,Date,Title,Article,Category,Image_link,Article_link
0,06-2-20,Hear out the States,"The responsibility of States to attend to displaced people or illegal immigrants cannot be taken away by the Centre assuming for itself a bigger role by a law such as the CAA

India, as defined in Article 1 of the Constitution, is a “union of States.” These States, therefore, are constitutive of the Indian Union and no executive power can be exercised in a manner that undermines their quasi-autonomous status. Even under Article 368, where the Parliament enacts a law, the power of the House is only a “constituent power”, which, though without limitation, only implicitly permits amendments in part-II (citizenship provisions) of the Constitution. The critical question is, can the constituent power of the Parliament in enacting a law override the constituent power of the State in implementing such a law? Given the quasi-autonomous status of the States, are they obliged to blindly comply with a Central law, which creates a conflict with part-III (basic structure) of the Constitution? Many such questions assume great significance in understanding the constitutional provisions and scope of its operation in relation to States, especially with regard to the recent Citizenship Amendment Act (CAA). Apart from embedded quandaries of the CAA, prima facie, in conflict with Article 14 of the Constitution, the CAA puts the onus of reparation indirectly on States, as the target class of immigrant citizens would have to reside or settle in a State of the Union. Therefore, the constituent power of the Parliament cannot bypass the State in a manner that creates conflict of interest with State(s). The Parliament needs to ensure that existing balance of power and interest is not grossly disturbed by a piece of law.

In Centre-State relations, the Parliament’s capacity to recommend an appropriate course of action in a matter that consequentially affects the State shall run the risk of getting limited by other obligations and interests of the State. A law such as the CAA cannot overwhelm both lex fori and lex loci conditions in relation to States. Obviously, the States remain as both the jurisdictional forum and locus of CAA in terms of its operation, which has to operate through Rules framed under the Citizenship Act of 1955, that necessarily involves officials under the State Government, who are delegated with “procedural” powers to determine who is a citizen.

To put it differently, the responsibility of States to attend to displaced people, who could be legal or illegal immigrants cannot be taken away by the Centre assuming for itself a bigger role by a law such as the CAA. Mere grant of citizenship by the Centre is a form of personal right, which requires the support of a State in entirety to secure all other rights of the citizen, including the right to life, as enshrined under Article 21. Indeed, the CAA in the first instance of its passage in Parliament did recognise lex fori and lex loci conditions by exempting States and areas under the Sixth Schedule from its operation. There remains much scope to fulfil these conditions in framing of rules under the CAA, as Assam and Tripura have State-specific accords to decide on matters of citizenship. The Supreme Court (SC), on its part, distinguishably recognised the case of Assam and Tripura as different from concerns of other parts of the country in relation to the CAA, which is recognition of lex fori and lex loci conditions under which the CAA must operate.

It must also be noted that under Article 13 of the Constitution, laws prior to the commencement of the Constitution such as Foreigners’ Act of 1946 under which the Foreigners’ Tribunals (FT) are ordered in violation of Article 323(b) are inconsistent with part-III of the Constitution and hence it can operate even with CAA framed under Article 368 of the Constitution. This establishes the limited application of the CAA that still requires a much wider framework, apart from its “religious” bias.

Indeed in the case of Assam, operation of the FTs in violation of basic principle of law, namely, “innocent until proven guilty” and its broad sweep of executive discretion in sending someone to a detention camp along with purported operation of the CAA hardly makes a case of consistent application of law. Indeed such inconsistency in operation of the citizenship law is exploited to the extent that a suspected foreigner or an illegal border crosser is often denied right to fair trial, as nothing in law explicitly puts a check and balance on a FT judge from placing a one-sided “onus of proof”, under Section 9 of the FT Act, 1946 on a person claiming to be an Indian citizen in dispute of what the Executive has attributed upon her as a foreigner.

Indeed, the affidavit filed by some of the parties disputing the CAA in the SC refers to this “onus of proof” to be placed upon an immigrant covered under the CAA to make it consistent with the FT Act. In effect, the Code of Civil Procedure that provides right to fair trial and assumes someone not to be guilty until proven guilty is ostensibly a matter of dispute in the case against the CAA that is lying before the SC now, which substantially involves the role of the State in deciding the fate of a suspected foreigner.

So, the SC has to decide on the basis of the principle of “better law” or “more rational law” in the cases filed against the CAA. Additionally, when a State disputes the CAA as a violation of the basic structure of the Constitution, especially the principle of secularism and right to equality before law, the SC has to decide on its jurisdiction as granted by Article 131 of the Constitution.

Kerala, West Bengal and Punjab are raising the same dispute under Article 131. Article 131 clearly stipulated original jurisdiction in any dispute between the Centre and States pertaining to validity of a Central legislation. Independent of the outcome of the case on the CAA, it is to be noted that the right to disputation by a State is a recognised constitutional position that cannot be questioned by raising the issue of prior permission by the constitutional authority of the Governor.

The quasi-autonomous status of the State and full power of the legislature in framing laws under the Seventh Schedule allow for a room of manoeuvering by the States in creative ways without directly contravening a Central law. In a quasi-federal structure like India, there is no “supremacy clause” attached to the Central law, as the Indian Constitution followed a principle of separation of powers guided by a thumb rule of avoiding inequality and imbalance.

This makes it amply clear that there is only an abiding responsibility of the State to follow a Central law without a binding obligation or liability in case the State is not convinced of its correctness. The whole set of issues of federal cooperation and consensus comes into play in enforcing a Central law in case the State concerned sees it as violative of part-III of the Constitution.

What causes the hiatus here is the filtering out of Muslims under the CAA and treating them differently from the rest, in case they have entered India from neighbouring countries covered by the law. Further, exclusion of Tamil immigrants from the purview of the CAA is a potent cause of heartburn in Southern States. The praxis of federalism, being a constantly-developing subject in the world’s large democracies, tells us that distinctions drawn among people on the basis of race, religion, colour, sex, culture and so on are to be disbanded by the State. Hence, in the case of India, no State can be made to practise such distinction and discrimination between people by a Central law, if the State sees it as an incorrect practice. It is correct that in no way can the constituent State of the Union remain non-compliant even if it sees a law giving rise to an incorrect practice, except for approaching the SC to resolve the dispute. However, it is also true that compliance by the State should not violate legal principles of non-discrimination, while denying certain rights to a segment by an established procedure of law. No constitutional law could be bereft of constitutional morality and ethical principle of “no harm” and hence no State could be forced by an executive decree to implement a law that the State sees causing discrimination and harm to a segment in a certain local situation.

The Bommai judgment makes it very clear that the Centre cannot apply “arbitrary powers.” Arbitrary powers here would mean decrees and pronouncements that explicitly subvert a State’s autonomy and jurisdiction of its executives in its own territory. Citizenship Rules, 2003, recognise this executive power of the State by delegating certain crucial powers to the State executive like the District Magistrate. Further, the Bommai Judgment, read with the Sarkaria Commission report, also makes it clear that one of the major sources of arbitrary power lies in “partisan” affairs. When there is no consensus in a bipartisan or multi-partisan sense on the CAA, it does not become non-partisan, as per the language of the Sarkaria Commission, which is the only major commission to examine and understand Centre-State relations in post-independent India. Further, the Inter-State Council, another constitutional body created to resolve any dispute between federal constituents, could discuss the points of contention related to the CAA, which, of course depends on how the respective players raise the matter.

In sum, there is a clear need for check and balance in the operation of executive powers under a Central law, which the CAA certainly warrants. All contentious issues related to the CAA also need a clear resolution in the good federal spirit, giving due importance to the States’ perspectives in the interest of social and political harmony across India.

(The writer is an author, political analyst, philosopher of law and teaches Philosophy at North Eastern Hill University)",columnists,https://www.dailypioneer.com/uploads/2020/story/images/big/hear-out-the-states-2020-02-06.jpg,https://www.dailypioneer.com/2020/columnists/hear-out-the-states.html
1,06-2-20,Erdogan has lost the plot,"One small and successful war might benefit the Turkish President by mobilising nationalism but three at once? This is megalomania

Turkey’s President Recep Tayyip Erdogan is not an “Islamist”, in the extreme sense of the word. He doesn’t wear a suicide vest, he doesn’t behead people, he doesn’t get his citizens flogged or stoned, he doesn’t get their hands cut off for theft, he doesn’t even go around holding one finger up in the air to signify his hatred of those who fail to acknowledge the one true God. However, he certainly does like the Islamists a lot. In the heyday of the Islamic State (ISIS) in northern Syria and Iraq, it was Erdogan who kept the Turkish border open so that thousands of foreign fighters and their families could go to join that terrorist proto-state, which was a descendant of Osama bin Laden’s original Al-Qaeda organisation. More recently, Erdogan has stationed Turkish troops in Syria’s Idlib province, the one remaining rebel-held part of the country, where Hayat Tahrir al-Sham, another offshoot of the Al-Qaeda, subjugated all the other rebel organisations last year and now rules unchallenged.

Unchallenged, that is, except by Syrian army troops backed by Russian airpower who are gradually winning back control on the province in a slow, grinding offensive that last week captured Idlib’s second-biggest city, Maarat an-Numan. So it’s no surprise that the Turkish army in Idlib is now firing directly on Syrian forces.

The story is a bit muddy, with Turkey claiming that four of its soldiers in Idlib were killed by Syrian shellfire on Sunday. But the Turkish Government said it had killed 35 Syrian troops in retaliatory fire and Erdogan added: “Those who question our determination will soon understand they made a mistake.”

And, upping the ante further he said that the Assad regime must fall back from Turkey’s observation posts in northwestern Syria this month. “If the Syrian regime will not retreat from Turkish observation posts in Idlib in February, Turkey itself will be obliged to make this happen,” Erdogan told his party’s lawmakers in Parliament on Wednesday.

Erdogan also warned Russia, Syria’s ally, “not to stand in our way.” The Russians will take this seriously since Erdogan deliberately set up an ambush in 2015 and shot down a Russian plane that strayed into Turkish airspace for only 17 seconds.

However, the fact remains that Moscow won’t back down. So, Erdogan is now playing with the dangerous prospect of a shooting war with Syria and Russia. That would be enough on his plate, you might think, but he is also intervening in the civil war in Libya. Erdogan backs the Islamist-dominated Government in the capital, Tripoli, against the rebel army led by General Khalifa Haftar that controls most of the country and he has just sent troops to support it.

The troops are Syrian Arabs, part of the same Islamist puppet army that Erdogan used recently to invade the Kurdish part of Syria. His intervention in Libya puts Turkey into a potential confrontation with France, Egypt and the United Arab Emirates, all of which back Haftar. So does Russia.

Not one to be daunted, Erdogan is spouting the same tough-guy rhetoric over Libya: “We will not hesitate to teach a deserved lesson to the putschist Haftar if he continues the attacks on the country’s legitimate administration and our brothers in Libya.” So there’s a few more potential enemies for Turkey. His plate is getting rather full. But Erdogan’s not finished yet. He has also militarised a dispute with Greece and Cyprus over seabed oil and gas reserves, to the extent that Turkish fighter planes are now violating Greek airspace almost daily. And he has demanded that Athens demilitarises 16 Greek islands that are close to the Turkish west coast (making them permanent hostages, totally vulnerable to Turkish invasion).

France has now sent warships to the eastern Mediterranean, and President Emmanuel Macron has explained that “Greece and France are pursuing a new framework of strategic defence.” “Defence” against whom? Turkey, obviously. Who else could it be?

Turkey is still formally a member of NATO, so technically France and Greece are its allies but Erdogan doesn’t seem bothered by that. Neither was he bothered by the fact that the United States (US) is also a NATO member when he invaded northeastern Syria last October to drive the Kurds, America’s key allies in the war against ISIS, from their homes in the border region. He got away with that: The Kurds had served their purpose and Trump just abandoned them to their fate. But is he really wise to take on almost everybody else at once? Like Vladimir Putin in Russia, Erdogan is a strongman ruler who has to win an election every four years. Putin is perennially popular in Russia and wins easily — but Erdogan usually scrapes through with just over half the vote. The country is divided down the middle and the other half loathes him and his Islamist policies.

One reasonably small and successful war might actually benefit Erdogan by mobilising Turkish nationalism but three at once? Against Russian and Syria on one front, France and Egypt on another and Greece plus France and perhaps other NATO and European Union members on a third. He used to be a fairly competent strategist but he has been in power too long (17 years) and he has finally lost the plot. This is megalomania.

(Gwynne Dyer’s new book is ‘Growing Pains: The Future of Democracy and Work’)",columnists,https://www.dailypioneer.com/images/logo.jpg,https://www.dailypioneer.com/2020/columnists/erdogan-has--lost-the-plot.html
2,06-2-20,How climate change births a virus,"The relationship between rising temperatures and increasing spread of viruses has been much researched. The American Society of Microbiology released a report on this in 2010 citing conditions for pandemics

The Coronavirus, with its epicentre in Wuhan, China, is wreaking havoc and creating an immense fear psychosis around the world. In China alone, the virus has infected over 24,391 people and has reportedly caused over 492 deaths according to official estimates.

However, the actual number is believed to be much higher. The alarming speed at which the virus is spreading caused Chinese President Xi Jinping to remark that the nation was fighting a demon. The virus has led many nations to evacuate their citizens from China. The Chinese authorities have deployed emergency measures to contain the spread of the virus by imposing strict travel restrictions and putting certain geographical locations under lockdown, with over 50 million people quarantined.

The spread of lethal viruses has become the new face of climate change and is taking an unimaginable toll on human life even as the international medical community, scientists and disease experts scramble to find a vaccine and contain the coronavirus. Climate change-enabled rise in temperatures has caused the spike in humidity levels that in turn have created a favourable environment for the viruses of the most virulent kind to breed and multiply. The relationship between rising temperatures and increasing spread of viruses has been much researched. The American Society of Microbiology released a report way back in 2010 regarding the relation between the two and how high temperatures play a perfect host to pandemics.

In the background of this virus outbreak, the lack of progress at the recent COP 25 looks like a lost opportunity, as the international environmental community with a great opportunity at hand could not come up with any major development agenda to fight climate change.

Had the world leaders and the environmental community cobbled together an actionable plan that included containment of those precipitating factors that trigger epidemics such as these, the world would have already had a plan in hand to deal with the present crisis.

Be it the SARS virus that impacted China 17 years ago and infected nearly 8,000 people or the Zika virus outbreak in 2016, the role of climate change has always been centric as the enabler of fast-spreading viruses. However, there are other aspects also. For instance, there is an urgent need to manage the triangular relationship between humans, the environment and animals. The inept handling of any one aspect of this can cause a cascading impact on the well-being of all three.

The United States (US) took a risk of sorts when the Trump Administration closed down the Predict Programme that had the research mandate to test animals for dangerous pathogens that could cross over to human beings. The current coronavirus could be an example where the virus strain is in fact believed to have evolved from bat species.

The political leadership, therefore, plays a very important role in either limiting the evolution and subsequent spread of the virus or exposing the human community to the risks of virus by shutting down ongoing research facilities engaged in studying them, as done by the Trump Administration.

The human community has for ages been engaged in a never-ending struggle with diseases and maladies which have challenged and inspired the scientific community to come out with superior medication and vaccines. But the intensity and speed of the virus is now approaching dangerous levels giving lesser and lesser time to the scientific and medical community to respond with an antidote.

As a result of this time lag, precious lives are being lost at an alarming speed. China needs to up its research and development powers and ensure that clear lines are drawn between animal and human interactions so that a virus highway of sorts is not opened between the two.

India, thankfully has remained largely out of the clutches of this present pandemic but the reporting of disease-infected victims is getting uncomfortably closer to home. India must set up a research protocol and a prevention programme and insulate itself against the disease. But more importantly, the global community must unite and ensure that climate change is controlled drastically and does not play host to the virulent viruses of the future.

(The writer is an environmental journalist)",columnists,https://www.dailypioneer.com/images/logo.jpg,https://www.dailypioneer.com/2020/columnists/how-climate-change-births-a-virus.html
