,Date,Title,Article,Category,Image_link,Article_link
194,06-2-20,A new port at Vadhavan,"The Union Cabinet, chaired by the Prime Minister, Narendra Modi, has given its 'in-principle’ approval for setting up a major port at Vadhavan near Dahanu in Maharashtra. Total cost of the project is likely to be Rs 65,544.54 crore.

Vadhavan port will be developed on ‘land lord model’. A Special Purpose Vehicle (SPV) will be formed with Jawaharlal Nehru Port Trust (JNPT) as the lead partner with equity participation equal to or more than 50 per cent to implement the project. The SPV will develop the port infrastructure including reclamation, construction of breakwater, besides establishing connectivity to the hinterland. All the business activities would be undertaken under PPP mode by private developers.

The position of JN Port, the biggest container port in India is 28th in the world with a traffic of 5.1 million TEUs (Twenty-Foot Equivalent Units). Even after the completion of the 4th terminal at JN Port with a capacity increase of 10 million TEUs by 2023, it will stand as the 17th largest container port in the world. With the development of Vadhavan port, India will reach in the list of top 10 container ports in the world.

Maharashtra has India’s largest container port at JNPT, which caters to the hinterland of Maharashtra, North Karnataka, Telangana and secondary hinterland of Gujarat, Madhya Pradesh, Rajasthan, NCR, Punjab and Uttar Pradesh. There is a need for a deep draft port that will accommodate the largest container ships in the world and also cater to the spill over traffic from JNPT port. JNPT and Mundra, the two largest container handling ports of the country (for mid size container ships only), have drafts of 15 m and 16 m respectively, while the world’s largest container handling modern deep draft ports require a draft of 18 m to 20 m.

The Vadhavan port has a natural draft of about 20 metres close to the shore, making it possible for it to handle bigger vessels. Development of Vadhavan port will enable call of container vessels of 16,000 to 25,000 TEUs capacity, giving advantages of economies of scale and reducing logistics cost.

The ever increasing size of container ships makes it imperative that a deep draft container port in West Coast of India is developed. Increasing containerisation of cargo in the wake of value-added manufacturing sector makes it important to prepare our port infrastructure for handling value-added import and export to facilitate manufacturing activity. Container traffic in the JNPT hinterland is expected to grow from 4.5 MTEUs currently to 10.1 MTEUs by 2022 to 25 when JNPT’s potential will be fully exhausted. The demand for container traffic will further accelerate after the plans for improving logistic infrastructure fructify and the ‘Make in India’ push drives greater exports and manufacture sourcing to India.",vivacity,https://www.dailypioneer.com/images/logo.jpg,https://www.dailypioneer.com/2020/vivacity/a-new-port-at-vadhavan.html
195,06-2-20,In—short,"A cancer awareness programme was organised by Chittaranjan Locomotive Works (CLW) at KG Hospital. Ravij Seth, PCMO and PFA presided over the programme. In his speech, he emphasised the need for this type of programme, which involves more number of people. Senior doctors along with the paramedical staff of the hospital attended the programme. Dr Tulu Chakraborty, Sr DMO/FW and Dr J Mitra, Sr DMO/Phy gave a presentation on cancer awareness. Dr Ajay Kumar, ACMS/In-Charge/KGH, concluded it by thanking everybody.

University School of Architecture and Planning (USAP) and University School of Environment Management (USEM) jointly organised a seminar on landscape architecture at the Dwarka campus of GGSIP university. Johanna Gibbons, a landscape architect and founding member of J and L Gibbons LLP, London, delivered a talk on the topic — Second Nature. She explored how practice develops design and critical engagement strategies to connect city communities with natural processes and urban forest. She also discussed on strategic action in the face of climate change and talked about evolving and sustaining a critical urban ecology. Apart from faculty members, research scholars and students of both the schools, the Vice Chancellor of the university, Professor Mahesh Verma also graced the occasion.",vivacity,https://www.dailypioneer.com/images/logo.jpg,https://www.dailypioneer.com/2020/vivacity/in---short.html
196,06-2-20,An eco-friendly snooze,"One of the pioneer mattress start-ups, Shinysleep has launched its superior latex mattress product. The product is a new, eco-friendly and anti-microbial latex mattress product.

These latex mattress are 100 per cent natural and are proven to be extremely durable in comparison to other mattresses in the market. Its natural latex foam is constructed in such a way that it conforms with several aesthetic quality standards. The mattresses are also authenticated by the OEKO-TEX certification, which is a worldwide consistent, independent testing and certification system for raw, semi-finished and finished textile products at all processing levels as well as for accessories.

“Latex mattress products are elegant, comfortable and nature-friendly with natural latex foam, which is has grown more preferable over the synthetic mattresses over the last few years. It is also much milder and has a less abrasive odour. Latex is the magic fluid used up in the mattresses which provides you the comfort of your life,” said founder Tarun Chugh.

Latex mattresses products are available in two types — pure latex mattress and synthetic latex mattress. While the pure one is a green alternative, which incorporates natural latex being devoid of any chemical substances, the latter contains the same molecular compound as natural latex, the only difference being that it is comprises man-made ingredients.

Founded in 2017 with an intense passion for creating a perfect mattress for people of every age group, these latex mattresses have been constructed with a view to gift the people with something comforting in today’s stressful life. The product also aims to cater to consumers by the process of decision-making for end consumers.",vivacity,https://www.dailypioneer.com/uploads/2020/story/images/big/an-eco-friendly-snooze-2020-02-06.jpg,https://www.dailypioneer.com/2020/vivacity/an-eco-friendly-snooze.html
197,06-2-20,"Student, an invaluable treasure","There is one Vidur Neeti shloka that one should preach when s/he wishes to get education. “The student, who is desirous of experiencing worldly merriment, should leave vidya (study), for he who is desirous of attaining vidya, he never thinks about experiencing worldly merriment.”

The meaning of the term, vidya is the voice that gives knowledge. The aspirant who ardently desires to gain knowledge is called vidyarthi or student. Obtaining traditional knowledge brings attention to previous Vedic Yugas, where Brahma (follower of four Vedas) used to preach different types of moral duties and spiritual knowledge from in a yajyen. As per a Rigved mantra, such preaching is called vidya, which is divine knowledge that gives salvation, if we follow it.

When we run more towards worldly merriment and materialistic articles, it is called avidya. And please note, that in present times, only avidya is being preached everywhere and hence, is a huge problem. A deep study of Vedas reveals that both vidya and avidya are necessary for human life and survival.

That is why, a Yajurved mantra states that a person, who knows and follows vidya, realises god. When he follows avidya, he overcomes the fear of death. Therefore, the two are required to be known and progressed simultaneously, being the main motto of life.

Nowadays, students are told that education is the means to earn money, survive and to live upon, which is making the current education one-sided and more related to worldly matters only.

As compared to the kind of education provided in the ancient times, when kings and queens had ruled, the present education system is very one-sided. With such practices, not only the students but even the government is living in an illusionistic world, away from spirituality. And students, being the invaluable treasure of the nation, are highly affected by illusion. It consequently leads to violence, corruption, dishonour to women, malnutrition and several other problems in the country (Atharvaveda mantra).

Hence, a necessary amendment in the education system is the need of the hour. The system should find its roots to traditional education as well.

In view of the above facts, four Vedas preach that youngsters should concentrate on studies and in the meanwhile, discharge all moral duties. The students must always keep themselves away from all kinds of violence, riots and other controversy.

A Manusmriti shloka preaches that holding the same knowledge in life, which is mentioned in Vedas and smritis is the best authentic moral righteousness. And therefore, the deeds done against the vedas and smritis are completely sinful. As was facilitated by Kings in the ancient yugas, our government also need to make necessary arrangements and include Vedic literature in present academic syllabuses to keep the tradition alive for generations to come.

Nowadays, when we eulogise the true stories of Ram, Krishna, king Janak, king Harishchandra and Dashrath, we usually forget that such pious dignitaries received the eternal knowledge of Vedas from ancient rishis traditionally. The said people set an example that to receive such Vedic knowledge and preach it in daily life, is the motto of human life. Hence, it is regretful that India has broken the tradition of listening and attaining Vedic knowledge by students from a learned acharya or guru or teacher.

In this regard, a Rigved mantra here preaches to assume that soul is telling his body that, ‘Oh friend! We must destroy the sorrows and obstacles which come in our life by receiving Vedic knowledge and science and philosophy, thus obtain salvation.’

It is sad that the present education system is totally against the ancient gurukul system of learning. It is devoid of the code of ethics that were taught in the ancient times. The person who misconducts in life cannot be purified by even practicing the Vedas. So the government should pay utmost attention to generate Vedic values and morality in all students and fulfill their reasonable demands to make the nation strong.

Students are priceless gems who can lead the country to progress. Therefore, virtuous conduct, moral duties, ethical behaviour, good character with control over senses, kindness, nationality and religious thoughts, etc.. are some of the good qualities which the youth needs to instill in themselves. Each and every Indian student need to understand his/her duties and help other people too to follow them. Well, most of it rests on parents and the government too.

(The author is yogacharya Swami Ram Swarup, the chief editor of Ved Ishvareeya Vani, a bi-annual magazine.)",vivacity,https://www.dailypioneer.com/uploads/2020/story/images/big/student--an-invaluable-treasure-2020-02-06.jpg,https://www.dailypioneer.com/2020/vivacity/student--an-invaluable-treasure.html
198,06-2-20,India can offer IT and medical solutions: Ecuadorian diplomat,"India has capacity to offer potential solutions for the issues bothering Ecuador,” said Hector Cueva Jacome. The Ambassador of Ecuador to India was addressing the gathering at World Cancer Day celebration at SRM Institute of Science and Technology. Best technology comes from India. It is easily adaptable, affordable and accessible for any country in the world.

Jacome said, “Effective solutions can come from India in the area of battling cancer.” Indian professionals and technology can be of good use to them to raise awareness with an objective of preventing cancer and also finding effective treatment solutions to it. “Cancer can become a disaster if nothing is done to prevent it,” he said.

“Ecuador can prevent, treat breast and prostrate cancers with the technological and professional help that pours from India. These cancers are common in their nation, however, not many go to seek help to treat the disease due to financial and social issues. These ailments are totally preventable,” added the ambassador.

The solutions found in India are cost-effective. “Glenza, the medicine used for prostrate cancer costs about 4,500 dollars per month in their country, while in India it is available for only 700 dollars per month as per their currency. The cost of using mammography is about 200 dollars in their nation. We have the needs and you (India) have the solutions. We just need to build a bridge to enable the solutions to reach us,” he said.

Vice chancellor of SRMIST, Sandeep Sancheti, said, “World Cancer Day ensures that we are raising awareness on the dreaded disease only to come out of its clutches. If it is not controlled, it will spread like wild fire. We need to use the best of the technology, medication in treating cancer.”

Dean of SRM Dental College, Dr N Vivek, said that nearly 80 per cent of the population in the developing nation will likely suffer from cancer by 2040. However, these numbers can be brought down by being instrumental in prevention. “We all can be instrumental in fighting against factors like tobacco, which are highly responsible for causing the problem,” he said. A video clip on cancer prevention was also screened.",vivacity,https://www.dailypioneer.com/uploads/2020/story/images/big/india-can-offer-it-and-medical-solutions--ecuadorian-diplomat-2020-02-06.jpg,https://www.dailypioneer.com/2020/vivacity/india-can-offer-it-and-medical-solutions--ecuadorian-diplomat.html
199,06-2-20,India fined for slow over-rate,"Indian cricket team on Wednesday was fined for maintaining slow over for the third successive time after Virat Kohli’s side was found four overs short of the target.

Chris Broad of the Emirates ICC Elite Panel of Match Referees fined Indian cricketers 80 per cent of their match fee after the visitors were ruled to be four overs short of the target after time allowances were taken into consideration.

In accordance with Article 2.22 of the ICC Code of Conduct for Players and Player Support Personnel, which relates to minimum over-rate offences, players are fined 20% of their match fees for every over their side fails to bowl in the allotted time.",sports,https://www.dailypioneer.com/images/logo.jpg,https://www.dailypioneer.com/2020/sports/india-fined-for-slow-over-rate.html
200,06-2-20,SC begins hearing to decide if it can refer question of law to larger bench in review jurisdiction,"A nine-judge Constitution bench of the Supreme Court Thursday began deliberations on the legal issue of whether the top court can refer questions of law to a larger bench while exercising its review jurisdiction.

This question arose during the hearing in the Sabarimala case which relates to gender discrimination against women at religious places.

A bench headed by Chief Justice S A Bobde is hearing the issues relating to discriminations against women at various places of worship including the Sabarimala temple.

Solicitor General Tushar Mehta argued that the apex court was right in referring the questions of law to the larger bench and added, ""as custodian of fundamental rights, it was the duty of the court to lay down an authoritative pronouncement on these questions of law"".

""Your Lordships are duty bound as custodians for posterity. Issues regarding review, reference, curative, these cannot be gone into. If there is a question of law, the court has the liberty to constitute a larger bench to settle the issues,"" Mehta said.

The other members of the bench are Justices R Banumathi, Ashok Bhushan, L Nageswara Rao, M M Shantanagoudar, S A Nazeer, R Subhash Reddy, B R Gavai and Surya Kant.

Many senior lawyers including Fali S Nariman, Kapil Sibal, Shyam Divan, Rajeev Dhavan and Rakesh Dwivedi argued on February 3 that while exercising review jurisdiction, the Supreme Court does not have the power to refer a question of law to a larger bench.

They said last year's November 14 verdict of a five-judge bench, headed by the then CJI Justice Rajan Gogoi, was wrong in making a reference of broad contours while deciding the review petition against the 2018 judgement which allowed women of all age groups to enter Kerala's Sabarimala temple.

Besides Sabarimala, last year's verdict had also referred issues of entry of Muslim women into mosques and dargahs and of Parsi women, married to non-Parsi men, being barred from the holy fire place of an agyari, to the larger bench.

The senior lawyers had assailed as ""erroneous"" the reference made to a larger bench by the five-judge bench on questions related to gender discrimination against women in religious places while dealing with the Sabarimala case.

The top court had said it will frame the legal issues to be adjudicated by a nine-judge Constitution bench on religious discrimination against women at various religious places.

The Constitution bench said it will inform the parties about the time frame for the hearing and would commence the proceedings by next week.

The apex court had said that as of now it would go by the reference order of November 14 last year, made by a five-judge bench.

By a 3:2 majority, it said the larger bench will have to evolve a judicial policy to do ""substantial and complete justice"" in matters of freedom of religion, such as restrictions on the entry of Muslim and Parsi women into their respective places of worship.

It had taken note of vehement opposition by the senior lawyers who claimed that the apex court was wrong in making a reference of broad contours while deciding the review petition against the 2018 verdict.

The top court had said it would deal with the legal issue, raised by the senior lawyers, of whether a reference order can be made in review jurisdiction for a hearing by a larger bench.

Sibal, appearing for the All Indian Muslim Personal Board (AIMPLB), had said though the Board has clarified that Muslim women are allowed to enter mosques to offer Namaz, the court should not enter into matters of faith and decide essential religious practices while entertaining a PIL filed by a person not belonging to a particular faith.

Mehta had referred to the Supreme Court Rules and said the court can undertake a larger debate ""on the contours of Articles 25, 26 (fundamental right to religion)"".

Mehta, senior advocates K Parasaran and Ranjit Kumar had said the top court while exercising the review jurisdiction can refer a larger issue, which has arisen during the adjudication of the dispute, to a larger bench.

A five-judge bench, by a majority of 3:2 on November 14 last year, had referred to a larger bench the issue of discrimination against women at various religions' places of worship.

A majority verdict by the then Chief Justice Ranjan Gogoi and Justices A M Khanwilkar and Indu Malhotra decided to keep the pleas seeking a review of its decision regarding entry of women into the shrine pending and said restrictions on women at religious places were not limited to Sabarimala alone and were prevalent in other religions also.

By a 4:1 majority verdict, the apex court had lifted the ban that prevented women and girls between the age of 10 and 50 years from entering the famous Ayyappa shrine in Sabarimala and held that the centuries-old Hindu religious practice was illegal and unconstitutional.",top-stories,https://www.dailypioneer.com/uploads/2020/story/images/big/sc-begins-hearing-to-decide-if-it-can-refer-question-of-law-to-larger-bench-in-review-jurisdiction-2020-02-06.jpg,https://www.dailypioneer.com/2020/top-stories/sc-begins-hearing-to-decide-if-it-can-refer-question-of-law-to-larger-bench-in-review-jurisdiction.html
201,06-2-20,"Karnataka CM expands Cabinet, inducts 10 Ministers","The Karnataka Chief Minister B S Yediyurappa on Thursday rewarded with Cabinet berth 10 defectors, who helped the BJP bring down the Congress-JDS coalition and come to power.

The then disqualified Congress-JDS MLAs who had shifted loyalty to the BJP and won the December by-elections, were sworn-in at a simple ceremony at Raj Bhavan with the Governor Vajubhai Vala admistering oath of office and secrecy.

The ten are S T Somashekar (Yeshwantpur constituency), Ramesh Jarkiholi (Gokak), Anand Singh (Vijayanagar), K Sudhakar (Chickballapur), Byrathi Basavaraj (K R Puram), A Shivaram Hebbar (Yellapur), B C Patil (Hirekerur), K Gopalaiah (Mahalakshmi Layout), K C Narayana Gowda (K R Pet) and Shrimant Balasaheb Patil (Kagwad).

The much-awaited expansion takes the strength of the Cabinet to 28, with six vacancies now.

In the first expansion last August, 17 Ministers were inducted.

The latest exercise wasn't without a twist.

Yediyurappa had announced on Sunday that 13 aspirants, including the ten who were sworn-in on Thursday and three BJP old-timers would be inducted.

The three who were expected to get Cabinet berth were Umesh Katti, Arvind Limbavali and C P Yogeshwar.

A section of the BJP had opposed making Yogeshwar a Minister, pointing out that he had lost Assembly elections and not a member of either House.

Late on Wednesday, Yediyurappa said induction of BJP old-timers had been put off following directions from the party's central leadership.

The decision to take none of the ""native"" BJP leaders into the Cabinet in the current round came after intense lobbying from several aspirants which threatened to go out of hand at one stage, party sources said.

The 10 newly inducted Ministers were among the then 16 Congress-JDS MLAs who brought down the coalition government headed by H D Kumaraswamy.

Among these disqualified MLAs, 13 had contested the by- polls in December and 11 had won.

The one who had been left out in the Cabinet expansion is Athani MLA Mahesh Kumathalli who has been promised by the Chief Minister ""some other big responsibility"".",top-stories,https://www.dailypioneer.com/uploads/2020/story/images/big/karnataka-cm-expands-cabinet--inducts-10-ministers-2020-02-06.jpg,https://www.dailypioneer.com/2020/top-stories/karnataka-cm-expands-cabinet--inducts-10-ministers.html
202,06-2-20,RBI keeps benchmark interest rate unchanged at 5.15 pc,"The Reserve Bank of India, for the second straight time, on Thursday kept its key policy rate unchanged at 5.15 per cent, maintaining its accommodative policy stance as long as it was necessary to revive growth.

The central bank retained GDP growth at 5 per cent for 2019-20 and pegged it at 6 per cent for the next fiscal.

""Economic activity remains subdued and the few indicators that have moved up recently are yet to gain traction in a more broad-based manner. Given the evolving growth-inflation dynamics, the MPC felt it appropriate to maintain status quo,” the Monetary Policy Committee (MPC) said.

The six-member committee voted unanimously to hold rates, but also said that there is “policy space available for further action”.

Between February and October 2019, the RBI had reduced repo rate by 135 basis points.",top-stories,https://www.dailypioneer.com/uploads/2020/story/images/big/rbi-keeps-benchmark-interest-rate-unchanged-at-5-15-pc-2020-02-06.jpg,https://www.dailypioneer.com/2020/top-stories/rbi-keeps-benchmark-interest-rate-unchanged-at-5-15-pc.html
