,Date,Title,Article,Category,Image_link,Article_link
65,06-2-20,AAP seeks termination of PPAs,"Cornering the Capt Amarinder Singh Government over hefty electricity tariff in Punjab, the Aam Aadmi Party (AAP) on Wednesday sought abrogation of Power Purchase Agreements (PPAs) in the ensuing budget session of the Assembly to save the people of the State groaning under ‘power shocks’ from an open ‘loot’ by power mafia.

Party MLAs, including the Leader of Opposition Harpal Singh Cheema, Sunam MLA Aman Arora, and Barnala MLA Gurmeet Singh Meet Hayer, referring to a two-page letter shot off to the Government by a senior IAS officer KBS Sidhu, openly demanded nixing of anti-State PPAs.

They questioned why the Capt Amarinder Government was running away from initiating steps in this regard.

“AAP’s Bijli Andolan had elicited humongous response from the people, prompting senior leaders of the party, including ministers, Sukhjinder Singh Randhawa, former power minister Rana Gurjit Singh, state Congress chief Sunil Jakhar, along with other legislators and Rajya Sabha members Partap Singh Bajwa to corner their own Government to cancel the PPAs in the interest of the State and its people.

Cheema said that during the long tenure of the SAD-BJP Government in the State, SAD president Sukhbir Badal had inked “one-sided” and “anti-State” pacts with private players by forcing closure of the Government thermal plants generating sufficient and cheaper electricity, which led the people of the State to face the heat of high power cost. KBS Sidhu’s letter had touched upon these vital points in details, he added.

Arora alleged that the Capt Amarinder had, surpassed the Badals in sharing ‘booty’ from the private thermal plants through powerful power mafia calling the shots in the State.

Referring to the letter by KBS Sidhu, Arora said that if Capt Amarinder Government, during its last tenure, could cancel the agreements inked with the States of Haryana, Rajasthan and Union Government on water sharing, why couldn’t he terminate pacts with private thermal plants?

Arora further alleged that if electricity could be procured from the market and the national grid at the cost Rs 3 per unit and Rs 3.15 per unit, why should it be purchased from private thermal plants at an exorbitant rate of Rs 8 to 9 per unit?

Meet Hayer, who is also party’s Bijli Morcha coordinator, said that the people of the State couldn’t heave a sigh of relief from the high power tariff until or unless the costly power pacts were not canceled.

He cautioned that if the Captain Government failed to cancel the PPPs, AAP, if formed the Government in the State in 2022, would crack a whip on the private power players and expedite the termination of the PPAs.",state-editions,https://www.dailypioneer.com/images/logo.jpg,https://www.dailypioneer.com/2020/state-editions/aap-seeks-termination-of-ppas.html
66,06-2-20,"CM opens SGPA, Int’l Centre at XUB","Chief Minister Naveen Patnaik inaugurated the School of Government and Public Affairs (SGPA) and newly-constructed International Centre at the Xavier University, Bhubaneswar (XUB) at Pipili on Wednesday.

Patnaik stated how public affairs and governance is important for sustainable growth and development. He said, “Policymakers have to envision policies as per people’s expectation to build an ambitious India and an Aspirational Odisha”.

Higher Education Minister Arun Kumar Sahoo spoke about the Chief Minister’s vision to promote higher education in the field of governance and hoped that the SGPA would produce citizen-effective practitioners of public affairs. MP Dr Amar Patnaik asked look forward to the SGPA bringing in a new era in the public policy arena.

Pipili MLA Pradeep Maharathy praised the Chief Minister for his commitment towards higher education and expressed his well wishes for the new school. Chief Advisor to the Chief Minister, R Balakrishnan, said the Government expects to take the mutual collaboration with the XUB to new heights.

XUB Board of Governors Chairman George Fernandes, Vice-Chancellor Prof Antony R Uvari and Registrar Prof EA Augustine also spoke.",state-editions,https://www.dailypioneer.com/images/logo.jpg,https://www.dailypioneer.com/2020/state-editions/cm-opens-sgpa--int---l-centre-at-xub.html
67,06-2-20,Residents with China connect under observation,"Haryana Health Minister Anil Vij on Wednesday said that 136 people of Haryana who had recently returned from China have been kept under observation in the background of the present Coronavirus outbreak.

The Health Minister said that one person with travel history of China is admitted in one of the private Hospitals in Gurugram.

One person in Karnal with travel history is having cough, is kept in isolation ward in Kalpana Chawla Medical College. Both have tested negative for Coronavirus. One person is admitted in Hisar, whose sample result is awaited.

He said rest of the 133 person with travel history to China are asymptomatic.Vij said that till date, 7 samples have been sent for testing, out of which results of 5 samples came as negative and report for rest of the samples is awaited.",state-editions,https://www.dailypioneer.com/images/logo.jpg,https://www.dailypioneer.com/2020/state-editions/residents-with-china-connect-under-observation.html
68,06-2-20,Meet on ‘Child Trafficking-Free India’ held,"The People’s Cultural Centre (PECUC) in association with the Kailash Satyarthi Children’s Foundation organised a district-level public dialogue on ‘Child Trafficking-Free India’ on Wednesday. Inaugurating the dialogue, Balianta MLA Arbind Dhali said that to bring about a change in the society, participation of every section of the society is very much essential.

He stated that the lack of education; poverty and addiction to drugs or liquor instigate people to conduct such a heinous crime like child trafficking. Efforts at all levels are needed to stop the crimes against children, Dhali added.

Bhubaneswar Central MLA Ananta Narayan Jena said, “We have to work together and generate awareness among public and families to prevent child trafficking.” He also highlighted some of the programmes of the Government in this regard.

Balianta BEO Snigdha Mishra, Bhubaneswar BEO Sasmita Mali, Khordha Rural CDPO Snehalata Nayak, Khordha CWC Expert Member Dr Tuna Sahu, PECUC director Dr Minakhi Panda and ED Anuradha Mohanty also spoke. They said awareness, education and support and cooperation of all Government and NGOs and general public are essential to stop the crime.",state-editions,https://www.dailypioneer.com/images/logo.jpg,https://www.dailypioneer.com/2020/state-editions/meet-on----child-trafficking-free-india----held.html
69,06-2-20,Food Safety Dept asked to ensure jaggery’s quality production,"Punjab Health and Family Welfare Minister Balbir Singh Sidhu, after reviewing the status of quality of gur (jaggery) production in the ghulaaries, on Wednesday directed the state Food Safety Department to ensure jaggery’s quality production in the State.

It was observed that few of the units, especially run by migrant labourers, are indulging in the unscrupulous practice of using unapproved chemicals for making gur, said the Minister.

The State’s Food and Drug Administration commissioner Kahan Singh Pannu informed the Minister that there are 617 ghulaaries in Punjab, which are engaged in processing of sugarcane to make gur and jaggery. These are small scale units normally functioning along the major roads, he said.

Pannu said all the unit owners have been provided one day training regarding good practices of making jaggery by Punjab Agriculture University (PAU), Ludhiana. It was also informed that a large number of ghulaaries in Punjab are producing good quality gur or jaggery which is even exported to other countries.

Sidhu asked the FDA Commissioner to conduct a thorough sampling of jaggery producing units.

He further asked the Commissioner to act strictly, including the closure of jaggery units, which are indulging in wrong practices which are harmful for human health.

The Minister directed that joint teams of officers of departments of Agriculture and Health should be constituted to complete the process of inspections of all the units in a period of 15 days.

In December, the jaggery processing tips were imparted to all the stakeholders under the Tandrust Punjab Mission.

Pannu, who is also the Tandrust Punjab Mission director, said that a similar exercise was conducted during the previous year as well wherein about 600 people were imparted training on ‘Sugarcane Juice Processing to Safe Jaggery’ by PAU.

During this season, nearly 200 people have been trained with the primary focus on enhancing the quality and hygiene of the produce, besides teaching them about chemical-free or organic formulation of jaggery.",state-editions,https://www.dailypioneer.com/images/logo.jpg,https://www.dailypioneer.com/2020/state-editions/food-safety-dept-asked-to-ensure-jaggery---s-quality-production.html
70,06-2-20,Gridco wants tariff hike by Rs 1.11,"The Gridco Limited, a State Government undertaking, on Wednesday proposed to the Odisha Electricity Regulatory Authority (OERC) to hike power tariff by Rs 1.11 hike per unit.

According to reports, the Gridco appraised the OERC that increase in cost of power being purchased from outside should be collected from power users.

Notably, the OERC is currently hearing the pleas of power generating, transmission and distribution companies for the year 2020-21.

On Tuesday, the State-owned Odisha Power Generation Corporation (OPGC) had demanded 20-paise hike on power generation cost for 2020-21 over the price approved by the OERC. It requested the commission to approve its proposal of fixing generation cost at Rs 2.67 per unit against current Rs 2.47.

The OHPC has also demanded for increase of power cost, being sold by it, from 88 paise to 95 paise per unit.",state-editions,https://www.dailypioneer.com/images/logo.jpg,https://www.dailypioneer.com/2020/state-editions/gridco-wants-tariff-hike-by-rs-1-11.html
71,06-2-20,Science Centre to come up in Ambala,"To promote Science Education and to stimulate natural curiosity among students, Haryana Government has decided to set up a Science Centre namely Aryabhatta Vigyan Kendra at Ambala Cantt on five acres of land at a cost more than Rs 30 crore.

The work for this project will start by April 2020 and will be completed in about 22 months, by December 2021, Additional Chief Secretary, Science and Technology Department, Amit Jha said on Wednesday.

He was presiding over a meeting to finalize the modalities for the implementation of this project. The meeting was attended by six-member team of National Council of Science Museums (NCSM) led by their Director General, AD Chaudhary and officers of PWD B&R and Architecture Departments, Haryana.

Jha informed that the Department of Science and Technology, Haryana will be setting up the Science Centre adjacent to War Memorial. This project will be implemented by the NCSM, Kolkata.

During the meeting, it was decided that the building of the Aryabhatta Vigyan Kendra will be constructed by PWD (B&R) Department, Haryana and the galleries and exhibits installation will be done by the National Council of Science Museum (NCSM).

The Centre will have a Thematic Gallery on Digital Adventure, a fun Science Gallery, 270 Degree Immersive Projection Hall, Science on Sphere and Virtual/Augmented Reality Theatre besides other facilities like a 3-D auditorium, cafeteria, temporary exhibition hall and Inflatable planetarium etc. An Innovation Hub will also be set up in this Centre. This Centre will have many exhibits on different principles of Science and Technology for imparting science education among general masses and students in particular.

Jha said that it was also decided that Kalpana Chawla Memorial Planetarium (KCMP) at Kurukshetra will also be upgraded by NCSM.

It was decided that an additional gallery with more Astronomy Exhibits will also be constructed and a mobile Astronomy bus having exhibits on Astronomy and telescope will also be started which will go to Rural areas throughout Haryana, he added.

The Additional Chief Secretary said the KCMP will be developed as Education Hub in the field of Astronomy in association with National Institute of Technology (NIT) Kurukshetra and Kurukshetra University Kurukshetra.",state-editions,https://www.dailypioneer.com/images/logo.jpg,https://www.dailypioneer.com/2020/state-editions/science-centre-to-come-up-in-ambala.html
72,06-2-20,BJYM to send dummy smartphones to Punjab CM,"To remind the Congress Government of all the promises made with the voters of Punjab, the Bharatiya Janta Yuva Morcha (BJYM) has decided to send dummy smartphones to the Chief Minister Capt Amarinder Singh.

The saffron party’s youth wing conducted a meeting at Ludhiana on Wednesday to condemn the Chief Minister for making fake promises with the youngsters.

BJYM’s Ludhiana district president Mahesh Sharma, after the meeting, declared that they would send dummy smartphone to the Chief Minister with a letter to remind all the promises he made with the voters before 2017 elections.

The youth wing maintained that the Chief Minister had announced to distribute smartphones to the youngsters on January 26, but not even a single person received the phone. “Almost three years are gone since the Congress Government came into power and the party leaders made tall promises with voters, especially youth who were promised smart phones,” said Sharma.

Sharma said that in September 2019, the State Cabinet had approved proposal to distribute smartphones among youngsters, and then on December 2, 2019, the Chief Minister also announced on Twitter that 1.06 lakh smart phones will be distributed among students of Class XI and XII on January 26, 2020.

“Not even a single student got that phone in Mohali where Capt Amarinder unfurled the national flag on Republic

Day. Now, we will gift dummy smart phone to the Chief Minister,” he added.",state-editions,https://www.dailypioneer.com/images/logo.jpg,https://www.dailypioneer.com/2020/state-editions/bjym-to-send-dummy-smartphones-to-punjab-cm.html
73,06-2-20,"Kejriwal has fulfilled tall promises, will retain Delhi","Very interestingly, one gets to see big billboards across the national capital region displaying the slogan ‘Desh maange Narendra Modi, Dilli maange Kejriwal' meaning the country wants Modi; Delhi wants Kejriwal. One Deepak Madan, who identifies himself as a volunteer of the RSS, has organised these hoardings that have left both BJP and Aam Aadmi Party (AAP) leaders scratching their heads in utter confusion. Madan says publicly that Modi is a great leader fit to lead India; but Kejriwal is the tallest one for Delhi.

Arvind Kejriwal had promised very affordable or free water and electricity in his first election manifesto, at which the whole country had laughed. But he did it and stunned the world. Lately, he has announced free power up to 200 units every month to benefit 3.2 million residents. The existing 50% electricity subsidy for the 201-400 units range will continue. Any Delhi consumer availing up to 200 units of electricity will get a zero-electricity bill. Consumers of 201-400 units will receive approximately 50% subsidy. Incredible indeed!

Incidentally, 200 units cost ?1,400 in Mumbai, ?910 in Gurugram and ?1,310 in Noida while in Delhi it is free. The Delhi electricity tariff has also not changed in the last five years. Similarly, there will be no ‘Development and Infrastructure' charges for water and sewer services anymore. Citizens will only have to pay Rs 2,310 for a new water or sewer connection.

Immediately after coming to power in 2015, Kejriwal had announced a 50% subsidy on monthly power consumption of up to 400 units and 20,000 litres of free water per month for all households. At that time, the scheme cost the exchequer around ?1,670 crore annually. Kejriwal managed this tough task mainly by controlling pilferage and theft by consumers in connivance with corrupt officials.

“I am supporting Kejriwal because I have seen the work he has done for Delhi. He has improved the healthcare system so much… I run an ambulance service in Paschim Vihar and keep taking people to hospitals. I have seen the kind of facilities that hospitals now offer,” says the ‘hording guy' Madan. “Education system in Delhi has improved significantly in the five years of AAP’s rule. Government schools are a lot better now. Teachers are extremely sincere and keep motivating students to put in hard work.” Madan is preparing to have more hoardings across Delhi.

“I feel that to become a developed country, we don’t need 50 years. Just ‘10 years' is enough. One only needs the right vision and intent,” Kejriwal had said at the recent ‘Hindustan Times Leadership Summit'.

Unfortunately, the BJP has no Chief Ministerial face to put up for Delhi. They are still trying in vain to project Modi as the saviour for Delhi, which the local voters dismiss laughingly. The Delhi BJP unit regularised 1,731 unauthorised colonies. Manoj Tiwari, Vijay Goel, and Vijendra Gupta continue to project it as a great achievement. But Delhi voters are not impressed at all. They want to know if the BJP-ruled States have made water and electricity free or cheap.

Promise fulfilling and accountability are being effectively marketed by the AAP. ‘Mohalla clinics', Government schools having turned as attractive as elite class private schools and capping expensive private school fees tightly for long have made Kejriwal immensely adorable.

Further, Kejriwal's promise to clean up the toxic Yamuna river in next five years is going well with the voters while the BJP is banking on its promise of nationwide NRC, not really making clear how Delhiites will benefit from it.

Kejriwal launched ‘India against Corruption' campaign in 2011. Anna Hazare was brought in to the anti-corruption fold as a credible face to be discarded within two years. The AAP was formed in 2012 with zero political legacy, vote banks, dynasties or even an ideology. The India against Corruption movement was a massive hit. Kejriwal sloganeered that all political parties and leaders were mostly thieves. Kejriwal’s genius in political entrepreneurship lay in the subtle manner he capitalised his fan following. A ruthless ‘use-and-discard’ approach for friend and foe, a redefinition of ‘welfarism' wrapped in nationalism symbolised through the ‘Bharat Mata ki jai' slogan and rampant display of Bhagat Singh’s portraits, all this became the USP for his political ventures.

The AAP has had its own ‘home jolts' too. A few founder-members and key functionaries including Ministers had to be xpelled on charges ranging from corruption to filming themselves having extramarital activities. Star figures like Yogendra Yadav and Prashant Bhushan had to be shown the door on incompatibility grounds. Kejriwal has not been lax on his basic stand on principles of integrity and austerity. He has been dictatorial too when it came to taking critical decisions. Whoever failed to agree to his strategies had to go. The AAP has developed its own version of non-ideological, underclass welfarism. The positive change and success brought in by the AAP are being acknowledged even by Kejriwal’s bitterest critics.

Unlike Rahul Gandhi, Kejriwal has kept intact his under-stated, soft Hindu identity. He never endorsed the intellectual Left’s demands for secular purity. He is politically wise and practical. So, he has launched a free pilgrimage programme for senior citizens for popular destinations like Ajmer Sharif and all big Hindu and Sikh shrines. The media has been persuaded to believe that Kejriwal is a modern-day ‘Shravan Kumar', the legendary parents-loving son who took his ageing parents to all 84 centres of Hindu pilgrimage on his shoulders. Pragmatic Kejriwal was also quick to host the ‘TM Krishna Concert' when forces of the rightwing Hindus opposed it vehemently. Similarly, he organised a huge, community ‘Diwali Mela' with big fanfare strictly without firecrackers. This IITian, former bureaucrat has proved to be smarter and nobler than most career politicians crowding out everywhere. Kejriwal-AAP is now an established brand with uniquely flexible political decisions and moves. Seasoned political analysts and critics do agree to the fact that Kejriwal may soon turn the torchbearer for best political reforms in India.

The bottom-line: Modern-day, techno-savvy bureaucrats learn nation-building techniques faster than ordinary self-serving politicians. Modi became a ‘larger than life' icon with exhaustive tutoring, mentoring and marketing support from super brains at astronomical costs. Kejriwal is all by himself because he has robust commonsense. He knows exactly what is critically required for the common man and how all that can be organised without depleting the public exchequer disproportionately.

All surveys show team-Modi is just no match for Kejriwal, who made extremely tall promises and kept them within months of coming to power. Modi would take at least two terms to achieve half of that, only hopefully.",state-editions,https://www.dailypioneer.com/images/logo.jpg,https://www.dailypioneer.com/2020/state-editions/kejriwal-has-fulfilled-tall-promises--will-retain-delhi.html
74,06-2-20,"No VIP symbols on vehicles, Haryana issues directions","The Haryana Government on Wednesday issued directions to comply with Punjab and Haryana High Court orders regarding “No VIP Symbols” on vehicles in letter and spirit.

As per the orders of the Punjab and Haryana High Court, display of designation or description of offices and unauthorised use of emblems on Government and private vehicles has been banned forthwith. Writing of words like court, Army, airport, navy, police and Press or any designation like chairman, vice-chairman on private and Government vehicles are prohibited forthwith.

All Administrative Secretaries, Heads of Depart-ment, Commissioners of Ambala, Gurugram, Faridabad, Hisar, Karnal, and Rohtak Divisions, all Managing Dire-ctors, Chief Administrators of Boards and Corporations and Deputy Commissioners and all Sub Divisional officers are directed to ensure compliance with these orders.",state-editions,https://www.dailypioneer.com/images/logo.jpg,https://www.dailypioneer.com/2020/state-editions/no-vip-symbols-on-vehicles--haryana-issues-directions.html
75,06-2-20,Paradip students get wheelchairs,"The School Friends Foundation in line with its motto ""Celebrate the joy of giving with a smile,"" joined hands with the management team of Jagruty, a special education centre for mentally, physically and hearing impaired children, in reaching out to children with special needs.

Notably, Paradip-based Jagruty has been instrumental in providing great care and compassionate service to the differently abled children over the last 22 years as a registered institution.

General secretary Subrata Biswas of School Friends Foundation handed over four mechanised wheel chairs to the administration team of Jagruty school in a formal ceremony at the school on February 5. The wheelchairs will not only ease but also greatly enhance the mobility of the differently-abled students.

Biswas also interacted with the teaching staff and students to better understand their needs and to explore ways for further cooperation.

The management team of Jagruty school led by Subhalaxmi Roy (president), Nalini Mohanty (Principal), Preeti Parija, Savita Panda, Munu Madam, Smita Rath, teachers and students appreciated the support provided by School Friends Foundation and decided to partner with it in future activities, benefiting the special children.",state-editions,https://www.dailypioneer.com/images/logo.jpg,https://www.dailypioneer.com/2020/state-editions/paradip-students-get-wheelchairs.html
76,06-2-20,CM announces Urban CHC at Bargarh,"Chief Minister Naveen Patnaik on Wednesday announced that a 30-bed Urban Community Health Centre would be established in the old District Headquarters Hospital (DHH) building at Bargarh town.

Emergency and outdoor patient (OPD) services would be provided at the Urban CHC, he added.

Besides, Patnaik also announced that facilities like free ambulance and bus services would be provided to patients and attendants for travelling between the proposed CHC and the new DHH.

The Chief Minister Naveen Patnaik made this announcement after a team comprising Labour Minister Susanta Singh, MP Prasanna Acharya, Bargarh MLA Debesh Acharya and former Minister Bimbadhar Kuanr met at the Lok Seva Bhawan and apprised him about people’s discontentment over the shifting of DHH to Tukurla which is about 10 km from Bargarh town.",state-editions,https://www.dailypioneer.com/images/logo.jpg,https://www.dailypioneer.com/2020/state-editions/cm-announces-urban-chc--at-bargarh.html
