,Date,Title,Article,Category,Image_link,Article_link
135,06-2-20,"Rajini backs CAA, says it’s not against Muslims","nEven as Islamic organisations are holding massive protest rallies all over Tamil Nadu against the Citizenship Amendment Act(CAA), National Population Register(NPR) and National Registry of Citizens (NRC) terming them discriminatory and anti- Muslim, Rajinikanth, Tamil film’s leading superstar, came out in support of the legislation on Wednesday.

“This was the need of an hour and the Narendra Mosi Government should be complimented for bringing in this legislation. There is nothing discriminatory in the CAA. Some religious organisations with the support of certain political parties are spreading the news that the act was against Muslims. This is not correct,” Rajinikkanth said while speaking to reporters outside his Poes Garden residence.

The actor, who is expected to announce the formation of his political outfit anytime from now, said that the Congress and other parties were speaking about such a legislation as early as 2009. “The Narendra Modi Government brought in the legislation and they should be appreciated for the same,” he said

Rajinikanth said there was nothing against the Muslims or any other religion in the CAA. “If the interests of the Muslims are hurt in anyway, Ill be the first person to come out challenging it and leading an agitation for them. The fears and concerns expressed by certain sections against the CAA are misplaced and there is no truth in such campaigns,” the actor explained.

He asked the student community in the country who are agitating against the CAA to seek the counsel of Constitutional experts and clear their doubts instead of becoming pawns in the hands of political parties. Rajinikanth said that he was making these observations after studying thoroughly about the CAA.

“There is no intimidation or threat to Indian Muslims. Some political parties with vested interests are taking this issue in hand. Some religious leaders too have fallen prey to them,” said Rajinikanth.

The superstar’s comments come at a time when MK Stalin , leader of the opposition and DMK chief is touring the State collecting one crore signatures against the CAA. Even on Wednesday, Stalin was seen attending a marriage in Erode district and making the new couple sign the anti-CAA register.

Tameemum Anzari, MLA, who is supporting the AIADMK government, said that Rajinikanth does not know anything other than acting and one need not give any importance to his comments on CAA. “He does not know politics and law and that is why he is speaking like this,” Anzari reacted to the comments by the actor.",india,https://www.dailypioneer.com/images/logo.jpg,https://www.dailypioneer.com/2020/india/rajini-backs-caa--says-it---s-not-against-muslims.html
136,06-2-20,"Overcrowding in jails related to courts’ performance, will pass orders: Apex court","Overcrowding in jails is connected to “performance of courts”, the Supreme Court observed Wednesday and said it will pass directions to deal with the issue affecting 1,341 prisons in the country which house 4.68 lakh inmates as against the sanctioned strength of 3.83 lakh.

A bench, headed by Chief Justice S A Bobde, said it will also pass direction to effectively deal with the problem of shortage of staffers in jails “which are on an average 30 to 40 per cent” of sanctioned strength.

The problem was “connected to the performance of the courts and will have to be tackled”, the benchsaid, taking note of issue of overcrowding in prisons.

It asked the Centre, represented by Additional Solicitor General A N S Nadkarni, to take instructions and apprise it as to how they are going to address the immediate concerns of filling up vacancies in jails and over-crowding in them as highlighted by the prison reforms committee headed by former apex court judge Justice Amitava Roy.

“We will pass orders after two weeks on the issues of overcrowding in jails and filling up of vacancies,” said the bench, also comprising Justices B R Gavai and Surya Kant, as the law officer sought time for taking instructions.",india,https://www.dailypioneer.com/images/logo.jpg,https://www.dailypioneer.com/2020/india/overcrowding-in-jails-related-to-courts----performance---will-pass-orders--apex-court.html
137,06-2-20,"BJP full of ‘fekus’, threatens with bullets: Mamata","Mamata Banerjee continued her tirade against the BJP for diverting the people’s attention — by supplying fake news — to non-issues — so that they do not raise questions on job loss, inflation and falling economy.

Addressing Trinamool Congress workers at Krishnagar in Nadia district , Banerjee on Wednesday said, BJP is a ‘Feku Party’ which only supplied fake news so as to divert people’s attention from real issues and divide the voters to rule.

“They are generating fake news to divide the people of the country on the basis of religion, and are threatening those who raise questions with bullets,” the Bengal Chief Minister said.

Listing the dangers of showing documents under CAA and NPR, Banerjee said “they are asking from you not only your personal details but also your parents’ certificates — like where they were born and where they lived. Moreover it is not enough to answer such questions. You will have to provide documents for your claims.

From where will you bring the documents of your parents? And if you cannot show such documents then your name will be struck off the citizenship register.

“So I will advice you not to show your documents and not to disclose your facts because they are waiting to trap you in NPR and CAA which are like black magic. Don’t show them your papers until I tell you to do so.”

She asked “will you throw me out of the country if I cannot produce my mother’s birth certificate. If that be the case then 70 percent of people will not be able to show their parents’ papers. So the BJP will drive them all out of the country.

Attacking the BJP for resorting to divisive politics she said, “politics of divide will do no good to India. It will finish the country which is already suffering under economic slowdown. Instead of providing you with rice (bread and butter) they (BJP Government) are imposing Citizenship Amendment Act, National Register for Citizens and National Population Register on you,” and added “I was not born in India that BJP is upholding before the world. I was born in Hindustan which was dreamt of by our sages and great men.”

Attacking the Centre for trying to sell the public sector units which come to the rescue of the people whenever the economy is in dire straits Banerjee said “they (BJP Government) are trying to sell off all PSUs, be it BSNL, LIC, Ordnance factories and the Railways. Unable to revive the country’s economy, they have now chosen the easy way out. But this will only take the country to further

bankruptcy.”

Saying that her own Government had registered an increase in the employment rate by 32 percent whereas national rate of employment had gone down by 40 per cent she maintained, “We managed to stem unemployment as we have chosen various ground-level projects where lakhs of jobs have been created in the last eight years.”

Earlier she compared the BJP with Dussasana—-he wicked brother of Kaurava king Duryodhana in epic Mahabharata who tried to cheat his cousins the Pandavas of their legitimate empire before being defeated in the battle of Mahabharata —Banerjee said “these (BJP are a party of Dussasanas” who also resemble the character of Sultan Muhammad bin Tughlaq a historical figure who is often termed by historians as the “wisest fool.”",india,https://www.dailypioneer.com/images/logo.jpg,https://www.dailypioneer.com/2020/india/bjp-full-of----fekus-----threatens-with-bullets--mamata.html
138,06-2-20,SC refuses to stay HC order on reservation to Marathas,"The Supreme Court on Wednesday refused to stay the Bombay High Court order upholding a Maharashtra law granting reservation to Marathas in education and jobs.

A bench of Justices L Nageswara Rao and Deepak Gupta said the matter has been pending for long and required detailed hearing.

It fixed March 17 to hear at length a batch of pleas filed for and against the Maratha quota. “We are fixing the date of March 17, so that the issue can be heard at length. We are also making it clear that no adjournments will be granted. All replies and counter replies to be filed before the next date of hearing,” the bench said.

At the outset, senior advocate Gopal Sankaranarayanan, appearing for some of the petitioners challenging the quota for Marathas, said the state cannot grant such reservation beyond the set limit.

He sought a stay of the Bombay High Court order which upheld the State law granting quota to Marathas with some modifications.

The bench said Wednesday it will not hear the matter on merits and to grant any interim reliefs, it needs to hear the pleas at length.

It said there is already an interim order passed by the apex court that any appointments made will be subject to the outcome of the batch of petitions.",india,https://www.dailypioneer.com/images/logo.jpg,https://www.dailypioneer.com/2020/india/sc-refuses-to-stay-hc-order-on-reservation-to-marathas.html
139,06-2-20,Porn on social media a grave concern: Speaker,"Speaker Om Birla on Wednesday suggested a serious discussion in the Lok Sabha on the issues relating to the unbridled pornographic content in the social media as members drew attention towards its ever increasing trend besides that of fake news and sought the Government to penalise social media companies.

Members said the UAE and China have banned child porno sites and asked the Government whether it would do the same.

Maintaining that child pornography is a serious thing and must be banned, Electronics and Information Technology Minister Ravi Shankar Prasad said the Government blocked 9,000 sites. Many say adult pornography is “our right”, Prasad said, adding “revenge porno” is also in vogue.

On the suggestions to ban all the sites spreading porn and fake news, the Minister said India should not be compared with China or the Middle East, as “we are a democracy”.

While several MPs had, during question hour, expressed concern over unregulated spread of the social media which spewed fake news and pornography, the Speaker said the issue demands a serious half-an-hour discussion. Prasad promptly agreed to the suggestion saying the upper house had discussed the misuse of social media. The Modi Government had in its first term planned to go whole hog on banning porn sites but due to reasons like impracticality among others it stepped back.

Gaurav Gogoi (Congress) blamed Government for not regulating social media and cited the case of teenager Gopal Sharma who fired at Jamia university site saying he was streaming live but “your Ministers did not remove… it is illegal”. He sought to know whether Government would penalise social media companies.

At this, Prasad said the Government was working on the direction of the Supreme Court. “We are considering penalising,” the Minister said even while pointing that the Data Protection Bill is before the select committee.” As for the shooting incident near Jamia, he said the incident is under investigation. In a written reply, Prasad also said there is no proposal to link social media profiles of users with their Aadhaar numbers and asserted that steps are being taken to curb spreading of fake news and pornography through social media platforms.

His response was to a question on whether the government proposes to formulate any policy to link social media profile of users with their Aadhaar numbers. According to him, the Government has taken several steps to keep a check on the spread of fake news, pornographic and anti-national content via social media platforms.

Prasad said there has also been a rise in irresponsible comments in the social media.",india,https://www.dailypioneer.com/images/logo.jpg,https://www.dailypioneer.com/2020/india/porn-on-social-media-a-grave-concern--speaker.html
140,06-2-20,13.62 mn Indian nationals staying abroad: MEA,"As many as 13.62 million Indian nationals are staying abroad and USD 118.3 billion has been received as remittances from them since April 2018 up to September last year.

In a written reply to a question in the Lok Sabha, Minister of State for External Affairs V Muraleedharan cited figures which showed that countries like Nepal, the Middle East region, the UK, the US, Malaysia and Germany have a large number of Indians living there.

As per the data received from Indian missions, there are an estimated 13.62 million Indians abroad, he said.

As per the RBI data, during 2018-19, USD 76.4 billion was received as remittances, while during period 2019-20 (April-September), USD 41.9 billion was received, Muraleedharan said.

Replying to another question, he said the number of Indians involved in financial irregularities with the banks as well as those who are under criminal investigation from 2015 onwards are 72 and considerable amount of Proceeds of Crime (PoC) are involved in respect of these cases.

Muraleedharan, in reply to a separate question, also informed Parliament that mortal remains of 21,930 Indian nationals from 125 countries have been brought back to India since 2015 till December, 2019.

On the issue of prisoners in Pakistan’s custody, he said as per the available information, 275 Indians, including fishermen are presently believed to be in Pakistan’s custody.

However, as per the lists shared on January 1, 2020, Pakistan has acknowledged the custody of 262 of them, he said. In addition, there is the issue of 83 missing Indian defence personnel, including prisoners of war, whose custody has not been acknowledged by Pakistan, so far, Muraleedharan said.",india,https://www.dailypioneer.com/images/logo.jpg,https://www.dailypioneer.com/2020/india/13-62-mn-indian-nationals-staying-abroad--mea.html
141,06-2-20,Statue of Unity to get divyang-friendly,"The world’s tallest statue, ‘Statue of Unity’ in Gujarat’s Narmada, which is visited daily by over 5,000 tourists, including elders and persons with disabilities (PwDs,) is all set for an upgrade to make it completely disabled-friendly.

The 182-metre-tall engineering marvel that was founded in a memorial tribute to Sardar Vallabhbhai Patel in Gujarat has recently got the tag of Shanghai Cooperation Organisation’s ‘8 Wonders of SCO’. It is also said to be on the itinerary list of US President Donald Trump who is expected to visit India in the last week of February this year.

Department of Empowerment of Persons with Disabilities Secretary (DEPwD) Shakuntala D Gamlin said, “Statue of Unity meets up almost all accessibility requirements. Features such as conveyor belt, lifts with Braille button, spacious corridors, directional signages, wheel-chair facilities and accessible drinking water and toilets in the Statue of Unity are novel features that need to be replicated universally.”

However, certain other features such as Braille maps, sign language interpreters, audio facility for the visually impaired people needs to be added to make the accessibility complete, she said.

To assess the tourism accessibility of the icon, which was inaugurated by Prime Minister Narendra Modi in 2018, the DEPwD under the Union Social Welfare and Justice Ministry recently organised a visit of 14 youths with disabilities from all over India.

“We have noted their observation. For instance, the visually impaired and hearing impaired mentioned the need for Braille maps, Braille booklets on the historical importance of the Statue of Unity and a sign language interpreter for hearing impaired. We have started putting in place an infrastructure that provides a barrier-free access to the visitors with disabilities,” said Gamlin.

The Rights of Persons with Disabilities Bill passed in 2016 mandates upon the Governments including Centre and the States to ensure that those with disability get equal access to education, public facilities which is barrier-free in infrastructure and transport systems.

The Railways Ministry is also ensuring that nearby Kevadiya railway station is ‘Divyang’ friendly. There will be special disabled friendly features such as ramps to wheelchair access, lifts and escalators for movement to one floor to another, washrooms on both sides of the railway station. Disabled-friendly sites are getting global attention.

For instance, Kerala’s ‘Barrier-Free Tourism Project’ recently got global recognition as the United Nations World Tourism Organization (UNWTO) made a special mention to it as an ‘Emerging Global Destination’ in the Accessible Destination Awards 2019. According to a report, a booming section of the travel market reserved for travellers with disabilities and also the elderly is estimated to be worth an astounding USD 19.2 billion.",india,https://www.dailypioneer.com/images/logo.jpg,https://www.dailypioneer.com/2020/india/statue-of-unity-to-get-divyang-friendly.html
142,06-2-20,"Cong driving Sena away from Hindutva, says BJP","Maharashtra BJP president Chandrakant Patil on Wednesday asked Chief Minister Uddhav Thackeray to guard against the Congress' “conspiracy” to “win away” the Shiv Sena from its Hindutva agenda and allow the Raj Thackeray-led MNS to fill the saffron vacuum in the State.

In remarks viewed as an attempt to placate the former ally of his party, Patil hailed the Sena's role “in protecting Hindus during communal riots and the Marathi manoos in Mumbai” as a “well-wisher” of the Thackeray-led party.

“The Congress is taking the Shiv Sena away from Hindutva and the MNS is being allowed to fill the Hindutva space as part of a conspiracy. The chief minister should understand this plan,” Patil said.The Congress and the NCP are constituents in the Shiv Sena-led Maharashtra Vikas Aghadi government.

Patil, however, said the BJP welcomes the MNS taking up the Hindutva agenda.

“As a well-wisher of the Shiv Sena and as a Mumbaikar, I feel that it was because of the Sena that Marathi manoos survived in Mumbai. It was because of the Sena that Hindus survived, as shiv sainiks came out to protect people during numerous riots,” the BJP leader said.

Calling himself a “fan” of the Sena, Patil said the Congress was attempting to take the Thackeray-led party away from Hindutva, and attempting to fit the MNS in that space.Indirectly referring to the new saffron flag of the MNS which was unveiled last month, Patil said, “there are some invisible people working behind designing the new flag and other things...CM Thackeray should understand this plan”.Patil also questionned Thackeray's statement in an interview that he had not abandoned Hindutva by joining hands with the NCP and the Congress to form a government.

“Uddhav Thackeray is trying to convince people by saying that the Sena has not given up Hindutva. If you really have not given up Hindutva, then why are you not demanding Bharat Ratna for Veer Savarkar, and (not) supporting the CAA?” he questionned.

Thackeray has in fact said that the new citizenship law was not aimed at taking away anybody's citizenship. However, he has opposed the proposed National Register of Citizens (NRC).Patil also questionned the “Hindutvavadi” Sena's “silence” on V D Savarkar being dubbed “homosexual”.

A controversial booklet on Savarkar and the RSS, allegedly distributed in an All India Congress Seva Dal training camp run by the Congress in Bhopal, had claimed that Savarkar had a physical relationship with Nathuram Godse, the assassin of Mahatma Gandhi.",india,https://www.dailypioneer.com/images/logo.jpg,https://www.dailypioneer.com/2020/india/cong-driving-sena-away-from-hindutva--says-bjp.html
143,06-2-20,Thane man throws inflammable liquid on woman for rape plaint,"A woman suffered an injury to her eyes after a man allegedly threw an inflammable substance on her after she refused to withdraw a rape complaint against him at Mira Road in Maharashtra's Thane district, police said on Wednesday.

The police on Monday arrested the accused from Ahmedabad for allegedly throwing an inflammable substance on the married victim, who is in her mid 20s, senior inspector Sanjay Hajare of the Mira Road police station said.

The incident took place on Saturday night, when the accused spotted the victim in the locality and threw an inflammable liquid either petrol or diesel on her, he said.

The woman was rushed to a nearby hospital, where she was treated for an injury to her eyes, he added.

Earlier, the victim had lodged a complaint of rape against the accused at Mira Road police station, the official said.",india,https://www.dailypioneer.com/images/logo.jpg,https://www.dailypioneer.com/2020/india/thane-man-throws-inflammable-liquid-on-woman-for-rape-plaint.html
144,06-2-20,"‘Love Jihad’ is a reality in Kerala, claims BJP leader","A day after the Union Home Ministry told Parliament that no case of “Love Jihad” has been reported by any of the central agencies, the BJP on Wednesday claimed that it was a reality, which is happening in Kerala.

Throwing its weight behind the Bishops of Syro-Malabar Catholic Church, who kicked up a debate in the state recently over the incidents of “Love Jihad” in the state, BJP national executive member P K Krishnadas urged the Home Ministry to carry out a “comprehensive probe” into such cases to bring out real facts.

“The term 'Love jihad' is not defined under the extant laws but it is a fact that Love Jihad is happening (in Kerala),” Krishnadas told reporters here. He accused the present CPI(M)-led LDF government and previous Congress-led UDF government of not giving a proper report to the Centre over the issue of “Love Jihad”. “The state governments controlled by the UDF and LDF give reports to the Centre saying that such incidents are not at all happening in Kerala,” Krishnadas alleged.

He said the BJP shared the views of the Syro-Malabar Church on the issue of “Love Jihad”. “The complaint and allegations raised by the Syro-Malabar Church on the issue of “Love Jihad” is based on facts and truth. We share their views,” he said.

The Syro-Malabar Church also reacted to the Central government's clarification on “Love Jihad”, saying the circumstances under which the Synod of the Church made the statement on the issue still exists.

Seeking an investigation into the issue, the Church, in a statement, made it clear that the statement of the Synod was not meant to disturb the communal harmony prevail in the Kerala society.

It said the synod had only expressed its opinion that inter-religious love affairs create troubles in family and society at large and that such cases should be probed.

Krishnadas said the BJP also does not see the “Love Jihad” as an issue between two religions.

“Don't mistake it as an issue between two religions. There is no religion for terrorists. We don't see it as a Hindu-Muslim issue or a Christian-Muslim issue,” he s

aid. In a written reply to a question, Union Minister of State for Home G Kishan Reddy on Tuesday informed the Parliament that the term “Love Jihad” is not defined under the extant laws and no case of “Love Jihad” has been reported by any of the central agencies.",india,https://www.dailypioneer.com/images/logo.jpg,https://www.dailypioneer.com/2020/india/---love-jihad----is-a-reality-in-kerala--claims-bjp-leader.html
145,06-2-20,"Shops shut in protest, two cops suspended","Traders downed shutters and educational institutes remained shut on Wednesday in Rajgarh area of Churu district over the alleged rape of a 10-year-old girl even as two policemen were suspended after the accused gave them the slip.

The accused, Akram Khan, was arrested nearly three hours after he managed to escape from police custody on Tuesday evening.

The minor was allegedly kidnapped and raped on Monday night.

Markets and educational institutes remained closed on Wednesday in Rajgarh in protest against the rape incident, police said.

The traders association had called for a shut down today and took out a silent rally and later submitted a memorandum to the sub-divisional magistrate demanding death penalty to the accused, they said.

Churu SP Tejaswani Gautam said two policemen have been suspended for dereliction of duty.

Head constable Girdhari and constable Balbir faced the action after the accused gave police the slip.

Rajgarh Station House Officer (SHO) Vishnu Dutt said the accused, Khan, allegedly abducted the girl from a market and took her to a secluded spot where he raped and assaulted her.

He was booked for rape and attempt to murder, the SHO added.",india,https://www.dailypioneer.com/images/logo.jpg,https://www.dailypioneer.com/2020/india/shops-shut-in-protest--two-cops-suspended.html
