,Date,Title,Article,Category,Image_link,Article_link
191,20-1-20,Trend Blazer,"Sanjay is proud of his son

Actor Sanjay Dutt is proud of son Shahraan as he successfully performed a full-split after practicing hard for days.

The actor took to Instagram to share a photo of his nine-year-old performing the full-split and called him his “little Karate kid.” He captioned: “He finally pulled off a ‘Full-split' after days of practice! My little Karate kid.”

Sanjay's wife Maanayata also commented on the post saying, “My boy.”

On the work front, Sanjay will next be seen in Mahesh Bhatt's directorial Sadak 2 in which he stars along with Pooja Bhatt and Alia Bhatt. The film is slated to hit the theatres on July 10.

‘Last year when I was doing Devdas, Siddharth came and saw it with his wife. That's when he mentioned that he had something for me. He called me soon after and had a very clear idea about my character. I heard about the role and I could very easily imagine myself doing it. They were looking for somebody to bring gravitas into the story.’

—Gaurav Chopra

The glitz and glamour of Bollywood creates a dream world in front of our eyes, but what is the reality?

Actor-filmmaker Pooja Bhatt took to Twitter to express how the Film City is turning into a mess. She tweeted: “Film City is bustling with activity. Shame that it is in such a mess. Debris from sets long de-constructed lie everywhere. The access roads are non-existent. Why can't we film folk clean up after we create these imaginary worlds on camera? Authorities don't seem to care. But we must.”

‘My husband is empathetic’

Actor Gwyneth Paltrow relied on her husband Brad Falchuck to help her through her emotional MDMA trip, after she took the drug whilst on vacation with Falchuck in Mexico.

“I never thought of MDMA as a psychedelic and when I took it, I didn't hallucinate,” Paltrow said.

She added: “It wasn't a rave, it was actually very, very emotional and I was with my then-boyfriend, who's now my husband. He's a very empathetic, profoundly wise person and was able to help me through it.”

Paltrow has been expanding her lifestyle brand and recently released a $75 candle, named This Smells Like My Vagina, on her online shop.",vivacity,https://www.dailypioneer.com/uploads/2020/story/images/big/trend-blazer-2020-01-20.jpg,https://www.dailypioneer.com/2020/vivacity/trend-blazer-trend-blazer-2020-01-20.html
192,20-1-20,Fix the flaw,"NSA finds major security glitch in Windows 10, issue amended

The National Security Agency has discovered a major security flaw in Microsoft’s Windows 10 operating system that could let hackers intercept seemingly secure communications.

But rather than exploit the flaw for its own intelligence needs, the NSA tipped off Microsoft so that it can fix the system for everyone.

Microsoft released a free software patch to fix the flaw and credited the intelligence agency for discovering it. The company said it has not seen any evidence that hackers have used the technique.

Amit Yoran, CEO of security firm Tenable, said it is “exceptionally rare if not unprecedented” for the US government to share its discovery of such a critical vulnerability with a company.

Yoran, who was a founding director of the Department of Homeland Security’s computer emergency readiness team, urged all organisations to prioritise patching their systems quickly. An advisory sent by the NSA on Tuesday said “the consequences of not patching the vulnerability are severe and widespread.”

Microsoft said an attacker could exploit the vulnerability by spoofing a code-signing certificate so it looked like a file came from a trusted source. “The user would have no way of knowing the file was malicious, because the digital signature would appear to be from a trusted provider,” the company said.

If successfully exploited, attackers would have been able to conduct “man-in-the-middle attacks” and decrypt confidential information they intercept on user connections, the company said.

“The biggest risk is to secure communications,” said Adam Meyers, vice president of intelligence for security firm CrowdStrike.

Some computers will get the fix automatically, if they have the automatic update option turned on. Others can get it manually by going to Windows Update in the computer’s settings.

Microsoft typically releases security and other updates once a month and waited until Tuesday to disclose the flaw and the NSA’s involvement. Microsoft and the NSA both declined to say when the agency privately notified the company.

The agency shared the vulnerability with Microsoft “quickly and responsibly,” Neal Ziring, technical director of the NSA’s cybersecurity directorate, said in a blog post.

Priscilla Moriuchi, who retired from the NSA in 2017 after running its East Asia and Pacific operations, said this is a good example of the “constructive role” that the NSA can play in improving global information security. Moriuchi, now an analyst at the US cybersecurity firm Recorded Future, said it’s likely a reflection of changes made in 2017 to how the US determines whether to disclose a major vulnerability or exploit it for intelligence purposes.

The revamping of what’s known as the “Vulnerability Equities Process” put more emphasis on disclosing vulnerabilities whenever possible to protect core internet systems and the US economy and general public.

Those changes happened after a mysterious group calling itself the “Shadow Brokers” released a trove of high-level hacking tools stolen from the NSA, forcing companies including Microsoft to repair their systems. The US believes that North Korea and Russia were able to capitalise on those stolen hacking tools to unleash devastating global cyberattacks.",vivacity,https://www.dailypioneer.com/uploads/2020/story/images/big/fix-the-flaw-2020-01-20.jpg,https://www.dailypioneer.com/2020/vivacity/fix-the-flaw.html
193,20-1-20,WEBBED,"Fortune Feimster: Sweet & Salty

This is a stand-up comedy which features actor, comedian and writer Fortune Feimster. She takes the stage and riffs on her southern roots, sexual awakenings, showbiz career and more. The show releases on January 21 on Netflix.

The ghost bride

In 1890s Malacca, Li Lan finds herself in the after life and becomes mired in a mystery linked to the sinister, deceased son of a wealthy family. Starring Huang Peijia,Wu Kang-jen, Ludi Lin, the sci-fi and fantasy drama releases on January 23 on Netflix.

The stranger

When a stranger makes a shocking claim about his wife, family man Adam Price becomes entangled in a mystery as he desperately searches for answers. Starring Richard Armitage, Siobhan Finneran, Jennifer Saunders, the show releases on January 30 on Netflix.",vivacity,https://www.dailypioneer.com/uploads/2020/story/images/big/webbed-2020-01-20.jpg,https://www.dailypioneer.com/2020/vivacity/webbed-webbed-2020-01-20.html
194,20-1-20,A mother’s gift,"Women share their victories, struggles and trends across generations while breastfeeding babies, writes Urvashi Sarkar

When 45-year-old storyteller and author Aparna Karthikeyan gave birth to her daughter two decades ago, her grandmothers advised her not to rely on breastfeeding alone as a source of food and nutrition for the baby.

“Amul milk was also considered a good source for the Indian middle class then. My grandmothers said that if I was breastfeeding my daughter, I should top it up with bottled Amul formula milk or diluted cow’s milk,” says Karthikeyan. Their argument was that the bottle would allow her to monitor the quantity of milk the baby consumed, whereas the baby might not get enough milk through breastfeeding.

The only person who supported Karthikeyan in her quest to breastfeed was her paediatrician, with whose encouragement she breastfed her daughter for five months and does not regret it. “My daughter never fell sick during breastfeeding. She built up her immunity. And the exercise also helped me bond with her. Weaning off was a challenge because it results in cold, fever and even upsets her stomach,” says Karthikeyan.

Breastfeeding babies for six months is a widely recommended practice. According to The Lancet, the first 1,000 days between conception and a child’s second birthday are crucial for health, nutrition and development of the child.

But for expecting and new mothers, breastfeeding can be a mix of conflicting advices, emotional turmoil and never-ending anxiety about whether the baby is being adequately fed. Moreover, the fact that breastfeeding isn’t easy for many women, and rather a technique that needs to be learned, is often swept under the carpet. The experience differs for various mothers. Take the case of 32-year-old Dr Nandini Hebbar, an academic scholar of gender studies. She has been committed to the idea of breastfeeding even before her son was born. She attended an orientation programme at a Delhi hospital and watched YouTube videos on proper positioning to achieve the correct latch for the baby. And yet, despite all the preparation, she struggled with the experience.

“A couple of days after giving birth to my son and starting to breastfeed, I was terribly sore, bleeding, and struggling. My son was crying inconsolably, looking jaundiced and losing more weight than what was average — all signs that he was not being fed enough. I had to resort to formula milk,” recalls Hebbar.

As she struggled with the dilemma of whether or not to persevere with breastfeeding, Hebbar, began reading up on the matter and found that “an overwhelming number of women worldwide give up exclusive breastfeeding within days of childbirth for reasons described as insufficient milk, painful and sore nipples or baby refusing the breast.”

Hebbar knew that poor latch and breastfeeding technique was the root cause of not being able to feed the baby, causing distress to both mother and infant. She was simultaneously aware that exclusively breastfeeding for six months reduces the rate of infant mortality and is linked to lower rates of chronic diseases such as diabetes and improves neurocognitive development. The mother would also benefit through lowered risks of breast and ovarian cancer, osteoporosis and heart disease.

There was no dearth of advice from family for Hebbar. While elders suggested her to feed sugar water and dilluted cow milk to the baby, others encouraged her to continue breastfeeding. “My family knew my problems but did not know how to help me. My gynaecologist suggested over the counter nipple butter. But even that didn’t help,” she says. Then Hebbar turned to a private lactation consultant who taught her to position herself and to ensure that the baby was fed well. After this she managed to exclusively breastfeed her son for six months.

Art critic and journalist Blessy Augustine too sought advice from a lactation consultant two weeks after her daughter’s birth. “My nipples were very sensitive and my daughter would keep biting hard causing them to bleed. She would cry for hours because she was hungry and had lost weight too.”

The lactation consultant advised her that it was more important that the baby gets milk in general, opposed to its variety. Augustine realised that a mix of breastfeeding and bottle feed worked best. “Once I switched to bottle feeding, my daughter was calmer and I was able to breastfeed her better. I think the conclusion of the advice was that you have to see what works best for you and the baby,” she says.

For 31-year-old Shrutika Bhat, an IT professional and mother to a five-month-old, breastfeeding was difficult only for the first two or three days when the baby was not latching on. But things smoothened soon. She doesn’t feel that there are major differences in practices or mind-sets about breastfeeding across generations. “Old is gold”, she says, with regard to the advice she received on breastfeeding by older members of the family who encouraged her to breastfeed.

Even as mothers, grandmothers and obstetricians continue to play an important role in providing guidance, new mothers usually prefer referring to professional lactation consultants. Social media also plays a role in helping women prepare for breastfeed.

Though breastfeeding is wholly considered a woman’s and a mother’s job, but the wider community plays a crucial role in providing a supportive and enabling environment. Augustine says, “I think I would have done better if people around me were not stressing me out so much about it.”

Workplaces also need to chip in with support for both mother and father. “If my spouse had a longer paternity leave, that would have really helped. He just had five days off,” she says.

According to the Maternity Benefit Amendment Act, 2017, women are entitled to 26 weeks of paid maternity leave from their workplace. Six months of paid maternity leave enabled Bhat to exclusively breastfeed. But Shrutika isn’t sure how frequently she will be able to breastfeed after six months since she wants to return to work.

However, exclusive breastfeeding is not available to all women, except for those who are financially well-off to avail paid maternity leave, lactation consultants and internet access. But this does not apply to vast swathes of women across India. For example, the 2017 Act that enables paid maternity leave is only applicable to commercial establishments that employ 10 or more people.

A vast number of women (over 90 per cent as per estimates) work in the unorganised or informal sector and are not covered under the law. And the entitlements provided by laws which cover women in the unorganised sector are insufficient. For example, under the National Food Security Act and accompanying Pradhan Mantri Matru Vandana Yojana, `6,000 needs to be given to every expecting and new mother for the nutritional needs of both mother and child. A report by Down to Earth showed that there were many cases where women did not receive any money. Hence, the policy has failed to include the needs of poor women and the ones engaged in casual employment in the unorganised sector. These women then have to look for alternatives.

“Take the case of female farmers,” says Karthikeyan, who writes about rural livelihoods in Tamil Nadu. “It is hardly possible for them to take their babies along with them to the fields. They try to breastfeed as much as possible but it isn’t as often or regular as they would like to. Before six months, they give them food like ragi porridge in Tamil Nadu and banana mash in Kerala. This is to offset the dependence on the mother for milk,” adds she.

Breastfeeding babies is important for both mother and child but there are various challenges that still need attention from the government, lawmakers and the wider community including family, workplace and medical practitioners to ensure they lead a healthy life.

—Charkha Features",vivacity,https://www.dailypioneer.com/uploads/2020/story/images/big/a-mother---s-gift-2020-01-20.jpg,https://www.dailypioneer.com/2020/vivacity/a-mother---s-gift.html
195,20-1-20,"Djokovic, Williams lead tennis old guard into new decade","Old stagers Novak Djokovic and Serena Williams will aim to keep the younger generation of players waiting in the wings as Grand Slam tennis enters a new decade at the Australian Open on Monday.

After recent bushfire smog largely cleared in Melbourne, the view is all too familiar with Djokovic and Williams, who is seeking a record-equalling 24th Major title, installed as the bookies' favourites.

Top seed Rafael Nadal, 33, is celebrating becoming world number one in a third decade while Roger Federer, 38, is trying to defy the ageing process and stay ahead of his rivals with a 21st Grand Slam win.

The start of 2020 is not dissimilar to 2010, when Federer and Nadal shared the four Grand Slam titles and Williams won in Melbourne and Wimbledon.

Ten years later, the men’s Big Three — who have won all but two Australian Open titles since 2004 — occupy the top three rankings, and Williams is one step away from Margaret Court's record for Grand Slam victories.

The men’s dominance is stark: since Federer won his first Grand Slam title in 2003, only five Major finals have not featured one of the Swiss, Nadal or Djokovic.

Several challengers have come and gone but there is increasing hope for the men's up-and-comers, while nine women have won Grand Slam titles since Williams, 38, claimed her 23rd in Melbourne in 2017.

‘They’re very close’

While Djokovic and Nadal split last year’s Grand Slams, Dominic Thiem, Daniil Medvedev and Fabio Fognini won their first Masters trophies and Stefanos Tsitsipas, 21, became the youngest ATP Finals champion in 18 years.

“They’re very close. I don’t think that’s miles, miles away maybe as it was some years ago,” Djokovic of the NextGen winning a Major title.

The clash between old and new will be epitomised in the first round on Monday, when Venus Williams, who turns 40 this year, plays 15-year-old rising star Coco Gauff —who wasn't even born when her fellow American lifted her first Grand Slam trophies in 2000.

Japan’s Naomi Osaka, 22, is defending a title for the second Grand Slam in a row after her repeat bid at last year’s US Open fell flat in the fourth round.

World number one Ashleigh Barty, fresh from winning the Adelaide International on Saturday, carries Australian hopes of seeing the first home-grown women’s winner since 1978.

“Obviously it’s the perfect preparation. But regardless of whether I won the title or not last week, I feel like I’m well-prepared,” Barty said.

“I’m happy, I’m healthy. I'm coming into the first Grand Slam of the year with a smile on my face. That’s all I can ask of myself.”

The tournament is taking place against the backdrop of a bushfires emergency that has swept the nation and ramped up fears over global warming — and billowed choking smog across Melbourne and other cities.

After player anger during qualifying and practice, when several were hit by coughing fits and breathing problems, air pollution returned to 'moderate' levels over the weekend, with rain forecast for the start of the tournament.",sports,https://www.dailypioneer.com/images/logo.jpg,https://www.dailypioneer.com/2020/sports/djokovic--williams-lead-tennis-old-guard-into-new-decade.html
196,20-1-20,Serena 'concerned' over Australian Open pollution after past lung problems,"Serena Williams voiced concern over pollution from bushfire smoke at the Australian Open on Monday, saying that lung problems in the past could make her more vulnerable.

The 38-year-old American, who is pursuing a record-equalling 24th Grand Slam title, said it was a waiting game to see how conditions develop over the next fortnight.

The poor air that disrupted qualifying eased by Monday -- when Williams made a winning start against Anastasia Potapova -- and instead gave way to spells of heavy rain.

""I definitely was concerned, and am,"" said Williams, who suffered a lung blood clot during labour while giving birth to daughter Olympia in 2017 -- the second time she has needed emergency treatment for the problem.

""That (haze) is still a concern for, I think, pretty much everyone.""

Many players have hit out at organisers for ploughing ahead last week with qualifying matches, despite pollution levels hitting some of the worst on the planet in Melbourne.

Asked if she feared she might be more sensitive to the pollution because of her past problems, Williams replied: ""It definitely crossed my mind.

""I'm, like, 'Oh no, I'm already playing a little down than most people.'""

But Williams, who gave her USD 43,000 Auckland winners' cheque to a bushfire relief fund last week, said she felt no particular problem in her opening victory against Russian teenager Anastasia Potapova.

The American said tournament organisers had been keeping the players informed of the latest conditions each day.

""That's been really good to see that the Australian Open take that stance on that,"" she said.

""So it's literally every day, we are just waiting every day to see how the air quality would be.""",sports,https://www.dailypioneer.com/uploads/2020/story/images/big/serena--concerned--over-australian-open-pollution-after-past-lung-problems-2020-01-20.jpg,https://www.dailypioneer.com/2020/sports/serena--concerned--over-australian-open-pollution-after-past-lung-problems-serena--concerned--over-australian-open-pollution-after-past-lung-problems.html
197,20-1-20,"Kohli, Rohit consolidate top batting positions; Bumrah leads bowlers pack in ICC ODI rankings","India captain Virat Kohli and his deputy Rohit Sharma consolidated their top two positions in the batting chart, while pace ace Jasprit Bumrah continued to lead among bowlers in the ICC ODI Rankings issued on Monday.

Following their stellar performances against Australia in the just-concluded series, which India won 2-1, Kohli (No.1) and Rohit (No.2) have strengthened their positions.

With 183 runs under his belt against Australia, Kohli was the player-of-the-series while Rohit was a close second, garnering 171 runs in the rubber, including a match-winning 119 in the deciding ODI in Bengaluru on Sunday.

Kohli (886 points) and Rohit (868 points) have gained two and three ratings points, respectively to occupy the top two positions in the batting rankings.

Pakistan's Babar Azam is in third position with 829 points, the ICC said in a statement.

Left-handed opener Shikhar Dhawan has also gained seven slots to reach 15th position with 170 runs in two innings, missing a chance to bat in Bengaluru after injuring his shoulder while fielding.

K L Rahul, who opened in his place in the final ODI, has gained 21 slots to reach 50th position with an aggregate of 146 runs.

Bumrah, who returned from injury in the Australia series, is atop the bowlers chart with 764 points, ahead of New Zealand left-arm pacer Trent Boult and Afghanistan's Mujeeb Ur Rahman. South Africa's Kagiso Rabada and Australian Pat Cummins complete the top five.

India all-rounder Ravindra Jadeja has moved up two slots to be 27th among bowlers after finishing with four wickets in the series.

He also scored 45 runs in two innings and has gained four places in the all-rounders' list to be ranked 10th.

Australian Steve Smith, who topped the series with an aggregate of 229 runs including a knock of 131 in the final ODI, has been rewarded with a four-place jump to 23rd position.

David Warner, a formerly top-ranked batsman in the format, has also moved up one place to sixth while captain Aaron Finch has moved up one place into 10th. Wicketkeeper Alex Carey is in 31st position after gaining two slots.

Leg-spinner Adam Zampa's five wickets in the series saw him advance 20 places to reach 37th position, while Kane Richardson has moved from 77th to 65th.",sports,https://www.dailypioneer.com/uploads/2020/story/images/big/kohli--rohit-consolidate-top-batting-positions--bumrah-leads-bowlers-pack-in-icc-odi-rankings-2020-01-20.jpg,https://www.dailypioneer.com/2020/sports/kohli--rohit-consolidate-top-batting-positions--bumrah-leads-bowlers-pack-in-icc-odi-rankings.html
198,20-1-20,Ishant sustains ankle injury before Test squad announcement,"India's senior-most pacer Ishant Sharma hurt his ankle badly while bowling during a Ranji Trophy game here on Monday, just before the announcement of the Test squad for the New Zealand tour.

Spearheading the Delhi attack against Vidarbha, the extent of the 31-year-old's injury is not known, but Ishant looked in real pain as he hobbled off the ground with the help of support staff.

The injury happened in the fifth over of Vidarbha's second innings and Ishant's third over.

It was a short delivery, which rival skipper Faiz Fazal tried to pull but the ball hit the pads, as Ishant vociferously appealed on the follow through before slipping suddenly.

He was writhing in pain and needed immediate medical help. Ishant had taken three wickets for 45 runs in Vidarbha's first innings.

The veteran of 96 Tests is expected to be in the Test squad for the New Zealand tour and this is his last Ranji game of the season.

His next outing is supposed to be a practice match in Hamilton but in case the injury turns out to be serious, he will be going to the National Cricket Academy (NCA) for rehabilitation.",sports,https://www.dailypioneer.com/uploads/2020/story/images/big/ishant-sustains-ankle-injury-before-test-squad-announcement-2020-01-20.jpg,https://www.dailypioneer.com/2020/sports/ishant-sustains-ankle-injury-before-test-squad-announcement.html
