,Date,Title,Article,Category,Image_link,Article_link
124,20-1-20,States opposing Act unconstitutional: FM,"Dubbing as “unconstitutional” the stand of some States that the CAA would not be implemented, Union Minister Nirmala Sitharaman on Sunday said all have the responsibility to ensure a law passed by parliament is enforced.

Defending the Citizenship (Amendment) Act, she maintained there was no necessity to mix up the National Register of Citizens (NRC) and National Population Register with the CAA and appealed to those opposing the act not to make allegations that would lead to unrest among the public.

The Finance Minister also rejected allegations that the Narendra Modi Government was selective in granting citizenship and said Pakistani singer Adnan Sami and over 3,900 others from neighbouring countries had been given citizenship in the last six years.

Speaking at an interactive event here on the controversial CAA organised by the Chennai Citizens’ Forum, she said the resolutions passed by some State Assemblies, including Kerala, against the law was a political statement.

“We can understand that.But saying they will not implement it, then it is against the law. It is unconstitutional to say that... Everybody in this country has the responsibility to implement the law which has been passed in Parliament,” she said.

The Kerala and Punjab Assemblies have adopted resolutions demanding repeal of the CAA which has triggered widespread protests across the country. Kerala Government has also moved the Supreme Court against the law.

Several State Governments, including Kerala, Rajasthan, Madhya Pradesh, West Bengal and Maharashtra have voiced their disagreement with the CAA, as well as the NRC and the NPR.

Sitharaman said that during the last six years, a total of 2,838 Pakistan nationals, 914 from Afganisthan and 172 from Bangladesh have received Indian citizenship. This included 566 Muslims.

“Besides, 4.61 lakh Tamils from Sri Lanka during the period 1964-2008 have received citizenships,” she said.

“This data is for those who comment that the Government has not given citizenships for Muslims. For example, Adnan Sami, he is a singer of prominence. He received citizenship in 2016 when the same Prime Minister was there then”, she said.

The Minister also pointed to Bangladeshi writer Taslima Nasreen, who has been given residence permit since 2004.

These figures would deny allegations made by the Opposition that this Government was giving citizenship only to some people and not for everyone. “There is no truth in it and that is not the right allegation,” she

said.

Appealing to those who oppose the CAA with folded hands, Sitharaman said if you have any objection speak and raise questions in the Parliament.

“Please do not make any allegations which are not true and that would create unrest among the public”, she said.

Noting that the CAA was a sensitive issue and needed to be handled carefully, she said there was no necessity to link NPR or NRC with this.

“NPR is taken every 10 years and it was not brought in by Modi Government in 2010. It was by the then Home Minister and senior leaders (of Congress),” she said.

They had then spoken in support of NPR, but, were opposing it now, Sitharaman said adding it was not right.",india,https://www.dailypioneer.com/images/logo.jpg,https://www.dailypioneer.com/2020/india/states-opposing-act-unconstitutional--fm.html
125,20-1-20,Women protest in Assam,"Hundreds of women hit the streets here on Sunday protesting against the contentious Citizenship (Amendment) Act, even as public rallies were held across the State.

Artistes, journalists, writers and women from other fields joined in large numbers at Latasil playground and marched to Chandmari area of Guwahati and vowed to continue their agitation till the CAA is repealed.

“Women have been at the forefront in Assam protests. Today also we have come out in large numbers for the state. The Government is trying to lure us through various means. But they should withdraw the Act and then all the protests will end,” film actress Barsha Rani Bishaya said.

The Government is stating that five lakh people will benefit through CAA, but the people of Assam are not ready to accept a single Bangladeshi after 1971, she added.

Senior journalist Ratna Bharali Talukdar said: “We will not accept this Act at any cost. It will endanger the culture, identity and history of Assam as well as North East. So, we all have to be united in our fight against this Act.”

In Bengali Hindu dominated Hojai, a huge gathering took place during a protest rally, in which senior journalist Ajit Bhuyan urged people to continue their movement till the “anti-people” Act is withdrawn.

Thousands of people in Tezpur participated in an agitational programme organised by the All Assam Students’ Union (AASU) and Asom Jatiyatabadi Yuva Chhatra Parishad (AJYCP).

A large number of people participated in similar protest rallies in Simaluguri, Moran, Duliajan, Nagarbera, Doom Dooma, Rupai, Rangia and many other places.

The CAA seeks to provide Indian citizenship to Hindus, Jains, Christians, Sikhs, Buddhists and Parsis entering India on or before December 31, 2014, from Bangladesh, Pakistan and Afghanistan after five years of residence here.",india,https://www.dailypioneer.com/images/logo.jpg,https://www.dailypioneer.com/2020/india/women-protest-in-assam.html
126,20-1-20,Himanta: Impossible for immigrants to give proof of religious persecution,"Assam Finance Minister Himanta Biswa Sarma has said it is impossible for an immigrant to provide proof of religious persecution.

Sarma, who is also convenor of the NDA’s regional wing North East Democratic Alliance (NEDA), said that it is not possible for the person to go back to his country of origin and collect a copy of police report to show that he was subjected to religious persecution.

Assam has been witnessing protests against the Citizenship (Amendment) Act with the people apprehending that it will hurt their interests.”It is not possible for an applicant to prove that he had been subjected to religious persecution in his country of origin.

Because if he has to prove it, then he has to go to Bangladesh to collect an FIR or police report,” Sarma said after a party function on Saturday.

“You cannot prove fear of religious persecution or religious persecution itself. How can you prove it? Somebody will challenge it.

“That is what my assessment is. You will ask a person to go back to Bangladesh and ask him to collect videographic or photographic evidence of religious persecution?” he asked. The Assam Government has requested the Centre to include submission of evidence by an applicant that he was in the State prior to 2014 in the rules of the CAA, which are under preparation, the NEDA convenor said.

“Our firm view is that in order to prove that you have come to Assam before 2014, you have to prove it through documents like a bank account opened prior to 2014 or name in the electoral roll prior to 2014 or NRC application before 2014,” the BJP leader said.

The Assam Government wants a very short window period to establish citizenship under the CAA because rumours are being spread about the possible number of beneficiaries under the Act.",india,https://www.dailypioneer.com/images/logo.jpg,https://www.dailypioneer.com/2020/india/himanta--impossible-for-immigrants-to-give-proof-of-religious-persecution.html
127,20-1-20,"Cong, TMC, LF betrayed Hindu refugees: BJP","The BJP has slammed the Opposition Trinamool Congress and Left Front for betraying the Hindu refugees from Bangladesh by keeping them in stateless State and batting to the Muslim gallery of infiltrators in order to pursue their dirty vote bank politics.

Bengal BJP president Dilip Ghosh on Sunday fired a fresh volley of salvos at the TMC, Left and Congress by promising and then keeping the “Hindu refugees from Pakistan, Bangladesh and Afghanistan deprived of citizenship for the past 70 years.”

And “when Prime Minister Narendra Modi showed the courage of finishing their unfinished job these TMC, Left and Congress people have descended on the streets to protest against the move with the so-called bunch of civil society who are nothing but parasites in their trail.”

Not a single drop tear was shed when the Hindus were tortured, persecuted and hounded out of their mother lands, he said reminding how their ancestors played an important role in the freedom struggle. “Did their ancestors fight for freedom, receive bullets and sacrifice their lives and property so that their successors would be left in a state less situation?” he said recalling how till recently Hindu girls were being lifted at gun point in Pakistan.

“Those who had to leave their home and hearth in Bangladesh are living here like beggars and when the BJP Government is feeling honoured to provide them citizenship Mamata Banerjee, Biman Bose and Adhir Chowdhury are feeling hurt burns…. But come what may we are determined to provide them citizenship,” Ghosh who was reelected to the post of State party president for the second term last week said.

Ghosh on Sunday led two massive rallies (Abhinandan Yatra) in North 24 Parganas congratulating the central government for enacting the Citizenship Amendment Act.

“We know in whose interest Didi and the Left leaders are doing this. We know in whose interest the Chief Minister is walking the streets for the past one month. It is in

the interest on one crore Muslim infiltrators from Bangladesh who form the bulk of her vote bank and but for whose she will lose all the elections. But we will not allow this game anymore,” Ghosh said adding how the Bangladeshi infiltrators were igniting riots and blasting bombs everywhere.

“They have triggered riots and Basirhat, Asansol, Baduria, Uluberia and many other places, they have set up bomb factories which the TMC use during the elections … one after the other accidents occur at bombs factories and the TMC Government call it blast of crackers…. This won’t be tolerated and the infiltrators will have to leave this country,” he said.

Attacking the civil society members including top Bengali cine stars, writers, poets and painters for descending on the streets against CAA he said “these so-called intelligentsia who are nothing but parasites living on the alms of the Government say that they will not show their papers but I warn them that days are coming when they will not be able to show their faces… I ask the people to identify and remember those who are protesting against the CAA for an appropriate time in future.”",india,https://www.dailypioneer.com/images/logo.jpg,https://www.dailypioneer.com/2020/india/cong--tmc--lf-betrayed-hindu-refugees--bjp.html
128,20-1-20,"Two missing, feared dead after car falls into river","Two persons are missing and feared dead while a teenager was injured after the car they were travelling in fell off the road into the Alaknanda river on Sunday.

The mishap took place near the Dhari Devi temple on the national highway to Badrinath. According to sources, those travelling in the car were identified as 52 year old Devendra Singh, 16 year old Divyanshi and 28 year old Praveen Kumar.

While the two men were missing after the mishap, the teenage girl was rescued in an injured condition.

She was admitted to the base hospital in Srikot while efforts were carried out for tracing the other two men involved in the mishap. The exact cause of the mishap is not yet known.",state-editions,https://www.dailypioneer.com/images/logo.jpg,https://www.dailypioneer.com/2020/state-editions/two-missing--feared-dead-after-car-falls-into-river.html
129,20-1-20,Devotees visit Shirdi temple amid Saibaba birthplace row,"Thousands of devotees managed to have darshan of Saibaba amid considerable inconvenience in the temple town of Shirdi in Maharashtra’s Ahmednagar district on Sunday, as the local residents and people from the neighbouring villages resorted to an indefinite bandh over a controversy on the birthplace of the 19th century saint.

Despite the bandh called by the local residents and people from 30 villages surrounding villages, the Shri Saibaba Sansthan Trust (SSST) has decided to keep the famous temple open for the visiting devotees. “The devotees are free to take darshan of Saibaba, while prasadalaya and accommodation facilities, will continue to operate as normal,” SSST’s CEO Deepak Muglikar said.

Being a Sunday, there were huge crowds of devotees at the temple queuing up for darshan. However, with shops, hotels and all other establishments remaining closed in the temple town, the devotees were inconvenienced. “Because of the bandh, we have made more than adequate arrangements for food and accommodation for the devotees,” Muglikar said.

The people of Shirdi and neighbouring 30 villages have for the past few days staging protests against Chief

Minister Uddhav Thackeray’s announcement to develop Pathri village in Parbhani district of Marathwada region as the birthplace of Saibaba, a decision that they fear will erode the importance of their town associated all along with the memories of Saibaba.

Taking cognisance of the protests by the people of Shirdi against the State Government’s decision to develop Pathri as birthplace of Saibaba, the Chief Minister has called a meeting with the leaders of the aggrieved people in Mumbai on Monday. At Monday’s meeting, Uddhav is expected to clarify the State Government’s stand on the issue and request the people of Shirdi to call off their agitation.

The raging controversy over the birthplace of Saibaba should be seen in the context of that a delegation of people from Pathri village had met the chief minister, during the latter’s recent tour of Marathwada. They had claimed that Pathri was the birthplace of the 19th century saint revered by people of different communities and urged the chief minister to make financial allocation for developing the place into a pilgrim centre.

During his interaction with the delegation, the chief minister had announced that the state government had prepared a development plan for Pathri and it would soon perform a bhoomi pooja for developing a pilgrim centre there.

Following the announcement, the people of Shirdi and neighbouring villages have gone on an agitation against the state government’s Pathri development move. What has surprised as to how the claim of Pathri being birthplace of Saibaba has come up all of a sudden. Though there is not much of evidence or documentation as to the date or place of borth of Saibaha, available historical evidence suggests that he came to Shirdi when he was about 16 years’ old in 1858 and he remained there till his death in 1918.

Three months ahead of his death on October 15, 1918, Saibaba told his devotees he would soon be “leaving his mortal body” (dying). By the end of September 1918, he had high fever and stopped eating. As his condition deteriorated, he asked his disciples to recite holy texts to him and continued to meet visitors. On 15 October 1918 which happened to Vijayadashami, he breathed his last.

His mortal remains were interred at “Buti Wada” in Shirdi, after which it has now become place of worship known today as Shree Samadhi Mandir or Shirdi Sai Baba Temple.

The claim that Saibaba was born in Pathri village in Parbhani district of Marathwada region is based on a reference made in the eighth edition of “Sai Charitra” (history of Saibaba), a Hindi publication brought by the Sai Sansthan between 1972 and 76. So far, the Sai Sansthan has brought out 36 editions of “Sai Charitra”.

“The reference to Saibaba being born in Pathri village has been made in the eighth edition. Incidentally, this edition has gone missing. We have ordered an inquiry into the missing edition of Rs Sai Charitra’,” a leading Marathi television channel reportedly quoted SSST’s chairman Dr. Suresh Kashinath Haware as saying.",india,https://www.dailypioneer.com/images/logo.jpg,https://www.dailypioneer.com/2020/india/devotees-visit-shirdi-temple-amid-saibaba-birthplace-row.html
130,20-1-20,K’taka Dy CM flays Shiv Sena leaders,"Karnataka Deputy Chief Minister CN Ashwathnarayanon on Sunday made it clear that the Belagavi border issue was settled, even as he accused certain political leaders in neighbouring Maharashtra of raking it up for political reasons.

Also, he urged them to focus on issues of public good that need immediate attention rather than instigating people for petty reasons on such emotive issues that have already been decided upon.

The Karnataka and Maharashtra border issue has already been settled by the Mahajan commission report, so they(political leaders) should stop repeatedly instigating the people on the issue with political motive,”Ashwathnarayan told reporters here.

He said, We all are Indians, boundaries between States have been fixed and decided upon. Instead of repeatedly dwelling on the issue, there are many good work to do. There are no boundaries for humanity and good work...”

“... Sanjay Raut (Shiv Sena leader) raking up such an issue is making things awkward for himself,” he added.

Ashwathnarayanwas reacting to visits by Shiv Sena leaders Raut and Maharashtra Minister of State Rajendra Patil Yadravkars to Belagavi allegedly with an intention to bring the border issue up.

Raut, during his visit to Belgagavi, has reportedly said the 70-year-old border issue between two States can be resolved by a ‘strong’ Union Home Minister like Amit Shah, who abrogated Article 370 related to Jammu & Kashmir.

He said the chief Ministers of Maharashtra and Karnataka and NCP supremo Sharad Pawar should meet to resolve demands of Marathi-speaking people of Belagavi and nearby areas.

Last month, Karnataka Chief Minister BS Yediyurappa had declared that not even an inch of the State’s land would be given away and accused his Maharashtra counterpart Uddhav Thackeray of stoking the Belagavi issue for political gains, as there were protests by the ruling Shiv Sena workers.

Maharashtra claims the border district of Belagavi was part of the erstwhile Bombay Presidency, but is currently a district of Karnataka, on linguistic grounds.

Uddhav Thackeray had, in December, appointed ministers Chhagan Bhujbal and Eknath Shinde as co-coordinators to oversee his government’s efforts to expedite the case relating to the boundary dispute with Karnataka.

The Maharashtra Ekikaran Samiti (MES), which has been fighting in the border areas of Belagavi for the merger of 800-odd villages with Maharashtra, had also recently submitted a memorandum of their demands to Uddhav Thackeray.",india,https://www.dailypioneer.com/images/logo.jpg,https://www.dailypioneer.com/2020/india/k---taka-dy-cm-flays-shiv-sena-leaders.html
131,20-1-20,"For first time since 1932, Mumbai to get cavalry unit for traffic","Mumbai will get a mounted police unit for traffic and crowd control post a gap of 88 years, and the horses will be deployed on duty after taking part in the Republic Day parade at Shivaji Park this year, Maharashtra Home Minister Anil Deshmukh said on Sunday.

Deshmukh said the mounted police unit, which would patrol the streets of the bustling metropolis, was disbanded in 1932 due to growing vehicular traffic.

“Today Mumbai police has modern jeeps and motorcycles. However, it was felt a mounted police unit would be useful for crime patrol in crowded areas. Accordingly, for the first time since Independence,

Mumbai will have mounted police unit,” he told reporters at a press conference.

He said horses in the unit can be used for crowd control during festivals and marches, at beaches and the rider can keep watch from a good height, and claimed a policeman on horseback was equal to 30 personnel on the ground.

He said the unit could be replicated in cities like Pune and Nagpur, among others, as well.

In the next six months, the unit will comprise 30 horses apart from a sub-inspector, one assistant PSI, four havaldars and 32 constables.",india,https://www.dailypioneer.com/images/logo.jpg,https://www.dailypioneer.com/2020/india/for-first-time-since-1932--mumbai-to-get-cavalry-unit-for-traffic.html
132,20-1-20,Two die in Bihar while taking part in human chain,"A 55-year-old Government teacher and a woman died in Bihar while taking part in a human chain organised by the Nitish Kumar Government on Sunday, officials said.

Mohammad Daud died at Keoti area in Darbhanga district while a woman, whose identity is yet to be ascertained, died in Samastipur district.

“Both died of heart attack,” Chief Secretary Deepak Kumar told reporters.

Kumar said an ex-gratia amount of Rs 4 lakh each will be paid to the family of the two deceased.

“Besides, family members of Mohammad Daud, who taught at a Government Urdu medium school in Darbhanga, will get all the benefits to which bereaved kinsmen of State employees are entitled,” the chief secretary said.

Daud fell ill and collapsed while he was standing in the human chain, Darbhanga District Magistrate Thyagarajan SM said. Daud was taken to a hospital where he was declared brought dead. Hospital sources said the deceased had suffered a cardiac arrest though it was not clear whether he was suffering from any heart disease.",india,https://www.dailypioneer.com/images/logo.jpg,https://www.dailypioneer.com/2020/india/two-die-in-bihar-while-taking-part-in-human-chain.html
133,20-1-20,Shivpal launches veiled attack on Mulayam for siding with Akhilesh,"Former UP Minister and president of Pragatisheel Samajwadi Party Shivpal Yadav on Sunday launched a veiled attack on his brother and SP patriarch Mulayam Singh Yadav for siding with his son Akhilesh Yadav and said that he was not going to look back.

Shivpal, who has never been openly critical of his brother before, said he had formed his party “only with the consent” of Mulayam.

He was answering a reporter’s question on whether Mulayam betrayed him by being seen more with his son these days.

“The Pragatisheel Samajwadi Party was formed only with the consent of Mulayam Singh Yadav. Why is Mulayam today standing with Akhilesh, its answer can be given by him (Mulayam) alone. But this is certain that I will not look back,” he said.

Mulayam was seen with his son at the SP headquarters in Lucknow on Saturday when former chief of Hindu Yuva Vahini (HYV) Sunil Singh, once considered close to Uttar Pradesh Chief Minister Yogi Adityanath, joined the Samajwadi Party.Shivpal said that his efforts will be to unite people who believe in the

philosophy of Ram Manohar Lohia, Chaudhary Charan Singh and Mahatma Gandhi.

The PSP chief said that he always gave respect to Mulayam, who is also his elder brother, and listened to everything he said.

“Not giving importance to what Mulayam said led to the split of the Samajwadi Party in 2018. This is the reason that the SP could not form the Government in UP again, otherwise Akhilesh would have been the Chief Minister,” Shivpal said.

Shivpal had formed his new party in October 2018 after parting ways with the Samajwadi Party.

Simmering discontent in the Yadav family came to the fore in January 2017 when Akhilesh became the national president of the party by replacing Mulayam. Shivpal lost the battle for control of the party for which the uncle and nephew were fighting since August 2016 when Akhilesh was the Chief Minister and he was a key minister in then SP Government.

Replying to another another question, Shivpal discounted the possibility of entering into any alliance with the BJP.

“From the BJP side, there were talks about coordination, but we did not enter into any sort of alliance,” he added. PTI",india,https://www.dailypioneer.com/images/logo.jpg,https://www.dailypioneer.com/2020/india/shivpal-launches-veiled-attack-on-mulayam-for-siding-with-akhilesh.html
