,Date,Title,Article,Category,Image_link,Article_link
59,20-1-20,"‘Netaji valued communal harmony, women power'","Odisha-born noted freedom fighter and founder of Azad Hind Fouz, Netaji Subhas Chandra Bose was a real strength of communal harmony and women power, speakers expressed in the sixth Netaji Subhas Utsav, Jay Hind 2020, held here on Friday.

The event was organised by the Utkala Bikasha Juba Parisad. Speakers described how four youth of Azad Hind Fauz's suicide squad members Fauza Singh from Punjab, Satyachandra Barddhan from Tripura, K Anantan Nair, a Kerali Brahmin and Vakkom Khader, a Kerali Muslim were hanged together in Madras jail on September 10, 1943 and Kerali Christian Bonfice Perreriah was sentenced with life imprisonment for being a minor.

Those days Netaji had inspired young girls to be in the fore front of independence movement. Jhansi regiment was formed and Captain Laxmi Sehgal was made a Minister in Azad Hind Government. Dr Leela Nag was nominated to national planning committee. When Pritilata Athe, a teacher, took arms and shot dead six British officers inside European Club in Chittagong and was seriously injured in return fire, she consumed cyanide.

Athe was just twenty one. Kanaklata Baruah, while leading a mass to hoist the tricolor inside Gohpur police station in Borangbari, Assam, she was shot dead by British police she was just 17. Pari Bewa too was shot dead by British police as a minor, told the speakers, calling upon youths and students to follow the ideologies of these martyrs.

Saheed Kanaklata's nephew Abhijit Baruah was felicitated with Netaji Samman 2020 along with Krushnachandra Patra, Prasant Mishra, Bilua Nayak, anti liquor leader Indumati Sahu, social worker Bijaylaxmi Routray and journalist Swati Jena.

Former Chief Minister Hemanand Biswal was chief guest while Prof Birendra Nayak was chief speaker. Pradyumna Satapathy, Kishore Mania and Shivanand Ray , Professor Kishore Swain were the other guests. Parisad president Debiprasad Prusti chaired.",state-editions,https://www.dailypioneer.com/images/logo.jpg,https://www.dailypioneer.com/2020/state-editions/---netaji-valued-communal-harmony--women-power-.html
60,20-1-20,3-day tribal philosophy meet concludes,"The three-day international conference on tribal philosophy, the first of its kind in the State concluded today, with Union Tribal Affairs Minister Arjun Munda laying stress on organizing such conferences at regular intervals. The three- day seminar Adi Darshan which was inaugurated by Governor Droupadi Murmu and Chief Minister Hemant Soren at Audrey House witnessed scholars from across the country and abroad deliberate on various aspects of tribal philosophy.

Munda said, “Institutes such as Tribal Research Institutes (TRI) can help a lot in improving the condition of tribal society. On the basis of class and sect there are different tribal societies but they are one on the basis of custom and practices.” Munda asked on holding such type of seminars at regular interval.

On last day, Dr Hage Tabyo and Prof Subhadra Chana chaired the session. Tribal thinker, Ram Prasad Sardar said that Munda society in Bangladesh is not considered as tribals, if they are not considered as tribal how they will have their identity.

Dr Jumuna Bini a tribal researcher talked about tribals of Arunachal Pradesh how their rituals performed after death of a person goes for days. Jagarnath Gond talked about relation of Gond society with nature. Gond also talked about Koya and Lingo philosophy.

Yogeshwar Asur talked about Singhbonga and how Singhbonga received power and energy. Sunil Kumar said that in Meghalaya philosophy means speaking truth.

The conference discussed the origin and nature of the universe from the tribal point of view, their philosophy of religion, concept of death, heaven and hell. According to the concept note of the conference, the event effort to answer a prominent question: Can there be a body of knowledge termed as tribal philosophy?

The conference had a dozen sessions over a period of three days. Beginning with Astro-Asiatic and Dravidian groups of tribals who live in Jharkhand, the conference discussed on philosophical aspects of other Indian tribes such as Bheel, Meena, Gond, and those living in the Northeast and abroad.

Inaugurating the conference, Governor Droupadi Murmu on Friday had said that there are nine philosophies in the country of which the tribal philosophy is the best. She said that people of the tribal communities worship the nature.

The governor expressed hope that such seminars would help 'Adivasi Darshan' take an important place in the Indian branch of philosophy. Speaking on the occasion, Chief Minister Hemant Soren said tribal 'Darshan' is a big subject and it is a challenge to understand and research tribal philosophy",state-editions,https://www.dailypioneer.com/images/logo.jpg,https://www.dailypioneer.com/2020/state-editions/3-day-tribal-philosophy-meet-concludes.html
61,20-1-20,Swamy considering PIL against Devsthanam Act,"Rajya Sabha MP and senior BJP leader Subramanian Swamy is considering the option of filing a Public Interest Litigation challenging the Char Dham Devsthanam Management Act which was recently accorded approval by the Governor Baby Rani Maurya. Though the State Government has been repeatedly stating that this Act will not affect the traditional rights and position of the priests and various other stakeholders, many in the religious fraternity are still not convinced and continue to oppose this Act.

Recently, a delegation of Teerth Purohits and traditional stakeholders in the Char Dham shrines met the BJP MP. Swamy also tweeted, “The Uttarakhand Government has got a new law passed by the Assembly. On the face of it, one can say that it is unconstitutional. Many sadhus came to see me to ask me to file a PIL. Will consider.”

Ever since talk of the Char Dham Devsthanam Management Board started, the Teerth Purohits and other stakeholders have been opposing this idea. Protest rallies were also staged in Dehradun and other parts of the State against this. After the bill was passed in the Assembly, the Raj Bhawan recently granted its approval to it. The Chief Minister Trivendra Singh Rawat, Culture and Tourism minister Satpal Maharaj and others have been stressing that this Act will not affect the rights or position of the various stakeholders. The State Government has been maintaining that this Act was brought to further improve the facilities for devotees from across Indid and abroad visiting the Char Dham and other shrines in the State. However, some have continued to oppose this. Recently the Char Dham Mahapanchayat vice president and priest in Gangotri shrine, Ashok Semwal led a delegation which called upon the BJP’s Rajya Sabha MP Subramanian Swamy. In the memorandum submitted by the delegation to Swamy, it was stated that many are opposing the Act and that a protest will also be organised in Delhi on this issue. It is pertinent to mention here that some other members of the religious fraternity in Uttarakhand have also opposed the Act on the grounds that only Hindu shrines should not be brought under government control.",state-editions,https://www.dailypioneer.com/images/logo.jpg,https://www.dailypioneer.com/2020/state-editions/swamy-considering-pil-against-devsthanam-act.html
62,20-1-20,One-way system trial elicits mixed response,"The police conducted a trial of the one-way system on various city roads here on Sunday.

The system is slated to be enforced in view of the various works to be undertaken in the city as part of the Smart City project. However, on the day of the trial, the people faced various problems and gave mixed response to the system.

“It is Sunday so somehow we managed, but our kids have school on the same route and the one-way will make it harder for us to go extra miles to drop them every morning. This will double the time it takes us to drop out children to school,” added Akriti Sahni.

According to Jeetram Sahni, “On normal days it hardly takes me five minutes on a motorcycle to reach Parade Ground from my place even during dense traffic but today I had to cover extra distance to reach the same place.

How it is helping anyone? It just wasted my time, energy and fuel. It might be helpful for pedestrians, but for bike riders and drivers, it is an inconvenient situation.”

Kedar Bhandari, an auto-rickshaw driver said, “Routes are undoubtedly longer than the usual ones and that is why the vehicles are taking more time to reach a destination. I do not know if this plan can help to reduce traffic in other days but it is certainly not going good for us today.

Commuters are not paying extra to go extra miles to reach the destination which is taking more time too besides extra fuel.”

However, some people found it helpful for commuters. “I am not saying that it is not causing inconvenience to the public, but I can also see less traffic jam than on other days. I come almost every Sunday towards Clock Tower and the intersection is always congested with vehicles.

Today the traffic here is about three times less than usual traffic. If it can work this way on other days too then I have no problem to cover a few extra miles without getting stuck in traffic,” said Vedant Tiwari.

According to Dipaneeta Sharma, “I had to ride some extra distance just to reach the place which was at a walking distance. We can go walking to such places but we can’t leave our vehicle on the road, so we’ll have to go extra miles. However, if this system can reduce the traffic then it is bearable, otherwise, it is a waste of fuel, time and effort.”

It is pertinent to mention here that traffic on Rajpur Road, Chakrata Road, Subhash Road, EC Road and some other roads in the core area of Dehradun city was affected by the one-way plan of the police.",state-editions,https://www.dailypioneer.com/images/logo.jpg,https://www.dailypioneer.com/2020/state-editions/one-way-system-trial-elicits-mixed-response.html
63,20-1-20,Rawat to meet protesting Anganwadi workers,"Former Chief Minister and senior Congress leader is expected to meet the protesting Anganwadi workers in Dehradun on Monday. According to the protesters, he will be extending his support to the protest and meet those undertaking the fast unto death in support of their demands.

According to State President of Anganwadi workers association, Rekha Negi, “I also came to know it just now that Harish Rawat is coming to support us.

Before that Congress leader Suryakant Dhasmana had also come to support us.

I am glad people are supporting us but also want to make it clear that we are not inviting leaders from any party to show any kind of support for us. We do not want to get politically involved; we just want our demands to be fulfilled.”

It has been around two months since the protest started and till now five women- Savita Sharma, Shashi Thapa, Manorama Nautiyal, Neelam Paliwal and Bhagyashree Uniyal have been admitted to the Government Doon Medical College (GDMC) hospital by the police after the health of the women was affected by them undertaking a fast unto death.

At present, Anganwadi workers Pinky Singh and Anju Chand are carrying on the fast unto death at the protest site near Parade Ground.

According to Rekha Negi, “Government is thinking they are controlling our protest through police but when we are forced to committ self-immolation, they will not know it before it’s too late.”

It is pertinent to mention here that the Anganwadi workers had also protested during the term of the previous Congress state government.

At that time, their allowance had been raised by Rs 1,000 per month.",state-editions,https://www.dailypioneer.com/images/logo.jpg,https://www.dailypioneer.com/2020/state-editions/rawat-to-meet-protesting-anganwadi-workers.html
64,20-1-20,CM administers polio drops to children,"Arriving here to attend the marriage function of MLA Mahesh Negi’s son, chief minister Trivendra Singh Rawat administered polio drops to children at a polio booth organised near the helipad.

On arriving here, the chief minister visited a polio-booth set up by the health department in the army area near the helipad. He witnessed the proceedings and also administered polio-drops to some of the children at the booth. Speaking on the occasion, the Chief Minister said that it was the responsibility of all parents to ensure that their children had been administered the medication for protection from dangerious diseases like polio. He said that due to public awareness and proactive action, polio had been eradicated from the Nation and the State. Despite this, one should get the medication administered to children on polio-days being organised as a precautionary measure, he stressed. Various office bearers of the Bharatiya Janata Party and local officials concerned were also among those present on the occasion.",state-editions,https://www.dailypioneer.com/images/logo.jpg,https://www.dailypioneer.com/2020/state-editions/cm-administers-polio-drops-to-children.html
65,20-1-20,Cong to start State-wide protest against Govt,"Accusing the Bharatiya Janata Party government at the State and Centre of “duping” Uttarakhand, the Congress is planning to undertake a state-wide protest rally.

Addressing media persons here on Sunday, former cabinet minister and senior Congress leader Mantri Prasad Naithani said that during the past three years, the Central and State Governments had been duping the state and imposing anti-people laws.

Due to this, the people who had voted overwhelmingly in favour of the BJP in the Lok Sabha and Vidhan Sabha elections are now feeling cheated.

He said that the Congress party had been consistently undertaking movements against the objectionable decisions and actions of the Government since 2017.

However, the Central and State Governments are suppressing the public agitations instead of resolving the issues causing problems to the public. The women, farmers, members of the business fraternity, unemployed persons and even government employees are suffering due to Government policies. Naithani said that the party will undertake a 15-day ‘Uttarakhand Bachao Dev Yachna’ rally in the State from February 15.

The rally will be in protest against the Devsthanam management Act, shifting of NCC Academy from Tehri, disinvestment of THDC and NTPC, formation of district authorities in various districts, failure to clear pending dues of sugar cane farmers, fee hike in medical colleges, discontinuation of public-welfare schemes started by the previous Congress government and about a dozen other issues.

The rally will also be extending support to the protesting Anganwadi workers, protest against failure to meet the valid demands of government employees, Central Government cutting the budgetary allocation for the Kumbh Mela to be held in Haridwar during and against the continued price rise, added Naithani.

Before the protest rally, the Congress will submit memoranda to the Prime Minister and various union ministers in the national capital from February 5 to 10. In the second stage of the protest, the party will start from the Rampur Tiraha and travel to various shrines in all the 13 districts of the state, seeking justice and help from the deities. If the Government fails to respond, the Congress will lock down the Vidhan Sabha during the budget session. After that the party workers will lock down the secretariat.

If still the desired results are not achieved, the Congress will undertake the fifth stage of its planned protest by taking out a ‘Jawab Do Sarkar’ rally from Narayan Ashram in Pithoragarh which will pass through all the districts and conclude at Gangotri.",state-editions,https://www.dailypioneer.com/images/logo.jpg,https://www.dailypioneer.com/2020/state-editions/cong-to-start-state-wide-protest-against-govt.html
66,20-1-20,Capt gets another letter from own MLA,"Days after senior Congress leader and Rajya Sabha MP from Punjab Partap Singh Bajwa threw a letter bomb on the Chief Minister Capt Amarinder Singh demanding State Advocate-General Atul Nanda’s expulsion, the Patiala Royal on Sunday received another letter from his party legislator raising issues concerning human resource development.

Congress MLA from Ferozepur City Parminder Singh Pinki has shot off a letter to the Chief Minister raising several issues concerning the physically challenged, besides the people’s health, expressing hope that Capt Amarinder would prioritise the same.

Pinki, in his letter, has sought monthly allowance for the physically challenged persons, along with organising district wise camps for them, issuing certificates to access certain facilities like travel, among other things.

“I am inviting your attention to an issue that is concerned with the society at large….It is about the disabled persons in Punjab,” said Pinki.

He added, “I recently organised a camp for the handicapped in Ferozepur during which I realised the extent and depth of their problem and cater to the needs of 1,562 such disabled persons. They virtually are a neglected section of the society going by their unmitigated problems.”

Underlining that the number of handicapped in Punjab is more than six lakhs as per official figures, Pinki said that such camps should be organized in every district from time-to-time.

“The persons certified as handicapped should be given monthly allowance. This is all the more important in case of those who belong to the weaker sections of society,” he suggested adding that they have a right to dignified life and the allowance would be just one step in that direction.

He suggested that the physically challenged should be issued certificates that would enable to access certain facilities like travel. They should have better access to education and employment opportunities, he added.

Pinki added another significant issue that needs to be given proper focus is the “health” of the people. “Open Gyms should be set up in the public parks in every city and towns of the State,” said Pinky pointing that this facility has been provided only in some areas and the same should be available to the people at large, especially in rural areas.",state-editions,https://www.dailypioneer.com/images/logo.jpg,https://www.dailypioneer.com/2020/state-editions/capt-gets-another-letter-from-own-mla.html
67,20-1-20,Independent MLA threatens to quit Haryana Govt,"An Independent legislator in Haryana, who has been booked for cheating, on Sunday gave an ultimatum to the Manohar Lal Khattar led State Government on withdrawing his support.

Indirectly hitting out at Chief Minister, Meham legislator Balraj Kundu said he has extended support to the CM for his clean credentials and not to a person who is supporting the corrupt.

Police had on Friday booked Kundu and his brother Shivraj Kundu for allegedly cheating Rohtak resident Narender Dhankhar.

While talking to the mediapersons, Kundu said that if the CM is not taking action against his leader Manish Grover, I will be forced to withdraw my support to this Government.

“I am giving a month’s time to the Chief Minister to act against Grover,” he said, adding “I know that the withdrawal of my support will have no impact on the Government stability as without me it has the support of 56 legislators, but my fight against the corrupt would continue”.

Kundu had alleged irregularities in sugar mills in the state since the BJP came to power in the state in 2014. He had sought a probe against former state Cooperatives Minister Manish Grover.

Earlier, Kundu, along with the supporters, reached the police station and dared authorities to arrest him for the case registered against him. The police told him that the case was under investigation.

The Meham legislator, a BJP turncoat, had won polls as an independent after being denied a party nomination.

In October last year, the BJP had won 40 seats and was six short of a majority in the 90-member Assembly. Besides the Jannayak Janta Party (JJP), seven independent MLAs had also extended support to the BJP, helping it reach a tally of 57 seats.

Kundu’s allegations are likely to be raised by the opposition during the year’s first session of the Haryana Assembly beginning January 20.

This will be a special assembly session to pass a resolution ratifying the SC/ST quota Bill for another 10 years.",state-editions,https://www.dailypioneer.com/images/logo.jpg,https://www.dailypioneer.com/2020/state-editions/independent-mla-threatens-to-quit-haryana-govt.html
68,20-1-20,Paradise extends helping hand to hospital patients,"Members of Paradise NGO on Sunday distributed medical equipment and medicines worth Rs 1.4 lakh for children undergoing treatment at Guru Nanak Hospital in Ranchi.

The list of items donated to the hospital includes CCTV cameras, Ultrasonic Digital Machine, IFT Machine, Muscle Stimulator Machine and Walker.

Aloke Poddar, the secretary of group said, “We request all to kindly encourage other interested persons to do join our social drive.

Together we will always keep coming forward as a ray of hope people in need of support.”

Every month, the NGO identifies areas for contributing to the society. No religious, no internationally funded trusts and no community based activity are undertaken.

The group relies on donors to contribute in its monthly activity. Presently, the group has more than 130 donors and wants to increase this number in coming months. Prominent group members are BJP Rajya Sabha MP Mahesh Poddar and Sumit Poddar of Premson Motors among others.

Poddar further said, “We use only digital platform to connect with members and raise funds through online payments. Event invitation, updates etc. are sent only on WhatsApp. We have used technology to influence the life of many underprivileged.”

The group by now has visited Sahyog village in Khunti and distributed a number of items to over 100 children of different age groups with the total cost of Rs 1,00,000. It has also contributed to old age homes and shelter homes in the past.",state-editions,https://www.dailypioneer.com/images/logo.jpg,https://www.dailypioneer.com/2020/state-editions/paradise-extends-helping-hand-to-hospital-patients.html
69,20-1-20,Giridih police sends 2 to jail on charge of theft,"The Nimiaghat police arrested two thieves, who were hiding in a saloon located at Isaribazar bus stand in Nimiaghat police station here on Sunday.

According to the SDPO Dumari Niraj Kumar, both had been committing thefts by identifying locked houses during the daytime. They have allegedly broken the ventilator and doors and entered the shop and house. Police also recovered two mobile phones, iron rods, iron scissors and modems from the arrested persons. The arrested persons Sonu Sharma and Chandan Sharma are both residents of Jamtara under Dumri police station area. Dumri SDPO Neeraj Kumar Singh, Dumri Inspector Dinesh Singh, Nimiaghat Police Station Incharge Bikas Paswan, Dumri Police Station In-charge Upendra Rai gave tip off to the concerned police station.",state-editions,https://www.dailypioneer.com/images/logo.jpg,https://www.dailypioneer.com/2020/state-editions/giridih-police-sends-2-to-jail-on-charge--of-theft.html
70,20-1-20,RK Singh is new managing director of Adhunik Power,"The former executive director of NTPC, Raghvendra Kumar Singh took charge as managing director of Adhunik Power & Natural Resources Limited.

The chairman of the company T. Sankaralingam welcomed Singh by presenting bouquet. Animesh Gupta, director (commercial) commenced sitting at Padampur site as extending work cooperation to the new MD. Gupta will continue to operate from Ranchi office too.

Soon after assumed charge of MD, R K Singh promptly came in action by taking face to face meeting with various department heads. “It is my privilege to lead Adhunik Power & Natural Resources Limited. I look forward to working with all our stakeholders, villagers of vicinity and employees to take this company on its next stage of growth,” said R K Singh. Commenting on Singh's appointment, CEO, Rakesh Gupta said: “Company will scale new heights under his guidance, expertise and leadership.",state-editions,https://www.dailypioneer.com/images/logo.jpg,https://www.dailypioneer.com/2020/state-editions/rk-singh-is-new-managing-director-of-adhunik-power.html
