,Date,Title,Article,Category,Image_link,Article_link
93,27-1-20,NBA legend Kobe Bryant killed in helicopter crash,"NBA legend Kobe Bryant died Sunday when a helicopter he was riding in crashed and burst into flames in thick fog, killing all nine people on board including his teenage daughter and plunging the sports world into mourning.

Bryant, 41, was travelling with his 13-year-old daughter Gianna and seven other passengers and crew when their Sikorsky S-76 helicopter slammed into a rugged hillside in Calabasas, west of Los Angeles. There were no survivors.

Bryant, a five-time NBA champion and two-time Olympic gold medallist, is widely regarded as one of the greatest basketball players in history, an iconic figure who became one of the faces of his sport during a glittering two-decade career with the Los Angeles Lakers.

Dozens of firefighters and paramedics battled across steep terrain to reach the flaming wreckage at the crash site but found no survivors, officials said.

The National Transportation Safety Board said an 18-strong team of investigators would be sent to California to probe the causes of the crash.

Bryant's death sent shockwaves throughout the world, with basketball stars stunned by the news. ""Laker Nation, the game of basketball & our city, will never be the same without Kobe,"" former Los Angeles Lakers star Magic Johnson wrote on Twitter.

Chicago Bulls legend Michael Jordan said Bryant was ""like a little brother"" to him. ""Words can't describe the pain I'm feeling,"" Jordan said. ""We used to talk often and I will miss those conversations very much.""

Tributes to Bryant flooded in from former US presidents, pop stars and athletes from different sports, a sign of how the man known as the ""Black Mamba"" had transcended basketball.

""Kobe was a legend on the court and just getting started in what would have been just as meaningful a second act,"" former US President Barack Obama wrote on Twitter.

American football star Tom Brady wrote simply: ""We miss you already Kobe."" Brazilian soccer star Neymar paid tribute to Bryant after scoring for his French club side Paris Saint-Germain, making the number 24 -- Bryant's old shirt number -- with his fingers.

At the Staples Center in downtown Los Angeles, several hundred shocked fans gathered to pay tribute as the venue which witnessed many of Bryant's career highlights hosted the music industry's Grammy Awards.

""This dude is everything to me man. It makes no sense,"" said distraught Lakers fan Bobby Jimenez, sobbing as he stood outside the venue.

The Grammys got under way with a somber tribute from singer Alicia Keys.

""To be honest with you, we're all feeling crazy sadness right now,"" Keys told the audience. ""Los Angeles, America and the whole wide world lost a hero. And we're literally standing here heartbroken in the house that Kobe Bryant built."" Across the NBA, tributes were held at several of the eight games scheduled for Sunday.

Denver Nuggets fans began chants of ""Kobe, Kobe"" as a minute's silence was held before their game against the Houston Rockets.

In New York, Madison Square Garden was lit up in purple and gold colors of the Lakers, alongside a giant image of Bryant captioned: ""Kobe Bryant, 1978-2020."" The crash came only hours after Bryant was passed by current Lakers star LeBron James for third on the all-time NBA scoring list in a Saturday game at Philadelphia. Bryant's final post on social media had been a tweet congratulating James on surpassing him. ""Continuing to move the game forward @KingJames,"" Bryant wrote. ""Much respect my brother #33644"".

Bryant was a five-time NBA champion in a career that began in 1996 straight out of a high school and lasted until his retirement in 2016.

He also was a two-time Olympic gold medalist, helping spark the US squad of NBA stars to titles in 2008 in Beijing and 2012 in London.

Bryant bowed out of the NBA in 2016, scoring 60 points in his final appearance before his adoring fans at the Staples Center.

It was a fairytale farewell to a sporting career which had begun two decades earlier.

The son of former NBA player Joe ""Jellybean"" Bryant, the Lakers legend was born in Philadelphia in 1978 while his father played for the 76ers.

The elder Bryant played from 1984 to 1991 in Italy, giving young Kobe a global worldview as he grew up dreaming of following his dad into the NBA.

He would eventually join the ranks of professionals at the age of 17, jumping directly into the NBA, only the sixth player and first guard to make such a leap.

At 18, Bryant became, at the time, the youngest player or starter in an NBA game and the youngest winner of the NBA Slam Dunk Contest.

With Bryant paired alongside Shaquille O'Neal, the Lakers captured three NBA crowns in a row from 2000-2002, returning the team to glory days unseen since 1988.

Bryant's career was almost derailed in 2003 when he was arrested in Colorado over a sexual assault complaint filed by a 19-year-old hotel employee where Bryant was staying ahead of knee surgery.

Bryant was accused of rape. He admitted to adultery but said he did not commit rape. The case was dropped in 2004 after the accuser refused to testify in a trial.

A separate civil suit was settled under terms kept private.

Bryant saw out his career with the Lakers, successfully branching out into the entertainment industry following his retirement.

In 2018, he won an Oscar for his animated short film ""Dear Basketball"", a love letter to the sport which brought him fame and fortune.",top-stories,https://www.dailypioneer.com/uploads/2020/story/images/big/nba-legend-kobe-bryant-killed-in-helicopter-crash-2020-01-27.jpg,https://www.dailypioneer.com/2020/top-stories/nba-legend-kobe-bryant-killed-in-helicopter-crash.html
94,27-1-20,"BJP doesn't want to open Shaheen Bagh route, it's doing dirty politics over this issue: Kejriwal","Delhi Chief Minister Arvind Kejriwal on Monday alleged that the BJP does not want to open the Shaheen Bagh stretch of the Kalindi Kunj road where anti-CAA protests are going on for over a month as the saffron party is doing ""dirty politics"" over it.

He said law and order in the national capital entirely lies with the Centre and ""if they are saying that they need permission from me, I am giving them permission, open the road in one hour"".

""I can give you this in writing, BJP does not want to open the route in Shaheen Bagh. The Shaheen Bagh route will remain closed till February 8 (election day) and it will open February 9,"" Kejriwal told reporters.

He further alleged that the BJP just knows how to do ""dirty politics over everything"".",top-stories,https://www.dailypioneer.com/uploads/2020/story/images/big/crime-rate-reduced-in-areas-where-cctv-cameras-installed--kejriwal-2020-01-27.jpg,https://www.dailypioneer.com/2020/top-stories/bjp-doesn-t-want-to-open-shaheen-bagh-route--it-s-doing-dirty-politics-over-this-issue--kejriwal.html
95,27-1-20,No power can stop Kashmiri Pandits from returning to Kashmir: DM,"No power can now stop Kashmiri Pandits from going back to Kashmir, Defence Minister Rajnath Singh said on Monday, forcefully defending the NDA government's decision to reorganise Jammu and Kashmir and abrogating its special status under Article 370.

In an address at a rally here, the Defence minister also sent a strong message to Pakistan and said India will not let anyone live in peace if it is harmed.

""We will not touch anyone, but if someone bothers us, then we are not going to let them live in peace,"" he said.

Referring to the exodus of a large number of Kashmiri Pandits from the Valley in the late 1990s at the height of militancy, Singh said no power now can stop them from returning to their homes.

On the Citizenship Amendment Act, the minister said it is not a law to hurt the sentiments of any religion but to give relief to victims of religious persecution.

Mahatma Gandhi had told Nehru to give citizenship to minorities like Hindus and Sikhs if they come to India and Prime Minister Narendra Modi has fulfilled that vision by bringing in the law, Singh said.

On several non-BJP states refusing to implement the CAA, the defence minister said it it is a central law and everyone should follow it.

Accusing the Congress of misleading people on the issue, he said the party should not forget its duty towards the nation just because it is in opposition.",top-stories,https://www.dailypioneer.com/uploads/2020/story/images/big/no-power-can-stop-kashmiri-pandits-from-returning-to-kashmir--dm-2020-01-27.jpg,https://www.dailypioneer.com/2020/top-stories/no-power-can-stop-kashmiri-pandits-from-returning-to-kashmir--dm.html
96,27-1-20,Keto diet may bring health benefits in short term: Study,"A ketogenic diet -- which provides 99 per cent of calories from fat and protein -- may produce health benefits in the short term, but negative effects after about a week, according to a study conducted in mice.

The study, published in the journal Nature Metabolism, suggests that the keto diet could, over limited time periods, improve human health by lowering diabetes risk and inflammation.

The keto diet has become increasingly popular as celebrities, including Gwyneth Paltrow, and Kim Kardashian, have touted it as a weight-loss regimen, the researchers noted.

The diet tricks the body into burning fat, said lead author Vishwa Deep Dixit from the Yale University in the US.

When the body's glucose level is reduced due to the diet's low carbohydrate content, the body acts as if it is in a starvation state -- although it is not -- and begins burning fats instead of carbohydrates.

This process in turn yields chemicals called ketone bodies as an alternative source of fuel.

When the body burns ketone bodies, tissue-protective gamma delta T-cells expand throughout the body.

This reduces diabetes risk and inflammation, and improves the body's metabolism, said Dixit.

After a week on the keto diet, mice show a reduction in blood sugar levels and inflammation, he said.

However, when the body is in this ""starving-not-starving"" mode, fat storage is also happening simultaneously with fat breakdown, the researchers said.

When mice continue to eat the high-fat, low-carb diet beyond one week, they consume more fat than they can burn, and develop diabetes and obesity, the researchers said.

""They lose the protective gamma delta T-cells in the fat,"" Dixit said.

Long-term clinical studies in humans are still necessary to validate the anecdotal claims of keto's health benefits, the researchers noted.

""Before such a diet can be prescribed, a large clinical trial in controlled conditions is necessary to understand the mechanism behind metabolic and immunological benefits or any potential harm to individuals who are overweight and pre-diabetic,"" Dixit said.

""Obesity and type 2 diabetes are lifestyle diseases. Diet allows people a way to be in control,"" he said.

With the latest findings, researchers now better understand the mechanisms at work in bodies sustained on the keto diet, and why the diet may bring health benefits over limited time periods.

""Our findings highlight the interplay between metabolism and the immune system, and how it coordinates maintenance of healthy tissue function,"" said Emily Goldberg, a postdoctoral fellow at Yale.",pioneer-health,https://www.dailypioneer.com/uploads/2020/story/images/big/keto-diet-may-bring-health-benefits-in-short-term--study-2020-01-27.jpg,https://www.dailypioneer.com/2020/pioneer-health/keto-diet-may-bring-health-benefits-in-short-term--study.html
97,27-1-20,"Nipsey Hussle wins posthumous Grammy, stars pay musical tribute at ceremony","Rapper-activist Nipsey Hussle posthumously received his first Grammy award taking the best rap performance trophy for ""Racks in the Middle"" featuring Roddy Ricch & Hit-Boy.

Members of Nipsey's family accepted the Grammy on his behalf.

""I wanted to thank all of you for showing all the love that I have felt for him all of his life, and will always live in my heart. So thank you, thank you, thank you,"" his grandmother said.

Hussle, whose real name was Ermias Asghedom, was fatally shot in Los Angeles on March 31, 2019. He was 33 years old.

Later in the ceremony, Hussle was honoured by his collaborates DJ Khaled, John Legend, Meek Mill Pay, Kirk Franklin, Ricch and YG.

Director Ava DuVernay introduced the tribute to the rap icon.

""Tonight we celebrate the enduring memory of an artist and a leader who made brave, brilliant strides to unite this community here in Los Angeles and around the world,"" DuVernay said.

Meek and Roddy Ricch started the performance with a new tribute song. It was followed by a spirited rendition of ""Higher"" by DJ Khaled, Kirk Franklin, YG and John Legend on the piano.

The act featured dancers clad in white, with garments paying tribute to Hussle's Eritrean.

At the end of the tribute, a graphic of both Hussle and NBA legend Kobe Bryant was projected on the stage and DJ Khaled took the mic to remember the basketball star, who died in a helicopter crash hours before the ceremony.

The crash also claimed the life of Bryant's 13-year-old daughter Gianna and seven others.",trending-news,https://www.dailypioneer.com/uploads/2020/story/images/big/nipsey-hussle-wins-posthumous-grammy--stars-pay-musical-tribute-at-ceremony-2020-01-27.jpg,https://www.dailypioneer.com/2020/trending-news/nipsey-hussle-wins-posthumous-grammy--stars-pay-musical-tribute-at-ceremony.html
98,27-1-20,Report: Bolton says Trump tied Ukraine funds to Biden probe,"President Donald Trump told his national security adviser he wanted to maintain a freeze on military assistance to Ukraine until it aided political investigations into his Democratic rivals, according to a report in The New York Times on Sunday.

The newspaper said John Bolton's description of his exchange with Trump appears in drafts of his forthcoming book. The revelation challenges the defense offered up by Trump and his attorneys in his Senate impeachment trial and raises the stakes as the chamber decided this week whether to seek sworn testimony from Bolton and other witnesses.

Bolton, who acrimoniously left the White House a day before Trump ultimately released the Ukraine aid on Sept. 11, has already told lawmakers that he is willing to testify, despite the president's order barring aides from cooperating in the probe.

The White House did not respond to a request for comment Sunday night. Trump's personal attorney Rudy Giuliani, who has played a prominent role in the Ukraine affair, replied to a request for comment with a text: “I used to like and respect John and tell people they were wrong about how irresponsible he was. I was wrong.” Democrats need at least four Republicans to vote with them to seek witness testimony. Those prospects looked unlikely in recent days and it's unclear if the new revelations about Bolton's book will sway any GOP senators.

Democrats quickly sought to ramp up the pressure on their Republican counterparts.

“John Bolton has the evidence,” tweeted Senate Minority Leader Chuck Schumer. “It's up to four Senate Republicans to ensure that John Bolton, Mick Mulvaney, and the others with direct knowledge of President Trump's actions testify in the Senate trial.” Senate Majority Leader Mitch McConnell had no immediate comment, according to his office.

The Associated Press has not confirmed the content of Bolton's draft book. A person familiar with the matter told the AP the book had been submitted to the White House for pre-publication review, which is standard for the work of former officials with security clearances. The person insisted on anonymity to discuss the sensitive subject.

The book's publisher, Simon & Schuster, declined to comment.

Sarah Tinsley, an adviser to Bolton, said: “The ambassador's manuscript was transmitted to the White House in hard copy several weeks ago for pre-publication review by the NSC. The ambassador has not passed the draft manuscript to anyone else. Period.”

Bolton attorney Charles J. Cooper said in a statement that the pre-publication review process had been “corrupted and that information has been disclosed by persons other than those properly involved in reviewing the manuscript.”

Democrats accuse Trump of abuse of power in withholding the military assistance to Ukraine to push that country to mount investigations into Democrats, including former Vice President Joe Biden and his son Hunter, who served on the board of a Ukraine gas company, Burisma, while his father was in office.

On Saturday, the president's attorneys said during their opening day of defense arguments that there was no evidence that Trump made the military aid contingent on the country announcing an investigation into Biden.

The Times also reported that Bolton says he told Attorney General William Barr that he was mentioned by Trump on his July 25 call with Ukrainian President Volodymyr Zelenskiy. A Justice Department official on Sunday disputed Bolton's account that he had told Barr about the president's call with Zelenskiy but did say that Bolton had called Barr to raise concerns about Giuliani's shadow diplomacy efforts.

Trump on Wednesday told reporters in Davos, Switzerland, that he didn't want Bolton to testify before the Senate.

“The problem with John is it's a national security problem,"" Trump said. “He knows some of my thoughts. He knows what I think about leaders. What happens if he reveals what I think about a certain leader and it's not very positive and then I have to deal on behalf of the country?” He added: “It's going to be very hard. It's going to make the job very hard.”",trending-news,https://www.dailypioneer.com/uploads/2020/story/images/big/report--bolton-says-trump-tied-ukraine-funds-to-biden-probe-2020-01-27.jpg,https://www.dailypioneer.com/2020/trending-news/report--bolton-says-trump-tied-ukraine-funds-to-biden-probe.html
99,27-1-20,Nine people dead in Kobe Bryant helicopter crash,"Nine people were killed in the helicopter crash that claimed the life of NBA star Kobe Bryant and his 13-year-old daughter, Los Angeles officials confirmed on Sunday.

Los Angeles County Sheriff Alex Villanueva said eight passengers and the pilot of the aircraft died in the accident.

""There were no survivors... There were nine people on board the aircraft, the pilot plus eight individuals,"" Villanueva said.

The helicopter crashed in foggy weather in the Los Angeles suburb of Calabasas. Authorities said firefighters received a call at 9:47 am about the crash, which caused a brush fire on a hillside.

The Los Angeles Times quoted police as saying that weather conditions were such that the Los Angeles Police Department's air support division grounded its helicopters until the afternoon, when the fog lifted.

""The weather situation did not meet our minimum standards for flying,"" said police spokesman Josh Rubenstein.

Los Angeles County Fire Chief Daryl Osby said firefighters had to hike to the site with medical equipment and hose lines to extinguish the blaze.

Los Angeles Mayor Eric Garcetti confirmed that Bryant's daughter Gianna was among the victims.

""L.A. Is grieving with the Bryant family over the loss of Gianna, who perished with her father and friends in today's tragedy,"" Garcetti wrote on Twitter.

Gianna was one of Bryant's four children with his wife Vanessa.

The retired NBA star, 41, and Gianna were flying to a game his daughter was expected to play in when their helicopter crashed, according to US reports. Local media said the other victims included another player and a parent.

Orange Coast College confirmed that its baseball coach, John Altobelli, 56, was also on board the helicopter.

CNN said Altobelli's wife, Keri, and one of their two daughters, Alyssa, were aboard the chopper, as well.

Villaneuva told reporters the authorities would not identify the victims pending notification of family members and identification from the coroner's office.

""It would be extremely disrespectful to understand your loved one has perished and you learn about it from TMZ,"" Villanueva said, referring to the celebrity news website that first broke the news about the crash.

""That is just wholly inappropriate, so we are not going to be going there. We are going to wait until the coroner does their job."" The National Transportation Safety Board said it was dispatching an 18-person team to California to help with the investigation into the crash.

""Our team will be looking at the history of the pilot and whatever crew was on board,"" said Jennifer Homendy, a member of the NTSB.

""We will be looking at maintenance records of the helicopter. We will be looking at records of the owner and operator of the helicopter and a number of other things."" She added that the helicopter was a Sikorsky S-76B that has a black box which investigators will seek to recover.

According to data from flightradar24.Com, a flight tracking site, the chopper took off from John Wayne Airport in Santa Ana at 9:06 am.

It headed northwest, reportedly to Mamba Sports Academy in Newbury Park, about 85 miles (137 kilometers) away.",trending-news,https://www.dailypioneer.com/uploads/2020/story/images/big/nine-people-dead-in-kobe-bryant-helicopter-crash-2020-01-27.jpg,https://www.dailypioneer.com/2020/trending-news/nine-people-dead-in-kobe-bryant-helicopter-crash.html
100,27-1-20,Akshay postpones 'Bachchan Pandey' release after Aamir's request,"Superstar Aamir Khan on Monday thanked actor Akshay Kumar and producer Sajid Nadiadwala for shifting the release date of ""Bachchan Pandey"" to avoid box office clash with his Christmas outing ""Laal Singh Chadha"".

The 54-year-old actor, who will playing the titular role in the movie, an official remake of Tom Hanks' ""Forrest Gump"", took to Twitter to express his gratitude to the team of ""Bachchan Pandey"".

""Sometimes all it takes is one conversation. Thank you to my friends @akshaykumar and Sajid Nadiadwala for their warm gesture of moving the release date of their film Bachchan Pandey at my request. I wish them the very best for their film. Looking forward to it,"" Aamir tweeted.

Akshay, 52, also posted the new release date and poster of ""Bachchan Pandey"" on the microblogging site, saying he is always there for his industry friends.

""Anytime @aamir_khan, we're all friends here. Presenting - new look, new release date. Coming on 22nd January, 2021. In and as #BachchanPandey!"" he tweeted.

""Laal Singh Chadha"" features Kareena Kapoor Khan opposite Aamir, while Kriti Sanon stars alongside Akshay in ""Bachchan Pandey"".",trending-news,https://www.dailypioneer.com/uploads/2020/story/images/big/akshay-postpones--bachchan-pandey--release-after-aamir-s-request-2020-01-27.jpg,https://www.dailypioneer.com/2020/trending-news/akshay-postpones--bachchan-pandey--release-after-aamir-s-request.html
101,27-1-20,Michelle Obama wins a Grammy,"Former US First Lady Michelle Obama won a Grammy for the best spoken word album for ""Becoming"", her best-selling memoir, during the awards ceremony's pre-show.

""Becoming"" was read by Obama in the audiobook.

She was nominated alongside artistes including Michael Diamond and Adam Horovitz, reports Hollywood Reporter.

It was Obama's first Grammy win. She she was previously nominated for ""American Grown: The Story of the White House Kitchen Garden and Gardens Across America"" in 2013.

Obama has joined a list of political winners in the Grammy category including Hillary Clinton, a fellow former first lady, as well as three US Presidents -- Jimmy Carter (who won the award three times), Bill Clinton and Barack Obama, along with spoken recordings of John F. Kennedy and Franklin D. Roosevelt.",trending-news,https://www.dailypioneer.com/uploads/2020/story/images/big/michelle-obama-wins-a-grammy-2020-01-27.jpg,https://www.dailypioneer.com/2020/trending-news/michelle-obama-wins-a-grammy.html
102,27-1-20,Dubai's Burj Khalifa lights up in Indian flag colours,"The Burj Khalifa, the world's tallest building, celebrated the Indian Republic Day by displaying the tricolours on its LED facade.

Colours of the Indian flag lit up the tower at 8.10 p.m. on Sunday, reports the Khaleej Times.

Earlier in the day, the United Arab Emirates (UAE) leadership congratulated Indian President Ram Nath Kovind on the occasion.

The President, His Highness Sheikh Khalifa bin Zayed Al Nahyan, His Highness Sheikh Mohammed bin Rashid Al Maktoum, Vice President and Prime Minister of the UAE and Ruler of Dubai, and His Highness Sheikh Mohamed bin Zayed Al Nahyan, Crown Prince of Abu Dhabi and Deputy Supreme Commander of the UAE Armed Forces, sent messages to Kovind,

Sheikh Mohammed bin Rashid and Sheikh Mohamed bin Zayed also sent similar messages to Indian Prime Minister Narendra Modi.

The day also saw cultural programmes at Indian missions all across the UAE, which was attended by a large number of expats.

",trending-news,https://www.dailypioneer.com/uploads/2020/story/images/big/dubai-s-burj-khalifa-lights-up-in-indian-flag-colours-2020-01-27.jpg,https://www.dailypioneer.com/2020/trending-news/dubai-s-burj-khalifa-lights-up-in-indian-flag-colours.html
