,Date,Title,Article,Category,Image_link,Article_link
17,27-1-20,‘CAA is BJP move to influence polls’,"The brains behind the successful implementation of free coaching under Jai Bheem Mukhyamantri Yojana and many other social welfare schemes of Delhi Government, Social Welfare Minister Rajendra Pal Gautam is contesting election for the second time from Seemapuri seat. Gautam spoke to The Pioneer’s Gayathri Mani on hosts of issues that AAP is banking upon to return to the power in Delhi.

Do you think Aam Aadmi Party (AAP) kept its promises with the youth that it had made in 2015 election manifesto?

Since day one, AAP has kept its promise and about 95 per cent of the promises made by party have been fulfilled. There are some promises which will be completed soon. More than 20,000 rooms have been constructed in public schools which are equal to 5,000 new schools, new engineering institute Netaji Shubhash Technical University has been opened, new education blocks have been opened in the already existing schools and faculties. There is a proposal to start 25 Skill Development Centre’s (SDC), seven are already functional.

What is your take on scholarships to poor students and free coaching to them?

Jai Bheen Mukhyamantri Pratibha Vikas Yojana, started for the Scheduled Caste (SC/ Scheduled Tribe (ST) students but has already been extended to all the students coming Economically Weaker Section. Another programme has been launched recently for the SC, ST students to study overseas in universities abroad. The online process to apply will take about six month to get completed, so we have started offline process so that more students can avail the facility.

What are the main issues in this election?

Pollution is biggest issue in Delhi. I believe, this issue should not be politicised. Pollution will be curbed, if everyone comes together because it is crucial matter which is affecting everyone be it a member of BJP, AAP and common man. Centre and Municipal Corporations is led by BJP and Delhi Government is with AAP, irrespective of one political agenda, we should come together to curb pollution in the national capital.

Seemapuri is underdeveloped area and crime is a major issue here? Do you think Delhi Police has been successful in maintaining law and order in your constituency?

First of all, it is not underdeveloped. All the colonies except few streets and slum clusters are developed and are authorised colonies. Sewer, electricity and water pipeline are laid down including slum areas and sewer lines has been laid wherever is possible. The biggest issues in my constituency are snatching, theft, pick pocketing and selling of narcotics. The area is situated in border and theft incident is increasing and our initiative of CCTV installation has helped to controlled many incidents. But the police have done nothing, I submitted many representations and met both DCP and LG but no action has been taken to curb criminal activities in the area.

What are the promises that you want to make to your voters?

My promise is to make my constituency free from traffic congestion, pedestrianisation and waterlogging issue will be addressed. In the last five years, the police have not done much to curb drug menace in the area. This time we will involve public and take their suggestions to curb such incidents. Adult education will be provided for the drop outs and seminar and counseling will be provided for youths to lead a good life and focus on education.

Do you think AAP Government has done enough than any other previous Government regarding social sectors especially reaching out to the weaker sections?

If you see, the developmental and infrastructure work done in the authorized colony in the last five year, no government has done such work and initiatives. About Rs 8,000 crore have been spent to lay road, sewer and water pipeline in the hundreds of un-authorised colonies. Free coaching under Jai Bheem, Free Bus ride, CCTV is a historic initiative brought by AAP. Sewer cleaning machines to curb manual scavenging and initiatives to clean septic tank by Delhi Jal Board is also in process. No Government can compete AAP in terms of development.

How do you see the demolition of the Sant Ravidas Temple? You blamed BJP why?

Because, the BJP hurts the sentiments of the people by demolishing the ancient temple. When we protested, it allowed 400 meter plot but why it first demolished the temple by hurting the sentiments of people? The opposition did it on purpose to create unrest in the society.

How will the party perform in SC/ reserved seats? You replaced one from Bawana.

The performance of the party will be good and the party will win all the seats. The candidate Jai Bhagwan Upkar who has been given ticket from area is also a strong candidate and has been a counselor. No leader is replaced without a reason; the party sees the work done, takes people suggestion, conducts survey and decides. I welcome the party’s decision and the party will perform well in all the reserved seats. Out of 70 seats, 68 plus is expected.

What is your opinion on NRC and CAA, because Home Minister Amit Shah said people who oppose it are Anti-Dalit?

First, the NRC and CAA is planned move by the BJP to imapct Jharkhand and Delhi elections but it is BJP which will be losing voters. They demolished Saint Ravidas temple. During the protest against the protest, dalits were beaten and arrested and yet they call others anti-dalit. PM Modi says there will be no NRC and Shah says NRC will be initiated. People are scared of NRC more than CAA. There is no need of NRC and CAA. The people who are protesting are Indians not outsiders. BJP wants to take away the right to vote of people, if NRC is amended then dalits, minorities and labour class will be largely affected as they do not have papers to prove their citizenship. About 80 per cent of the people do not have papers and they will be called as refugees and their fundamental rights will be taken, thus CAA and NRC are anti-constitutional acts which should not be amended. It is a tool to divide Hindus and Muslims. Why BJP always creates unrest in the country during elections?",state-editions,https://www.dailypioneer.com/images/logo.jpg,https://www.dailypioneer.com/2020/state-editions/---caa-is-bjp-move-to-influence-polls---.html
18,27-1-20,Kejriwal accuses Shah of insulting people of Delhi,"Aam Aadmi Party (AAP) national convener Arvind Kejriwal on Sunday accused Union Home Minister Amit Shah of insulting people of Delhi during his daily campaigning for the upcoming election.

Kejriwal said in the last five years, the people of Delhi have worked very hard to improve our city. ""Two Crore people of Delhi got together to fix our schools, hospitals, electricity and water supply. But Amit Shah comes daily and makes fun of the hard work of the people of Delhi in the last five years,"" he said.

While campaigning a few days back, Shah said there is no CCTV cameras were installed in Delhi, he said, adding that the next day people sent him a CCTV recording in which he was seen. ""How many cameras have you installed in Delhi? Not even one right? Instead of making fun of the people of Delhi, it would have been better if your central government had also installed some cameras in Delhi,"" he said.

Talking about the achievement of the AAP Government, he said ""Delhi’s Government schools had a pass percentage of 96 per cent this year. The parents of these children worked hard with the children staying awake all through the night. 65000 teachers of Delhi government worked hard on the children,"" he said.

""In the history of India, no state has ever had a pass percentage higher than 96 per cent in government schools. Other states of the country have results in the range of 40to 50 per cent. People of Delhi are proud of their children’s success,"" he added.

Referring the statement of Home Minister in which he said that the state of education in Delhi is very poor, he said ""When children and teachers saw this statement on TV, they felt very bad. Many parents came to me and said that they felt very bad when they heard your statement. What would have been good politics is if you had learned from the people of Delhi and improved the schools of UP and Haryana as well. Why go so far? You should fix the school of MCD first,"" he added.

Hitting out at Home Minister, the Chief Minister said ""Your people are saying that the people of Delhi are ‘bikau’ because Delhiites get free electricity, water, bus service, schools and hospitals. Due to the policies of your central government, there is so much inflation in the country. It has become difficult for a common man to survive. So if the government of Delhi made people’s electricity, water free to give them some respite from inflation, does it make the people of Delhi ‘bikau’? This is absolutely wrong.""",state-editions,https://www.dailypioneer.com/images/logo.jpg,https://www.dailypioneer.com/2020/state-editions/kejriwal-accuses-shah-of-insulting-people-of-delhi.html
19,27-1-20,"Goel to hold padyatra, to stay in slums","In a bid to garner votes and retain power in Delhi Assembly elections 2020, the Bharatiya Janata Party (BJP) leader Vijay Goel will conduct padyatra and do night stay in the slum clusters located around Mayur Vihar area on Monday in support of BJP candidate Ravi Negi.

Goel had also recently stayed at Choona Bhatti Jhuggi, Keerti Nagar. ""Aam Aadmi party (AAP) has lied through its teeth and all there false claims fall apart when one visits these Jhuggis.

There is a lack of basic amenities such as proper facilities for water or toilets.

He claimed that his party has surveyed around 200 jhuggis of Choona Bhatti and had prepared a report on it.",state-editions,https://www.dailypioneer.com/images/logo.jpg,https://www.dailypioneer.com/2020/state-editions/goel-to-hold-padyatra--to-stay-in-slums.html
20,27-1-20,SC upholds man's life term for killing wife days after buying insurance policy in her name,"The Supreme Court has upheld the life imprisonment of a man for killing his wife in Uttarakhand in 2002, a few days after he had taken a life insurance policy in her name.

A bench of justices Ashok Bhushan and Navin Sinha held that ""all the links in the chain of circumstances pointed to the guilt of the appellant alone"".

The man had alleged that five persons had entered his house in the intervening night of March 24 and 25, 2002 to abduct him and that his wife was shot dead by them when she resisted their attempt.

But he had failed to mention any reason for his ""attempted abduction"" or name any person who tried to abduct him, the apex court noted.

""If the intruders had come to abduct him and his wife had been shot dead after she tried to prevent his abduction, it would have been all the more convenient for the intruders to take him away with them.

No explanation has been furnished by him in this regard,"" the bench said.

The man was convicted by the trial court and the order was upheld by the high court. Thereafter, the convict had approached the Supreme Court.

The apex court further noted that the convict also could not provide any description of the intruders' physical features.

It said there were inconsistencies in the statements made by the convict before the police and the trial court.

""The appellant failed to furnish any plausible defence,"" the bench said, noting that he tried to give false evidence by first raising alleged ""extra-marital affairs"" of his wife and later stating that five intruders had broken into his house to abduct him. It said there was no evidence to prove that people had barged into the convict's house as there were no footprints in the muddy courtyard.

The court further noted that the convict did not mention any reason for his attempted abduction or name any person on the suspicion of enmity or otherwise. PTI

It also took into consideration the statements of his in-laws, who said the convict was very greedy, had demanded money from them and had also taken an LIC policy in his wife's name days before the incident.",india,https://www.dailypioneer.com/images/logo.jpg,https://www.dailypioneer.com/2020/india/sc-upholds-man-s-life-term-for-killing-wife-days-after-buying-insurance-policy-in-her-name.html
21,27-1-20,Indians across world celebrate R-Day,"Thousands of Indians across the world enthusiastically celebrated the 71st Republic Day on Sunday and participated in various cultural events with unfurling of the tricolour and singing of the national anthem.

Indian High Commissioner to Sri Lanka Taranjit Singh Sandhu led the Indian community during the celebrations at the India House on Sunday.

Sri Lankan Prime Minister Mahinda Rajapaksa, along with his wife Shiranthi Rajapaksa, joined the Indian diaspora to celebrate the day organised by the Indian High Commission at the Bandaranaike Memorial International Conference Hall in Colombo on Saturday.

“I would like to wish the Prime Minister (Narendra Modi) and people of India a very Happy 71st Republic Day,” Rajapaksa tweeted.

The High Commission of India in Canberra, Australia, organised the event at

the India House. Celebrations to mark the day were also organised by the Consulate Generals of India in Sydney and Melbourne.

“Consulate General of India Melbourne wishes you all a very #HappyRepublicDay2020. Big ‘Thank You’ to everyone for celebrating this day with us,” it tweeted.

The Indian High Commission in Pakistan celebrated the day with Charge d’affaires Gaurav Ahluwalia hoisting the tricolour and reading out President Ram Nath Kovind’s address.

“High Commission of India in Pakistan celebrated the 71st Republic Day with great enthusiasm and joy,” the Indian High Commission in Pakistan tweeted.

“A cultural programme presented by members of the High Commission of India in Pakistan enthralled the audience. The performances brought out the beauty, diversity and the idea of India contained in the Constitution,” it said. Over 800 people in the Netherlands participated in the Republic Day celebrations organised at the residence of the Ambassador of India to the Netherlands Venu Rajamony in Wassenaar.

The program witnessed the largest gathering of the Indian diaspora, including members of the Surinam-Hindustani community and friends of India who came together to celebrate the day.

In Bangladesh, Indian High Commissioner Riva Ganguly Das unfurled the national flag and read out President Kovind’s address.

“Young Children from the Indian Community presented a cultural programme. Members of the Indian Community participated in large numbers,” the Indian High Commission in Dhaka tweeted.

The Mahar regimental band of the Indian Army, which was specially flown in for the occasion, played the national anthem, a press release issued by the mission said.

In Nepal, members of the Indian community, friends of India and officials participated in the Republic Day celebrations at the Indian Embassy in Kathmandu.

Indian Ambassador to Israel Sanjeev Singla hoisted the national flag and read out the President’s message as he joined the Indian community during the Republic Day celebrations at the Embassy in Tel Aviv.

“71st #RepublicDayIndia brings sunny weather to #TelAviv,” the Indian Embassy tweeted.

“Amb Sanjeev Singla unfurled the tricolour, read the message of the President of India & spoke about growing #IndiaIsrael partnership in areas of #innovation #startups #agriculture #I4f #culture #tourism,” it tweeted.

The Republic Day celebrations at the Indian High Commission in Pretoria, South Africa, started with unfurling of the national flag.

High Commissioner Jaideep Sarkar read out President Kovind’s message to Indians and friends of India who took part in the programme.

Indian Ambassador to Maldives on Sunjay Sudhir hoisted the national flag and led the Indian community to celebrate the day.

Maldivian Foreign Minister Abdulla Shahid took to Twitter to extend greetings on the occasion, saying may the special friendship between the two countries continue to prosper. Members of the Indian community in New Zealand took part in the Republic Day celebrations organised by the Indian High Commission in Wellington.

Hundreds of Indian expatriates took part in cultural events organised by the Indian missions in the UAE.

Indian Ambassador to the UAE Pavan Kapoor hoisted the national flag at the embassy premises in Abu Dhabi.

Consul General of India in Dubai Vipul hoisted the flag at the Indian Consulate.

The Indian Embassy in Japan also organised a cultural programme to mark the day.

Meanwhile, the Indian Embassy in China on Friday cancelled the Republic Day ceremony in view of the coronavirus outbreak.",india,https://www.dailypioneer.com/images/logo.jpg,https://www.dailypioneer.com/2020/india/indians-across-world-celebrate-r-day.html
22,27-1-20,"Maldives, Lithuania extend greetings to India","The Foreign Ministers of the Maldives and Lithuania on Sunday congratulated India on the occasion of 71th Republic Day.

Maldivian Foreign Minister Abdulla Shahid took to Twitter to extend greetings on the occasion, saying may the special friendship between the two countries continue to prosper. “Republic Day greetings to the government and people of India. May the special friendship between the Maldives and India continue to prosper,” Shahid said.

Lithuanian Foreign Minister Linas Linkevicius posted his congratulatory message on Twitter in Hindi.

“I heartily congratulate the people of India on Republic Day. I am very pleased with the powerful and dynamic bilateral relations and cultural and spiritual ties between Lithuania and India,” Linkevicius said, extending warm greetings to his Indian counterpart S Jaishankar and the people of India. Responding to the two leaders, Jaishankar thanked them for their warm wishes in separate messages.",india,https://www.dailypioneer.com/images/logo.jpg,https://www.dailypioneer.com/2020/india/maldives--lithuania-extend-greetings-to-india.html
23,27-1-20,"India donates vehicles, ambulances to Nepal","India on Sunday donated 36 vehicles, including 30 ambulances, to various hospitals and charitable organisations of Nepal on the occasion of India’s 71st Republic Day.

Members of the Indian community, friends of India and officials participated in the Republic Day celebrations at the Indian Embassy in Kathmandu.

Charge d’ Affairs of Embassy of India, Dr Ajay Kumar, handed over keys of 30 ambulances and 6 school buses to the representatives of hospitals, schools and various charitable organisations amidst a special programme to celebrate the Republic Day celebration. Kumar felicitated 14 people, including widow and next of kin of deceased soldiers by presenting cash incentives amounting to a total of Rs 59.70 million (INR 3.73 crore).

The Indian embassy also gifted books to 51 libraries and educational institutions spreading across the country on the occasion. Later in the afternoon, Kumar hosted a reception at the India House, which was attended by Nepal’s Vice President Nanda Bahadur Pun, Foreign Minister Pradeep Gyawali, Minister for Labour Rameshwor Raya Yadav and leaders of various political parties.",india,https://www.dailypioneer.com/images/logo.jpg,https://www.dailypioneer.com/2020/india/india-donates-vehicles--ambulances-to-nepal.html
24,27-1-20,national flag hoisted in UAE,"India’s 71st Republic Day was celebrated in the UAE on Sunday with a host of cultural, patriotic events organised by the country’s missions attended by hundreds of Indian expatriates.

Indian Ambassador to the UAE Pavan Kapoor hoisted the national flag at the embassy premises in Abu Dhabi, followed by singing of the National Anthem.

“Flag hoisting by Ambassador Pavan Kapoor at the Embassy on the occasion of 71st #RepublicDay2020. Over 350 members of the Indian community attended the flag hoisting ceremony. The spirit of patriotism was high,” the embassy said in a Tweet along with photographs of the celebrations.

Consul General of India in Dubai Vipul hoisted the flag at the Indian Consulate in Dubai.

“First Republic Day of India was celebrated in Indian Consulate Dubai with large number of Indian diaspora. CG Vipul @vipulifs unfurled the tricolour and read out President’s message,” the Indian Consulate in Dubai tweeted. Both the heads of the missions read President Ram Nath Kovind’s address on the occasion. Hundreds of expatriate Indians attended the celebrations waving flags and sporting Tricolour attires.",india,https://www.dailypioneer.com/images/logo.jpg,https://www.dailypioneer.com/2020/india/national-flag-hoisted-in-uae.html
25,27-1-20,29K fliers screened till Sunday: Health Ministry,"Over 29,700 passengers from 137 flights were screened for novel coronavirus infection at seven identified airports in the country till Sunday but no positive case was detected, the Union Health Ministry said.

""Total of 29,707 passengers from 137 flights screened. 4,359 passengers of 22 flights screened today. No case of #coronarvirus found till date, "" the ministry tweeted.

Over 100 people have been kept under observation in Kerala and Maharashtra following screening for a possible exposure to novel coronavirus (nCov) as the Prime Minister's Office on Saturday reviewed India's preparedness to deal with any situation amid mounting global concern over rising cases in China.

""In response to confirmed case of #nCoV2019 in #Nepal, India has stepped up vigil in districts bordering Nepal. Health Teams deployed at BOP with Nepal at Jhulaghat and Jauljibi, Dist Pithoragarh, #Uttarakhand,"" another tweet by the Ministry said.

Union Health Minister Harsh Vardhan on Saturday said samples of seven passengers have been sent to the ICMR-NIV laboratory in Pune.

One person each from Thrissur, Thiruvananthapuram, Pathanamthitta and Malappuram and three from Ernakulam are in isolation wards of various health centres in Kerala.

The Union Health Minister has directed multidisciplinary central teams to go to the designated airports in New Delhi, Kolkata, Mumbai, Chennai, Bengaluru, Hyderabad and Kochi where thermal screening is being done.

Vardhan, who held a review meeting to analyse the preparedness for prevention and management of nCoV in India, also spoke to Uttarakhand Chief Minister Trivendra Singh Rawat and assured him of all support for screening at the border with Nepal.

Vardhan has urged the passengers who have a travel history to China since January 1, 2020, to report to their nearest health facility if they experience any symptoms such as fever, cough, respiratory distress, etc.

On Saturday, the Union Health Ministry also issued a fresh advisory asking the passengers to follow certain dos and don'ts if they are in China or travelling or returning from China. The advisory stated that during their stay in China, if they feel sick and have fever and cough, they should cover their mouth while coughing and sneezing, seek medical attention promptly and report to the Indian Embassy in China.

The advisory also said that if they feel sick on flight while travelling back to India from China, they should inform the airline crew about their illness, seek mask and self-reporting format from the airline crew.

In such a case, the advisory said, avoid close contact with family members or fellow travellers and follow other directions of crew and airport health officer.

According to the advisory, 28 cases have been confirmed outside Chinese mainland -- 5 in Hong Kong, 4 in Thailand, 3 each in Taiwan and Singapore, 2 each in Macao, Japan, South Korea, United States and Vietnam, and 1 each in Nepal and France.

Novel coronavirus is a large family of viruses that causes illnesses ranging from common cold to acute respiratory syndromes. The virus, which has so far killed 56 people and affected 1,975 in China, is a novel strain and not seen before.

It emerged from a seafood and animal market in China's Wuhan and is suspected to have spread to as far as the United States.",india,https://www.dailypioneer.com/images/logo.jpg,https://www.dailypioneer.com/2020/india/29k-fliers-screened-till-sunday--health-ministry.html
