,Date,Title,Article,Category,Image_link,Article_link
0,27-1-20,You’re what you say you’re,"In the midst of all the din created by parties that has earned India the dubious title of a divided nation, Delhi stands as a calm outlier. AAP has significantly changed perceptions

I was reading a piece on the popular online platform, Medium. In the said article, I came across an interesting tidbit about an American football coach, Bill Parcells. He has been listed in the “Pro Football Hall of Fame” and is one of the most successful football coaches in the US. While he has won many championships and brought great success to his team, most fans remember him for his famous quote rather than something he had done on the field: “You are what your record says you are.” This is a lovely take on the classic adage, “You are what you say you are.” Both phrases are rooted in real-life experiences. There can be no greater example of it than the prevailing political scenario in New Delhi.

Elections in the national capital are due in February. With the media’s focus on the said polls, it is likely that one may have had a chance to hear about or must have come across the different political campaigns currently at play by various parties in the city. One of the favourite catch phrases for one of the political opponents of the Aam Aadmi Party (AAP) has been “Pakistan.” It’s very hard to escape any mention about it. Whenever any panellist speaks against the AAP on a television debate or otherwise, it is almost inevitable that reference to “Pakistan” is made. This is in stark comparison to the catch phrase of the AAP, which reads: Kaam Pe Vote.

Why is there such a difference in the approach of both parties? To understand this, the phrase, “You are what you say you are” may be of help. When the AAP exploded into the Indian political landscape, it came up with a message that was entirely different from the prevailing political narratives at that time. There was no talk about division along religious or caste lines. Instead, the message of hope that was offered then was that the AAP is in politics to change the narrative and that of the politicians. Communalism or crony capitalism was not on the agenda. Instead, the focus was on “development” and to provide cheaper power and ample water supply to the people of Delhi.

At that time, this mandate was only based on “hope” because back in 2015, the AAP had no prior record in Indian politics. Fast forward it to 2019 and the story is quite different now. Just how different will be dealt in detail later in this piece. The reason why the AAP chose to speak about “development” and aimed to provide basic amenities to the people is simple. Its focus on these issues isn’t one of “obsession” or “identity.” On the contrary, AAP’s belief is that most Delhiites, and for that matter most Indians, do not care as much about what makes them different but what can take them and their children forward. It’s an aspirational view of politics that speaks to not only what it can be about but also how a commitment to this basic principle can help the citizens move forward.

On the other hand, the Bharatiya Janata Party (BJP) has made “Pakistan” its main focus area. Party spokespersons speak little or do not even talk about development. But if one were to ask them about Pakistan, they can write a thesis about our neighbour. This is why BJP leaders have little or no idea about how to improve the state of education or to provide cheap electricity. The BJP’s agenda is to focus on what divides us. Differences abound among Indians; we have different religions, eating habits, climates, spices and different colours. But just because we have differences doesn’t mean that we must be divided.

Our greatest asset lies in “diversity” and Delhi is a microcosm of it where citizens from all across the country have come together to make it their home. I believe that as Indians, we are in unison about at least one thing: We want our children to see a better India than what we have seen until now. Citizens want affordable electricity, a corruption-free Government, good roads and an empowering education system. These formed the foundation of the AAP’s 2019 slogan, Kaam Pe Vote.

While 2015 may have been an election about hope, in 2020, the AAP has asked for votes only on the basis of the work done by it. This is a marked departure from the way its political opponents, who are obsessed with identities, have campaigned. The AAP is obsessed with “work.” This is where Bill Parcells’ quote comes into picture: “You are what your record says you are.”

Since 2015, the AAP has reduced teacher vacancies by over 70 per cent. The party’s focus, which is to improve Delhi’s education system, has been recognised by the world. The fact that 1.4 lakh children in the national capital have been shifted from “private” to “Government” schools is a testimony to the fact that people have recognised and appreciated the work done by it. In the healthcare sector, too, the party has already set up 450 mohalla clinics till December 2019 and has served around two crore people in the city.

The power sector, too, has undergone a transformative change. Delhi is the only State where both domestic and commercial tariffs have reduced and where 24x7 electricity is a reality. Under previous Governments, an increase in tariffs was all but regular. To receive 24x7 electricity was a treasured rarity. Delhi is going the way most Indians want India to go. Its economy is growing and the AAP Government has managed a surplus by reducing leakages and corruption at every level.

I can go on and on speaking about the efforts and results of the AAP in Delhi but this article is about something more than this. It’s about how in 2010, the term, “India” was on everyone’s lips. Great things were expected of us and the entire world looked upon the country to provide them “intellectual” and “human capital.”

We were on the cover of international magazines as an emblem of hope. Now, we are on their covers as an example of a divided nation. A mixture of corruption, incompetence, entitlement from certain political parties and politics of hatred, division and communalism on the part of certain political parties has brought us to this unfortunate moment.

However, all is not lost. Amidst all this din, the fact is that Delhi stands as a calm outlier that has done actual work for the people. It has done so by leaving the task of talking to be done by those who are more adept at it. And when the AAP does speak, it’s about kaam (work) not “Pakistan.” The party believes in the phrase, “You are what you say.” Does anybody not believe us? Have a look at our records and they will speak for themselves.

(The writer is a former IPS officer, a former MP and currently a member of the AAP)",columnists,https://www.dailypioneer.com/uploads/2020/story/images/big/you---re-what-you-say-you---re-2020-01-27.jpg,https://www.dailypioneer.com/2020/columnists/you---re-what-you-say-you---re.html
1,27-1-20,Toxic war of words,"The BJP seems to have lost the plot with its support to rabid statements by party leaders and is in no mood to engage

If the ruling BJP is indeed serious about its outreach to civil society, which it feels is an alien species and needs an education in Bharat Parv, then its methodology of hammering home truths is grossly and crudely misplaced. And at best ends up as an egoistic assumption of what a dialogue should be like — more and more force-feeding, treating questions like malignant spyware and blaming all of the nation’s problems to either Pakistan or Bangladesh. How else does one explain the distasteful transgressions of the BJP candidate for the Delhi polls Kapil Mishra and Bengal BJP in-charge Kailash Vijayvargiya? The former, clearly defying the party diktat to dispel fears on the Citizenship Amendment Act (CAA), likened civil protest spots, like Shaheen Bagh, to mini-Pakistan. He even called the Delhi polls an Indo-Pakistan match, clearly implying Hindutva as India and lumping all sorts of otherness into one disposable basket. The Election Commission, which had overlooked incendiary remarks during the run-up to the Lok Sabha polls last year, has thankfully issued a notice and the Delhi police has lodged an FIR against him. Vijayvargiya, who is to drive the party’s campaign in Bengal, has found out a simpler method of identifying infiltrators that does not need documents at all. He feels people eating flattened rice or chidwa are confirmed Bangladeshis, totally ignoring the fact that all Bengalis have this as a staple snack or that poha is a breakfast favourite even in his home State, Madhya Pradesh. At least, he seems to have dispelled the need to go for an elaborate process of compiling and sorting out the National Population Register (NPR). The point is such racist, misogynist and uncouth statements are not even funny any more. They are dangerously serious considering that they are given legitimacy, either because the party’s top leadership stays silent or because fringe leaders of the Sangh, who were once kept under wraps by the old BJP, have been coopted and rewarded in proportion to their success in disseminating a divisive agenda. What else could explain how even a seasoned senior leader from the old school like Prakash Javadekar had to reduce the Delhi electoral battle to the binaries of who is more committed to Indianness and who is a traitor. He labelled the fight as one between “Bharat Mata ki Jai” and “Jinnah wali azaadi.” One can understand that the BJP has nothing to show as a record of its performance unlike its key opponent Aam Aadmi Party (AAP). Can that, therefore, justify this dog-whistling politics? BJP leaders know that their party cannot match the hyper-localised agenda of Chief Minister Arvind Kejriwal and are, therefore, countering that with an umbrella issue that can generate a swell of emotion, which in the current scenario of identity politics, happens to be the most virulent strain of nationalism. Having been out of power in the city for almost 20 years, most of which had seen high-performing regimes, the BJP can no more claim to champion anything revolutionary. Even its war room expert and Home Minister Amit Shah has not picked up any issues except pledging Rs 1 lakh crore for bolstering infrastructure in the recently regularised colonies. And now that AAP deputy Chief Minister Manish Sisodia has also publicly extended support to the women protesting citizenship laws at Shaheen Bagh, the BJP feels it has drawn out its opponent to an arena where civic issues become somewhat national.

What is frightening though is that in the process, the BJP is dictating the zeitgeist of contemporary politics. Worse, it is changing the DNA of political discourse with a mythologised sanctity of India’s greatness that has been eaten away by all kinds of imposed viruses until the party rescued it. There was a time when Prime Minister Narendra Modi himself reined in party motormouths and had advised them to stay away from media platforms. Now that same man is either painfully silent or sometimes guilty of playing to the gallery. Anyway, his restraint was just in the nature of an advisory and the fact that someone like Pragya Thakur is now a bonafide MP or that Uttar Pradesh Chief Minister Yogi Adityanath is allowed a free run with his religion-specific remarks, proves that they not only have the blessings of higher-ups but are deployed as their prize arrowheads. If the Modi of 2014 was about the ABCs of development, he himself has been rather brazen if his comments of green versus pink revolution (against meat-eaters) and kabristan versus shamshan ghat are any indications. So clearly, toxicity was not just limited to campaign rhetoric. And 2014 was just a stepping stone to get a hold of national consciousness in 2019. Now that the BJP has that at its command, it wants to replicate the Sangh’s vision as a voluntary national will that has nothing to do with science, reason, history or culture. With a new obsession on whom we need to be as Indians, issues like the economy can be easily swept under the carpet or become a secondary concern. The saddest part is that this does great disservice to Hinduism and the tenets of an Indic civilisation.",columnists,https://www.dailypioneer.com/uploads/2020/story/images/big/toxic-war-of-words-2020-01-27.jpg,https://www.dailypioneer.com/2020/columnists/toxic-war-of-words.html
2,27-1-20,Roger that,"With his fightback at Australia Open, Federer is the first singles player to win 100 matches in two Grand Slams

Roger Federer is not just a sporting legend. He is a human story and an inspiration for everybody because he has demonstrated true grit that survival requires in our times, surprising us every time when we feel he has just gone over the hill. And at a time when individual power sports is all about burnouts, Federer has crafted lastability as a credo despite the competition and overcome challenge from millennials. He has produced several great performances over the years. One of those performances came in the match against Australia’s John Millman during the third at the Australian Open 2020 on Friday where the former world number one was looking down and out in the fifth-set super tie-breaker after falling behind with the score of 8-4. However, he showed why he has won 20 Grand Slams in his career by picking up six consecutive points and cementing his spot in the fourth-round at the first Grand Slam of the year. And he did it in a thrilling match that began Friday night in Melbourne and ended after midnight Saturday. Who cares if he is 38 years old when he keeps finding new ways to redefine his greatness?

Unlike other tournaments — such as Wimbledon and the US Open, which play first-to-seven in a tiebreaker — the Australian Open has a first-to-10 format, and Federer fell behind 8-4 early on. So imagine the kind of rallying he had to do with six straight points to win the tiebreaker and the third-round match, 4-6, 7-6 (2), 6-4, 4-6, 7-6 (10-8). With this, he has also become the first singles player to win 100 matches in two different Grand Slams; his Wimbledon 100 happened last year. In his post-match interview, Federer joked that when Millman had that huge lead in the tiebreaker and was two points away from taking the match, he was already preparing himself to offer excuses during his press conference for why he lost. Now we know how he didn’t let his doubts get the better of him. So tennis can still be an old man’s game. Just like life itself.",columnists,https://www.dailypioneer.com/uploads/2020/story/images/big/roger-that-2020-01-27.jpg,https://www.dailypioneer.com/2020/columnists/roger-that.html
3,27-1-20,Listen to the teenage zealot,"One does not have to buy into Greta Thunberg’s apocalyptic angst to see that something has to be done on climate change. Changing to a cleaner energy future is a good thing in itself

An unfamiliar white patina covered our lawn recently, something seldom seen any longer, certainly not here in the South: A frost. For the first time this year, I considered digging out my heavy coat from the depths of the cupboard but it wasn’t really cold enough.

Where have our winters gone? I miss them. No doubt having written those words, the country will freeze for the next month but there is no sign of anything remotely wintry in the long-term forecast anywhere in the country, not just in London. It is hard to recall an old-fashioned winter where it would snow at least two or three times between December and April.

This mild pattern is noticeable across the entire European continent and has been for some time now. In Moscow, the authorities sprayed fake snow around the city centre over the New Year to give the residents a sense of the season. The temperature in the Russian capital last week was 4oCelsius; usually it is -10oCelsius or lower.

I remember visiting Moscow in late January and it was -25oCelsius, with the River Moscva frozen so solid you could drive across it. They used to call it General Winter — weather so ghastly that it was an integral part of Russia’s defences, repelling Napoleon and Hitler, among others. Now it’s not even Lance-Corporal Slightly Chilly.

All the great eastern and central European cities — Berlin, Warsaw, Vienna and St Petersburg — are exceptionally mild, though winter could yet have a sting in the tail. The so-called Beast from the East that arrived late in the season a few years ago temporarily shocked us out of our complacency but it was relatively short-lived and not that exceptional in any case.

Mild Januaries are now the norm. We have a lovely old wooden toboggan that has hardly been put to use since the 1980s, which is the last time I can remember a succession of cold winters. Growing up in Kent in the 1960s and 1970s, heavy frosts and blizzards were an annual occurrence. Not now.

I am reluctant to attribute what might prove to be temporary weather glitches to long-term climate change but there is clearly something going on that cannot be ignored. We don’t have to buy into the apocalyptic angst of Swedish environmental activist Greta Thunberg, on show again in Davos last week, to recognise that something has to be done.

Whether or not you are a sceptic about the impact of carbon dioxide on the climate or question man’s involvement in producing the greenhouse gas, our energy future is a non-carbon one, like it or not. Virtually every Government across the world has committed to this as an overt aspect of public policy and those that haven’t, like China or the US, have a rapidly growing green energy sector poised to exploit the move to a carbon-free future.

If US President Donald Trump wants to be remembered for anything other than being impeached, he would throw his weight behind it because it is happening anyway, even in his own backyard. American greenhouse gas emissions are falling despite his commitment to fossil fuels.

Perhaps Trump would be persuadable if he were to recognise there is a hard-headed economic imperative here. He should listen to someone like Marco Alvera, an oil and gas CEO who understands what is going on and has ideas to address it.

At a conference in Venice at the weekend, he said we should commit to the one clean energy source that is plentiful, easy to transport and getting cheaper to produce. It is all around us, does not have to be drilled out of the ground in parts of the world favoured with the right geology and does not pollute the atmosphere. It is hydrogen, the most widespread element in the universe. Like many businesses reliant upon carbon-based energy, Alvera’s Italian energy infrastructure company, Snam, has no long-term future unless it adapts because its pipelines, compressors and storage tanks will be useless as oil and gas come under pressure from state actors around the world. They can be used for hydrogen instead.

However, this is more than just a commercial calculation. Alvera has published a book compellingly setting out the case for Governments, manufacturers and investors to get behind hydrogen now before they head off down other less-promising blind alleys.

Hydrogen can be burned to drive a turbine, can be piped into homes for boilers, cookers and air conditioners and converted into electricity using a fuel cell to power a car or a lorry. Unlike wind and solar power, it is easily

stored and can generate the intense heat needed by industrial processes including manufacturing steel and cement. The only waste product is water.

True, there is nothing new about the concept. Fuel cells were developed in the mid-19th century and some buses were running on hydrogen in Germany and Britain in the 1930s. There are cars today that have been converted to hydrogen but they are expensive and there is no infrastructure to support them. Manufacturers like Toyota are developing hydrogen cars with their Mirai range but few others are following suit. They should.

In the past, hydrogen has been too expensive relative to fossil fuels but that will change as new taxes are loaded onto coal and gas to meet carbon dioxide targets and the cost of renewable energy continues to fall. No one pretends the transition will be straightforward but if there’s widespread adoption of the technology and the necessary infrastructure, it will become increasingly affordable.

This is a reasoned, not a hysterical, approach. Alvera likes to adapt the argument known as Pascal’s wager to our climate change conundrum. The 17th century French philosopher and mathematician asked what we should do if we had to bet our lives on the existence of God. Pascal posited that the rational response was to behave as though he did exist because we have nothing much to lose if it turns out that he doesn’t but risk eternal damnation if he does.

Climate change is the same. If Greta is right then the consequences of doing nothing are calamitous. But if she is wrong, changing to a cleaner energy future is a good thing in itself and can even generate growth and prosperity. You do not have to be a teenage zealot to see sense in that.

(Courtesy: The Telegraph)",columnists,https://www.dailypioneer.com/uploads/2020/story/images/big/listen-to-the-teenage-zealot-2020-01-27.jpg,https://www.dailypioneer.com/2020/columnists/listen-to-the-teenage-zealot.html
