,Date,Title,Article,Category,Image_link,Article_link
50,27-1-20,"Banking sector is stressed, govt in no position to bail it out: Banerjee","Nobel laureate and economist Abhijit Banerjee here on Sunday said the banking sector in the country is “stressed” and the Government is in no position to bail it out.

Speaking to the media on the sidelines of the 13th Jaipur Literature Festival, Banerjee said the demand slowdown in the automobile sector also shows that people are lacking confidence in the economy.

“Financial sector is the biggest stress point currently. There is no question that the finance sector is something we should worry about, the banking sector is stressed. The government really is not in a position to bail it out, so we are talking about a long process of attrition, that’s going to be costly.

“We also know that due to a demand deficit in the economy, cars and two-wheelers are not selling, and those things are signs of a general fact that people lack confidence that the economy is going to grow fast so they are holding back, they are not spending,” he said.

The author of “Good Economics for Hard Times” added that the slowdown in the economy will also adversely impact poverty alleviation in the country as urban and rural sectors are interdependent.

“Poverty alleviation has been happening mostly on the strength of the fact that urban sector creates low skill jobs, and a lot of rural sector works in the urban sector and sends money back.

“That’s the peak source of transmission of growth from urban sector to rural sector. And as soon as the urban sector slows down the rural sector, the people in construction work don’t have as many jobs. All of that will feed back on the rural sector,” the 58-year-old Indian-American economist said.

Answering to a question — how will economic policies work if people have a lack of trust in the data, he said the government “should worry about this issue” as foreign investors are getting “nervous”.

“They don’t know where they are going, what they are getting into, I mean those are real issues the government should look into. If it wants to have more investment and more involvement in the global economy, then I think it needs to provide the true data to people,” he said.",business,https://www.dailypioneer.com/images/logo.jpg,https://www.dailypioneer.com/2020/business/banking-sector-is-stressed--govt-in-no-position-to-bail-it-out--banerjee.html
51,27-1-20,Keep growing,"Pruning serves a variety of functions, including shaping, removing dead matter and preventing the plants from sagging or drooping, say experts

Houseplants are quick to tell you when they need help. They display discoloured leaves, drooping stems and little or no growth. That usually gives you enough time to make things right. “Plants send signals simply by the way they look,” said Dawn Pettinelli, an Extension educator at the University of Connecticut. “If they aren’t getting enough light, the leaves will yellow or turn brown and they’ll be slow to develop.”

Off-colour leaves also can be the symptom of root problems, insect infestations, irregular soil moisture or unsuitable light conditions or temperatures.

African violets, one of America’s most popular houseplants, don’t like to be cold but also get stressed when it’s too warm. “They’ll start wilting if they’re chilled and they won’t bloom if they’re hot,” Pettinelli said. “Their buds will fall off.”

A good way to rejuvenate many kinds of tired houseplants is by pruning or giving them what some growers dub “horticultural haircuts.” Pruning serves a variety of functions, including shaping, removing dead matter, and cutting back to reduce stem loads and keep the plants from sagging or drooping, said Diana Alfuth, a horticulturist with University of Wisconsin Extension.

But don’t prune too soon. “Pruning can be helpful but it causes growth, so it’s best done in late winter when the days start getting longer and the plants become more active,” Alfuth said. “Pruning then results in strong new growth. Pruning is helpful to keep a plant bushier or to rejuvenate a plant, especially if it has vining type growth.”

Slow-growing or tree-type houseplants are less tolerant of major trimming, she said. Avoid pruning palms, pines and orchids. It also provides an opportunity to take cuttings — segments from the stems, leaves or roots — to develop new plants.

Some houseplants are more tolerant of neglect and need less maintenance than others. “Succulents are great because they can go without water for long spells and they grow slowly so rarely need pruning or re-potting,” Alfuth said.

A houseplant’s diet is important and so is the timing of fertiliser applications. “Houseplants should not be fertilised during winter when days are short,” Alfuth said. “Fertilise in late winter as days get longer and plants wake up and will need fertiliser to put on growth during spring.”

Houseplant maintenance doesn’t need to be confined to spring cleaning. “It can be done any time of the year but a good way to remember it is by making it a New Year’s resolution,” Pettinelli said.

Don’t forget to dust. “When plants start touching the floor, they start collecting dust,” Pettinelli said. “If covered with dust, photosynthesis is reduced and the plants start losing some of their chemical energy for growth.”

Be careful not to overwater, which is one of the leading causes of houseplant losses. “Plants lose oxygen when they get too much water,” Pettinelli said. “Especially the roots. They’ll drown.”

Check to see if your plants are root-bound and need re-potting. If so, then buy larger containers and fill them with loose potting soils mixed with perlite or peat moss. Be sure the pots have holes cut in the bottoms so any excess water can drain out.",vivacity,https://www.dailypioneer.com/uploads/2020/story/images/big/keep-growing-2020-01-27.jpg,https://www.dailypioneer.com/2020/vivacity/keep-growing.html
52,27-1-20,Bridging the gap,"Modern society might have surpassed many crossroads but real progress can only be attained when science and spirituality go hand in hand, says Rajyogi Brahmakumar Nikunj Ji

Without religion, science is lame and without science religion is blind, Albert Einstein once said. Most of us would agree with what he said. Undoubtedly, the modern society has surpassed many cross roads but real progress can only be attained when both science and spirituality travel together.

Though science has advanced vastly but it cannot answer why; instead it answers how on the basis of additions and subtraction. These form the root of all mathematical explanations. For example, why did Newton’s apple come down and did not go up? Science answered that gravity of the earth pulled it towards its centre. It explained the mechanism of falling, hence, it answered how, but not why. Similarly, if an object is pushed by another object, it moves forward and science explains the phenomenon as: applied external force causes the movement of objects. Again science answers the mechanism of separation. Hence, it answers how, not why. Why the application of force causes movement? Science cannot answer this. Two stones when rubbed together produces heat. But why? Science says that the haphazard movement of atoms and electrons generates heat. Here also the reasons for mechanism of heat production are not explained.

Now, think for a while that what could be the answer to this why? Well, the answer is that whatever comes in this material world is fixed or pre-destined. So the roles that we all are playing in this world is prefixed. One might ask that what is the proof about it? To begin with, we exist only in the present and not in the past or the future. The anticipated future might soon become the present. And the present turns into the past within a stipulated time period. The past is not physically but it is subtly existent. The future is neither physically nor subtly existent but is merely an imagination.

We all have experienced the magic of films on a celluloid where the series of pre-built pictures touch the light beam of a projector machine chronologically and ultimately, live and animated pictures are produced on the screen. Fixed and readymade past goes animated and returns as a live and existent present. Anything that has a beginning must have an end. It proves that the world drama is fixed. If it runs ahead and does not stop after the end, the past will appear as the present.

In spiritual parlance, one complete cycle of world drama is called a Kalpa in which the almighty plays the role of a director and the body takes different births and re-births in this world drama.

What each one is doing is fixed in the world drama and what is fixed is being done by each one. God, being the director, advises every actor (human beings) to think good, do good and play their role in the best manner possible so that it becomes glorious and memorable in entire cycle of life.",vivacity,https://www.dailypioneer.com/uploads/2020/story/images/big/bridging-the-gap-2020-01-27.jpg,https://www.dailypioneer.com/2020/vivacity/bridging-the-gap.html
53,27-1-20,Master the awkward financial talk,"Avoiding conversations around managing money with family often yields worse results than simply facing them head on. Here are some tips that will help you get through such discussions

Money, it’s a gas. Unless you need to borrow some from your parents. Then it’s a conversation many adults will avoid at all costs, even if it means paying for groceries with couch nickels.

That’s not the only money conversation we avoid. More than 60 per cent of millennials have never asked for a raise, largely because they don’t feel comfortable doing so, according to the salary data site PayScale. In many couples, partners hide debt, sometimes to the detriment of their relationship.

Avoiding these conversations often yields worse results than simply facing them head on. These tips will help you get through tough money talks, like asking your parents for money, negotiating your salary and talking to your partner about money.

ASKING YOUR PARENTS FOR MONEY

Even bonafide adults need help from the bank of mom and dad sometimes. In fact, 70 per cent of young adults (ages 18 to 34) received financial support from their parents in the past year, according to a 2018 survey by Merrill Lynch.

Asking your parents for money can be humbling, but swallowing your pride is better than letting your car insurance lapse. Here’s how to approach the conversation.

— Be specific. Tell your parents where you could use their help, whether it’s covering some (or all) of your rent, paying your car insurance, or buying groceries. Say upfront if you need ongoing help, rather than going back to them each month for more money.

— Own your mistakes. This will play better than blaming other people or circumstances, says Nathaniel Ivers, an associate professor in the department of counseling at Wake Forest University.

— Present a plan. Create a budget to show your parents that you are trying to get your finances under control. Ask for their input and avoid getting defensive if they scrutinize your spending.

Taking this advice into account, Ivers suggests your ask could sound something like this: “I was wondering if you could help me with my rent this month. I had a lot of unforeseen expenses (give examples) and, honestly, I didn’t manage my expenses as well as I could have. I have already started a budget to monitor things more closely. Would you be willing to go over it with me? It’s kind of tight, but if I cut down on some of the extra things, I will definitely have enough to cover things next month.”

TALKING WITH YOUR PARTNER ABOUT DEBT

Debt is a reality in most relationships, so it’s wise to disclose any you carry when things get serious. Ripping off the debt Band-Aid may be terrifying, but it can ultimately strengthen your bond, says Marla Mattenson, a relationship expert.

“The more comfortable you get about talking about your finances together, the easier it will be for you to discuss all the challenges that arise in a relationship,” Mattenson says.

Ask your partner to set aside time to chat and give them a heads up on where the conversation is heading, she adds. Keep it simple, something like: “Can we set aside 30 minutes sometime this week to talk about my personal finances?”

Be transparent during your conversation about how you got into debt, whether it’s student loans, credit cards or a combination of the two, and articulate your plan to pay off your debt. You should also share with your partner any fears you have about how this might affect your relationship.

NEGOTIATING SALARY

Your salary serves as the basis for future raises and job offers. That’s why negotiating your salary — at the outset and throughout your tenure — is critical. Here’s how to approach the conversation.

— Research industry salary. Use sites like Glassdoor to research salaries by city and company and ask people in your network what someone with your experience can expect to earn. If you’re comfortable, talk to current coworkers about their compensation when angling for a raise.

— Bring a list of wins. Come to the conversation armed with tangible examples of how you’ve added value to the company (if you’re asking for a raise). Prepare a list of business you’ve brought on, successful campaigns you’ve run or other metrics you’ve moved. If you’re negotiating for a new job, articulate how your skills and experience will add value to your new employer.

— Be prepared for a ‘no.’ If your boss declines your raise request, ask for an explanation. Welcome any recommendations for how to improve your performance and set the expectation that you would like to revisit the conversation in the coming months. When negotiating for a new job, find out if there is any wiggle room and consider negotiating for benefits like more vacation time in lieu of a higher starting salary.",vivacity,https://www.dailypioneer.com/uploads/2020/story/images/big/master-the-awkward-financial-talk-2020-01-27.jpg,https://www.dailypioneer.com/2020/vivacity/master-the-awkward-financial-talk.html
54,27-1-20,"After Padma Vibhushan, Mary dreams of Bharat Ratna","The first woman sportsperson to be decorated with the Padma Vibhushan, celebrated boxer MC Mary Kom on Sunday said she hopes to win the Bharat Ratna by winning a Gold at the Tokyo Olympics.

“It is a dream to win the Bharat Ratna. With this award (Padma Vibhushan) I will now be inspired to do even better with the thought that I can win the Bharat Ratna,” Mary Kom, 2012 Olympics Bronze medallist and a six-time world champion, told reporters.

“Sachin Tendulkar is the only sportsperson to have won it and I hope to become the second one and the first woman. I want to emulate Tendulkar and I get inspiration from him.”

The 36-year-old Mary Kom, however, said her immediate target is to first qualify for the Olympics and then she would think about the “colour of the medal”.

“My immediate target is to first qualify for Olympics and then I will think about the colour of the medal. If I qualify and win a Gold in Tokyo I hope to get the Bharat Ratna. To be honoured with Bharat Ratna will be the pinnacle of achievement and recognition for not only a sportsperson but also for any Indian,” she said.

Asked how she felt to be the greatest Indian woman sportsperson ever, Mary Kom said, “I think I have brought so many laurels for the country and the only thing remaining is a Gold medal in the Olympics.

“I want to shine for the country. Tokyo is likely to be my last Olympics. I don’t know whether they (BFI) will allow me to participate in next Olympics (2024) at 40 years of age so this one is really important. I want to win a Gold medal for my country in the Olympics,” she said.",sports,https://www.dailypioneer.com/images/logo.jpg,https://www.dailypioneer.com/2020/sports/after-padma-vibhushan--mary-dreams-of-bharat-ratna.html
55,27-1-20,Bayern cut Leipzig’s lead,"Robert Lewandowski hit his 21st league goal of the season as Bayern Munich thrashed Schalke 5-0 to cut RB Leipzig’s lead at the top of the Bundesliga to one point on Saturday.

After Leipzig had crashed to a 2-0 defeat at Eintracht Frankfurt, Bayern seized the chance to trim the advantage with an emphatic win over David Wagner’s young Schalke side.

“The Leipzig match beforehand didn’t interest me, the main thing is we took three points and had a stability in our game which is very important,” said Bayern coach Hansi Flick.

Lewandowski and Thomas Mueller scored first-half goals, then both had efforts disallowed for offside by VAR.

However, Leon Goretzka, Thiago Alcantara and Serge Gnabry netted second-half strikes as Bayern dominated at the Allianz Arena.

With less than six minutes played, Schalke goalkeeper Markus Schubert failed to deal with a cross and Lewandowski was on hand to hook the ball into the net.

The Polish star moved one clear of Leipzig’s Timo Werner at the top of the Bundesliga scoring charts.

Schalke’s Welsh forward Rabbi Matondo hit the crossbar soon after, but it was all Bayern after that.

Mueller fired home Goretzka’s header two minutes into first-half stoppage time.

It was Mueller’s 100th goal at the Allianz Arena.

The hosts came out flying after the break as Goretzka volleyed home against his former club on 50 minutes.

Lewandowski served up a simple tap-in for Alcantara eight minutes later as Schalke offered precious little resistance before Gnabry came on and marked his comeback from injury with a late fifth goal.

“It wasn’t fun for us and it wasn’t nice, but we’ll learn from that,” said Wagner.",sports,https://www.dailypioneer.com/images/logo.jpg,https://www.dailypioneer.com/2020/sports/bayern-cut-leipzig---s-lead.html
56,27-1-20,‘Phenomenal’ Liverpool too good for City: Pep,"Manchester City manager Pep Guardiola conceded the Premier League title to Liverpool and believes no team in the world would be able to stay with the European champions this season.

Liverpool are well on course for a first league title in 30 years as they lead City by 16 points with a game in hand after winning 22 and drawing one of their 23 games.

City have won back-to-back titles with a combined 198 points, denying Liverpool last season despite Jurgen Klopp’s men posting 97 points — the third highest tally in top-flight English football history.

“Liverpool obviously will be champions of the Premier League, but they would be champions in Spain, champions in Italy, champions in Germany,” said Guardiola.

“They would be champions everywhere after 23 games, 22 victories, 1 draw.”

City have lost five league games this season, but Guardiola defended their record by pointing out it would still be good enough to mount a title challenge in Europe’s other top leagues.

“In the recent past when Chelsea won the league, the next season, they didn’t qualify for the Champions League, Leicester the same and Chelsea again the same. When we won the league we repeated the league,” added Guardiola.

“In Spain with the points we have we would be there, one or two points behind the leader, in Germany we would be there, one or two points behind the leader, in Italy as well.

“But Liverpool are just fantastic, phenomenal, overwhelming. So we have to accept it and learn from that.”

Guardiola won three league titles in a row at Barcelona and Bayern Munich, but believes the mental strength to bounce back of his current squad is just as good as any he has coached before.

And City could still end the season with three trophies as they look to defend the FA Cup and League Cup and take on Real Madrid in the last 16 of the Champions League next month.

“Honestly, it is one of the best I have ever handled or faced in my career for how they react in the bad moments,” he said.

“The numbers, the results, not just in this season, I think are good. Even in the previous seasons I think it was phenomenal. That is why I am so proud.”",sports,https://www.dailypioneer.com/images/logo.jpg,https://www.dailypioneer.com/2020/sports/---phenomenal----liverpool-too-good-for-city--pep.html
57,27-1-20,Atletico goal drought continues,"Atletico Madrid’s goalscoring troubles resurfaced as they drew 0-0 at home to a struggling Leganes side that finished with a defender in goal after the dismissal of Ivan Cuellar.

Atletico crashed out of the Copa del Rey in midweek after losing to third-tier Cultural Leonesa, and Sunday’s latest setback would appear to rule Diego Simeone’s team out of title contention.

They are now winless in four games and could finish the day 10 points behind city rivals Real, who travel to Real Valladolid later, ahead of next week’s Madrid derby at the Santiago Bernabeu.

Having sold French striker Antoine Griezmann to Barcelona, scoring goals has been Atletico’s fundamental weakness this season. They have managed only 22 in 21 league games, the same number as Real Mallorca in 17th.

Angel Correa and Alvaro Morata both tested Cuellar in the first half while Recio went close for Leganes with a curling strike that was deflected over by an Atletico Madrid defender.

Substitute Ivan Saponjic headed over for Atletico in stoppage time before Leganes were forced to play the final minutes with left-back Jonathan Silva in goal after Cuellar was shown a second yellow card for time wasting.",sports,https://www.dailypioneer.com/images/logo.jpg,https://www.dailypioneer.com/2020/sports/atletico-goal-drought-continues.html
58,27-1-20,Address policy issues stalling growth: Industry body to FM,"Leading industry body Indian Auto LPG Coalition has sought GST reduction on Auto LPG as well as on conversion kits for gaseous fuels to promote the adoption of clean automotive fuels.

LPG used as fuel in automobiles or Auto LPG, which is among the cleanest alternative fuels with a Global Warming Potential of ‘zero’ is currently taxed at 18 per cent GST. Also, the GST rates on Auto LPG/CNG conversion kits stand at a prohibitive 2 per cent, IAC said.

High GST rates on clean fuels and conversions kits are in complete variance to the government’s stated green mobility push, it said in a statement.

“We seek the attention of Finance Minister Nirmala Sitharaman towards the imminent need for devising friendly policies to allow rapid growth of environment-friendly transport fuels such as Auto LPG. Auto LPG which is being promoted actively by governments across the world is facing discriminatory policies in India. It is taxed at a high GST slab of 18 per cent. Similarly, conversion kits for auto LPG and CNG are placed at the highest slab of 28 per cent which is meant for either luxury goods or demerit items like tobacco products,” said Suyash Gupta, Director General, Indian Auto LPG Coalition (IAC).

IAC said LPG is the most widely used alternative fuel in the world, with a proven track record of improvement in air quality. The global consumption of Auto LPG has risen by over 40 per cent over the past 10 years, fuelled by environmental concerns. Among the key nations that have successfully adopted this green fuel for their transportation requirements are South Korea, Turkey, Poland, Japan, Australia, Italy, Mexico and Russia.

The association said even as India plans a long-term shift to electric vehicles, it is missing out the environmental benefits that can be gained by adopting low hanging fruits like Auto LPG. Investing in a wider basket of clean alternative transport fuels that are more readily available can bring about an immediate improvement in air quality unlike EVs that are still a decade away from becoming commercially viable.

“Apart from the need to lower GST, another critical intervention required is the reform of the Type Approval norms governing conversion to gaseous fuels. The Type Approval norms require companies to renew extremely cost prohibitive Type Approvals for Auto LPG and CNG conversions every three years. This acts as a major hurdle to the industry and has resulted in a rapid dwindling of players in the retro-fitment market. The Type Approval regime must be made industry friendly and its validity must be made perpetual in line with European norms,” Gupta said.

More than 26 million vehicles run on Auto LPG globally, supported by close to 71,000 LPG Filling Stations with global Auto LPG consumption exceeding 26 million tonnes. Emissions of harmful nitrogen oxides (NOx) and harmful particulate matter PM 2.5 are almost negligible for Auto LPG, claimed IAC.

IAC is the nodal body for the promotion of Auto LPG in India. Members of the Coalition include the oil PSUs, private auto LPG marketers, kit suppliers and equipment manufacturers. The coalition works closely with the World LPG Association, Society of Indian Automobile Manufacturers and Automotive Research Association of India.",business,https://www.dailypioneer.com/uploads/2020/story/images/big/address-policy-issues-stalling-growth--industry-body-to-fm-2020-01-27.jpg,https://www.dailypioneer.com/2020/business/address-policy-issues-stalling-growth--industry-body-to-fm.html
