,Date,Title,Content,Category,Image_link,Article_link
152,2020/01/22,Using a Shakespearian technique to voice dissent,"Shakespeare’s prowess to voice dissent through soul-stirring plays which lay bare social and personal truths is still a tool to show resistance. At least in politically sensitive Iran, where artists and writers face many challenges. The Mostaghel, the only formal theatre company in Iran, has been using adaptations of the bard’s plays to depict the state-of-affairs in the country, now on the verge of a war.

The company’s last year offer at the International Theatre Festival of Kerala (ITFoK) was the adaptation of A Midsummer Night’s Dream, which was much lauded. This year, it is back again with Coriolanus, a Persian adaptation of the Shakespearean original that hints at the country’s many turbulent political situations. “We dedicate our play to the people of Iran, who have been oppressed by the rulers for long,” says Mostafa Koushki, the play’s director.

One of Shakespeare’s famous tragedies, Coriolanus is based on the life of Caius Marcious, a legendary Roman leader who was given the name Coriolanus following his success against various uprisings challenging the Roman regime. But his temperament is unsuited for popular leadership and he fails to win the support of his people and loses the position of Consul. He then allies with his enemy Tullus Aufidius and swears to take revenge on his city. The conclusion of this decision was his death.

Mr. Koushiki says a theatre presentation from Iran at this time is not an easy task with tensions mounting in West Asiat after the killing of Iran’s military commander Quassem Soleimani.

“In dictatorial government and totalitarian regimes, sovereignty and the masses join hands in a queer way as the dominant and the dominated. The masses repeat words of the domineer without any thought and the domineer rides on it. This will cause elites, intellectuals and rationalists to be killed, deported or be imprisoned. There is no difference between Third World and Developed countries in this trend,” says Mr. Koushki.

The Mostaghel Theatre Company has more than 10 productions since its formation four years ago. Coriolanus‘s musician Ali Rezania, who effortlessly handled more than half a dozen instruments, was given a huge rounds of applause by the audience.

An Evening with Immigrant from the U.K. and Cheralacharitham, a Malayalam play, were the other two plays staged on Wednesday at the ITFoK.",kerala,https://www.thehindu.com/news/national/kerala/9xjrfi/article30627974.ece/ALTERNATES/LANDSCAPE_615/tv23irantheaer,https://www.thehindu.com/news/national/kerala/using-shakeaspeare-for-showing-dissent/article30626761.ece
153,2020/01/22,Govt. seeks legal opinion to prosecute Devassy,"The State government has sought legal opinion on whether or not to prosecute former Maradu grama panchayat president K.A. Devassy.

Mr. Devassy, an influential CPI(M) leader, had found himself in the eye of a storm after the Crime Branch (CB) ‘reported’ in December that he had ‘played a vital role in the commission of the offences’ related to the illegal construction of four flats in the panchayat.

The agency told the government that Mr. Devassy had actively collaborated with the ‘delinquent’ builders to help them fraudulently acquire, reclaim and construct on ecologically fragile wetland. The builders, later, palmed of the illegally built flats to unsuspecting buyers.

However, the delay on the part of the government to accord sanction to prosecute Mr. Devassy had ‘hobbled’ the agency's efforts to investigate the corruption aspect of the case. In contrast, the government had given the CB sanction to prosecute three local body officials Jairam Naik, P.E. Joseph and Muhammad Ashraf.

The alleged move to save Mr. Devassy from prosecution prompted the Congress-led United Democratic Front (UDF) to take to the streets in protest. Congress leaders also swore to raise the issue in the coming budget session of the Assembly. Hundreds of apartment dwellers, who lost their life’s savings when their flats were dynamited, lent their support to the UDF protest.

Finally on January 20, Additional Chief Secretary, Home, Vishwas Mehta wrote to the Director General of Prosecution seeking his ‘remarks’ in the matter. Mr. Mehta has not set any deadline for receiving the legal opinion.

The agency had sought the permission of the government for sanction under Section 17 (a) of the Prevention of Corruption Act to indict him as a former public servant for conspiracy, cheating and graft. It suspected that a large amount of money had changed hands over a protracted period to facilitate the fraud.

Abuse of power

The agency had also found that Mr. Devassy allegedly abused the power of his office to pressurise panchayat officials to issue building permits overlooking the provisions of the Coastal Regulation Zone notification of 1991, Kerala Municipal Building Rules and other allied laws.",kerala,https://www.thehindu.com/static/theme/default/base/img/og-image.jpg,https://www.thehindu.com/news/national/kerala/govt-seeks-legal-opinion-to-prosecute-devassy/article30626118.ece
154,2020/01/22,Kerala RSS worker arrested for allegedly hurling bomb at police picket in Kannur,"The police on Tuesday arrested a Rashtriya Swayamsevak Sangh worker who allegedly hurled a bomb at a police picket on Ponniyam Nayanar Road in the Kathirur police station limits last week. A police team arrested K. Prabesh, a resident of Malal, from the house of his relative in Coimbatore, where he had gone into hiding. Mr. Nijeesh said he was an accused in several cases of violence.

The police said he hurled the bomb at the picket early on January 16. The post had been established to keep check on political conflicts in the area. Two policemen on duty had a narrow escape as the steel bomb hurled at the post missed the target.",kerala,https://www.thehindu.com/static/theme/default/base/img/og-image.jpg,https://www.thehindu.com/news/national/kerala/kerala-rss-worker-arrested-for-allegedly-hurling-bomb-at-police-picket-in-kannur/article30621639.ece
155,2020/01/22,Kerala govt. to issue land deeds for all applicants,"Revenue Minister E. Chandrasekharan has said that title deeds for all applicants in the State would be issued before the end of tenure of the LDF government.

Speaking after inaugurating a district level pattaya mela here on Tuesday, Mr. Chandrasekharan said that the government would ensure land for all landless tribespeople.

A piece of land for living was not the munificence of anybody but the right of a citizen in a democratic set-up. The inordinate delay by the Forest Department in marking the boundary of the land that was allotted to tribespeople was the major reason for the failure to ensure land to all landless tribal families, he said.

The Forest Department should ensure that the land identified for tribal families was habitable, Mr. Chandrasekharan said. Land deeds were provided to 1,40,000 families in the State in 38 months. When the pattaya melas were completed in five more districts, the number of families would cross 1,50,000, he said.

A.K. Balan, Minister for Welfare of Scheduled Castes, Scheduled Tribes, and Backward Classes, who delivered the presidential address, said that coordinated intervention of the district administration, Forest and Tribal departments was needed to solve land-related issues of the tribal families. As many as 8,051 such families in the district were landless, Mr. Balan said.

He directed the Tribal department officials to adopt steps to provide land to all tribal families in the district in two months.

Mr. Chandrasekharan handed over pattayams (land deeds ) to 500 families belonging to the general category and 496 tribal families.

Possession certificates were issued to 15 tribal families under the Forest Rights Act on the occasion.",kerala,https://www.thehindu.com/news/national/kerala/wkjfk5/article30618540.ece/ALTERNATES/LANDSCAPE_615/22tvwypattayamela,https://www.thehindu.com/news/national/kerala/state-govt-to-issue-land-deeds-for-all-applicants/article30618541.ece
156,2020/01/22,8 tourists from Kerala found dead in Nepal hotel,"A holiday in Nepal turned tragic for a group of friends from Kerala and their families, as eight of them, including four children, were found dead, presumably due to asphyxiation caused by a malfunctioning gas heater in their hotel room.

The deceased have been identified as Praveen Krishnan Nair (39), his wife Saranya (34), their children Sreebhadra (9), Aarcha (8) and Abhinav (7), Renjith Kumar (39), his wife Indu (34) and son Vaishnav (2). They were part of a group of 15 belonging to four families who had travelled to Nepal last week.

They were staying at a hotel in Daman, located in the Makwanpur district, on their way back from Pokhara to catch a flight back to India. They checked in at the hotel on Monday night. Two of the families shared one room, while the others stayed in the second room. The gas heaters were switched on due to the cold weather. The room was bolted from inside and there was hardly any ventilation.

On Tuesday morning, all the eight in the first room were found unconscious. They were airlifted to the HAMS hospital in Kathmandu, where they were pronounced dead on arrival. The deaths are presumed to have been due to carbon monoxide poisoning, caused by a gas leak in the heater.

According to Kannan, Praveen’s cousin, the trip was a sort of get-together for four college friends and their families. Praveen, Renjith Kumar, Jayakrishnan and Ramkumar were batch mates at the Sree Chitra Thirunal College of Engineering, Pappanamcode, from where they passed out in 2004.

Praveen, hailing from Chenkottukonam on the outskirts of the city, was working at a private firm in Dubai. Saranya, his wife, had shifted back in Ernakulam a few years back to complete her M.Pharm, which she would have done in March.

Renjith Kumar, hailing from Kunnamangalam in Kozhikode district, was running an IT company, while his wife Indu was working at a co-operative bank. Their son Madhav, who was sleeping in the other room survived.

Chief Minister Pinarayi Vijayan has expressed deep grief at the deaths. In a statement, he said officials of the Department of Non-Resident Keralites Affairs had got in touch with the Indian embassy in Nepal. After post-mortem, the bodies are expected to be brought here by Wednesday.

External Affairs Minister S. Jaishankar said the Embassy officials were at the hospital providing the necessary assistance. “Our thoughts are with the bereaved families,” he said.

(With inputs from New Delhi bureau)",kerala,https://www.thehindu.com/news/national/kerala/607vgt/article30619928.ece/ALTERNATES/LANDSCAPE_615/Kerala-family,https://www.thehindu.com/news/national/kerala/8-tourists-from-kerala-found-dead-in-nepal-hotel/article30619922.ece
157,2020/01/22,Power generation resumes partially at Moolamattom,"Power generation at the Moolamattom power house resumed partially on Tuesday after it was stopped following a blast at the exit transformer of the second generator on Monday night.

The blast occurred around 9.30 p.m. and the underground station was filled with smoke. Fire and Rescue Services personnel immediately evacuated all staff from the power station.

Two of them, assistant engineer Sampath and contract staffer Abin Ramachandran, were admitted to a private hospital at Moolamattom after they had difficulty in breathing.

A Kerala State Electricity Board official on Tuesday said the other generators were restored to normal power production mode by afternoon. The second generator needed inspection and only an inquiry could ascertain the reasons for the blast. The official said the State would have a shortage of 500 MW in view of the partial disruption in generation. Electricity Minister M.M.Mani on Tuesday visited the power house to take stock of the situation.

The Moolamattom power house of the Idukki reservoir has an installed capacity of 780 MW with six generators of 130 MW each. It meets nearly 40% of the power requirements of the State and is reserved mainly for the peak summer season demand.

2015 and 2011 blasts

In April 2015, a major blast was reported at the circuit breaker and in January 2011 two engineers on duty at the powerhouse were killed in another blast.

A second power station at Moolamattom to meet the requirements of the peak season is under consideration of the government. It is also aimed at reducing the pressure on the present power station where the equipment are over 40 years old and without much upgrade.",kerala,https://www.thehindu.com/static/theme/default/base/img/og-image.jpg,https://www.thehindu.com/news/national/kerala/power-generation-resumes-partially-at-moolamattom/article30619903.ece
158,2020/01/22,Acid attack awareness loses to period biopic,"Three days before the release of Chhapaak — which she starred in and debuted as producer for — Deepika Padukone was spotted at Jawaharlal Nehru University in Delhi. The actor stood alongside those who protested the mobbed violence that occurred a few days earlier. Right Wing supporters called for the boycott of her film on social media: going as far as to post the same image, with the same seats in the same theatre, cancelling those same tickets.

Chhapaak, directed by Meghna Gulzar, has reportedly been made on a budget of ₹40 crore and released to 1,700 screens across the country. But when the film hit cinemas on January 10, it opened to a reasonable ₹4.50 crore net. While some would insist the boycott had some effect, trade analysts say otherwise. “[The opening] is not a low number [for a film like Chhapaak],” says Shailesh Kapoor or Ormax Media, a firm specialising in trade insights. “If the film was really boycotted, it would have opened 15 to 20% lower. The ‘boycott’ actually created a lot of buzz for the film.” Kapoor adds that in spite of being released to a significant number of screens, the film has only been targeted at three to four metro cities. “The masses aren’t getting influenced by politics [when it comes to films],” he adds. “Chhapaak’s target audience has their own opinions of politics.”

The film is entirely led by a woman without an A-lister male star while tackling a niche subject like acid attacks, with little no ‘masala’ entertainment. Take in to account Gulazar’s last film Raazi, which became Alia Bhatt’s first solo ₹100-crore earner. The film opened to ₹7.33 crore net, a little more than Chhapaak, but continued steadily for several weeks. Unfortunately, Padukone’s film has not been able to sustain an increase in revenue collecting a total of ₹29.70 crore net in about 11 days. Chhapaak might be a dampner on Padukone’s career graph, but it’s only in terms of box office success. After all, her last film Padmaavat became the second highest grossing film of 2018 collecting ₹282 crore net. This time, she’s not waiting another two years to appear on the big screen with Kabir Khan’s 83 set to release in October. For now, it’s quite certain that the film will crawl towards a slow second week and end its run with a lifetime earning around ₹35 to ₹40 crore net.

Big competition

On the other hand, Chhapaak’s immediate competition was Tanhaji: The Unsung Warrior, reportedly made with ₹120 crore with a 3,880 screen count. The biographical period film overpowers Chhapaak in mass attraction, budget, scale and even star power with Ajay Devgn and Saif Ali Khan. It’s no wonder then that the film opened at ₹14.50 crore net and continues to pull audiences in its second week earning a total of ₹170 crore net as of this Monday. With disparate subjects and equally different target audiences, it’s not as if the bigger of the two took viewers away from the other. But it’s clear that Tanhaji is the real winner especially considering its performance in Maharashtra which accounts for almost 40% of total revenue. “The film has turned out to be bigger than expected, becoming Devgn’s biggest film to date,” says Kapoor adding that Maharashtra usually contributes to about 20% of a mass film’s collections. Plus, the film has performed well across the board, in single screen and multiplex territories.

With no real competition at the end of Tanhaji’s first theatrical week, it will continue to sustain its collections in week two. This week, Kangana Ranaut’s Panga releases along with Varun Dhawan and Shraddha Kapoor-starrer Street Dancer 3D. The two might just cut short Tanhaji’s wining streak which is predicted to snag an impressive ₹200 crore net before bowing out of cinemas.\

Daily box office collections

Day Chhapaak (revenue in ₹ crore net) Tanahji - The Unsung Warrior (revenue in ₹ crore net) Friday, January 10 4.50 14.50 Saturday, January 11 6.50 19.75 Sunday, January 12 7 25.50 Monday, January 13 2 13.50 Tuesday, January 14 2.5 15.25 Wednesday, January 15 2.5 16.25 Thursday, January 16 1.25 11.25 Friday, January 17 0.75 9.50 Saturday, January 18 1.25 16 Sunday, January 19 1.50 21.50 Monday, January 20 0.45 8.25",movies,https://www.thehindu.com/entertainment/movies/ilgcmk/article30627399.ece/ALTERNATES/LANDSCAPE_615/23bmboxoffice,https://www.thehindu.com/entertainment/movies/acid-attack-awareness-loses-to-period-biopic/article30627401.ece
159,2020/01/22,‘We dance for a cause’ : Shraddha Kapoor and Varun Dhawan on 'Street Dancer 3D',"While shooting for Baaghi 3, fresh out of her experience on Street Dancer 3D, Shraddha Kapoor would do steps in between takes. Even as Kapoor tells me that her favourite styles now are popping and locking and the robot, she sways while seated to demonstrate what she means. “I have always loved dancing,” she remarks cheerfully, “So to be able to live that out in a film is a dream come true for me.” Growing up, Kapoor attended classes by contemporary dance gurus like Shiamak Davar, Ashley Lobo and Terence Lewis. But it wasn’t until ABCD2 (2015), that she decided to do it professionally. “It was my ABCD2 family,” she says when I ask her about her reasons for doing Street Dancer 3D. But the expectations were higher and the training more gruelling this time around. “It was very difficult on the body,” recalls Kapoor. “There were a lot of injuries, there was a physio on set for all of us.”

Against type

The opportunity of playing a character who is passionate, aggressive and arrogant was both new and appealing to Kapoor. Street Dancer 3D’s overconfident Inayat, she points out, is a far cry from the docile Vinnie of ABCD2. At the same time, being a part of Remo D’Souza’s steadily growing dance universe, which provides a platform for many gifted dancers, was greatly inspiring for Kapoor.

For Varun Dhawan, it was a documentary on the Sikh Welfare and Awareness Team or SWAT, a charitable organisation based in West London, that proved to be the real draw. Director Remo D’Souza and writer Tushar Hiranandani discussed it with Dhawan and he says that its subject not only inspired him to come on board but also ended up playing a big part in Street Dancer 3D.

Vim and vigour

Dhawan like Kapoor attests to the long hours of training for the film and speaks of how embodying a dancer meant bringing about changes to one’s body language too. “The challenge is every day. You are not dancing in a regular dance form. You are playing a dancer. So, your behaviour has to be like that. You can’t do anything ordinary… that was taxing and difficult,” he notes.

Dhawan admits that he has always been a dancer. The actor remembers watching broadcasts of Michael Jackson’s HIStory World Tour as a boy and says that he has always admired and tried to ape performers like Prabhu Deva, Govinda, Usher and Chris Brown. However, he is also quick to add, “But not at this level. Not on the reality show competitive level. I am dancing with reality TV stars here.”

Shared legacy

Street Dancer 3D’s trailer seems to indicate that it draws its competitive energy from the age-old and oft-used narrative of the warring subcontinental rivals.

Dhawan agrees that there is an India-Pakistan angle and an associated rivalry since the protagonists are from the two countries, but points out that it is only an angle. “It is not what the film is actually about. We dance for a cause – the rehabilitation of illegal immigrants which is also there in the trailer,” he emphasises.",movies,https://www.thehindu.com/entertainment/movies/8bme06/article30627363.ece/ALTERNATES/LANDSCAPE_615/23bm-pg5-Street-Dancer,https://www.thehindu.com/entertainment/movies/we-dance-for-a-cause-shraddha-kapoor-and-varun-dhawan-on-street-dancer-3d/article30627364.ece
160,2020/01/22,"After #MeToo, Harvey Weinstein’s trial set to open in New York","Harvey Weinstein spawned the #MeToo movement. Now, the former film titan is starring in the biggest trial of its era: a landmark moment in a global reckoning that has empowered women while shining a light on power dynamics in workplaces from Hollywood Boulevard to Main Street.

Opening statements and the first witness testimony are expected Wednesday in Weinstein’s New York City rape trial, where the possibility of life in prison looms for the once-celebrated Pulp Fiction producer now vilified as a predator by scores of women.

Weinstein’s accusers include some well-known actresses who plan to testify or attend the trial and others who are looking to the New York case for a form of justice because their allegations haven’t resulted in criminal charges.

""This trial is so important because the enormity of Harvey Weinstein’s international power and fame offers an opportunity to shine a spotlight on the rampant abuse of power that permeates our culture on a global level,” actress Jessica Barth said Tuesday.

""Not only the outcome of this trial, but the trial as a whole, is precedent setting,” said Barth, a star of the Ted films who says Weinstein once invited her to his hotel suite and demanded a naked massage.

Weinstein’s trial could take more than a month, Judge James Burke said. Judging from an arduous two-week jury selection that netted a panel of seven men and five women, it could be a hotbed of protests and intense media coverage.

Extra court officers have been lining the front of the Manhattan courthouse where Weinstein, 67, has been ambling in and out with a walker that his lawyers say was necessitated by a summer car crash and subsequent back surgery.

In a failed last-minute push to get the trial moved, Weinstein’s lawyers said a flash mob’s chanting, “The rapist is you!” at street level could be heard in the courtroom, 15 floors above.

Adding to the drama, actor Cuba Gooding Jr. is due at the same courthouse Wednesday for a hearing in a case in which several women have accused him of groping. He’s denied all allegations of wrongdoing.

Though dozens of women have accused Weinstein of sexually harassing or assaulting them over the years, his New York trial involves just a pair of allegations- that he raped a woman in a Manhattan hotel room in 2013 and sexually assaulted a different woman in 2006.

Backed by expected testimony from four other accusers, prosecutors will attempt to portray Weinstein as a monster who used his power to ingratiate himself with women, sometimes promising a film role or other career advancement, before sexually assaulting or raping them.

One of them, actress Annabella Sciorra will testify that Weinstein forced himself inside her Manhattan apartment and raped her in 1993 or 1994 after she starred in a film for his movie studio.

While Sciorra’s allegations are outside the statute of limitations for criminal charges, the judge has said her testimony can be used to prove predatory sexual assault charges, which carries a maximum life sentence and requires prosecutors to show a pattern of misconduct.

Weinstein’s lawyers say any encounters were consensual. They plan to go on the offensive, pointing to “dozens and dozens and dozens of loving emails to Mr. Weinstein” they say show he and some of his accusers were in consenting relationships. Defense lawyer Damon Cheronis said some of the women “also bragged about being in a sexual relationship with him.”

Once trailed by whispers in Hollywood circles, Weinstein was met with an explosion of allegations from dozens of women after The New York Times and The New Yorker published separate exposes about his behavior in October 2017.

After opening statements, prosecutors are expected to call a former member of the board of directors at Weinstein’s old movie studio to testify about how the company handled allegations against him.

One issue that has remained unresolved in the trial is the defense’s objection to a juror who wrote an upcoming novel about young women that includes, according to the book’s publicity materials, descriptions of their relationships with predatory older men. If she is removed and replaced as a juror, that’ll leave just two remaining alternates for the trial.

Once the New York trial is over, Weinstein faces additional rape and sexual assault charges in Los Angeles. Those charges were filed this month as jury selection in his New York trial was getting underway.",movies,https://www.thehindu.com/entertainment/movies/r5qvt0/article30625310.ece/ALTERNATES/LANDSCAPE_615/SEXUALMISCONDUCTHARVEYWEINSTEIN,https://www.thehindu.com/entertainment/movies/after-metoo-harvey-weinsteins-trial-set-to-open-in-new-york/article30625311.ece
