,Date,Title,Content,Category,Image_link,Article_link
72,2020/01/22,No pay cut if government employees stage protests after duty hours: Assam Minister Himanta Biswa Sarma,"Government employees including teachers who take part in protests against the government policies after duty hours will not lose pay, Assam Finance Minister Himanta Biswa Sarma said at a meeting with the principals and heads of colleges here on Wednesday. “We cannot prevent anyone from protesting or expressing his or her concerns in a democracy. But that does not mean school, college teachers and other government officers and employees can take to the streets during duty hours. They should not even meet Ministers,” said Mr. Sarma, who handles Education too.

“The pay cut will apply to all — from the clerk to the doctor if duty hours are used for other activities,” he said.

Mr. Sarma also announced a scheme under which some 20,000 students living in hostels would be given ₹7,000 annually to “easing the fiscal burden” on their parents.

“We estimated that a hostel boarder spends about ₹1,400 per month for 10 months excluding two months of holidays. We want to bear 50% of this expenditure and hope to raise it to foot the entire bill.”

He said the money would be deposited in the bank account of each student and the college principals were called for the meeting primarily to work out disbursement with the Finance Department. “We intend to deposit the amount before February 10.”

The Sarbananda Sonowal-led government has been on a sop spree after the violent protests against the Citizenship (Amendment) Act that left six people dead in Assam since December 12-14 last year. These included a one-time grant of ₹50,000 to artistes and technicians who had been leading the protests against the amended citizenship law.",national,https://www.thehindu.com/news/national/other-states/jw1z14/article30578766.ece/ALTERNATES/LANDSCAPE_615/16TH-THGRP-HIMANTA-Biswa-sarma-1,https://www.thehindu.com/news/national/no-pay-cut-if-government-employees-stage-protests-after-duty-hours-himanta/article30625801.ece
73,2020/01/22,"Novel coronavirus: 9,156 air travellers to India screened","A total of 43 flights and 9,156 passengers have been screened for novel Coronavirus (nCoV) illness till January 21 and no cases have been detected through the efforts, the Ministry of Health and Family Welfare said on Wednesday.

Also Read Ministry seeks details of travellers from Wuhan

“We are on alert and our preparedness is sturdy,” said Health Secretary Preeti Sudan. All the States have been alerted about the Ministry’s measures on nCoV reported in China. Passengers travelling from that country were being requested to report to the nearest public health facility in case they felt any symptoms.

“The Ministry has approached all States/UTs [Union Territories] to review their preparedness, identify gaps and strengthen core capacities needed to prepare for, detect and respond to possible outbreaks. Integrated Disease Surveillance Programme has been issued advisory to all States/UTs to pick up any travel related case reported in the community and follow-up contacts of suspect/confirmed cases,’’ said Ms. Sudan.

As part of the measures taken by the Ministries of Health and Family Welfare, and Civil Aviation, a travel advisory had been issued and posted on the Health Ministry’s website. It had also been shared on Twitter.

Also read | What is the source of the new SARS-like disease reported in China?

“The National Institute of Virology, Pune, is fully geared to test samples of nCoV. Ten other laboratories under the Indian Council of Medical Research’s Viral Research and Diagnostics Laboratories network are also equipped to test such samples, if a need arises. Adequate stock of Personal Protection Equipment is being maintained by Medical Stores Organisation,’’ she said.

In this undated handout photograph released by the Ministry of Civil Aviation on January 21, 2020, a thermographic camera screens the head of a man at Indira Gandhi International Airport in New Delhi. | Photo Credit: AFP

The Health Ministry has instructed the Airport Health Organisations in Delhi, Mumbai, Kolkata, Chennai, Bangalore, Hyderabad and Kochi for screening of passengers coming from mainland China. Signages have been put up at prominent locations in these airports for encouraging public about self-reporting of illness. Immigration officers manning the counters have been sensitised. Close coordination is being maintained with the Civil Aviation Ministry to coordinate the screening effort and dissemination of information to inbound passengers through in-flight announcements.",national,https://www.thehindu.com/news/l2crt9/article30626248.ece/ALTERNATES/LANDSCAPE_615/coronavirus-screening,https://www.thehindu.com/news/national/no-novel-coronavirus-case-found-in-india-health-ministry/article30625648.ece
74,2020/01/22,Magsaysay awardee Sandeep Pandey booked for ‘inappropriate comments’ against Savarkar,"Magsaysay Award winner and human rights activist Sandeep Pandey has been booked for allegedly making inappropriate comments against Hindutva ideologue Vir Savarkar.

On Tuesday, national vice president of Hindu Mahasabha Rajiv Kumar filed a complaint alleging that Mr. Pandey made the comments while addressing anti-citizenship law protesters at Aligarh Muslim University on Sunday, police said.

The FIR was lodged at the Civil Lines police station under Sections 153 A (provocation with intent to cause riots) and 505 (1)b (inciting public or community to commit an offence) of the Indian Penal Code.

In his address, Mr. Pandey had also said that the same people who “divided Hindus and Muslims” during the British Raj, are doing it now.

He had claimed that “masked goons” hired by some right-wing organisations have disrupted peaceful protests in Jawaharlal Nehru University, Jamia Milia Islamia and AMU and they were the real culprits behind the violence in these varsities.

Meanwhile, noted historian Irfan Habib has accused Uttar Pradesh Police of using pressure tactics to crush the democratic rights of citizens to protest peacefully.

He said police were behaving in a partisan manner and deliberately trying to suppress dissent.",national,https://www.thehindu.com/news/national/9vffrs/article30625497.ece/ALTERNATES/LANDSCAPE_615/TH22SANDEEPPANDEY,https://www.thehindu.com/news/national/magsaysay-awardee-sandeep-pandey-booked-for-inappropriate-comments-against-savarkar/article30625498.ece
75,2020/01/22,Centre designates Daman as headquarters of the merged Union Territories,"The Centre on Wednesday designated Daman as the headquarters of the merged Union Territories of Daman & Diu, and Dadra & Nagar Haveli.

The Central government has also approved amendments or extension or repeal in the legislations dealing with the Goods and Services Tax (GST), Value Added Tax (VAT) and State Excise.

The decisions were taken at a meeting of the Union Cabinet, chaired by Prime Minister Narendra Modi, an official statement said.

These amendments will lead to ‘Minimum Government, Maximum Governance’ by way of having common taxation authorities, better delivery of services to the citizens by reducing duplication of work and improving administrative efficiency, it said.

These will help in bringing more uniformity in laws relating to GST, VAT and State Excise and it will also help to avoid any legal complications in the levy and collection of GST Tax, VAT, State Excise, including recovery of arrears, it said.

Moreover, the said amendments not only bring uniformity in taxation laws but also strengthen the system of laws, said the statement.

The statement said Daman has been designated as the Headquarters of UT of Dadra and Nagar Haveli and Daman and Diu in view of the merger of the two UTs on January 26, 2020.",national,https://www.thehindu.com/static/theme/default/base/img/og-image.jpg,https://www.thehindu.com/news/national/centre-designates-daman-as-headquarters-of-the-merged-union-territories/article30625097.ece
76,2020/01/22,Anti-CAA protesters baton-charged by police in U.P.’s Etawah,"People protesting against the Citizenship (Amendment) Act (CAA) were allegedly lathicharged by police in a Muslim-dominated area in Uttar Pradesh’s Etawah district.

A video of the incident, where policemen can be seen using batons and chasing away protesters in the area late on Tuesday has also gone viral on social media.

Violence broke out when police tried to disperse the protesters who were on a sit-in since Tuesday morning in Pachraha area, defying prohibitory orders imposed there.

“The police indulged in force against us while we were holding a peaceful protest. Our brothers and cousins were beaten up and we were abused. We were physically tortured. We have a right to protest,” one of the women protesters said.

Responding to the allegations, police said the protesters had staged dharna and were pelting stones, defying prohibitory orders imposed in the area.

Police said they had to use mild force to chase the protesters away. In the video, policemen can be seen entering houses and shops.

The sit-in was organised in solidarity with women protesting at Shaheen Bagh in Delhi against the new legislation.

“Police are citing prohibitory orders to end out protest. What about the large public meetings being held by ministers,” another protester said.",national,https://www.thehindu.com/static/theme/default/base/img/og-image.jpg,https://www.thehindu.com/news/national/anti-caa-protesters-baton-charged-by-police-in-ups-etawah/article30624941.ece
77,2020/01/22,Militant killed in encounter in Kashmir’s Pulwama,"A militant was killed in an encounter with security forces in Pulwama district of Jammu and Kashmir as the operation to flush out ultras in Khrew area entered the second day on Wednesday, police said.

An Army jawan and a special police officer (SPO) were killed in a gunbattle in the area of Tuesday.

The gunbattle had started after cordon and search operation were launched by security forces in the district on Tuesday.

Earlier in the day, Director General of Police (DGP) Dilbag Singh had told reporters that there were reports of presence of two militants in the area.

“The Khrew operation resumed this (Wednesday) morning after being suspended on Tuesday night. So far, there is no confirmation of any militant being killed there... We have reports of presence of two militants there and the search is on,” Mr. Singh had said on the sidelines of a wreath-laying ceremony of the slain SPO Shahbaz Ahmad.

The DGP said operations against militants in the valley have been intensified.

“Counter-terrorist operations in the valley have been intensified, which has created a stir in south Kashmir. There have been half-a-dozen successful operations and they will continue in the same manner. We will work harder for the people and for establishing peace in Jammu and Kashmir,” he said.

Asked about preparations for the Republic Day functions in the Kashmir Valley, Mr. Singh said all arrangements are in place.

“We have done all preparations on the ground. Preparations have been done in all districts of the valley. All security arrangements have been put in place in Srinagar as well. I think all other arrangements have also been done for the January 26 function and this function will take place smoothly,” the DGP said.

On a question about the police using drones for surveillance in Srinagar city, Mr. Singh said they are technical aids that help police.

Drones are a normal technical aid which every police force uses in this age. Jammu and Kashmir Police also uses them to cover law and order situations. I think this is a very good help and drones show us what happens in lanes and bylanes which otherwise is not possible. They tell us about any mischievous activity taking place there, he said.",national,https://www.thehindu.com/static/theme/default/base/img/og-image.jpg,https://www.thehindu.com/news/national/militant-killed-in-encounter-in-kashmirs-pulwama/article30624806.ece
78,2020/01/22,Interpol issues Blue Corner Notice against Nithyananda,"The Interpol has issued a Blue Corner Notice seeking information about controversial self-styled godman Nithyananda, who fled the country amid allegations of rape and wrongful confinement of children.

A Blue Corner Notice is issued by the international police cooperation body to collect additional information from its member countries about a person’s identity, location or activities in relation to a crime.

Earlier, the Gujarat Police had sent a request to the Central Bureau of Investigation, the nodal body for Interpol matters in India, seeking a Blue Corner Notice against Nithyananda, who is facing a rape case in Karnataka and a case pertaining to the illegal confinement of children and minors in Ahmedabad, Gujarat.

“Interpol issued the Blue Corner Notice against the controversial godman this month,” Deputy Superintendent of Police-Ahmedabad (Rural) K. T. Kamariya told mediapersons in Ahmedabad on Wednesday.

Working ahead

Police officials involved in the investigation against the self-styled godman said that they are now working to get the Interpol to issue a Red Corner Notice, a global arrest warrant, against Nithyananda, who fled the country after a rape case was lodged against him in Karnataka.

In November 2019, the Gujarat Police had registered a First Information Report (FIR) against Nithyananda after two girls went missing from his ashram in Ahmedabad.

He was charged with kidnapping and wrongful confinement of children in order to make them collect donations from his followers to run his ashram, which was set up in the premises of a Delhi Public School in the city.",national,https://www.thehindu.com/news/national/other-states/n6yu4l/article30039564.ece/ALTERNATES/LANDSCAPE_615/Nithyananda,https://www.thehindu.com/news/national/interpol-issues-blue-corner-notice-against-nithyananda/article30624632.ece
79,2020/01/22,India drop 10 ranks to 51st position in Economist Intelligence Unit’s Democracy Index,"The latest edition of the Democracy Index spells gloom for India. The world’s biggest democracy slipped 10 places in the 2019 global ranking to 51st place.

The survey published on January 22 attributes the primary cause of “the democratic regression” to “an erosion of civil liberties in the country”.

India’s overall score fell from 7.23 to 6.9, on a scale of 0-10, within a year (2018-2019) — the country’s lowest since 2006. The average global score also recorded its worst value ever, down from 5.48 in 2018 to 5.44, driven by a sharp regression in Latin America and Sub-Saharan Africa, a lesser one in the Middle East and North Africa (MENA) region, and by stagnation in the remaining regions that were covered. The report published on Wednesday by The Economist Intelligence Unit — the research and analysis division of The Economist Group, which is the sister company to The Economist newspaper — records how global democracy fared, analysing 165 independent states and two territories.

The report, A year of democratic setbacks and popular protest, was done by The Economist Intelligence Unit — the research and analysis division of The Economist Group, which is the sister company to The Economist newspaper.

India was graded in electoral process and pluralism (8.67), government functioning (6.79), political participation (6.67), political culture (5.63) and civil liberties (6.76).

The average global score also recorded its worst value ever, down from 5.48 in 2018 to 5.44, driven by a sharp regression in Latin America and Sub-Saharan Africa, a lesser one in the Middle East and North Africa (MENA) region, and by stagnation in the remaining regions that were covered.

The report records how global democracy fared, analysing 165 independent states and two territories.

In the Asia and Australasia region, India ranks eighth, behind Taiwan and Timor-Leste.

The report talks about the repeal of both Article 370 and Article 35A and how ahead of the move, “the government deployed a large number of troops in J&K, imposed various other security measures and placed local leaders under house arrest, including those with pro-India credentials.”

“The government also restricted Internet access in the State,” it notes. It says the NRC exercise in Assam excluded 1.9 million people from the final list, and that “the vast majority of people excluded from the NRC are Muslims.”

While the ruling BJP says that most of the people excluded from the list are immigrants from Bangladesh, the government of that country “denies this”, the report adds. It also cites the critics’ claim that the exercise “targets the Muslim population and will lead to demographic changes along religious lines”.

On the CAA, the report says, “The new citizenship law has enraged the large Muslim population, stoked communal tensions and generated large protests in major cities.”

The Index also categorises India under “flawed democracies”, countries that hold free and fair elections and where basic civil liberties are respected, but have significant weaknesses in aspects of democracy, such as problems in governance, an underdeveloped political culture and low levels of political participation. According to the report, there are only 22 “full democracies” as compared to 54 “authoritarian regimes” and as many “flawed democracies,” that include the U.S.

“Almost one-half (48.4%) of the world’s population live in a democracy of some sort, although only 5.7% reside in a “full democracy”, down from 8.9% in 2015 as a result of the US being demoted from a “full democracy” to a “flawed democracy” in 2016,” it says.

The total score of some 68 countries declined from 2018, but almost as many (65) recorded an improvement. Thailand registered the biggest improvement in score owing to an election in March 2019, which was the first since the military coup d’état in May 2014, while China registered the greatest decline as discrimination against minorities, especially in Xinjiang, intensified, and digital surveillance of the population continued apace.

The report describes the year in Asia as one filled with “drama and tumult,” with Hong Kong being the epicentre of protest in the continent. Globally, “the sheer number of protests spanning different time zones” caught the attention of commentators everywhere, says the report, topped by Norway (9.87) and followed by Iceland, Sweden and New Zealand. North Korea (1.08) figures at the bottom.",national,https://www.thehindu.com/news/cities/bangalore/2hlrqj/article30624343.ece/ALTERNATES/LANDSCAPE_615/24BGPROTESTFLAGCAA,https://www.thehindu.com/news/national/india-falls-to-51st-position-in-eius-democracy-index/article30624354.ece
80,2020/01/22,Congress should be called ‘Muslim League Congress’: BJP,"The BJP on January 22 accused several Opposition leaders of “abusing” Hindus through “appeasement politics” and referred to the Congress as “Muslim League Congress”.

Seeking apology from Congress president Sonia Gandhi and NCP chief Sharad Pawar, BJP spokesperson Sambit Patra said leaders of these parties have used the ongoing protests against the amended citizenship law to “abuse” Hindus.

Ashok Chavan said in a public meeting that the Congress joined hands with the Shiv Sena in Maharashtra because Muslims wanted Congress to stop the BJP, Mr. Patra stated. “This shows the Opposition party has nothing to do with people belonging to other religions, including Hindus,” he said.

Mr. Patra also referred to a statement from an NCP leader to attack the Opposition.

Asked about Congress leader Mallikarjun Kharge’s reported jibe at the RSS for its “non-participation” in the freedom movement, the BJP leader shot back, asking if parents of Sonia Gandhi, who are of Italian origin, had fought in India’s independence struggle.

The Indian National Congress, he said, should be called “Muslim League Congress”.",national,https://www.thehindu.com/news/national/wyqm2m/article30623441.ece/ALTERNATES/LANDSCAPE_615/SAMBITPATRA,https://www.thehindu.com/news/national/congress-should-be-called-muslim-league-congress-bjp/article30623442.ece
81,2020/01/22,22 youths to be conferred National Bravery Awards,"Two youths from Jammu & Kashmir, and a Karnataka boy who guided an ambulance during floods in the State, are among those chosen for the ICCW National Bravery Awards this year, officials said on Tuesday.

The names of the awardees — 10 girls and 12 boys — were announced by the Indian Council for Child Welfare (ICCW) on Tuesday at a press conference here.

Sixteen-year-old Muhammed Muhsin from Kozhikode in Kerala, who drowned while saving three of his friends in the rough sea in April last year, has been chosen for the ICCW Abhimanyu Award posthumously, the officials said.

Kupwara native Sartaj Mohidin Mugal, 16, and Mudasir Ashraf, 19, from Budgam are among the awardees for performing acts of valour in Kashmir in 2019.

“I was on the first floor of my home in Tumina village of Kupwara in October last year, when a shell fired by adversaries hit my house on the first floor and as a result my room was filled with smoke. I immediately jumped from the first floor, and then rushed to the ground floor where my parents and two sisters were,” Mugal said.

“I picked my sister Sadia, 8, in my hands and Sania, 13, held my hands, while my parents ran out of the room, before the damaged house collapsed,” he said.

Mugal has been selected for the ICCW Shravan Award.

Ashraf, from Budgam, had rushed to help people after an Mi-17 helicopter had crashed in a village there.

“The helicopter debris had hit a villager, who caught fire. I tried to douse flames by putting soil on him, but in vain. Help arrived later, but the man could not be saved. I tried very hard,” he said.

Venkatesh, 11, from Karnataka, who guided an ambulance carrying a body and relatives of the deceased during the floods last August, will also receive the award, officials said.

ICCW, an NGO, has been organising these awards since 1957, and has awarded 1,004 children — 703 boys and 301 girls — till last year.

However, in January 2019, sources had said that the Centre had undertaken its own selection process for national children’s awards and dissociated itself from the Bravery Awards given by the Council.

The Women and Child Development (WCD) Ministry had then said it had reinvented the national children’s awards and included bravery as one of the categories under the awards, called the Pradhan Mantri Rashtriya Bal Puraskar, 2019.

Assam boy Kamal Krishna Das, 12, from Assam’s Guwahati who saved his mother, aunt and himself after being thrown overboard a boat in Brahmaputra in September 2018, is also among the awardees.

Das, whose mother, Situmoni Das, a housewife, was present at the press conference, said he aspired to become a doctor.

“I recognised my mother by her bangles when she was drowning in the river waters. I swam back from the shores and then rescued my aunt too. There were nearly 30 people on the boat before they were all thrown overboard,” he said.

Another boy who displayed exemplary courage is Everbloom K. Nongrum, 10, from Meghalaya, who saved two of his friends in separate drowning incidents last year.

A resident of Mawryngkneng village in East Khasi district, Everbloom when asked if he felt afraid jumping into the waters, said, “No, not at all. I will not shy away from saving more lives in future, if it is in my capacity“.

The youngest recipient would be Lourembam Yaikhomba Mangang, 8, from Manipur, who saved the life of a boy who was drowning in Imphal River in March 2019.

Adithya K., 15, from Kerala, who helped rescue over 40 people after the bus they were travelling in caught fire while returning from Nepal, has been chosen for the ICCW Bharat Award.",national,https://www.thehindu.com/news/national/25hq9l/article30623267.ece/ALTERNATES/LANDSCAPE_615/TH22AWARDS,https://www.thehindu.com/news/national/22-youths-to-be-conferred-national-bravery-awards/article30623209.ece
