,Date,Title,Content,Category,Image_link,Article_link
214,2020/01/22,"Raising azadi slogans amounts to sedition, says Adityanath","Raising slogans of ‘azadi’ (freedom) “in the name of protests” will amount to sedition and invite harsh action, Uttar Pradesh Chief Minister Yogi Adityanath said on Wednesday while speaking in support of the Citizenship (Amendment) Act. Addressing a rally in Kanpur, he said “people living on Indian soil will not be allowed to conspire” against the country.

“In the name of dharna and demonstration, if you raise slogans of azadi that were once raised in Kashmir, it will come under sedition and the government will take the harshest action,” said Mr. Adityanath.

The Chief Minister accused the Opposition parties in U.P. of using women and children as proxies to protest against the CAA. “They lack the courage to protest directly because they know we will seize their property if they indulge in arson and vandalism,” he said.

Mr. Adityanath also questioned the women holding sit-ins against the CAA and claimed that they did not know what they were protesting against. He claimed the women were told to gather in the streets by the men in their families while they themselves preferred to “sleep in their quilts” at home.

“Ab inhone ne apne ghar ki mahilaon ko chaurahe chaurahe par bithana prarambh kar diya hai (Now they have started to place their women at all crossroads),” Mr. Adityanath said.

The Uttar Pradesh Chief Minister’s comments come at a time when protesters, mostly women, are holding sit-ins against the CAA and the proposed nationwide National Register of Citizens in Prayagraj and Lucknow.

‘Property will be seized’

The CM also warned those who “burn and vandalise” public property that their property will also be seized. “We will punish them in such a way that coming generations will remember how things are done,” Mr. Adityanath said.

He, however, also mentioned that holding a peaceful dharna and submitting a memorandum was everyone’s right in a democracy.

Targeting the Opposition, Mr. Adityanath also accused it of “speaking the language” of and encouraging the “enemies”.

Referring to the Congress, he said: “For them the country is not important, Hindus are not important, Buddhists, Sikhs, Parsis and Jains are not important. And now even Christians are not important for the Congress. And they have said in one voice that till ISI [Pakistan’s Inter-Services Intelligence] agents don’t get an entry into India, they will oppose the CAA.”",other states,https://www.thehindu.com/news/national/other-states/ixjp6o/article30627850.ece/ALTERNATES/LANDSCAPE_615/DE23-PNORTH2020000108A,https://www.thehindu.com/news/national/other-states/raising-azadi-slogans-amounts-to-sedition-says-adityanath/article30627851.ece
215,2020/01/22,Hardik Patel gets bail in sedition case,"The Ahmedabad sessions court on Wednesday granted bail to Congress leader and Patidar quota agitation spearhead Hardik Patel who was arrested for evading court appearances in the sedition case filed by the Gujarat police.

Additional sessions judge B.G. Ganatra granted Mr. Patel bail on condition that he will cooperate with court proceedings and will not seek adjournment unless there is a genuine reason.

Mr. Patel was arrested after a non-bailable warrant was issued by the court which had observed that Mr. Patel was flouting his bail conditions by not cooperating with trial proceedings and remaining absent.

The court will hear the sedition case on January 24 during which Mr. Patel has to be present.

Last week, the judge issued an arrest warrant against Mr. Patel after accepting the government’s plea against exemption from appearance.

The Ahmedabad police had booked Mr. Patel in a case of sedition in connection with the violence which broke out in many parts of the State following a rally for Patidar quota here on August 25, 2015. Mr. Patel had led the agitation.

The Gujarat High Court granted him bail in July 2016. Subsequently in November 2018, the trial court framed charges against him and others.

Mr. Patel joined the Congress ahead of the 2019 Lok Sabha polls.",other states,https://www.thehindu.com/news/jbkz7r/article30595672.ece/ALTERNATES/LANDSCAPE_615/VBK-HARDIKPATEL-PTI,https://www.thehindu.com/news/national/other-states/hardik-patel-gets-bail-in-sedition-case/article30626152.ece
216,2020/01/22,IPS officer’s harassment charge malicious: Assam Rifles,"The Assam Rifles (AR) has refuted the allegations by an Indian Police Service (IPS) officer that its troops had harassed, assaulted and misbehaved with her during a routine check of vehicles in Manipur’s Tengnoupal district on January 18.

Acting on a complaint by Sub-Divisional Police Officer of Yairipok Anupama, copies of which were submitted to the Governor Najma Heptulla and Director General of Police L. M. Khaute, the Manipur State Commission for Women (MSCW) on Monday summoned an Assam Rifles jawan identified as P. K. Pandey. The panel also sought suggestions from the National Commission for Women and State Chief Minister N. Biren Singh.

In a statement received late Tuesday night, Assam Rifles said the police officer’s allegations that she was “assaulted, harassed and molested” at the Khudengthabi Check Post were baseless and malicious. It said the SUV (sports utility vehicle) the police officer was in had bypassed the designated scanning lane and jumped the vehicle queue at the check post around 2 p.m. on that day. The vehicle had come from Moreh, a town on the Manipur-Myanmar border.

‘Normal action’

“The vehicle was stopped by the AR troops and the passengers were asked for their identification, which is the normal course of action at the check post. On being enquired about the identity of the passengers and reasons for bypassing the scanning and jumping the queue, the officer along with armed male escorts who were in civil dress started arguing in an ignoble and indecorous language which is unbecoming of a uniformed soldier,” the statement said.

This was possibly with the aim of avoiding checking of the unidentified and suspicious stores loaded in the vehicle, the statement said.

Apart from refusing to divulge her identity and behaving rudely, the police officer started clicking photographs of the check post, to which rifleman Pandey objected. However, she persisted and continued clicking photographs, which is against the laid down norms, the statement said.

The AR said the police officer and her escorts were carrying their personal weapons without any escort vehicle, outside her area of jurisdiction. “Had she cooperated with the security forces and provided the identity as asked, such an unwarranted incident as claimed by her could have been avoided,” a spokesperson of the paramilitary force said.

Movement of such vehicles with occupants in civil dress carrying weapons in a vulnerable area and without prior intimation to other security agencies has serious operational ramifications, the AR said, adding that video footage of the incident at the check post would be released at an appropriate time.

‘On official duty’

Though Ms. Anupama maintains that she was on official duty, the AR is in possession of video clippings showing her and her party entering two towns across the international border, Namphalong and Tamu, and bringing some “suspicious items”, which falsify her claim of being “on official duty”.

It has been pointed out that senior officers of the AR tried to bring about a compromise. Instead of extending cooperation to the officers “she [Ms. Anupama] insisted on hitting the rifleman Pandey ten times with a shoe” for accepting his apology.

It further added that since the incident took place in the presence of people and several agencies, it was not possible that the officer and her team were “assaulted”.

‘Law takes course’

The Manipur Chief Minister N. Biren, who holds the State’s Home portfolio, has said that the law will take its own course, “now that a First Information Report (FIR) has been lodged with the police”.

The MSCW and several women’s organisations have condemned the incident and demanded appropriate action against Pandey and four other personnel named in the FIR.

[Inputs from Iboyaima Laithangbam in Imphal]",other states,https://www.thehindu.com/static/theme/default/base/img/og-image.jpg,https://www.thehindu.com/news/national/other-states/ips-officers-harassment-charge-malicious-assam-rifles/article30625051.ece
217,2020/01/22,"Will a person be declared foreigner, then allowed to apply for citizenship, asks Mamata in anti-CAA jab","West Bengal Chief Minister Mamata Banerjee, who took her fight against the CAA and the proposed NRC to the Darjeeling hills on Wednesday, sought clarifications from Union Home Minister Amit Shah on the clauses of the new law, even as she accused the Centre of spreading lies on the issue.

Addressing a rally after leading a mega 4-km-long protest march through the serpentine roads of this Himalayan town, Ms. Banerjee said the Centre is trying to push CAA only in non-BJP ruled states.

She claimed all states except West Bengal have attended the meeting on the National Population Register (NPR) in New Delhi due to fear of BJP-led Union government.

Explained: What connects the NPR, NRIC and Census?

“Every day the Union home minister is giving new sermons. Yesterday he said that we (opposition parties) are misleading the people. I would like to ask him to clarify whether a person will be declared foreigner and then allowed to apply for citizenship under the CAA,” Ms. Banerjee said, addressing the rally in Hindi.

Reiterating that the CAA, the NPR and the NRC won’t be allowed in West Bengal, Ms. Banerjee said before forcing any citizen out of the state, the BJP “has to throw her out” first.

“Due to NRC in Assam, lakhs of Gorkhas have been rendered homeless. We will not allow that to happen in Darjeeling as long as I am here,” she told the rally in Chowkbazar area.

Ms. Banerjee’s comments come a day after Mr. Shah had accused the opposition parties of “misleading” people on the Citizenship Amendment Act (CAA) and said that the law will not be scrapped despite protests over it.

The Trinamool Congress supremo, who has been at the forefront of anti-CAA agitations, has led ten protest marches and addressed six rallies in various parts of the state since the issue snowballed into a major political firestorm last December.",other states,https://www.thehindu.com/news/national/other-states/clfxrd/article30624546.ece/ALTERNATES/LANDSCAPE_615/PTI1152020000219B,https://www.thehindu.com/news/national/other-states/will-a-person-be-declared-foreigner-then-allowed-to-apply-for-citizenship-asks-mamata-in-anti-caa-jab/article30624547.ece
218,2020/01/22,BJP’s outreach programme to J&K is nothing but a hoax: Tarigami,"The Jammu and Kashmir unit of the Communist Party of India (Marxist) (CPI(M)) on Wednesday launched a scathing attack on the Bharatiya Janata Party (BJP) over its public outreach programme in the Union Territory, saying that the move to parachute 36 ministers is a propaganda in panic mode, as the party has failed on every count throughout the country.

“What is the need for the BJP ministers to visit J&K when the government claims everything is normal? Reality is that they want to sell Kashmir’s ‘normalcy’ and ‘all is well’ story for those in mainland India who are ignorant about Kashmir’s ground realities,” senior CPI(M) leader and former legislator M.Y. Tarigami said in a statement.

Reacting to the statement of Union Minister Mukhtar Abbas Naqvi in Srinagar — that his government’s outreach programme is aimed at resolving all the issues confronting people in Jammu and Kashmir, Mr. Tarigami said that the visit is ‘nothing, but a hoax.’

“Did the BJP government assess what has befallen on people of J&K after abrogation of Article 370? How the economy of J&K got shattered due to its misadventure,” Mr. Tarigami said, adding that the abrogation of Article 370 was an assault on the Constitution of India.

Also read | Mukhtar Abbas Naqvi begins Centre’s Kashmir outreach

In the aftermath of the abrogation of Article 370 provisions and bifurcation of the erstwhile state into Union Territories in August last year, the Centre launched a major week-long public outreach programme on January 18, to make people aware about the benefits of the move and to disseminate information about the implementation of its policies and programmes for the overall development of Jammu and Kashmir.

“If the BJP claims that its misadventures will bring development to J&K, let it put its report card for last six years in Parliament. Since 2014, the BJP is in power and what has it done for the development of J&K?” the senior CPI(M) leader said.

He said that the political activities of all other parties other than the BJP have come to a standstill in J&K for the last six months.

“Almost all the political leaders are either under detention or their activities have been restricted. In such a situation, parachuting Union ministers to J&K and trying to project all is well theory is nothing but a shame,” said Mr. Tarigami.

He also added that the internet services continue to remain snapped, and the BJP claims its ministers would make people aware about the schemes of the central government.

“The parachuted ministers are inaugurating those projects which had been sanctioned before 2014,” Mr. Tarigami said, adding, “Where was the BJP government and its ministers when horticulture in Kashmir and agriculture in Jammu suffered massive losses due to heavy snowfall in the Valley in November and rainfall in Jammu?”

“Why did the BJP government forget about development that time when farmers of J&K were crying?” he asked.

Mr. Tarigami said, “Almost three months had passed, but proper assessment of losses have not been done as yet.”

He claimed that the people are eking out a tough existence in Kashmir.

“Daily wagers are not able to find work to feed their families. Thousands of businesses cannot pay their staff or keep them on their rolls. ‘Shikara-walas’ (boatmen) of Dal Lake, pony-walas of Gulmarg, handicraft sellers and hoteliers, their staff and their suppliers are facing the worst crisis since last August (when Centre abrogated the Article 370 and announced the bifurcation of the erstwhile state into two UTs),” Mr. Tarigami said.

“More than the losses to the economy, job loss due to clampdown on internet services and restrictions is more worrying. According to a recent report of Chamber of Commerce and Industry, present disruption has resulted in loss of jobs of lakhs of people while J&K economy suffered losses worth thousands of crores,” he added.

The former MLA said that the snowfall in early November caused losses worth thousands of crores to horticulture sector.

“Education sector has been worst affected as most of the schools, colleges and universities remain shut since early August last year,” the CPI(M) leader said.",other states,https://www.thehindu.com/news/national/pisqmk/article30595804.ece/ALTERNATES/LANDSCAPE_615/TH19TARIGAMI,https://www.thehindu.com/news/national/other-states/bjps-outreach-programme-to-jk-is-nothing-but-a-hoax-tarigami/article30623494.ece
219,2020/01/22,Jammu-Srinagar National Highway shut for second day due to multiple landslides,"Multiple landslides at several places hampered restoration work on the Jammu-Srinagar National Highway which remained closed for the second day on Wednesday, officials said. The highway, the only all-weather road linking Kashmir with the rest of the country, was closed for traffic on Tuesday following fresh snowfall and incessant rains.

Though the weather improved, multiple landslides at Panthiyal, Moumpassi and Digdole coupled with slippery conditions delayed restoration work, the officials said.

“The men and machines are on the job and efforts are on to make the highway motorable as soon as possible,” said Deputy Superintendent of Police (traffic), National Highway, Shemsher Singh.

Also read: J&K highway closed for second consecutive day

He said that the Jawahar Tunnel, which experienced nearly one feet of fresh snowfall, was cleared for one-way traffic and around 1500 Kashmir-bound vehicles including trucks carrying essential commodities were allowed to move towards their destinations with drivers asked to drive carefully due to slippery conditions.

Heavy rains in Ramban triggered shooting of stones from hillocks overlooking the highway between Panthiyal and Ramsu throughout the day on Tuesday, while fresh landslides occurred at different places along the stretch, blocking the road, he said.

In Jammu city and other parts of the region it was a sunny day.

Jammu city recorded a minimum of 6 degrees Celsius -- one degree below normal, but the maximum temperature which had slipped over four degrees below normal on Tuesday is likely to settle around the season’s normal at 18.8 degrees Celsius due to clear skies, an official of the Meteorological department said.

He said that Katra, the base camp for pilgrims visiting Mata Vaishno Devi Shrine in Reasi district, recorded a low of 5 degrees Celsius.

The shrine and adjoining areas experienced heavy snowfall on Tuesday.

The highway town of Batote in Ramban district was the coldest recorded place in Jammu region with a night temperature of minus 2° Celsius followed by Bhaderwah in Doda district at minus 1.3° Celsius and Banihal at minus 1° Celsius, the spokesman said.",other states,https://www.thehindu.com/todays-paper/iqx3wf/article30309881.ece/ALTERNATES/LANDSCAPE_615/MangaloreCITYGB16RMJAP7jpgjpg,https://www.thehindu.com/news/national/other-states/jammu-srinagar-national-highway-shut-for-second-day-due-to-multiple-landslides/article30623223.ece
220,2020/01/22,Manipur woman IPS officer ‘roughed up’,"The Manipur State Commission for Women has summoned an Assam Rifles jawan for allegedly detaining and roughing up a woman police officer in Tengnoupal district on Saturday. It also forwarded the IPS officer’s complaint to the National Commission for Women.

The Assam Rifles did not react officially to the allegation, but a senior officer said the paramilitary force would “follow the procedures.”

“I have sent summons to the jawan (P.K. Pandey) seeking his appearance before the Commission on or before January 27. I have also sought suggestions from the NCW and the Chief Minister,” MSCW Chairperson Meinam Binota said, adding that Mr. Singh has instructed the police to arrest the jawan.

Tengnoupal’s Superintendent of Police Vikramjit Singh said his team was trying to take all possible legal steps necessary for the case.

The incident on January 18 occurred when Ms. Anupama, posted at Yairipok, was returning from Moreh town on the India-Myanmar border along with four policemen after performing official duties.

Personnel of the 12 Assam Rifles D-Company stopped her vehicle at Khudengthabi check post following which she and a constable went to register the entry of the vehicle and show identification cards as is required.

But the accused rifleman allegedly detained them for unspecified reasons, leading to an altercation before a Major of the Assam Rifles unit brought the situation under control.

In her complaint at the nearest police station, the IPS officer accused the jawan of harassment, misbehaviour and physical assault. She also said the jawan tried to snatch her mobile phone. and complained the matter to the Assam Rifles authorities.

Assam Rifles officials said erring personnel of the paramilitary force are usually tried internally. “No member of the armed forces of the Union shall be arrested for anything done or purported to be done by him in the discharge of his official duties except after obtaining the consent of the Central government,” says Section 45 of the Code of Criminal Procedure.

The section further says: “The state government may, by notification, direct that the provisions of Sub-Section (1) shall apply to such class or category of the members of the force charged with the maintenance of public order as may be specified therein, wherever they may be serving, and thereupon the provisions of that Sub-Section shall apply as if for the expression ‘Central government’ occurring therein, the expression ‘state government’ were substituted.”",other states,https://www.thehindu.com/static/theme/default/base/img/og-image.jpg,https://www.thehindu.com/news/national/other-states/manipur-woman-ips-officer-roughed-up/article30620025.ece
221,2020/01/22,Newly-appointed CRPF chief on 2-day visit to Naxal-hit Chhattisgarh,"Newly-appointed CRPF Director General Anand Prakash Maheshwari on Tuesday arrived on a two- day tour of Chhattisgarh where he is scheduled to meet state DGP DM Awasthi and Joint Director, Intelligence Bureau on Wednesday to discuss anti-Maoist strategy, an official said.

Maheshwari, earlier in the day met Chhattisgarh Chief Minister Bhupesh Baghel and then went to Bijapur where he held a familiarisation meeting with CRPF Deputy Inspectors General of Dantewada and Bijapur along with district police officials, he said.

“Later, he traveled to Basaguda and interacted with CRPF 168th battalion and COBRA 204th battalion personnel deployed for anti-Naxal operations. Tomorrow, he will go to Dornapal in Sukma district to hold meetings,” he added.

He will also visit the CRPF sector office in Naya Raipur on Wednesday.",other states,https://www.thehindu.com/static/theme/default/base/img/og-image.jpg,https://www.thehindu.com/news/national/other-states/newly-appointed-crpf-chief-on-2-day-visit-to-naxal-hit-chhattisgarh/article30619248.ece
222,2020/01/22,Medical team in Odisha carries a critically ill woman over 30 km of hilly terrain,"Walking nearly 30 km through hilly jungle terrain, carrying an ailing expectant mother in a makeshift stretcher, a medical team saved the life of the woman in Odisha’s Malkangiri district.

The six-member medical team from the Kalimela Community Health Centre (CHC), led by a young physician, Dr. Radheshyam Jena, undertook this exemplary show of service. The medical team had been on a two-day trip by foot to remote villages in the Kalimela Block for pulse polio immunisation and malaria screening. These villages do not have any road connectivity.

Inaccessible village

While at the inaccessible Kodidulagundi village, which falls under the Kurmanur Panchayat, on January 20, they had received information pertaining to Rinama Bare, a tribal woman in extreme labour pain over the previous 24 hours. Dr. Jena, along with his assistant Sukant Sahu, and health workers Dinesh Biswas and Sundarmihan Tudu, immediately rushed to her home. The team could ensure Ms. Bare delivered a baby boy. However, she was carrying twins.

“Without the necessary medical equipment, it was not possible for me to oversee the next delivery as the condition of the patient had deteriorated. Her pulse was feeble and she was also bleeding. Her life was in danger. So, we decided to save her by immediately shifting her to the nearby medical centre at Kalimela,” said Dr. Jena. But there was no one at the village to help as all the men were away working.

Makeshift stretcher

Having no other way out, Dr. Jena and his team converted a cot into a makeshift stretcher for Ms. Bare, which they carried on their shoulders towards Tekguda, from where they could reach Kalimela by a vehicle.

They started their 30 km trek over hilly terrain at about 2 p.m. and reached Tekguda at about 8 p.m. From there, the woman was immediately shifted to the Kalimela CHC, where she delivered a dead child. Nevertheless, Ms. Bare’s life could be saved.

The young Dr. Jena hails from Balasore district. He completed his MBBS degree from the MKCG Medical College in Berhampur in 2017, and took up government service in March 2019. “I feel saving life of a patient is the greatest joy for any physician and I am happy that I got the chance to do it,” said Dr. Jena.",other states,https://www.thehindu.com/news/national/other-states/i2cppc/article30617358.ece/ALTERNATES/LANDSCAPE_615/IMG-20200121-WA0004,https://www.thehindu.com/news/national/other-states/medical-team-in-odisha-carries-a-critically-ill-woman-over-30-km-of-hilly-terrain/article30617359.ece
223,2020/01/22,Tripura police destroy ₹20 lakh worth heroin,"The Tripura police have destroyed ₹20 lakh worth heroin on Tuesday.

“About 470 grams of heroin was seized in Ambassa of Dhalai district last year. We have destroyed it today [on Tuesday],” Deputy Inspector General Gourab Chakraborty said.

The DIG said the anti-narcotic drive would continue in Tripura.

Police have been destroying seized drug items like cannabis and heroin after a campaign was launched in the State in April 2018.",other states,https://www.thehindu.com/static/theme/default/base/img/og-image.jpg,https://www.thehindu.com/news/national/other-states/tripura-police-destroy-20-lakh-worth-heroin/article30620020.ece
