,Date,Title,Article,Category,Image_link,Article_link
146,22-3-20,‘I love to experiment with genres’,"AMITT K SINGH, who has done several TV shows will now been seen as a lead in a 90-minute horror web film shot on a smartphone. SHALINI SAKSENA speaks with him about the latest venture and how he took to acting

How did your acting career begin?

I am from Varanasi but my home is in Delhi. I was in the Capital but the shoot got cancelled. At present, I am in self-quarantine. My acting career began in school. I used to be part of all school and college extra-curricular activities. I always wanted to take up acting professionally but didn’t know how to proceed. I graduated from NIFT and started working in Bengaluru. Then I got transferred to Mumbai and shared with an apartment with my acting friends. I would go with them on shoot and was fascinated with the industry. I auditioned and got my first show on TV. That is when things got hectic. I learnt acting and trained under Neeraj Kabi.

How did you come on board for Kaavya, the web horror film?

I had not auditioned for the lead character but then the director liked my face and re-auditioned for the lead. This film is unique — for the first time a film has been shot on an iPhone. A lot of Hollywood directors have done this, but in India, we are doing for the first time. It as a bit of a challenge as we are used to facing the camera. The crew also had to get trained. We did workshop for a month and shot the film in two weeks. But it was fun and crazy experience.

You have a mixed bag of work. Has that been a conscious decision?

I love to challenge myself and try to repeat my characters so I can avoid being stereotyped. I did comedy; I did a web series — Bhaukaal — based on a real-life cop. I travelled to the place where he was posted and learnt body-language and other nuances of a real-time cop. Then I too up the horror project. I love to experiment with genres.

You have worked on TV, films and web series. Does that mean that you like to experiment with platforms as well?

What matters to me the most is the character and content that I am offered. Platforms don’t matter as much. It was much an honor to work with R Balki and Harman Baweja’s production for the web series. I have loved to be part of each and every project that has come my way as it has been different.

What is the attraction of taking up a project for a digital space?

The content that one sees here is so bold. There is so much more than one can do here. There are no restrictions, I don’t mean there is vulgarity but the boldness of the subject, there is no fear to experiment with a subject. We have the freedom to express ourselves. In TV, one is restricted by the channel and other guidelines. Even in films the Censor Board will cut a scene that they think is inappropriate.

How has the journey been so far?

It has been really good. I have had the opportunity to work with some of the best people in the industry. I am at a very good place as far as my career is concerned. My acting career is just starting.

What was your parents’ reaction when you quit your job?

I didn’t tell them for the longest time. I had quit my job to shoot for the show for three months. I never told them that I was busy shooting. It was only when the day to air the show was announced that I called up the family and told them and asked them to watch the show. It was a pleasant surprise that they fully supported me. I am the youngest in the family, maybe that was the reason. Now, my mother calls me everyday to know about my day.

What next?

There is Kaavya of course. There is a web series as well in which I play the lead. There is another project that I am working on; I can’t talk about it but I can let you know about my look in it. I have had to shave my hair and grow a beard. It took me time to see whether I wanted to take it up or not since I won’t be able to do anything else due to the look. It was a daring decision but I am glad I took it up.",show-time,https://www.dailypioneer.com/uploads/2020/story/images/big/---i-love-to-experiment-with-genres----2020-03-22.jpg,https://www.dailypioneer.com/2020/show-time/---i-love-to-experiment-with-genres---.html
147,22-3-20,Plan Your Stay At Home Sunday,"This Sunday as the nation stays indoors, Star Movies is here, to drive your boredom away with back-to-back blockbuster movies playing all throughout the day.

What better way to spend some quality time with your family, friends or flat mates than binging on your favorite movies with a bucket of popcorn!

The theatres may be closed, but Star Movies brings blockbusters like — The Expendables 2, Ant-Man and The Wasp, Captain Marvel, Coco, Frozen, Ice Age: Dawn of the Dinosaurs, Avengers: Infinity War, Con Air and Prince of Persia:The Sands of Time — to you, so that you can stay safe and stay entertained.

It is not all, Comedy Central, India’s leading English Entertainment channel is all set to provide it’s viewers with over a week long binge. Airing back to back episodes of all the fan favourite shows, the channel will air multiple marathons over the next week! Giving you a wake up call on Sunday, March 22 at 7 am will be the iconic show Friends. Join the crazy bunch in their adulting journey through till the famous cop team from the 99th Precinctl gear up to entertain you with Brooklyn Nine-Nine, Thursday 10:30 am onwards. While the 99th squad will surely entertain you with their Jimmy Jab Games, let’s not leave Sheldon and his quirky friends out of the fun! Tune in to The Big Bang Theory on Saturday, March 28, 9:30 pm onwards. Let the Marathon begin! Bring along your popcorn and binge — watch the super long marathon on Comedy Central, #YouurHappyPlace.",show-time,https://www.dailypioneer.com/uploads/2020/story/images/big/plan-your-stay-at-home-sunday-2020-03-22.jpg,https://www.dailypioneer.com/2020/show-time/plan-your-stay-at-home-sunday.html
148,22-3-20,Step-up your moves,"MUSBA HASHMI speaks with the judges of Sony TV’s India’s best Dancer to tell you what makes the show different

Dance can never go out of trend. This can be one reason why makers are not ready to give up on the format of dance reality shows anytime soon. While these shows is not new for the audience, but what makes them worth a watch is the talent from across the country.

Raising the bar is Sony Entertainment Television’s latest offering India’s Best Dancer. Adding to the charm of the show are the judges — Malaika Arora, Terrence Lewis and everyone’s favourite Geeta Kapoor.

Tagged as the toughtest dance reality show on TV, what sets it apart is the 90 seconds format. “The contestants will get only 90 seconds to give their best shot in front of the judges, to prove their talent. The contestant will have to impress us with their three ‘best’ moves in order to get their ticket to move to the mega auditions. From a large number of talented contestants, we will pick the ‘best barah’ ! Also, this show is different from any other dance reality show because we are not going to judge them only basis the number of flips, stunts and tricks in their acts, it’s beyond all of that,” Arora tells you.

All the three judges are expecting talent who will surprise them with their range as a performer. “We are glad that the contestants on the show are uniquely different from each other. The audience won’t see any similarity between two contestants. Each contestant brings uniqueness and variety on stage. And we, as judges, will ensure that we review them objectively as well as encourage them to realise and tap into their infinite potential. So far, the contestants have managed to intrigue us with their acts and only set the bar higher for themselves. We are waiting to be blown off by their power-packed performances,” she says.

Arora will be on a lookout for entertainment quotient in the performances this time. “We will be judging contestants based on three main elements, which is entertainment, newness and technique. Therefore, we are calling ourselves the ENT specialists. While Geeta will be evaluating them on the novelty factor, Terence will scrutinise their dance techniques, and I will be assessing the entertainment quotient in their performances. Lastly, we are looking at originality in their performances,” she tells you.

Kapur tells you that the reason she said yes to the show is that it stands out from other dance reality shows is that it is not harbouring duets, crews, groups or trios. “After a long time, a show is only going to showcase solo dancers, which hasn’t happened in many years now. It was high time that someone came up with this concept, and now here it is. Such a concept was much needed,” she says.

Internet has become a go to option for people who would want learn dance. But, Kapur believes that physical training is a must. “It is great that people are taking interest in learning dance and in case they can’t reach out to a formal guide or guru they are turning to internet. But I would recommend that there should always be someone who can guide you with technique because you can learn dance on the internet, but you may not know or understand the technique. Personal training has always helped me. There should be someone to keep an eye on you and train you with care,” she says.

Kapur is one of the most loved judges on reality shows. What makes her everyone’s favourite is the aura that she possess and the love that she showers upon everyone on the show. She says that she was fortunate enough to have been in the industry for so long.

“Every person has a story to tell, and I have been a part of this industry for quite some time now and I have a long story to tell. But to cut it short, all I can say is that it has been very fruitful. I have been trained by the best, worked with the best and that has helped me foresee the future of dance, and the creation and evolution of dance. I have had a blessed journey. I have never looked at my journey as a struggle; it has only been a learning experience,” she recalls.

Kapur admires a lot of people in the industry to name a few they are Gopi Krishnanji and Birju Maharajji. “They dance beautifully, and I don’t think there is anyone who can compete with them. Also, Farah Khan and Michael Jackson continues to inspire me till now,” she tells you.",show-time,https://www.dailypioneer.com/uploads/2020/story/images/big/step-up-your-moves-2020-03-22.jpg,https://www.dailypioneer.com/2020/show-time/step-up-your-moves.html
149,22-3-20,AI can better predict drug response to lung cancer therapies,"Researchers have used Artificial Intelligence (AI) to train algorithms and predict tumour sensitivity in three advanced non-small cell lung cancer therapies which can help predict more accurate treatment efficacy at an early stage of the disease.

The researchers at Columbia University's Irving Medical Center analyzed CT images from 92 patients receiving drug agent nivolumab in two trials; 50 patients receiving docetaxel in one trial; and 46 patients receiving gefitinib in one trial.

To develop the model, the researchers used the CT images taken at baseline and on first-treatment assessment.

""The purpose of this study was to train cutting-edge AI technologies to predict patients' responses to treatment, allowing radiologists to deliver more accurate and reproducible predictions of treatment efficacy at an early stage of the disease,"" explained Laurent Dercle, associate research scientist at the Columbia University Irving Medical Center.

Radiologists currently quantify changes in tumour size and the appearance of new tumour lesions.

However, this type of evaluation can be limited, especially in patients treated with immunotherapy, who can display atypical patterns of response and progression.

""Newer systemic therapies prompt the need for alternative metrics for response assessment, which can shape therapeutic decision-making,""

Dercle said in a paper appeared in the journal Clinical Cancer Research.

The researchers used machine learning to develop a model to predict treatment sensitivity in the training cohort.

Each model could predict a score ranging from zero (highest treatment sensitivity) to one (highest treatment insensitivity) based on the change of the largest measurable lung lesion identified at baseline.

""We observed that similar radiomics features predicted three different drug responses in patients with advanced non-small cell lung cancer (NSCLC) ,"" Dercle said.

""With AI, cancer imaging can move from an inherently subjective tool to a quantitative and objective asset for precision medicine approaches,"" he added.",pioneer-health,https://www.dailypioneer.com/uploads/2020/story/images/big/ai-can-better-predict-drug-response-to-lung-cancer-therapies-2020-03-22.jpg,https://www.dailypioneer.com/2020/pioneer-health/ai-can-better-predict-drug-response-to-lung-cancer-therapies.html
150,22-3-20,"China reports first local COVID-19 case after three days, witnesses surge in imported infections",", Mar 22 (PTI) China reported its first domestic coronavirus case after a gap of three days as the country saw a surge in imported infections with 45 new cases and initiated stricter measures to avert COVID-19 to resurface and create a second wave of infections, health officials said on Sunday.

China's National Health Commission (NHC) said that 46 new confirmed cases were reported on the mainland on Saturday, including one domestic infection transmitted by imported cases in Guangzhou.

Six deaths were reported from China, including five from Hubei Province, taking the death toll in the country to 3,261.

Coronavirus epicentre Wuhan, however, has not reported a new coronavirus case for the fourth consecutive day, health officials said.

The overall confirmed cases on the mainland had reached 81,054 by the end of Saturday, including 3,261 people who died of the disease, 5,549 patients still being treated and 72,244 patients discharged after recovery.

On Saturday, 504 people were discharged from hospital after recovery, while the number of severe cases decreased by 118 to 1,845, it said.

The imported cases included 14 from Shanghai, 13 from Beijing, seven from Guangdong province, four from Fujian province and two from Jiangsu province, while the provinces of Hebei, Zhejiang, Jiangxi, Shandong and Sichuan reported one case each, taking the total number of infections from abroad to 314, the NHC said.

By the end of Saturday, 273 confirmed cases, including four deaths, were reported in Hong Kong, 18 confirmed cases in Macao and 153 in Taiwan, including two deaths.

Meanwhile, facing a sharp increase of COVID-19 cases from abroad, China will take strict measures to prevent imported cases, NHC spokesman Mi Feng told media here on Saturday.

He called for unswerving efforts in preventing the COVID-19 epidemic from rebounding.

Beijing and several other cities have already initiated stricter quarantine rules under which the people will be confined to designated hotels for which they have to pay.

Beijing also started diverting flights to neighbouring cities where the foreign returnees would undergo a 14-day quarantine.",trending-news,https://www.dailypioneer.com/uploads/2020/story/images/big/china-reports-first-local-covid-19-case-after-three-days--witnesses-surge-in-imported-infections-2020-03-22.jpg,https://www.dailypioneer.com/2020/trending-news/china-reports-first-local-covid-19-case-after-three-days--witnesses-surge-in-imported-infections.html
151,22-3-20,Trump sent letter to Kim offering help on virus outbreak',"US President Donald Trump has sent a letter to North Korean leader Kim Jong-un, offering help with Pyongyang's fight against the coronavirus pandemic, the latter's sister said on Sunday.

The letter is a ""a good example showing the special and firm personal relations"" between Trump and Kim, said Kim Yo-jong, the first vice department director of the Central Committee of the North's Workers' Party, in a statement carried by the country's official Korean Central News Agency (KCNA), reports the Seoul-based Yonhap News Agency.

""We regard it as a good judgment and proper action for the US President to make efforts to keep the good relations he had with our Chairman by sending a personal letter again at a time as now when big difficulties and challenges lie in the way of developing the bilateral relations, and think that this should be highly estimated,"" she said.

""In the letter, he also explained his plan to propel the relations between the two countries of North Korea and the US and expressed his intent to render cooperation in the anti-epidemic work, saying that he was impressed by the efforts made by the Chairman to defend his people from the serious threat of the epidemic,"" Kim Yo-jong added.

North Korea has not reported a single coronavirus case, but was widely suspected to be covering up an outbreak.

The regime has tightened its borders and enforced tough quarantine measures on its people, according to state media.

Relations between Washington and Pyongyang have come to a standstill due to a deadlock in denuclearization negotiations following the collapse of Trump and Kim Jong-un's second summit in Vietnam in February 2019, said the Yonhap News Agency.

Kim Jong-un had set an end-of-year deadline for the US to show flexibility in their negotiations, but 2019 passed without progress and a warning from the North Korean leader of a soon-to-come ""new strategic weapon"".

Still, the leaders have appeared to maintain their warm personal relations, and in January, Trump sent a letter to Kim Jong-un to congratulate him on his birthday.

""In the personal letter, President Trump said he was glad to hear that his congratulations to Chairman on his birthday was correctly conveyed, and wished the family of the Chairman and our people wellbeing,"" Kim Yo-jong said in the Sunday letter.

""Saying that he values his relations with Chairman Kim Jong-un, President Trump said that there were difficulties in letting his thoughts known because communications were not made often recently.

""He expressed his willingness to keep in close touch with the Chairman in the future.""

The North Korean leader also ""mentioned his special personal relations with President Trump again and appreciated the personal letter"", she said.

Kim Yo-jong, however, cautioned against misjudging the two countries' ties based only on the personal relations of the two leaders.

""As they are the close relations between the two men representing the two countries, they would have positive impact but nobody knows how much the personal relations would change and lead the prospective relations between the two countries, and it is not something good to make hasty conclusion or be optimistic about it,"" Yonhap News Agency quoted her as saying in the letter.

""If impartiality and balance are not provided and unilateral and greedy intention is not taken away, the bilateral relations will continue to aggravate,"" she warned.

Adding that it is her personal opinion, Kim Yo-jong suggested that dialogue can only be restored when ""the equilibrium is kept dynamically and morally and justice ensured between the two countries, not merely by the personal letter between the two leaders"".

She also extended ""sincere gratitude"" to Trump for sending ""his invariable faith"" to Kim Jong-un.

The statement came a day after the North fired two short-range projectiles toward the East Sea in its third such weapons test so far this year.

",trending-news,https://www.dailypioneer.com/uploads/2020/story/images/big/trump-sent-letter-to-kim-offering-help-on-virus-outbreak--2020-03-22.jpg,https://www.dailypioneer.com/2020/trending-news/trump-sent-letter-to-kim-offering-help-on-virus-outbreak-.html
152,22-3-20,US Vice President Pence and his wife test negative for coronavirus,"US Vice President Mike Pence and his wife Karen Pence have tested negative for the deadly novel coronavirus, a top White House official said on Saturday.

Pence and the Second Lady took the test after a staff from his team tested positive for the deadly disease. However, the infected staff was never in direct contact with either Pence or US President Donald Trump.

The name of the infected staffer has not been released.

""Pleased to report that the COVID-19 test results came back negative for both Vice President @Mike_Pence and Second Lady @KarenPence,"" Katie Miller, the Press Secretary for Pence, said in a tweet on Saturday.

The COVID-19 pandemic has infected over 26,000 people and killed 340 people in the country. Coronavirus cases have been reported in all the 50 States in the US and District of Columbia as well as Puerto Rico.

According to the Johns Hopkins coronavirus tracker, over 3,00,000 people have globally contracted the virus and over 13,000 have died of the disease.

Earlier, Pence, during a White House press conference said that he was doing well.

""While the White House doctor has indicated that he has no reason to believe that I was exposed and no need to be tested, given the unique position that I have as vice president and as the leader of the White House coronavirus task force, both I and my wife will be tested for the coronavirus later this afternoon,"" he said.

Giving details of the infected staffer, Pence said, ""I am pleased to report that he is doing well.

The staffer exhibited ""mild cold-like symptoms"" and had not worked at the White House since Monday, he said.

Trump too had taken the coronavirus test last week and tested negative.

The White House has instituted strict provisions for entry of individuals within its premises.

Members of the presidential physicians' team and secret service take temperature of every individual who enter the premises.

The seating arrangements in the White House briefing room too have as been rearranged to maintain social distancing.",trending-news,https://www.dailypioneer.com/uploads/2020/story/images/big/us-vice-president-pence-and-his-wife-test-negative-for-coronavirus-2020-03-22.jpg,https://www.dailypioneer.com/2020/trending-news/us-vice-president-pence-and-his-wife-test-negative-for-coronavirus.html
