,Date,Title,Article,Category,Image_link,Article_link
37,22-3-20,Authorities on alert after Bird Flu killed birds at Birsa Zoo,"As many as ten birds have died at the Bhagwan Birsa Zoological Park recently. The birds included three lesser adjutant stork, two white ibis and five grass owls. As per the post mortem repots, the birds died due to a severe case of bird flu.

“Initially it was not known but later on it was confirmed to be bird flu. Suspecting it to be an acute virus all necessary precautions have been taken as per the protocol and guidelines. There have been no further deaths since February 25,” said Director of Birsa Zoological Park, D Venkateshwarlu.

The first incident occurred on February 23 where seven birds died and the second one on February 25 when there were three more casualties of those birds which were segregated from the lot.

“The first incident took place on February 23 when all of a sudden seven birds died. The birds had not been showing any signs or symptoms of any disease. As per the initial post mortem report per acute type of viral infection was found,” said Dr Ajay Kumar, a veterinary doctor at the zoo.

The samples of the birds were sent to Regional Disease Diagnostic Laboratory, Kolkata and later on also to National Institute of High Security Animal Diseases, Bhopal. The latter confirmed that the birds died due to avian influenza.

“The reports were sent by the institute to the Government of India which further issued directives of following the action plan for the prevention, cure and containment of the disease. An inspection team also visited the premises to enquire about the health of the persons interacting with the aviaries and to also know about the health status of the people in and around the zoo.

The team has given various instructions to remain vigilant, monitor any unusual deaths of birds and identify any symptoms in

humans so that they can be treated immediately,” added the Director.

Venkateshwarlu further stated that since then there has no further death which means that the spread of the virus is under control. “More samples of live birds will again be sent to the laboratories to check the presence of any disease. If not detected, it can be safely assumed that the bird flu has been controlled,” he said.

The zoo authorities are taking all the necessary precautions to curtail its spread amongst other species and humans.

Preventive measures like application of lime disinfectant on the ground have been done. Cages and barriers have been sprayed with anti viral sprays.

The zoo staff has been briefed about the necessary sanitization methods which need to be followed. They have also been provided with gloves, gum boots and other personnel protective equipment.

As per the State government’s directive, the zoon will remain closed till April 14",state-editions,https://www.dailypioneer.com/images/logo.jpg,https://www.dailypioneer.com/2020/state-editions/authorities-on-alert-after-bird-flu-killed-birds-at-birsa-zoo.html
38,22-3-20,State readies to witness ‘Janata Curfew’,"State government machinery, political parties, business fraternity and common people are all set to join hands to make Sunday’s ‘Janta Curfew’ successful in a bid to fight the global pandemic COVID-19. Although there is no Coronavirus positive case found in Jharkhand yet people and government machinery are not leaving any stone unturned to keep off the virus from State.

The state government has already announced closure of schools, colleges, clubs, theatres and other institutions, where mass gatherings take place. Famous religious places have also been shut and advisory has been issued for public to keep away from gatherings so that a possible outbreak of the disease can be stopped.

Meanwhile, political parties including the BJP, JMM and Congress have announced to fully support the public curfew in the wake of the global pandemic. State BJP president Deepak Prakash said, “The purpose of ‘Janata curfew’ is to defeat Corona as the corona chain can break through the 12-hour public curfew, which will make public spaces free of infection, so public support will be extremely important. At the same time, on March 22, at 5 pm to people must thank health fighters and policemen fighting with corona virus by clapping, beating plates, bell, conch etc from their houses,” he said.

JMM General Secretary Supriyo Bhattacharya said that there is no question of not supporting the PM’s appeal. “The pandemic has not left any country, religion or party. One has to follow the directions given by World Health Organisation and this time our country is at a crucial stage,” he said.

The State unit of Congress party has also announced full support to ‘Janta Curfew’. JPCC Spokesperson Alok Dubey said on Saturday that the State unit will adhere to the instructions of the PM and State government regarding Coronavirus. However, he said that the Congress workers will not beat plates or clap but will sing popular bhajans of Mahatma Gandhi to pay respect to corona warriors.

Meanwhile, the Railways has also announced to cancel and reschedule several trains across the nation on Sunday, which include a large number of trains operating in Jharkhand. The South Eastern Railway has cancelled 17 express trains and 17 passenger trains. It has also relaxed the rules for refund of tickets as a large number of passengers are unable to travel due to the pandemic.

Different airline services have also provided facilities for alternation of travel dates for the travellers in the wake of COVID-19. Notably, women holding a sit in near Haj House in their protest against CAA, NRC and NPR have also postponed their indefinite protest till April 5.",state-editions,https://www.dailypioneer.com/images/logo.jpg,https://www.dailypioneer.com/2020/state-editions/state-readies-to-witness----janata-curfew---.html
39,22-3-20,"Punjab records 11 corona cases in single day, total reaches 14","Punjab on Saturday recorded 11 cases of COVID-19, taking the total number of those infected in the State to 14. While six cases were reported from Nawanshahr, three from Mohali and one each from Hoshiarpur and Amritsar.

As of now, a total of 181 samples have been tested, out of which, the reports of 141 persons were found negative, a medical bulletin said.

The report of 23 persons is awaited, it said. The bulletin added that 40 people with suspected coronavirus are admitted in hospitals.

The maximum number (six) of coronavirus patients were reported from Nawanshahr town of the State. They are the relatives of the 70-year-old coronavirus positive man who had returned from Germany via Italy and died on Wednesday because of cardiac arrest.

Among the infected are his three sons, daughter, daughter-in-law and granddaughter, as per the bulletin. A 60-year-old resident of Garhshankar in Hoshiarpur who had come in contact with the 70-year-old man also tested positive, it said.

Three persons from Mohali tested positive on Saturday. Among them is a 74-year-old woman, sister of the 69-year-old Mohali-based woman who tested positive on Friday, said Mohali Deputy Commissioner Girish Dayalan.

Another 28-year-old Mohali-based woman who came in contact with Chandigarh-based 23-year-old woman coronavirus patient, also tested positive, said Dayalan.

A 42-year-old Mohali resident, who recently returned from the United Kingdom, also tested positive for COVID-19. He is admitted to a government hospital in Sector-16 in Chandigarh.",state-editions,https://www.dailypioneer.com/images/logo.jpg,https://www.dailypioneer.com/2020/state-editions/punjab-records-11-corona-cases-in-single-day--total-reaches-14.html
40,22-3-20,"60-year-old man robbed of revolver, mobile phone, car keys","A 60-year-old man was robbed of his revolver, mobile phone and car keys and attacked with sharp-edged weapons and wooden sticks. His car was also damaged by three miscreants at Karbala under Shahjehanabad police station in the night on Thursday.

CSP, Shahjehanbad, Nagendra Pateria, said that the victim asked a couple sitting at Karbala which infuriated the youth and he called his aides who damaged the victim’s car, took his revolver, car keys and mobile phone.

The miscreants attacked the victim in his head and he is undergoing treatment at Chirayu hospital. The search for the accused has been intensified, he added.

A complaint was lodged with the police by the victim. In the complaint the victim claimed that the a couple was near Karbala and he asked reason for standing late in the night which angered the youth and he called his aides and they attacked and robbed him. They also damaged window pane and wind shield of his Mahindra Scorpio.

Based on the complaint after the preliminary investigation the police have registered a case under section 394 of the IPC and have started further investigation. The victim is a resident of Koh-e-Fiza and work as a builder.",state-editions,https://www.dailypioneer.com/images/logo.jpg,https://www.dailypioneer.com/2020/state-editions/60-year-old-man-robbed-of-revolver--mobile-phone--car-keys.html
41,22-3-20,"After PM appeal, taxis, autos to stay off road today","In wake of the Prime Minister’s appeal for ‘Janata Curfew’ on Sunday, several 'Autorickshaw and taxi' unions have decided to stay off roads on Sunday in the national Capital.

Several unions including the Delhi Autorickshaw Sangh, Delhi Pradesh Taxi Union, Delhi Auto Taxi Transport Congress Union and Delhi Taxi Tourist Transport Association, have decided to join the curfew from 7am to 10pm on Sunday. The prime minister acknowledging this initiative said that the fight against corona epidemic will receive a boost due to it.

""This initiative will give new strength to the fight of the countrymen against corona epidemic,"" he tweeted in Hindi. General Secretary of Delhi Autorickshaw Sangh Rajendra Soni said all unions affiliated to the Bhartiya Majdoor Sangh will join the curfew.

""We have appealed all our members, including those of Delhi Autorickshaw Sangh and Delhi Pradesh Taxi Union, to refrain from taking out their vehicles during Janta Curfew on Sunday,"" Soni said. He said it was a duty of each citizen to stop the virus spread and contribute to the efforts of the government towards this end.

President of Delhi Taxi Tourist Transport Association Sanjay Samrat said his union welcomed the curfew as it will check the spread of the virus. He said the curfew should be extended till March 31 and urged the prime minister for financial help to people earning their livelihood on a daily basis.",state-editions,https://www.dailypioneer.com/images/logo.jpg,https://www.dailypioneer.com/2020/state-editions/after-pm-appeal--taxis--autos-to-stay-off-road-today.html
42,22-3-20,"Shaheen Bagh stir will continue, say protesters","The protesters at Shaheen Bagh on Saturday said that they will continue their agitation against the Citizenship Amendment Act (CAA) and they all are taking all precautions to fight against the noval coronavirus. The protest against the CAA at Shaheen Bagh on Saturday completed its 100th day. The protesters also said that they continue their protest on Sunday, the day when Prime Minister Narendra Modi has urged people to remain inside their houses under a self-imposed curfew.

According to elderly women sitting at the protest site, they are offering namaz five times a day and regularly washing their hands. ""This protest will not end here. Modiji, you still have time to revoke this black law. We want to spend our lives peacefully and let us do that. The country belongs to us. We were born here and will die here only,"" said a women protester.

""What you have done with Jamia, Jawaharlal Nehru University (JNU) and Jafrabad. We do not need such kind of government. Jamia and Shaheen Bagh are our homes and we will sit here. We have to fight this battle together and Jamia and Shaheen Bagh will win it together,"" another woman said.

On Monday, the Delhi government said gatherings with more than 50 people were not allowed in the wake of the novel coronavirus pandemic. The size of gatherings has since been reduce to 20 people. ""It also applies to Shaheen Bagh,"" Chief Minister Arvind Kejriwal had said.

The protesters said that not more than 50 women had been staging protest at any given time. On December 13, the students of Jamia Millia Islamia protested against the CAA and had called for a march to Parliament House from the university campus to express their opposition to the legislation. The anti-CAA protest in Shaheen Bagh started on December 15 last year. The women have been blocking a side of a road connecting southeast Delhi to Noida since mid-December to protest against the amended citizenship law.",state-editions,https://www.dailypioneer.com/images/logo.jpg,https://www.dailypioneer.com/2020/state-editions/shaheen-bagh-stir-will-continue--say-protesters.html
43,22-3-20,"Manage Fair Price Shops, stop hoarding: Minister","Food and Supply Minister Imran Hussain on Saturday said that necessary action against the black-marketers and hoarders are being taken as per law under the provisions of essential commodities act.

Hussain also directed officials for taking measures to manage Fair Price Shops (FPS) better during the fight against the COVID-19. He said that the guidelines issued by Government of India along with do’s and don’ts may be circulated to all FPS for strict adherence.

“The hygienic items like masks, hand sanitisers, soaps, etc required to contain the transmission of COVID-19 may be sold at FPS subject to the prohibitions and conditions as prescribed under law,” he told the official during a high level meeting to review the arrangements of Food Supplies and Consumer Affairs Department for effectively tackling the threat posed by coronavirus.

Social distancing may be adopted as a non-pharmaceutical infection prevention and control intervention process, he said, adding that keeping a distance of one meter among the beneficiaries/persons in a queue at FPSs should be maintained.

The Minister further said that days of distribution of food grains at FPSs may be extended up to maximum period of the month so as to reduce the crowd of beneficiaries at the FPSs.

The meeting was attended by Commissioner, Food and Civil Supplies (F&CS) and other senior officers of Food Supplies and Consumer Affairs Department.

During the meeting, the minister observed that under the provisions of the Essential Commodities Act, 1955, masks and hand sanitizers declared as essential commodities. “The teams of F&CS and weights and measures department should regularly visit general stores, chemists, pharmacies, drug manufacturers etc dealing in the face masks and hand sanitizers to ensure that good quality masks and sanitizers are available and that these commodities are not being overcharged,” he said.

In order to ensure a better coordination among agencies, it was decided to associate the officials of Food Supplies and Consumer Affairs Department with District Magistrates for ensuring better monitoring the regulation of quality, distribution and logistics of masks and hand sanitisers.",state-editions,https://www.dailypioneer.com/images/logo.jpg,https://www.dailypioneer.com/2020/state-editions/manage-fair-price-shops--stop-hoarding--minister.html
44,22-3-20,Fight against Corona : Myths and Reality,"As India preps to make Janta Curfew a success today, it is time we realised that COVID-19 is spreading through our human networks and that a single person’s behaviour can cause ripple effect across the globe transmission. The onus, therefore, is upon us to check its spread, writes Dr Tamorish Kole

Myth: Coronavirus will disappear when summer sets in India.

Fact: From the evidence so far, the new coronavirus can be transmitted in all areas, including areas with hot and humid weather.

Myth: Taking a hot bath can prevent coronavirus disease.

Fact: Our normal body temperature is 97.5 degree F. Taking hot bath will only raise our body temperature. Additionally, extreme hot water is harmful for us.

Myth: Pets at home can spread coronavirus.

Fact: To date, there is no evidence that pets such dogs or cats can be infected with COVID-19. However, it is prudent to wash hands before and after handling them.

Myth: Eating Chicken or other meats can cause COVID-19.

Fact: There is no such evidence. However, eat well cooked meat and avoid raw meat.

Myth: Wear a mask when you step out.

Fact: There is no need to wear a mask for healthy people. If you have fever, cold and cough wear a three-layer surgical mask to protect others from getting infected. Seek medical attention as well. N95 mask is only required for healthcare professionals.

The novel coronavirus outbreak (2019-nCoV, now called SARS-CoV-2) causing the COVID-19 viral disease that has swept into 156 countries, which affected 191,127 people (as on March 18, 2020) and killed more than 7807 people is now officially a pandemic, as declared by the World Health Organisation (WHO).

It is for the first time that the WHO has called an outbreak a pandemic since the H1N1 “swine flu” in 2009. The 1918 Spanish flu epidemic was the deadliest flu season that we know of, infecting about one-third of the world’s population.

Coronaviruses are a large group of viruses that are known to infect both humans and animals, and in humans causes respiratory illness that range from common colds to much more serious infections. The most well-known case of a coronavirus epidemic was Severe Acute Respiratory Syndrome (SARS), which, after first being detected in southern China in 2002, went on to affect 26 countries and resulted in more than 8,000 cases and 774 deaths.

The COVID-19 disease appears to have originated from a Wuhan seafood market where wild animals, including marmots, birds, rabbits, bats and snakes, are traded illegally. Coronaviruses are known to jump from animals to humans, so it is thought that the first people infected with the disease — a group primarily made up of stall holders from the seafood market — contracted it from contact with animals.

If we compare COVID-19 with two other coronavirus outbreaks in the recent past, we will see that it is less lethal. With a mortality rate currently estimated at around 2 percent (a range of 0.7 to 3), it is less deadly to those who become affected than SARS or MERS. According to early WHO estimates, the average reproductive rate (r0) of coronavirus ranged between 1.4 and 2.5. That means, on an average, each confirmed case of coronavirus would infect between 1.4 and 2.5 other people. It is, therefore, more contagious than some of the deadliest airborne viruses.

India is one of the first countries in the world to prepare for an outbreak of COVID-19 outbreak. According to Health ministry, India began screening people at airports from 17 January onwards, six days after Chinese state media reported the first known death from an illness caused by the virus and a good two weeks before the WHO declared it a global health emergency.

As on date, India has over 200 confirmed COVID-19 cases and is on Stage 2, which means we have only local transmission from positive cases. The Indian Council of Medical Research (ICMR) believes that we may eventually slip into Stage 3, where the disease spreads in the community and large areas are affected. ICMR also says that we have approximately 30 days window period to halt this transmission and that’s where our focus as a country should be on.

Till now, India has taken following stringent measures to address the problem:

Mandatory checks at airport and quarantine as required.

Blanket Visa ban until at least April 15, 2020.

Invoked Disaster Management Act to centralise the response and preparedness.

Invoked Epidemic Act for the same purpose.

Created isolation facilities across the country using Armed Forces and Paramilitary Forces facilities.

Carried Rescue Missions from China, Iran and Italy to bring back Indians who are at risk of COVID-19 exposure.

Indian Healthcare Sector along with Central and State Government is fully prepared to deal with the outbreak. However, we need to keep in mind that every country in the world is facing some challenges despite their socio-economic status as the virus is spreading very rapidly.

In today’s world, naturally fear is always the first wave of every epidemic. But, we must realise that we have had pandemics before, and we have responded to them before. It is very important to know what each one of us can do to fight against COVID-19.

WHO advises seven simple steps for every one of us to stay safe and prevent the virus from spreading to other people. These are:

STEP 1: Wash your hands frequently, regularly and thoroughly with an alcohol-based hand rub (use a hand sanitiser that contains at least 60% alcohol, for at least 20 seconds) or wash them with soap and water (for at least 40-60 seconds). Wash your hands after coughing or sneezing, when caring for the sick, before, during and after you prepare food, before eating, after toilet use, when hands are visibly dirty and after handling animals or animal waste. We use our hands to touch objects and surfaces that may be contaminated. Without realising it, we then touch our faces, transferring viruses to our eyes, nose and mouth where they can infect us. Washing your hands with soap and water or using alcohol-based hand rub kills viruses that may be on your hands, including the virus that causes COVID-19.

STEP 2: Avoid touching your eyes, nose and mouth to avoid transmission of virus. Hands touch many surfaces and can pick up viruses. Once contaminated, hands can transfer the virus to your eyes, nose or mouth and can then enter your body and make you sick.

STEP 3: Cover your mouth and nose when you sneeze or cough with the bend of your elbow or with a tissue. Also make sure that you, and the people around you, follow good respiratory hygiene. Dispose of the used tissue immediately into a closed bin and wash your hands. When someone coughs or sneezes, they spray small liquid droplets from their nose or mouth which may contain virus. By covering your cough or sneeze, you avoid spreading viruses and other germs to other people. By using the bend of your elbow or a tissue and not your hands to cover your cough or sneeze, you avoid transferring contaminated droplets to your hands. This prevents you from contaminating a person or a surface through touching them with your hands.

STEP 4: Avoid crowded places and close contact with anyone that has fever or cough, and international travel history in recent past. This is more important for people over 60 years of age or with underlying health condition such as high blood pressure, diabetes, heart and lung diseases or cancer. Maintain at least 1 metre (3 feet) of distance between yourself and anyone who has a fever or cough. COVID-19 spreads mainly by respiratory droplets that come out of the mouth or nose when a person who has the disease coughs. By avoiding crowded places, you keep yourself distant from people who may be infected with COVID-19 or any other respiratory disease. This is called Social Distancing and is proven a very effective strategy for containment.

STEP 5: Stay at home if you feel unwell, even with a slight fever and cough. By staying home and not going to work or other places, you will recover faster and will avoid transmitting diseases to other people. This is called Home Isolation and is very effective for rationing of healthcare resources to sicker individuals.

STEP 6: If you have a fever, cough and difficulty breathing, seek medical care early. If you can, call your hospital or health centre first so that they can tell you where you should go. In India the helpline number set up by Ministry of Health and Family Welfare is: +91 11 23978046. This will help to make sure you get the right advice, are directed to the right health facility, and will prevent you from infecting others.

STEP 7: Get information from trusted sources. Stay informed about the latest information from about COVID-19 from trusted sources. Make sure your information comes from reliable sources — Ministry of Health and Family Welfare, Government of India website, the WHO website, or local health authorities. Everyone should know the symptoms — for most people, it starts with a fever and a dry cough. Local and national authorities will have the most up-to-date information on whether COVID-19 is spreading in your area. They are best placed to advise on what people in your area should be doing to protect themselves.

In addition, we also need to understand that so far 80% of people affected by COVID-19 have mild symptoms and recovered from the disease in two weeks. Most coronavirus illness are also generally mild for children and young adults. Treatment is similar to other coronavirus outbreak protocols with some drugs (Under trial) are now being tried in very sick patients. We do not have an effective vaccine as yet and therefore seek proper medical attention in time and avoid self-medications.

It is time we realise that COVID-19 is spreading through our human networks — through our countries, our towns, our workplaces and our families. In this spread, a single person’s behaviour can cause ripple effect across the globe. Let us be responsible and fight the coronavirus outbreak together.

The author is President, Asian Society for Emergency Medicine (ASEM)",sunday-edition,https://www.dailypioneer.com/uploads/2020/story/images/big/fight-against-corona---myths-and-reality-2020-03-22.jpg,https://www.dailypioneer.com/2020/sunday-edition/fight-against-corona---myths-and-reality.html
