,Date,Title,Article,Category,Image_link,Article_link
0,22-3-20,HP CM seeks support of all parties to combat COVID-19,"Urging the leaders of all political parties to give wholehearted support to the Government to check the coronavirus spread, Himachal Pradesh Chief Minister Jai Ram Thakur on Saturday assured that there was adequate stock of essential commodities and the Government would deal the cases of hoardings and profiteering of essential commodities sternly.

Chairing an all-party meeting here, he said the Government has decided to postpone the date of payment of various public utility bills like electricity and water without any extra charges.

Thakur said the State would take strict action against the suspected persons who refrain from quarantine. The State has asked five manufacturers in the state for bulk manufacturing of sanitisers. All the teachers have been exempted from coming to school till March 31. He said only in case of any emergency the Deputy Commissioners can requisite the services of teachers.

He said there was adequate stock of essential commodities in the State. He said adequate sanitation kits were being made available to the doctors, paramedical staff, police personnel and sanitary workers.

Himachal Pradesh was the first State in the country to notify the Himachal Pradesh Epidemic Disease (COVID-19) Regulation of 2020 on March 14 to tackle the menace of coronavirus effectively.

The Chief Minister said two suspected cases of coronavirus were reported from Kangra district on Friday, which was a matter of concern. He said samples of both the patients have been sent to Pune for further investigations and verification.

The State has closed all educational institutions till March 31 as a preventive measure besides closing all major temples. The State has also banned entry of tourists. The hotelier associations have also extended wholehearted support to the state in this regard.

He said a complete ban has been imposed on organising of any religious, cultural, political and social functions and gatherings in the State.

Thakur said the prices of masks and sanitizer have been fixed and hoarding of these essential commodities would be dealt sternly. The Chief Minister said a mechanism would be developed soon to bring down the attendance of employees in major offices so as to avoid overcrowding.

Thakur also urged the opposition parties to give their support to ensure the success of 'Janta Curfew' in the State to motivate the people to remain indoor on March 22. He said keeping in view 'Janta Curfew', 2,020 plying of buses has been suspended and all the inter-state contract carriage has been suspended from midnight of March 21 till further orders.

The Chief Minister said the Government reduced plying of interstate HRTC bus services to only 10 per cent. The intrastate bus services of HRTC and private buses would be reduced by 50 per cent.",state-editions,https://www.dailypioneer.com/images/logo.jpg,https://www.dailypioneer.com/2020/state-editions/hp-cm-seeks-support-of-all-parties-to-combat-covid-19.html
1,22-3-20,Punjab police warns against spreading rumours,"The Punjab Police on Saturday warned of strict action against those indulging in spreading unsubstantiated claims and fake news about coronavirus.

Punjab DGP Dinkar Gupta said those found guilty of indulging in such acts will be penalized and dealt with under the relevant provisions of law. In an advisory issued here, the DGP warned people against spreading baseless rumours and falsehood.

He also issued a series of ''dos and don''ts'' against using mobile phones and social media platforms to spread mischievous and unsubstantiated information, which can create unnecessary panic and hardship to the people.

These are tools that help keep everyone connected and informed, Gupta said, warning people against sending WhatsApp forwards, or posting and spreading fake news on the deadly disease. Gupta requested the general public not to create panic or unrest through malicious forwards and social media posts.

The number of coronavirus patients in Punjab surged to 13 on Saturday. A media bulletin issued by the Punjab Government said the number of COVID-19 positive patients went up to 13 in the State. As of now, testing of 181 samples has been conducted and out of which, reports of 141 persons came negative, it said.The reports of 23 persons with suspected coronavirus are awaited, the bulletin said.

PUNJAB PERMITS DISTILLERIES TO MANUFACTURE HAND SANITIZERS

To meet the growing demand of hand sanitizers in view of health emergency, Punjab Drug Administration Commissionerate has granted permission to distilleries registered with Excise and Taxation Department to manufacture and supply sanitizers as per the formulation given by WHO, KS Pannu, Commissioner Food & Drug Administration Punjab said on Saturday.

The orders State that the permission is granted purely on temporary basis for a period of 10 days, keeping in view the emergency conditions due to spread of Corona virus. Moreover, the producer will make the supply to Government Institutions in Punjab only and no part of it will be supplied outside the state.

The producer is expected to use the standardized materials only and shall supply the material at price which shall not be more than the price fixed by GOI or Govt of Punjab.

Pannu informed that the Drug control officers of the area shall inspect the manufacturing units on daily basis to take stock of quality, and quantity of production and its supply and the units have been asked to maintain proper record of the manufacturing and supply of the material.

PSPCL TO PROVIDE UNINTERRUPTED POWER SUPPLY TO HOSPITALS

Due to Covid-19, A.Venu Prasad, Principal Secretary, Power, Punjab Govt. on Saturday asked Punjab State Power Corporation Limited to provide uninterrupted 24x7 power supply to all Health Care Institutions such as Medical Colleges, Hospitals, Dispensaries, other Medical Establishments, Public Health Laboratories for testing the virus that causes COVID-19 and Quarantine Centres across the States. In a communication addressed to Baldev Singh Sran, CMD PSPCL, Principal Secretary Power also directed that PSPCL should also work proactively because these places are the first contact point in case of medical emergency. Accordingly, instructions have been imparted to the field offices for ensuring uninterrupted 24x7 power supply to all such Health Care Institutions and Quarantine Centres in the state.

FARIDKOT ADMN DENIES PERMISSION FOR MELA

The Faridkot administration in Punjab on Saturday denied permission for holding an annual event, ''Baba Kala Mehar mela'', at Kotkapura in wake of the coronavirus pandemic. Faridkot Deputy Commissioner Kumar Saurabh Raj said the proposed March 25 event at Bir Sikhanwala village in Kotkapura would not be held. ""The next date for holding the mela will be announced later,"" he said. The decision has been taken after the state government issued directions that public gathering of more than 20 people at one place will not be allowed. The mela' is organised every year at Bir Sikhanwala village by the Sandhu clan to pay respect to their elders. Thousands of people belonging to the Sandhu clan from several parts of Punjab, Haryana and Rajasthan attend the ''mela''.",state-editions,https://www.dailypioneer.com/images/logo.jpg,https://www.dailypioneer.com/2020/state-editions/punjab-police-warns-against-spreading-rumours.html
2,22-3-20,No new case reported in UT,"No new positive case of COVID-19 (Coronavirus) was reported in Chandigarh on Saturday. The number of positive cases stood at five in the city.

The number of people put in home quarantine stood at 370. Out of total 434 passengers reported here, 370 passengers are under home quarantine and 64 have completed home quarantine or migrated to other states.

The mother, brother and cook of the first positive case of 23 years old woman resident of city, were tested positive on Friday and under treatment in GMCH-32. Three more contacts (neighbors) residents of Chandigarh admitted at GMCH-32 were turned out to be negative for COVID-19 and have been home quarantined.

The fifth positive case reported from the city was of 26 years old woman, who had returned from London.

Meanwhile, in view of Janta Curfew call given by Prime Minister Narendra Modi, the hotels, restaurants and other eating places will remain closed in the city on Sunday.

Red Cross Society Chandigarh mobile vans with packed foods will be available at designated place for public in the city. The Administration has also decided to prepare a proposal for advance payment of ration money for a few months to cater to the BPL families of Chandigarh so that they have liquidity which will enable them to make purchases of essentials from the market.

To tackle the rumors being spread on social media regarding Coronavirus, the Administration will launch its website dedicated exclusively for providing information on the disease. The information of tricity would be uploaded on the website as local authorities in Mohali and Panchkula would also provide information regarding reported COVID-19 cases to Administration.

These decisions were taken during a meeting of Punjab Governor and UT Administrator VP Singh Badnore on Saturday with the senior officials of Chandigarh Administration, Governments of Punjab and Haryana to review the preparatory measures being taken in triciry to combat the spread of COVID-19. Punjab Chief Secretary Karan Avtar Singh was present at the meeting.

The Administrator reviewed the availability of medical or safety equipment with all the Government Hospitals. It was decided that order for procuring additional medical equipment to be used by the doctors and para medical staff will be made and the same will be procured on priority. The Governor will review the situation everyday through video conference.

Among other issues, Punjab Chief Secretary informed that in Punjab the wholesale vegetable markets are open and only retail Apni Mandis have been closed due to congestion.

UT Adviser Manoj Parida apprised that in Chandigarh both the wholesale and retail vegetable markets are open as if the same is not done then people would overcrowd the Sector 26 market which will unnecessarily cause congestion and may spread infection.

It was suggested that atleast in Mohali and Panchkula, the respective State Governments can keep the Apni Mandis and vegetable shops open as after ensuring necessary protocols and instructions as given by Government. It will reduce the unnecessary crowding of people from Mohali and Panchkula in Chandigarh.

Adviser Manoj Parida said that, if required, there is a plan to permit community halls to be used for sale of vegetables. The mobile carts etc would be allowed to sell vegetables from house to house. Mobile vans could also used for the purpose.

The decision of Chandigarh Administration to paste posters outside the houses of suspected Coronavirus cases so as to reduce the risk of other people getting infected was appreciated.

A day before, the Administration had banned a gathering of more than 50 persons in Chandigarh. The order of allowing a gathering of 100 people at wedding and pubs serving food was also withdrawn.

The Administrator has appealed residents to stay at home on Sunday and make the Janta Curfew successful as announced by the Prime Minister. He has urged all the business establishments and industries to voluntarily close down their operations and stay at home so that chain of infection is broken.

In view of Janta Curfew, various market associations in Chandigarh have announced partial shutdown on Sunday.

The Governor also said that the people should restrain from relying on rumours. He stated that adequate number of beds and medicines are available in Chandigarh. The officials were also directed not to allow hoarding of masks and other safety equipment and take strong action against those creating artificial scarcity of materials.

50 teams of MCC sanitizes public places throughout city

In order to prevent spread of Coronavirus, the Municipal Corporation of Chandigarh on Saturday sanitized public places including benches in parks, open air gyms, grills, door handles of ATMs, table counters of different offices and shops, ramps in corridors of markets.

In addition to that, the teams of MCC sanitized the public transport including CTU buses and Auto rickshaws and public toilets throughout city.

Giving details, KK Yadav, Commissioner, Municipal Corporation said that total 50 teams have been deployed throughout city to sanitize the public places. All the government offices, institutions, buildings were sanitized besides hospitals, dispensaries, religious places and markets. Private places have also been covered during the day on call basis, he said.

Petrol pumps, motor markets, bus stops, bus terminals, police stations, e-sampark centres, vending zones, Sehaj Safai Kendras, housing societies, EWS houses, Taxi stands, auto rikshaw stands, police beat boxes, Dharmshalas, Community Centres, Aangnwari kendras, schools, mini markets, streets in villages and colonies were also sanitized, he added.

Yadav said that apart from sanitizing the public places, the teams of Municipal Corporation have created awareness among the residents by distributing pamphlets and public address system.

He further said that the teams will continue their job till further orders and sanitization will be enhanced as per the requirement and circumstances.

PU to remain closed till March 31

The Panjab University will remain closed till March 31. The staff including teaching and non-teaching should would from home to the extent possible and should remain available on phone and any other means of communications, said an official spokesperson. They should attend the office, if called for any exigency of work. Emergency/essential services shall remain operational. Ongoing examinations and evaluation work shall be re-scheduled after March 31, the spokesperson said.

All chairpersons/directors/coordinators/wardens (including the Regional/Rural Centres & Constituent Colleges) and Heads of all Non-Teaching Departments/Branches/Offices, Principals of Affiliated Colleges of the University shall also follow the above necessary compliance, he added.

Centre directions will be followed: Chd Admn

The Central Government has passed an order, to regulate the prices of masks (2ply and 3ply), the melt blown non- woven fabric used as raw material in production of masks, and hand sanitizers for preventing infections due to COVID-19 . The retail prices of Meit Blown non - Woven Fabric used in manufacturing masks (2ply & 3ply), shall not be more than the prices prevailing on the day one month prior to March 13 i.e. the prices prevailing on 12.02.2020. The retail prices of masks (3ply surgical mask), shall not be more than the prices prevailing on the day one month prior to March 13 as on 12.02.2020 or not more than `10 per piece whichever is lower and that of mask (2ply) shall not be more than `8 per piece, said an official spokesman of Chandigarh Administration.

The retail prices of hand sanitizer shall not be more than `100 per bottle of 200ml the prices of other quantities of hand sanitizers shall be fixed in the proportion of these prices. These orders shall remain in force for a period upto June 30.

The spokesman said that the Administration is already conducting checking in the markets of Chandigarh to enforce the orders of the government. The shopkeepers and chemists are also informed to strictly follow these orders in letter and spirit. The general public can also report the cases of overpricing and non availability of these items in the shops or chemist stores on the toll free number of the Department:1800-180-2068 or at 0172-2703956 or via email at fcs-chd@nic.in.",state-editions,https://www.dailypioneer.com/images/logo.jpg,https://www.dailypioneer.com/2020/state-editions/no-new-case-reported-in-ut.html
3,22-3-20,U’khand to remain at home today,"State gears up for PM’s call of Janata Curfew from 7 am to 9 pm; CM TSR appeals to people to cooperate

The Chief Minister of Uttarakhand Trivendra Singh Rawat has made an appeal to the people of the State to cooperate in the Janata curfew on Sunday. The Prime Minister Narendra Modi has given a call to the countrymen to remain at home on March 22, from 7 am to 9 pm.

In his message, CM Rawat has said that the Government is prepared to meet the challenge of COVID-19 and there is no need of any fear. He said that the public cooperation is very important in combating the threat of infection and people should cooperate in the call of Janata Curfew given by PM Modi. The CM said that the supplies of all essential commodities are normal and would be maintained.

The tourism and culture Minister Satpal Maharaj has also appealed to the people to remain united in the fight against the Coronavirus (COVID-19).

He said that people should observe self imposed curfew on Sunday, March 22 on the appeal made by

Prime Minister Narendra Modi. Maharaj said that total observation of Janata curfew is needed to break the infection cycle of the Coronavirus.

He said that children below the age of ten years and people with more than 65 years of age should remain inside their homes for some days because they have low immunity and are susceptible for infection.

The Member of Parliament (MP) from Nainital- Udham Singh Nagar parliamentary constituency, Ajay Bhatt said that the Janta Curfew is the most efficient tool to fight an epidemic like Coronavirus.

He said that the dreaded disease would remain in control by preventing the spread of infection of virus.",state-editions,https://www.dailypioneer.com/images/logo.jpg,https://www.dailypioneer.com/2020/state-editions/u---khand-to-remain-at-home-today.html
4,22-3-20,Remain prepared for real time situation: CS to DMs,"The chief secretary Utpal Kumar Singh took a meeting with all the district magistrates (DMs) and chief medical officers (CMOs) of state via video conferencing on Saturday. In the meeting, the CS directed that the tourists coming from other states should be earmarked and information about them should remain updated. He directed the officers to remain prepared for real time situation so that problems in handling the situation are minimised. On a terse note, the CS said that spread of rumours on social media sites should be checked and strict action should be taken against those who are spreading rumours. He told the DMs that they should request all leaders including the Ministers and MLAs to cancel their Janta Milan programmes.

The secretary, health services, Nitesh Jha said that the district officers should make a list of the retired para medics and those who have worked in medical services of army so that a plan to take their services in the time of need can be made. In view of less number of patients in the hospitals of the state during Janta Curfew on Sunday, the health secretary said that mock drills in the hospitals should be conducted to check their preparedness.",state-editions,https://www.dailypioneer.com/images/logo.jpg,https://www.dailypioneer.com/2020/state-editions/remain-prepared-for-real-time-situation--cs-to-dms.html
5,22-3-20,Janta Curfew; City buses not to ply today,"The city buses will not be operate in Dehradun on Sunday in view of the proposed Janata Curfew from 7 am to 9 pm. The president of Dehradun Mahanagar City Bus Seva Mahasangh, Vijay Vardhan Dandriyal said that the decision is being taken in view call of Janta curfew given by Prime Minister Narendra Modi.

“The day of Janta curfew is very important due to the threat posed by novel Coronavirus (COVID-19). We appreciate this move by the PM Narendra Modi, therefore, we have decided not to operate the city buses on

Sunday.” However, Dandriyal also added that all the city buses are being properly sanitised and the passengers do not need to be scared while travelling through the city buses during other days.",state-editions,https://www.dailypioneer.com/images/logo.jpg,https://www.dailypioneer.com/2020/state-editions/janta-curfew--city-buses-not-to-ply-today.html
6,22-3-20,U’khand Board exam deferred due to COVID-19 threat,"The ongoing examinations of the Uttarakhand board have been suspended due to the threat posed by the novel Coronavirus (COVID-19). The secretary school education, R Meenakshi Sundaram said that the remaining examinations of Uttarakhand Vidhyalayi Shiksha Parishad (UVSP) would remain suspended till further orders. The examinations of class X and class XII of UVSP scheduled for March 23, 24 and 25 would remain suspended due to the threat of Coronavirus.

Questions were being raised on the propriety of continuing the examination of Uttarakhand board even as the examinations of other boards like Central Board of Secondary Examination (CBSE) and ICSE were suspended due to the threat posed by the dreaded COVID-19. It is learnt that the senior officers of the department wanted to continue holding the examinations on the plea that the examination was on its last phase. However on Saturday, the education minister Arvind Pandey evaluated the situation and ordered suspension of the remaining examinations.

The examinations of UVSP popularly called Uttarakhand board started on March 2. The examinations of both the class X and XII were being held in single shift from 10 am to 1 pm.

A total of 150279 candidates were enrolled for class X while 121126 students were registered in class XII examination this year. The board had set up 1324 examination centres out of which 225 were declared sensitive while 27 were hyper sensitive.

Meanwhile, the process of the evaluations of the answer sheets of the board examinations too has been suspended. As per the original schedule, the process of evaluations was to start on April 1 and end on April 15.

The UVSP has also suspended its Diploma in Elementary Education (DElEd) examination slated on March 30.",state-editions,https://www.dailypioneer.com/images/logo.jpg,https://www.dailypioneer.com/2020/state-editions/u---khand-board-exam-deferred-due-to-covid-19-threat.html
