,Date,Title,Article,Category,Image_link,Article_link
76,22-3-20,"Assocham suggests moratorium on debt repayments for corporates, individuals","With the coronavirus outbreak hitting businesses hard, industry body Assocham on Saturday said it has sought form the government a slew of measures to tide over this difficult economic situation.

In a letter to Finance Minister Nirmala Sitharaman, it has suggested moratorium for a period of one year on debt repayments both for corporates and individuals. It has also urged the ministry for an urgent infusion of liquidity by the Life Insurance Corporation of India (LIC) into the Non Banking Financial Companies (NBFCs) in a quasi-equity format.

""Assocham has sought a blanket year-long moratorium by banks on debt repayment both for corporates and individuals as also urgent infusion of liquidity by the Life Insurance Corporation of India into the NBFCs in a quasi-equity format,"" Assocham said in a statement.",business,https://www.dailypioneer.com/images/logo.jpg,https://www.dailypioneer.com/2020/business/assocham-suggests-moratorium-on-debt-repayments-for-corporates--individuals.html
77,22-3-20,"MTNL offers double data in all broadband plans of landline, mobile for a month","State-run telecom firm MTNL will offer double data in all broadband plans of landline and mobile for a month to encourage work from home for people in the wake of rising cases of coronavirus in the country.

""MTNL has doubled free data in all the broadband plans of landline as well as mobile for one month will effect from today so that people are encouraged to work from home,"" MTNL Chairman and Managing Director Sunil Kumar told PTI. The new scheme will be provided to customers in Delhi and Mumbai where the company operates.

On Friday, it announced free broadband service for its landline and new customers for a month to support 'work from home' allowed by most organisations amid the coronavirus outbreak. New customers opting for copper cable based connection will not have to pay even installation charges but will need to buy modem for the service, BSNL officials said.

Public sector companies are the first one to come up with schemes to support work from home.

On Thursday, Prime Minister Narendra Modi asked people to stay indoors and work from home as much as possible while underscoring the dangers of coronavirus, saying the world has never seen a crisis as grave as this.",business,https://www.dailypioneer.com/images/logo.jpg,https://www.dailypioneer.com/2020/business/mtnl-offers-double-data-in-all-broadband-plans-of-landline--mobile-for-a-month.html
78,22-3-20,Authorities ban entry of pilgrims in Ayodhya for Ram Navami Mela,"In the wake of coronavirus concerns, the district administration has banned the gathering of people for Ram Navami Mela in Ayodhya on April 2 for which more than 10 lakhs devotees were expected to converge, officials said.

According to Ayodhya district magistrate Anuj Kumar Jha, the administration took the decision on Saturday to not allow devotees to enter Ayodhya till April 2 and has also banned people from taking a holy dip in river Saryu.

According to seers, this will be the first time that devotees will not be allowed to take part in the traditional Ram Navami Mela. The devotees start converging in Ayodhya from the first day of Navratri festival (March 25 this year).

However, as part of precautionary measures due to Coronavirus pandemic, the administration will barricade all entry points of Ayodhya and devotees will be stopped on borders and sent back, the DM said.

The administration has also instructed owners and managers of hotels and dharamshalas to not entertain any guests and cancel any advance bookings for the period.",india,https://www.dailypioneer.com/images/logo.jpg,https://www.dailypioneer.com/2020/india/authorities-ban-entry-of-pilgrims-in-ayodhya-for-ram-navami-mela.html
79,22-3-20,Migrant labourers sent back without proper screening: Didi,"Even as Kolkata recorded its third corona patient on Saturday Mamata Banerjee hit out at the Centre for allowing unrestricted flow of railway passengers to Bengal without making arrangement for screening them at the Railway stations.

Alleging that Bengal was not only being deprived of adequate stock of equipment required to treat patients and prevent further infection the Chief Minister said “I have been screaming for the past one month about screening the migrant labourers train loads of who are being sent to my State but they are not listening to me and deliberately sending them back to Bengal … With limited infrastructure how will we be able to keep track of these thousands of people when they fan out in the villages?”

The Chief Minister said how her repeated appeal to stop long-distance trains had fallen in deaf ears. “We are entering the third week (of proliferation) and this is a crucial hour. It is a dangerous phase. We are not getting enough cooperation and now this additional hazard (of migrant labourers) for Bengal,” the Chief Minister said appealing to the workers not to go out to other States for work “as we have created enough facility for you to find jobs here in Bengal itself.”

Banerjee had on Friday hit out at the Centre for allowinginternational flights to land in India. “Why should the common people of the country have to bear the burden of a disease brought from outside,” she said. The Chief Minister has called an all-party meeting on Monday with a view to discuss the grave situation arising out of the Corona outbreak in the country.

Meanwhile even as the third Corona case surfaced in Kolkata where a woman from Scotland tested positive and reports of two special trains bringing thousands of migrant labouers back to the State, the Government on Saturday directed the closure of all the restaurants, parlors, pubs, clubs, amusement parks, zoos, museums and other entertainment facilities from Sunday.

Inter-State bus services will also remain suspended from Sunday till t least March 31, Government sources said.

“In order to further check non-essential social gatherings which lead to spread of the virus from infected persons to healthy persons we have ordered the shutdown,” a Government official

said. The Class XII Board examinations which were allowed to continue for the past one week will also remain suspended from Monday till further notice, Education Department sources said.",india,https://www.dailypioneer.com/images/logo.jpg,https://www.dailypioneer.com/2020/india/migrant-labourers-sent-back-without-proper-screening--didi.html
80,22-3-20,Firing kills 1 as inmates clash for masks in jail,"Though there was no corona-infected casualty in Kolkata the scare of the virus apparently led to a skirmish causing one death inside Dum Dum Central penitentiary where two groups of prisoners clashed on Saturday leaving one person dead, sources said.

The dead person received bullet injuries that the inmates claimed was fired by the police.

The clash broke out in the backdrop of growing Corona scare which was further stoked by suspension on court hearings till March 31, lack of masks and sanitizers and alleged selective grant of payroll to the inmates, sources said.

While Jail Minister Jyoti Priya Mullick said things would come to the fore after an inquiry, inside sources said that the under-trials were irked by the turning down of their application for payroll which they alleged was being granted to prisoners who were undergoing sentence.

Another reason for their anger was a bar on jail visits for the next one week by the relatives of the prisoners.

A general grievance for lack of facilities in the backdrop of Corona scare finally snowballed into a clash between the convicted prisoners and the under-trials, sources said adding the police and the jail authorities were also attacked when they tried to intervene even as the two sides fought with

brickbats.

Even as the inmates set the front building afire by igniting the gas cylinders kept in the kitchen and broke open the inner gate the police resorted to firing and bursting tear gas shells, sources said.

Senior officials including ADG prisons, Commissioner of Police Barrackpore also rushed to the spot sources said adding the situation was brought under control after a 4-5 hour skirmish. Fire tenders were pressed into service to douse the flames, sources said.

Meanwhile similar unrest had erupted inside Presidency Jail in Kolkata where the inmates had started protesting sources said adding the police have rushed to the area and were trying to bring the situationunder control.",india,https://www.dailypioneer.com/images/logo.jpg,https://www.dailypioneer.com/2020/india/firing-kills-1-as-inmates-clash-for-masks-in-jail.html
81,22-3-20,TN doing excellent job in fighting epidemic: ADMK,"The entire State of Tamil Nadu has come under a security blanket but with a difference. Instead of gun totting commandoes of para military forces and the State Police, para medics and doctors armed with scanners and sensors welcome travelers at airports, railway stations and bus stations across the State.

Since the news of coronavirus broke out, Tamil Nadu has detected six cases of COVID . “One of the patients has been cured and discharged while others are undergoing treatment in Government-run Rajiv Gandhi General Hospital in Chennai,” said Dr C Vijaya Baskar, Minister for health and family welfare. He said there was no need of any concern and people need not get panic as the State Health Department is in a ‘mission mode’ from day one. He said all were imported cases from different regions with travel histories and were not community transmitted.

That the situation in Tamil Nadu was under control was emphasized by MK Stalin , Leader of the Opposition in the assembly. “The Centre and State Governments are doing whatever they could do to help and save the people from this pandemic. But we too should be vigil against the disease and virus,” Stalin said in a TV commercial, surprising words from the DMK president who is always breathing down the neck of the Edappadi Palaniswamy led AIADMK Government.

“Tamil Nadu is doing excellent job in fighting the coronavirus epidemic. The Minister Dr Vijaya Baskar is working round-the-clock with his team of medical doctors and para medics. The Chief Minister is also monitoring the situation and interacting with the officials on a hourly basis,” said Vaigai Selvan, chief spokesman, AIADMK, who himself is a former minister in the Jayalalithaa government.

Minister Dr Vijaya Baskar said in the assembly on Saturday that elaborate arrangements have been made to monitor and screen people reaching Tamil Nadu from various destinations. “We screen nearly 25,000 persons at Chennai airport daily. The same is the case with MGR Central Railway Station, Egmore and Tambaram Railway Stations,” said the minister.

While all major pilgrim centres have been shut down in the State, the vehicles entering Tamil Nadu from the States of Kerala, Karnataka and Andhra Pradesh are being monitored thoroughly. Passengers reaching the Tamil Nadu borders from Kerala were seen arguing with the health authorities for the tough measures being followed. “We have been told to remain cool despite the harsh words spoken by these people. The attitude of people from Kerala has to change. No wonder, the southern State is reeling under Corona virus scare with more than hundred patients running helter-skelter all over Kerala,” said Abhijit Nakulan, a frequent commuter between Chennai and Kochi by road.

At the time of going to Press, 90 per cent of the public transport in Chennai city remained off the roads as a prelude to Janata Curfew scheduled for Sunday. “By Friday evening itself, Chennai had come to a standstill as a curtain raiser for the big event,” said Sri Priya Iyer, a social activist and motivational speaker. She also said the Government of Tamil Nadu deserved complements for ehat it has done till Saturday to keep corona virus at bay.",india,https://www.dailypioneer.com/images/logo.jpg,https://www.dailypioneer.com/2020/india/tn-doing-excellent-job-in-fighting-epidemic--admk.html
82,22-3-20,"Bihar shuts bus services, restaurants, banquet halls till March 31","The Bihar Government on Saturday ordered shutting down of bus services, restaurants and banquet halls across the state till March 31 to prevent the spread of novel coronavirus, officials said.

However, home delivery and take home services of restaurants will remain functional, a health department order said.

The State Government, invoking the Bihar Epidemic Diseases, COVID-19 Regulations, 2020, said the restrictions have come into force with immediate effect.

“The decision was taken for prevention and control of the outbreak of epidemic disease namely COVID-19 in the state,” Health Department Principal Secretary Sanjay Kumar said in the order.

No coronavirus case has been reported in Bihar so far, Health officials said. Transport Secretary Sanjay Kumar Agarwal said both city and interstate buses will not ply till March 31 in the wake of the coronavirus.

“All types of government and private city buses and interstate buses will not ply till March 31,” Agarwal said.

City buses will stop plying from Saturday, while interstate bus services will be suspended from Sunday, he said.

The state government had on March 18 shut all shopping malls, gymnasiums, spas and swimming pools across the state till March 31 in view of the coronavirus outbreak.

It has also restricted all mass gatherings except marriages and directed shops and restaurants to disinfect the facilities twice a day, besides providing customers with hand sanitisers. The state government had on March 13 ordered closure of all educational institutes, movie theatres, parks, zoos and museums till the month-end.

A total of 520 people who returned to the state from coronavirus-hit countries since January 11 till date have been placed under home quarantine, they added.",india,https://www.dailypioneer.com/images/logo.jpg,https://www.dailypioneer.com/2020/india/bihar-shuts-bus-services--restaurants--banquet-halls-till-march-31.html
83,22-3-20,Continue teaching via WhatsApp: Assam,"The Assam Government on Saturday directed the schools to provide students with course materials and give them homework through WhatsApp to prevent learning gaps and subsequent dropouts during the closure of educational institutes due to the coronavirus outbreak, officials said.

The Education Department asked the schools to create WhatsApp groups with guardians of the students for this purpose, an official said.

The department also asked teachers to make short videos on topics in the syllabi and upload them in the WhatsApp groups, he said. It asked the teachers to assist students with studies over the phone or WhatsApp from 7 am to 9 am and 7 pm to 9 pm, besides making home visits, the official said.

The department also asked the schools to use technologies like Google Classroom in future, the official said.

It asked the schools to create classwise WhatsApp groups in the educational institutes where students and teachers are more in number, he said.

The department directed the schools to identify local youths with smartphones to assist the guardians who do not own such phones, the official said.

All educational institutes in the state have been shut till March 31.",india,https://www.dailypioneer.com/images/logo.jpg,https://www.dailypioneer.com/2020/india/continue-teaching-via-whatsapp--assam.html
84,22-3-20,Big financial package need of hour: Rahul,"In the wake of coronavirus outbreak and possibility of it graduating to its third stage, Congress leader Rahul Gandhi on Saturday called for immediate steps to revive the country's economy on Saturday saying there was a need for a big financial package.

Stating that the onset of coronavirus was a serious attack on country's fragile economy, the former Congress president took potshots at Prime Minister Narendra Modi's call for beating of ""thalis"" in the honour of those working to contain the spread of the virus.

Congress leader said clapping would not help the daily wage workers and small and medium entrepreneurs. ""The coronavirus is a big attack on our fragile economy. Small and medium entrepreneurs and our daily wage workers are the most affected.

""Clapping will not help them. Today there is a need for cash relief and tax sops, besides relief in repayment of loans as part of a big economic package. Take immediate steps,"" the former Congress chief said in a tweet in Hindi.

Congress on Saturday sought the government to provide immediate financial assistance to daily wagers, auto drivers, security guards and small vendors. The party also asked the Modi-government to make advance payment of wages to those linked to MGNREGA.

Number of those infected by Coronaviros to a major jump on Friday taking the total number to 283 across India.",india,https://www.dailypioneer.com/images/logo.jpg,https://www.dailypioneer.com/2020/india/big-financial-package-need-of-hour--rahul.html
85,22-3-20,Business Corner,"SAIL’s massive response to fight COVID-19

New Delhi: Under the guidance of Shri Dharmendra Pradhan, Hon’ble Minister for Petroleum & Natural Gas and Steel, Steel Authority of India Limited (SAIL) has implemented various preventive measures across all its Plants, Units and offices against the spread of COVID-19. In the leadership of Chairman SAIL, Shri Anil Kumar Chaudhary, a host of preventive actions have been spearheaded across the Company on a war footing. Broad-based general guidelines/measures for a scaled response on the management of COVID-19 at all SAIL Plants & Units have been prepared and extensively circulated across SAIL. The social distancing is being promoted along with several other pre-emptive macro measures. It is being monitored on a daily basis. These macro measures by SAIL include facilitating pregnant employees and employees with critical / vulnerable medical conditions to avoid exposure/cross-infection, adequate preparations to run canteens during any contingencies, massive awareness campaigns using visual communications like posters, banners, hoardings etc. Other measures include increased cleaning of the common areas like door, handles, washbasins, taps, lifts stairways etc., introducing adequate sanitising facilities at several locations , use of proper disinfectants for mopping and cleaning floors and office premises, temporary closure of Company’s schools, clubs, gyms, swimming pools, stadiums, sports academies etc. Quarantine facilities at SAIL hospitals and Occupational Health Service centres inside the plants, townships have been being augmented and kept in readiness along with making isolation wards in the SAIL hospitals.

TRIFED Launches Tech For Tribals program

New Delhi: A project aimed to transform 5 crore Tribal Entrepreneurs under the name ""Tech for Tribal"" was launched on 19 March 2020 by TRIFED and IIT-Kanpur along with IIT-Roorkee, IIM Indore, Kalinga Institute of Social Science, Bhubaneshwar and SRIJAN, Jaipurin the first phase of organising tribal entrepreneurship and skill development program. Tech for Tribals, an initiative of TRIFED supported by Ministry of MSME, aims at capacity building and imparting entrepreneurship skills totribal forest produce gatherers enrolled under the Pradhan Mantri VanDhan Yojana(PMVDY). The trainees will undergo a 30 days program over six weeks comprising 120 sessions.",business,https://www.dailypioneer.com/images/logo.jpg,https://www.dailypioneer.com/2020/business/business-corner-business-corner-2020-03-22.html
86,22-3-20,Coronavirus outbreak: Mahindra proposes lockdown for few weeks,"Mahindra Group Chairman Anand Mahindra on Sunday proposed lockdown for the next few weeks, expressing concerns over reports that India is likely to have already reached stage-3 of coronavirus transmission.

He also offered the facilities of the group's hospitality arm as medical care facilities while the group will work on how its manufacturing facilities can make ventilators.

""Going by various reports from epidemiologists, it is highly likely that India is already in stage-3 of transmission. Cases could rise exponentially with millions of casualties, putting a huge strain on medical infrastructure,"" Mahindra said in a series of tweets.

He further said, ""A lockdown over the next few weeks will help flatten the curve and moderate the peak pressure on medical care. However, we need to create scores of temporary hospitals and we have a scarcity of ventilators.""

Sharing plans of the group which has presence across sectors ranging from farm equipment to aerospace, he said, ""To help in the response to this unprecedented threat, we at the Mahindra Group will immediately begin work on how our manufacturing facilities can make ventilators.""

Mahindra further said, ""At Mahindra Holidays, we stand ready to offer our resorts as temporary care facilities.""

The group's project team stands ready to assist the government and the Army in erecting temporary care facilities, he said adding that the Mahindra Foundation will create a fund to assist the hardest hit in our value chain (small businesses and the self employed).

Mahindra also said he will contribute his 100 per cent salary to the fund and add more over the next few months while encouraging ""associates to voluntarily contribute"".

""I urge all our various businesses to also set aside contributions for those who are the hardest hit in their ecosystems,"" he said.",business,https://www.dailypioneer.com/uploads/2020/story/images/big/coronavirus-outbreak--mahindra-proposes-lockdown-for-few-weeks-2020-03-22.jpg,https://www.dailypioneer.com/2020/business/coronavirus-outbreak--mahindra-proposes-lockdown-for-few-weeks.html
87,22-3-20,"Trump: Respect China, but sad it began there","US President Donald Trump has said he greatly respects China and shares a “very good” relationship with his Chinese counterpart Xi Jinping, but termed it “unfortunate” that the coronavirus began in the Communist nation and got out of control.

Speaking at a press briefing on Friday, Trump said he considered Xi as a friend and and asserted that the Chinese President respects the US.

“I have a very good relationship with China and with President Xi. I have great respect for President Xi. I consider him to be a friend of mine. It is unfortunate that this got out of control,” he said.

Trump reiterated that coronavirus originated from China. “They (coronavirus) came from China, it got out of control. Some people are upset. I know - I know President Xi. He loves China. He respects the United States and I have to say I respect China greatly and I respect President Xi,” he

said.

US Secretary of State Mike Pompeo told the same press briefing that China's delay in sharing information about the virus had created risks to people worldwide.

“We need to know immediately. The world is entitled to know. The Chinese Government was the first to know of this risk to the world, and that puts a special obligation to make sure that data gets to our scientists, our professionals,” Pompeo told reporters at a White House news conference on Friday.

“When you see a delay in information flowing from the Chinese Communist Party to the technical people who we wanted to get into China immediately to assist in this, every moment of delay connected to being able to identify this risk vectors creates risk to the people all around the world,” he said. Pompeo, a known critic of China, said he was not blaming Beijing, but the Chinese government was the first to know about the risk the virus presented.

“This is about moving forward to make sure that we continue to have the information we need to do our jobs,” he said. “We need to make sure that even today the data sets that are available to every country, including data sets that are available to the Chinese Communist Party, or made available to the whole world. It's an imperative to keep people safe,” Pompeo said.",world,https://www.dailypioneer.com/images/logo.jpg,https://www.dailypioneer.com/2020/world/trump--respect-china--but-sad-it-began-there.html
88,22-3-20,White House staffer tests positive,"A staffer in the team of US Vice President Mike Pence has tested positive for the coronavirus, making him the first White House personnel to have been infected by the deadly disease that has so far claimed the lives of 230 people in the country.

“This evening we were notified that a member of the office of the Vice President tested positive for the coronavirus,” Katie Miller, Press Secretary to Vice President, said in a statement.

Neither President Donald Trump nor Vice President Pence had close contact with the individual, she said.

“Further contact tracing is being conducted in accordance with CDC guidelines,” Miller said.

This is the first case of a White House staffer being tested positive for the deadly virus. Last week, Trump had tested for the coronavirus but the result was negative.",world,https://www.dailypioneer.com/images/logo.jpg,https://www.dailypioneer.com/2020/world/white-house-staffer-tests-positive.html
