,Date,Title,Article,Category,Image_link,Article_link
0,20-3-20,Continuous R&D must,"The last decades have seen myriad vaccines in progress trailing off after outbreaks of diseases which were Coronavirus cousins, like the SARS and the MERS, fizzled out

When the new Coronavirus genome sequence was posted on an online databank in January, scientists in several biotechnology laboratories around the globe saw its close similarity to the SARS (Severe Acute Respiratory Syndrome) virus and thereby several teams started work on vaccine development. Internationally, experts are of the opinion that the world will “need the vaccines” to contain the current pandemic as it is very possible that this outbreak will not just fizzle out (considering its epidemiology and pattern) like the outbreaks of the last few decades but could return. In fact, it could come back with a vengeance (with mutations and antigenic shifts and drifts).

Large pharmaceutical companies such as Merck, Johnson & Johnson and Sanofi, as well as comparatively lesser-known biotechnology firms like Gilead, Regeneron, Inovio and Moderna, are pursuing vaccines and chemicals to fight the Coronavirus and the estimate is that at least 40 other biotechnology companies, small and big, are on one or the other research and development (R&D) mission for a vaccine or a drug to save the world at this time of a crisis. During the SARS pandemic, a research team at Boston was able to secure investments and thereby work progressed to clinical trials. The team, in all likelihood, could have accomplished all the phase trials for vaccine development. And had that been done during the 2002-2003 epidemic, we could have potentially been equipped with a vaccine to use in China in the initial days of the outbreak. This could have saved the world from the current pandemic and its resultant fallouts.

""This is the problem with the whole vaccine infrastructure, it is reactive and not enough anticipatory. Oh, SARS is gone now, let’s forget the fight we were on and just move on to other projects”, says one of the prominent scientists from the biotechnology industry.

The last decades have seen myriad vaccine R&D work in progress trailing off after outbreaks of infectious diseases which were Coronavirus cousins, like the SARS and the Middle East Respiratory Syndrome (MERS), fizzled out. Whenever a “mysterious” new illness emerges and public alarm is at its peak, there’s a race to develop a way to prevent or treat the disease. But by the time a promising candidate is ready, it’s often too late and the outbreak is on the wane. The world has seen this happen with the outbreaks of Zika, Ebola, SARS, MERS interspersed between epidemics of H5N1 and H7N9 avian, swine and H1N1 influenza.

The reasons for such incomplete work are varied — the potential patient pool for clinical trials dries up once an infectious outbreak subsides and the pool of medical customers for a drug also disappears as an epidemic disappears quite unpredictably, offering little chance to recover an investment of what could be hundreds of millions of dollars. Currently, various R&D works have been going on in parallel. The one at the most advanced stage is at its first human trial in Kaiser Permanente Washington Health Research Institute in Seattle, where four patients received jabs — the first being a 43-year-old mother of two. This vaccine developed at Moderna therapeutics uses pre-existing technology and is made to a very high standard. The company claims it can’t cause the disease as genetic code copied from the virus that causes the disease is used and not a “real virus” extract. It is named Mrna-1,273 Vaccine and is very unlike the usual vaccines in use that are prepared from weakened (live) or killed viruses.

Scientists working at Moderna say the vaccine has been made using a tried and tested process. And at the same time experts reiterate that it will take many months to know if this vaccine has served the intended purpose or not. The main goal of this first set of tests is to find out if the vaccine is safe. If it is, later studies will determine how well it works. Such rapid development of a potential vaccine is unprecedented, and it was possible because researchers were able to use what they already knew about related Coronaviruses that had caused SARS and MERS.

Besides this advancement, there are others on the job for the benefit of humanity. In a suburb south of Boston, robots are manufacturing a potential vaccine. Another candidate vaccine —development work for which started when SARS terrified the world in early 2000s — sits in deep freeze in a repository ready to be thawed and formulated into thousands of vials for further testing. Yet another is being put together at facilities in San Diego and Houston, with projections that it could be tested on people by the summer of 2020. Another laboratory in San Diego, the Inovio, is using a new type of DNA technology to develop a potential vaccine. It is named INO-4,800 and is planned to enter human trials by the summer.

For any vaccine to be deployed after development takes at least a year because of the time needed to run clinical trials and attain regulatory permissions. Hence in all probability there may be an approved therapeutic drug (to treat COVID-19) long before scientists actually arrive at a licenced, marketable vaccine.

Several drug makers, most prominently Gilead Sciences (California) —an anti-HIV drug company and Toyama Chemical (Japan) are testing medicines developed for other diseases as a possible Coronavirus treatment. The most promising, broad spectrum anti-viral drug that has come up is Remdesivir, the same drug that was tried in controlling the Ebola virus outbreak with poor results.

Gilead and health authorities in China are racing to test it on people in controlled trials. This US-based biotechnology company had already shipped this drug to China to be used on the patients even without FDA approval on requests from treating physicians.

Another drug Kaletra — a combination of two anti-HIV drugs from pharma group AbbVie is in trials. The anti-malarial drug Chloroquine is another relatively safe drug with high activity against the Coronavirus, though this needs some definitive clinical trials to mark its efficacy.

The laboratory of Beth Israel in collaboration with Janssen is working to accelerate another vaccine. This laboratory is using a common cold virus to deliver a Coronavirus antigen into cells to stimulate the immune system. This laboratory has earlier used a similar approach to make over a million doses of a vaccine for the Ebola virus that has yet to be licenced. The work done against Coronavirus is in the stage of testing multiple versions of the vaccine on mice, ferrets and Rhesus monkeys exposed to the Coronavirus within a research facility.

Historically, the promise of breakthrough medicines and treatments appears to rest with private companies, and not the federally-sponsored manufacturing sites. Drug companies are often seen to be reluctant to develop vaccines because more often than not such epidemics dissipate long before a vaccine can pass through the regulatory lines and be approved. And the financial implications of such R&D work are too high on the companies to handle, once the disease and the customers dissipate quite suddenly.

Charitable donations are being used to support prominent pharma groups and promising projects and the leading player in this is the Coalition for Epidemic Preparedness Innovations (CEPI). This is supporting Inovio and Moderna groups for vaccine development and its co-founders are the Governments of Norway and India, the Bill and Melinda Gates Foundation and the Wellcome trust.

For future disaster preparedness against infectious disease outbreaks we need funds from Governments and philanthropic organisations to support pharmaceutical groups not just in their basic research but for the late stage developments as well.

(The writer is a doctor by profession)",columnists,https://www.dailypioneer.com/uploads/2020/story/images/big/continuous-r-d-must-2020-03-20.jpg,https://www.dailypioneer.com/2020/columnists/continuous-r-d-must.html
1,20-3-20,"We need quick action, not panic","A Coronavirus vaccine has entered the stage of human-volunteer trials in Seattle, US and in the UK it will happen somewhere in June

COVID-19 has been clouding most minds on this planet for months now. If you still don’t know about COVID-19, you’ve probably just landed from Mars. The most difficult and harmful thing at a time like this is misinformation and scant information, coupled with the lack of tools to handle the disaster. I’m not talking about the contagion but about the level of scaremongering that is not far from the horrifying 2011 sci-fi of the same name. More than 150 countries are battling with Coronavirus today and thousands of lives have been lost. A vaccine has entered the stage of human-volunteer trials in Seattle, US and in the UK it will happen somewhere in June. No conclusive medication has so far been approved by any global authority for treatment, though there have been sporadic reports, including from Jaipur and Delhi, of a “cure”. The World Health Organisation (WHO) has predicted a winter peak later this year with potential cases rising over the 500 million mark and casualties touching over 10 million by end-2020 or early 2021. So where does that bring us? We need to act now. The world woke up to the Coronavirus slower than it should have. The Chinese, Korean, Italian and Spanish lockdowns, the German border closure, French and other European responses and those of the UK, US, Canada and Australia, have all been delayed and partial.

The Indian Government, too, has been, in all honesty, a bit slow in reacting. We have adopted a “brake-and-go” approach. The recent step of involving South Asian Association for Regional Cooperation (SAARC) nations to jointly handle the problem, in view of porous land-borders like Europe, is a commendable step in the right direction. But more is needed. If the outbreak goes out of control, we could see an acute shortage of beds in Intensive Care Units (ICUs) and High Dependency Units (HDUs).

One option could be the Government temporarily bringing all ICU beds under federal control, or at least monitoring their preparedness federally. State Governments have not been proactive on lockdowns. We still have allowance for gatherings in many States, whether for marriage ceremonies or in some places, even otherwise. All gatherings of more than five people should be banned, unless all of them live together in the same household. Still all the States have not closed cinemas, gyms or clamped down on public gatherings. This needs to be done fast. Restaurants need to follow the European lead of ensuring minimum one metre distance (preferably three metres) between customers, else they should be closed temporarily.

Work from home is still sporadically implemented and needs addressing. The Government also needs to ring-fence an emergency budget like the UK and the US to handle the crises. Both employees and employers need to be supported with additional and emergency provisions of sick pay so they can self-isolate quickly. Public information should be more widely disseminated. Handwashing and correct alcohol gel application needs to be taught to every household and the media has a vital role to play here. A blanket ban should, however, be imposed on any media/social media portal spreading misinformation. The public should be educated not to resort to panic reactions of hoarding food and other commodities. This will be counter-productive and lead to more chaos. All non-essential services like Outpatient Departments, elective surgeries and so on should be suspended in all hospitals across the country for two months. This should be done both to avoid any unnecessary public gathering and travel and to free up resources to tackle the worst. All educational institutions should be closed for at least two months. The most vulnerable — those over 70, diabetics, heart patients, those with dementia and immunodeficiency — should have protocols in place and preferably should be isolated for two months. A travel advisory should be issued to avoid all but the most essential travel, which should be clearly defined. Social security measures should be stepped up. Hoarding of any essential material and disinfectants should be acted against immediately to ensure free availability of disinfecting material to the public at reasonable rates and on subsidised rates or free for poor households. A federal disaster management department with daily public updates from the Prime Minister should be set up. This is the time for a daily “Jann ki baat,” not just a one-off address to the nation.

There is a saying in trauma care: “The treatment of bleeding is to stop the bleeding”. The same goes with COVID-19. “The treatment of Coronavirus is to stop it from spreading”. We are in the so-called “Golden Hour” of Advanced Trauma Life Support. But it won’t last long. The window is not more than 15 days. There’s no need to panic, only to act quickly, logically and responsibly. This is a war which people and Governments need to fight together. Of course there will be some losses which can be minimised by right action at the right time. Empowerment of masses through right education and their participation is the key to combat this. However the Government cannot leave it for the masses to fight it out either. A joined-up thinking is required.

(The writer is a UK-based International Healthcare Policy Expert)",columnists,https://www.dailypioneer.com/images/logo.jpg,https://www.dailypioneer.com/2020/columnists/we-need-quick-action--not-panic.html
2,20-3-20,Birth of a new work culture,"As more and more people worldwide work from home, many core company policies for remote workers, telecommuting, cybersecurity, crisis management and so on will need an overhaul

Many of you would have seen a cartoon doing the rounds of social media which shows a man sitting on a couch with a laptop and an accompanying caption which reads, “Oh that meeting was just an email!” Some of you reading this now might have gotten used to music streaming in from your neighbour’s house, as you sip on your favourite beverage while on a video call with 30 of your colleagues in casuals. The new workplace is here and chances are it will change the way humans will ever work, that is if they stay long enough, to reboot planet Earth. The global pandemic has ensured a new world of cars parked in garages, cleaner city air, occasional wildlife appearances in deserted streets and fishes and dolphins being spotted in rivers and oceans closer to cities. Many point out that large technology companies and global corporations, which already have flexible work options, superior cybersecurity fixes and streamlined work from home policies, will be the first ones to deliver large chunks of jobs home. The question is what happens to smaller firms and micro-firms that do not have access to these high-end solutions and seek maximum efficiency from (in many cases) shoestring budgets and minuscule employee strength. These firms will find it difficult to manage productivity. There are many more likely outcomes which will need fresh thinking, particularly in the areas of urban space planning, power management, human resource management and many integrated policy issues.

When companies realise that they can perform optimally with remote workers, they are most likely to vacate plush commercial spaces. Real estate valuations for most of these spaces will undergo a huge downgrade as anchor corporations exit. This will impact financial firms, banks and developers with exposure to office properties. Long-term leases are also most likely to come under stress. Shift to a home workstation also means daily power consumption patterns will shift geographies within cities. Traditionally, during weekdays, power demand peaks in office complex zones shifting to residential complexes at night and entertainment zones like malls, shopping complexes hotels and so on during the weekends. However, with a likely crumbling of traditional cubicles, power consumption patterns will even out across the cityscape all the days of the week. This will also stem demand for better broadband and network connectivity, 24/7 demand for electricity and chic meeting joints in residential neighbourhoods.

A crucial aspect of modern office work is earned sick leave for employees. While most global corporations and Government staff will have access to substantial number of earned leaves per year, it is the medium small size and micro-firms which will have to rethink their policies. Most small firm employees would lament lack of earned leaves in their respective set-ups for fear of losing jobs.

The situation becomes far graver for a country like India which has far more Micro, Small and Medium Enterprises (MSMEs) and family firms employing less than ten people. Add to this the support staff like housekeeping, cleaners, drivers, maids, office delivery persons who make up a vital part of any office. Most of them today would be fearful of reporting a fever or a seasonal illness and in turn spread diseases across communities, homes and offices. With global trends shifting to the work from home culture, a fresh clamour for some kind of group insurance for the unorganised sector and mandatory earned leaves, specially for a country like India, will continue to grow.

The Uttar Pradesh Government has done a commendable job by announcing a certain fixed amount transfer for daily wage earners and labourers, who are likely to lose livelihoods for some days due to temporary shutdowns of cities and towns. This initiative should trigger similar moves by other State Governments but it will still leave out a huge chunk of the urban workforce in the unorganised sector. Think of your domestic help, cooks, delivery agents and so on, who are mostly considered a temporary workforce. Traditionally they do not have earned sick leave or medical insurance and post-retirement benefits.

Threats like COVID-19 should be a wake-up call for employers/employees to demand group insurance for micro and small firms and seek recognition of temporary workforce for benefits on the same lines as their permanent counterparts. Contrary to popular belief, this may actually bring down costs for many employers as preventive measures could prove a hundred times better than a cure in the long run. This is also more likely to bring a sense of professionalism found lacking in many workers in the unorganised sector as additional answerability, including regular health checks will foster discipline. Finally, many core company policies like creating new work protocols for remote workers, telecommuting, remote access and cybersecurity policies, remote recovery, crisis management, virtual private network management and many such will need an overhaul.

Pandemics don’t need passport for entry into geographies. It may create a temporary shutdown of borders and may give strength to voices opposed to a globalised world. However, one should remember that pandemics require multinational cooperation to formulate an integrated strategy for citizen safety and health. This should bring nations closer, now more than ever.

(The writer is Country Manager, India, ITI Council)",columnists,https://www.dailypioneer.com/images/logo.jpg,https://www.dailypioneer.com/2020/columnists/birth-of-a-new-work-culture.html
