,Date,Title,Article,Category,Image_link,Article_link
149,20-3-20,Kerala CM seeks support of civic bodies to check third phase spread of virus,"Kerala Chief Minister Pinarayi Vijayan on Thursday sought the support of local body institutions to check the spread of coronavirus in the State, where 24 people including two foreigners, have so far rested positive for the virus and over 25,000 are under surveillance.

In a video conference meeting held with local body members and officials across the State, he said an “unusual” situation was prevailing in the State and even a minor lapse would worsen it.

Though the present restrictions imposed to check the further spread of the infection would cause some temporary difficulty, everyone should cooperate considering the emergency situation, he added.

“The Government will make all possible steps to ensure adequate supply of food and medicines. Local body representatives have a significant role to play in ensuring normal life to those under surveillance,” Vijayan said.

Pointing out the responsibilities of the civic bodies and its members, the Chief Minister said they should initiate special awareness drives among migrant and MNREGA workers who have suffered job loss due to the virus outbreak.",india,https://www.dailypioneer.com/images/logo.jpg,https://www.dailypioneer.com/2020/india/kerala-cm-seeks-support-of-civic-bodies-to-check-third-phase-spread-of-virus.html
150,20-3-20,Mamata warns rumour mongers of strict action,"With rumors of a complete shutdown and possible scarcity of daily essentials gripping the market, Bengal Chief Minister Mamata Banerjee on Thursday warned the rumor mongers of strict action for “spreading false and fake information.”

“Some people are spreading rumor about a complete shut down and a possible scarcity of essential items in the face of corona scare but I want to warn these elements to desist from making false, fake and irresponsible information … The police have been instructed to take stringent action such people who are spreading such rumor,” Banerjee said.

“All shops are open and will remain open and there is no need to fear. Though the borders with some States have been sealed there is enough stock with us and the situation is normal,” she said adding the Government was in firm control of the situation.

Bengal Government has made elaborate preparations to deal with situations related to Corona outbreak Banerjee said. The Chief Minister who held a lengthy meeting with private medical facilities and the nodal agencies of the Government said that Corona was a challenge and her Government was determined to win it.

“Corona is a challenge and we will definitely win it,” Banerjee said appealing to the private players to come forward and contribute towards the fighting the pandemic.

“This is not time for business. We will have to stand by the people together and fight against this disease which has come as a threat to the mankind,” Banerjee said alleging her Government has not been getting the kind of support it requires from the central government to erect a preparedness against any possible outbreak of the disease. “We are waiting for the kits from the Centre but they have not sent us the kits,” she said.

Presently out of 399,469 people screened and 77 samples tested in the State only one person—a son of a bureaucrat who recently returned from London — has tested positive, the Chief Minister said.

She said 25 people have been kept in isolation and 17,500 people have been advised home surveillance. “We are procuring 2 lakh special suits for the nurses who involved in corona care … besides this orders have been placed for 300 ventilation machines” she said adding , about two lakh gloves and as many numbers of masks were being procured.

Apart from the isolation beds kept available at Beleghata ID Hospital and Chittaranjan Cancer Institute, Rajarhat, 50 beds have been kept ready at RG Kar Hospital and 150 beds have been earmarked at MR Bangur Hospital, she said. This apart, district hospitals at Siliguri in North Bengal, Midnapore, Burdwan are being readied to tackle emergency, she said.

The Chief Minister on Wednesday had ordered a 50 percent reduction in staff attendance at Government offices. “Daily till next circular the staff will be allowed to leave office by 4 pm instead of 5 pm in the evening so that there is less rush in trains and buses,” she said.

Meanwhile, the Trinamool Congress and the Left blamed the BJP for mingling politics with relief work even as the workers of that party went about distributing saffron masks among the people.

“This is obnoxious, dirty that people of some party will play politics when the country is facing such unprecedented crisis,” a senior Minister in the Government said.",india,https://www.dailypioneer.com/images/logo.jpg,https://www.dailypioneer.com/2020/india/mamata-warns-rumour-mongers-of-strict-action.html
151,20-3-20,‘Only critical cases should visit JIPMER in view of COVID-19’,"In the wake of the spread of coronavirus, the Centrally sponsored JIPMER in Puducherry on Thursday asked only patients with critical ailments and requiring tertiary care should visit the hospital.

Making this appeal through a circular, JIPMER (Jawaharlal Institute of Postgraduate Medical Education and Research) said this was part of the precautionary steps to save patients from the spread of the novel COVID-19.

The hospital said around 10,000 patients visit the hospital every day for treatment. So, it is likely that the patients include those having symptoms of the virus.

“There is, therefore, a real risk of those visiting JIPMERcatching the infection,” the circular said.

It said patients with minor ailments seeking medical advice are discouraged from visiting the hospital in view of disproportionately high risk of exposure to infection, including CVID-19, in the crowded hospital.

Specifically, elderly persons with such chronic ailments like diabetes, hypertension, cancer and heart diseases who are on regular and continued medication should avoid coming to the hospital simply for receiving drugs.",india,https://www.dailypioneer.com/images/logo.jpg,https://www.dailypioneer.com/2020/india/---only-critical-cases-should-visit-jipmer-in-view-of-covid-19---.html
152,20-3-20,"Raj CM: All Govt, semi-Govt departments to be shut till Mar 3","Rajasthan Chief Minister Ashok Gehlot on Thursday directed shutdown of all Government and semi-government departments, autonomous institutions and state corporations till March 31 in the wake of the rising cases of coronavirus.

However, departments related to essential services will continue to work, he said.

Gehlot also directed officials concerned to postpone examinations in all schools and colleges till further orders.

He said appropriate arrangements should be ensured promptly, taking lessons from Italy to contain the coronavirus pandemic.

The next two weeks are particularly important for the spread of the disease, so every person must play the role of a responsible citizen, he said.",india,https://www.dailypioneer.com/images/logo.jpg,https://www.dailypioneer.com/2020/india/raj-cm--all-govt--semi-govt-departments-to-be-shut-till-mar-3.html
153,20-3-20,Sidda raises doubts over BSY Govt's ‘longevity’,"Leader of the Opposition in Karnataka Assembly Siddaramaiah on Thursday sought to taunt Chief Minister BS Yediyurappa by raising questions about his Government's longevity and said there was no guarantee about the ruling BJP continuing in power for remaining three years.

The former Chief Minister cited “political developments” in the BJP for his doubts.

While speaking about increase in loans availed by the Government and consequences that may arise in the future, Siddaramaiah said “assuming for argument sake that you (BJP) will continue (in power) for three years...”

Immediately responding to this, Yediyurappa said “we will be here (continue in power)..”

Siddaramaiah then said “if you are continuing... happy Mr Yediyurappa, what trouble will I have, but we don't have guarantee that you will continue or not, because lot of things are happening within your party, we will not get involved into those things or do anything.”

Participating in the discussion on the Budget, he said “there are lot of political developments that are happening.”

As someone from BJP said, there were political developments within the Congress also, Siddaramaiah said: “that means similar developments are happening among you (BJP) right? see it is admitted by themselves (BJP MLAs) now.

What happened here (Congress), is happening there also.”

Several times in the past too Siddaramaiah has raised questions about the longevity of Yediyuraapa-led Government that came to power after the collapse of the Congress-JD(S) coalition Government headed by HD Kumaraswamy last year, due to “internal disgruntlement.”

According to BJP sources, the win of 11 disqualified Congress-JD(S) legislators on BJP ticket and ten of them being inducted as Ministers has given much need stability to the Government.

But “disgruntlement” among some party seniors and loyals who failed to get Cabinet berth and their displeasure over Yediyurappa's style of functioning, has posed fresh challenge to the Government, sources said.",india,https://www.dailypioneer.com/images/logo.jpg,https://www.dailypioneer.com/2020/india/sidda-raises-doubts-over-bsy-govt-s----longevity---.html
154,20-3-20,TMC sniffs Hindutva agenda in PM's address,"The Trinamool Congress on Thursday alleged that Prime Minister Narendra Modi's address to the nation on combating coronavirus had a “hidden Hindutva agenda” and claimed that he failed to give any direction on how to tackle the pandemic.

The remark was made by Mamata Banerjee's cabinet minister Subrata Mukherjee minutes after the PM's address in which he urged all Indians to stay indoors as much as possible to avoid getting infected by coronavirus, saying the world has never seen a danger as grave as this.

Modi also called for the “janata curfew” on March 22 from 7 am to 9 pm, saying no citizen, barring those in essential services, should get out of house.

“He has failed to provide a direction to the nation in combating the pandemic. There is no proper proposals to tackle it. Rather, he was speaking of ringing bells, this is absurd. How will you combat coronavirus by ringing bells,” Mukherjee said.

“There is a Hidden agenda of Hindutva and the RSS in his speech. We condemn such an approach during this national crisis,” Mukherjee, a senior TMC leader and minister said.

The TMC leader in the Rajya Sabha, Derek O' Brien, wondred whether the PM's speech was high on gimmicks and low on solutions.",india,https://www.dailypioneer.com/images/logo.jpg,https://www.dailypioneer.com/2020/india/tmc-sniffs-hindutva-agenda-in-pm-s-address.html
155,20-3-20,Prices of alcohol used in making hand sanitizers capped under Essential Commodities Act: Govt,"The Centre on Thursday said prices of alcohols used in manufacturing hand sanitizers have been capped under the Essential Commodities Act on account of coranavirus outbreak.

Due to COVID-19, prices of the alcohol used in manufacturing the hand sanitizers have been exorbitantly increased by the producers in the last couple of weeks.

It has also notified that the raw materials used in manufacture of essential commodities are also essential commodities under the E.C Act. States can now ask the manufactures of these alcohols not to increase the prices of their produce without concurrence of the Central Government.

“On these items, the States may now notify the Central order in their official Gazette, also issue their own orders under the EC Act to that effect and take necessary actions as per the situation prevailing in the respective States”, it said.

The decision would empower the Central Government and States/UTs to regulate prices, production, sale, distribution, transport, movement, storage, information etc. of alcohols used in manufacturing the hand sanitizer as preventive measure to avoid infection from COVID-19. It will smoothen the sale and availability of these items and carry out operations against hoarders, speculators, profiteers, blackmarketeers etc. and those involved in contravention of the orders of Central Government and States/UTs in respect of the above alcohols. This will help the manufacturers of hand sanitizers to keep prices of their and product at reasonable and within the reach of the common people.

The Central Government has requested the States/UTs to advise the manufacturers of deodorants to manufacturer alcohol based hand sanitizer spray with ethyl alcohol as main content on mass scale in the same plant which may manufacture this alcohol based sanitizer at very low cost and make it available in the market at the earliest.",india,https://www.dailypioneer.com/images/logo.jpg,https://www.dailypioneer.com/2020/india/prices-of-alcohol-used-in-making-hand-sanitizers-capped-under-essential-commodities-act--govt.html
156,20-3-20,"4,296 people screened in Mizoram, no cases so far","Altogether 4,296 people were screened at the Lengpui airport and other screening counters along the inter-state and international borders on Thursday, an official said.

Not a single confirmed coronavirus case has been reported in Mizoram till date, a health department official said.

He also said that at least 156 people, who returned from abroad recently, have been placed under home quarantine as a precautionary measure though they did not show any symptoms of being infected with the deadly virus.

Meanwhile, an official statement said that the Indo- Bangladesh border has been sealed and the entry point along the international border was open only at Zokhawthar on the Mizoram-Myanmar border. The statement also said that Health Minister Dr R Lalthangliana held a meeting with Mizoram Kohhran Hruatute Committee (MKHC), a conglomerate of church leaders' committee, and sought its help to prevent the spread of coronavirus on Thursday.

It was also decided in the meeting that awareness would be created through the weekly bulletins of the churches.

The MKHC also would take measures to ensure that mass gathering is avoided at important programmes such as weddings, memorial stone erections and other important events concerning the churches.",india,https://www.dailypioneer.com/images/logo.jpg,https://www.dailypioneer.com/2020/india/4-296-people-screened-in-mizoram--no-cases-so-far.html
157,20-3-20,Gujarat cancels recruitment exams,"In a proactive measure to stop The spread of the coronavirus in Gujarat, the government on Thursday decided to cancel all recruitment exams scheduled to be held till March 31 and suspend state bus services to Maharashtra. Now, these tests will be conducted after April 20, said a government release. Chief Minister Vijay Rupani, along with his deputy Nitin Patel, chaired a high-level meeting to review the preparedness of the state machinery to counter the spread of the novel coronavirus (Covid-19).

The meeting was held hours before the state health department formally announced that two positive cases of the coronavirus have been detected in Gujarat for the first time after the outbreak.",india,https://www.dailypioneer.com/images/logo.jpg,https://www.dailypioneer.com/2020/india/gujarat-cancels-recruitment-exams.html
158,20-3-20,C’garh Govt sent notice to NCL over mining crisis,"Congress-ruled Chhattisgarh Government has sent a notice to National Coalfields Limited (NCL) over the differences cropping up between villagers, NGOs and companies mining iron ore and coal in the State resulting in closure of operations affecting the State exchequers. The Bhupesh Baghel Government has asked the representatives of NCL to immediately resolve the crisis with other stakeholders.

NCL is a joint venture company between the National Mineral Development Corporation (NMDC) and Chhattisgarh Mineral Development Corporation (CMDC). “The mining lease for iron ore in Bailadila Hills in Dantewada had lapsed and fresh action needs to be taken on whether or not new leases will be issued,” said the note to NCL.

A senior NMDC official said that mining has been halted in the region because of the agitation and inquiries initiated by the State government. The tribals, villagers have argued that those who have either signed or put their thumb impressions during the gram sabha meeting in April 2014 are either no more alive or their consent was taken forcefully and hence now all the conditions and compensation issue has to reviewed in a fresh gram sabha meeting.

Baghel has ordered a probe into complaints received against the gram sabha which earlier had approved the project way in 2014 under the BJP ruled Raman Singh government. What further has complicated the issue is a report by district administration that explains the said gram sabha meeting of 2014 was a fake one as only 109 villagers signed in the state government register whereas 806 lived in the village then.

Recently at a gram sabha meeting at Hiroli, a village panchayat located in Dantewada where there was a demand for closure of the mines and alleged they were not paid compensation by the state government.

Besides NCL, the other company whose works will be severely impacted is Adani Enterprises appointed by NMDC as a Mine Developer and Operator (MDO) for the mine in December 2018.” said sources in the government. While NCL is yet to respond to the demands, Adani conveyed that they came into picture after bidding in December 2018 and the gram sabha had approved in 2014.

But political sources said that the issue is due to emerging differences between Baghel and State Health Minister TS Singh Deo who was one of the contenders for the Chief Minister post when Congress decimated the BJP's 10 year rule.

“Singh Deo is considered to be the undisputed leader of mineral-rich Sarguja district where most of the mining area falls and has several times lodged his grudges to the party high command against incumbent CM. He had been eyeing for the CM post since Congress came into power. Singh has not heeded to the pleas and interest of the displaced people in mining area citing economic loss to the government, Baghel is all out to protect the interest of the farmers, tribals and affected people. With Adanis already a recognized MDO, connivance between political and business interests in Sarguja Ambikapur mine rich area cannot be ruled out,” said a state government official camping in national Capital to get resolve the crisis.",india,https://www.dailypioneer.com/images/logo.jpg,https://www.dailypioneer.com/2020/india/c---garh-govt-sent-notice-to-ncl-over-mining-crisis.html
159,20-3-20,Corruption reached peak in UP in 3 years: Akhilesh,"Claiming that “gundaraj” and “corruption” reached its peak in Uttar Pradesh in past three years, Samajwadi Party chief Akhilesh Yadav on Thursday alleged that 65 farmers committed suicide in Mahoba due to financial problems.

He was talking to reporters at party headquarters. “In the past three years, 'gundaraj' and corruption reached its peak in UP. They talk about doubling farmers income by 2022 but the reality is that it has become half. “On February 29, 14 MLAs and MLCs of the party went to Mahoba and met family members of 65 farmers, who committed suicide due to financial crisis,” Akhilesh said.

Trashing claims of Chief Minister Yogi Adityanath that his government was number one, he said, “This government is number one in providing poor health facilities and education, giving bad quality mid-day meals, in fake encounters, crimes against women and children, atrocitiesagainst rape victims, corruption and promoting casteism.”",india,https://www.dailypioneer.com/images/logo.jpg,https://www.dailypioneer.com/2020/india/corruption-reached-peak-in-up-in-3-years--akhilesh.html
160,20-3-20,UP:12-year-old girl gang-raped,"A 12-year-old girl was allegedly abducted and gang-raped in Uttar Pradesh's Mahoba district, police said on Thursday.

The incident occurred in Kabrai area on Tuesday night when two persons came to the girl's house and took her to secluded place and raped her, the police said.

The girl raised an alarm, following which villagers caught a suspect, Chhote (23), while another, Devideen (22), managed to flee from the spot, according to the police.

On a complaint of the minor's family, an FIR has been registered and Chhote was arrested. Hunt is on to nab the other suspect, the police added.",india,https://www.dailypioneer.com/images/logo.jpg,https://www.dailypioneer.com/2020/india/up-12-year-old-girl-gang-raped.html
161,20-3-20,LS passes Bill for ‘national importance’ tag to Gujarat’s ayurveda institutes,"Lok Sabha on Thursday passed a Bill which seeks to accord the status of institution of national importance to a Jamnagar-based cluster of ayurveda institutes. The Institute of Teaching and Research in Ayurveda Jamnagar will be granted institution of national importance by conglomerating the cluster of Ayurveda institutes at Gujarat Ayurveda University campus in Jamnagar.

Many MPs while supporting the bill demanded that many Ayurveda institutes in Kerala and other South Indian states must also get preference. Moving the Institute of Teaching and Research in Ayurveda Bill

for passage, the Minister of State for Ayurveda, Yoga and Naturopathy, Unani, Siddha and Homoeopathy (AYUSH) Shripad Yesso Naik said people across the globe are now showing greater interest in ayurveda which has its origin in India.

Some amendments moved by Opposition members were defeated by voice vote.

The three institutes which would be clubbed are Institute of Post Graduate Teaching and Research in Ayurveda, Gulabkunwerba Ayurveda Mahavidyalaya and Institute of Ayurveda Pharmaceutical Sciences",india,https://www.dailypioneer.com/images/logo.jpg,https://www.dailypioneer.com/2020/india/ls-passes-bill-for----national-importance----tag-to-gujarat---s-ayurveda-institutes.html
