,Date,Title,Article,Category,Image_link,Article_link
68,20-3-20,Three OSDs to ramp up fight against Covid-19,"To ramp up its preventive measures to combat Covid-19, the Chhattisgarh government on Thursday appointed two IAS officers and a state administrative officer as officers on special duty with additional charge of the state and health family welfare department.

According to an order issued by the state administration department, Prabhat Mallik, director, institutional finance with additional charge of chief operating officer CHiPS and D Rahul Venkat, deputy secretary, planning and economics, statistics and ex-officio deputy secretary, Chhattisgarh state planning commission and deputy secretary tourism and culture have along with the existing charges been appointed as officers on special duty (OSDs), of the state health and family welfare department.

SAS officer Deepak Agrawal, deputy secretary, state election commission, Chhattisgarh has been attached with the health and family welfare department for coronavirus-related work at the secretariat as OSD.",state-editions,https://www.dailypioneer.com/images/logo.jpg,https://www.dailypioneer.com/2020/state-editions/three-osds-to-ramp-up-fight-against-covid-19.html
69,20-3-20,Police to track people with history of foreign visits,"The Chhattisgarh police are now going to track people who have visited foreign nations after March 1, an official said here on Thursday.

Director general of police (DGP) DM Awasthi has asked the district superintendents of police (SPs) to collect the names, addresses, contact details and the travel history people who have travelled abroad from tour operators and agents.

The order was issued after a woman in Raipur tested positive for Covid- 19. She had returned from London and has been admitted in a isolation center at the AIIMS Raipur along with her family members.

The DGP has also instructed all police units to brief all police personnel about coronavirus-related precautions to be followed during evening and night calls.

The unit chief has been given the responsibility to ensure that if in any police station/line/company a conronavirus suspect is found, then they should be immediately isolated and senior officials must be informed.

In every unit, arrangement for washing hand and sanitizers and masks should be provided, the DGP said.

Further the traffic police have been directed not to use breath analyzers until further orders.

Similarly, traffic police officials and personnel on road intersection duty, patrolling duty, challan duty and others, will have to mandatorily use masks.

Before entering a traffic police station/office it has been mandatory for visitors to hash their hands with a hand sanitizer and hand wash.

Besides, if police personnel on duty spot any suspected person, then the health officials have to be informed.",state-editions,https://www.dailypioneer.com/images/logo.jpg,https://www.dailypioneer.com/2020/state-editions/police-to-track-people-with-history-of-foreign-visits.html
70,20-3-20,"Tourism dept issues guidelines to DCs on hotels, motels and resorts","To contain the spread of Covid-19, the state tourism department on Thursday directed district collectors not to permit any organizations to hold social or community events at tourism spots across Chhattisgarh.

District collectors have been directed to not to grant permissions for organizing any kind of social-community events in the tourist destinations of the state, keeping in view the threat of infection in crowded places, a tourism department circular said.

Any kind of gathering at such places should be completed avoided and prevented, it said.

Collectors have been instructed to collect information about foreign tourists checking in at hotels, motels, resorts and other rest houses across the state, and ensure their health check-ups.

District chiefs have also been asked to coordinate with the owners and managers of hotels, motels, resorts as well as tour operators and provide them necessary guidelines to create awareness, the circular said.",state-editions,https://www.dailypioneer.com/images/logo.jpg,https://www.dailypioneer.com/2020/state-editions/tourism-dept-issues-guidelines-to-dcs-on-hotels--motels-and-resorts.html
71,20-3-20,PM praises Naveen for sis registration,"Prime Minister Narendra Modi has praised Chief Minister Naveen Patnaik for his decision to register the details of his sister Gita Mehta on the State Government’s COVID-19 portal.

In a tweet, Modi stated, “Setting a great example, Chief Minister! I hope others also emulate Naveen Babu. We all can do our bit in preventing the spread of COVID-19.”

On Wednesday, the Chief Minister had said he has registered the details of his sister on the COVID-19 portal after her return from abroad. He also appealed to others to register details of their family members and friends returning from abroad.",state-editions,https://www.dailypioneer.com/images/logo.jpg,https://www.dailypioneer.com/2020/state-editions/pm-praises-naveen-for-sis-registration.html
72,20-3-20,Congress cries foul at government decisions,"The Congress party has criticised the Uttarakhand Government for taking important policy decisions outside the assembly even as the budget session is underway.

The Leader of Opposition (LoP) in state assembly Indira Hridayesh said that the as per the constitutional practices, the Government should make important policy decisions on the floor of the assembly.

She said that the budget session of the assembly is in progress and the Government is making policy decisions outside. The Kedarnath MLA, Manoj Rawat also criticised the government for ignoring the assembly.

He said that decisions like reservation in promotion are related to wider interests of public and as per the established traditions, the Government should have made them in the assembly.",state-editions,https://www.dailypioneer.com/images/logo.jpg,https://www.dailypioneer.com/2020/state-editions/congress-cries-foul-at-government-decisions.html
73,20-3-20,MCL to end FY ’20 on a high note,"The Mahanadi Coalfields Limited (MCL) is set to end the financial year 2020 in style, setting a new benchmark of daily and monthly coal productions.

Despite challenging situations due to prolonged monsoon, bandhs and unseasonal heavy rains in the current fiscal, the MCL recorded the highest one-day production of coal by a subsidiary in the history of Coal India.

With the return of conducive business environment in the second half of the financial year, the project teams bounced back successfully steering the company from turbulent conditions.

Last push to further minimise the negative growth of 3.5 per cent as on date has been planned and the employees’ unions have appealed to all production teams to put extra efforts to maximise production in the balance 13 days of the current fiscal year.

The coming two weeks will witness the MCL’s resolve to become a coal company registering highest production on day to day basis ever, beating sister subsidiary South Eastern Coalfields Limited (SECL).

While a series of production-cum-safety days are being observed to motivate the project teams across Jharsuguda, Sundergarh and Angul district of Odisha, CMD BN Shukla appealed all the coal production and dispatch teams to give utmost priority to safety while operating in the mines.",state-editions,https://www.dailypioneer.com/images/logo.jpg,https://www.dailypioneer.com/2020/state-editions/mcl-to-end-fy----20-on-a-high-note.html
74,20-3-20,Ghatuary 1st DLitt in Odishi dance,"Iernationally renowned Odishi dancer and compere Srinivas Ghatuary, popularly called Milan, has added another feather to his cap and brought laurels for the State.

He has been honoured with DLitt for his contribution to the classical dance by the University of Central America.

He is the first dancer of the State to be conferred with this honour.",state-editions,https://www.dailypioneer.com/images/logo.jpg,https://www.dailypioneer.com/2020/state-editions/ghatuary-1st-dlitt-in-odishi-dance.html
75,20-3-20,SEWS delegation meets Labour Commissioner,"Members of the SIIDCUL Entrepreneurs Welfare Society (SEWS) met the new state labour commissioner Dipti Singh and discussed various issues with her.

The delegation talked of measures to enable women workers to work the night shift in industrial units. They also discussed increasing overtime to 100 hours which would also benefit the workers. This would also tackle the issues faced in industries due to shortage of workers. Easy compliance and other issues were also discussed by the SEWS delegation with the labour commissioner.

The commissioner exhorted the SEWS members to ensure protection of the workers from spread of novel coronavirus.

The delegation informed her about the measures being taken for this purpose. SEWS members including Manoj Tyagi, Ashutosh Sharma and others were present in the meeting.",state-editions,https://www.dailypioneer.com/images/logo.jpg,https://www.dailypioneer.com/2020/state-editions/sews-delegation-meets-labour-commissioner.html
76,20-3-20,Let State Red Cross unit be rejuvenated,"On October 29 night, 1999, the Super Cyclone ripped through Odisha and created unprecedented havoc. Kharanta Tutha village was destroyed and the houses were damaged. Basanti Nayak and her husband Khirod took shelter under a tree.

Basanti Nayak was pregnant and was in extreme pain. Khirod took Basanti to the nearest Red Cross cyclone shelter. Immediately, the godown of the cyclone shelter was converted into a labor room. In the shelter a woman named Ambika Jena helped Basanti being a nurse, as she was experienced enough being a mother of five children.

The condition was so worse that the umbilical cord of the new born baby was removed with the help of a coin after sharpening it first. The baby took birth safely thereafter and as he spent the first week of his life in the Red Cross cyclone shelter his father Khirod and mother Basanti kept his name as “Red Cross”.

As per the Government of India report, the 1999 Cyclone was the biggest disaster in south Asia where 10,000 people and 3 lakh animals died. But 40,000 people could be rescued as prior to the cyclone, Odisha Red Cross was able to build 23 cyclone shelters in the coastal area.

In 1936, the Indian Red Cross Society, Odisha State Branch was initiated in our State. The Governors of Odisha were the ex-officio president of Red Cross State branch. From time to time, the presidents give appointment to the State secretaries for the state branch. In the leadership of the State secretaries, the State branch usually functions. Few years ago, the State branch was very active, as mentioned above. Till date, Red Cross State branch has completed 75 cyclone shelters. The State branch along with the cyclone shelters adopted villages, training the people in the field of disaster preparedness and management, first- aid response, youth leadership etc, organizing search and rescue operations, health camps, blood donation camps, conducting relief operations, blood grouping camps, ambulance service, Nirbana service, family counselling services and many more.

The State Red Cross was able to do these types of works with the help of life members and volunteers. There was a monthly life members meeting and from that meeting the secretary chose the active life members and build small different groups and committees like Fund Raising Committee, Relief Committee, Finance Committee, Adopted Village Committee, Purchase Committee etc.

The Red Cross State branch was also managing 55 blood banks in the name and style of Red Cross. But when the Indian Red Cross Society observes its centenary year, the Odisha State branch appears very tired. The organisation is active but the appointed secretaries do not have the determination to carry the organization forward. The president always gave appointment to either a retired person or the officers from the Health department those who have one or two years for retirement. In this case they do not have any interest to do the work; on the other hand, they just want to run the State Red Cross as a Government office.

Red Cross is a voluntary and also member based organization, and true development would happen if the volunteers and members gather together and discuss stuffs which they do not want to agree. So the State branch is on the verge of getting destroyed.

The Odisha Red Cross State branch is a branch of Indian Red Cross Society and Indian Red Cross Society is also a part of the largest humanitarian organization of the world. The renowned Nobel award winner Jean Henry Dunant is the founder of Red Cross. In his initiative the international Red Cross committee formed in 1863 and it was approved by every nations of the world in 1964 through Geneva Convention. Now Red Cross is working in more than 185 countries as the National Society. In our country it is working in the name and style of Indian Red Cross Society.

Now it is 100 years old. During the First World War in 1914, India had no organisation for relief services to the affected soldiers, except a branch of the St John Ambulance Association and by a Joint Committee of the British Red Cross. Later, a branch of the same committee was started to undertake the much needed relief services in collaboration with the St John Ambulance Association in aid of the soldiers as well as civilian sufferers of the horrors of that Great War. A bill to constitute the Indian Red Cross Society, independent of the British Red Cross, was introduced in the Indian Legislative Council on March 3, 1920 by Sir Claude Hill, member of the Viceroy's Executive Council who was also Chairman of the Joint War Committee in India. The Bill was passed on March 17, 1920 and became Act XV of 1920 with the assent of the Governor General on March 20, 1920.

In the 100th year of Indian Red Cross Society, it is a fact that the office bearers are not Red Cross minded or are not able to run the voluntary organisation in a team spirit. Election in Red Cross is the only solution to make it function in a democratic way.

(The writer is a Life Member, Indian Red Cross Society, Odisha State Branch, M-8984007600, 9938537600)",state-editions,https://www.dailypioneer.com/images/logo.jpg,https://www.dailypioneer.com/2020/state-editions/let-state-red-cross-unit-be-rejuvenated.html
77,20-3-20,AAP begins preparing for 2022 election,"The Aam Admi Party (AAP) has started preparing for the 2022 Vidhan Sabha elections in Uttarakhand. For this, it has started a survey across the State to know about the issues of the residents besides inviting the people to join the party.

On Thursday, the State incharge of AAP Dinesh Mohniya said, “People of Uttarakhand admire our party for the work we have done for Delhi’s public. By entering into this state’s politics, we are giving the public a better alternative than other parties like Congress and BJP.”

Mohniya also said that AAP has started a survey in the state to be more aware of the issues of Uttarakhand’s public which will help them during the 2022 Vidhan Sabha elections.",state-editions,https://www.dailypioneer.com/images/logo.jpg,https://www.dailypioneer.com/2020/state-editions/aap-begins--preparing-for-2022-election.html
78,20-3-20,Fake hand sanitiser racket busted,"A team led by SDO Chandan Kumar busted a racket involved in fake hand sanitiser manufacturing as police seized batches of these fake products.

Acting on a tip-off, raided the duplicate hand sanitiser manufacturing unit Shree Enterprises near Star Talkies at Burmamines and recovered the fake products. The team during interrogation found that the manufactures were using only colours to make the product.

“The city is witnessing a scarcity of sanitisers and face masks since the Covid-19 outbreak. In order to cash on the growing demand, several local traders are manufacturing the products illegally. Thry done even have license. During the raid we found that they were not adding chemicals but were only using colour to make products,” said SDO Kumar.

Police have nabbed those involved in manufacturing these fake products and filed cases under Essential Commodities Act, 1955, and other relevant sections of IPC and the Drugs Law.

On the basis of leads provided by Shree Enterprises, the team went conducted raids at KK Pharmaceuticals at Tapadia Apartment in Jugsalai. The police team seized several cartons of fake sanitisers and hand wash. Kamal Gupta owner of KK Pharmaceuticals was involved in distribution of fake products to cash more on the increase in demand. During the investigation, the accused confessed as sales of hand sanitisers and similar products swelled across several markets since the Covid-19 outbreak began in January 2020, the accused started manufacturing hand sanitisers without using any kind of precautions or following the standards set by Drug & Ayush Departments.

The groups started distributing these products in around the city through various distributors and supplied the same to leading medical shops.

Pharmacists and traders in the city have claimed shortage of supply of hand sanitisers and masks amid fears over the deadly COVID-19, while people rued that these items were being sold at exorbitant rates, if available.

"" We are getting complains now we plan to conduct more such raids in and across the city. We will ensure that law takes its due to course over any irregularity related to it,"" said an official.",state-editions,https://www.dailypioneer.com/images/logo.jpg,https://www.dailypioneer.com/2020/state-editions/fake-hand-sanitiser-racket-busted.html
79,20-3-20,Inbrief,"Seminar at BIT, Mesra

A seminar on ‘Role of0 in our society’ was organised by the Department of Electronics & Communication (ECE), Birla Institute of Technology (BIT) Mesra, Ranchi on March 05, 2020, in the R&D building, on the occasion of the celebration of “Women’s Week”. The event was chaired by Dr. Srikanta Pal (HoD), Dr. Nisha Gupta (Chairman, ICC), Dr. S.K. Ghorai and Dr. Neela Chattoraj (Event Coordinator). This seminar was anchored by Quarrataluin and Sneha Tiwari. About 60 participants from various Master's and PhD programmes enlightened the audience with their speeches. The seminar was started with the formal inauguration and floral felicitation. Dr. Srikanta Pal, Head of the Department, ECE Department, inaugurated the program with an informative speech by talking about women equality in all spheres of life and about the importance of education which would result in a more caring, tolerant, just and peaceful life for women.

DEO inspects Strong Room

The upcoming Chas Municipal Corporation and Gomia Municipal Council elections, BrajGriha and counting hall are to be built in the market committee itself. For this purpose, District Election Officer-cum- DC Mukesh Kumar has inspected Market Committee Chas. Kumar has sent a letter of recommendation to the State Election Commission after all aspects have been cleared after inspection. As soon as the approval from the Election Commission, all the process related to strong room for municipal elections will be started. During the inspection, SP Sujata Kumari , SDO Chas Shashi Prakash Singh, DPLR Pashupatinath Mishra, Executive Engineer Building Division, Rajkumar Rana, District Land Acquisition Officer James Surin and other officials were present.",state-editions,https://www.dailypioneer.com/images/logo.jpg,https://www.dailypioneer.com/2020/state-editions/inbrief-inbrief-2020-03-20.html
80,20-3-20,State Capital witnesses clear sky weather conditions,"After a lull phase of few days of normal weather conditions, abrupt weather conditions have been witnessed at several places in the State for the past two days. Several places have recorded rainfall and thundery activities in the past 24 hours and harsh weather conditions are likely to be witnessed in the next 24 hours as warning of speedy winds, thundery activities and hailstorms has been issued by Met department.

State Capital witnessed clear sky weather conditions on Thursday with day temperature reaching at 33 degree Celsius. The night temperature was recorded at 18.6 degree Celsius.

Among the nearby areas Hoshangabad recorded day temperature at 36.7 degree Celsius and night temperature at 20.8 degree Celsius.

The day temperatures have soared and highest day temperature was recorded at 39 degree Celsius on Wednesday. The coldest place of the state was Rewa which recorded night temperature at 13 degree Celsius.

Khandwa recorded the highest rainfall at 2 cm in the past 24 hours, Seoni, Pandhana and Begumganj recorded 1 cm rainfall each which were among the regions which recorded good rainfall and several areas have received little rainfall for brief periods.

Met department has issued warning of thundery activities, speedy winds ranging 30-40 km/hr and hailstorm for brief periods in Shahdol and Rewa divisions and Sagar, Damoh, Jabalpur, Narsinghpur, Katni, Vidisha, Raisen and Mandla.

The regions for which warning of thundery activities and speedy winds ranging 30-40 km/hr has been issued are Chhindwara, Seoni, Balaghat, Panna, Tikamgarh, Chattarpur, Sehore, Betul and Hoshangabad.

Ujjain and Rewa divisions recorded significant increase in day temperatures. The night temperature recorded significant decrease in Jabalpur division.",state-editions,https://www.dailypioneer.com/images/logo.jpg,https://www.dailypioneer.com/2020/state-editions/state-capital-witnesses-clear-sky-weather-conditions.html
81,20-3-20,Section-144 likely if corona reaches community stage: DC,"Amidst the fear of Corona Virus infection on Thursday, Ranchi District Administration announced that if the virus reaches the community stage, Section-144 will be imposed in the District.

In a meeting with various Sarna Committees, Deputy Commissioner (DC) Ranchi, Rai Mahimapat Ray appealed to the committees to postpone Sarhul procession, which is scheduled on March 28. Ray said that in view of the effect of Corona virus, he appealed to the committees to take a unanimous decision in the public interest, after which could not get support from all the committees.

A meeting was held at the DC Office at Ranchi Collectorate under the chairmanship of DC Ranchi along with various Sarna committees, religious, social and tribal organisations to carry out the procession at Sarhul. After the meeting on March 17, the decision was to be taken in the meeting to postpone the procession for some time in view of the effects of the Corona Virus. Due to the lack of consensus among the organisations, no decision could be taken on the issue.

In the meeting, former Education Minister, Geetashree Oraon asked everyone to take care of the safety of the people. In the end it was decided by the Committees that preparations will continue for Sarhul at present, it will be decided a few days before the procession is taken out due to the effect of Corona virus.

The meeting was attended by the Ranchi Sub-Divisional Officer, Lokesh Mishra, Additional Collector, Law and Order, Kotwali DSP, and representative of various Sarna Committees, religious and social organizations.

Meanwhile, various Ramnavmi procession committees decided that they will also not organize procession.

The Chief Patron of the committee, Deepak Prakash Singh urged all the members that all types of public programmes are closed in the entire country keeping in mind the prevention of Corona virus, in such a situation, all the people should celebrate the festival in a peaceful State. Singh said in the meeting of Shri Mahavir Mandal Swagat Samiti on Ramnavami Festival concluded in Harmu Road on Thursday.

The meeting was chaired by Ustad Vinod Verma. Taking the decision in the meeting, the old committee was restored and the details of the expenditure were presented.

Singh urged during the meeting that special attention to should be given to cleanliness. Speaking on the occasion Convener Prem Verma said that in view of the Corona virus in the present situation, the committee decided that it would decorate Harmu Road like earlier.",state-editions,https://www.dailypioneer.com/images/logo.jpg,https://www.dailypioneer.com/2020/state-editions/section-144-likely-if-corona-reaches-community-stage--dc.html
