,Date,Title,Article,Category,Image_link,Article_link
211,20-3-20,India’s Pro League matches on hold,"The International Hockey Federation on Thursday extended its suspension of all Pro League matches, including fixtures involving India, to May 17 owing to the COVID-19 pandemic.

“Based on the latest developments of the COVID-19 outbreak and in particular of the response to it by the relevant public authorities globally, FIH, with the support of all participating National Associations, has today decided to extend the postponement period of the FIH Hockey Pro League to 17 May,” the sport’s world body said.

“Consequently, all matches currently scheduled until 17 May are on hold. FIH will keep on monitoring the situation closely, following the recommendations of the World Health Organization and the decisions of the public authorities.”

The Indian men’s team was scheduled to play against Germany in Berlin on April 25 and 26 before taking on Great Britain in London on May 2 and 3.

India are then scheduled to host New Zealand on May 23 and 24 before travelling to Tucuman, Argentina for matches on June 5-6. India’s last tie in FIH Pro League is against Spain in Valencia on June 13 and 14.

New Zealand and Australia had already decided not to travel to Europe.",sports,https://www.dailypioneer.com/images/logo.jpg,https://www.dailypioneer.com/2020/sports/india---s-pro-league-matches-on-hold.html
212,20-3-20,All COVID-19 tests during PSL have come negative: PCB,"The Pakistan Cricket Board (PCB) on Thursday claimed that all the 128 COVID-19 tests it conducted on the players, support staff, match officials, broadcasters and team owners involved in the PSL have come negative.

The PCB had conducted the tests on March 17. Additionally, Multan Sultans underwent 17 COVID-19 tests on Monday and results of that were also negative.

“It was absolutely critical for the integrity and credibility of the HBL Pakistan Super League and the Pakistan Cricket Board that all players, support personnel, broadcasters and match officials, those who had decided to stay back till the end of the tournament, tested negative for COVID-19,” PCB Chief Executive Wasim Khan said.

“In this background, the PCB is pleased with the outcome of the results and happy that all these players and officials have rejoined their families without any health and safety doubts or concerns.”",sports,https://www.dailypioneer.com/images/logo.jpg,https://www.dailypioneer.com/2020/sports/all-covid-19-tests-during-psl-have-come-negative--pcb.html
213,20-3-20,"WTA, ATP call off season till June 7","All men’s and women’s professional tennis tournaments through June 7 are being called off because of the new coronavirus pandemic.

The ATP and WTA announced that the entire clay-court circuit “will not be held as scheduled” — a day after the start of the French Open, also played on that surface, was postponed from May to September.

The tours had said last week they would suspend play until late April or early May.

The tournaments affected by the tours’ suspensions include combined men’s and women’s events in Madrid and Rome.

Also being scrapped are upcoming WTA tournaments in Strasbourg, France, and Rabat, Morocco, along with ATP events in Munich; Estoril, Portugal; Geneva; and Lyon, France.

Both tours also said that their rankings will be frozen “until further notice.” The International Tennis Federation also put a halt to its lower-tier events until June 7.",sports,https://www.dailypioneer.com/images/logo.jpg,https://www.dailypioneer.com/2020/sports/wta--atp-call-off-season-till-june-7.html
214,20-3-20,"In self-isolation, I have found some freedom: Mary Kom","The COVID-19 pandemic has isolated her from the world outside but iconic Indian boxer M C Mary Kom says the forced slowdown of life as usual has also redefined the meaning of freedom for her.

Mary Kom has self-isolated at her Delhi residence since returning from the this month's Asian Olympic Qualifiers in Jordan where she booked herself a second Olympic berth.

The precautionary measure was necessitated by a training trip to Italy before landing in Jordan even though the entire Indian team got COVID-19 negative certificates from the IOC.

""I am chilling, doing my exercises, taking care of my fitness and playing with my children after being away from them for almost one month,"" Mary Kom told PTI in an interview.

""That's the best part of this isolation, I am with my family through the day without having to think of anything. My appeal to everyone is don't panic, try and stay at home if you can and spend time with your family,"" she said.

""In my case, I have felt a sense of freedom with this isolation. I have realised that I am not feeling the stress of a daily schedule right now.""

The six-time world champion is also a sitting Rajya Sabha MP. Does she miss not being in Parliament when it is in session, given that she is among the most regular MPs?

""I hope to attend the last few days of the session. My isolation is till end of this month. Parliament will function for a few more days after that,"" she said referring to the schedule of the ongoing budget session which runs till April 3.

""Right now, all I know is that my children are very happy. For 10-15 days, they have got their mom and that too without any interruption,"" she quipped.

Relaxed she might be at home but Mary Kom said she understands the fear of the virus outbreak, which has killed more than 9,000 people globally.

In India four have died so far and the number of positive cases stands at more than 190 now.

""My children, out of innocence, ask me, 'mama this virus will stay na?' They are happy being at home playing and missing school but I know how serious it is. It is a scary situation and I hope everyone follows the health guidelines. It is crucial that everyone does,"" she said.

""That's the only way we can save ourselves. Everyone has to be careful,"" she added.

""The precautions that I am taking include not giving appointments to anyone right now,"" she further stated.

A five-time Asian champion besides being a gold-medallist at the Commonwealth and Asian Games, Mary Kom would be competing in her last Olympic Games if it goes ahead as scheduled in July-August in Tokyo.

There are growing concerns about the Games' fate with several current and former athletes demanding that IOC put their safety first. The IOC, however, has resolutely stated that the quadrennial showpiece will go ahead on time despite the current crisis.

""I don't think the Games will be postponed or cancelled. It is too huge an event to be shifted just like that. It will cause chaos. In any case, it's not in my hands. So, it's better I don't say much,"" she said.

But will the current situation, in which travel restrictions by most countries have nearly brought the world to a halt, have a bearing on her preparations for Tokyo?

""Some planning is required. I haven't yet made up my mind, Training here is also pretty smooth. There is nothing missing. We will see how the situation is in the next couple of weeks before deciding on whether going outside is an option,"" she explained.

""Till then, everyone please stay at home and don't forget to wash your hands,"" she laughed.",sports,https://www.dailypioneer.com/uploads/2020/story/images/big/in-self-isolation--i-have-found-some-freedom--mary-kom-2020-03-20.jpg,https://www.dailypioneer.com/2020/sports/in-self-isolation--i-have-found-some-freedom--mary-kom.html
215,20-3-20,4 Nirbhaya convicts executed in Tihar Jail,"The four men convicted of the gang rape and murder of a Delhi woman on December 16, 2012 were hanged in the darkness of pre-dawn on Friday, ending a horrific chapter in India's long history of sexual assault that had seared the nation's soul.



Mukesh Singh (32), Pawan Gupta (25), Vinay Sharma (26) and Akshay Kumar Singh (31) were executed at 5.30 am for the savage assault in an empty moving bus on the 23-year-old physiotherapy intern who came to be known the world over as Nirbhaya, the fearless one.



This is the first time that four men have been hanged together in Tihar Jail, South Asia's largest prison complex that houses more than 16,000 inmates.



The executions were carried out after the men exhausted every possible legal avenue to escape the gallows. Their desperate attempts only postponed the inevitable by less than two months after the first date of execution was set for January 22.



In last-gasp attempts, one of the convicts knocked on the doors of the Delhi High Court and the Supreme Court just hours before the hanging.



In an unprecedented late-night hearing that began at 2.30 AM and lasted an hour, a Supreme Court bench dismissed his last plea.



Finally, the four convicts were hanged at 5.30 am, Director General of Tihar Jail Sandeep Goel said.



After the execution, Nirbhaya's mother told reporters that justice has finally been done and women will definitely feel safer now.



""We will request the Supreme Court to issue guidelines so that no one can adopt delaying tactics in such cases in future,"" she said at her house.



""Our wait for justice was painful and agonising. We appeal for observing this day as Nirbhaya 'Nyay Diwas' (day of justice),"" Nirbhaya's father said.



After raping and brutalising the woman, the men, one of whom was a juvenile at the time, dumped her on the road and left for dead on the cold winter night. Her friend who was with her was also severely beaten and thrown out along with her. She was so severely violated that her insides were spilling out when she was taken to hospital. She died in a Singapore hospital after battling for her life for a fortnight.



Six people, including the four convicts and the juvenile, were named as accused.



While Ram Singh allegedly committed suicide in the Tihar Jail days after the trial began in the case, the juvenile was released in 2015 after spending three years in a correctional home.



The road to the gallows was a long and circuitous one, going through the lower courts, the High Court, the Supreme Court and the president's office before going back to the Supreme Court that heard and rejected various curative petitions.



The death warrants were deferred by a court thrice on the grounds that the convicts had not exhausted all their legal remedies and that the mercy petition of one or the other was before the president.



On March 5, a trial court issued fresh death warrants for March 20 at 5.30 am as the final date for the execution.",top-stories,https://www.dailypioneer.com/uploads/2020/story/images/big/4-nirbhaya-convicts-executed-in-tihar-jail-2020-03-20.jpg,https://www.dailypioneer.com/2020/top-stories/4-nirbhaya-convicts-executed-in-tihar-jail.html
216,20-3-20,Hanging of convicts in Nirbhaya case victory of country: Maliwal,"Commission for Women chief Swati Maliwal on Friday said the hanging of the four convicts in the Nirbhaya gangrape and murder case was the victory of the country.

""This is the victory of whole country. We have to now create a strong system,"" she said in a tweet.

The four convicts --- Mukesh Singh (32), Pawan Gupta (25), Vinay Sharma (26) and Akshay Kumar Singh (31) --- were hanged at 5.30 am.

Tweeting ""Satyameva Jayate"" (truth alone triumphs), Maliwal said justice has won after a long wait of seven years.

She said the people of the country had to take to the streets for justice in the case.",top-stories,https://www.dailypioneer.com/uploads/2020/story/images/big/hanging-of-convicts-in-nirbhaya-case-victory-of-country--maliwal-2020-03-20.jpg,https://www.dailypioneer.com/2020/top-stories/hanging-of-convicts-in-nirbhaya-case-victory-of-country--maliwal.html
217,20-3-20,"Justice has finally been done, women will feel safer now: Nirbhaya's mother","Justice has finally been done and women will definitely feel safer now, Nirbhaya's mother Asha Devi said after four men convicted of gang rape and murder of her daughter were hanged at Tihar Jail on Friday.

Talking to reporters at her home in Dwarka, she said justice was delayed but not denied, and added they would continue their fight for justice for India's daughters.

""We will request the Supreme Court to issue guidelines so that no one can adopt delaying tactics in such cases in future,"" she said, referring to the execution of death warrants being deferred thrice by a court on various grounds.

She said women will definitely feel safer after this execution and it will also make parents teach boys to behave with women. ""After a long agonising wait, my daughter has got justice,"" she said.

""After the Supreme Court hearing last night, I came home and hugged a portrait of my daughter and told her - 'beti nyay dila diya tumko',"" Asha Devi said, adding, ""March 20 should be celebrated as Nirbhaya Nyay Diwas (day of justice). This day will be written in history books.""

Mukesh Singh (32), Pawan Gupta (25), Vinay Sharma (26) and Akshay Kumar Singh (31) were executed at 5.30 am for the savage assault in an empty moving bus on the 23-year-old physiotherapy intern who came to be known the world over as Nirbhaya, the fearless one.

Hours before the execution, Gupta approached the Supreme Court to challenge the rejection of the second mercy petition by the president. In an unprecedented late-night hearing that began at 2.30 am and lasted an hour, an apex court bench dismissed his plea, paving the way for the execution.

The bench also refused to pass any direction allowing Gupta and Akshay Singh meet their family members before they were sent to the gallows.

""Our faith in Constitution or judicial system was getting shaken, but that trust has been restored. This hanging will send a stern warning to criminals to dare not commit such acts,"" Asha Devi said.

""My daughter will now rest in peace,"" said the emotionally overwhelmed mother, appealing to all mothers to report sexual assault cases in family and society to support the daughters.

Nirbhaya's father Badrinath Singh said he and his wife haven't slept a wink, awaiting justice.

""We haven't slept the whole night, running from high court to Supreme Court late night. But, finally, the moment has arrived. Our village in Ballia will now play Holi,"" he told PTI outside their home.

""Our wait for justice was painful and agonising. We appeal for observing this day as Nirbhaya Nyay Diwas ,"" he said.

Women gathered outside the Dwarka home of Nirbhaya's parents did a countdown as the time of the execution of the four convicts neared.

This is the first time that four men have been hanged together in Tihar Jail, South Asia's largest prison complex that houses more than 16,000 inmates. The executions were carried out after the convicts exhausted every possible legal avenue to escape the gallows. Their desperate attempts only postponed the inevitable by less than two months after the first date of execution was set for January 22.",top-stories,https://www.dailypioneer.com/uploads/2020/story/images/big/justice-has-finally-been-done--women-will-feel-safer-now--nirbhaya-s-mother-2020-03-20.jpg,https://www.dailypioneer.com/2020/top-stories/justice-has-finally-been-done--women-will-feel-safer-now--nirbhaya-s-mother.html
218,20-3-20,Resolve to not allow Nirbhaya-like incident again: Kejriwal,"Hours after the four Nirbhaya convicts were hanged, Delhi Chief Minister Arvind Kejriwal on Friday said it is a day to take a resolution to not allow another similar incident happen.

Taking to Twitter, Kejriwal also called for a collective resolution by police, courts, states and the central government to remove loopholes in the system ""to let this not happen"" to any daughter again.

""After seven years, Nirbhaya case convicts were hanged today. It's a day to take a resolution that we will not allow another Nirbhaya case. Police, courts, state governments and the Centre should resolve to collectively remove loopholes in the system to let this not happen to any daughter,"" he tweeted in Hindi.

The four men — Mukesh Singh (32), Pawan Gupta (25), Vinay Sharma (26) and Akshay Kumar Singh (31) — convicted for the 2012 gang rape and murder of the 23-year-old physiotherapy intern, who later came to be known as 'Nirbhaya', were hanged at 5.30 am inside Tihar Jail.",top-stories,https://www.dailypioneer.com/uploads/2020/story/images/big/resolve-to-not-allow-nirbhaya-like-incident-again--kejriwal-2020-03-20.jpg,https://www.dailypioneer.com/2020/top-stories/resolve-to-not-allow-nirbhaya-like-incident-again--kejriwal.html
219,20-3-20,"Justice has prevailed, says PM Narendra Modi on hanging of Nirbhaya case convicts","Prime Minister Narendra Modi on Friday said justice has prevailed after all four convicts in the Nirbhaya gangrape and murder case were hanged.

""Justice has prevailed. It is of utmost importance to ensure dignity and safety of women,"" he said in a tweet though there was no direct mention of the Nirbhaya case.

The four men -- Mukesh Singh (32), Pawan Gupta (25), Vinay Sharma (26) and Akshay Kumar Singh (31) -- convicted for the 2012 gang rape and murder of the 23-year-old physiotherapy intern, who later came to be known as 'Nirbhaya', were hanged at 5.30 am inside Delhi's Tihar Jail.

""Our Nari Shakti has excelled in every field. Together, we have to build a nation where the focus is on women empowerment, where there is emphasis on equality and opportunity,"" the PM said.",top-stories,https://www.dailypioneer.com/uploads/2020/story/images/big/justice-has-prevailed--says-pm-narendra-modi-on-hanging-of-nirbhaya-case-convicts-2020-03-20.jpg,https://www.dailypioneer.com/2020/top-stories/justice-has-prevailed--says-pm-narendra-modi-on-hanging-of-nirbhaya-case-convicts.html
220,20-3-20,Delhi HC declines to entertain comedian Kunal Kamra's plea against flying ban on him by airlines,"The Delhi High Court on Friday declined to entertain stand-up comedian Kunal Kamra's plea challenging the flying ban imposed on him by Indigo, Vistara and other airlines for heckling journalist Arnab Goswami on board a flight.

Justice Naveen Chawla disapproved of Kamra's behaviour on flight and said it cannot be permitted on an airline.

The court also declined Kamra's oral plea for an interim direction permitting him to fly on any of the airlines.

The court said it was not going to entertain the matter as multiple causes of action had been raised in the matter.

After the court made it clear it was not going to entertain the matter, Kamra's lawyers sought permission to withdraw the plea and approach the appellate authority against the ban by Indigo.",top-stories,https://www.dailypioneer.com/uploads/2020/story/images/big/delhi-hc-declines-to-entertain-comedian-kunal-kamra-s-plea-against-flying-ban-on-him-by-airlines-2020-03-20.jpg,https://www.dailypioneer.com/2020/top-stories/delhi-hc-declines-to-entertain-comedian-kunal-kamra-s-plea-against-flying-ban-on-him-by-airlines.html
221,20-3-20,Greece hand over Olympic flame,"Greece on Thursday handed over the Olympic flame to Tokyo 2020 organisers at a ceremony held behind closed doors.

In the absence of spectators, Olympic gymnastics champion Lefteris Petrounias ran a lap with the flame and Olympic pole vault champion Katerina Stefanidi lit a cauldron inside the all-marble Panathenaic stadium, where the first modern Olympics were held in 1896.

The flame was then handed to Tokyo 2020 representative Naoko Imoto, a swimmer who competed in the Atlanta 1996 Olympics. Imoto, a UNICEF representative, was reportedly a last-minute appointment as she already lives in Greece and did not have to travel from Japan.

Greek President Katerina Sakellaropoulou in a statement said the ancient Olympic values of “concord, goodwill, brotherhood... are the weapon to use” against the virus.

Last week’s flame lighting ceremony in ancient Olympia was also carried out without spectators as Greece registered its first death from the virus.

“Regretfully the COVID-19 outbreak made us take hard decisions and change our initial plans. We deeply regret that you... were not able to travel to Greece and join us here today,” Greek Olympic Committee chairman Spyros Kapralos said, addressing Tokyo organisers absent from Thursday’s ceremony.",sports,https://www.dailypioneer.com/images/logo.jpg,https://www.dailypioneer.com/2020/sports/greece-hand-over-olympic-flame.html
222,20-3-20,"AFI cancel Indian GP, postpone Fed Cup","The Athletics Federation of India on Thursday cancelled the Indian Grand Prix hours before it was to begin, paying heed to the government’s directive.

The event was scheduled to be held at NIS Patiala.

Next month’s Federation Cup National Senior Championships (April 10-13), a qualifying event for the Tokyo Olympics, has been postponed to a later date.

The development came after hours after the Sports Ministry advised all national federations to refrain from conducting competitions and selection trials till April 15.

Indian athletics’ High Performance Director Volker Herrmann said that the AFI will have to abide by the government’s directive.

“The Indian GP at Patiala will not be held on Friday. It is unfortunate for the athletes who are trying to qualify for the Olympics but the health of Indian people is more important than sports. So, with regret we took the decision to cancel the first Indian GP on Friday. The second GP (also to be held in Patiala on March 25) has also been cancelled,” Herrmann said.

“All sporting events has been suspended till April 15 and the AFI respects the government’s decision in the larger interest of the country and the health and well being of its people,” the German added.

Asked about the status of the Federation Cup, scheduled for April 10-13 in Patiala, he said, “There is no other way for the AFI than respect the government’s decision. Since the suspension of all sporting events remains till April 15, the Federation Cup is postponed.

“We will try to hold the Federation Cup in May or June, depending on the situation (of the COVID-19 pandemic). We cannot say now when it will be held but we have to still keep the options open as the Olympics is still on.”",sports,https://www.dailypioneer.com/images/logo.jpg,https://www.dailypioneer.com/2020/sports/afi-cancel-indian-gp--postpone-fed-cup.html
223,20-3-20,Athletes returning from high-risk COVID-19 affected nations will be quarantined: Rijiju,"Sports Minister Kiren Rijiju on Thursday said athletes arriving back from high-risk COVID-19 affected countries will have to be in mandatory quarantine but refused to be drawn into speculation surrounding the IPL and the Tokyo Olympics.

Spelling out the protocol for athletes arriving from the most-affected countries China, South Korea, Iran, Italy, Spain, France and Germany, Rijiju said they will have to follow what has been mandated for everyone else.

“Athletes who are coming back from countries which are very prone to coronavirus will be quarantined as per the government provisions. There will be no exceptions. Anybody who has come from abroad is being put in isolation and athletes also have to adhere to it,” Rijiju said while talking to reporters.

Currently, chess ace Viswanathan Anand has self-isolated in Germany after travel restrictions delayed his return to India. Wrestler Vinesh Phogat and javelin thrower Neeraj Chopra are among the sportspersons to have cut short their training stints in parts of Europe to head back due to the COVID-19 pandemic.

They have put themselves in isolation after returning.

He was also asked about Indian boxers, who have been seen at public events since returning from the Asian Olympic Qualifiers in Jordan after training in Italy before that.

“They have been tested and given coronavirus negative certificates by the International Olympic Committee. They are not in any danger but it is advisable that they stay in isolation,” he said.",sports,https://www.dailypioneer.com/images/logo.jpg,https://www.dailypioneer.com/2020/sports/athletes-returning-from-high-risk-covid-19-affected-nations-will-be-quarantined--rijiju.html
224,20-3-20,Bayern set cyber-training sessions,"Keen to avoid unnecessary travel while maintaining social contact, Bayern Munich have set up ‘cyber-training’ sessions where players work out together online by following exercises streamed from the club’s headquarters.

“We all have to try to deal with the situation in a positive way,” Bayern coach Hansi Flick told the club’s website.

“Yesterday (Wednesday) at 11 am, we had our first ‘Cyber Training’, where the team were coached remotely. Everyone was motivated, everyone did very well.” The state of Bavaria has not yet introduced mandatory confinement measures, but Bundesliga leaders Bayern have decided to keep their players at home in order to best respect the instructions from health authorities.

Flick contends that keeping players in touch on a regular basis is just as essential as the training itself.

“It will be important that we are in contact with one another daily. The whole group is there for training,” said Flick, who directs the sessions which players can follow via their tablets.",sports,https://www.dailypioneer.com/images/logo.jpg,https://www.dailypioneer.com/2020/sports/bayern-set-cyber-training-sessions.html
