,Date,Title,Article,Category,Image_link,Article_link
0,16-4-20,Climbing again,"After a production cut agreed upon by oil producers, crude prices are rising again. But demand will continue to be weak

As the world’s largest oil-producing countries agreed to somewhat reduce production after an intense price war last month between Russia and Saudi Arabia saw rates drop to their lowest level in almost two decades, crude oil prices have started to climb once again. But the spike, and this, using the one of North Sea Brent Crude which is a global benchmark, has found it difficult to pierce the $30 a barrel mark. Analysts believe that after the International Monetary Fund (IMF) report, which said that the world economy will shrink by almost three per cent this year, oil prices cannot rise to offset that much of a fall in demand. Even with countries such as India using the opportunity to fill their strategic reserves of oil to the brim, the additional demand this will produce will not offset the overall fall. This is a good thing for India, although not necessarily for the consumer. The Central Government recently used the fall in the crude price to increase existing excise duties on prices paid at the pump and passed a law to be able to increase the excise rates later on. Therefore, the fall in prices at the pump may be negligible. That said, the Government will be desperate to raise additional revenues after the six-week lockdown would have devastated the economy. The additional revenues that these potential excise duty enhancements will produce though will be tempered by a reduction in demand as the informal sector remains effectively shut and the formal sector is expected to operate at a mere fraction of its pre-COVID-19 ability.

The reduction in crude prices might also have a medium-term impact on demand and the technology progress of alternative environmentally-friendly mobility solutions. Electric vehicles, already expensive, might see a fall in demand as consumers will switch to more affordable petrol-engined cars. Handing out subsidies for buying such vehicles will be seen as an avoidable extravagance by Governments during a public health crisis. This may be one of the unintended consequences of the pandemic but we feel that the work in this space must continue. One of the positives of the past four weeks has been the cleaner and more breathable air across the world. We should not see that as an aberration but as the new normal. Crude prices may never recover from that shift.",columnists,https://www.dailypioneer.com/uploads/2020/story/images/big/climbing-again-2020-04-16.jpg,https://www.dailypioneer.com/2020/columnists/climbing-again.html
1,16-4-20,Disaster waiting to strike,"The number of confirmed COVID-19 cases in Nepal may be low but it is not due to precautions taken by the Govt but because of the low rate of testing

With the number of COVID-19 cases rising globally, India’s neighbour Nepal is also going through a critical phase in its fight against the pandemic. A country located next to China, the nation where the COVID-19 outbreak began, its immediate vulnerabilities lie in addressing the epidemic with an existing poor healthcare infrastructure and ensuring the safety of its people. The very first case of COVID-19 was reported on January 23 in Nepal. A student who had returned from Wuhan on January 9 was admitted to a hospital in Kathmandu. With no expertise and lab infrastructure to examine such cases then, the swab tests of the student were sent to Hong Kong and had confirmed the Nepal Government’s worst fears.

Loose end: Nepal’s first COVID-19 case had recovered in the second week of February. With no new cases reported until the third week of March, overzealous Government officials went on to declare Nepal a “COVID-19 free” country. While it was the time for the Government to deploy extra measures to prepare for the outbreak, declaring the country as “COVID-19 free” without any consultation with medical experts was indeed a short-sighted and irresponsible step. The Government was very clear that it did not wish to stop the arrival of tourists in Nepal because 2020 had been declared as a tourism year and the Government had spent a lot of time and money in making its ‘Visit Nepal 2020’ campaign a household initiative. However, in the end, with the appearance of the Coronavirus, Nepal had to suspend the campaign officially, even though till today it has a total of 16 confirmed cases and no reported deaths. In 2018, tourism had contributed more than seven per cent revenue to the Nepalese Gross Domestic Product (GDP), which was expected to double this year. With the suspension of tourism for this year, the economy will have to bear the brunt.

Logistic shortage: Compared to its neighbours India and China, which have reported a huge number of cases, Nepal has seen just 16 positive cases till now. The country has conducted a total of 6,299 tests, with a little over 80 people in isolation. Amid the ongoing lockdown, Nepal is facing an acute shortage of trained human resources, required healthcare infrastructure, including speciality hospitals, safety gear and testing kits. In several cases, healthcare staff have refused to attend to their duties due to lack of Personal Protective Equipment (PPE). In the present circumstances, testing is key to contain and control the spread of the epidemic. However, with just one specialised testing lab for COVID-19 cases in the capital city for a population of more than 29 million people, Nepal is wide open to any major surge in the pandemic. While nine more temporary testing labs have been established in the last 15 days, logistical support and their testing capacity are yet to be seen. Meanwhile, Nepal has requested several countries, including India, China, Singapore, South Korea and Israel to supply medical equipment and medicines needed to combat the disease.

Missing preparedness: Over the last two decades, the Government has not paid any heed to improving the quality and quantity of healthcare facilities in the country. Against this backdrop, Nepal has faced several emergencies such as the present outbreak. A decade-long civil war from 1996-2006 was followed by a major earthquake in 2015 which claimed over 20,000 lives and destroyed 1,500 health facilities, creating an immediate need for investing in the public healthcare system. Meanwhile, no lessons were learnt from these two important events and nothing was done to better the basic healthcare infrastructure. While conflict and natural calamities have both direct and indirect effects on people’s health and the overall health system in the immediate and post-shock phase, the missing healthcare infrastructure in Nepal is a matter of major concern, particularly in the present crisis.

India extends help: As Nepal awaits replies from other countries, India has begun to send new consignments of medical supplies, including the much-needed hydroxychloroquine sulphate. During an official conversation between Prime Minister Modi and his Nepalese counterpart on April 10, the two Prime Ministers agreed “to look after the welfare and medical care of the people of the two countries currently living in each other’s territory.”

The multi-dimensional friendly relations between India and Nepal are testimony to shared socio-cultural and people-to-people contacts that have stood the test of time and various disasters. The creation of the South Asian Association for Regional Cooperation (SAARC) COVID-19 Emergency Fund is a collective effort initiated by Prime Minister Narendra Modi to bring SAARC countries onboard to fight COVID-19. Nepal has actively participated in the initiative and the initiative shall work as an additional effective mechanism in Nepal’s fight against COVID-19.

China banks on the crisis: China, on the other hand, is banking on the ongoing crisis in Nepal. China’s online supply chain Alibaba along with the local administration of its Sichuan province have donated PPE and portable shelters to Nepal. However, a significant deal to a private Chinese company to procure equipment worth more than $10 million was cancelled amid criticism. The Government of Nepal faced criticism for defying the rules in granting the contract to a private company, which has been involved in supplying low-quality products in the past. Giving in to public pressure, the Ministry of Health and Population decided to annul the tender. At this critical juncture, it is the responsibility of the Government of Nepal to ensure that logistics are procured with caution, rather than appease China with multi-million-dollar deals. On April 10, the Tibet Autonomous Region also donated medical equipment to Nepal and China and Chinese officials conducted a “handing over ceremony.” With Nepal facing a critical shortage of supplies, Chinese assistance is not free from an attempt to win over public sentiments. Something that India needs to watch out for.

Poor governance: An acute shortage of medical equipment exhibits poor governance and the inability of the Government of Nepal to safeguard the interests of its citizens who have been a cardinal factor in sustaining the economy. Notably, one-fourth of Nepal’s GDP comes from the remittances sent home by the Nepalese workforce abroad. Following the initial fears of lockdowns in host countries, thousands of Nepalese migrant workers attempted to travel back to their home country. While the closure of international flights stopped millions of workers from returning to Nepal from the Middle-East, Malaysia and Australia, thousands of them are stuck at the Indo-Nepal border.

This is after they undertook long and arduous journeys through land routes to cross the border checkposts. With no quarantine wards and healthcare personnel deployed at the check-posts, these workers have been desperately waiting to get back to their homes.

By stopping the returnees at the border, Nepal might have chosen to contain the spread of the COVID-19 but it is a cruel, irresponsible and inadequate attitude towards its citizens. They have been left in the open without food, shelter and exposed to Coronavirus contamination due to lack of social distancing at several places. It was as late as April 10 that Nepalese Prime Minister KP Oli requested his Indian counterpart to look after the welfare and medical needs of those stuck at the Indo-Nepal border. As India does its bit to provide food and shelter to the suffering Nepalese workforce, the Government of Nepal should have had mechanisms in place in advance for its returning expatriates. It must have in all honesty anticipated the return of its people from the neighbouring nation given the long open border. That it chose not to do anything about it and let its people suffer knowingly is something that will always be remembered by the people of the little Himalayan nation.

The number of confirmed COVID-19 cases in Nepal may be low but it is not due to precautions taken by the Government. It is less because of the low rate of tests being carried out per day. On April 11, Nepal recorded the highest number of COVID-19 tests and the same day, three new cases were reported. For all we know, it might be the next hotspot of the world. But that will only be revealed once more testing is done.

It is time for the Government of Nepal to provide proper healthcare to its people to contain the spread of COVID-19 in the country. The present Government won a large public mandate in the 2017 elections due to Oli’s promises of a stable Government and improved economic conditions. However, poor governance, flawed economic policies and imbalanced foreign relations have endangered the lives of citizens.

(The writer is doctoral candidate, Centre for South Asian Studies, JNU)",columnists,https://www.dailypioneer.com/uploads/2020/story/images/big/disaster-waiting-to-strike-2020-04-16.jpg,https://www.dailypioneer.com/2020/columnists/disaster-waiting-to-strike.html
2,16-4-20,Resilience in a VUCA world,"The Novel Coronavirus has presented us with novel challenges and an uncertain business environment, the response to which has to be focussed

The unprecedented Coronavirus pandemic has driven home the fact that the world is a very volatile, uncertain, complex and ambiguous (VUCA) place. Hence, survival and growth strategies have to be revisited and revised accordingly. Although the term VUCA was coined by the US Army, it is now widely used by business leaders to portray the unpredictable nature of the environment in which they operate. Over the decades, business models have changed dramatically, so have the things that businesses value, leading to a sea change in how they operate. And since situations are so uncertain and can change quickly, businesses also need to be agile and adapt quickly. Here are some of the strategies that business leaders can look at to keep their corporations afloat now.

Optimise costs: Since this pandemic has hit the entire world, all businesses will find it extremely difficult to match historic levels of profitability. With factories shutting down due to lockdowns ordered by the Government and lower sales turnover, the resources available with the companies will be very limited. Therefore, proper utilisation of the same is a must. Review various costs, both fixed and variable, to carefully determine what is in fact required to run your business. After this, review, strategise any cost-reduction initiatives, whether it is making your business lean by introducing a downsizing process, holding off any upcoming capital investment or introducing companywide innovative techniques to drive down costs. Employees can be motivated to join this campaign and suitably rewarded for any innovative ideas that help the firm. Although reduction in expenditure is a must, cost-cutting should be avoided in areas that have the potential for revenue generation in the future. However, caution has to be exercised to make sure that the cost-cutting does not cause any reputation loss.

Liquidity rules: The pandemic and the lockdown strategies adopted by nations will most definitely lead the global economies into recession. During such slow times, it is crucial to understand that cash is the lifeline of any business and follow strategies to maintain cash flows. Run sensitivity and scenario analysis to understand the impact of changes in one or all variables relevant to your business, whether the impact would be more short-term or long-term in nature and what management approach needs to be taken. Build cash reserves like there is no tomorrow. That will become the lifeline of your business till things settle down and there is an upward trend in growth. Managing of working capital is another significant aspect of managing cash. Strategise to increase all inflows and reduce all outflows and stretch the time frame of payables. Try and reduce the days for any receivables and delay all non-essential capital expenditure. Another fastest way of adding liquidity to a business is the existing banker. Communicate with your banker to explore the extension of any credit facility. If you have a long association with your bank and it understands the value of your business, discuss the current situation and your plans to tackle the same. Clarity and openness in your conversation will be the key here. Try and re-negotiate the terms of your debt repayments or consider the options of refinancing or recapitalisation. Therefore, engaging with your key stakeholders and lenders early on will help you stay on top of your challenges.

Renegotiate terms with stakeholders: Customers and suppliers are the important external stakeholders for any business. In these economically difficult times it is vital to carefully nurture important and credit-worthy customers and weed out economic drags on your business. During normal times, businesses are under pressure to increase the number of customers or suppliers and to attain them firms sometimes give out more favourable terms. Now is a good time to carefully monitor accounts, re-evaluate the supplier base and re-negotiate favourable terms with some of your suppliers.

Be more responsive: You should aim at developing and transforming your organisation’s culture to be more responsive. The values of integrity, trust and empowerment will be the main features of this new business environment. Leaders have to set the right tone of the culture of the business, hire the correct staff and empower them to perform. All the organisational systems and processes have to be aligned with the company culture and become more responsive as a strategy for this new normal situation.

Invest in your people: Organisational response and agility will only develop if values are communicated correctly to your staff as they are the ones to steer your business through these difficult times. Businesses should invest in training people in skills and attributes that will help set up the corporate culture they are trying to build. In addition, leadership development programmes, coaching and mentoring are also a necessity. Innovate and find cost-effective and impactful ways of training staff. The Novel Coronavirus has presented us with novel challenges and an uncertain business environment, the response to which has to be focussed and swift. All these strategies, if adopted in time, will make it easier for businesses to emerge bruised but certainly alive.

(The writer is Associate Professor, Amity University, Noida)",columnists,https://www.dailypioneer.com/images/logo.jpg,https://www.dailypioneer.com/2020/columnists/resilience-in-a-vuca-world.html
3,16-4-20,War against COVID must be fuelled by peace,"Attacks on the Afghan security forces, who remain in active defence posture, targetted suicide and IED attacks and wartime criminality —including kidnapping and armed robberies — have hampered the rapid implementation of the Government’s Coronavirus strategy

COVID-19 has emerged as the single-most dangerous enemy of humanity in this century. Most of the fatalities have occurred in developed and developing countries, including the US, Italy, Spain, France, China and Iran. Looking at the scope and scale of emergency preparedness, the containment and mitigation measures undertaken by these countries to defeat COVID-19, one immediately begins worrying about a lack of resources, a severe shortage of essential commodities and services, as well as widespread human vulnerabilities in the countries of the “bottom billion.” There, State institutions remain weak, healthcare systems are non-existent or dysfunctional, demographics unchecked, coping mechanisms severely eroded and economies stagnating or in a state of gradual collapse.

This grim situation is further exacerbated by protracted and often imposed conflicts, which continue to be fuelled by geopolitical tensions and rivalries in regions such as the Middle East and South Asia where State actors exploit impoverished youth by brainwashing them ideologically and militarily arming them to advance State-specific geostrategic goals.

These intertwined and ever-growing vulnerabilities of the least-developed and war-ravaged societies remain a cause for grave global concern, as expressed by the United Nations (UN) Secretary-General Antonio Guterres, who urged warring parties across the world to lay down their weapons in support of the bigger battle against COVID-19. Indeed, no country needs an immediate cessation of conflict as much as Afghanistan. Even before the advent of the many and sometimes overlapping conflicts of the past four decades, Afghanistan had been a least developed country with meagre resources to address its dismal socio-economic indicators and abject poverty. The following decades, including the past 19 years, have hardly been kind to the suffering people of Afghanistan. Last year alone saw the killing and maiming of over 10,000 civilians while “conflict-related civilian casualties with more than 100 killed and many more injured” were recorded in March, says the UN Assistance Mission to Afghanistan (UNAMA). On March 27, the UN Security Council condemned the “heinous and cowardly terrorist attack that took place at the Dharamshala Sikh Temple in Kabul” when 25 citizens, including children, were killed and wounded.

In addition to these attacks, the improvised explosive devices (IEDs), planted in urban and rural Afghanistan, indiscriminately kill and cripple citizens. This tragedy is further compounded by the adverse effects of climate change, including droughts, floods, landslides and avalanches. The UN Office for Coordination of Humanitarian Affairs (UNOCHA) says that, “More than 14,000 people have been affected by floods, landslides and avalanches in more than 12 provinces across Afghanistan.” Plus humanitarian efforts have been hindered by attacks on aid workers.

Moreover, the destruction of critical service-delivery infrastructure remains a tactic often used to further victimise people. Millions have been deprived of electricity as transmission lines, importing electricity from Uzbekistan, have been cut in northern Afghanistan where such attacks recur often. Extended power cuts disable the few hospitals and clinics that respond to the basic medical needs of the population. Indeed, this is killing and maiming Afghans by other means than direct acts of violence, which are often overlooked for holding to account those UN member-State/s that directly cause or indirectly contribute to such complex humanitarian crises.

It is clear and well-documented that the Taliban are responsible for the frequent and largescale civilian deaths due to direct and indirect acts of violence and destruction of critical infrastructure. But they are not alone in committing these war crimes. Since their creation as an instrument of external strategic influence in 1994, the Taliban have enjoyed safe havens, an operational infrastructure, diplomatic support, as well as medical treatment for their wounded fighters in our neighborhood — from where they continue to run a terror campaign across Afghanistan.

At the same time, their killing machine has enabled other regional and transnational terrorist networks—such as the Al Qaeda and the Islamic State (IS) — to destabilise Afghanistan. In turn, this has enabled the Taliban to run a multi-billion-dollar illicit drug business that has not only addicted jobless young Afghans but has also fed drug demand in the wider region where millions are dying of addiction.

In the face of the rapid spread of the Coronavirus, the Taliban must reconsider their efforts to maintain status quo: To keep killing Afghans and destroying critical service-delivery infrastructure, whose extended dysfunction will cause further death, pain and destruction. Indeed, as they know all too well, this stands against the core teachings of Islam. This also violates the basic principles of international human rights and humanitarian laws, which uphold the right of all Afghans —including those in the Taliban-controlled areas — to unfettered access to COVID-19 tests and treatment.

As of now, 784 Afghans in over 20 provinces across the country have contracted the deadly virus and 25 people have died. These figures hardly reflect the ground reality, considering that thousands of Afghans have recently returned from Iran and Pakistan which are also battling COVID-19. Indeed, attacks on the Afghan security forces, who remain in active defence posture; targetted suicide and IED attacks and wartime criminality —including kidnapping and armed robberies — have hampered the rapid implementation of the Afghan Government’s COVID strategy, including containment, mitigation and socio-economic relief and recovery measures. To avert a COVID-19 catastrophe in Afghanistan, the Taliban must respond positively to calls by the international Ulema, the Organisation of Islamic Cooperation (OIC), the Afghan people and the international community, to cease violence immediately across Afghanistan.

Cessation of violence during this national hour of acute need for a humanitarian response to the global pandemic will automatically build confidence on all sides, allowing the recently-announced inclusive negotiation team and the Taliban to begin making progress towards peace, which all Afghans desire, demand and deserve. In the eyes of the Afghan people, choosing the path to peace over continued bloodshed will undoubtedly demonstrate the Taliban’s independence of any foreign influence while establishing their Islamic credentials based on the key tenets of a peaceful, tolerant, compassionate and merciful faith as enshrined in the Constitution of Afghanistan.

(The writer is the Ambassador of Afghanistan to Sri Lanka)",columnists,https://www.dailypioneer.com/images/logo.jpg,https://www.dailypioneer.com/2020/columnists/war-against-covid-must-be-fuelled-by-peace.html
