,Date,Title,Article,Category,Image_link,Article_link
175,16-4-20,Friendship with Indian player doesn’t ensure IPL entry: Laxman,"Former India batsman VVS Laxman took a jibe at Michael Clarke for his recent claims that Australian cricketers “sucked up” to India captain Virat Kohli for protecting their IPL contracts, saying just being nice to someone doesn’t guarantee a spot in the cash-rich tournament.

“Just by being nice to someone doesn’t get you a place in IPL,” Laxman, who also mentors IPL team Sunrisers Hyderabad told Star Sports on its show Cricket Connected.

“Any franchise will look at the player’s caliber and value add to the team, which gives them desired results by winning matches/tournaments. These are the kind of players who get IPL contracts. So just being nice to someone will not earn you a spot in the IPL.”

Laxman said as a mentor when he is on the auction table, those players are looked at who do exceptionally well for their country.

“If you’re friendly with any Indian player it doesn’t mean that you are getting IPL contract. As a mentor, I’m on the auction table and we select players, those international players that have played exceptionally well for their country and can add value to the franchise.

“Friendship with any Indian player doesn’t ensure entry into the IPL,” Laxman, who amassed 8,781 Test runs, said without mincing any words.

Former India opener Krishnamachari Srikkanth also shot back at Clarke, terming his comments as ‘ridiculous’.

Srikkanth, who was part of the 1983 World Cup winning Indian team, said matches are not won by sledging.

“You do not win matches just by sledging. Aussie’s loss is a loss, his statement was ridiculous I would say,” said 60-year-old Srikkanth.

Srikkanth, himself an aggressive player, said that sledging cannot help in any way.

“If you ask Nasser Hussain or Sir Vivian Richards who are experienced players, you can never score runs or get wickets through sledging. You need to play good cricket and showcase determination; you need to bowl well to get wickets and bat well to achieve targets. Sledging cannot help in any way according to my opinion,” he said.",sports,https://www.dailypioneer.com/images/logo.jpg,https://www.dailypioneer.com/2020/sports/friendship-with-indian-player-doesn---t-ensure-ipl-entry--laxman.html
176,16-4-20,Indian women qualify for 2021 World Cup,"India on Wednesday sealed their qualification for the 2021 Women’s World Cup following the cancellation of their ODI Championship round against Pakistan with the BCCI not getting government clearance to play the arch-rivals.

The India-Pakistan round was scheduled to take place between July and November last year but was always subject to government clearance. Both teams will share points for the cancelled three-match series.

“With respect to the India v Pakistan series, the TC concluded that the series could not be played because of a Force Majeure event after the BCCI demonstrated that it was unable to obtain the necessary government clearances to allow India to participate in the bilateral series against Pakistan, which forms a part of the ICC Women’s Championship,” said the ICC in a statement.

“The India-Pakistan series was originally scheduled in the sixth round of the competition, between July and November 2019, but despite the best efforts of both the boards, it was unable to take place,” it said.

The development also means that India, who finished runners-up in the 2017 edition, have secured their berth for the 2021 World Cup in New Zealand.

All eight teams in the 2017-2020 edition of the ICC Women’s Championship play each other in a three-match series. Hosts New Zealand and the next four highest-placed teams on the points table qualify directly for one-day international cricket’s showpiece.

“Australia (37 points), England (29), South Africa (25) and now India (23) have qualified by virtue of being the top four,” the statement added.

The 10 teams vying for the three remaining places in the showpiece event will be the hosts, Sri Lanka, along with Pakistan, West Indies, Bangladesh, Ireland, and the winners of the five regional qualifiers.",sports,https://www.dailypioneer.com/images/logo.jpg,https://www.dailypioneer.com/2020/sports/indian-women-qualify-for-2021-world-cup.html
177,16-4-20,Indians shine in online shooting competition,"The experienced Amanpreet Singh, Manu Bhaker and Meghana Sajjanar were among the Indian shooters who shone in the first-of-its-kind International Online Shooting Championship held on Wednesday.

In the 10m air rifle event, Austria’s Martin Strempfl finished at the top with 632.5, Sajjanar was second with 630.5 while Etienne Germond of France was placed third with 629.4.

World number one Indian Divyansh Singh Panwar had to be contend with a fourth-place finish with 627.8.

In the 10m air pistol competition, Amanpreet shot 576 to finish at the top with Ashish Dabbas at second place with 575.

Teen sensation Bhaker, who has already secured a quota place for the Tokyo Olympics alongside Divyansh, was third with a score of 572.

Hungary’s Veronika Major finished fourth with 569.

A total of 50 shooters from seven countries took part in the innovative event, an initiative of former India shooter Shimon Sharif to help the athletes ‘get a feel of competition’ during the coronavirus-forced lockdown in many countries.

Doing commentary was renowned Hungarian shooter Peter Sidi as marksmen and markswomen turned their homes into shooting ranges.

The competitors logged in through Zoom app from their respective locations and shot using their Electronic Shooting Targets (EST).

The competition was live streamed on the Internet.",sports,https://www.dailypioneer.com/images/logo.jpg,https://www.dailypioneer.com/2020/sports/indians-shine-in-online-shooting-competition.html
178,16-4-20,Trump eager to ‘get sports back’,"US President Donald Trump is hankering for a return of live sports action, but US league supremos are taking a cautious approach to competition amid the coronavirus pandemic.

“We have to get our sports back,” Trump said Tuesday. “I’m tired of watching baseball games that are 14 years old.” Sports in America, like the rest of the world, have been brought to a virtual standstill by COVID-19.

The NBA shut down on March 11 after Utah Jazz center Rudy Gobert tested positive for the virus, and the NHL, Major League Soccer and the US PGA Tour quickly followed suit.

Major League Baseball’s 2020 season, due to start March 26, is on hold, as is the LPGA tour and motor racing, while the NFL is just hoping it will be able to start its season on time in September.

The dearth of sports has led to a wealth of speculation as to when and how competition could resume.

The NBA and NHL are wrestling with how they might fashion credible ends to campaigns that were heading into their final stages.

Baseball, meanwhile, was reported to be considering sequestering 30 teams in Arizona — or perhaps Arizona and Florida — to open the season playing games in empty ballparks.

The NHL was reportedly mulling a single-venue re-start in North Dakota, while Dana White, head of the Ultimate Fighting Championship, indicated he was considering holding mixed martial arts cards on a private island.",sports,https://www.dailypioneer.com/images/logo.jpg,https://www.dailypioneer.com/2020/sports/trump-eager-to----get-sports-back---.html
179,16-4-20,"Sane Bayern move still possible, says new agent","Leroy Sane’s new agent says the Manchester City winger is still in the running for a transfer to Bayern Munich, after a potential switch was put on hold due to a serious knee injury.

“FC Bayern is the only club in Germany that Leroy can see as the next step in his career,” Sane’s agent Damir Smoljan told magazine Sport Bild on Wednesday.

“He believes the conditions are right there for him to achieve his ultimate goal: winning the Champions League.”

The 24-year-old Sane is viewed as one of Germany’s brightest talents and has scored five goals in 21 appearances for his country. He won the Premier League title with City in 2017/18 and 2018/19.

Bayern want Sane after wingers Arjen Robben and Franck Ribery both retired at the end of last season.

“The interest of FC Bayern is no secret, but other very big European teams have already contacted us about Leroy,” Smoljan added, with Barcelona and Real Madrid also said to be interested.",sports,https://www.dailypioneer.com/images/logo.jpg,https://www.dailypioneer.com/2020/sports/sane-bayern-move-still-possible--says-new-agent.html
180,16-4-20,Holding picks Steyn in his ‘fab 4’ pacers,"The great Michael Holding has picked South African Dale Steyn among his top-four fast bowlers across generations and his list includes fellow West Indians Malcolm Marshall and Andy Roberts besides Australian Denis Lillee.

In a Sky Sports podcast, the 66-year-old said he would pay to watch Steyn, who retired from Tests last year.

“I have experience with those three guys (Marshall, Roberts and Lillee, but just watching, you can’t go Dale Steyn outside of photography. He has been one of the great fast bowlers in an era. You’d pay to see it,” said Holding, who picked 249 wickets in 60 Tests at 23.68.

Steyn picked 439 Test wickets at a stellar average of 22.95 and has one of the smoothest actions in the game.

Talking about Lillee, Holding said he was a complete package.

“Lillee had it all: rhythm, aggression control. He was extremely fast when he started, but he had to completely reshape his action after a back injury and find different ways to get hitters out after losing a lot of rhythm.

“When you see that someone can adapt in that way, you have to rate him highly, as many players are not as effective when they miss a beat,” said Holding, who was nicknamed Whispering Death for his smooth and silent run-up.

On fellow West Indians Marshall and Roberts, Holding said: “Malcolm started with a good rhythm, but as time went on he learned a lot about fast bowling. He could evaluate opposition hitters so quickly and so easily.

“In those days you didn’t have many tapes or computers, it was all in his head. He understood how to deal with hitters.”

On Roberts, he added: “Andy was someone I learned a lot from. He hardly ever spoke, he used to walk around the field with a sullen face and people thought he looked aggressive and must be a miserable guy. But that wasn’t Andy.

“He was my roommate for most of my career and we used to talk about cricket almost every night. A lot of times, we would order food, we would stay in our room and talk about cricket. You would never believe how much this guy knows.”",sports,https://www.dailypioneer.com/images/logo.jpg,https://www.dailypioneer.com/2020/sports/holding-picks-steyn-in-his----fab-4----pacers.html
181,16-4-20,Tour de France postponed to Aug 29-Sept 20,"The Tour de France will be raced from August 29 to September 20, organisers announced on Wednesday, postponing cycling’s flagship event originally slated to start on June 27 due to the coronavirus lockdown.

The news comes as a relief to professional cycling teams and fans with four-times Tour winner Chris Froome welcoming ‘light at the end of the tunnel’ for those suffering under COVID-19 lockdown.

The decision moves the three-week race out of its traditional slot in the summer holidays where roadside crowds of around 12 million would be expected to gather in festive spirit.

It will now finish on the same day the postponed French Open championships starts, September 20, giving a worrying indication of a potential autumn fixture pile-up as more sports seek to reschedule suspended events.

Tour director Christian Prudhomme said the new start was based on a double rationale.

“We wanted to be as far away from the pandemic as possible,” he said.

“The president put a July 14 date on public gatherings, but it seemed more reasonable to us to allow the riders time to get into peak condition.”

While the dates have changed the original route remains intact, starting in Nice and finishing in Paris.

“The Tour is still the Tour. All the challenges we set remain intact,” he said of the hotly anticipated climb-laden route that rarely strays far from the mountains.

The new date solves a series of problems after organisers faced up to the reality that the race could never take place on the original dates.",sports,https://www.dailypioneer.com/images/logo.jpg,https://www.dailypioneer.com/2020/sports/tour-de-france-postponed-to-aug-29-sept-20.html
182,16-4-20,TRIFED leads the game,"The current crisis situation due to COVID-19 has posed an unprecedented threat across the country. Almost all the states and UTs in India are affected by it, in varying degrees. The trade and industry, at all levels and all segments of society are also affected. The situation has dealt a serious blow to the livelihood of the poor and marginalised communities too.

TRIFED under Ministry of Tribal Affairs, with the assistance of state nodal departments and state implementation agencies initiated Pradhan Mantri VanDhan Yojana (PMVDY) where a total of 1205 Van Dhan Vikas Kendras (VDVKs) have been sanctioned in 27 states and one union territory involving around 18,075 Van Dhan self-help groups (SHGs). This constitutes over 3.6 lakh tribal gatherers in the scheme.

TRIFED has issued dos and don’ts advisories relating to NTFP to be kept in mind during COVID-19, providing suggestive practices for maintaining personal hygiene, adopting cashless practices, among others. It is also working on setting up of 15,000 ‘Van Dhan Social Distancing Awareness and Livelihood Centres’ from the recently sanctioned Van Dhan SHGs among the 1205 Van Dhan Kendras under Van Dhan Samajik Doori Jagrookta Abhiyaan. One leader from each Van Dhan SHG will be identified for generating awareness among the community about social distancing and steps to be followed. He would be made aware of the symptoms of the disease, information about the nearest medical facility/ practitioner in case of need for contacting or reporting and will disseminate information to the community. The SHG would be provided with protective masks and sanitising products (soaps, disinfectants).

It has collaborated with UNICEF for developing a digital communication strategy for promoting the scheme and utilising the VDVK platform for risk communication and well-being during the pandemic. UNICEF is providing the necessary support to be circulated to the SHG centers in the form of digital multimedia content, webinars for virtual trainings (basic orientation on COVID response, key preventive behaviours), social media campaigns (on social distancing, home quarantine, etc) and Vanya radio.

A webinar with UNICEF training team was held on Thursday. It witnessed national level participation from representatives of state implementing and nodal agencies, members from SHGs, among several others from all over the country. The informational training helped the participants in knowing the key preventive measures to take against COVID-19, and clarified doubts and dispelled the myths related to the pandemic. It also involved interaction from viewers in the form of poll questions, with viewers answering questions based on the information provided in the discussion. The webinar saw over 2,380 users, and amassed over 26,000 views while being live-streamed on Facebook. Further informational trainings are scheduled to be held in the forthcoming weeks in order to reach ever more districts and tribal families across the country.",vivacity,https://www.dailypioneer.com/uploads/2020/story/images/big/trifed-leads-the-game-2020-04-16.jpg,https://www.dailypioneer.com/2020/vivacity/trifed-leads-the-game.html
183,16-4-20,Sharda University takes courses online,"To minimise disruption in academic schedule, Sharda University continues to deliver online classes across all the courses. Due to the lockdown amid global COVID-19 outbreak, the institute has taken this initiative to ensure that students’ academic interests aren’t compromised.

It has put together a contingency plan in which the faculty are working towards ensuring a seamless transformation to digital learning via technology tools and solutions like Zoom, Big Blue Button, Google Classroom. The iCloud LMS software that the university subscribes is cloud-based and highly-advanced. Coursera and SWAYAM are some of the technologies used by students of School of Design and Planning for making their assignments. Teachers and students have access to this software at homes but for students who are in remote areas, teachers are helping them through email, WhatsApp or audio lectures. Students and faculty can access library from anywhere as it is made available online.

YK Gupta, pro chancellor, Sharda University, said, “Online learning has a lot of potential and even though it has been thrust into the spotlight under unfortunate circumstances, it is time that educational institutions utilise this tool effectively. Our aim is to keep a strict schedule in place so that students are able to complete their courses and projects on time. We are also focussing on the admission procedures through online counsellors so that no student aspiring for a better future is left behind due to the COVID-19 crisis.”

Many international students are staying in hostels at the university campus. The institute has made necessary arrangements to ensure their safety and well-being. Students have been assigned single rooms and the campus is being sanitised regularly. Students have been given access to free Wi-Fi.",vivacity,https://www.dailypioneer.com/uploads/2020/story/images/big/sharda-university-takes-courses-online-2020-04-16.jpg,https://www.dailypioneer.com/2020/vivacity/sharda-university-takes-courses-online.html
184,16-4-20,ESIC undertakes relief measures,"The world is currently dealing with a very deadly situation due to Coronavirus pandemic. Many establishments are temporarily closed and workers are unable to work. In line with the relief measures being extended by government to business entities and workers, Employees’ State Insurance Corporation (ESIC) has undertaken following relief measures for its stakeholders, especially Employers and Insured Persons, besides strengthening its medical resources to fight COVID-19:

Extension of time in filing ESI contribution: As a relief measure, the period for filing ESI contribution for the month of February and March was earlier extended to April 15 and May 15, respectively. Now, considering the hardship being faced by employers, the period for filing ESI contribution for the month of February has been further extended from earlier extended period (April 15 to May 15). No penalty or interest or damage will be levied on establishments during the extended period.

Besides these, following relief measures have been undertaken for Insured Persons and Beneficiaries:",vivacity,https://www.dailypioneer.com/images/logo.jpg,https://www.dailypioneer.com/2020/vivacity/esic-undertakes-relief-measures.html
185,16-4-20,NCC volunteers to help,"National Cadet Corps cadets are volunteering countrywide to help the civil administration. They are taking up tasks and are working shoulder to shoulder with civil defence and police personnel.

As the instructions to utilise the cadets for logistics and supply chain management duties have reached various district headquarters, the district administration is seeking their support, by requisitioning them from the NCC directorates.

Exercise NCC Yogdan commenced on April 1. Within 10 days approximately, 2,000 cadets have been employed countrywide in 12 states, with maximum in Tamil Nadu (306 cadets).

Volunteer NCC cadets, who are above 18 years and are from senior division (for boys cadets) and senior wing (for girls cadets) are only being employed for these duties. The cadets are voluntarily contributing in the cause, to fight against COVID-19. It’s being ensured that cadets are trained and properly briefed about the tasks, and also provided with safety equipment like masks, gloves. They are being employed under supervision of officers, PI staff and ANOs. They are not being employed in areas which are sealed as hotspots.

They are being employed for various duties like, traffic management, supply chain management, preparation and packaging of food items, distribution of food and essential items, queue management, social distancing ,manning control centres and CCTV control rooms.

As the lockdown continues, more states are in the process of requisitioning NCC cadets for various tasks. Headquarters DGNCC is monitoring the number of cadets volunteering for the cause. As per the last figures, 50,000 cadets have volunteered to contribute in Exercise NCC Yogdan.",vivacity,https://www.dailypioneer.com/uploads/2020/story/images/big/ncc-volunteers-to-help-2020-04-16.jpg,https://www.dailypioneer.com/2020/vivacity/ncc-volunteers-to-help.html
186,16-4-20,PCB won’t agree to cancel Asia Cup to accommodate IPL,"Pakistan Cricket Board chairman Ehsan Mani has asserted that the PCB will not agree to cancelling the Asia Cup, scheduled in the UAE in September, to make room for the Indian Premier League, which has been postponed due to the COVID-19 pandemic.

The IPL was to be held from March 29 to May 24 but has been postponed indefinitely because of a extended lockdown.

“I have read and heard about these speculations but right now just remember that having or not having the Asia Cup is not a decision between Pakistan and India it involves other countries as well,” asserted Mani on Tuesday.

Pakistan were to host the event but it was shifted to Dubai and Abu Dhabi after India expressed reluctance to visit Pakistan owing to security concerns and the strained diplomatic ties between the two countries.

“...It is important to have the Asia Cup if cricket activities resume by then because development of Asian cricket depends on funding from the tournament. It is important for many countries who are members of the Asian Cricket Council,” he added in a podcast released by the PCB.

However, he also conceded that holding the Asia Cup this year is a big challenge because right now “we don’t know if it can be held or not.”

“But if the conditions change and we can have the Asia Cup, it must be held as earnings from it are distributed as development funds to member countries for next two years,” he said.

He said reports about the Asia Cup being hosted by Bangladesh or UAE were mere speculation at this stage.",sports,https://www.dailypioneer.com/images/logo.jpg,https://www.dailypioneer.com/2020/sports/pcb-won---t-agree-to-cancel-asia-cup-to-accommodate-ipl.html
187,16-4-20,Vijay dubs CSK as special side,"Veteran opening batsman Murali Vijay on Wednesday described his IPL franchise Chennai Super Kings as a special team in the T20 league with “legends of world cricket” forming a part of it.

“CSK is a very very special team. The kind of players, who came aboard right from the first auction, you name it, they are legends of world cricket,” Vijay, who spent five seasons with the team from 2009-13 in his first stint before re-joining it in 2018, was quoted as saying by the CSK website.

“It was a great honour for us youngsters to step into the dressing room and rub shoulders with some of the legends. You get to learn a lot of things by watching them and being around them,” the right- hander said about his early days in the franchise.

The 36-year-old, who has played for India in 61 Tests, the last being in 2018, was a part of all the three IPL-winning campaigns of CSK.

“Twenty20 was a new format in 2008/09, and I guess my game was suited for white ball cricket when I started. I kind of enjoyed it when the opportunity came to me. I was ready up and going,” he said.

“The team atmosphere was such that you want to contribute because everyone plays with such energy and intensity. The competition was very high.”",sports,https://www.dailypioneer.com/images/logo.jpg,https://www.dailypioneer.com/2020/sports/vijay-dubs-csk-as-special-side.html
188,16-4-20,Buttler in awe of Rohit’s effortless batting,"England batsman Jos Buttler was effusive in his praise for Rohit Sharma, describing the India opener as an awesome player, who can ‘effortlessly’ take down any opposition by scoring big hundreds.

“Rohit Sharma I think is an awesome player,” Buttler said during an Instagram Live session on Rajasthan Royals page. “Effortless. Quite a lot of Indian players have that awesome style.

“He has been fantastic for a long time and I just like the way he bats and the effortless nature in which he takes people down.”

Rohit is currently regarded as one of the greatest ODI players, ranked only behind India skipper Virat Kohli at the top of the ICC rankings. The Mumbaikar is the only batsman to have scored three double hundreds in the format.

The 32-year-old had equalled Sachin Tendulkar’s record for most centuries in World Cup matches when he scored five hundreds at the 2019 edition to end up as highest-scorer with 648 runs.

“One of the things I have seen with Rohit is that if he gets in, he scores big runs and really affects the game. He must have scored 4-5 hundreds in the World Cup last year,” said Buttler, who had shared the dressing room with Rohit at Mumbai Indians in the 2016 and 2017 seasons.

Buttler feels the Indian players now have become better in negotiating short balls.

“I think a few years ago people used to attack Indian players with the short ball but Rohit smashes them. Then you go fuller and he smashes them right down the ground.”",sports,https://www.dailypioneer.com/images/logo.jpg,https://www.dailypioneer.com/2020/sports/buttler-in-awe-of-rohit---s-effortless-batting.html
