,Date,Title,Article,Category,Image_link,Article_link
61,16-4-20,"UT identified as hotspot, Admn to urge Centre to reconsider decision","The Union Territory of Chandigarh, which has reported 21 positive Covid-19 (Coronavirus) cases till Wednesday evening, has been included in the list of coronavirus hotspots released by the Central Government.

As per Centre’s guidelines, restrictions will continue to apply on hotspots or red zones till May 3. A district could move from the red to the green zone if it does not report any case for 28 days, and vice-versa.

The development has come as a major disappointment for the UT Administration, which has decided to approach the Central Government to reconsider its case and allow relaxations accordingly, after April 20.

The Prime Minister Narendra Modi had a day before announced that for the next one week till April 20, every town, district, state will be examined carefully and areas, which have shown improvement in tackling coronavirus will be given certain relaxations.

Following this, the Administration had already begun preparing a roadmap for allowing relaxations after April 20 in the city. Curfew was imposed in Chandigarh on March 24 to ensure social distancing and combat the spread of Coronavirus. The city has so far recorded 21 positive Coronavirus cases, out of which nine have already recovered and no death has been reported till Wednesday evening. While 1721 were put in home quarantine as a precautionary measure, 1226 have completed the quarantine period.

Manoj Parida, Adviser to UT Administrator while talking to The Pioneer said, “Chandigarh has been included in the list of 170 districts identified as Covid-19 hotspots or red zones released by Central Government.

“The Administration will approach the Central Government urging it reconsider Chandigarh’s case as more than nine persons have already recovered in the city. No coronavirus hotspots within the city have been identified,” he said.

“We were hoping to allow certain relaxations regarding public movement and opening of various establishments after April 20. But, no relaxations can be allowed in coronavirus hotspots as per Centre’s guidelines till May 3,” he added.

The UT Administrator VP Singh Badnore was also apprized about Centre’s decision to declare Chandigarh as a hotspot district, which requires strict restrictions in the city. The Administrator has directed the UT officers to ensure that the instructions received from Central Government be strictly implemented and supervised.

Notably, Chandigarh is a joint capital of Punjab and Haryana. While Punjab has so far reported 186 positive coronavirus cases, Haryana has recorded 190 cases.

The satellite township of Chandigarh namely Mohali in Punjab is also Covid-19 hotspot and has reported 56 cases, maximum in the State. Neighboring district of Panchkula in Haryana has reported six cases.

According to the Centre’s guidelines, in hotspots, containment zones will be demarcated by States/ UTs/ District administrations as per the guidelines of the Ministry of Health and Family Welfare. In these containment zones, the activities allowed for non-hotspots will not be permitted. There shall be strict perimeter control in the area of the containment zones to ensure that there is no unchecked inward or outward movement of population from these zones except for maintaining essential services (including medical emergencies and law and order related duties) and Government business continuity.",state-editions,https://www.dailypioneer.com/images/logo.jpg,https://www.dailypioneer.com/2020/state-editions/ut-identified-as-hotspot--admn-to-urge-centre-to-reconsider-decision.html
62,16-4-20,MGNREGS allowed in State with riders,"The State Government on Wednesday issued operational guidelines to be maintained during MGNREGS work in the State during the COVID-19 lockdown.

“All field officials working under the PD, DRDA, Executive Engineer, RWSS, BDO and GP level will attend their work normally in the field. The concerned head of office should also ensure full strength in the office which would provide necessary support to the field execution,” an official order said.

The concerned officials have been asked to ensure social distancing strictly in the field and contain the spread of coronavirus. No meetings would be organised, soap or hand wash and sufficient safe drinking water should be made available for sanitisation at the work site and informal gatherings of workers at a worksite should be avoided.

No sick person and persons above 60 years should be engaged in any work, stated the order.",state-editions,https://www.dailypioneer.com/images/logo.jpg,https://www.dailypioneer.com/2020/state-editions/mgnregs-allowed-in-state-with-riders.html
63,16-4-20,Punjab to use residential schools as isolation centres,"Ramping up the health infrastructure and facilities, Punjab Government would use as many as 8,346 beds available in hostels of State’s all 10 residential meritorious schools as Covid Care Isolation Centres.

Informing this, the State Education Minister Vijay Inder Singla on Wednesday said that besides providing all State Government schools for the creation of isolation centres, the Department has also put 10 meritorious schools on the disposal of Deputy Commissioners to use them as Covid Care Isolation Centres.

Singla, who was reviewing the preparedness at Meritorious School Ghabdan (Sangrur), said that as many as 8346 beds are available in hostels of these residential meritorious schools and around 200 classrooms could also be used by the medical staff for various other purposes.

These schools are situated in Amritsar, Bathinda, Ferozepur, Gurdaspur, Jalandhar, Ludhiana, Patiala, Mohali, Sangrur and Hoshiarpur districts, said Singla.

Singla, who is also holding charge of PWD Minister, said that the Public Works Department’s officials have also been directed to fully cooperate with the local administration for any improvements required for setup of isolation or quarantine centres.",state-editions,https://www.dailypioneer.com/images/logo.jpg,https://www.dailypioneer.com/2020/state-editions/punjab-to-use-residential-schools-as-isolation-centres.html
64,16-4-20,6 IAS officers to tackle Covid-19 in BBSR,"The State Government has appointed six IAS officers for containment and prevention of COVID-19 in the Bhubaneswar Municipal Corporation (BMC) areas after the capital city has emerged as the epicentre of the virus spread in the State.

While ST and SC Development Secretary Ranjan Chopra and Energy Secretary Bishnupada Sethi have been assigned the north zone, Excise Secretary KK Lohani and Higher Education Secretary Saswat Mishra have been assigned the south-east zone.

Finance Secretary Ashok K Meena and Social Security and Empowerment of Persons with Disabilities (SSEPD) Commissioner-cum-Secretary Bhaskar Jyoti Sarma have been assigned the south west zone, stated a notification issued by Chief Secretary Asit Tripathy.

The move came after Chief Minister Naveen Patnaik reviewed the status of disease at a high-level meeting on Tuesday.

The concerned senior officers would be in overall charges of overseeing the containment and prevention activities including intensive sampling of primary and secondary contacts, contact tracing, household survey by the surveillance team in the containment zone and supply of essential commodities to the households under containment.

The officials would coordinate with the BMC or Commissioner of Police and other administrative departments working in the fight against COVID-19.",state-editions,https://www.dailypioneer.com/images/logo.jpg,https://www.dailypioneer.com/2020/state-editions/6-ias-officers-to-tackle-covid-19-in-bbsr.html
65,16-4-20,Govt to issue appointment letters to doctors in waiting list: Anil Vij,"To tackle the Covid-19 pandemic amid reports of shortage of doctors in some hospitals of the State, Haryana Health Minister Anil Vij on Wednesday said that the State Government has decided to issue fresh appointment letters to doctors on 116 posts, who were named in the waiting list.

“With the direction to join duty within 15 days of issuance of appointment letters, state Government had issued appointment letters to 312 selected doctors in March but only 196 of them have joined. A total of 116 have not joined duty and their joining date has expired. Now new appointment letters will be issued to those candidates who are in the waiting list,” Vij said.

The Health Minister said that this move is a part of mobilising all available resources in view of the Covid-19 crisis and to ensure the availability of doctors in rural parts of the State.

Sources in the health department said that the selection process of 447 doctors was initiated by the Health Department through Rohtak PGI. 312 doctors were selected and were offered to join their favorite district. A total of 1400 candidates had participated in the selection process done by PGI, Rohtak.

Despite Government’s consistent efforts, there has been shortage of doctors in the Government hospitals since long. Currently, there are 789 vacancies in the Government hospitals despite availability of about 2,500 doctors hospitals. If all 312 selected doctors join duty, there will still be a vacancy of 477 doctors in the State, officials said.

Meanwhile, Vij said that to provide medical services in rural areas, 211 medical teams have been formed to operate mobile clinics. These medical teams will visit different areas of the districts in Haryana Roadways buses, which will be converted into mobile clinics, to provide general OPD services and trace people exhibiting Covid-19 symptoms.

Talking to ‘The Pioneer’ over the phone, Vij said, “To address the regular medical issues of citizens left unaddressed due to the unfolding of the Covid-19 crisis, all district chief medical officers have been directed to form teams, consisting of doctors, paramedics and pharmacist, to operate mobile dispensaries.”

To execute this scheme effectively, all the DCs have been given necessary instruction and also directed to prepare the route plan of the mobile dispensary with the officials concerned. This dispensary will go to each village for the treatment of patients for at least two hours. Many villages will be covered in a day, the Minister added.

Vij said that to know the actual status on the execution of this scheme, he will review this scheme with DCs on Thursday.

The Health Minister said that instruction has been issued that social distancing will be taken care of once the mobile dispensary reaches the village. No crowd will be allowed to gather, he said, adding that the medical officers have been directed to send maintenance records of patients daily at State Headquarters. All Chief Medical Officers have been instructed to create routes by coordinating with the concerned DCs.

Sources in the Health department said that every mobile dispensary will have Allopathic, Urologist and homeopathic medicines. For mobile dispensaries to function, teams have been formed, which include doctors, paramedics and pharmacists. They will visit their assigned areas, examine the health condition of people who approach them for check-ups and provide them with medicine.

The time-table has been made for every village and mobile dispensary will visit the villages accordingly. To avail the service of mobile clinic, the villagers will be informed about when the mobile dispensary will reach their village. Once or twice in a week, a mobile dispensary will visit the village as per necessity.",state-editions,https://www.dailypioneer.com/images/logo.jpg,https://www.dailypioneer.com/2020/state-editions/govt-to-issue-appointment-letters-to-doctors-in-waiting-list--anil-vij.html
66,16-4-20,Naveen Patnaik is hero in corona battle,"The unruly coronavirus has evoked the fear, precautionary spirit and frightful discussion among the human race as never before. The horrifically infective virus is the biggest enemy of mankind at the present. The entire human world is slowly coming together to destroy the invisible foe. The multifarious sovereign political entities that were at war for long have ignored hostilities and turned friends for survival.

Mighty and wealthy nations led by the USA are reeling under the pressure of helplessness as the virus is lurking everywhere irrespective of borders.

China believably discovered the virus first after taking a big beating. And since developed Western countries, having turned lazy due to riches, had dumped all their manufacturing activities in China to save money at enormous loss of employment, most of their nationals carried back the virus to their home locales. When Trump got to know about the pandemic, he was advised by his medical experts to let the country folks get infected to develop good enough ‘herd-immunity' and defeat the virus routinely. The previous SARS virus breakout in China was deadlier than corona but much less infective. The genetic material DNA of the previous one was less adaptive and so less lethal. Corona has the RNA genetic material which is way smarter in duping the host cell and getting itself ferociously multiplied. Incidentally, DNA is the master genetic material that stores and transmits the genetic code. The RNA is only the servant messenger to carry the message to newly-forming organism. The servant is always usually slier and bigger master of machinations. Corona is an RNA-virus that adapts hosts easily and jumps species immediately when in trouble.

By the time corona caused panic by assuming proportions of a global pandemic, huge damage was already done to those national communities that had intimate relationships of trade and other transactions with China. Around the close of February 2020 when India was groping in wilderness, Naveen Patnaik came heavily on the precaution mode having been guided perfectly by his chosen group of aides. Odisha, thus, is the first State to clamp the most critical lockdown technique as there was not much time in hand to persuade people to practise social distancing, constant hand-washing and more behavioural adaptations. PM Modi took cue and declared a nationwide lockdown. Naveen still scores by having established maximum number of COVID hospitals and installing the fastest testing equipment in Odisha.

The infection incidence and prevalence today across India are a bit misleading for the simple reason that ‘proportionate-to-population' tests are not being conducted due to lack of facilities. Odisha is one of fewest States to test huge numbers of COVID suspects. It is also the first State to extend the lockdown period to April-end. Naveen is smarter in disaster management. If Modi and Naveen join hands in nation-building efforts, wonders would happen.

Rightly, people have realised the greatest warriors in the ‘corona-destroy’ battle are low-wrung police functionaries that endure the scorching sun to keep public order intact; the nurses at hospitals who work in closest proximity with patients; the sanitary workers who keep clearing garbage from all around; and, lastly, the doctors some of whom are extremely dedicated in treating the afflicted people. Some doctors do shirk work out of fear of infection particularly those running private clinics. These cash-crazy crooks should be identified and brought to book. Besides, the bureaucratic administrators who are alert days and nights to ensure every official is delivering the desired service and everything is in place need to be hailed as heroes. People do not seem to know how top-level bureaucrats perform duties in nightmarish conditions because ultimately they would be blamed if things failed. But it is also true some tricky officials glorify themselves by confusing the media guys-in-a-hurry. They dramatise very ordinary acts during daily Press briefings.",state-editions,https://www.dailypioneer.com/images/logo.jpg,https://www.dailypioneer.com/2020/state-editions/naveen-patnaik-is-hero-in-corona-battle.html
67,16-4-20,‘Initiate action against those causing disruption in procurement’,"Adopting a tough stand towards the people, who were threatening to disrupt the smooth arrangements made for wheat procurement, the Punjab Mandi Board on Wednesday issued directions to all the Secretaries of the Market Committees across the State to initiate strict action immediately against any person found causing hindrance in the procurement operations.

Punjab Mandi Board Secretary Ravi Bhagat said that it has come to their notice that a certain section of arhtiyas had threatened to boycott the procurement operations during Rabi Marketing Season 2020-21, which would not be tolerated at any cost.

He pointed out that the Mandi Board has already issued necessary directions to cancel the licenses of all such erring arhtiyas and warned them of further action under the strict provisions of the Disaster Management Act, 2005.

In order to ensure that farmers do not face any harassment, Bhagat further directed immediate cancellation of all farmers’ passes issued to those arhtiya threatening to go on strike and re-issuance of an equivalent number of these passes to other arhtiyas operating in the same mandi.

Bhagat clarified that as of now, there is no disruption of work in any Mandi across the State. However, arrivals are slow and nil in several mandis across the State.",state-editions,https://www.dailypioneer.com/images/logo.jpg,https://www.dailypioneer.com/2020/state-editions/---initiate-action-against-those-causing-disruption-in-procurement---.html
68,16-4-20,25 Punjab cops selected for ‘DGP Honour for Exemplary Sewa to Society’,"Punjab Director General of Police (DGP) Dinkar Gupta has selected 25 Punjab Police officers across districts for the coveted ‘Director General of Police Honour for Exemplary Sewa to Society’ for their exceptional community service on the frontlines of the Covid-19 operations and response activities in the State.

The awardees include four Superintendents of Police (SPs), one Assistant Superintendents of Police (ASP), one Deputy Superintendents of Police (DSP), six Inspectors, four Sub-Inspectors, three Assistant Sub-Inspectors (ASIs), two Head Constables and four Constables.

The award would honour those who have done outstanding work by going beyond the call of duty in various kinds of humanitarian activities during the current corona pandemic.

“They are selected from various nominations sent by the Commissioners of Police and Senior Superintendents of Police (SSPs) for the award introduced on the Chief Minister Capt Amarinder Singh’s initiative in the light of scale and sacrifice of over 45,000 policemen who are working relentlessly across the State along with social and religious organizations to realize the resolve that ‘no man will sleep hungry in Punjab’,” said the DGP Gupta.

Gupta said: “Nakodar ASP Vatsala Gupta did pioneering work in reaching out to the poor and underprivileged slum dwellers of Nakodar town, while Ropar DSP Varinder Jit Singh ensured supply of essential goods to the poor and needy by mobilizing volunteers. Ropar’s SI Jatin Kapoor motivated the Panchayats to impose a voluntary lockdown of their villages.”

Kharar Station House Officer (SHO) Bhagwant Singh proactively carried out the tracking and tracing of suspect coronavirus cases. Similarly, SBS Nagar SI Neeraj Chaudhary took the risk of visiting isolated corona patients to trace the contacts where the patients refused to cooperate with the epidemiologist and other doctors.

Pathankot SI Shohrat Mann is doing commendable work for the welfare of the people of Pathankot by providing food to the poor and the downtrodden. Fatehgarh Sahib SI Shakunt Chaudhary has also done commendable work as in-charge of a critical Naka point, said the DGP, giving details of the work done by some of the awardees.",state-editions,https://www.dailypioneer.com/images/logo.jpg,https://www.dailypioneer.com/2020/state-editions/25-punjab-cops-selected-for----dgp-honour-for-exemplary-sewa-to-society---.html
69,16-4-20,MCD completes sanitisation of all 100 wards,"On the second day of its special sanitisation drive, the Municipal Corporation of Dehradun (MCD) sterilised 50 wards using over three lakh litre of disinfectant solution.

Earlier, on Tuesday, the MCD had sanitised 50 wards on Tuesday as a measure to prevent the spread of novel Coronavirus (COVID-19) in the city, the municipal corporation sanitised the remaining wards of the city on Wednesday.

The remaining 50 wards were divided into four zones and four nodal officers were appointed for each zone by municipal commissioner Vinay Shankar Pandey.

Using 40 spray machines and 60 tanks, the sanitation workers sprayed around 3.30 lakh litre of one percent hypochlorite solution in all the areas of remaining wards.

The work of sanitising the city was also inspected by Dehradun mayor Sunil Uniyal 'Gama' and the municipal commissioner.

In the past too, during the initial days of the lockdown the MCD had undertaken a three-day sanitation drive in which it sterilised all the wards of the city using more than two lakh litre of disinfectant solution.

According to deputy municipal commissioner Rohitash Sharma, the special sanitisation drive was undertaken as a precautionary measure in order to reduce the risk of the community spread of the novel coronavirus in Dehradun.

He said that such drives will be undertaken in the future too by the corporation.

Besides, the mayor also appealed people to remain indoors during the lockdown and advised them to contact the helpline numbers issued by the administration in case of emergencies.",state-editions,https://www.dailypioneer.com/images/logo.jpg,https://www.dailypioneer.com/2020/state-editions/mcd-completes-sanitisation-of-all-100-wards.html
70,16-4-20,Cong demands return of stranded U’khandis,"After the extension of the country wide lockdown by the Prime Minister Narendra Modi till May 3, the Uttarakhand unit of Congress party has intensified pressure on the State Government to make arrangement for return of Uttarakhandis stranded in other States.

Thousands of residents of the Uttarakhand working in other states are stranded and their hopes of return to homes got shattered when the Government extended the lockdown to control the spread of novel Coronavirus (COVID-19).

The Pradesh Congress Committee (PCC) Pritam Singh said that the State Government should make arrangements for return of these people of the State. “I appeal to the Chief Minister of State to show same empathy in ensuring return of people of state stranded in other areas and sending back the people of other states stuck here as shown in sending the stranded Gujarati’s back,’’ he said.

The Vice President of Uttarakhand Congress, Jot Singh Bisht said that the system which the State Government has set in place for return of Uttarakhandis stranded elsewhere has proved to be failure. “The officials concerned are either not picking up phones or are giving false assurances to the callers. The State

Government should prepare a plan for return of these stranded people of the State in a phased manner,’’ he said.

Bisht added that many of the stranded don’t have money to pay the rents of the houses they are living and are facing crisis of food also.

In a letter written to chief minister Trivendra Singh Rawat, Congress leader Manish Khanduri said that most of the youth of the State work in industrial areas or hotels and due to prevailing lockdown they have become unemployed.

He said that these people were somehow managing till April 14 but the extension of lockdown has brought them in a crisis.

Khanduri said that the State Government should make arrangement for return of these people.",state-editions,https://www.dailypioneer.com/images/logo.jpg,https://www.dailypioneer.com/2020/state-editions/cong-demands-return-of-stranded-u---khandis.html
