,Date,Title,Article,Category,Image_link,Article_link
125,16-4-20,"WB: 17 new infections, total tally reaches 132","Bengal Chief Minister Mamata Banerjee on Wednesday announced a partial protocol-based opening of economic activities even as the State’s active corona cases went up to 132 with 17 new infections reported in the past one day.

Apart from allowing partial economic activities the Chief Minister also announced that the remaining three examinations of the State’s Higher Secondary (Class – XII) course will be conducted in the month of June when the State educational institutions will open as per an earlier announcement.

The Plus-2 board examinations had to be postponed mid-way following the announcement of the first phase of all India lockdown last month.

The students of the undergraduate and post graduate courses in all the colleges will be promoted to the next semester save those in the respective final semesters, Banerjee said adding the ""final smester students will have to appear for their examinations.""

“The students of Class XI will be promoted to Class XII and the remaining papers of the Class XII higher secondary examinations will be held in the month of June,” Banerjee said adding students of all the classes of undergraduate and post graduate courses --- “from 1st year, 2nd year 3rd year etc” --- will “move a semester ahead save those who are in the final semester whose examinations will be conducted” after the lockdown ends. However, there was no clarification from the Education Department on whether the college semester examinations would be clubbed with other semesters at later dates or whether the students will be promoted to next semesters without having to appear

for the relevant papers at all like the students of

Class XI. In the commercial sector the Chief Minister announced significant relaxation of activities based however on protocol and guidelines offered by the central government. Among the areas that will start limited functioning are agriculture, tea packaging, irrigation, road and building construction, ware-housing and industries in the rural areas.

The Chief Minister said, “tea-packaging, irrigation, road and building construction will start working with 25 percent workers taken at local level,” warning “strictly wearing of masks and social distancing will have to be followed.”

Apart from this Banerjee also said that the jute industry will be allowed to function in a limited capacity. A labour intensive affair the jute mills will start with 15 percent work force only the Chief Minister said adding the mill owners will have to take necessary clearances from the Chief Secretary for the purpose.

Elsewhere, 46 medical staff including doctors of Asia’s oldest Calcutta Medical College and Calcutta National Medical College were sent to mandatory quarantine following reports of corona infections in the stated medical colleges, sources said. The medical staff were quarantined following one death and two reports of infection, sources said.

Meanwhile even as the State Government ordered wearing of masks mandatory making certain areas out of bounds for the “outsiders” Bengal reported 17 new corona cases in the past 24 hours taking the total number of active cases to 132.

“There were 120 active cases till April 14 which went up to 137 as there were 17 new cases of infections reported,” Chief Secretary Rajiva Sinha said adding “the total number of active cases now stand at 132 with five patients being cured and discharged.” In total, Bengal had tested about 3,470 cases he maintained. Notwithstanding the Government’s claims opposition BJP charged the ruling Trinamool Congress with hiding facts about the real number of deaths and infections besides alleging large-scale bungling over distribution of relief materials.

Senior party leader Sayantan Basu said “despite the Government’s claims we still can see that there is a difference of at least 18 cases … which means the Government is not showing these cases as corona positive.”

He also alleged that the “TMC workers have been given to distribute the relief materials in many areas leading to large scale bungling… they are stealing rice, flour, sugar from the total stocks and the people are suffering as a result.”",india,https://www.dailypioneer.com/images/logo.jpg,https://www.dailypioneer.com/2020/india/wb--17-new-infections--total-tally-reaches-132.html
126,16-4-20,Man carries aged father on shoulders after police refuse vehicle to pass,"A man travelling by an autorickshaw in Punalur, about 90 km from the state capital, to get his aged father back from a hospital had to carry him on his shoulders after the police did not allow the vehicle to pass in the wake of lockdown called to contain coronavirus.

The incident picked up by TV channels showed the police stopping the vehicle and the man explaining his situation.

The police later said the person was stopped to explain why he was roaming around in view of restrictions on movement of people following lockdown. ""The person could not show any paper about the medical condition of his father,"" said the police.

The man was later shown carrying his aged father on his shoulders.

The police have promised to look into the matter.",india,https://www.dailypioneer.com/images/logo.jpg,https://www.dailypioneer.com/2020/india/man-carries-aged-father-on-shoulders-after-police-refuse-vehicle-to-pass.html
127,16-4-20,"With 2 more doctors infected, concerns over quality of PPE","With two more doctors testing positive in Jammu region on Wednesday question marks have been raised on the availability of good quality personal protection equipment (PPE) and standard guidelines being followed while handling suspected covid-19 cases across health care centres in Jammu & Kashmir.

The list of positive cases among doctors has gone up to six in Jammu region only. On the other hand, the total tally of Covid-19 patients in Jammu & Kashmir reached 300 as 22 more people tested positive for coronavirus in the Union territory on Wednesday.

“As many as 22 persons have tested positive today. Out of these, 18 belong to Kashmir and four to Jammu division,” Government spokesman Rohit Kansal tweeted.

He said the total number of cases in Kashmir stood at 246 now while Jammu division had 54 cases so far.

So far, a senior doctor of the Microbiology department, Government Medical College hospital,has recovered and discharged from the hospital while his wife and four others are currently in isolation.

Their contact persons have been quarantined and some of the samples of closed relatives have tested negative.

Meanwhile, among the four fresh cases from Jammu, one of the patient is a close relative of doctor already discharged from the hospital and another one is a PG student of GMC Jammu. He reportedly came in contact with a Covid-19 positive woman, from Tikri area of Udhampur,in GMC and later died on April 9. Two doctors and one of their staff members from a private hospital, too came in contact with a patient, who was suffering from liver ailment and later tested positive and shifted to GMC.

Health care services were also suspended in one of the private hospitals in Jammu. The routine surgeries have been postponed to carry out decontamination and sanitisation work on ground zero and hospital staff has also been quarantined in the hospital premises.

In other related development, a microbiology laboratory at SMGS hospital in Jammu was burnt completely in a mysterious fire late Tuesday night.

The hospital authorities have decided to carry out investigations in the GMC, hospital to avoid any inconvenience to patients admitted in the Gynaecology department.",india,https://www.dailypioneer.com/images/logo.jpg,https://www.dailypioneer.com/2020/india/with-2-more-doctors-infected--concerns-over-quality-of-ppe.html
128,16-4-20,Two persons die in Tamil Nadu drinking methanol,"Not responding to treatment two more persons lost their lives on Wednesday in Cuddalore district after they consumed methanol, as the liquor shops are closed due to Covid-19 lockdown, said police.

Five persons in Cuddalore district consumed methanol on Monday night and were hospitalised the next day as they turned critical.

Not responding to treatment one person died on Tuesday. With two more persons dying on Wednesday the death toll has gone up to three.",india,https://www.dailypioneer.com/images/logo.jpg,https://www.dailypioneer.com/2020/india/two-persons-die-in-tamil-nadu-drinking-methanol.html
129,16-4-20,Aarogya Setu becomes world fastest app: Niti,"Government’s mobile app Aarogya Setu, developed for tracking coronavirus patients, has become the world’s fastest app to reach 5 crore downloads in just 13 days, Niti Aayog CEO Amitabh Kant said on Wednesday.

Prime Minister Narendra Modi in his address to the nation on April 14 appealed to people to download the app.

“Telephone took 75 years to reach 50 million users, radio 38 yrs, television 13 yrs, Internet 4 yrs, Facebook 19 months, Pokemon Go 19 days. AarogyaSetu, India’’s app to fight COVID-19 has reached 50 mn users in just 13 days-fastest ever globally for an App,” Kant said in his tweet.

The death toll due to coronavirus rose to 377 while the number of cases in the country climbed to 11,439.

Aarogya Setu app alerts people if any known or person in their vicinity has tested positive.

District administration has been asking all educational institutions, departments etc to push downloading of the app.

The app was developed under a committee set up by the Prime Minister’s Office with active involvement of Niti Aayg and Ministry of Electronics and IT.

According to sources, Tata Consultancy Services is working on testing and some of the other aspects while Tech Mahindra and the Mahindra group is working with the committee on the next version of this application and leveraging next generation technologies like AI, machine learning, data science.

Tech Mahindra is also working on expanding the reach of Aarogya Setu on all types of phones. The current version of Aarogya Setu app is fit for use on smartphones only.",india,https://www.dailypioneer.com/images/logo.jpg,https://www.dailypioneer.com/2020/india/aarogya-setu-becomes-world-fastest-app--niti.html
130,16-4-20,BJP blames Sena-led Govt,"Terming the gathering of migrant workers as a very serious incident, senior BJP leader and former Chief Minister Devendra Fadnavis retorted saying it was the responsibility of the State to arrange for food and shelter for the workers.

“It is unfortunate that the Centre is being blamed in such a situation to escape. The fight against coronavirus is not political, please note this at least now. It is my earnest request that we fight this battle seriously,” he said.

Another BJP leader Kirit Somaiya slammed the Shiv Sena-led MVA Government for failing in preventing the gathering.

He described the incident as an intelligence failure. “Will Thackeray Sarkar explain how thousand people gathered at Bandra (West) near Station? What was Intelligence doing? From where do these people come? How suddenly do they gather there in spite of 144? Since lockdown never Police allow more than 4 people allowed, then How & Why today?” he tweeted.",india,https://www.dailypioneer.com/images/logo.jpg,https://www.dailypioneer.com/2020/india/bjp-blames-sena-led-govt.html
131,16-4-20,Ensure implementation of lockdown rules: Cabinet Secy,"Cabinet Secretary Rajiv Gauba on Wednesday interacted with all State Chief Secretaries and Directors General of Police on the smooth implementation of the revised lockdown guidelines issued by the Union Home Ministry.

“Government of India has asked all States and Union Territories to continue implementing lockdown restrictions strictly for the extended period till May 3, 2020 as announced by Prime Minister Narendra Modi as an effort to contain the spread of COVID-19 in the country. The Government has decided to provide some relaxations after April 20 in places, where there are no hotspots, said the Government in a statement.

Principal Secretary to the Prime Minister PK Mishra, Union Home Secretary Ajay Kumar Bhalla and Union Health Secretary Preeti Sudan were also present in the video conference.

The Cabinet Secretary asked the Chief Secretaries to closely monitor the situation on a daily basis and also in the notification of hotspots on April 20. Gauba asked the States and Union Territories to adopt a strategic approach in the containment zones to contain the Covid-19 pandemic within a defined area by making it a no movement zone, early detecting of cases, breaking the chain of transmission and thus preventing its spread to new areas, said the statement.

He stressed for passing on clear instructions to the District and Tehsil authorities to the field functionaries to ensure the implementation of lockdown restrictions on ground and allowing only those activities which are notified by the Government under NDMA Act time to time. Chief Secretaries and DGPs need to convene meetings with district level authorities to strictly follow the lockdown directions in letter and spirit, the Cabinet Secretary added.",india,https://www.dailypioneer.com/images/logo.jpg,https://www.dailypioneer.com/2020/india/ensure-implementation-of-lockdown-rules--cabinet-secy.html
132,16-4-20,No relief for tipplers as sale of liquor banned,"This is not a good news for tipplers. The Centre on Wednesday banned the sale of alcohol and tobacco during the next phase of the lockdown to contain the coronavirus outbreak. The Centre’s guidelines came even as states like Kerala, Tamil Nadu, Maharashtra, Uttar Pradesh and Punjab were mulling opening liquor stores, which have a major contribution to the

State economy.

Ahead of the extension, states like Assam had allowed the sale of alcohol while those like Meghalaya had set up a provision to ensure home delivery of the spirit so that social distancing norms are not violated.

After the fresh guidelines on Wednesday, Assam and Meghalaya have withdrew their order to open liquor shops.

Kerala had earlier allowed addicts to buy alcohol if they produce a doctor’s prescription but the Kerala High Court stayed the government order and the Indian Medical Association too had objected to it.

According to a fresh set of guidelines issued by the union home ministry, there should be a strict ban on sale of liquor, gutka and tobacco. The restrictions for public spaces also include a ban on spitting in public and the organisation of gatherings. The directives shall be enforced by the District Magistrate through fines and penal action under the Disaster Management Act 2005.

In the first phase of the lockdown, states had refrained from operating liquor stores to ensure social distancing norms are followed.

Many are turning to illegal liquor, say customs and police officials, who have seen a marked increase in seizures of hooch, which has in the past claimed thousands of lives among the poor unable to afford branded booze.

According to Google Trends, online searches for “how to make alcohol at home” peaked in India during the week of March 22-28, the same week Prime Minister Narendra Modi imposed the nationwide lockdown.

The liquor industry contributes about Rs 2 lakh crore a year to state governments by way of excise duty and in some states as value added tax, said an industry insider. Bulk of their tax outgo goes to state governments as liquor is a state subject. The liquor industry sustains livelihood of nearly 40 lakh farmers, and employs nearly 20 lakh people directly and indirectly.The central government’s indirect taxation of the industry is mostly limited to customs duty on import of concentrate.

“Excise duty on liquor is among the major revenue streams to state governments similar to GST on goods and services and excise duty on petrol and diesel. Kerala generates highest revenue from liquor sale every year,” said an official of the central excise department. The states that depend heavily on liquor for tax revenue are Tamil Nadu, Maharashtra, Uttar Pradesh, Punjab and Delhi.

The International Spirits & Wine Association of India (ISWAI), which represents India’s largest liquor makers, told the consumer affairs ministry that the suspension of alcohol sales is only helping the illegal trade.",india,https://www.dailypioneer.com/images/logo.jpg,https://www.dailypioneer.com/2020/india/no-relief-for-tipplers-as-sale-of-liquor-banned.html
133,16-4-20,Centre amends green rule for drug production,"After its move to grant “out of turn” clearances to bulk drug projects against the backdrop of surging Covid-19 cases, the Centre has gone a step further to ramp up the availability of drugs by making an amendment to Environment Impact Assessment (EIA) Notification 2006.

“All projects or activities in respect of bulk drugs and intermediates, manufactured for addressing various ailments, have been re-categorised from the existing Category ‘A’ to ‘B2’ category. Projects falling under Category B2 are exempted from requirement of collection of Base line data, EIA Studies and public consultation,” the Ministry of Environment, Forest and Climate Change said in a statement.

The move is aimed at addressing the unprecedented situation arising from global outbreak of COVID-19. Within two weeks, more than 100 proposals have been received under this category, which are at different levels of decision making by the concerned regulatory authorities in the states.

“The re-categorization of such proposals has been done to facilitate decentralization of appraisal to State Level so as to fast track the process. This step is with a view to help in increasing the availability of the important medicines/ drugs in the country within short span of time. This amendment is applicable to all proposals received up to 30th September 2020. The states have also been issued advisories to expeditiously process such proposals.

“Further, to ensure expeditious disposal of the proposals within given time-line, Ministry has also advised states to use information technology e.g. video conference, considering the fact that in view of the prevailing situation on ground, appraisal of proposals may not be possible through physical meetings, the MoEF stated.

Earlier, the Centre had decided to expedite clearances to bulk drug projects by considering them ‘out of turn’ ensure overall preparedness and availability of drugs to reduce the impact of the outbreak.",india,https://www.dailypioneer.com/images/logo.jpg,https://www.dailypioneer.com/2020/india/centre-amends-green-rule-for-drug-production.html
134,16-4-20,Army cautions personnel on use of Aarogya Sethu app,"Keen to keep its personnel abreast with all developments regarding fight against coronavirus pandemic and save themselves, the Army has asked all serving ranks to install and use “Aarogya Setu” app of the Government for the duration of Covid-19 situation with due precautions while also advising veterans and their families also to use the App.

Giving this information here on Wednesday, Army sources also said “existing cyber security policies on usage of mobile phones to be adhered to by Army personnel while using the App,” while listing out several precautions. Service personnel are advised not to use the App in office premises, operational areas and sensitive locations. These directives come in the backdrop of some services personnel including the army and navy falling prey to Pakistan based spy rings who breached the smartphones of these personnel and extracted information.

“Personnel are not to disclose service identity including rank, appointment. Contact list of user should not contain any reference to rank, appointment or service,” they said.",india,https://www.dailypioneer.com/images/logo.jpg,https://www.dailypioneer.com/2020/india/army-cautions-personnel-on-use-of-aarogya-sethu-app.html
135,16-4-20,Govt staffers to resume office from April 20,"Almost the entire Government staff will be able to work from their respective offices from April 20.

As per the MHA’s consolidated guidelines released on Wednesday, all deputy secretaries and above level officers will resume work in their offices after having been confined to work from home for almost a month now due to the lockdown imposed to check the spread of coronavirus.

Earlier this week, all the Union Ministers and the joint secretaries of the Central Government and above level officers had joined their respective departments, a day before Prime Minister Narendra Modi announced an extended lockdown.

“Remaining officers and staff to attend up to 33 per cent as per requirement,” the guidelines for the lockdown issued by the Home Ministry maintained further.

All the Ministries and departments, and offices under their control are to function with 100 per cent attendance of Deputy Secretary and levels above that, it said.

Besides, defence, central armed police forces, health and family welfare, disaster management and early warning agencies, national informatics centre, food corporation of India, NCC, Nehru yuva kendras and customs to function without any restrictions, the guidelines said.

With respect to offices of the state and union territories, the Home Ministry said district administrations and treasury (including field offices of the accountant general) will function with restricted staff.

“However, delivery of public services shall be ensured, and necessary staff will be deployed for such states,” it said.

All other departments of state and UT Governments will work with restricted staff, it added.

“Group A and B officers may attend as required. Group C and levels below that may attend up to 33 per cent of strength, as per requirement to ensure social distancing,” the guidelines issued by the ministry said.

Police, home guards, civil defence, fire and emergency services, disaster management, prisons and municipal services will function without any restrictions, it said.",india,https://www.dailypioneer.com/images/logo.jpg,https://www.dailypioneer.com/2020/india/govt-staffers-to-resume-office-from-april-20.html
136,16-4-20,Win cash prizes by taking part in CRPF Covid-19 poster challenge for students,"As part of a CRPF-community collaboration initiative, the paramilitary has launched a pan-India poster challenge for school students to counter Covid-19 and stay safe amid the lockdown.

The Central Reserve Police Force (CRPF), the world’s biggest paramilitary, announced the “COVID Poster Challenge” contest for school students to enhance public awareness about the pandemic.

The Covid Poster Challenge is open for students in three categories— Class I-V (Theme: Stay Safe), Class VI-X (Theme: Life during Covid) and Class XI-XII (Theme: India Fights Together).

The poster challenge will have cash prizes Rs 50,000, Rs 40,000 and Rs 25,000 for the first, second and third category respectively. In addition, there will 10 motivational prizes with selected participant to get Rs 5,000 and the last date of entry is April 25.

The posters can be a hand painting/ drawing/ sketch accompanied by slogan/ message relevant to fight against COVID-19. If a poster is selected the copyrights will remain with CRPF. A student will post the poster with his name and class. Parents/ School are allowed to post the posters made by their wards/ students as the wards may not have twitter account due to age limit. The tweet with the poster should mention and tag @crpfindia. The twitter handles that send the winning posters will be contacted later by CRPF for information to disburse the prize money. Original copy of the handmade poster may be called by post at a later stage. The winner will have the option to redeem the prize amount by using it on an adventure trip, summer camp, books, electronic gadgets, stationery items, sports goods etc. or a combination of these. The decision of the jury will be final. No representation will be entertained at any stage. The winner shall be contracted by nearest CRPF establishment within 24 hours of the announcement.",india,https://www.dailypioneer.com/images/logo.jpg,https://www.dailypioneer.com/2020/india/win-cash-prizes-by-taking-part-in-crpf-covid-19-poster-challenge-for-students.html
