,Date,Title,Article,Category,Image_link,Article_link
0,01-2-20,Can invisible hand work?,"Seen from an economist’s perspective, the Economic Survey looks eloquent. But execution could run into a logjam as politicians are prone to controlling the consumer

The Economic Survey for 2019-20 has been prepared by the Chief Economic Advisor, Dr K Subramanian, keeping the ambitious target of achieving the $ 5 trillion economy status by 2024-25, set by Prime Minister Narendra Modi, at its centre. The rigorous analysis (a lot of it involves running of “regression equations” — a euphemism in econometric analysis to bring out correlation between various economic parameters) done by the CEA has to be seen in the backdrop of deceleration in the GDP (gross domestic product) growth to its 11-year-low of five per cent during the current year (first advance estimate) and the dire need to resurrect it without losing much time. Indeed, he projects the growth for 2020-21 at 6.5 per cent (pertinently, this is significantly higher than the projection of the International Monetary Fund [IMF] at 5.5 per cent).

In sync with this pretty ambitious rebound and keeping the economy on a high growth trajectory for the next four years, the dominant focus of the survey is on “wealth creation” with better distribution, which in a way also reflects Modi’s assertion time and again that “unless wealth is created, it won’t get distributed.” These prognostications though need to consider a piece of research released by rights group Oxfam ahead of the just concluded 50th Annual Meeting of the World Economic Forum in Davos, Switzerland. According to the study, India’s richest one per cent holds more than four-times the wealth held by 953 million people who make up for the bottom 70 per cent of the country’s population. Further, the combined total wealth of 63 Indian billionaires is higher than the total Union Budget of India for the fiscal year 2018-19 (Rs 24,42,200 crore). Between 2014-15 and 2018-19, the average growth in GDP was about 7.5 per cent, which demonstrates that wealth was generated at a fast pace but its distribution was highly inequitable. So, by restoring growth to a higher level 2020-21 onward won’t assure better distribution.

The survey gives an indication of decline in growth having already bottomed out (during the second quarter, it was 4.5 per cent) and that during the second half, the pick-up is anticipated in view of increase in FDI, building demand pressure and increase in GST (Goods and Services Tax) collections. The reference here may be to GST collection during November/December, 2019 crossing Rs 100,000 crore each (this is likely to touch Rs 115,000 crore). But this is more due to intensified efforts to rein in tax evasion, increasing compliance and checking fraudulent claims of input tax credit (ITC) rather than being indicative of any significant revival in economic activity.

In any case, in view of the survey itself talking of five per cent growth for the whole year, it is abundantly clear that there is not going to be any dramatic turnaround during the second half.

To see resurrection of growth during 2020-21, Dr Subramanian has alluded to the need for deviating from the fiscal deficit target of three per cent set by the Modi government for the year. This in itself is a substantial slippage from the three per cent glide path recommended by the Dr NK Singh committee on review of the Fiscal Responsibility and Budget Management (FRBM) Act to be achieved by 2018-19. Any reference to the three per cent benchmark is laughable when seen in the backdrop of the current year (2019-20), which is expected to end with a slippage to at least four per cent (against a target of 3.3 per cent), that too when off-budget liabilities and extra-budgetary resources (EBRs) are not included. If EBRs are included (there are some reports pointing to the Finance Minister’s intent to making these transparent in this budget), then the year may end up with a deficit close to six per cent.

Therefore, for boosting demand and investment (these are the two overarching constraints on growth), to expect the government to achieve this merely by deviating from the so-called prudential fiscal norms (read FRBM) is tantamount to “missing the wood for the trees.” Here, it may be pertinent to recap that already, through a number of mini-budgets presented by the Finance Minister (a spate of policy announcements and support measures made during August/September 2019 subsequent to the main budget presented in July 2019), the Government had already injected a number of demand boosters.

Indeed, a number of those measures had meant huge loss of revenue. For instance, the steep reduction in the corporate tax (from 30 per cent to 22 per cent for existing firms and from 25 per cent to 15 per cent for new companies to be set up after October 1, 2019) meant a loss of about Rs 1,45,000 crore; even after considering many firms not availing of the lower rates, the actual is still high at about Rs 1,00,000 crore. Taking into account other sops like tax refund to exporters, special dispensation for real estate sector, support to housing finance companies and so on, the total support would work out to well above Rs 2,50,000 crore.

As stated by the Prime Minister ad infinitum, the survey, too, reiterates the dire need for a whopping investment of Rs 100 lakh crore in infrastructure over the next five years. This is to be funded by 39 per cent contribution from the Union Government and States each and 22 per cent by the private sector. This will translate to Rs 8 lakh crore annually by the Centre and State each. For the Centre, this amount is even higher than its budget fiscal deficit [or total borrowings] for the current year. Likewise for the States, the numbers look theoretical to say the least. The official think tank will really have to look for innovative ways, including much greater participation of private sector (foreign investment included) of financing the mammoth investment in infrastructure. It is not as if the task is not doable. This requires a complete overhauling of the Indian banking sector as also the non-bank finance companies (NBFCs). In this context, the CEA needs to be commended for undertaking a comprehensive analysis of the reforms undertaken in the banking sector since 2015-16, viz cleaning up of the balance sheets of public sector banks (PSBs), the Insolvency and Bankruptcy Code (IBC) and its use for recovery of NPAs (non-performing assets), improvement in the quality of lending and so on.

He has visibly demonstrated as to how indiscriminate lending during 2008-2013 negatively affected investment and increase in the quality of lending from 2014 onward will positively impact investment and growth. But one wonders whether the “bad loan” syndrome has really bottomed out or more skeletons are yet to come out. The NBFC crisis in particular raises serious concern, especially when one looks at two behemoths in this segment, the Infrastructure Leasing and Financial Services (IL&FS) and Dewan Housing and Finance Company (DFCL) going bust. Considering that a sizeable chunk of the funds has reportedly been siphoned off by dubious promoters/management, the concern only gets aggravated.

With the government now being forced to consider and sanction special dispensation/packages even for NBFC (as the stakeholders consider their revival as crucial to revival of credit flows, investment and demand), one wonders we may not be landing in a situation of the exchequer pouring water (read funds) in a bottomless pit. One can only hope that we don’t see more cases of willful default or misappropriation of funds or else any revival attempt using tax payers money is bound to fail.

The survey rightly emphasises the need for expediting reforms particularly in the area of banking (the recommendation for reducing the government’s shareholding below the majority mark is pending for long), land acquisition, enforcement of contracts, elimination of bureaucratic red-tape, removing bottlenecks in transportation and clearances at the ports (this is particularly relevant for boosting exports) and so on as these major bottlenecks come in the way of ease of doing business and attracting investment. It has also guarded the Government against too much of intervention and micro-management of activities (including implementation of welfare schemes) which, if left to the market forces, would deliver much better results. Dr Subramanian has aptly articulated the role of what he euphemistically describes as the role of “invisible hand” juxtaposed with “public trust” in stimulating wealth creation.

Both are crucial pillars in galvanising Indian economy on to a high growth trajectory, yielding better distribution effects. Seen from an economist’s perspective, this looks eloquent. But, when it comes to execution which has to be done by the political class, one gets into a logjam as it is prone to controlling most of the things; in fact, almost all of the essential items in the consumer’s basket.

(The writer is a New Delhi-based policy analyst)",columnists,https://www.dailypioneer.com/uploads/2020/story/images/big/can-invisible-hand-work--2020-02-01.jpg,https://www.dailypioneer.com/2020/columnists/can-invisible-hand-work-.html
1,01-2-20,"Iran’s loss, ISIS’ gain","The terror group stands to gain much from the assassination of Iranian General Soleimani, who was the face of armed resistance against it in Iraq and Syria

Not very long ago, December 2017 to be precise, the world was celebrating the defeat of the Islamic State (ISIS), the deadly face of terror that had compelled the world powers with differing strategic interests to come together to defeat it and along with it the idea of a medieval Islamic Caliphate. The ISIS had succeeded in recreating it by capturing swathes of territory in Iraq and Syria, including oil fields, refineries and mine fields of strategic minerals.

The aura of the ISIS was such that it not only attracted thousands of jihadists from different parts of the world, including Europe, but also dared to challenge the might of the United States (US) by executing and beheading American citizens. The menace of ISIS grew so fast and rapidly that the entire world was unanimous in countering the threat posed by it. Qaseem Soleimani, an Iranian General, was the face of armed resistance against the ISIS in Iraq and Syria along with the USA, Russia, Turkey and its European allies. Soleimani contributed in a big way in the defeat of the ISIS. The US and Iran, adversaries in the Middle East, identified a common enemy in the ISIS and effectively fought together against it to eliminate the terror group’s de facto state in Iraq and Syria. However, realpolitik soon overtook the strategic convergence of interests with Iran and the US almost at the verge of a war with a renewed Middle East crisis.

The ongoing US-Iran crisis reached the peak last month with US President Trump authorising the killing of General Qaseem Soleimani, the head of Iran’s Islamic Revolutionary Guard’s elite Quds Force and an American ally in the fight against ISIS while he was on a visit to Iraq. This raised the tensions between the US and Iran to a new level with the future of the US forces in Iraq in the doldrums.

It also let loose many Shia militias which Soleimani had carefully raised and groomed to counter and challenge the ISIS. Their focus all of a sudden shifted from combatting ISIS to their newly-emerged enemy, the US assets and troops in the Middle East. Under the threat of Iranian retaliation, even the focus of Americans and others has been diverted from the ISIS and other radical Islamist jihadi terror groups for the time being. If at all there was a clear winner of the ongoing US-Iran conflict, it was undoubtedly the terror organisation. It has provided the ISIS with the much-needed oxygen as well as time and space to reorganise and regroup.

As a result, the US and its allies now face the dual threat of Shia militias and the Sunni radical Islamist jihadi terror groups led by the ISIS. The fall of Soleimani has provided them a new opening. The growing demand of ejecting US forces from Iraq has further complicated the security scenario in the region and in the process hurt the efforts to counter ISIS which have suffered a serious blow.

My assessment when Iraq’s Prime Minister declared a final victory over Islamic State in December 2017 was that the “ISIS may have been defeated but it was not destroyed. It may have been disseminated but was not dissolved.”

According to Goldenberg, an American diplomat who had served as Special Advisor in the Middle East between 2009-12, “The ISIS retains an underground presence and could take advantage of the chaos of an American withdrawal or a US-Iranian conflict to improve its position in Iraq.”

The assessments are seeming to be proving true with increased frequencies of terror attacks by the ISIS after the elimination of General Soleimani. The upheaval created by his killing has given rise to such conditions in Iraq that the ISIS is ever-willing to exploit.

The weakening of the Shia militias as a consequence to absence of Soleimani’s charisma as well as sterling leadership qualities will definitely weaken the Iraqi Government which would create a space for the ISIS and other Sunni terror groups to stage a comeback in the region.

Moreover, the US focus shifting towards defending its bases in Iraq and the security of green zone, will allow the terror group to manoeuvre more freely. The ISIS fighters, who had dispersed and gone underground are now rebuilding and re-emerging fully recuperated as a potent threat in form of insurgency, Improvised Explosive Devices, bombings, targetted killings suicide attacks, sniper attacks and lone wolf attacks. It is too early to assess if they would continue with this tactics or attempt once again to establish an Islamic Caliphate.

The US is trying to put up a brave front by denying any surge in the activities of the terrorist organisation due to its own activities. It is also obstinately claiming that most of the recent attacks by the group may have been planned well before the killing of Soleimani (because of the time and resources required to plan and execute such operations, more so when the ISIS is suffering from a unified command crisis and dispersion of its fighters). But the fact remains that with a divided focus it has become increasingly difficult for the US to contain the terror group.

The flare-up in the US-Iran crisis has certainly provided opportunity to Abu Ibrahim al Qurayshi — the newly- appointed successor of the assassinated long-time ISIS leader Abu Bakr al Baghdadi — to strengthen his grip and revitalise the terror outfit to intensify its attacks in the region.

Under Qurayshi’s leadership, the group may also attempt to regain lost territories in Syria and Iraq depending on the resistance it faces, as this would give the new chief an opportunity to establish his hold more firmly over the group and prove his mettle.

The ISIS attacks on US-backed Kurdish-led Syrian Democratic Forces have also intensified during the last month. The group is also trying to restore and rejuvenate its social media wing, its main source of funding and recruitment. Disturbingly, the terrorist group’s propaganda sites are on the rise on various social media platforms and apps.

The re-emergence of ISIS would have a definite impact on the Afghanistan-Pakistan region (Af-Pak region) with its consequential fallout for India and regional peace and stability in South Asia.

Soleimani’s successor, Brigadier General Ismail Qaani, is an old hand at fomenting trouble in Afghanistan and Pakistan. Solemani himself had played an active role in Afghanistan by cooperating with the Northern Alliance to fight the growing might of the Taliban. In a later turn of events after the American invasion of Afghanistan, Iran courted Taliban to fight the Americans and other Western troops in Afghanistan. General Qaani, who till as late as 2018 was the Iranian deputy Ambassador to Afghanistan, was instrumental in managing Iran’s Afghan policy.

Pakistan has also been accused of cross-border terror in Sistan- Baluchistan by Iran. Tehran is opposed to the rise of any Sunni-fundamentalist regime on its eastern border and with Pakistan now assisting the US to forge a deal with the Taliban, Iran has further been angered.

Shia-Sunni violence in Pakistan and persecution of Shias remains a constant point of friction between Iran and Pakistan. Thus a US-Iran conflict may have an impact in the situation in Afghanistan with Iran turning a blind eye to the rise of ISIS in the Af-Pak region as a complimentary threat to the US. In the process, Iran will try its best to derail the Afghan peace process. While Iran may have its own axe to grind in Afghanistan and sort out Pakistan as well for promoting the American interest in the region, rise of ISIS will have adverse impact on India’s security.

ISIS may well use Pakistan and Bangladesh as launch pads to renew its threat of Ghazwa-e-Hind. India will have to be cautious and watchful and at the same time strengthen its intelligence apparatus to counter the emerging challenges.

(The author is a Jammu-based veteran, political commentator, security and strategic analyst)",columnists,https://www.dailypioneer.com/uploads/2020/story/images/big/iran---s-loss--isis----gain-2020-02-01.jpg,https://www.dailypioneer.com/2020/columnists/iran---s-loss--isis----gain.html
2,01-2-20,Address farm sector woes,"If the Government wishes to grow the economy, then it needs to make an all-out effort to turn agriculture into a profitable business

As India plans to become a $5 trillion economy by 2024, it cannot ignore the importance of the farm sector in helping it achieve this target. This is because we are an agriculture-based economy and more than 50 per cent of the population depends on the agri sector for its livelihood. However, the poor state of the rural economy is an area of concern for everyone and is affecting the country’s fiscal health too. The Government would do well to pay attention to some of the predominant problems hampering the growth of this key sector in its pursuit of the $5 trillion dream.

Subsidise inputs: India is a consumption-driven market and not an export-driven one like China and Singapore. As per the report of the National Statistical Office (NSO), half of the country’s population lives in rural India. Hence, it becomes a critical consumption market for the fertiliser industry, seed industry, tractor producing companies, other items essential for farm production and a host of consumer goods. The Government needs to provide farmers essential inputs on subsidised rates, especially for those growers who have holdings that are smaller than five acres.

Small and marginal farmers’ issues: The Government must focus on the problems plaguing small and marginal farmers. According to a report by the National Bank for Agriculture and Rural Development (NABARD) small and marginal farm holdings generate meagre incomes and result in farmers accruing major debts and then committing suicide due to the inability to pay off those loans. If the Indian economy has to be resurgent, the agriculture sector needs more subsidy and easy agri-credit for small and marginal farmers.

Develop the dairy sector: Dairy farmers can earn as much as 75-85 per cent of the market price by selling the milk produced on their farms to cooperative societies like AMUL and other major milk marketing companies. India also has the largest bovine population in the world. However, the milk production per animal is significantly low as compared to the other major dairy producers of the world. Moreover, nearly all of the dairy produce in India is consumed domestically, with the majority of it being sold as milk. On account of this, the dairy industry holds tremendous potential for value-addition and overall development and the Government must focus on this to better the lot of farmers.

Need to develop vegetable and fruit markets: Indian farmers earn scarcely 10 per cent of the market price for their perishable produces like vegetables and fruits. Since a market is the primary medium for farmers to exchange their produce for money, lack of connectivity to ensure that their harvest reaches buyers in time, results in lowering the farmers’ ability to monetise their produce. The Government needs to plug these gaps and provide farmers a way to get their produce to the markets at the earliest and provide cold storages and freezer trucks, better road and rail connectivity so that the 40 per cent of the produce that is lost now can be saved and this in turn improves the monetary gains of the growers.

Reduce imports: As we all know, agricultural imports cause domestic prices to fall and this directly hurts the farmers. The Government needs to focus on increasing agricultural production in the country and review its policy on bumper production. The Minimum Support Price should be reconsidered for the development of the farm sector as farmers are producers and their interests must also be protected by policymakers, just like that of any citizen of the country.

Need for more agri-NBFCs: Adequate availability of finance is a prerequisite for the growth of any sector and the farm sector is no exception to this rule. However, the difficulties faced by growers in accessing loans when they need them the most have hampered the growth of the sector. Many farmers are either left un-served or underserved due to the lack of timely access to institutional finance via agri-loans. Without access to credit, most farmers with small holdings are restricted to farming, trading, processing practices that result in low levels of productivity. Although various financial institutions have come up and have set shops in rural India, the majority of agri stakeholders still have limited or no access to them. For the inclusive development of agriculture sector, financing is an important element and the Government must focus on developing this on a war footing.

Irrigation facilities: Farmers suffer due to floods in one part of the nation and drought in another area. The Government needs to focus on water management through river linkages and also provide subsidy for water conservation in rural areas for agrarian purposes.

If the Government wishes to stem the crisis plaguing the farm sector and grow the economy, then it needs to make an all-out effort to turn agriculture into a profitable business and make major policy decisions to achieve that goal.

(The writer is Associate Professor of Economics, Faculty of Business Management at the Marwadi University, Rajkot)",columnists,https://www.dailypioneer.com/images/logo.jpg,https://www.dailypioneer.com/2020/columnists/address-farm-sector-woes.html
