,Date,Title,Article,Category,Image_link,Article_link
52,01-2-20,Govt orders guest teachers’ appointment at vacant posts,"After the green signal given by the Supreme Court (SC), the education department has decided to appoint selected candidates as guest teachers on the vacant posts.

These 5034 candidates were selected by the department in the year 2018 but the legal tangles prevented the department to give them appointment.The secretary education, R Meenakshi Sundaram gave the order to the director education for appointment of these candidates waiting for job for almost two years now. In the order the secretary has directed that the orders of the SC dated January 14 should be followed while giving appointment to these teachers.

The SC in its order had allowed the education department to appoint guest teachers on vacant posts till permanent appointment are made. In its orders the SC had clearly said that the appointment of guest teachers should be purely temporary. Sundaram told The Pioneer that the primary concern of the department is to provide teachers to students.

He said that in accordance to the order of SC, the guest teachers appointed in the year 2015 and removed from service on March 2018 should be considered for appointment in the posts which fall vacant in future.

Sundaram said the department has also competed the process of promotion on 1949 posts of Lecturers and Licensed Teachers (LT) but since the issue of promotion is pending in High Court (HC), this list is placed before the court in a sealed envelope.

The issue-

In an attempt to provide teachers on more than 5000 posts the education department initiated the fill these posts by guest teachers since the process of permanent appointments is long.

However some of the former guest teachers challenged the drive in the SC which issued a stay on the appointment of guest teachers. The issue was pending before the SC since then. Last year, the hearing of the case was delayed as the case earlier was listed in the court of then Chief Justice of India (CJI), Ranjan Gogoi.

However the case could not come up for hearing as the constitutional bench of SC consisting of five judges headed CJI was engaged in a day to day hearing of the politically sensitive Ramjanambhoomi- Babri Masjid land dispute case. The case came up for hearing in another bench of SC on January 14 which gave its verdict in favour of government.",state-editions,https://www.dailypioneer.com/images/logo.jpg,https://www.dailypioneer.com/2020/state-editions/govt-orders-guest-teachers----appointment-at-vacant-posts.html
53,01-2-20,NCC growing in popularity in U’khand: CM,"The popularity of and demand for National Cadet Corps (NCC) has increased in the state. Considering this, necessary financial approval was granted for raising a new NCC battalion in Uttarkashi.

The foundation for an NCC Academy will also be laid in the near future. The land for the academy has been identified and financial provision has also been made for this purpose, said the Chief Minister Trivendra Singh Rawat.

He said this while attending a programme held here on Friday for the State’s NCC contingent which returned after participating in the Republic Day camp and parade in the national capital.

Rawat commended the performance of the cadets due to which the State’s contingent had secured the sixth position at the national level. It is due to the hardwork of the cadets that the state achieved the sixth position, making a considerable jump from the 16th to 17th positions generally achieved in the past.

Appreciating the cultural presentation made by the cadets on Republic Day, he said that this goes on to show the all-round development of youngsters facilitated by the NCC. Rawat said, “The demand for NCC has been growing in the state.

Considering this the necessary financial approval was granted for setting up of a new NCC battalion in Uttarkashi. Soon the foundation for an NCC Academy will also be laid in the state. The land for this has been identified and financial provision has also been made.

This academy will be developed on green energy. For this purpose, a 750 metre long lake is being developed at a cost of Rs seven crore near the academy site. In addition to being developed as a model academy, the NCC Academy will also be equipped with latest facilities,” said the chief minister. Earlier, the Chief Minister felicitated the cadets and officers of NCC along with representatives of schools and organisations cooperating with the NCC.

Speaking on the occasion, the NCC ADG major general Sudhil Behel thanked the chief minister and informed that every year about 16,000 new cadets join the NCC. The body has influenced lakhs of people in the state.

He stressed that the NCC doesn’t just prepare the youth for the armed forces but also contributes to their personal development in a manner which takes them towards success in different aspects of life.",state-editions,https://www.dailypioneer.com/images/logo.jpg,https://www.dailypioneer.com/2020/state-editions/ncc-growing-in-popularity-in-u---khand--cm.html
54,01-2-20,National Skiing & Snowboard Championship to be held in Auli on Feb 8-10,"The National Skiing and Snowboard Championship is going to be held at Auli in Chamoli district from February 8 to 10. The Uttarakhand Tourism Development Board (UTDB) is going to organise the national championship with the assistance of the Ski and Snowboard Association of Uttarakhand.

The Garhwal Mandal Vikas Nigam (GMVN) has been made the nodal agency for the event to ensure its successful organisation.

According to the UTDB, the national championship will include slalom and giant slalom for men/women, junior under 21 and junior under 18; giant slalom in under 16 and under 14 categories, snowboard slalom and giant slalom for men and women; snowboard giant slalom for junior under 21 and junior under 18, and cross country for men and women.

The State’s Tourism secretary Dilip Jawalkar said that this event will benefit those involved in business related to skiing. Additionally, the event will also help publicise the adventure tourism destinations in the state at the international level.

According to the Tourism secretary, about 10 teams with a total of 250 players are expected to participate in this national-level championship.The GMVN will look after the boarding and lodging facilities for all participants and guests coming to the event. He also appealed the private hoteliers at Auli to help in making the event successful.Jawalkar further said that Auli has a unique identity across the world as a destination for skiing.

Organising the national level championship here will also generate more sources of income generation for local investors and strengthen the local economy. As part of such efforts, the Uttarakhand adventure summit is slated to be held at Ramnagar from March 20 to 22.

In this event, investors will be invited to invest in skiing, paragliding, rafting and other related activities, added the Tourism secretary.",state-editions,https://www.dailypioneer.com/images/logo.jpg,https://www.dailypioneer.com/2020/state-editions/national-skiing---snowboard-championship-to-be-held-in-auli-on-feb-8-10.html
55,01-2-20,State to hold Adventure Summit in Ramnagar,"On the directions of the Chief Minister Trivendra Singh Rawat, an adventure summit is to be organised at Ramnagar in Nainital district on March 21-22 to capitalise on the considerable opportunities for employment in the tourism sector. The high powered committee formed for operation and guidance under the chief secretary Utpal Kumar Singh met at the secretariat to discuss details of the event here on Friday.

Chairing the meeting, the chief secretary directed the officials concerned to contact the prominent professionals related to adventure tourism in India and abroad, bloggers and investors for the summit.

The officials also deliberated upon possibility of sponsorship for the summit through those involved in the adventure business should also be contacted regarding sponsorship of the summit.

Investors related to the adventure tourism field at the national and international levels, specialists and tour operators related to this sphere are to be invited for the summit.

Singh also directed officials to contact ambassadors of tourism domination nations along with domestic and international tourism companies to invite them to the summit.

The adventure summit will help in generating more employment opportunities in the state. It was also decided in the meeting of the high powered committee that road shows will be held in Rishikesh, Nainital and New Delhi for wider publicity of the adventure summit. Provision will also be made to exhibit equipment related to adventure sports at the exhibition.

The Tourism secretary Dilip Jawalkar informed about the action taken so far regarding the preparation for the summit. Nodal officer for execution of the event, Kumaon Mandal Vikas Nigam (KMVN) managing director Rohit Meena informed the chief secretary about the event venue, knowledge partners and works done till now for the event.

The Tourism additional secretary Sonika, GMVN managing director Eva Ashish Srivastava and Tourism deputy director Vivek Chauhan were also present in the meeting.",state-editions,https://www.dailypioneer.com/images/logo.jpg,https://www.dailypioneer.com/2020/state-editions/state-to-hold-adventure-summit-in-ramnagar.html
56,01-2-20,Second phase of rural polls held peacefully,"The second phase of polling for three-tier Panchayat polls held on Friday was overall peaceful as no untoward incident was reported.

According to the state election commission a total of 1882 polling booths were declared sensitive while highly sensitive polling booths were 742. These were mainly in Bastar division, commission sources said. Polling teams were air-lifted by helicopter in certain polling booths and lifted back after polling.

The second phase of polling for three-tier Panchayat was scheduled in 21 districts of the state covering 36 blocks and 2505 gram Panchayats.

A total of 48,952 candidates were vying for 19870 posts of Panchs. Whereas for 2396 Sarpanch posts there were 10,496 candidates in the fray and for 658 Janpad members post there were 2870 candidates and for 89 posts of Zila Panchayats there were 405 candidates in the race. Thus, for total posts of 23,013 there were 62,723 candidates in the fray.

The total electors in the second phase were 30,56,648 out of which the number of women voters was 15,21,721, men voters 15,34, 894 and third gender 33.

In the second phase a total of 15147 candidates were elected unopposed namely 15026 Panchs, Sarpanch - 101, Janpad members 19 and Zila Panchayat Member 1.",state-editions,https://www.dailypioneer.com/images/logo.jpg,https://www.dailypioneer.com/2020/state-editions/second-phase-of-rural-polls-held-peacefully.html
57,01-2-20,Budget session of C’garh assly to begin from Feb 24,"Budget session of Chhattisgarh state assembly will commence on February 24 and will end on April 1. A notification in this regard was done by assembly secretariat on Friday.

According to information from assembly secretary Chandra Shekhar Gangrade the session would tentatively have 22 sittings and various government works would be undertaken in the session apart from budget session.

However, Chief Minister Bhupesh Baghel, who also holds finance portfolio, already completed pre-budget exercises.

The pre-budget consultations for the budgetary provisions had almost been completed by him with all the departments. Followed by it, the finance department is at present busy finalizing the annual budget.

Meanwhile, the session is expected to be stormy as the treasury bench will also move a resolution against the Citizenship (Amendment) Act (CAA). This issue will certainly be opposed by the main opposition BJP and it will now be busy chalking out its strategy by conducting a series of meeting of the legislators.",state-editions,https://www.dailypioneer.com/images/logo.jpg,https://www.dailypioneer.com/2020/state-editions/budget-session-of-c---garh-assly-to-begin-from-feb-24.html
58,01-2-20,Nursing home surrenders Rs 1.25 crore undisclosed income,"The operator of a private nursing home has surrendered undisclosed income amounting to Rs 1.25 crore following a survey conducted by the income tax department. According to information provided by the department, a survey was conducted in Vaish Nursing Home on Thursday.

Checking the various documents during the survey and conducting questioning, the officials found that the receipts in the nursing home shown in the income tax return were considerably less than the actual receipts.

When the operator of the nursing home, Dr Vipin Vaish was asked to explain this difference, he was reportedly unable to provide a satisfactory answer. Acknowledging the gaps, he surrendered undisclosed income of Rs 1.25 crore which is in addition to his regular commercial income of the current financial year. He has also assured to pay the tax on the said income by March 31 this year. Further, officials checking the documents also found some documents related to the purchase-sale of land-property according to which the payable capital gains tax has not been paid.

He has also assured that this capital gains tax will also be deposited by March 31 this year. The joint income tax commissioner NC Upadhyay informed that the task of checking the documents is continuing and a detailed report is being presented to the senior officers. The survey was conducted under the directions of the chief income tax commissioner, Dehradun, Vipin Bihari Singh and principal income tax commissioner SK Ambashth.",state-editions,https://www.dailypioneer.com/images/logo.jpg,https://www.dailypioneer.com/2020/state-editions/nursing-home-surrenders-rs-1-25-crore-undisclosed-income.html
59,01-2-20,Warm farewell accorded to UJVNL MD Verma,"The Managing Director (MD) of the UJVN Limited, S N Verma superannuated on Friday. A farewell programme was held at the headquarters of UJVN limited the day. The officers and other employees of the organisation garlanded the MD and presented him Shawl.

Speaking on the occasion, Verma thanked the staff members for their support and termed the achievements during his tenure as a result of their dedication and hard work. The speakers on the occasion shared their experiences and termed Verma as an efficient and accomplished Engineer with a positive and constructive approach. His achievements in the field of power production and improvement in the financial health of the organisation were also discussed.

The director operation, Purushottam Singh, director Projects, Suresh Chandra Baluni, director finance, Sudhakar Badoni, director HR, Pankaj Kumar, Executive director Surendra Kumar, Rajiv Agarwal, General Manager Har Prasad, Rajendr Singh, Pankaj Kulshrestha and others were present on the occasion. Verma would be succeeded by Sandip Singhal.",state-editions,https://www.dailypioneer.com/images/logo.jpg,https://www.dailypioneer.com/2020/state-editions/warm-farewell-accorded-to-ujvnl-md-verma.html
60,01-2-20,"Increase in work but no raise in salary, allege striking bank employees","On the first day of two-day strike of the nationalised banks, the protesting bank employees said that there has been a consistent increase in their workload but there has not been a corresponding raise in their salary.

According to Mahesh Gaur, employed at a bank in Astley Hall, “We are not allowed to stay in the bank after official timings and we also have to complete the additional work of others in the same hours but there is no raise in the salary”.

Arun Wadhwa, who works in a bank in Indiranagar said, “Our first and foremost demand is to get a 25 per cent increment in our salary which has not been given to us since the year 2017.

Though Indian Bank’s Association (IBA) has offered us 20 per cent but the union is not ready to accept it. The other demands include medical-aid facilities, five working days in a week, and hiring of new staff. An adequate number of new staff has not been hired for years which adds to the burden of other employees.” It is pertinent to mention here that United Forum of Bank Unions (UFBU) which consists of nine bank unions of employees and officers has called for agitation programmes on March 11, 12, and 13 and if nothing is settled, an indefinite strike will be commenced from April 1.",state-editions,https://www.dailypioneer.com/images/logo.jpg,https://www.dailypioneer.com/2020/state-editions/increase-in-work-but-no-raise-in-salary--allege-striking-bank-employees.html
61,01-2-20,"Officials making contradictory statements, allege Anganwadi workers","Regarding the continuing strike of Anganwadi workers, the director of Integrated Child Development Services (ICDS) Jharna Kamthan has directed officials of the department to take proper action to prevent the negative effect of the protest on departmental schemes.

However, the Anganwadi workers association president Rekha Negi alleged that Kamthan is making contradictory statements regarding the action reportedly directed on the striking workers.

According to Rekha Negi, “When we questioned Jharna Kamthan about how we can be issued notice when we have not violated any law and have informed the department days ago about our protest, she told us that she is not aware of the notice issued to us and officials like District Programme Officer (DPO) and Child Development Project Officer (CDPO) have the rights to take decisions as they are the one who appoints us too. But while talking to media persons, she gave a statement saying that she told the officials to take the proper action against the Anganwadi workers.”

However ICDS director Jharna Kamthan has denied this allegation by Anganwadi workers. According to her, “I did not say anything about taking any actions against Anganwadi workers or to terminate their services.

Since their strike is going on for so long, I did not want it to have an effect on the schemes related to Anganwadi workers that affect the children in the Anganwadi centres too, so I just asked the DPOs to take necessary actions as per the rules. It is up to DPOs how they proceed in order to make the Anganwadi centres run in an area.”

It is pertinent to mention here that Anganwadi workers have been protesting for about 57 days in support of their demands including raise in allowance. They have also been undertaking hunger strike unto death for about 23 days though the authorities have picked up a number of hunger strikers so far due to health concerns.

They have also warned to commit self immolation if the government does not accept their demands. However, there has been no initiation of settlement from any officials of the government, said Rekha Negi.

Besides, the last two protesting workers Basanta Rawat and Madhurvadni Tiwari who were on fast unto death for three days have been admitted to the hospital by police and new duo, Sakiran Khatoon and Urmila Tomar have taken up a fast unto death.",state-editions,https://www.dailypioneer.com/images/logo.jpg,https://www.dailypioneer.com/2020/state-editions/officials-making-contradictory-statements--allege-anganwadi-workers.html
62,01-2-20,UPES holds Raftaar 2.0 for Govt primary schools,"As part of its initiative of supporting eight government primary schools, UPES organised the second edition of the annual inter school sports and cultural competition Raftaar 2.0 on its campus. The UPES vice chancellor Deependra Jha inaugurated inaugurated the event. Over 300 students from the eight government primary schools participated in various activities held throughout the day.

Welcoming the students, principals and teachers of all the participating government primary schools, UPES senior director and Raftaar mentor Arun Dhand informed that UPES-CSR has been providing need-based infrastructural support to these state government run schools for over a decade.

The UPES-CSR faculty mentors and student volunteers have been visiting these schools on a regular basis to supplement the efforts by their teachers in teaching mathematics & English to their students.

Distributing the winter kits comprising woolen blazer, woolen inner set, woolen cap, two pairs of woolen socks and a pair of shoes each to the primary school students, the vice chancellor Deependra Jha praised the efforts by the entire UPES-CSR team in supporting the primary education among the schools situated in a radius of five kilometres of the UPES campuses through a regular infrastructural support and academic interventions benefiting their students.

Over 300 students from classes I to V of the eight government primary schools participated in the multiple sports and cultural events of Raftaar 2.0. In all, 40 gold trophies, 40 silver trophies and 21 bronze trophies along with 320 winner and participant certificates were awarded to the students.

The Raftaar 2.0 running shield was lifted by the government primary school, Bishanpur. Shagun from the government primary school in Bishanpur, a second position winner in a state level painting competition and Khushi from government primary school at Paundha, who won the first position in district level spelling competition were also recognised with a special Achievers Award on the occasion.",state-editions,https://www.dailypioneer.com/images/logo.jpg,https://www.dailypioneer.com/2020/state-editions/upes-holds-raftaar-2-0-for-govt-primary-schools.html
63,01-2-20,Health dept convenes special meeting,"Stung by the occurrence of a suspected patient of Coronavirus in provisional state capital, the state health department has swung into action.

The senior health officials of the state held a meeting with the representatives of the private hospitals, medical colleges and Indian Medical Association (IMA) on Friday.

Presiding over the meeting, the secretary (in-charge) of medical health and family welfare department, Pankaj Kumar Pandey said that the protocol for treatment of the suspected patients of the Coronavirus should be followed.

He informed about the guidelines released by the government of India about the disease and said that the hospitals should keep all the suspected patients of the disease on vigil and provide information about such patients.

Pandey said that any patient who is having symptoms of common cold and he had returned from China after January 15 should be considered as suspected case of the disease and should be kept in isolation.

When such a suspected patient exhibits more symptoms of the disease, a sample should be taken and sent for Coronavirus test.

Pandey said that every person coming from China or entering India from Nepal is being screened and the private hospitals too should be on alert mode.

He said that if any suspected patient visits the private hospitals then they should follow the protocol and inform government.

Pandey however added that misconceptions and unnecessary scare about the disease should not be allowed to spread in general public.

The Director General (DG), health services, Dr Amita Upreti said that the department has sufficient number of masks and other things required to combat the disease and when needed they can be provided to the private hospitals also.

She said that no suspected patient of the disease should be declared as Coronavirus patient until it is confirmed by the authentic test and necessary secrecy should maintained about such patients.

Dr Upreti clearly said that only the patients returning from China should be declared suspected and kept in isolation.

Meanwhile, the Principal of Government Doon Medical College (GDMC), Dr Ashutosh Sayana convened a meeting of doctors at his office on Friday. In the meeting the Principal took stock of the preparation of the GDMC hospital for Coronavirus.",state-editions,https://www.dailypioneer.com/images/logo.jpg,https://www.dailypioneer.com/2020/state-editions/health-dept-convenes-special-meeting.html
64,01-2-20,First suspected patient in State at AIIMS Rishikesh,"The first suspected patient of Coronavirus in Uttarakhand, a female medical student is kept under isolation and strict vigil of doctors at All India Institute of Medical Sciences (AIIMS), Rishikesh.

The blood sample of the student has been sent to the National Institute of Virology, Pune for test of Coronavirus and the findings of the test are expected on Monday. The student, a resident of Dehradun has recently returned from China and had complained of fever and breathlessness.

The family members of the suspected patient too have been kept under observation and they are advised by the doctors not to meet people.",state-editions,https://www.dailypioneer.com/images/logo.jpg,https://www.dailypioneer.com/2020/state-editions/first-suspected-patient-in-state-at-aiims-rishikesh.html
