,Date,Title,Article,Category,Image_link,Article_link
172,01-2-20,Finding the unknown,"Inspired by the golden period of Hindi cinema, global artworks at the fair delve deep into India’s history and culture. By Team Viva

As one enters the India Art Fair, time becomes an illusion as you are surrounded by a plethora of creativity and art from across the world. It’s enthralling to see how the contemporary art scene has evolved overtime in the country and today has an immense global presence.

There are around 80 galleries from across Indian and international cities, many of them first-timers. Taking a walk through the fair, one could see many live installations, events, bookshops and workshops.

Inspired by the imagery of the golden period of Hindi cinema — 1960s, the paintings of Canada-based artist Marcel Dzama gives an insight into the Indian culture, details about Bollywood and regional wildlife. Presented by the David Zwirner gallery, Dzama’s works are a visual exploration of the Indian ethos with hints of divine iconography. His works presented a blurred relationship between the real and the subconscious through a understandable visual language. “I have always admired Bollywood. I loved how each character had a specific charm and tone which is somewhere still intact in the hearts of the people. So I have always been drawn to dance, costumes and masks. I remember, during my childhood, I used to dress up in a costume and pretend that I was a film’s character all day long,” Dzama said, pointing towards his work that seamlessly merge Indian mythology, pop culture and memories.

While I wondered the depth each painting talked about, the appealing tent facade designed by popular Indian artist Sameer Kulavoor, grabbed my attention instantly. It focussed on the routine Indian life, I couldn’t help appreciating him for depicting the everyday ordinariness so beautifully.

Another artist, Chitra Ganesh has explored the the lines between past and future. She has also portrayed a dynamic connection between mythology and science fiction. “There are always untold stories trying to rise to the surface. They are inspiring,” said she.

B Prabha, a female modernist, brought one of her prized pieces to the fair. She began painting at a time when very few women were in this profession. Inspired by artist Amrita Sher Gil, Prabha represented real female subjects, liberated from the gaze of the male artist. She painted the trauma and tragedy of women and depicted the melancholy rural women in natural colour palettes.

Moving ahead was the miniature artist, Sahil Naik, who described his meticulous models in a fine manner. For Naik, close examination of structures offers the possibility of understanding what took place and under what circumstances. He is interested in knowing the incidents that led to a particular situation. One of his project called Monuments, Mausoleums, Memorials and Modernism explored the zeal of new nations. Models of structures were inspired by a proposed dam in his native Goa, whose building process would have displaced local residents from there. There is a human cost, Naik implies, to such large-scale ambition.

Apart from a diverse selection of contemporary and modern art galleries from across different cities, the fair also features international galleries from New York, Berlin, Seoul, Colombo, London, Hong Kong, and Dubai.

There were sections showcasing solo presentations curated by various galleries — Ratheesh T by Galerie Mirchandani and Steinruecke, Girjesh Kumar Singh by Rukshaan Art, Anjan Modhak by Emami Art, Avijit Dutta by Kalakriti Art Gallery, D Dhasan by Apparao Galleries, KS Radhakrishnan by Galleri Nvya and Subodh Kerkar by Gallery Art Positive.

Next in line were outdoor art projects, ranging from largescale interactive installations to sculptures. It also had giant wooden rain drops by Chennai-based printmaker Vijay Pichumani with Art Houz Gallery. It touched upon the ongoing conversation around water scarcity.

Yet another interesting part of the fair, that extends beyond the venue, are collateral events programmed by galleries, museums and arts spaces around the city. The opening of the newly refurbished Jaipur House, Kiran Nadar Museum of Art, Gujral Foundation, Khoj International Artists Association, Bikaner House and walkthroughs in Okhla, among others remained a centre of attraction.

Various artists were glad about the fact that they not only do a fair amount of business through the fair but have also been able to build long-term relationships.",vivacity,https://www.dailypioneer.com/uploads/2020/story/images/big/finding-the-unknown-2020-02-01.jpg,https://www.dailypioneer.com/2020/vivacity/finding-the-unknown.html
173,01-2-20,Young at heart,"Over the course of 40 years, actor Anil Kapoor had straddled the domain of arthouse and commercial cinema with equal ease. By Ayushi Sharma

The recent trailer of Malang has been making waves as people hazard wild guesses about what the film’s storyline is about. There are conjectures all around as to who is playing what and actor Anil Kapoor fuels the curiosity further when you ask him about his character. He laughs and says that’s the “intent” because it’s a thriller. “Yes, it does look a bit confusing and that’s the idea — to keep people’s curiosity alive. The trailer should be such that people want to watch the film when it releases. Don’t you want to?,” he asks.

Anil has played a range of characters during the 40 years that he has been a part of the industry. But he is not flagging as he continues to reinvent himself with each film. His first reaction to the trailer was similar to that of most of the audience. So what made him go for such a character? “When I heard the script, I felt what the audience is feeling after watching the trailer. It makes you think about what and how will the film unfold. It confuses you. But then you are eager to find out the layers. The narrative is not simple but it is definitely interesting,” says he.

The film revolves around a couple, Advait (Aditya Roy Kapoor) and Sara (Disha Patani), whose seemingly perfect life comes crashing down when they get linked to a corrupt cop (Anil) and his righteous counterpart (Kunal Khemu). To further complicate matters, all four are on a killing spree. Anil plays a police officer from Goa, who is disappointed with the ways of the world and the hostile environment around him. He feels that the process is slow and taxing. “He just wants justice. While his department is a little unhappy with the way he works, he is also dissatisfied with the manner in which his department handles operations. There’s also a simmering anger within him about the decline of Goa. Earlier he was fine with the place becoming a tourist attraction but now he finds that it has become too commercial,” he tells us. Anil feels that such films push one to use their mind and youngsters today enjoy doing that. “They don’t want to be spoonfed,” he says.

Amid this flood of good content and realistic cinema, what do thrillers have to offer? Do they still appeal to the audience as they did before? Moreover, the idea of thrillers has also changed with Sacred Games and Mirzapur. They are no longer infused with fiction or fantasy. It’s reality all the way. Anil thinks it’s changing because of the kind of exposure to content we have now. “It’s so important that even fantasy has a bit of reality now. People want the characters and stories to be real. A little larger than life. Nobody starts investing in something the customer doesn’t require. It’s always according to what people want. There are so many stakeholders, distributors and producers. They always invest in stories which the audience wants to consume. Sometimes they succeed and at times they don’t. It’s just a part of the business. Also, the choices vary from filmmaker to filmmaker, actor to actor. You just need to do your best and eventually, it is the audience which decides what’s right, what’s wrong,” he says.

The actor is known to have blended in with the younger generation really well. So does he feel the pressure of putting the right content forward as many people, especially youngsters look up to him? He feels that it’s not just him but almost everybody has the pressure of putting the right content forward, no matter the age or the profession. “When everybody knows the kind of work you do, they start expecting a little more and you stand in a position where you have to deliver. That’s partially the price you pay for being in the show business. And you are also paid for that, so why won’t you deliver? There are no free lunches in life,” he laughs and says.

As an actor, Anil has straddled arthouse and big commercials effortlessly. How difficult is it to keep a balance while switching genres? It depends on the actor, he says. For him, the more challenging it is, the more exciting it becomes. “I love challenges. I want to dive into something which I have never done before. So I never step back from trying new things because when you keep on doing same things over and over again, there is a tendency to stagnate and people get bored. So that’s not the right move for an actor who really loves his work. And when you start doing great work, people expect you to do the same thing and even that becomes more challenging. Both ways, it is difficult,” says Anil.

Photo: Pankaj Kumar",vivacity,https://www.dailypioneer.com/uploads/2020/story/images/big/young-at-heart-2020-02-01.jpg,https://www.dailypioneer.com/2020/vivacity/young-at-heart.html
174,01-2-20,Helmet will decide if I should play lead: Aparshakti,"Actor Aparshakti Khurana says he had a great time shooting for his quirky next release, Helmet. The film, co-starring Pranutan Bahl, is his first outing as a solo lead actor. He added that the audience response to the film will determine whether he should do lead roles in the future.

“I think these all are wishes of my family, colleagues and the audience that all these things are happening to me. If Helmet connects with the audience then people might think about whether I should play lead roles or not. If it does not connect, then people will say that it was too early for me to do a lead-hero film and I should have done two to three films in supporting roles. So, it’s all very situational. Having said that, I had a great time shooting for the film. Whatever I have seen and heard about it, it’s all going great,” said the actor, while interacting with the media at dancer choreographer Shakti Mohan’s Break A Leg Season 2 shoot along with actor Nushrat Bharucha.

Aparshakti has carved his niche as a fine actor and comedian with some interesting character roles and was recently seen in the dance hit, Street Dancer 3D. “This is the first time I played an emotional character. I have always played comic characters in films. When I used to do theatre, I used to do a lot of dark and intense roles but when I started working in films, I continuously have been doing comic characters and that was a bit weird. I had fun while playing an emotional character in this film and I feel glad that it connected with the audience,” he said.

Helmet, his first outing as a leading man, is directed by Satram Ramani. Nushrat Bharucha, who was also present at the location, talked about her forthcoming film Chhalaang, co-starring Rajkummar Rao. “We have recently launched the poster of the film. Everybody is excited to see what is going to happen in the film and why Raj (Rajkummar Rao) is sleeping in the poster. We are going to release the trailer very soon, so I don’t want to talk about it any more. The film will release on March 13,” she said about Chhalaang, a black comedy directed by Hansal Mehta and backed by Ajay Devgn, Luv Ranjan and Ankur Garg.

This film will be Aparshakti’s first as a lead actor. Directed by Satram Ramani, Helmet is a funny script which touches upon an unusual topic that is considered embarrassing for most people in India. It is yet to be disclosed. Rohan Shankar, who previously wrote Luka Chuppi has been roped in as the writer.

Aparshakti will play opposite Pranutan Bahl in the film. It has been shot in Varanasi and Mumbai.",vivacity,https://www.dailypioneer.com/uploads/2020/story/images/big/helmet-will-decide-if-i-should-play-lead--aparshakti-2020-02-01.jpg,https://www.dailypioneer.com/2020/vivacity/helmet-will-decide-if-i-should-play-lead--aparshakti.html
175,01-2-20,‘Live in the moment’,"Actor David Alan Grier says that the best part of his day is to feel a sense of belonging while walking into a theatre

When David Alan Grier was offered a chance to revisit one of his favourite plays on Broadway, he quickly agreed. He just forgot about all the beatings. In A Soldier’s Play, Grier plays a stern Army sergeant who during each show is pummeled twice and later shot dead, again twice. While the violence is fake, the actor does have to repeatedly drop and roll around on the American Airlines Theatre stage.

While this is Grier’s third time performing A Soldier’s Play, the fact that the role he’s playing was so physical slipped his mind. He only remembered the physicality when a fight coordinator appeared.

“I forgot about all that. I was like, ‘Oh, he has lots of lines. Yeah, I’ll do it.’ I thought there were little scuffles. I thought, well, he gets pushed a couple times. A lot of monologues. I’ll take it,’” says Grier.

To be sure, Grier is the last person you’d expect to be caught unaware. One of his earliest roles was in a small part in the off-Broadway debut of A Soldier’s Play when he was in his 20s. He revisited the work when it was turned into a 1984 film. This is his third bite of the apple. “I was the youngest actor. Now I’m the oldest,” he says.

The play by Charles Fuller is set on an Army base in Louisiana during World War II. A Black investigator has been called to find out who murdered the Black sergeant of an all-black company. What he finds is racism — but not from white bigots or the KKK. He finds intolerance within the black ranks.

The play won the Pulitzer Prize for drama and over the years has attracted some of the most accomplished actors in the black community: Denzel Washington, Adolph Caesar, Samuel L. Jackson, Wood Harris, Taye Diggs, Anthony Mackie, James McDaniel and Blair Underwood.

Jerry O’Connell, who plays a captain worrying about the direction of the case, said it’s a kick having Grier — who has now played three different roles — around for the Broadway version. “It is pretty funny asking Grier for advice, like ‘Hey, what happened in the original production?’ He’s like, ‘It was 38 years ago! I don’t remember any of it!’”

Grier recalls making the film in Arkansas and one day then Gov Bill Clinton stopped by the set. He also vividly recalled the food: Patti LaBelle, who played a nightclub singer, made rice and red beans daily and one day the caterer served something a little odd: catfish sushi. “I abstained. Wisely, wisely, I was told later,” Grier says. One reason was that he’d never heard of such a dish. “And I’m going to go out on a limb. I speak for all Japan: Neither have they.”

When you speak to the actor, food often comes up. He’s an avid chef and shares his creations on social media and in a food blog. He recently detailed cooking a massive pork shoulder for eight hours. He managed to pull out the bone and simmer it with root vegetables to make bone broth. Someone mentioned in the comment section they’d also been boiling bones but they were doing it for three days and the broth tasted terrible. “Yeah, you dummy. Three days? That’s what you do to get rid of a body,” joked Grier.

Food — well, dessert, really — had an important role in how he became an actor. Growing up in Detroit, he knew he was funny but he moved to New York in the mid-1970s to be a musician. And like all struggling musicians, he had a side hustle.

Grier worked at a Häagen-Dazs ice cream store in the Upper East Side of Manhattan and often after his sticky shift would go across the street to a disco. One night he was messing around when an actor spotted him and said he had talent and was wasting his life. “He was really responsible for saying you are on the wrong path. Whatever he saw in that moment was ‘You need to go over here,’” says Grier. “And I listened.”

Grier, who after that conversation applied to acting schools and chose Yale, would go on to a career on the stage (Dreamgirls and Porgy and Bess), on TV (In Living Color and DAG) and film (Jumanji and Native Son).

Being on Broadway again these days isn’t old hat to the 63-year-old performer. He even likes to get to the theatre early, long before the place is buzzing.

“To walk into a theater and belong — this is my doorway into my life — is the best. It’s the best part of the day,” he says. “You walk in this environment before the audience is there and the crew is kind of just vacuuming, setting up, testing everything. I love it.”",vivacity,https://www.dailypioneer.com/uploads/2020/story/images/big/---live-in-the-moment----2020-02-01.jpg,https://www.dailypioneer.com/2020/vivacity/---live-in-the-moment---.html
176,01-2-20,Final that nobody saw coming,"In a first, Kenin, Muguruza face-off for first Australian title

Serena Williams dominated talk before the Australian Open but today’s women’s final is between unseeded Garbine Muguruza and unheralded Sofia Kenin — a 750-1 longshot of a championship match that nobody predicted.

After a tournament of surprises, the 21-year-old Kenin can even supplant Williams as the top-ranked American if she manages another plot twist by beating Spain’s Muguruza in Melbourne.

The 38-year-old American legend Williams was attempting to equal the record 24 Grand Slam titles of Australian Margaret Court, but she lost in the third round to China’s Wang Qiang.

Reigning champion Naomi Osaka went out at the same stage to 15-year-old sensation Coco Gauff, who was promptly turfed out herself by fellow American Kenin.

Six of the top 10 seeds exited in the third round, seemingly blowing the tournament open for Australia’s world number one Ashleigh Barty.

But step forward Moscow-born 14th seed Kenin once more, who showed remarkably few nerves in her first Grand Slam semi-final as she broke home hearts in straight sets.

Even if she loses the final, Kenin will reach a career-high nine in the world, rising from her current position of 15th.

If she beats Muguruza — and she did so in their only previous meeting, at the China Open in the autumn — she will leapfrog Williams into seventh in the rankings.

“After this week, she is a top-10 player, she deserves that respect and she deserves the recognition,” said the beaten Barty, the latest to succumb to the fiery Kenin.

“She’s played an exceptional tournament, she’s had an exceptional last 12 months.”

Kenin won her first WTA title only 12 months ago in Hobart and added two more during the season with the determination and aggression that has become her trademark in the past fortnight.

“I’ve always had that, no matter who I’m playing, where I’m playing, I’m going to fight for it,” said Kenin, who moved to the United States from Russia as a baby with her family.

The 26-year-old Muguruza will be the next to try to tame Kenin. British bookmakers William Hill said the odds of a Kenin-Muguruza final were 750-1 before the Australian Open began.

They make Muguruza the favourite because she has experience of the biggest occasions, having won the French Open in 2016 and Wimbledon in 2017.

But this is her first final in Melbourne and she is ranked 32 in the world after her form tailed off alarmingly in the past 18 months.

Unseeded for the first time at a Grand Slam since 2014, Muguruza beat three top-10 seeds in reaching the final.

She fought back in both sets in her semi-final against fourth-ranked Simona Halep to defeat her fellow former world number one 7-6 (10/8), 7-5.

Muguruza is not one for exuberant celebrations and she gives as little away in her post-match comments.

So it was left to Halep to say that the Spaniard has the quality to be the world’s top-ranked player once more — but with one caveat.

“If she can play every day like this, she can be number one for sure,” said the 28-year-old Romanian, also a French Open and Wimbledon champion, following their hard-fought semi-final.

“But it’s tough to do that. The consistency on tour — it’s the most important thing and the toughest one.”",sports,https://www.dailypioneer.com/images/logo.jpg,https://www.dailypioneer.com/2020/sports/final-that-nobody-saw-coming.html
177,01-2-20,Thiem outlasts Zverev,"Tireless Dominic Thiem came from a set down to outlast German Alexander Zverev and make his first Australian Open final on Friday, booking a showdown with seven-time champion Novak Djokovic.

The 26-year-old fifth seed, the first player from Austria ever to reach the Melbourne decider, battled past seventh-ranked Zverev 3-6, 6-4, 7-6 (7/3), 7-6 (7/4) on a sweltering evening.

Defending champion Djokovic awaits him after the second seed ended Roger Federer’s dreams in straight sets on Thursday to make his eighth Melbourne Park final.

Thiem has his work cut out against the Serb who is on a 12-match unbeaten streak this season and has won all seven of the Australian Open deciders he has contested.

And if Djokovic needs extra motivation, winning tomorrow will see him reclaim the world number one ranking after Rafael Nadal crashed to Thiem in the last eight.

“It was an unreal match, two tie-breakers, so tough and so close. It was almost impossible to break him,” said Thiem.

“Being in the Australian Open final is unreal. What a start to the season for me.”

Thiem had dealt with semi-final pressure before, although always on the slower red clay at Roland Garros, where he reached the past two finals only to be beaten by Nadal.

That experience paid dividends as he coolly closed out the match after 3hrs 42 mins to give himself another chance to break the stranglehold of the Big Three and win his first Grand Slam.",sports,https://www.dailypioneer.com/images/logo.jpg,https://www.dailypioneer.com/2020/sports/thiem-outlasts-zverev.html
178,01-2-20,Boris Johnson hails UK’s new beginning as Brexit day arrives,"Britain begins the day as a member of the European Union. Its status at the end of the day — as a proud nation that has reclaimed its sovereignty, or a diminished presence in Europe and the world — will still be up for debate.

Britain officially departs the EU at 11 pm local time Friday, midnight in Brussels (2300 GMT, 6 pm EST). The departure comes 3½ years after the country voted by a margin of 52%-48% to walk away from the club that it had joined in 1973.

It’s the first time a country has left the EU, and many in the bloc regard it as a sad day. In Brussels, European Council President Charles Michel and EU Commission leader Ursula von der Leyen are due to sketch out the EU’s first steps as a group of 27, rather than 28.

UK Prime Minister Boris Johnson is to meet in the morning with his Cabinet in the pro-Brexit town of Sunderland, in northeast England. He is scheduled to deliver a televised address to the country an hour before departure, calling Brexit “not an end but a beginning.” According to his office, he will describe it as “a moment of real national renewal and change.”

The government hopes the moment will be marked in a dignified, nontriumphalist fashion, with red, white and blue lights illuminating government buildings and a countdown clock projected onto the prime minister’s 10 Downing St. Residence.

Some Brexit supporters will be holding more raucous celebrations. Arch-Brexiteer Nigel Farage and his band of devotees will gather for patriotic songs and speeches in London’s Parliament Square to mark a moment that even Farage sometimes doubted would ever come.

Britain was never a wholehearted EU member, but actually leaving the bloc was long considered a fringe idea.

It gradually gained strength within the Conservative Party, which has a wing of fierce “euroskeptics” — opponents of EU membership. Former Prime Minister David Cameron eventually agreed to hold a referendum, saying he wanted to settle the issue once and for all.",world,https://www.dailypioneer.com/images/logo.jpg,https://www.dailypioneer.com/2020/world/boris-johnson-hails-uk---s-new-beginning-as-brexit-day-arrives.html
179,01-2-20,Slow response made coronavirus epidemic worse: Chinese official,"China’s delayed response to the discovery of a deadly new coronavirus infection worsened the epidemic, the most senior official from the city at the centre of the outbreak said Friday. More than 210 people have died and nearly 10,000 others have been infected in China by the SARS-like virus and new cases have been found abroad, with more than 20 countries now affected by the disease.

Public anger has simmered on Chinese social media over the handling of the health emergency by local authorities in Wuhan, where the virus was first detected.

Wuhan officials have been criticised online for withholding information about the infection until the end of last year, despite knowing about the new illness weeks earlier.

“Right now I’m in a state of guilt, remorse and self-reproach,” said Ma Guoqiang, the municipal Communist Party secretary for Wuhan.

“If strict control measures had been taken earlier, the result would have been better than now,” he told an interview with state broadcaster CCTV.",world,https://www.dailypioneer.com/images/logo.jpg,https://www.dailypioneer.com/2020/world/slow-response-made-coronavirus-epidemic-worse--chinese-official.html
