,Date,Title,Article,Category,Image_link,Article_link
111,01-2-20,Man gets life for murder in JSpur,"District and Session Judge Ananda Chandra Behera on Friday sentenced a murder accused to undergo life imprisonment and pay a fine of Rs 1,000.

The convict was identified as Pratap Barik. A resident of Sikhar village under Naugaon area, Barik in December 2014 had murdered two women Sailabal Barik and Nirupama Swain and critically injured one Subash Swain over old enmity.

Later, the Naugaon police arrested the accused and filed the charge-sheet in the District Judge court here. While delivering judgment, the Judge found the accused guilty based on the prosecution submission and evidences and awarded the punishment. Public Prosecutor Nalini Kanta Moharana was conducting the case on behalf of the Government.",state-editions,https://www.dailypioneer.com/images/logo.jpg,https://www.dailypioneer.com/2020/state-editions/man-gets-life-for-murder--in-jspur.html
112,01-2-20,Rourkela admn forgets Gandhi,"It was unfortunate that the district administration of Rourkela did not observe the Martyr's Day marking the assassination of Mahatma Gandhi. Neither any officer of the district administration nor from I&PR Department turned to the Gandhi Statue to offer flowers.

It may be noted here that at the entry point of Rourkela at Panposh Chowk, a Gandhi statue has been installed under the aegis of the district administration. But for the last time the district administration has garlanded the statue was on October 2, the birth day of the Mahatma. Still the dried garland was hanging on the dust filled statue.

Locals had expected that the administration will clean the statue to observe the Martyr's Day on January 30 but in vain.",state-editions,https://www.dailypioneer.com/images/logo.jpg,https://www.dailypioneer.com/2020/state-editions/rourkela-admn-forgets-gandhi.html
113,01-2-20,RI held taking bribe in B’swar,"The Vigilance police on Friday arrested Baleswar district’s Remuna Panchagarh RI Arabinda Kumar Singh on the charge of taking a bribe of Rs 500 from one Madan Behera of Sergarh village to submit a report for birth certificates of his two daughters.

Singh’s office room at Panchagarh and house at Narasinghpur under the Nilgiri police station were under search, informed an official release.",state-editions,https://www.dailypioneer.com/images/logo.jpg,https://www.dailypioneer.com/2020/state-editions/ri-held-taking-bribe-in-b---swar.html
114,01-2-20,"Headmistress, parent held for ‘Modi abuse’ in drama","Days after a sedition case was slapped against a school in Karnataka, its headmistress and a student’s mother have been arrested for alleged involvement in staging of a drama portraying Prime Minister Narendra Modi in poor light over the CAA and NRC, police said on Friday. The police action came after they questioned the two women, a few staff members of the Shaheen School in the district headquarters town of Bidar and students on Thursday.

They were produced before a court which remanded them to judicial custody, police said adding further investigation was on.

The drama was staged by students of fourth, fifth and sixth standard on January 21.

A sedition case was booked by police on January 26 against the school, along with some other sections of the Indian Penal Code (IPC) on January 26, based on a complaint from social worker Neelesh Rakshyal.

The play uploaded on social media had gone viral.

Officials said, the utterances against the Prime Minister were not part of the original script, but the mother of a Class six student allegedly incorporated them during the practice and the teacher allowed it to be part of the drama.

The complainant has alleged the school authorities ‘used’ the students to perform a drama where they “abused” Modi in the context of the Citizenship Amendment Act and the National Register of Citizens.The management tried to create ‘fear’ among the Muslims that they would have to leave the country if the CAA and NRC were implemented, Rakshyal had charged.",india,https://www.dailypioneer.com/images/logo.jpg,https://www.dailypioneer.com/2020/india/headmistress--parent-held-for----modi-abuse----in-drama.html
115,01-2-20,Goa: Plaint against school for involving kids in protest rally,"The National Student’s Union of India (NSUI) on Friday filed a complaint with the director general of police (DGP) against a school in Porvorim for allegedly brainwashing students and making them participate in a pro-CAA march.

The action has come hours after the police registered a criminal case against a wing of Goa Church and an NGO for allegedly making children take part in a rally against the Citizenship (Amendment) Act (CAA).

NSUI Goa chief Ahraz Mulla filed a complaint with the DGP alleging that Porvorim-based school Vidya Prabhodini had brainwashed students and made them participate in a pro-CAA rally at Porvorim on December 18 last year.

In its complaint, the NSUI said the management of Vidya Prabhodini has been brainwashing young students and had reportedly asked them to participate in a rally supporting CAA and National Register of Citizens.

The management exposed children to political ideology and aggressive language, and also exposed them to psychological abuse and an unsafe environment, the NSUI alleged.

“There have been complaints that students from the institution are forced to be part of such rallies, failing which strict action is taken by the management against students who oppose NRC and CAA,” the complaint states.",india,https://www.dailypioneer.com/images/logo.jpg,https://www.dailypioneer.com/2020/india/goa--plaint-against-school-for-involving-kids-in-protest-rally.html
116,01-2-20,Maha Congress: Slap sedition case against school for pro-CAA event,"The Congress on Friday demanded that a sedition case be registered against the management of a school in Mumbai for allegedly forcing children to support the controversial Citizenship Amendment Act.

The demand from the Maharashtra Congress comes against the backdrop of a move by police from neighbouring Karnataka to slap sedition charges against a school in Bidar there for staging a drama critical of CAA and Prime Minister Narendra Modi.

The drama was staged by students of fourth, fifth and sixth standard on January 21, and a sedition case was registered on January 26.The headmistress of Shaheen School and the mother of a student have been arrested by Bidar police in this case.

According to media reports, a programme relating to the CAA was organised at the school in Matunga here earlier this month.

“If sedition case can be registered against students for staging drama against CAA, then a case of sedition should be filed against a school management and organisers for holding students to ransom to support CAA at a Mumbai school,” Maharashtra Congress spokesperson Sachin Sawant said in a statement.",india,https://www.dailypioneer.com/images/logo.jpg,https://www.dailypioneer.com/2020/india/maha-congress--slap--sedition-case-against-school-for-pro-caa-event.html
117,01-2-20,Goa: Cong condemns FIR against church wing over protest rally,"The Congress on Friday condemned the FIR filed against a Goa Church wing and an NGO over the presence of children at anti-CAA protest, terming it an “assault on a religious institution”.

The Goa police’s women and child protection unit on Thursday filed an FIR against Council for Social Justice and Peace (Goa Church’s wing) and National Human Rights Organisation (Goa Chapter) for using children to protest against the Citizenship (Amendment) Act at a rally in Margao on January 24.

“The politically dictated FIR by the Goa Police is not only an attack on freedom of expression and speech, but also a direct assault on a religious institution,” Goa Congress chief Girish Chodankar said.

Talking to reporters here, Chodankar accused the BJP- led state government of creating “fear psychosis” among the anti-CAA protesters, who have been fighting to save the Constitution.

The FIR was completely “politically dictated” by BJP leaders to suppress the voice of masses, he said.

“When the BJP realised that people are against its ulterior motive of passing CAA, they are resorting to such actions,” the Congress leader alleged.

The police has kept several complaints against corruption in the state in cold storage, while it was quick to file an FIR in frivolous and mischievous complaint by an NGO against a Goa Church body, he alleged.

Speaking about the issue, BJP’s Goa general secretary and former MP Narendra Sawaikar said, “There is no point in dragging children on the street for this issue. The person who has filed the complaint must have found something unconvincing in the rally,” he said.

Citizens have the right to agitate but it should be for a genuine cause and students from school should not be brought on the streets, he said.”It has happened even in Delhi. Where is this heading? Why are we trying to pollute minds of children?” he questioned.",india,https://www.dailypioneer.com/images/logo.jpg,https://www.dailypioneer.com/2020/india/goa--cong-condemns-fir-against-church-wing-over-protest-rally.html
118,01-2-20,IN Brief,"HC Acting CJ visits Kandhamal

Phulbani: Orissa High Court Acting Chief Justice Sanju Panda arrived here on Friday on a visit to Kandhamal district. District Judge Sarada Prasanna Nayak and other judicial officers, District Bar Association members, the district Collector and SP were present to welcome her at the Circuit House.

Ajay Mahapatra awarded Ajay Utsav Samman

Bhubaneswar: The Ajay Utsav 2020 was celebrated on Saraswati Puja here on Thursday under the chairmanship of Utsav Committee president Ashok Kumar Puhan. Guests including writer Hara Prasad Das, Debdas Chhotray, painter Baldev Maharatha, storyteller Gourahari Das and Dr Rajani Ranjan spoke. Storyteller and novelist Ajay Mahapatra was awarded with the Ajay Utsav Samman (Literature) and young poet Dipun Puhan with the Ajay Utsav Tarun Sahitya Samman. Among others, committee’s Sabitri Sahu, Ajay Swain, Priya Ranjan Mohanty and Binod Tripathy were present.

Monica FICCI State chairperson

Bhubaneswar: Sambad Group managing director Monica Nayyar Patnaik has been appointed as the chairperson of FICCI (Federation of Indian Chambers of Commerce and Industry) Odisha State Council.

Balangir region SBI staffs on 2-day strike

Balangir: Responding to a two-day all-India bank strike call given by the United Forum of Bank Unions, State Bank of India Staff Association, Balangir Region led by its secretary Rohit Satpathy and Rupesh Dalai staged a demonstration before the SBI Main Branch here on Friday. “Our main demands are wage revision and five-day work besides 12 other points. Unless our demands are fulfilled, we will hold agitation in March and an indefinite strike in April,” said SBI Staff Association Regional secretary Satpathy.

Man dies in fire mishap in house Ganjam

Brahmapur: A person was charred to death when a massive fire broke out in a house at G Damodarapalli village under the Dharakote police station in Ganjam district in wee hours of Friday. The deceased was identified as G Simanchal Patro. An electric short circuit was suspected to be the cause of the fire. The Dharakote police rushed to the site and recovered the victim’s body.

Gandhi death anniv observed in JSpur

Jagatsinghpur: The district administration in collaboration with the municipal authorities on Thursday celebrated the 72nd death anniversary of Mahatma Gandhi at the district headquarters town. Collector SK Mohapatra paid floral tribute to Father of the Nation at his statue at the Jagatsinghpur police station premises and addressed the gathering. Similarly, the Gandhi death anniversary was celebrated at Swadhinata Sangrami Smruti Bhawan here, where veteran freedom fighter Madhabananda Monahari chaired the event. Lawyer Muralidhar Sahoo, scribe Sasanka Sekhar Panda, Abhimanyu Swain and Dwarika Nath Mohapatra, among others, joined.

Biridi Cong leader Mohanty remembered

Jagatsinghpur: The Biridi block Congress unit held a remembrance meeting of late leader Nanda Kishor Mohanty who died two weeks ago following prolonged illness. Mohanty hailed from Bagalpur village under Biridi block and was a former president of the Alaka Mahavidyalaya and former president of Biridi block Congress. Leaders like Lingaraj Malla, Deviprasanna Tripathy, Biridi block Chairman Padmanav Behera and lawyer Deepak Pasayat, among others, were present.

Bandar Mazdoor Sangh office-bearers elected

Paradip: Elections of office-bearers of the Bharatiya Bandar Mazdoor Sangh (BBMS), Paradip were held on Wednesday. Social worker Rakesh Kumar Pattnaik was unanimously elected as president. Senior labour leader Dolagobinda Dash, Pabitra Mohan Mishra, Trigunatita Biswal, Mahendra Nayak, Bhabendra Dash and Kirtichandra Dash were elected as general secretary, vice-president, assistant secretary, organisation secretary and treasurer, respectively. Pabitra Singh, Bikash Chandra Sahoo, Devi Prasanna Majhi, Satyanand Jena, Purnachandra Majhi, Laxmidhar Panda, Bikram Parida and Babul Behera were elected as executive body members.

‘Udayabata’ celebrates Republic Day

Jajpur Road: The ‘Udayabata’ magazine celebrated the 71st Republic Day at the Durlabh Kala Parishad Mandap here. Former TISCO officer Upendranath Mohanty hoisted the Tricolour. Durlabh Kala Parishad artists Bharat Bhusan, Kalinga Keshari and others sang the National Anthem and other patriotic songs. A meeting was organised under chairmanship of Bidyutprava Ray. Dr Akshaya Panda, Basant Patra, Prafulla Barik, Rasmikant Pandit, Pradeep Barik, Suman Ray, Sumitra Mishra, Debendra Mallick and Samir Mishra spoke about the significance of the day.

JSPL TRB Mines wins JIPM's Award

Bhubaneswar: TRB Iron Ore Mines, Tensa, of the Jindal Steel and Power (JSPL) has won the prestigious TPM Excellence Award for the second time from Japan Institute of Plant Maintenance (JIPM), Tokyo, Japan. The 'Award for Excellence in Consistent TPM Commitment' would be conferred on in March in Kyoto, Japan, recognising the mines' consistency in successfully adopting TPM in its operation.",state-editions,https://www.dailypioneer.com/images/logo.jpg,https://www.dailypioneer.com/2020/state-editions/in---brief-in---brief-2020-02-01.html
119,01-2-20,UAIL mine holds Mineral Conservation Week,"The 22nd Mines Environment and Mineral Conservation Week – 2019-20 was celebrated by Baphlimali Bauxite Mine of UAIL under the aegis of Indian Bureau of Mines (IBM), Bhubaneswar region.

The programme was inaugurated at Baphlimali Mines by its Head Mukesh Kumar Jha with hoisting of MEMC flag. Subsequently, oath taking was done to clean the environment and conserve the natural resources. The awareness programme was celebrated at mines by conducting different activities among employees, stakeholders and workers. On the occasion, Baphlimali mines was inspected by the Inspection Team convener KK Sahoo, GM- Mines, M/s Penguin Trading and Agencies and the team members CK Rath, Manager Mines, M/s. Shri Probodh Mohanty and Manoj Pattanaik, Manager (Geo), M/s MGM Minerals. An awareness skit was performed on the inspection day.

The programme was coordinated by mines team under the guidance of Jha, KC Jyotishi, Head- Geology and Sukanta Mahapatra, Head, Mines Administration.

UAIL Unit Head and president NNagesh congratulated the team mines on successful completion of the week.",state-editions,https://www.dailypioneer.com/images/logo.jpg,https://www.dailypioneer.com/2020/state-editions/uail-mine-holds-mineral-conservation-week.html
120,01-2-20,‘Leprosy can be eradicated easily',"Leprosy Eradication Day and Martyr’s Day, recounting Mahatma Gandhi , was observed on Thursday here. As chief guest Jharsuguda district Collector Saroj Kumar Samal laid wreath in the photo of Gandhi and lit candle. A two-minute silence was observed.

Speaking on the occasion, Collector Samal said Leprosy patients were not subject of hatred rather they could be treated well amid their friends and relatives.

On diagnosis the patients can be completely cured by taking medicine for six months only, he added. Besides Samal laid stress on regular health check-ups and use of medicines.

On the occasion, the district Collector felicitated president of Association of Peoples Affected by Leprosy (APAL) Umesh Chandra Nayak and others working in the field of leprosy eradication with trophies and certificates.

The programme was coordinated by District Social Security Officer Susila Kiro. CDMO Jagdish Chandra Barik discussed aims and objectives of observation of the day. Barik garlanded the bust of Gandhiji. An awareness procession was held from Beheramal Kisan Chhak to the Collectorate.",state-editions,https://www.dailypioneer.com/images/logo.jpg,https://www.dailypioneer.com/2020/state-editions/---leprosy-can-be-eradicated-easily-.html
121,01-2-20,Hundreds of turtle carcasses along Paradip beach,"Locals as well as tourists at Paradip beach here were taken aback after they found carcasses of hundreds of Olive Ridley turtles spread along the coastline on Friday morning.

Sources said the Olive Ridley turtles were found dead on the beach from Hanuman temple to Paradip Oil Refinery south gate Thursday night. This has triggered discontentment among tourists and environmentalists.

They alleged that despite restriction, many fishermen were venturing into sea for which the rare turtles died after being injured by trawlers. They demanded that the Forest officials and the Fisheries Department take the incident seriously and initiate action in this regard.

Worth mentioning, fishing by motorized vessels or trawlers and mechanized techniques has been banned within 20 km from the specified coast of the sea comprising sea turtle congregation area and their buffer zones in 3 river mouths namely Dhamra river mouth, Devi river mouth and Rusikulya river mouth. The ban imposed on November 1 is in force till May 31.

On January 27, Forest officials had apprehended 19 fishermen for illegal fishing in Gahirmatha Marine Sanctuary and seized two trawlers and eight quintal fish from them.",state-editions,https://www.dailypioneer.com/images/logo.jpg,https://www.dailypioneer.com/2020/state-editions/hundreds-of-turtle-carcasses-along-paradip-beach.html
122,01-2-20,Techno-mgmt fest ‘Wissenaire’20’ begins,"The three-day 10th edition of techno-management fest ‘Wissenaire'20’ of the Indian Institute of Technology (IIT), Bhubaneswar on the theme ‘Cosmic Expeditions: Astounding Odysseys Ensuring Humanity’s Existence’ was inaugurated here on Friday.

Former Defence Research and Development Organization (DRDO) Director General (Life Sciences) Dr Manas Kumar Mandal inaugurated the fest and emphasised the potential of new age space technologies in solving some of the crucial challenges associated with manned space missions.

He also mentioned that the Wissenaire’20 is an event which can provide a sneak peek into the present and future of the technological world.

IIT BBS Director Prof RV Raja Kumar said that the three-day fest which brings the best of technological minds together would definitely lead to fruitful outcomes that would benefit the society. “I wish a fruitful time for the participants and congratulate the organising team of Wissenaire’20”, added Prof Kumar.

The fest would include exhibits from the DRDO and ISRO, the Indian Army and various other gadgets and innovations along with a series of talks on the second day tagged “TekNite” and a stand-up session by stand-up comedian Shashwath Maheswari.

Central events include ‘YANTHRIX’ the robotics events and competitions and workshops on IOT, web development, mercedes engine analysis, bridge design etc, said Wissenaire’20 Chairman Dr SR Kannan.",state-editions,https://www.dailypioneer.com/images/logo.jpg,https://www.dailypioneer.com/2020/state-editions/techno-mgmt-fest----wissenaire---20----begins.html
123,01-2-20,JSpur Dalits seek fresh probe in rape case,"Members of the Jagatsinhpur unit of the National Confederation of Dalit Organisations staged a dharna in front of the SP office here on Friday, demanding proper investigation in the Tentai Dalit girl rape and murder case and action against the IIC of the Naugaon police station.

Organissation Sate head Ashok Mallick led the agitation participated by hundreds of Dalit men and women from across the district. The protestors claimed that Dalit girl Laxmipriya Das of Tentai village had been raped by an upper-class man from the same village. The accused then exhibited a few nude photos of the victim in village outskirts. Unable to tolerate social stigma, the girl committed suicide three months back.

Dissatisfied at the investigation conducted by the Naugaon police, kin of the deceased later approached National SC/ST Commission. Thereafter, commission member Yogendra Paswan visited Tentai village, met victim’s family and instructed police to expedite the probe. But police have not taken any action till date, alleged Mallick.

“We urge police to respond to the National SC/ST Commission instruction and restart the probe. Action should be taken against the IIC who was conducting the case,” demanded Mallick.

The agitators withdrew the dhrana after SP Prakash R discussed with them and assured them of all possible actions.",state-editions,https://www.dailypioneer.com/images/logo.jpg,https://www.dailypioneer.com/2020/state-editions/jspur-dalits-seek-fresh-probe-in-rape-case.html
124,01-2-20,SBI Life holds mega insurance meet,"The SBI Life Insurance organised a congregation of Life Mitras (Life Insurance Agents) in Cuttack and Bhubaneswar which was attended by 2,700 Life Mitras.

The congregation deliberated on the opportunities and challenges faced the life insurance sector, discussions around various technological advancements that brought in the required change in the sector followed by motivational speeches boosting the confidence of the practitioners.

SBI Life Zone-III President Ravindra Kumar and Bhubaneswar region Regional Director Amit Saha, motivational speaker Shahsikant Pedwal, Odia cine stars Archita Sahu and Sabyasachi Mishra attended the event.

The convention featured invaluable breakout sessions delivered by thought-leaders and sector experts who offered professional advice and rich entertainment, along with innovative ideas, realistic solutions and the platform provided excellent networking opportunities.",state-editions,https://www.dailypioneer.com/images/logo.jpg,https://www.dailypioneer.com/2020/state-editions/sbi-life-holds-mega-insurance-meet.html
125,01-2-20,3 PFI activists held in connection with violence during protest in Lucknow,"Three members of the Popular Front of India (PFI) were arrested on Friday for their involvement in the December 19 anti-CAA protests in Lucknow which had turned violent, police said.

Shakeel ur Rehman, Shabi Khan and Mohammed Arshad were among the conspirators behind the anti-Citizenship (Amendment) Act violence that had rocked the State Capital, a police spokesperson said in a statement issued here.

The trio were held from Hasanganj Police Station area of the city.

“They were arrested following a tip-off by their associates who were arrested earlier. Shakeel ur Rehman, Shabi Khan and Mohammed Arshad are linked to PFI, and they used to instigate people,” the police said.

On December 31, last year, the Uttar Pradesh Police had sought a ban on the PFI, days after its complicity was suspected in the recent statewide violent protests against the amended citizenship law.

The then Uttar Pradesh Director General of Police O P Singh had said that they had written to the Union Home Ministry, seeking a ban on the PFI after its Uttar Pradesh head, Wasim and 16 other activists were arrested for allegedly masterminding the violence in the state capital.

“We have written to the Union Home Ministry, recommending that the PFI should be banned,” Singh had told reporters here.

Deputy Chief Minister Keshav Prasad Maurya had said that the PFI in a way was the “incarnation” of the Students Islamic Movement of India (SIMI) — an organisation banned by the government in 2001 for allegedly being involved in a series of terror acts in the country.

Stressing that PFI’s role has been “established” in vandalism in the State, Maurya had told reporters: “The truth is emerging through the probe. If SIMI reappears in any form, it will be crushed.” When asked if the PFI will be banned, Maurya said, “The process is on. Such organisations will not be allowed to grow. If needed, they will be banned.”",india,https://www.dailypioneer.com/images/logo.jpg,https://www.dailypioneer.com/2020/india/3-pfi-activists-held-in-connection-with-violence-during-protest-in-lucknow.html
