,Date,Title,Article,Category,Image_link,Article_link
111,24-2-20,‘Bagheli Gayan’ ‘Rajasthani Folk Dance’ held at MP State Tribal Museum,"The “Bagheli Gayan” and “Rajasthani Folk Dance” were performed on Sunday at Madhya Pradesh State Tribal Museum. The performances were held under Uttaradhikar series.

The programme started with the popular song Devi Geet of Baghel Khand. The song is performed in the devotional spirit of Goddess Sharda in the auspicious month of Navratri.

When everything is green during the rainy season after worshiping the song Kajri, Lord Bhole Nath, this song is presented by the people of Baghelkhand expressing their happiness in such a cheerful month. This folklore is considered important in the tradition of marriage rites in Sohag song and through this song the Bagheli society performs the wedding ceremony with its customs and rites.

Vikas Geet is inspired by his love for the soil of the village, which describes the yield of grain through the toil of farmers. This congratulatory song is presented on the occasion of the birth anniversary of Lord Krishna. Buriyaye Mahadev Vairagi in Holi song. This song mentioned on Lord Shiva is enjoyed on Holi festival in the month of Falgun and is presented with full enthusiasm.

Audiences were delighted by the performance by Mamta Mishra and fellow singing 'Bagheli Gayan' on stage. Mamta has been performing traditional songs of Baghelkhand since childhood. He has so far performed on many forums in the country.

The next performance was 'Rajasthani Folk Dance'. The artists first performed Chari dance which is a welcome dance. It is performed in honour of the kings who returned to their kingdom after victory in battle. In which the women of the house perform this dance while welcoming the island.

Next performance was Ghoomar. In Ghoomar dance, the women of the Rajput family of Rajasthan perform this dance in a happy moment. It was followed with Bhavai Dance.

This dance is performed by men in which the dance is done by balancing the dancers by placing a pot filled with water over the glass on the head. This dance is usually performed by male artists from rural areas.

Later, artists performed Kalbeliya dance. This is performed by a community of Rajasthan who are snake charmers, this dance is performed by the women of this community.

According to the belief of the community, their ancestors were considered to be worshipers of snakes while maintaining their family through snakes. In this, women perform dance like a snake.

Gulabo Sapera's directorial line-up and the dancing skills of the artists gave delightful performances leaving the audience enthralled.",state-editions,https://www.dailypioneer.com/images/logo.jpg,https://www.dailypioneer.com/2020/state-editions/---bagheli-gayan-------rajasthani-folk-dance----held-at-mp-state-tribal-museum.html
112,24-2-20,Life story of Kashmiri legendary poet Habba Khatoun retold through ‘Zoon’,"The life story of Kashmiri legendary poet Habba Khatoun was retold through a play “Zoon”. The play was staged at Bharat Bhavan on Sunday, marking the grand closure of 38th foundation anniversary.

Written and directed by Purva Naresh, the play is set in two eras 16th century and the present day, the play unravel the love story of the poet, originally named Zoon, and Yousuf Shah Chak, the warrior king of Kashmir, who she eventually marries.

The year is 1570. Yousuf Shah Chak, the warrior king of Kashmir captivated by a peasant girl, falls in love with the beauty of her voice and the richness of her rhyme. She is Zoon (the moon). They marry against all odds. Their love, destined to be short lived, is thwarted by a jealous Akbar, the great emperor. Renamed Habba Khatoun, she goes on to become the legendary last poet queen of Kashmir.

In 2019, in a maidaan somewhere in Kashmir, the stage is set for a dramatic retelling of Zoon's legendary tale.

Five young college students wait to be assigned their roles for the show. Why have they caught the attention of a soldier stationed nearby? In another corner a mysterious woman sits silently. Who is she and what is she doing there? Little do they all know that the drama will unfold before anyone even gets onto stage.

As Kashmir’s past and present collide through the richness of song and poetry, be enthralled by this compelling and dramatic reinterpretation of the story of Zoon, the nightingale of Kashmir.

The director uses the device of a play within a play for the dramatic retelling of Habba Khatoun’s tale. Her poems and writings gave voice to the ordinary man and woman of Kashmir.",state-editions,https://www.dailypioneer.com/images/logo.jpg,https://www.dailypioneer.com/2020/state-editions/life-story-of-kashmiri-legendary-poet-habba-khatoun-retold-through----zoon---.html
113,24-2-20,NCERT syllabus will be implemented in Govt schools in phased manner: Min,"Minister for School Education, Prabhuram Chowdhary, said that NCERT syllabus will be implemented in Government schools in a phased manner. He informed that examinations of class 5th and 8th in the State have been started on the lines of board examinations. Innovations like copy-checking, continuous inspection, interaction with parents are yielding good results in school education.

Chowdhary was addressing the students after dedicating the newly constructed Government higher secondary school building built at a cost of Rs 1.75 crore in Banwari village of Narsinghpur district.

Minister Chowdhary said that only good education system will ensure progress of students and state. For this, training is being given to the teachers and various facilities are also being provided to them. He said that we are making efforts so that the state should become an example in the field of education in the country. He called upon the teachers to discharge their duties with honesty and dedication for the bright future of children.

Chowdhary further informed that 100 bed hostel has been sanctioned for Utkrisht Vidyalaya of Saikhera village. Under this, boys hostel costing Rs 3.85 crore and girls hostel costing Rs 3.86 crore will be constructed. In the programme, he felicitated teachers for their outstanding works and also performed Bhumi-Pujan of sports ground.

The Former Member of Parliament Rameshwar Nikhra, MLAs Sunita Patel and Sanjay Sharma, Former MLA Deendayal Dhimole as well as Administrator of District Cooperative Bank Maithilisharan Tiwari also addressed the programme. On this occasion, Former MLA Suresh Rai, Member of Jila Panchayat Pradeep Patel and other public representatives were also present.",state-editions,https://www.dailypioneer.com/images/logo.jpg,https://www.dailypioneer.com/2020/state-editions/ncert-syllabus-will-be-implemented-in-govt-schools-in-phased-manner--min.html
114,24-2-20,"Uddhav, kin to seek Ram Lalla’s blessings in Ayodhya","The day Maharashtra government completes 100 days in office (March 7), Chief Minister Uddhav Thackeray, along with his ministerial colleagues and family members, will visit Ayodhya to seek the blessings of Ram Lalla.

The Maharastra CM, to be accompanied by his wife and son along with state ministers and other Shiv Sena leaders, would directly reach Ayodhya from Mumbai on March 7 morning, Shiv Sena officials said on Sunday.

The Maharashtra CM and others will also have darshan of Hanumangarhi and other temples besides meeting saints during the day-long stay in the temple city.

After the Supreme Court gave its judgement on Ram temple on November 9 last year, Uddhav had announced to visit Ayodhya. However, his strained ties with the BJP after the Maharashtra assembly polls and formation of his government in alliance with the NCP and Congress delayed his visit.

“It will be a thanksgiving visit when Uddhav Thackeray pays obeisance to Ram Lalla,” a senior Shiv Sena official in Lucknow said.

Uddhav had last visited Ayodhya on June 16, 2019 along with 18 party MPs after the win in Lok Sabha polls. During that visit, he had predicted that the Ram temple would be constructed during the tenure of Prime Minister Narendra Modi. At that time, both the parties — BJP and Shiv Sena — were in alliance and he had praised Modi’s leadership.",state-editions,https://www.dailypioneer.com/images/logo.jpg,https://www.dailypioneer.com/2020/state-editions/uddhav--kin-to--seek-ram-lalla---s--blessings-in-ayodhya.html
115,24-2-20,"UP to be free from virus-orne diseases by 2025, says Yogi","Chief Minister Yogi Adityanath declared that Uttar Pradesh would be made free of tuberculosis, filaria and all virus-borne diseases so that Prime Minister Narendra Modi’s dream could be realised by 2025.

After inaugurating he Arogya Mela at Surya Kund in Darshan Nagar in Ayodhya on Sunday, the Chief Minister said that the state government had started ‘Mukhyamantri Arogya Mela’ from February 2 so as to ensure better health services to the people. It was the fourth Arogya Mela organised in the state.

Chief Minister Yogi said that the programme was started simultaneously to achieve the goal of health through 4,000 primary health centres and wellness centres within the state.

He said if all the people became aware and committed to bringing the schemes of government to the poor, no poor would die due to lack of medicines, because Prime Minister Modi introduced Ayushman card.

“Every person should get the golden card of Ayushman made. Those who have got the cards are getting health insurance up to Rs 5 lakh per year. This programme (through Aarogya Mela) is essentially being extended on a war-footing,” he said.

“By 2025, we have to make India free of TB, filaria and all virus-borne diseases. This programme also has to be taken up by us and for that, ‘Arogya Mela’ is a big boon,” he said.

The CM said that during the last three years, several programmes of health awareness were conducted in the state.

“From 1947 to 2016, there were only 12 medical colleges in the state. Our government laid the foundation of 28 medical colleges in the state in just three years between 2016 and 2019. Seven medical colleges have been started, including the Medical College at Ayodhya, while 13 medical colleges will be built. Medical colleges will be built in places where there are none. Better health facilities will be available in every district,” the CM said.

“We are all grateful to Prime Minister Narendra Modi who delivered what he promised. Today, under the leadership of Prime Minister Modi, India is emerging as a power in the world. Prime Minister Modi abrogated Article 370 in Jammu & Kashmir and prohibited the practice of triple talaq. He amended the citizenship law to create a completely transparent system of giving shelter to the suffering humanity of the world, and under his strong leadership, a way has been paved for the construction of grand temple of Bhagvan Shri Ram in Ayodhya,” the CM said.",state-editions,https://www.dailypioneer.com/images/logo.jpg,https://www.dailypioneer.com/2020/state-editions/up-to-be-free-from--virus-orne-diseases--by-2025--says-yogi.html
116,24-2-20,Youth ends life,"Feeling harassed over prolong illness, a 22-year-old youth committed suicide by jumping in front of a moving train at Chetak Bridge area in the night of Saturday. Medicines have been recovered from youth’s bag, said MP Nagar police.

A suicide note was recovered from the belonging of the deceased identified as Krishna Dutt Sharma which he kept near the railway tracks before committing suicide in the night on Saturday.

According to MP Nagar police, the deceased was a resident of Agra. On Saturday night, he committed suicide after leaving hotel in which he stayed from Friday to Saturday afternoon. In his suicide note, he mentioned that he came to Bhopal for a job and would return to Agra.

The family members were contacted by the police in which they found that youth was suffering from severe illness. His kidneys were not functioning and medicines in the bag which was found were for treatment for kidney.

In the night at around 9, the police received information about a body lying near Chetak Bridge railway track.

A team of police reached the spot and the body was sent for post-mortem

A case under section 174 of the CrPC has been registered by the police and the investigation has been initiated.",state-editions,https://www.dailypioneer.com/images/logo.jpg,https://www.dailypioneer.com/2020/state-editions/youth-ends-life.html
117,24-2-20,UP govt issues notice to Sonbhadra mining officer,"The Uttar Pradesh government has issued a notice to the mining officer of Sonbhadra for issuing official statement about the discovery of around 3,000 tonnes of gold in the district even as the report was junked by the Geological Survey of India (GSI).

Mining officer KK Rai had earlier claimed that the GSI and UP Mining department had discovered around 3,000 tonnes of gold at Sone Pahadi and Hardi village area in Sonbhadra.

“Some newspapers had carried the statement of Rai. The government has issued a notice asking him about the source of his information about the discovery of gold and why he spoke to the media without taking permission from his seniors,” a government official told The Pioneer on Sunday.

He said the mining official had been given a week’s time to submit his answer. “Government believes that wrong information has sent a bad message and raised expectations that India may become ‘sone ki chidiya’ once again,” he said.

Excavation of gold has always been a big news in Uttar Pradesh. In 2016, a hermit, Shobhan Sarkar, had claimed that gold could be found in Dondiya Kheda village in Unnao district. Excavation was carried with the help of ASI but it proved to be an exercise in futility.

Earlier, the mining officer of Sonbhadra had disclosed that the gold was estimated to be around 3,000 tonnes at Sone Pahadi and Hardi village area. But the GSI clarified that it had not estimated such vast resource of gold deposit in Sonbhadra district. The northern region of GSI has carried out several exploration works for gold but the results have not been encouraging.

“The exploration was carried out in 1998-99 and 1999-2000 and in the report, it had estimated a probable category resource of 52806.25 tonnes of ore with 3.03 grams per tonne for a strike length of 170 metres in Sone Pahadi area of Sonbhadra district,” GSI director and PRO Ashish Kumar Nath said in a press statement.

It was clarified that the total gold which could be extracted from the total resource of 52806.25 tonnes of ore was approximately 160 kg and not 3,350 tonnes, as mentioned in media reports.

The work for finding gold reserves in Sonbhadra started in the year 1992-93 after the Central Geological Survey of India took over. Reportedly, it was the British who first initiated the process to find gold reserve in Sonbhadra region.",state-editions,https://www.dailypioneer.com/images/logo.jpg,https://www.dailypioneer.com/2020/state-editions/up-govt-issues-notice-to--sonbhadra-mining-officer.html
118,24-2-20,Sunni Waqf Board to meet today,"Uttar Pradesh Sunni Central Waqf Board will meet in Lucknow on Monday to decide whether to accept the five acres of land allotted by the UP government for construction of a mosque in Ayodhya.

The Supreme Court, in its verdict on November 9 last year, had directed the government to allocate an alternative land at a prominent location in Ayodhya for the construction of a mosque.

“The board may also announce a trust for construction of a mosque. The trust can be named Indo-Islamic Culture Foundation,” sources said. They said the board would not only decide whether to accept the land but also about the usage of the land if it decided to take possession. There are several proposals like building a hospital or school at the site.

The Uttar Pradesh government has allotted a 5-acre plot for the mosque at Dhannipur village in Sohawal tehsil of Ayodhya district, nearly 25 kilometres away from the Ram Janmabhoomi temple complex. Litigants in the Babri case said that the land allotted by the UP government was far away from Ayodhya town and the government should find some other land at a closer location, otherwise they would be left with no alternative but to approach the Supreme Court once again.

“The site for the mosque is too far from Ayodhya. It will be difficult for people to go that far to offer Namaz. The decision should be reconsidered and the land must be allotted at a nearby place,” Haji Mahboob, one of the litigants, said.

In a historic decision, the Supreme Court had on November 9 last year directed the Central government to hand over the disputed site at Ayodhya for the construction of Ram temple and set up a trust for the same.

The apex court had also directed the government to give a suitable plot of land measuring five acres to the Sunni Waqf Board.",state-editions,https://www.dailypioneer.com/images/logo.jpg,https://www.dailypioneer.com/2020/state-editions/sunni-waqf-board--to-meet-today.html
119,24-2-20,Bank manager charged with violent and abusive conduct,"A bank manager in Indore has been charged with violent and abusive conduct after forcing his way into a girls' hostel on Friday night and beating up and verbally harassing students.

Amarjeet Singh, 45, an employee at a private bank, was arrested on Sunday morning for assaulting an MBA student in a shocking incident of moral policing in the city's Bhanwar Kuan area.

The hostel resident alleged that Amarjeet Singh frequently targeted them by stalking, staring and hurling verbal abuses. Police say he has been booked under multiple sections of the Indian Penal Code, including those related to trespassing and assault.

“On Friday, evening some friends of ours came to meet us outside the hostel. We were talking there, outside the hostel gates. When the accused came forward and attacked our friends.

There was some violence and then he followed us inside the hostel,"" one of the residents said.

In a video of the attack Amarjeet Singh, wearing a blue t-shirt, can be seen thrashing a young girl amid cries of alarm from her friends.

Violence and abusive conduct of the accused towards young college girls inside a private hostel premises in the name of moral policing in Indore, went viral on social media.

On the evening of the attack, Amarjeet Singh's 67-year-old mother had objected to residents of the girls' hostel speaking to male friends outside hostel gates. As per the family of the accused, one of the girls allegedly pushed the mother to the ground, sparking the brawl.

The residents' association also objected to the number of unregulated hostels in the area.

""The accused, Amarjeet Singh, resides near the hostel. He had objections to some boys and girls talking outside the hostel.

This led to an argument following which the accused fought with the boy. Later on, he went inside the hostel and beat up the girl student,"" said Sanjay Shukla, the SHO.",state-editions,https://www.dailypioneer.com/images/logo.jpg,https://www.dailypioneer.com/2020/state-editions/bank-manager-charged-with-violent-and-abusive-conduct.html
120,24-2-20,Prez Kovind: Role of judiciary to be crucial in coming days,"President Ram Nath Kovind said that the role of the judiciary is bound to be pivotal amid dramatic transformations in the coming days.

In his address at the International Judicial Conference being organised by the Supreme Court on Sunday, Kovind said that issues like gender justice, contemporary perspectives on protection of constitutional values, dynamic interpretations of the Constitution in a changing world, harmonisation of environment protection vis-a-vis sustainable development and protection of the right to privacy in the Internet age are issues that influence every member of the global community.

These five distinctly defined topics cover the matrix of challenges faced by the judiciary across the world, he said.

The President praised the Supreme Court for carrying out ""radical reforms"" which, he said, made justice more accessible to common people. He cited landmark judgements passed by the apex court which have strengthened the legal and constitutional framework of India.

""Its bench and bar are known for their legal scholarship and intellectual wisdom. What it has achieved is nothing less than a silent revolution in diagnosing and correcting the afflictions that adversely affected the justice delivery system,"" he said, as per a press note.The President particularly mentioned the role of Supreme Court in making the higher courts' judgments available in regional languages, terming it ""an extraordinary achievement given the linguistic diversity of India"".

As of now, the judgments of the Supreme Court get translated in up to nine Indian languages to make them accessible to common people.

Kovind expressed confidence that its scope would further widen in the future.",india,https://www.dailypioneer.com/images/logo.jpg,https://www.dailypioneer.com/2020/india/prez-kovind--role-of-judiciary-to-be-crucial-in-coming-days.html
121,24-2-20,India looks forward to welcoming Trump: PM,"On the eve of US President Donald Trump's India visit, Prime Minister Narendra Modi said on Sunday that India looks forward to welcoming the US President, who is to commence his ""historic programme"" from Gujarat.

The US president will be on a two-day visit to India and together with Modi is to participate in a roadshow in Ahmedabad after landing there.

""India looks forward to welcoming @POTUS @realDonaldTrump. It is an honour that he will be with us tomorrow, starting with the historic programme in Ahmedabad,"" Modi wrote on Twitter.

He was responding to a tweet by Gujarat Chief Minister Vijay Rupani that said ""entire Gujarat speaks in one voice- #NamasteTrump"".

On Monday, President Trump and Prime Minister Modi will take part in a 22-km roadshow from the Ahmedabad international airport. Then they will proceed for the 'Namaste Trump' event at the newly built Sardar Patel Stadium in the city's Motera area, where over one lakh people are expected to be present.

The US President will visit Sabarmati Ashram in Ahmedabad on Monday before heading towards a cricket stadium where he will address over 1,00,000 people.

Sabarmati Ashram was a key base of Mahatma Gandhi during the freedom struggle. He lived there between 1917 and 1930. The US president will later fly down to Agra to visit Taj Mahal and thereafter fly to Delhi for the official engagements where ""major trade deals"" are expected to be signed by the two sides.

On the morning of February 25, the US president and first lady Melania Trump will be accorded a ceremonial welcome at the forecourt of the 'Rashtrapati Bhavan'. From there, they will go to Raj Ghat to pay homage at the 'samadhi' of Mahatma Gandhi. It will be followed by restricted and delegation-level talks between Trump and Modi at Hyderabad House. 'Namaste Trump' will be similar to the landmark 'Howdy, Modi!' event hosted by the Indian-American community in honour of Prime Minister Modi during his visit to Houston in September 2019, said an official. Trump, accompanied by wife Melania, daughter Ivanka and son-in-law Jared Kushner, will arrive in Ahmedabad around noon on Monday for a little less than 36-hour-long trip to India.

Other members of the US president's delegation include Treasury Secretary Steven Mnuchin, Commerce Secretary Wilbur Ross, National Security Adviser Robert O'Brien and Energy Secretary Dan Broulliette.

From Ahmedabad, the US President is to fly to Agra where huge billboards on streets near the city airport and public squares in the vicinity of the Taj Mahal greeting him have come up ahead of his visit.

Trump's convoy route from the airport to the Taj Mahal is about 13 km and along the way thousands of artistes will welcome him with special performances.

On the famous Mall Road, which falls on the route, one hoarding reads 'His Excellency Donald J Trump, President of the United States of America, Heartiest Welcome to the Land of Krishna'. It is accompanied with an image of Trump standing next to Prime Minister Narendra Modi. Trump is to reach Agra in the Monday evening.",india,https://www.dailypioneer.com/images/logo.jpg,https://www.dailypioneer.com/2020/india/india-looks-forward-to-welcoming-trump--pm.html
