,Date,Title,Article,Category,Image_link,Article_link
181,24-2-20,Let it bee,"Backyard gardeners can act to help bee populations

Chemicals are routinely applied around residential landscapes to kill insect pests and troublesome weeds but many are indiscriminate and devastate pollinators in the process.

Over the past 30-plus years, pollinator populations have crashed worldwide due to a variety of reasons, including pesticide and herbicide exposure, invasive pests and diseases, loss of habitat, loss of species and genetic diversity and a changing climate, scientists say.

Pesticide contamination of lawns, gardens and waterways is widespread, and even at sub-lethal levels can impact pollinators’ foraging ability and hive productivity. “Honeybees are not the most impacted of pollinators,” said Katie Buckley, pollinator coordinator with the Washington State Department of Agriculture. “Once-common butterfly and native bee species have become rare, with some on the verge of extinction.”

The rusty patched bumblebee, island marble butterfly, Taylor’s checkerspot butterfly and the familiar monarch butterfly were among those singled out by Buckley as greatly depleted.

Pesticides are over-applied by many backyard gardeners, said James Dill, a pest management specialist with University of Maine Extension. “They don’t read the labels, or they eyeball the amounts,” Dill said. “Sometimes, if maybe an ounce is called for, they’ll use two ounces. They often will use a calendar spray schedule or just spray because they had a problem in the past.”

But well-informed gardeners can be a big help in reversing the pollinator declines, especially those caused by chemical poisoning. “In general, the best defense is to avoid spraying plants that are in bloom, use pesticides that have a short half-life when possible and use pesticides with low toxicity to bees and other beneficial insects,” Buckley said. “Whether as a farmer or a homeowner, it is critical to always read and follow the label.”

Clothianidin, dinotefuran, imidacloprid and thiamethoxam are highly toxic to honeybees by contact and ingestion, according to the Environmental Protection Agency’s toxicity classification scale for bees. Thiacloprid and acetamiprid are moderately toxic, the federal agency says. If you keep bees, finding the right apiary location is an important way to reduce pesticide exposure.’ Keeping colonies as far away from commercial agriculture as possible (4 to 5 miles) is the safest,” Dill said. “Drive around your area where you intend to keep hives and get the lay of the land so you know what you are dealing with. If you have a large, pesticide-free foraging area with diverse flowering plants nearby, that would be ideal.”

Supplying honeybees with uncontaminated water is also an effective deterrent, said Kevin Jensen, a pesticide management compliance investigator with the Washington State Department of Agriculture. “If the bees do not have a water source in the apiary, they will be forced to look for water elsewhere during the hot months,” Jensen said. “This can result in bees being attracted to an area that is being sprayed, even though that area may not have flowers blooming in it.”

Even pesticides allowed for use in organic agriculture can harm bees and other beneficial insects like flies, beetles, moths and wasps, entomologists say. “Homeowners should avoid using pesticides in backyards and instead use nontoxic methods such as soapy water to get rid of pests such as aphids,” said Ramesh Sagili, an associate professor-apiculture with Oregon State University.",vivacity,https://www.dailypioneer.com/uploads/2020/story/images/big/let-it-bee-2020-02-24.jpg,https://www.dailypioneer.com/2020/vivacity/let-it-bee.html
182,24-2-20,Tsitsipas defends Marseille trophy,"Stefanos Tsitsipas successfully defended his Marseille title on Sunday with a straightforward victory over Felix Auger-Aliassime.

Greek star Tsitsipas eased to a 6-3, 6-4 win to leave Felix still waiting for his maiden ATP title after his fifth final defeat.

Tsitsipas, who had arrived in southern France with a 3-4 losing record this season, enjoyed an emphatic return to form as he clinched his fifth ATP trophy.

“I did well mentally,” said Tsitsipas. “I didn’t crack when I was under pressure.”

Auger-Aliassime would have been confident of finally ending his wait for tournament success after two wins from his three previous meetings with Tsitsipas, but has still failed to even win a set in his five Tour-level finals.

“Playing a final is wonderful, you have to have that perspective, remember that everything is going in the right direction despite everything,” said Auger-Aliassime.

“It’s heavy, losing every time in the final. There is a little doubt... when will it be my turn?”

World number six Tsitsipas, the ATP Finals champion, broke in the third game and saved three break points to serve out the opening set. The second seed got the better of a run of three successive breaks in the second set to move 4-3 in front and only dropped one more point on serve.

He will now travel to the UAE for the Dubai C’ships, where he is second seed behind number one Novak Djokovic.",sports,https://www.dailypioneer.com/images/logo.jpg,https://www.dailypioneer.com/2020/sports/tsitsipas-defends-marseille-trophy.html
183,24-2-20,"Sharath, Sathiyan settle with Silver","Indian men’s doubles pair of Achanta Sharath Kamal and Gnanasekaran Sathiyan settled for a Silver medal at the ITTF World Tour Hungarian Open after losing the summit clash to German combination of Benedikt Duda and Patrick Franziska.

The Indian pair, which defeated top seeds Ho Kwan Kit and Wong Chun Ting of Hong Kong 3-2 in the semi-finals, put up a strong effort in the summit clash but eventually went down fighting 5-11, 9-11, 11-8, 9-11 to the 16th seeds German pair in a 30-minute showdown on Saturday.

It is Sharath Kamal’s second medal from the prestigious tournament. He also won a Bronze with Manika Batra in mixed doubles.",sports,https://www.dailypioneer.com/images/logo.jpg,https://www.dailypioneer.com/2020/sports/sharath--sathiyan-settle-with-silver.html
184,24-2-20,singles,"Fury crushes Wilder in WBC Rematch

Las Vegas: Tyson Fury reigns again as a heavyweight world champion after battering Deontay Wilder to a stunning seventh-round stoppage in their World Boxing Council title rematch. Fourteen months after their dramatic split-decision draw, Britain's Fury dominated the American champion — who had blood dripping from his left ear and leaking from his mouth when referee Kenny Bayless called a halt as Wilder's corner threw in the towel. “The king has returned to the top of the throne,” said Fury, who had dropped Wilder in the third and fifth rounds as he remained unbeaten while handing Wilder the first defeat of his career.

Nishioka reaches Delray Beach final

Miami: Unseeded Yoshihito Nishioka of Japan rallied for a 1-6, 6-4, 6-0 victory over sixth-seeded Ugo Humbert to reach the ATP Delray Beach final. Nishioka, apparently refreshed by a second rain delay, roared through the final set to advance to his second career final. He won his only prior title match at Shenzhen in 2018.

Thiem thwarted in bid to pass Federer

Rio De Janerio: World number four Dominic Thiem of Austria missed a chance to reach a career-best third in the ATP rankings with a Rio Open quarter-final loss to Italy's Gianluca Mager. Mager, a 128th-ranked qualifier playing in only his eighth career tour-level match, defeated 2017 Rio champion Thiem 7-6 (7/4), 7-5 in a match that was halted on Friday by rain. Had Thiem reached the semi-finals in his 2020 clay-court debut, he would have overtaken Roger Federer for third in Monday's ATP rankings.

Goa to host ISL final: Nita Ambani

Mumbai: Margao in Goa will host the final match of this season's Indian Super League on March 14, Football Sports Development Limited's founding chairperson Nita Ambani said. The summit clash will be held at 7:30 pm on March 14 at the Jawaharlal Nehru Stadium at Fatorda in Margao. “Goa deserves to host the ISL final. There is no denying that Goa loves its football and we would like to bring the most crucial football event to the city for the people of Goa,” Ambani said.

WIndies recall Russell for SL T20s

Colombo: West Indies recalled big-hitting all-rounder Andre Russell for their upcoming T20I series against Sri Lanka. The 31-year-old Russell, who played a key part in the Windies' 2016 World T20 triumph, last played internationally at last year's 50-over World Cup and has not featured in a T20I since August 2018. Shimron Hetmyer, who along with fellow batsman Evin Lewis was left out of the ODI squad in Sri Lanka for failing to meet minimum fitness requirements, is also back in the squad. The Windies face Sri Lanka in two games in Kandy on March 4 and 6.

Hansini wins bronze in ITTF event

New Delhi: In her maiden appearance at an International Table Tennis Federation (ITTF) junior circuit event, Chennai's table tennis prodigy, Mathan Rajan Hansini put up an impressive performance by bagging the Bronze medal in the Mini-Cadet Girls' Singles category at the Swedish Junior and Cadet Open in Orebro, Sweden.",sports,https://www.dailypioneer.com/images/logo.jpg,https://www.dailypioneer.com/2020/sports/singles-singles-2020-02-24.html
185,24-2-20,Jitender ensures place in Indian team for Olympic Qualifiers,"Jitender Kumar sealed his place in the Indian team for the Olympic Qualifiers with a Silver medal at the Asian Championship here on Sunday, a result that could slam the Tokyo Games door on veteran Sushil Kumar.

Two-time Olympic medallist Sushil had skipped the continental event citing an injury.

A Gold eluded India on the second day of the men’s freestyle competition with Deepak Punia (86kg) and Rahul Aware (61kg) finishing with Bronze medals.

Up against Kazakhstan’s Daniyar Kaisanov, Jitender showed tremendous defensive skill, but was lacking in attack. The Indian lost 1-3 to the defending champion.

However, his performance was enough to convince the national federation that he should travel to Bishkek, Kyrgyzstan for the Olympic Qualifiers, without a re-trial.

It means that Sushil, who also competes in 74kg, will have to wait and see how Jitender fares in Bishkek, where the finalists will directly qualify for the Tokyo Games.

If Jitender reaches the Gold medal bout there, it will affect the prospect of Sushil, who has been struggling since the 2018 Asian Games.

If Jitender fails to seal an Olympic quota in Bishkek, the last chance would be through a World qualifying event in April.

“I tried one move towards the end but could not execute it properly, it could have got me the Gold. There are improvements in the my game and it could be seen. This Silver is special. Now I will try harder to get Olympic quota,” said Jitender.

His attacking moves from a distance were not good enough to get a good grip on his rivals. Largely, he was defending from standing position.

In fact, in the semifinal against his Mongolian opponent, all three points were scored on passivity and the bouts lacked flare.

Before that, Jitender had won his qualification bout rather easily but just about managed to win his following bouts against Iran’s Mostafa Mohabbali Hosseinkhani (2-2) and Mongolia’s Sumiyabazar Zandanbud (2-1).

“We will not have trials in any category in men’s free style. We will see how our wrestlers perform in Bishkek,” Wrestling Federation of India (WFI) president Brij Bhushan Sharan Singh said.

Much to the disappointment of the home fans, world championship Silver medallist Deepak lost his 86kg semifinal to Japan’s Shutaro Yamada.

His style was identical to Jitender’s and his moves from distance did not yield the desired result.

Against Yamada, the only points he scored from a takedown were removed after a successful challenge from his opponent’s camp.

In the fight for Bronze against Issa Abdulsalam Abdulwahhab Al Obaidi, the Indian looked a different man, winning it easily. He defated his Iraqi rival by technical superiority.

“I had not trained enough because of an injury I suffered during training after I arrived in India from Russia. I had six stitched just above my right eye,” Deepak, who won a Silver at 2019 Worlds, said.

In the non-Olympic 61kg category, Rahul, who won a Bronze at the Worlds in Nur Sultan, paid the price for being overconfident as his unnecessary challenges cost him dearly.

His movement was terrific and so were his attacks but untimely challenges resulted in him losing points in both the quarterfinal and semifinal.

In a fast-paced, high-scoring quarterfinal bout against Uzbekistan’s Jahongirmirza Turobov, Rahul won 11-9, largely because of his superior defence.

The Pune grappler lost his semifinal to Kyrgyzstan’s Ulukbek Zholdoshbekov 3-5.

He won Bronze after downing Iran’s Majid Almas Dastan 4-2 in an exciting bout.

In the 125kg, Satender won his qualification bout but later lost his quarterfinal and repechage rounds.

In the 92kg, Somveer’s challenge lasted just 24 seconds against his Uzbek rival Ajiniyaz Saparniyazov.",sports,https://www.dailypioneer.com/uploads/2020/story/images/big/jitender-ensures-place-in-indian-team-for-olympic-qualifiers-2020-02-24.jpg,https://www.dailypioneer.com/2020/sports/jitender-ensures-place-in-indian-team-for-olympic-qualifiers.html
186,24-2-20,"Naim, Afif back for ODIs","Bangladesh have called up uncapped batsmen Mohammad Naim and Afif Hossain for their 15-man squad for the first two ODIs of a three-match series against Zimbabwe next month.

Naim and Afif have played T20 for Bangladesh, but were not part of the ODI side to be led by pacer Mashrafe Mortaza.

Mashrafe was retained as captain despite concerns over his future, and will lead the side for the first time since the World Cup last year.

Batsman Liton Das and all-rounder Mohammad Saifuddin also return to the ODI side after missing the previous series against Sri Lanka in July.

The first two ODIs against Zimbabwe will be held in Sylhet on March 1 and 3.",sports,https://www.dailypioneer.com/images/logo.jpg,https://www.dailypioneer.com/2020/sports/naim--afif-back-for-odis.html
187,24-2-20,Taliban wants to make peace deal with US: Trump,"The Taliban in Afghanistan are tired of fighting and want to make a peace deal with the US, President Donald Trump said on Sunday as he left for his maiden visit to India during which the two countries will significantly ramp up the defence and strategic ties.

Just before his departure for India, Trump told reporters at the White House that the time had to come for the US troops to ""come home"".

The President said he would sign a peace deal with the Taliban if it worked out over the next week.

""I want to see how this period of a week works out. If it works out over the next less-than-a-week, I would put my name on it,"" he said.

""Time to come home. The Taliban want to make a deal too. They're tired of fighting,"" he said.

Trump's remarks came a day after the US and the Afghan Taliban started a seven-day partial truce ahead of a possible peace deal to end more than 18-year-long war, raising hopes for a resolution to America's longest war.

The agreement struck during negotiations between the US and the Taliban, if maintained, may secure a peace deal that would lead to a withdrawal of American troops from Afghanistan.

In November, Trump announced the resumption of peace talks with the Taliban, but refused to give a timeline for the drawdown of the US troops from Afghanistan, as he made an unannounced visit to American soldiers stationed in the war-torn country.

After nine rounds of negotiations with the Taliban, Trump announced in September that he was calling the peace talks off after a US service member was killed in a suicide attack in Afghanistan's capital, Kabul.

The US currently has less than 14,000 troops in Afghanistan, but military officials would not confirm the exact number.

Trump is accompanied by First Lady Melania, daughter Ivanka, son-in-law Jared Kushner and the top brass of his administration on his maiden visit to India.

During his visit, the two countries are expect to significantly ramp up bilateral defence and strategic ties.

The nearly 36-hour-long visit by Trump is also set to send across a clear message of growing congruence of interests on major geopolitical developments in the region and beyond, particularly when China has been expanding its military might and economic clout.",world,https://www.dailypioneer.com/images/logo.jpg,https://www.dailypioneer.com/2020/world/taliban-wants-to-make-peace-deal-with-us--trump.html
188,24-2-20,Three Mali soldiers killed in jihadist attack,"At least three Mali soldiers were killed and five wounded Sunday in a suspected jihadist attack on an army camp in the far north of the country, the Malian military said.

The outpost in Bambara Maoude, about 100 kilometres (60 miles) south of the city of Timbuktu ""was the object at about 0500 GMT of a terrorist attack,"" the military said on Twitter.

""During this attack, we regret to report a provisional toll of three dead, five wounded, together with material damage,"" it said.

""The wounded were airlifted to Sevare... The outpost remains under the control of the armed forces.""

""Three of our men fell Sunday during a jihadist attack in Bambara Maoude,"" a military official told AFP from Timbuktu earlier.

A local official confirmed the toll of three soldiers dead and said two more were missing. According to another local official, ""the terrorists left, taking vehicles and military equipment with them... Together with the bodies of two of their comrades.""

The attack is the latest in a long series of deadly incidents in Mali's north, where French forces said Friday they had killed about 50 jihadists so far this month.",world,https://www.dailypioneer.com/images/logo.jpg,https://www.dailypioneer.com/2020/world/three-mali-soldiers-killed-in-jihadist-attack.html
189,24-2-20,Love will find a way,"Writer and filmmaker Faraz Arif Ansari has woven various themes of womanhood, sexuality, Islam, nationality and identity into one narrative to make the audience think over them sensitively in his short film, Sheer Qorma. He tells Chahak Mittal how he’s trying to fight the mindset that a queer person isn’t normal or is different from the rest

What’s your definition of mainstream? Something that catches the common eye easily? For filmmaker Faraz Arif Ansari, it’s something that each and every person present can relate to. “When we talk about mainstream, our understanding of it is quite limited. We think there would be dance, music, drama, action or some comedy. But the term’s actual meaning is ‘universal.’ Everyone in the room should relate to what is being showcased. It doesn’t need to be loud or have a wedding. And it can still be called mainstream with elements as subtle as they could be. My film very much tries to re-define and re-explore what mainstream is and should be,” says the director of short film Sheer Qorma, starring Shabana Azmi, Divya Dutta and Swara Bhasker, which is set to hit the screens soon.

For Faraz, cinema has forgotten how to depict love. “Love is multi-layered. We’re just worried about plot-lines and how to sell it. If you look at Bollywood films, depicting the problems of the LGBTQ have just become a topic to cash in on a popular trend. They don’t genuinely exercise the practice of inclusion. The issue has only become commercial. But I just focus on how many lives my work is going to change,” says he.

The film, he adds, is, hence, also a lot about representation. He tells us, “I have to break this pattern in the industry where people are so non-inclusive even though they harp about inclusion all the time. Around 96 per cent of my crew and cast in Sheer Qorma were women, which is intentional because representation matters, no matter how big or small.”

It was after Sisak, the award-winning short film and the first Indian silent LGBTQ love story, that Faraz felt that something more needs to be done around the issue, while focussing on women. “I realised that nobody is talking about women in the queer diaspora. The conversations are still very related to men. There is so much of patriarchy and inherent misogyny even within the queer community. You’ll always come across stories of a man loving another man. But when it comes to a woman loving another woman, people get uncomfortable for some strange reason. They don’t want to talk about it,” he says, explaining why he decided to give this film an angle where women explore their love for each other in the backdrop of a Muslim household.

Produced by Marijke De Souza, the film, Sheer Qorma, Faraz says, is a gentle, heart-rending narrative of the longing for love and acceptance felt by queer children in their households. The story is told through delicate characters of courageous Muslim queer women. With multiple themes of ethnicity and culture at play within the narrative, the story sensitively confronts the harsh reality of disrupted family dynamics through a sensitive and universal tale.

Faraz says that he has woven a lot of themes into the narrative to make the audience think over it sensitively. He points out that there is a common perception that queer people don’t have a religion or a family. He adds, “But that’s not true. Why isn’t anybody making a film about us? We’re real people like everybody else. I identify as a gay, non-binary, Muslim person. For me, my religion has always been a part of me as much as my sexuality. And our generation is more about co-existing rather than discarding. I felt that while I am talking about LGBTQ women, I should also address the persisting Islamophobia, which too exists within the queer community in the Indian and Middle East belt. This is why the film has so many layers. It is layered with women, non-binary people, Islam, nationality, identity, and sexual preferences. Moreover, the portrayal of Muslim women has been very stereotypical in Hindi cinema.”

He tells us that his inspiration for this film has been his khala jaan (mother’s eldest sister), who he calls a “badass” or a tough woman at a time when it wasn’t even normal for women to be rebels. “She never got married and was the manager of one of India’s leading banks. She brought up her siblings when they lost their parents. She would tell me not to listen to anyone and do my own thing. I grew up with her courage. My mother, on the other hand, has been the complete opposite. She’s very worried about what people would think, which is probably why, even though I came out to her when I was 21, she still hasn’t fully accepted me. She still hopes that one day, I will get better and realise that it was just a phase.”

Growing up around inspiring women, who’ve done some pathbreaking things in their lives, you certainly gain a very different understanding of the world. He says, “I’ve always wanted to make films. It started with me as a child, who used to stage elaborate skits with characters like Barbie and He-Man for family gatherings during festivals. It’s not a very toxic-masculinity kind of understanding. Even my father is a very gentle creature. And the film, too, has no man surrounding the women because in Bollywood, even though the films that have been about women, there is always some man bringing in the masculinity some way or the other. This is way different from that. This one is all about love and why it’s the only thing we need to win hearts. Hate cannot heal the world.”

The filmmaker says that his fight is also with the terms “normal” and “different.” He says, “In school, I heard a lot of ‘he’s not like us’, or ‘he’s so different’ or ‘he’s not normal’. When we talk about ‘normalising’ it, I even hate the term normal. It makes it seem like we are talking about something that is otherwise not usual or present around us. So when my sexuality and being a Muslim came into play together as part of my identity, I just carried on with my life and did what I believed in.”

Fighting yet another mentality, the Taare Zameen Par writer and creative director points out that if two women are in love, the perception is that the love must be different from the rest. He says, “I’m trying to fight this mindset. I had interacted with many women and shared my draft with them. They’d ask, ‘How did you know about our lives?’ I’d answer, ‘By knowing about my life’.”

He adds that the biggest compliment, perhaps, came from actor Shabana Azmi when she called the film “gender-free.”

(The film’s trailer will be released on February 25.)",vivacity,https://www.dailypioneer.com/uploads/2020/story/images/big/love-will-find-a-way-2020-02-24.jpg,https://www.dailypioneer.com/2020/vivacity/love-will-find-a-way.html
