,Date,Title,Article,Category,Image_link,Article_link
50,24-2-20,Admin to launch special drive to check PGs irregularities in Chandigarh,"A day after a fire tragedy at an unregistered paying guest accommodation in Sector 32 here claimed three young lives, the Chandigarh Administration is set to launch a special drive to check such PGs violating rules in the city.

The fire incident had claimed the lives of girls namely Pakshi (from Kotkapura, Punjab), Riya (Kapurthala, Punjab) and Muskan (Hisar, Haryana), all aged between 19-22. After the unfortunate incident, UT Adviser Manoj Parida said that inspections of paying guest accommodations would be conducted in the city to avert such untoward incidents in the future.

Deputy Commissioner Mandeep Singh Brar had a day ordered an inquiry into the fire incident and the Sub-Divisional Magistrate (South) has been directed to conduct a thorough probe and submit a report at the earliest. The SDM (South) is likely to submit the report in next three days. The UT PG accommodation policy makes it mandatory for the owner to provide liveable condition in PGs and get it registered. However, as per preliminary inquiry, as many as 34 people were stuffed in Sector 32 PG, compromising with living standards

The UT Police has arrested Nitish Bansal, who was running the Sector 32 PG accommodation. Bansal was arrested late on Saturday night, Inspector Baldev Kumar, Station House Officer of Sector 34 police station, said.

Bansal was booked under Section 336, 304, 188, 34 of IPC related to culpable homicide not amounting to murder, act endangering life of others and disobedience to order duly promulgated by public servant.

While three girls had died, two others were injured during the fire incident due to electrical short-circuit. The floor in which the fire broke out had polyvinyl chloride (PVC) partitions and other combustible material with some rooms having a common entry.

One of the survivors of the horrific incident, Jasmeen Kaur, 18, from Moga in Punjab, saved herself by jumping from the first floor of the house. Jasmeen, her relatives and some other girls staying at the PG recorded their statements before the police regarding the accommodation where they were staying.

Recalling the ordeal while speaking to the mediapersons on Sunday, Jasmeen said she was sleeping when her friend Pakshi did not care about her own safety and first went to wake her up telling her that a fire had broken out probably because of an electrical short-circuit.

As smoke filled up the congested floor which was partitioned by combustible material, Jasmeen told her to run towards the only narrow exit. Soon, the fire grew bigger and Jasmeen somehow managed to grab a chair to climb a nearly seven-feet high wall, jumped off and fell on a shed below and then subsequently onto the floor. “When I came out, Pakshi was still inside. I was injured and waited for her. When I climbed the wall, I lost balance and fell down on a shed. Later, we could hear Pakshi calling out to us and a friend of ours tried to rescue those trapped inside, but there were flames all over,” said an inconsolable Jasmeen, unable to come to terms at the loss of her friend and two others in the tragedy.

Being a weekend, she said most of the girls staying in the PG were out while some were still in college.

“There were just 4-5 of us on the floor. There was only one narrow exit and that too was blocked by fire. There were panelling on all sides and it was soon engulfed by fire,” she said.

Notably, the PG business is thriving in Sectors 15, 22, 23, 32, 34, 35 and 43, but not more than 125 PGs are officially registered with the UT Estate Department.

With Chandigarh being a hub to several educational and coaching institutes, the UT Administration had in 2006 framed rules to regulate functioning of the PGs. However, the unregistered PGs continue to run violating the rules.",state-editions,https://www.dailypioneer.com/images/logo.jpg,https://www.dailypioneer.com/2020/state-editions/admin-to-launch-special-drive-to-check-pgs-irregularities-in-chandigarh.html
51,24-2-20,Badals ‘hand in glove’ with Punjab Govt: SS Dhindsa,"Rajya Sabha MP and rebel Akali leader Sukhdev Singh Dhindsa on Sunday accused the Badal family of being “hand in glove” with Punjab Chief Minister Capt Amarinder Singh, saying that their business interests “remained unaffected” despite the Congress being in power in the

State. Dhindsa appeared to be responding to the allegations by Akali Dal leaders that he and his son Parminder Singh Dhindsa were being used as “pawns” by the Chief Minister and the Congress to “weaken” the SAD.

The Dhindsas were expelled by the Akali Dal for alleged anti-party activities on February 3, a day after holding a rally in their home turf — Sangrur.

Retorting, the Dhindsa father-son duo, along with various panthic leaders, on Sunday held ‘Save Punjab, Save Panth’ rally at the same place.

The rally was attended by SAD (Taksali) leaders Ranjit Singh Brahmpura and Sewa Singh Sekhwan, SAD (1920) leader Ravi Inder Singh, former MP Balwant Singh Ramoowalia, former Deputy Speaker Bir Devinder Singh, former president of Delhi Gurdwara Parbandhak Committee Manjit Singh GK and former Akal Takht Jathedar Ranjit Singh.

Dhindsa and other leaders lashed out at the Badal family, accusing them of “damaging” the Akali Dal. “Everybody knows Capt Amarinder Singh and Badal family are hand-in glove. Everything is going on as it is,” Dhindsa said.

“I want to ask them (Akalis) how many Congressmen have come here today. Who are Congressmen? The whole world knows Sukhbir Singh Badal is in cahoots with Capt Amarinder Singh.

Nobody stops his (Sukhbir) bus and their buses are plying without permits as usual. Nobody touched their cable business even today,” alleged Dhindsa, adding their business remained unaffected. The Akalis only make statements against the Congress but ""we will fight them,"" he said.

Referring to SAD’s February 2 rally in Sangrur, Dhindsa claimed that the Akalis had said that they organized the rally against the Congress government. “Did they speak against Congress? They spoke only against Dhindsa family. From this, it was clear who is with Congress,” he said.

Dhindsa said that the size of his rally was “much bigger” than the SAD’s. “Sukhbir you come here and see and this gathering is enough to break your arrogance,” said the senior Dhindsa. On February 2, the SAD leadership had accused the Dhindsas of “backstabbing” the party.

Dhindsa had rebelled against the Akali Dal leadership in a bid to “liberate” the SAD from the Badal family and revive its lost glory. He joined hands with SAD splinter groups, including the SAD (Taksali). His son too followed him.",state-editions,https://www.dailypioneer.com/images/logo.jpg,https://www.dailypioneer.com/2020/state-editions/badals----hand-in-glove----with-punjab-govt--ss-dhindsa.html
52,24-2-20,Singhdeo launches statewide deworming drive in Ambikapur,"Health and Family Welfare, Medical Education Minister T. S. Singhdeo launched the state-level Deworming drive on Sunday. He administered anthelmintic (Deworming) medicine to school-going children at the Government Girls School premises, Ambikapur.

Health and family welfare, women and child development, social welfare, higher education, and school education departments are jointly organizing the drive from February 24 as 10th phase of National Deworming Day.

The drive will cover state’s all the 28 districts and the basic purpose of the drive is to administer albendazole tablet to 1.13 crore children, adolescent boys and girls aged from 1-19 years. The government has planned to reach out in 56384 schools and 52474 anganbadi centres under the drive.

The infant would be administered the medicine on February 28.

Addressing the gathering, Singhdeo said, Rs Rs healthy children have stronger minds and higher capabilities.

So for healthier future, one has to remain healthy. It is state government’s duty to ensure children are protected from diseases for which deworming is a part of it’’.

He added that private schools and drop out children would also be covered under the drive.",state-editions,https://www.dailypioneer.com/images/logo.jpg,https://www.dailypioneer.com/2020/state-editions/singhdeo-launches-statewide-deworming-drive-in-ambikapur.html
53,24-2-20,"Set blood collection target to 25,000 units: Borah","Presiding over the Red Cross district secretaries meeting, Indian Red Cross Society chairman Sonmoni Borah directed them to hike the present blood collection capacity of 12,000 units to 25,000 units in the state.

The NCC, NSS and students should be motivated to donate blood and also spread the message among masses for blood donation, Borah said.

Borah also directed the officials to ensure medicines are sold at minimum price on no-profit-loss basis keeping in mind the need of the poor patients. The chairman said in each district two and in each block one Red Cross Society medical shops should be started. At present there are 33 shops which should be increased to 100, he said.

He also laid emphasis on first-aid training to each person. He said district collector, different district level officers, NCC and NSS like other social organisations and youth can be trained in providing first aid so that in case of any emergency, trained volunteers are available for Red Cross. He directed officials to prepare a training model and implement it.

He said on May 8, the Red Cross will complete 100 years, on which at district and state level programmes would be organised by holding competitions in 10 categories.

District Committees, medical shops, donors and volunteers and others should be felicitated by Governor and Chief Minister.

Reviewing vehicle for transporting bodies, Borah said in districts where hearse is not available, alternative arrangement should be made while freezer facilities should also be ensured. Regarding old age homes, he directed officials to keep it clean, increase the capacity and do the work in service form. He also laid stress on membership drive.",state-editions,https://www.dailypioneer.com/images/logo.jpg,https://www.dailypioneer.com/2020/state-editions/set-blood-collection-target-to-25-000-units--borah.html
54,24-2-20,"NTPC-Sipat enriching society, protecting environment: CGM","Chief General Manager NTPC-Sipat Padmakumar Rajasekharan highlighted how the 2980 mega watt plant of the power giant is fulfilling the energy need of country as well as enriching the society with its CSR activities and environment protection steps.

Addressing a press conference on Saturday Rajasekharan said country’s first advanced ultra super critical technology 800 mega watt power plant is going to be installed at Sipat Super Thermal Power Station of public power utility NTPC Limited.

All the approvals required for setting up this plant is underway, public hearing of this work is expected soon and expenditure proposal is about to be approved, he added.

“After completion of all the formalities we can expect for commencement of construction work. The new plant will come inside the existing plant, no extra land will be required for this new plant. Theefficiency of this plant will be 5 percent more in comparison to the super critical technology,” added Rajasekharan.

In this financial year till 21st February 2020 Sipat Super Thermal Power Station has generated 19717.51 million units of power with 84.83 percent plant load factor. Recently NTPC Sipat has been conferred with NTPC’s champion of Business Excellence award, Swarn Shakti Award, Greentech Safety and Environment award etc.

Replying to queries, the CGM informed that till date NTPC has recruited 427 land oustees. Due to lack of sufficient number of Schedule caste (ST) candidate there is a backlog of 154 ST posts, he said, adding, “We are expecting that very soon we can complete the recruitment process.”

On Corporate Social Responsibility and Community Development activities, he said Girl Empowerment Mission was organised for 120 girls of Govt School in the age group of 10-12 years.

“Nineteen health camps organised for the villagers. RO water plants have been installed in four villages, Integrated Live Stock Development Centre and Fodder Multiplication centre is working for the farmers. ITI centre has been constructed by NTPC at village Baloda in Mahuda Block of Janjgir-Champa district,” he told the press conference.

Environment conservation has been the prime focus of Sipat plant, the CGM stated. In this context he pointed out that in Hariyar-Chhattisgarh programme NTPC has contributed more than 12 crore for plantation of 7,15,847 saplings. Till date NTPC Sipat has planted 10,94, 333 saplings, he said.",state-editions,https://www.dailypioneer.com/images/logo.jpg,https://www.dailypioneer.com/2020/state-editions/ntpc-sipat-enriching-society--protecting-environment--cgm.html
55,24-2-20,More focus on agri sector in Budget: Minister,"Haryana Agriculture and Farmers’ Welfare Minister Jai Parkash Dalal on Sunday said that with a view to promote micro-irrigation and make farmers aware of the same, the Central Government has laid more focus towards the agriculture sector and micro-irrigation in the present budget.

He said that there is a provision of giving upto 85 per cent subsidy on equipment in micro-irrigation sector by the State Government.

This will increase the trend towards drip irrigation to farmers, which will save irrigation water and increase production, he added. The Agriculture Minister shared this while interacting with the media persons in Bhiwani.

He said that Farmer Producer Organizations(FPO) are being made for the benefit of small farmers so that they can work together for food processing, packing and Polly houses and can earn maximum profits.

The Minister said that the State Government is continuously implementing new schemes for public welfare. He said that the State Government is already running several schemes for the welfare of Farmers and even the Central Government has laid more focus on the growth of the agriculture sector.

While sharing the details about the Chief Minister Mr. Manohar Lal’s rally to be organized on March 7, in Kairu village, Tosham Assembly Constituency, he said that a large number of people will participate from all the four assembly constituencies and the rally would be named as Haryana Pragati Rally.

He further said several developmental announcements are expected to be made at the rally.

While responding to a question, the Minister said that a roadmap has been prepared for various development works which will be executed in every area of the Bhiwani district. The old sewerage and petroleum lines in the city will be replaced. Similarly, roads which require maintenance will also be renovated, he added.

He said that excellence centers of horticulture, animal husbandry, fisheries etc. will be set up in Bhiwani, so that farmers and livestock farmers will get maximum benefit.

The Minister also said that sheep farming is being promoted in the district, for which special centers will be opened.

Like the Kisan Credit Card, the Pashu Kisan Credit Card Scheme has been started, for which there is great enthusiasm among the farmers and soon, a big fair will be organized in Bhiwani, in which thousands of cattlemen will be given these cards, he added.

Fix one day for public grievances

The Agriculture and Farmers' Welfare Minister Jai Parkash Dalal has directed the officers to fix one day in every month for resolving the public grievances.

He said that to make the functioning of district administration more effective, the responsibility of each officer should be fixed to ensure that there is no delay in the work.

The Agriculture Minister said this while presiding over the meeting of District Public Relations and grievances committee in Charkhi Dadri. During the meeting, a total of 13 complaints were heard, out of which 10 were settled on the spot.

The Minister directed the Deputy Commissioner to form a Joint Committee of public representatives, social workers, police and administration officials, to keep a check on vehicle overloading problem in the city. He also directed the police to take stern action to prevent the incidents of canal water thefts.

Taking cognizance of the problem of drinking water supply in the city, the Minister directed the SDM to do a spot inspection and resolve such complaints immediately.",state-editions,https://www.dailypioneer.com/images/logo.jpg,https://www.dailypioneer.com/2020/state-editions/more-focus-on-agri-sector-in-budget--minister.html
56,24-2-20,Inbrief,"Min expresses gratitude for fund release

Shimla: Himachal Education Minister Suresh Bhardwaj expressed gratitude towards Central Government for releasing a total of Rs 443.18 crore to Himachal Pradesh under Samagra Shiksha till date for overall development of education sector in the state. The amount has been released by Union Ministry of Human Resource Development for provision of free uniform to 4,59,890 students, free text books to 2,98,203 students, composite school grant to 15,414 schools, setting up libraries in 15,399 Schools, ICT and digital initiatives in 55 schools. Bhardwaj said, the amount released would be utilised for imparting special training to 5,357 out of school children, running of 13 Kasturba Gandhi Balika Vidyalays, self defence training to girls in 4707 schools, 92 additional classrooms in elementary schools, ramps and handrails in 811 schools, solar panels in 19 schools, electrification in 308 schools.

CM Jai Ram Thakur visits Tarna Mata Temple

Shimla: Himachal Chief Minister Jai Ram Thakur visited the famous Tarna Mata Temple of Mandi town and performed ‘Puja’ there. The Chief Minister went around the temple complex and also interacted with the visitors on the occasion. Member of Parliament Ram Swaroop Sharma, MLAs Jawhar Thakur, Inder Singh Gandhi and Hira lal, Deputy Commissioner Mandi Rugved Thakur, Superintendent of Police Gurdev Sharma also accompanied the Chief Minister on the occasion.

Kalia mourns demise of leader Shakti Sharma

Jalandhar: Punjab BJP’s former president and former minister Manoranjan Kalia on Sunday expressed deep shock and grief over the sudden demise of senior BJP leader and Punjab Small Industries and Export Corporation’s (PSIEC) former chairman Shakti Sharma. “I have lost a friend who had worked with me in various organizational capacities in BJYM and BJP. May the departed soul rest in peace and give courage to the bereaved family to bear the irreparable loss,” said Kalia.

Nirankari Mission holds cleanliness campaign

Chandigarh: Sant Nirankari Charitable Foundation on Sunday organized mega cleanliness drives Pan India covering government hospitals. The drive focused on the cleanliness of compounds, toilets, drainage or water areas and parks of 1,266 Hospitals with the help of about 3.5 lakh volunteers, sewa dal and active members of Sant Nirankari Mission. Chandigarh coordinator Navneet Pathak said that cleanliness drive took place at PGI, GMCH Sector 32, besides several Civil Hospitals from 8 am onwards.

FPSWA opens front against board of Education

Chandigarh: The Federation of Private School Welfare Association, Haryana has opened a front against the Board of Education. The federation alleged that the teachers had not performed their duty during the board examinations in March 2019 but the students are being punished in lieu of the said teachers. The board did not issue the roll numbers of lakhs of students in the state, whose school teachers had not performed examination duty last year. President of Federation, Kulbhushan Sharma questioned that under which rules and laws, Bhiwani Board officials are harassing students by stopping their roll numbers against teachers who had not performed duties. The board examination of students will start from March 3.

Chandigarh-based author awarded in New Delhi

Chandigarh: Haryana State Awardee as best teacher and noted author Shakuntla Mukherjee was honoured with a series of awards for her contributions in education and literature at a function organized at Gandhi Samarak, ITO, New Delhi. Navodit Sahityakar Manch has conferred ‘Delhi Sahitya Ratna Award’ for her fine contribution towards literature. Namita Shrivastava, Deputy Director, Central Industrial Security Force (CISF) has conferred this award to Mukherjee.

National workshop at PGIMER

Chandigarh: The Department of Pharmacology, PGIMER will organize the 36th National Workshop on Clinical Pharmacology from February 24 to 29. In this week-long workshop, imminent speakers from both the Industry and Academia will be addressing the delegates. The Department of Pharmacology has been hosting the prestigious conference every year for more than three decades now. The workshop intends to equip the delegates with various skills across the discipline of clinical pharmacology through a hands-on approach.

FYI programme conducted in tri-city

Chandigarh: The final edition of Find Your Investor (FYI) programme 2019-20, supported by Kotak Mahindra Bank (Kotak) was conducted by Venture Garage in the upcoming IT hub of the tri-city of Chandigarh-Mohali-Panchkula. After four super successful sessions in Pune, Mumbai, Bengaluru and Hyderabad, over 100 applications were received at the Chandigarh FYI event, which is a fund-raising platform for start-ups. More than 50 start-ups and seven investors attended the Chandigarh edition, which catered to entrepreneurs from Punjab and from towns such as Patiala, Ludhiana and Mandi.",state-editions,https://www.dailypioneer.com/images/logo.jpg,https://www.dailypioneer.com/2020/state-editions/inbrief-inbrief-2020-02-24.html
57,24-2-20,Haryana Congress chief slams BJP-JJP Govt for new excise policy,"Haryana Congress chief and Rajya Sabha MP Kumari Selja has slammed the BJP-JJP alliance Government of the State for the new excise policy and the decision to take away the land of Dhauli (donation) given to the Brahmin families.

She said that those who used to talk of closing liquor vends in the state, have made arrangements for opening liquor vends from house-to-house today. Eliminating 15 percent quota in liquor vend contracts of Dalits exposes the anti-Dalit face of this government, she said.

The Congress leader said that the Dhauli (donation) land given by the Congress Government to the Brahmin families is being taken away by the present Government, which is highly condemnable.

In a statement issued here, Selja said that our State is already getting entangled in the swamp of drugs. On the other hand, the decision of the Government giving relaxation on sale of liquor in shopping malls, reduction in the prices of beer, allowing the bar to open till 1 am in midnight and giving permission to keep liquor boxes in house, shows that the Government promotes intoxication in the state. The real objective of the Government is to make reach of liquor easy to maximum number of people so that people would not even bother to go to the liquor vends for it. It shows how the Government is promoting drugs in the state, she added.

She said that the parties involved in this Government used to talk about liquor ban in the elections, but today the real face of these parties has come before the people of the State. This decision of the Government will have serious consequences, and the youth of the State who are already getting caught in the clutches of drugs will be increasingly trapped in the morass. Now liquor will be supplied from house to house and it will also have a direct impact on the law and order of the State, she said.

Selja said that be it the Government of the state or the Central Government, Dalits were repeatedly tortured in this Government. Sometimes there was a conspiracy to end their reservation, sometimes the law against the oppression of Dalits is not properly advocated, which was rejected in the Supreme Court. The 500-year-old Ravidas Temple was demolished in this government. At the same time, abolishing the 15 percent quota in liquor contracts of Dalits, once again exposes the anti-Dalit face of this Government, the Congress leader said.

Corneringthe Government for taking away the ownership rights of Dhauli (donation) land given to some other castes including the Brahmin by the Congress Government in the year 2011, Selja said that the anti-Brahmin face of this Government is also exposed. The anti-Brahmin mentality of this Government and Chief Minister Manohar Lal has been exposed many times. The anti-Brahminquestion in the Haryana Staff Selection Commission, and the threat given by Chief Minister Manohar Lal to behead the head of a Brahmin leader, tells how this Government maintains an anti-Brahmin mentality, she said.

She further said that in the year 2011, when the Congress was in power in the State, the Congress made law and people of the Brahmin community were given the right to own the land of Dhauli (donation). Under this, 37,836 Dhauledars became the owners of 14,187 acres of land. Now due to its anti-Brahmin mentality, this Government has decided to take away the ownership of the land of these people, which is highly condemnable.

She said that the Congress party is standing with the people of the State against these anti-people decisions and these decisions will be strongly opposed by the Congress.",state-editions,https://www.dailypioneer.com/images/logo.jpg,https://www.dailypioneer.com/2020/state-editions/haryana-congress-chief-slams-bjp-jjp-govt-for-new-excise-policy.html
