,Date,Title,Article,Category,Image_link,Article_link
155,01-1-20,Iraq warns US ties at stake after deadly strikes,"Iraq’s Government warned Monday that its relations with the United States were at risk after deadly American air strikes against a pro-Iran group sparked anger on the streets, with protesters torching US flags.

Baghdad said it would summon the US ambassador while Washington responded by accusing Iraqi authorities of having failed to “protect” US interests.

At least 25 fighters were killed in Sunday night’s attacks, which saw US planes hit several bases belonging to the Hezbollah Brigades, one of the most radical factions of Hashed al-Shaabi, a Tehran-backed Iraqi paramilitary coalition.

The attacks came as Iraq is caught up in mounting tensions between its allies Tehran and Washington while it also grapples with huge street protests against corruption and Iran’s growing political influence in the country.

The strikes “killed 25 and wounded 51, including commanders and fighters, and the toll could yet rise,” said the Hashed, which holds major sway in Iraq.

Victims were still being pulled from the rubble of bases near Al-Qaim, an Iraqi district bordering Syria, on Monday, it said.

The Hezbollah Brigades said they will hold a mass funeral ceremony on Tuesday in Baghdad near the high-security Green Zone, where the US embassy is located.

Iraq’s government, acting in a caretaker capacity following the resignation of prime minister Adel Abdel Mahdi in the face of street protests, denounced the strikes and warned they could affect ties with Washington.

“American forces acted on their political priorities, not those of the Iraqis,” a statement said, adding that such strikes “violate the sovereignty of Iraq”.

The attacks “force Iraq to review its relations and its security, political and legal framework to protect its sovereignty”, the government added.

The warning came as demonstrators torched US flags in the Shiite-dominated southern cities of Basra and Najaf as well as in Kirkuk, north of Baghdad, while lawmakers called for US troops to be booted out of Iraq.

In a phone call on Monday, Saudi Crown Prince Mohammed bin Salman and US Secretary of State Mike Pompeo “agreed that the Iranian regime and its proxies continue to be a destabilizing force in the region and that nations have a right to defend themselves in the face of these threats,” State Department spokeswoman Morgan Ortagus said.

Pompeo “underscored that attacks by the Iranian regime, or their proxies of any identity, that harm Americans, our allies, or our interests will be answered with a decisive response, as demonstrated yesterday.”

Dozens of lawmakers called on the government to review an agreement allowing the deployment of 5,200 US soldiers in the country, saying the strikes amount to a violation that renders the pact obsolete.

US Assistant Secretary of State David Schenker said the strikes were a “proportionate” response for the death Friday of a US civilian contractor in Kirkuk in a Hezbollah Brigades rocket attack.

“We don’t want an escalation here, we want a de-escalation,” he added however. Abdel Mahdi said he had been forewarned by US Defense Secretary Mark Esper that the US would carry out the attacks.

“He told me the United States would strike the Hezbollah Brigades and I told him it would be a very dangerous act that could lead to an escalation,” Abdel Mahdi said.

Tensions have soared between the United States and Iran since Washington pulled out of a multilateral nuclear agreement with Tehran last year and imposed crippling sanctions Iraqi leaders fear their country could become a battleground between Tehran and Washington.",world,https://www.dailypioneer.com/images/logo.jpg,https://www.dailypioneer.com/2020/world/iraq-warns-us-ties-at-stake-after-deadly-strikes.html
156,01-1-20,2019: India deepens strategic ties with SA,"The bilateral ties between India and South Africa further deepened in 2019 with the two countries stepping up their cooperation in the area of defence and developing a road map to enhance their strategic partnership.

South African President Cyril Ramaphosa was the chief guest at the Republic Day parade in New Delhi on January 26. The visit of Ramaphosa, the second South African president to be the chief guest at the Republic Day celebrations, was of high symbolic value and was very special for both the countries as India celebrated the 150th birth anniversary of Mahatma Gandhi, while South Africa observed the 100th birth anniversary of the anti-apartheid icon, Nelson Mandela.

Twenty-four years ago, shortly after the end of the Apartheid regime in early 1994, Mandela came to India as the Chief Guest at the Republic Day parade in 1995.

In 1997, India and South Africa signed the Strategic Partnership, called the Red Fort Declaration. Since then, the bilateral ties between the two countries have grown stronger with the two nations having MoUs in practically all areas.

During his 2019 India visit, President Ramaphosa renewed the Declaration with the three-year Strategic Programme of Cooperation (2019-2021), which aims at enhancing bilateral cooperation in a time-bound manner. The strategic programme will facilitate expansion of ties in several key areas such as defence, maritime security and trade and investment.

India and South Africa also resolved to work together to address the issue of fugitive economic offenders through international organisations and institutions, such as G20, Financial Action Task Force (FATF) and others.

The year 2019 also witnessed the first-ever joint India-Africa military training exercise, which was held in Pune in March and was participated by nine countries, including South Africa. The other countries which attended the Indian- Africa Field Training Exercise were Egypt, Ghana, Nigeria, Senegal, Sudan, Tanzania, Namibia, Mozambique, Uganda, Niger and Zambia.

The bygone year also saw many Indian companies expanding their businesses in South Africa.

While, global natural resources player Vedanta Resources Ltd — which has already invested Rs 3,000 crore in South Africa — announced a fresh investment of Rs 8,500 crore to expand its mining and allied operations, carmaker Mahindra & Mahindra —which is celebrating 15th year of its operations in the resource-rich country — has inaugurated its Special Fitment Centre in Gauteng.",world,https://www.dailypioneer.com/images/logo.jpg,https://www.dailypioneer.com/2020/world/2019--india-deepens-strategic-ties-with-sa.html
157,01-1-20,Re-emphasise teaching goals,"Surabhi Goel lists digital trends that can be seen in the education sector this year

Technology continues to deeply impact every aspect of life and education is no different. The digital divide is shrinking steadfastly at a rate of five per cent annually and internet growth statistics show that by the year 2028, 100 per cent of the world population will have internet access. Access to internet coupled with other technological advancement will completely transform the way education has been imparted till now. Here are some trends of the immediate future.

Individualised learning plans

Thousands of years ago India had the gurukul system. Each child would get individualised learning as per their ability.Somewhere we lost this wonderful gift of teaching and learning. Till date students continue to learn at different speeds yet we churn them out of schools like factories would churn out goods. We all wish that we could run schools with a smaller student teacher ratio but unfortunately that is not always possible. Technology is helping put forward a customised approach which help students learn with techniques that interest them the most. The ILP will not only help students learn at their own pace, but also track and manage their learning needs. This is especially beneficial for students with learning difficulties who engage better via listening and speaking mediums.But most importantly by introducing a customised learning plan in discussion with the student, their buy-in is greater and the students develop self-reflective abilities.

Online assessments for tracking student performance

Online assessment platforms have transformed the way teachers evaluate the performance of the students. They are also used by classroom teachers to understand what percentage of the class has understood the didactic and therefore, plan lessons better.

Students will continue to have a place to express their feelings and thoughts

More and more youngsters are committed to bring about positive change at a large scale basis. Crowdfunding is possible at a click of a button. There are several platforms which gives a voice to students. They support a cause and feel like they are a part of a larger community and this has been possible due to technology.

Educators will have to be open to change and adapt to changing technology

Educators who aren’t willing to adapt to the technological revolution run the risk of becoming redundant. Upgradation of skills will enable educators to widen the technological knowledge pool of students and then leave the choice of utilising the skills up to them. They will have to upskill themselves to be able to keep pace with the learners.

Game based learning

There are several game based learning programmes for children as young as five to six years old which are helping children learn complex concepts in a simple and effortless manner. There is instant feedback given to the student player. Different levels help to track learning progress and gives students and teachers a clear learning pathway to go to the next level.

School management systems have changed the way the schools now connect with various stakeholders — parents, students and teachers

More and more schools are now adopting SMS to develop a comprehensive eco system where real time information of their childrenis available. It is also a very convenient tool for working parents. More and more schools will continue to digitise their communication which could even include sending out simple circulars via email instead of hard copies.

Schools spaces are evolving

There will be libraries with no books, just kindles and tablets. Think labs and innovative centres will be set up which will support robotics, artificial intelligence, and product designs using 3D printers. Use of virtual reality kits to simulate real life experiences will increase.

It will be up to instructional designers and educational technologies to make the most of the opportunities provided by technology to change education so that effective and efficient education is available to everyone everywhere.

While all these positive trends will be on the rise in the future, a dilemma will continue to plague education leaders.

On one end, schools with access to international pedagogies, bring your own device policies and latest gadgets such as VR sets and 3D printers, are wondering if they need to reduce screen time and introduce activities which build character and develop motor skills by introducing carpentry, gardening or Taekwondo, the other upcoming schools are bringing in interactive white boards and upgrading their ICT labs.

Technology is agreat equaliser and thus those who do not have access to it can be left behind. But like with everything in life, moderation is the key. The onus lies on both parents and educators to set boundaries on utilisation of digital media by children.

The writer is Chief Executive Officer, Aditya Birla World Academy",avenues,https://www.dailypioneer.com/uploads/2020/story/images/big/re-emphasise-teaching-goals-2020-01-01.jpg,https://www.dailypioneer.com/2020/avenues/re-emphasise-teaching-goals.html
158,01-1-20,Admission Open,"engineering courses

KIIT Group of Colleges invites applications for admission to various courses in 2020-2021 session. The courses offered are BTech (CSE ECE, EEE, civil engineering & mechanical engineering), MTech (ECE & CSE), MBA, BBA & BCA.

Duration: Four years

Eligibility: Candidates must have appeared/passed Class XII examination for bachelors degree, and appeared/passed graduation for masters degree programmes.

Last date to apply: June 30, 2020.

ug-pg courses

The Indian Institute of Art and Design (IIAD) in collaboration with Kingston School of Art, London invites applications for admissions to its undergraduate programmes in fashion design, dashion business management, communication design and interior architecture & design. It also offers postgraduate programmes in fashion design and fashion business management.

The institute offers these programmes through its creative studio-based education and strives to groom the next generation of designers and design thinkers at its state-of-the-art campus in New Delhi.

How to apply: Log on to www.iiad.edu.in or contact +9198713 83633.

pgdm programme

JK Business School (JKBS) invites applications for admission to its full time AICTE approved PGDM programme.

Duration: Two years

Eligibility: Graduate in any discipline from a recognised university with minimum 50 per cent score is eligible to apply for the PGDM programme.

How to apply: Log on to www.jkbschool.org or email at admissions@jkbschool.org.

Last date to apply: January 31, 2020.

BSC HONOURS

The University of Strathclyde, Glasgow invites applications for admissions to its BSc Hons Architectural Studies starting in September 2020.

Students will be taught in a dynamic studio-based environment by professional practitioners and academics. The university focuses on engagement with local and international communities encouraging students to balance the practical realities of the world with innovative design.

Students will develop creative design skills, and learn about construction techniques, materials and environment informed by an understanding of architectural history, culture and theory.

Duration: Four years

Eligibility: Minimum 70-75 per cent in all subjects taken at Class XII level and the same at Class X level.

Fee: £18,100 per year for international students

How to apply: Log on to https://www.strath.ac.uk/courses/undergraduate/architecturalstudies/#contactus or

eng-admissions@strath.ac.uk.

BSC HONOURS

The University of Sheffield, UK invites applications for admissions to its BSc Artificial Intelligence and Computer Science with a year in Industry course starting in September 2020.

Duration: Four years

Eligibility: Minimum 85 per cent in Class XII including Maths. IELTS grade of 6.5 with a minimum of 6.0 in each component; or an alternative acceptable English language qualification.

How to apply: Log on to https://www.sheffield.ac.uk/prospectus/courseDetails.do?id=GG752020.",avenues,https://www.dailypioneer.com/images/logo.jpg,https://www.dailypioneer.com/2020/avenues/admission-open.html
159,01-1-20,2019: Year full of development,"Last year saw AI, ML and data science as the flavours of the season. Hari Krishnan Nair lists the trends that ruled this year

The year 2019 was full of developments in the professional education space and upskilling platforms have fared in the bygone months. The key trends witnessed in the space in 2019 are as follows.

Trend 1: Revenue growth of ed-tech companies

The surge witnessed by ed-tech companies in the professional education space, over the last one year is phenomenal. We have seen significant growth over the past one-year with professionals increasingly opting for high-quality up-skilling programmes that can help them achieve career transitions. We generated around `150 crore in revenue in FY19, and expect to achieve a turnover of `400 crore by the end of this fiscal and `1000 crore by FY21.

Trend 2: Freshers opting for courses in Data Science, AI and ML

Industry expectations from freshers have changed drastically over the year. Corporates now want to hire professionals that are well versed in new-age skills like devops, data science, machine learning and cloud. We have seen great demand for our data science programme that is focused on fresh graduates looking to build a career in data science and analytics. Recently, about 60 per cent of our current batch has already been placed with an average salary package of `5.6 lac per annum (85 per cent more as opposed to the usual `3 to `3.5 lac per annum). Several students with one to two years of prior experience have infact even drawn a 100 per cent hike on their salary. This course has helped thousands of professionals to bag better roles and pay packages this year.

Trend 3: Tech companies increasingly partnering with edtech platforms

Re-skill is the current buzzword echoing off corporate walls as companies are driving large scale initiatives among the existing workforce to build a continuous learning culture. Skilling has become a priority for organisations. We have made rapid strides in delivering in-depth and quality pedagogy to the professionals through multiple learning models and are now working with corporates to deliver tailor-made programmes keeping in mind the roles and requirements within the organisation.

The writer is Co-founder, Great Learning",avenues,https://www.dailypioneer.com/uploads/2020/story/images/big/2019--year-full-of-development-2020-01-01.jpg,https://www.dailypioneer.com/2020/avenues/2019--year-full-of-development.html
160,01-1-20,13th ISDSI conference,"The Indian Institute of Management Sambalpur (IIM-S) hosted the 13th Annual ISDSI conference, an international conference of Indian Subcontinent Decision Sciences Institute (ISDSI). The theme of the three-day conference was ‘Managing Industry Transformation in Post-Digital Era’.

The main objective of this conference was to provide a platform for academicians, researchers and practitioners to disseminate research, providing insights into the challenges, opportunities, emerging strategies and analytical tools in the domain of decision making, present case studies on application of tools and techniques and explore cutting- edge ideas, results and share experiences.

The conference was attended by over 300 professors, scholar and industry managers from USA, China, Europe, New Zeeland, South Africa and India. More than 200 research papers were presented during the three days of the conference.

The three days of the conference witnessed workshops, panel discussions and keynote addresses by dignitaries from the country and across the globe.

All the sessions stayed in line with the main theme while suggesting ways on how management institutes can continue to thrive in the post digital era and the role of B-schools in this age.The sessions focused on how leaders can make the best use of available resources to leverage traditional strengths and capacities to the fullest.",avenues,https://www.dailypioneer.com/images/logo.jpg,https://www.dailypioneer.com/2020/avenues/13th-isdsi-conference.html
161,01-1-20,Make right choice,"Planning a career is a lifelong process, which begins by choosing the course stream of your choice, getting a job and growing in the job. It is important to think wisely while selecting the right career and arriving at the right decision. Embarking on a path which leads to a bright career in future is not accidental. In fact, the process of choosing a career is an introspective and important task.

It is important to begin early and to know and learn about options that lie ahead of you after school so that you can make an intelligent and calculated decision.

Considering there are about 9,000 career options in the world, the spectrum of choice is wide ranging from humanities to commerce, science to medicine and engineering, management to defence amongst others. A plethora of opportunities awaits students of Humanities stream. Designers (interior/exterior, jewellery, fashion/textile), fine arts, photography, print journalism, travel and tourism, law, mass communication, film making, advertising, public relations and hotel industry are a few options to be considered.

With the positive changing scenario around the world in the realm of economic activity, selecting Commerce as a career option is one of the best to grab. Commerce students get familiar with knowledge of business, trade, market fluctuation, basics of economics, fiscal policies, industrial policies, share market, stock markets and others. Considering the burgeoning activity of market, talented individuals are needed to make a balance between demand and supply.

Individuals with careers in science are responsible for many of the things we, as a society, benefit from every day — ways to prevent and cure diseases, new technology, and strategies to help control climate change.

The breadth of careers in engineering spans from mechanical to electrical, civil, environmental, software, chemical, aerospace, petroleum, geological and mining.

Medicine is the field of health and healing. Not only that, Medicine is one of the most innovative and profitable industries worldwide. It is one of the oldest and most respected professions.

Management is one of the largest, most varied, and most interesting areas of work in the global economy. Itincludes but is not restricted to consulting, entrepreneurship, human resources, general management. Non-profit areas and strategic planning are few others to come under its purview.

A career in defence promises one of the most prestigious and respected positions in the country. It makes a person not only disciplined and strong but also opens up many avenues of growth.

The choice is yours, choose wisely.

The writer is an entrepreneur, motivational speaker & numerologist",avenues,https://www.dailypioneer.com/images/logo.jpg,https://www.dailypioneer.com/2020/avenues/make-right-choice.html
162,01-1-20,CAD narrows to 0.9 pc of GDP in Sept quarter on lower trade deficit: RBI,"India's current account deficit (CAD) narrowed to 0.9 per cent of GDP, or $6.3 billion, in the September 2019 quarter, on account of lower trade deficit.

It had stood at 2.9 per cent of gross domestic product (GDP), or $19 billion, in the corresponding quarter of 2018-19. On a sequential basis, CAD had printed 2 per cent of GDP, or $14.2 billion, in the June 2019 quarter. The current account deficit is the difference between foreign exchange inflows and outflows.

""The contraction in the CAD was primarily on account of a lower trade deficit at $38.1 billion as compared with $50 billion a year ago,"" the Reserve Bank of India (RBI) said in a release on Tuesday.

During the first half of the current financial year, CAD narrowed to 1.5 per cent of GDP from 2.6 per cent in the corresponding period in 2018-19, on the back of a reduction in the trade deficit, which shrank to $84.3 billion as compared with $95.8 billion a year ago. The trade deficit is the gap between the value of imports and exports.

The balance of payment stood at $5.12 billion in the second quarter and $19.10 billion during the first half of this fiscal.

Net foreign direct investment stood at $7.4 billion, almost the same level as in second quarter of 2018-19.",business,https://www.dailypioneer.com/images/logo.jpg,https://www.dailypioneer.com/2020/business/cad-narrows-to-0-9-pc-of-gdp-in-sept-quarter-on-lower-trade-deficit--rbi.html
