,Date,Title,Article,Category,Image_link,Article_link
34,01-1-20,Forum launched in State for child rights,"In realising the need of promoting and facilitating the process of child participation, a civil society forum called, ""APPROCH” (Alliance to Promote Participation Rights of the Children) in Odisha was launched here on Monday.

The alliance will be with the child rights clubs, NGOs, parents, caregivers, community, Government officials, PRIs, schools and media houses, who are coming together to promote an enabling environment and reinforce child rights to participation.

The APPROCH believes that child participation is the cornerstone or fundamental value to fulfil other rights of children like survival, development and protection rights. This is along with the Rights to Freedom of Expression (Article 13), Freedom of Thought, Conscience and Religion (Article14), Freedom of Association and Peaceful Assembly (Article15). About 30 NGOs from different districts participated in the launching programme and decided to take forward the initiative further.The programme was facilitated by the NINEISMINE campaign New Delhi.

""Right to play is one of the important components under the participation rights but in Odisha 78 per cent of the school do not have playgrounds and play materials. This is alarming that 94 per cent of schools in Subarnapur district do not have playground and paly materials. Similar is the situation in 93 per cent schools in Rayagada and Kalahandi, 91 per cent in Balangir and Nuapada followed by 89 per cent in Koraput and 87 per cent schools in Kandhamal district. The Karnataka Government has the provision of Children’s Gramsabha where children have the scope to demand their needs and scope to raise their voices.But in odisha there is no such provision yet,"" said a release.",state-editions,https://www.dailypioneer.com/images/logo.jpg,https://www.dailypioneer.com/2020/state-editions/forum-launched-in-state-for-child-rights.html
35,01-1-20,Nine IAS officers transferred in Haryana,"In a major reshuffle, Haryana Government on Tuesday issued transfer and posting orders of nine IAS officers with immediate effect.

Vijayendra Kumar, Secretary, General Administration Department and Secretary, Revenue and Disaster Management-I Department has been given the additional charge of Chief Executive Officer, Saraswati Heritage Board.

Sonal Goel, Chief Executive Officer, Gurugram Metropolitan City Bus Limited, Gurugram has been given the additional charge of Additional Chief Executive Officer, Gurugram Metropolitan Development Authority, Gurugram.

Prabhjot Singh, Commissioner, Municipal Corporation, Panipat (Designate) has been posted as Director and Special Secretary, Skill Development and Industrial Training and Employment Departments, relieving Yashendra Singh of the said charge (Designate).

Jitender Kumar, Deputy Commissioner, Rewari (Designate) has been posted as Deputy Commissioner, Jhajjar, vice Narhari Singh Banger (Designate).",state-editions,https://www.dailypioneer.com/images/logo.jpg,https://www.dailypioneer.com/2020/state-editions/nine-ias-officers-transferred-in-haryana.html
36,01-1-20,In Brief,"Capt greets people on New Year-2020

Chandigarh: Punjab Chief Minister Capt Amarinder Singh on Tuesday greeted the people on the eve of the New Year with the promise to give them a peaceful, harmonious, secure and progressive Punjab. He called upon the people to welcome year 2020 with the commitment to work collectively and zealously to preserve the ethos of secularism, sovereignty, communal harmony and national integration.

Haryana DGP lists priorities for 2020

Chandigarh: Haryana Director General of Police (DGP) Manoj Yadava on Tuesday said that the state Police is committed and played a important role in ensuring safety and security of people particularly the downtrodden and weaker sections of the society. Listing his priorities in 2020, DGP said that Haryana Police will focus on new technologies for further strengthening the professional policing so as to provide better services to the public. He also expressed hope that all ranks of Haryana Police would further bring a positive change in their behavior to ensure a better ‘public image’ of the ‘police force’.

PU declares holiday on Jan 2

Chandigarh: Panjab University, Chandigarh, has declared a public holiday on January 2, 2020, on account of birthday of Guru Gobind Singh, instead of January 1, 2020, in the Panjab University, Chandigarh and its institutions or regional centres, offices and affiliated colleges located in Chandigarh and in the state of Punjab. All meetings and examinations will be held as per schedule announced earlier.

Lehal joins as Punjab NRI Commission member

Chandigarh: Gurjit Singh Lehal on Tuesday joined as the member of Punjab NRI Commission in the presence of the state Cooperation and Jails Minister Sukhjinder Singh Randhawa, Sports and Youth Services and NRI Affairs Minister Rana Gurmit Singh Sodhi, NRI Commission chairman Justice (Retd) RK Garg, among others. Lehal assured that he would fulfill the responsibility assigned to him with full commitment and would address the issues pertaining to the NRI diaspora on priority basis.

Nominations invited for NSP, 2019

Chandigarh: The Union Ministry of Women and Child Development has invited nominations for the Nari Shakti Puraskar-2019, the highest civilian honour for women in India. The main rationale behind the award is the recognition of exceptional work for women empowerment. Spokesperson said that nearly 40 Nari Shakti Puraskars would be awarded on March 8, 2020 — on International Women's Day. The application process is open to individuals, groups and institutions for outstanding work towards women empowerment. The nominations or applications can be submitted only online on www.narishaktipuruskar.wcd.gov.in portal by January 7, 2020.

Harminder takes charge as Milkfed chairman

Chandigarh: Captain Harminder Singh on Tuesday assumed charge as the Milkfed chairman in the presence of Punjab Cooperation and Jails Minister Sukhjinder Singh Randhawa. The Minister expressed hope that Captain Harminder would ensure that Milkfed emerges as the backbone of cooperative sector and it's strengthening would be of great help to the state’s farming community. Captain Harminder said that he would fulfill the assigned responsibility with full dedication and would undertake novel initiatives aimed at cementing the bond between Milkfed and the state’s farmers.

Sohail Sen performs live at Chandigarh Club

Chandigarh: Sohail Sen, singer of the record breaking song 'Bala Bala', on Tuesday performed live at Chandigarh Club on the New Year Eve party. Sohail said: “I gave a special performance for the New Year Eve party at Chandigarh Club and named it Bala 2.O. Punjab region has a very close association with Bollywood as Punjabi culture and music is a very important part of Bollywood movies and lyrics. When I sang Bala, the crowd enjoyed the beats and danced with enthusiasm,” he said.

Elante celebrates New Yr with Happyness Day

Chandigarh: Elante Mall is all set to celebrate New Year by organizing a ‘Happyness Day’ on January 1. This initiative has been curated to spice up the experience of the shoppers by taking a Hyperlocal approach in terms of activations. During the ‘Happyness Day,’ customers can avail offers on Merchandise and enjoy food.

Reliance Jio strengthens its market in Punjab

Chandigarh: Reliance Jio on Tuesday said it has added around 3 lakh subscribers in October 2019 as per the latest telecom data released by TRAI. A statement said with this, Jio will remain the market leader telecom operator in Punjab with the highest customer base of 1.33 crore subscribers.

APRO, TPO given warm send off

Chandigarh: Punjab’s Information and Public Relations Department on Tuesday gave a warm send off to APRO Sham Sunder and TPO Manjit Singh. Department’s Additional Director Dr Senu Duggal honoured the superannuating officers and wished them well for the future, adding that the Department would always remember the services rendered by them. On the occasion, Additional Director (Press) to Chief Minister Opinder Singh Lamba, Deputy Director (Press) Dr Ajit Kanwal Singh Hamdard, Deputy Director (Advertising) Randeep Singh Ahluwalia, and Deputy Director (field) Harjit Singh Grewal described Sham Sunder and Manjit Singh as efficient and dedicated officers.

Himachal CM releases Giriraj Calendar

Shimla: Himachal Chief Minister Jai Ram Thakur on Tuesday released Calendar-2020 of Giriraj Government Weekly newspaper depicting the panoramic picture of Chandertal of Lahaul-Spiti district. The CM said that Giriraj Weekly newspaper has its grass root level reach which provides the people of the State a glimpse of policies and programmes of the State Government besides providing knowledge regarding traditions and customs of the State. Director Information and Public Relations Harbans Singh Brascon was also present on the occasion.",state-editions,https://www.dailypioneer.com/images/logo.jpg,https://www.dailypioneer.com/2020/state-editions/in-brief.html
37,01-1-20,Review cases against 55 Sikhs: Capt to UP CM,"Punjab Chief Minister Capt Amarinder Singh on Tuesday asked his Uttar Pradesh counterpart Yogi Adityanath to review a case registered against 55 Sikh devotees for allegedly defying prohibitory orders while taking out a religious procession in Pilibhit.

The demand for review was made by Capt Amarinder after giving a personal phone call to Adityanath on Tuesday morning. “Call upon UP CM @myogiadityanath to review the FIR in Pilibhit against 55 religious devotees who participated in the customary Nagar Kirtan to observe the martyrdom of the Sahibzadas,” tweeted Capt Amarinder later on.

The procession was taken out to observe Shahidi Diwas, the martyrdom of the sons of Guru Gobind Singh.

On December 29, the Uttar Pradesh Police had booked the Sikh pilgrims for allegedly violating prohibitory orders under Section 144 of the Code of Criminal Procedure (CrPC) by taking out a religious procession at Kheri Naubaramad village in Pilibhit district.",state-editions,https://www.dailypioneer.com/images/logo.jpg,https://www.dailypioneer.com/2020/state-editions/review-cases-against-55-sikhs--capt-to-up-cm.html
38,01-1-20,Baghel terms 2019 as year of achievements,"nChief Minister Bhupesh Baghel on Tuesday extended hearty greetings of New Year 2020 to the people of the state.

Chief Minister said that year 2019 was the year of achievements for Chhattisgarh. Major decisions such as waiving off farmers' loan, paddy procurement at Rs 2500 per quintal, distribution of 35kg rice to all the families, curtailing of electricity bill by half for up to 400 units, apart from historical decision of returning lands to farmers of Lohandiguda were taken and acted upon, he said.

The Chief Minister pointed out that in urban areas, registry of small land plots was started.

Collector rate was reduced by 30% and decision to free hold the land plots was taken, he said, adding Gomashta Act was amended.

Chief Minister Haat-Bazaar Clinic Yojana was launched to provide access to health services to maximum number of people, Baghel said.

Chief Minister Urban Health Scheme for urban slums, Suposhan Abhiyan for malnutrition eradication have also been initiated in year 2019, the CM recalled.

Distribution of forest land right certificates has been started again, he added.

'Narva, Garva, Ghurva, Badi' Yojana has been started to empower rural economy, he said.

Chief Minister said that works related to preservation of art, culture and traditions of Chhattisgarh has also been done in last one year.

“Public holiday has been declared on the occasions of Chhattisgarhi festivals such as Pola-Teeja, Hareli etc. The recently organized three-day National Tribal Dance Fest in Raipur was also a humble effort in this direction,” he said.

In this one year, the state government has taken a number of decisions for welfare and development of all sections of the society and has implemented them too, he said.

“In upcoming years as well, we would continue to serve people of Chhattisgarh and take every possible step towards development of the state with the goal of making Chhattisgarh one of the leading states of the country,” Baghel assured.

Chief Minister extended hearty greetings to people of the state saying that may this new year bring peace, prosperity and joy in lives of everyone. Baghel said that together “we would make our ancestors' dreams of Healthy, Prosperous and Happy Chhattisgarh come true.”",state-editions,https://www.dailypioneer.com/images/logo.jpg,https://www.dailypioneer.com/2020/state-editions/baghel-terms-2019-as-year-of-achievements.html
39,01-1-20,Gaurela-Pendra-Marwahi is C’garh’s 28th district,"A Gazette notification for constituting the 28th district of Chhattisgarh has been issued by the state government.

As per the notification Gaurela-Pendra-Marwahi will be a new district. The district will officially will be recorded as 28th district of the state from February 10, 2020.

As per the notification, the district area has been defined as complete tehsil of Pendra Road, Marwahi and Pendra. Its border in north will have Tehsil Manendragarh (District Koriya) while on the south it will have tehsil Kota (District Bilaspur and tehsil Lormi, district Mungeli. Similarly, Tehsil Katghora, District Korba will be in its east and in the west will be Sohagpur and Pushrajgarh of district Anuppur, Madhya Pradesh.",state-editions,https://www.dailypioneer.com/images/logo.jpg,https://www.dailypioneer.com/2020/state-editions/gaurela-pendra-marwahi-is-c---garh---s-28th-district.html
40,01-1-20,Saffron robe does not suits ‘worldly’ Yogi: Baghel,"Chief Minister Bhupesh Baghel on Tuesday backed the comment of Congress national general secretary Priyanka Gandhi on saffron robe of Uttar Pradesh Chief Minister Yogi Adityanath.

While talking to media persons here at police ground helipad, Baghel said saffron is a colour of a transient person who is spiritual and religious. It does not suit on Yogi Adityanath as he is entangled in worldly ‘Moh Maya’, he said.

Notable, earlier Priyanka attacking the UP Chief Minister said, ""He wears the dress (vastra) of a yogi. He wears saffron clothes. This bhagwa (saffron) is not yours; it belongs to 'dhaarmik' (religious), 'aadhyaatmik' (spiritual) tradition of Hindustan.""

""It is a symbol of the Hindu religion. Us dharma ko dhaaran kariye (adopt that religion). In that religion, there is no place for anger, violence and revenge. This is all I have to say,"" she added.

Meanwhile, Baghel also castigated Sadhvi Pragya Singh and said he does not believe that she is a spiritual person as she always ‘spits poison’. Such a behavior is not of a spiritual person, he said.",state-editions,https://www.dailypioneer.com/images/logo.jpg,https://www.dailypioneer.com/2020/state-editions/saffron-robe-does-not-suits----worldly----yogi--baghel.html
41,01-1-20,CM travels by road after chopper develops snag,"Chief Minister Bhupesh Baghel’s chopper, which was supposed to take him back to state capital after Odisha tour, developed a technical snag on Tuesday when he went to board it in Raigarh, prompting him to travel by road.

Special Secretary to Chief Minister and Director Aviation, Taman Singh Sonwani informed that hydrolic indicator of around 20 years old state chopper suddenly stopped after blinking for a while.

It happened after taking fuel at Jindal’s airstrip in Raigarh. As the mending of technical snag could take 2 to 3 hours, the Chief Minister decided to continue his rest of the journey by road, the official informed.",state-editions,https://www.dailypioneer.com/images/logo.jpg,https://www.dailypioneer.com/2020/state-editions/cm-travels-by-road-after-chopper-develops-snag.html
42,01-1-20,Bargarh Dhanu Yatra begins amid fervour,"The famous 11-day annual Dhanu Yatra kicked off amid religious fervour and splendour here on Tuesday.

Bargarh MP Suresh Pujhari, Rajya Sabha member Prasanna Acharya, Bargarh MLA Debesh Acharya, district Collector Jyotiranjan Pradhan and ADM Prabhash Dansena and Yatra convenor Sureshswar Satpathy graced the inaugural function as guests. During 11-day period, the yatra portrays the rule of demon king Kansa in Mathura, birth of Lord Krushna, miracles done by child Krushna and death of Kansa. The longest open stage drama would continue till January 10. The town has been bedecked in a royal style, symbolsing Mathura of Dwapara Yuga.

The entire mythological drama is captioned as Krishna Leela and Mathura Vijay. While Bargarh town has become Mathura, Ambapali has turned Gopapura and the Jeera river as the Jamuna river, symbolically.

To avoid any untoward situation during the yatra, the district police administration has beefed up high security measures at the venue.

“We have made elaborate security arrangements with deployment of police personals to prevent any untoward Situation during the Yatra,” said Bargarh SP Padmini Sahu.",state-editions,https://www.dailypioneer.com/images/logo.jpg,https://www.dailypioneer.com/2020/state-editions/bargarh-dhanu-yatra-begins-amid-fervour.html
43,01-1-20,Puri welcomes NY visitors with all warmth,"The Puri district administration has made adequate arrangements for a large number of visitors expected to throng the city to have Darshan of the Trinity, Lord Jagannath, Lold Balabhadra and Devi Subhada, in the Shreemandir on occasion of New Year on Wednesday.

The temple’s surroundings, ‘Bada Danda’ and newly-built shed for visitors have been well decorated with lights and flowers.

Loud speakers have been installed at the shed near the temple to air devotional songs for devotees.

As many as 60 platoons of police force and 800 police officers have been deployed to maintain law and order in the pilgrim town. Sources said tight security would remain in force from Monday evening till 2 pm on Thursday. This apart, police personnel will keep a round-the-clock vigil on the railway station, Grand Road and sea beach.

As per reports, ‘Pahuda’ ritual would be carried out at 12 am on January 1. Mangala Alati ritual would be performed at 1 am followed by ‘rosahoma’ at 4 am. ‘Mailama’ and ‘Tadapa lagi’ at 4.30 am, Abakasha at 5.15 am. Priests would perform Surya Puja at 5.45 am, ‘Dwarapala Puja’ at 6 am and ‘Besha sesha’ at 6.30 am.

‘Madhyana Dhupa’ is scheduled to be held from 11 am till 12.30 pm on January 1. Mahaprasad would be availed by 11 am.

A traffic advisory issued by the district police said that passenger buses coming from Bhubaneswar and Konark sides would use regular route to reach the Municipality Bus Stand. But buses coming from Brahmagiri side would be allowed till Jatia Babaji Chhak.

Inter-State/tourist buses coming from Bhubaneswar and Konark sides via ROB would park at the Malatipatpur Bus Terminal. Tourists can avail mini-buses/auto-rickshaws for Puri and those intending to go Satapada would avail by-pass road from Batagaon to Mangalaghat road.

Heavy and medium vehicles would not be allowed to enter Puri town on December 31 and January 1.

Four wheelers coming from Bhubaneswar side will be parked at Jagannath Ballav and Old Jail parking sites. If required, they would be parked on both sides of Grand Road from Badasankha to Gundicha Mandir.

The four wheelers coming from Brahmagiri side will be parked at Flourish India parking place near Mangala Ghat.

Two wheelers would be allowed for parking at Market Chhak, Mochi Sahi and Nilachala Ashoka. In no circumstances, two wheelers will be allowed to proceed towards Lion Gate beyond Market Chhaka.",state-editions,https://www.dailypioneer.com/images/logo.jpg,https://www.dailypioneer.com/2020/state-editions/puri-welcomes-ny-visitors-with-all-warmth.html
44,01-1-20,Govt allows peaceful protest against CAA,"Punjab Chief Minister Capt Amarinder Singh on Tuesday said that his Government would not stop students from protesting against the Citizenship Amendment Act (CAA) and other controversial actions of the Central Government, but would not allow the State’s peace to be disturbed at any cost.

Referring to the proposed January 1 statewide protest by left aligned student unions against the CAA, as well as the National Register of Citizens (NRC) and National Population Register (NPR), the Chief Minister said that protest was the democratic right of every citizen of India and people, including students, were within their right to stage peaceful dharna, march etc against these draconian initiatives of the Central Government, as long as such protests were conducted peacefully.

“Even my Government is totally opposed to CAA, NRC etc in view of the fundamentally divisive and discriminatory nature of the legislation or action initiated by the BJP-led Government at the Centre,” said Capt Amarinder.

He said: “In fact, during an anti-CAA dharna, organized by the Punjab Congress in Ludhiana on Monday, I had reiterated the Government’s decision not to allow the controversial legislation to be implemented in the State under any circumstances.”

There was, thus, no question, of barring students from coming out against these actions of the Central Government, said the Chief Minister, making it clear that as long as the protestors did not take the law in their hands in any manner, the police would not prevent them from carrying out their proposed campaign.However, the Chief Minister warned that “no violence or destruction of public property would be tolerated during the planned protest”.

“The police have been directed to come down heavily against any attempt by the protestors to vandalize public property or otherwise indulge in any violence during their protest,” he added.

Capt Amarinder also urged the student leaders to ensure that proposed protest is carried out peacefully, and to keep a check for possible infiltration of goonda elements among the protestors.

Notably, the peaceful protests in some other states had ended up in violence due to such infiltrations.

The chief minister said that the police will maintain a strict vigil not just in and around the university campuses but in other sensitive areas and public places across the state, throughout the day.",state-editions,https://www.dailypioneer.com/images/logo.jpg,https://www.dailypioneer.com/2020/state-editions/govt-allows-peaceful-protest-against-caa.html
45,01-1-20,"Cold wave continues in Punjab, Hry","Cold wave continued unabated in Punjab, Haryana and Chandigarh on Tuesday with Narnaul being the coldest place in both the States at 2.3 degrees. Chandigarh recorded a minimum of 4.8 degree Celsius, one notch below normal.

With bone-chilling cold wave prevailing in the region, Hisar shivered at 4.5 degrees Celsius, Ambala 4.6, Rohtak 4.8, Sirsa 4.9 and Karnal at 5 degrees Celsius. In Punjab, Amritsar, Ludhiana and Patiala braved chill at a low of 3.4, 4.1 and 4.6 degrees Celsius respectively. Pathankot, Adampur, Bathinda and Halwara recorded their minimums at 3.5, 3.6, 4.2 and 4.6 degrees Celsius respectively.",state-editions,https://www.dailypioneer.com/images/logo.jpg,https://www.dailypioneer.com/2020/state-editions/cold-wave-continues-in-punjab--hry.html
46,01-1-20,Hry changes office timings due to cold,"Haryana government has changed timings of its offices across the state in view of severe cold conditions.""In view of severe cold wave conditions across the state, the working hours of the offices will now be from 9.30 am to 5.30 pm as against 9 am to 5 pm. The changed timings shall remain in force between January 1 and 15,"" an official statement said.Earlier, schools in Haryana were ordered to remain closed on December 30 and 31. Between January 1 and 15, schools in the state will remain closed on account of winter holidays.In Haryana, the minimum temperature is hovering around the freezing point while day temperature has settled in the range of 10-13 degrees Celsius.",state-editions,https://www.dailypioneer.com/images/logo.jpg,https://www.dailypioneer.com/2020/state-editions/hry-changes-office-timings-due-to-cold.html
47,01-1-20,Tourism to be promoted through digitisation: Minister,"Tourism Minister Kanwar Pal on Tuesday said in 2020, Haryana tourism would further be promoted through digitisation in a big way.

""The department has already started providing online facilities regarding tourist places and resorts in the state for the foreign tourist which has led to rise in the income of the department by manifolds,"" he said in a statement.

Kanwar Pal said that the Haryana Tourism Department has signed an agreement with the 'BharatP' company, so the payment can be accepted through UPI based 'QR' code scanning through more than 120 applications like Paytm, Google-Pay, Bheem-UPI, Phone-Pe, HDFC-Payzapp, SBI YONO, Truecaller etc in Haryana government tourist resorts and petrol pumps.

Also, 120 swipe-machines have been installed at the department's resort and petrol pump to promote digitization in the department. The minister said most of the tourists visiting Haryana prefer to stay in the hotels or resorts of the tourism department.

Though the department has already started online booking, Haryana

Tourism Department has signed an agreement with online travel agents like makemytrip.com, goibibo.com, travelguru.com, yatra.com, and cleartrip.com. There has been an increase in international tourists visiting the state after digitization.

Kanwar Pal said the department has also started using social media platforms like Facebook, Twitter, YouTube, and Instagram to promote Haryana Tourism.",state-editions,https://www.dailypioneer.com/images/logo.jpg,https://www.dailypioneer.com/2020/state-editions/tourism-to-be-promoted-through-digitisation--minister.html
