,Date,Title,Article,Category,Image_link,Article_link
87,01-1-20,"DCW chief’s stolen phone found within hours, 1 held","nThe Delhi Police recovered the Delhi Commission for Women (DCW) chief Swati Maliwal’s mobile phone within hours which was stolen at Paharganj in Central Delhi. Police said that they have also arrested the accused involved in the theft. Meanwhile, Maliwal thanked police for its quick response and recovering her phone.

According to a DCW member, the theft occurred on Monday evening when Maliwal had gone to Paharganj to help an elderly woman in distress and subsequently police were informed about the incident.

The police informed her on Tuesday morning that her phone has been recovered.

Police said a man identified as Rohan alias Vinod has been arrested for allegedly stealing the phone.

“After been informed by the DCW, the police team put the stolen phone under technical surveillance, which detected the location of the phone and led to the arrest of the accused. CCTV camera footage of the area was also examined. Police teams are also verifying if the accused has any previous criminal record,” said a senior police official.

“Last night, I had gone to Paharganj to rescue an elderly woman. At the same time my phone was stolen from my pocket. After giving a complaint to the police, they caught the culprit in the night and got me my phone back. Thank you @DelhiPolice and SHO Paharganj for the quick action,” the DCW chief tweeted.",state-editions,https://www.dailypioneer.com/images/logo.jpg,https://www.dailypioneer.com/2020/state-editions/dcw-chief---s-stolen-phone-found-within-hours--1-held.html
88,01-1-20,Jaiswal holds ‘Priyanka Gandhi Rozgar Aapke Dwar’,"Former Secretary of Jharkhand Pradesh Congress Committee, Aditya Vikram Jaisawal organised ‘Priyanka Gandhi Rozgar Aapke Dwar’ programme at Maulana Azad Basti here on Tuesday.

During the programme two needy widows were handed over sewing machines and 150 blankets were distributed among the needy persons. Senior Congress leaders and youth were present on the occasion.

Jaiswal said, on the occasion, that service to the poor is true service. “Given the severe cold in the Capital city, I have decided to distribute blankets. With the aim of connecting two poor widow women with self-employment, sewing machines have been provided under the ‘Priyanka Gandhi Rozgar Aapkaar Dwar’ programme to make our society strong and prosperous,” he said.

Jaiswal said, “Our team will continue to strive and struggle continuously to be at the forefront of every field of development. In the past too, with your cooperation and blessings, you have played a strong role in the field of public service. We will continue to serve people even further.”

Dr Mustaquim Ahmed, Gulam Jawed, Krishna Sahay, Rahul Rai, Anil Singh, Nusrat Parveen, Sonu Singh, Ashish Jiyaul, Mohsin, Amarjeet Singh, Gaurav, Chintu Chaurasiya, Aaayush and Punit alongwith several others were present on the occasion.",state-editions,https://www.dailypioneer.com/images/logo.jpg,https://www.dailypioneer.com/2020/state-editions/jaiswal-holds----priyanka-gandhi-rozgar-aapke-dwar---.html
89,01-1-20,Fire tragedy averted in GK-II,"A major fire tragedy was averted after the police control room (PCR) van of the Delhi Police managed to douse the flames which had engulfed a taxi in South Delhi’s Greater Kailash-II on Monday night.

According to Sharat Kumar Sinha, the DCP, PCR, a taxi caught fire near Savitri Cinema in Greater Kailash-II and subsequently getting the information at around 11.09 pm on Monday night, the police team on PCR Mobile Patrol Van (PRV) doused the flames with the help of fire extinguishers and also arranged water from nearby houses. “The fire was controlled before fire tenders arrived on the spot and prevented a major fire with timely proactive action,” said the DCP.",state-editions,https://www.dailypioneer.com/images/logo.jpg,https://www.dailypioneer.com/2020/state-editions/fire-tragedy-averted-in-gk-ii.html
90,01-1-20,Rain may dampen NY spirit,"People of Jharkhand are likely to welcome the New Year with rainfall, thunderstorms and even hailstorms in some places. The coldest day in Ranchi was recorded in the past week on December 28 with the minimum temperature dropping to 4.8 degree Celsius.

From December 31, clouds are expected to form over many parts of Jharkhand thereby increasing the chill across the entire State. Because of the clouds, there will be an increase in the minimum temperature while the maximum temperature will drop.

“A system of induced western disturbances is likely to have an interaction with the easterly waves and due to this rainfall is expected over the State for the next few days. The wind direction is going to change which will reduce the chill, but with little sunlight and a cloudy sky, the chill factor will continue to be felt,” said Deputy Director MET Centre, Ranchi, Abhishek Anand.

Districts in the central and northern part of the State are likely to witness rainfall on January 1. Hailstorm accompanied with thunderstorm and lighting will be fairly widespread across the State on January 2. On January 3, central and south Jharkhand will witness light to moderate rainfall with thunderstorm. As per the predictions, the weather will start clearing from January 4 thus causing an increase in the chill factor across the State.

“During the winter months, there are generally two systems which cause rainfall in Jharkhand. One could be because of the induced systems currently being experienced and the other could be due to a cyclone in the Bay of Bengal. Once this system clears on January 4, due to excess moisture in the atmosphere, it will be quite foggy in the early morning hours,” added the official.

According to the weather bulletin released by the Meteorological Department Ranchi on December 31, the minimum temperature in the State capital was recorded at 5.8 degree Celsius which is 3.1 degrees below normal. The maximum temperature was 22.4 degree Celsius.

The minimum temperature in Daltonganj and Bokaro was 4.9 and 5.5 degree Celsius which is 3.8 and 6.1 degrees below normal respectively. Jamshedpur was 2.9 degree below normal at 7.8 degree Celsius.

As per the communiqué released by the weather department, from December 31 to January 4, the minimum temperature in Ranchi and its surrounding areas will be between 11 degrees while the maximum temperature will be around 18 to 21 degree Celsius.",state-editions,https://www.dailypioneer.com/images/logo.jpg,https://www.dailypioneer.com/2020/state-editions/rain-may-dampen-ny-spirit.html
91,01-1-20,Bhondsi jail inmate uses pepper spray to flee,"A 33-year-old undertrial prisoner at Gurugram’s Bhondsi prison fled police custody after he allegedly pepper-sprayed the policeman who was guarding him at Delhi’s Safdarjung hospital. The accused prisoner has been identified as Naresh (33).

According to police, the incident took place outside Safdarjung hospital on Monday.

“Sub-Inspector Shyam Phool from Bhondsi Jail of Gurgaon was accompanied by a gunman at the time of the incident.The Gurgaon Police took seven prisoners from the Bhondsi Jail to Safdarjung hospital for medical check-ups,” said a senior police official.

Around 12 pm, when the policeman got down out of the police van, the accused prisoner allegedly used pepper-spray and ran away.

“When I stepped out of the van, I saw three men rushing towards me. They fired in the air and gave the accused a spray bottle. He sprayed it in my eyes, due to which I couldn’t see anything and lost hold of Naresh. I somehow managed to caught Naresh, but his associates thrashed me caused injury on my head and fled the spot,” Phool said.

Thereafter, Phool approached Delhi police and reported the matter.

“We have registered a case under relevant sections of the IPC at Safdarjung Enclave police station on Monday,” a senior police officer said.

Naresh, who was booked for assault and attempt to murder, was in Bhondasi jail for nine months. He was taken to hospital after doctors from Bhondsi Jail said that the man had kidney stones.",state-editions,https://www.dailypioneer.com/images/logo.jpg,https://www.dailypioneer.com/2020/state-editions/bhondsi-jail-inmate-uses-pepper-spray-to-flee.html
92,01-1-20,Lajpat Nagar flyover to be renamed: Govt,"After renaming of Pink Line’s Sarai Kale Khan, INA to Sarai Kale Khan- Nizamuddin and Dilli Haat-INA, the Delhi Government has decided to rename three more locations in national Capital. Deputy Chief Minister Manish Sisodia along with Urban Development Minister Sateyendar Jain on Tuesday announced that that Pragati Maidan metro station to be renamed as Supreme Court metro station, Mukarba Chowk Flyover renamed as Shaheed Captain Vikram Batra and Badarpur-Mehrauli road to be renamed as Acharya Shri Mahapragya.

The Lajpat Nagar flyover will also be renamed as Sri Jhoole Lal Setu and Shakti Nagar Flyover as Bhagwan Mahavir Chowk in the coming months.

The name changing of the following the locations of Delhi were proposed by the naming committee. ""Mukarba Chowk is one of the most important junctions in the country. Naming the Chowk as well as the flyover after Shaheed Captain Vikram Batra who was martyred in the Kargil War in 1999 can inspire the people of Delhi and those who come to Delhi. A few months before the parents of Shaheed Captain Vikram Batra visited Delhi and requested to honor the martyr. This decision is a deserving tribute to Shaheed Captain Vikram Batra"", said Sisodia while announcing about the development.

""The demand to change the name of Pragati Maidan Metro Station in the Blue Line of DMRC to Supreme Court Metro Station was made by the Supreme Court in September 2019. The request to change the Mehrauli Badarpur Road to Acharya Shri Mahapragya was initiated be people nearby and various organizations"", said the Deputy Chief Minister.

Besides, the AAP Government also announced that the Lajpat Nagar Flyover and Shakti Nagar Chowk will also be renamed to Sri Jhoole Lal Setu and

Shakti Nagar Chowk as Bhagwan Mahavir Chowk. The Naming Committee also decided board and stone signage at Maharshi Dayanand Chowk in place of Rani Bagh, and re-install the signboards of Acharya

Tulsi Marg at different places from Andheria Mod to Gurugram.

In 2017, the Delhi Government constituted the Naming Committee headed by the Deputy Chief Minister Manish Sisodia with the mandate to name Government roads and institutions under the state purview. ""The changes are to be made effective in a month"", said the Deputy Chief Minister.",state-editions,https://www.dailypioneer.com/images/logo.jpg,https://www.dailypioneer.com/2020/state-editions/lajpat-nagar-flyover-to-be-renamed--govt.html
93,01-1-20,inbrief,"Ex SAIL Chairman passes away

Ex-SAIL Chairman SR Jain passed away on Tuesday morning at Gurugram. He was 85-year-old. SAIL family deeply mourned the sudden demise of Sheo Raj Jain, ex-Chairman, SAIL — a visionary & a technocrat par excellence. The SAIL employees said that they will remain ever grateful to Jain for steering SAIL to greater heights of accomplishments & success. He also headed Coal India Ltd. and HEC as CMD.

Health check-up of RRD employees

Every year health check-up of railway employees is done, it is not very convenient for railway employees working at far-flung stations to come to Division Hospital in Ranchi to get health check-up. Therefore, doctors go to such stations from Division

Hospital and check up their health, under this, on Tuesday, Additional Chief Medical Superintendent Ranchi Sanjeev Kumar conducted a health check up of a total of 37 railway employees working in Jonha.

New anti-bacterial thermals

This season, leading thermal wear brand Bodycare thermals has launched a new product that will not only keep one warm but its anti-bacterial technology will also ensure hygiene and lasting freshness by keeping odour causing bacteria at bay. The brand’s new range uses a new silver-based anti bacterial mechanism to address the concern of body odour and hygiene that comes with long hours of wearing a thermal wear. Perspiration and odour are a natural corollary of wearing thermals over a long period of time. However, this Bodycare range has been treated in silver line chemical, and this technology does not allow odour causing bacteria to build up.

RRD bids adieu to retiring employees

A total of 14 railway employees of various departments working in Ranchi Railway Division retired on Tuesday and were paid the retirement benefits. On this occasion, ADRM (Operations) MM Pandit extended best wishes to retired railway employees and wished for a happy and healthy life after retirement. Divisional Personnel Officer (Incharge) S Srinivas, Assistant Personnel Officer Mohammad Ibarra, Assistant Operations Manager Vibhuti Narayan Sharma, Assistant Engineer VK Parik, Assistant Divisional Finance Manager TR Meena and Chanchal Singh from Men’s Congress were present on the occasion.",state-editions,https://www.dailypioneer.com/images/logo.jpg,https://www.dailypioneer.com/2020/state-editions/inbrief.html
94,01-1-20,"Guv, CM extend New Year’ s greetings to People","Governor Lalji Tandon, Chief Minister Kamal Nath, Public Relations Minister PC Sharma and other Cabinet Ministers have extended greetings and best wishes to State's people on New Year.

In his greeting message, the Governor wished lots of happiness and success for all in New Year. The Governor has urged youths for resolve to actively participate in development of the State next year. He wished people health, happiness and prosperity and hoped that new heights of development will be achieved in the state during New Year.

Chief Minister Kamal Nath, extending greetings and best wishes to people of the state, Chief Minister said that 2020 will be the year of new resolutions and new parameters of development for the state. He urged the people to be a part of development processes and always be ready to contribute.

Nath said that Madhya Pradesh has a distinct identity as a State nourishing communal harmony and peace urging the people to further enrich the heritage of harmony.

Madhya Pradesh is progressing with the cooperation of all. We would march ahead even faster in New Year. Nath urged to contribute their mite in making Madhya Pradesh a prosperous and developed state.

Public Relations Minister PC Sharma has extended greetings and best wishes to state's people on New Year.

In his greeting message, Sharma wished people happiness, health and prosperity. He said that Madhya Pradesh has scaled new heights of development in the country. As a result, Madhya Pradesh is being counted among developed States. The Minister said that effective and concrete efforts would be made in year 2016 to give new dimensions to state's development.

He urged people to work unitedly with commitment for state's progress. He also urged every citizen to take resolve for this.

New and Renewable Energy Minister Harsh Yadav, extending good wishes to the citizens, said that the coming year would be more useful for the people, as the State government would take more steps towards welfare of the people.",state-editions,https://www.dailypioneer.com/images/logo.jpg,https://www.dailypioneer.com/2020/state-editions/guv--cm-extend-new-year----s-greetings-to-people.html
95,01-1-20,Bank staff held for taking bribe for IAS officer,"The Vigilance police on Tuesday arrested a bank relationship manager for allegedly accepting a bribe of Rs 1 lakh on behalf of IAS officer Bijay Ketan Upadhyaya, who was arrested from his office on corruption charge on Monday.

Santosh Kumar Pattnayak, the relationship manager of the Bapuji Nagar branch of YES Bank here, was apprehended in front of his office while having accepted the bribe from a sprinkler irrigations systems supplier, a Vigilance department statement said.

Pattnayak had allegedly been receiving bribes from different companies, dealers and suppliers on behalf of the 2009-batch IAS officer Upadhyaya, the statement said.

After his arrest, Upadhyaya, who was Director of Horticulture, has been suspended by the Government.

Pattnayak had received the bribe of Rs 1 lakh from a representative of the SRM Plastochem Private Ltd for approving payment of Rs 50 lakh to the company, the Vigilance statement said. The SRM Plastochem is an empanelled supplier under the Directorate of Horticulture for supply of sprinklers to eligible farmers under the Pradhan Mantri Krishi Sinchayee Yojana (PMKSY). Upadhyaya had directed the company to pay the bribe to Pattnayak, the statement said. The Vigilance has registered a case against the IAS officer under the Prevention of Corruption (Amendment) Act, 1988.",state-editions,https://www.dailypioneer.com/images/logo.jpg,https://www.dailypioneer.com/2020/state-editions/bank-staff-held-for-taking-bribe-for-ias-officer.html
96,01-1-20,25 BJD youths fined for helmetless driving,"Helmetless driving has proved costly for 25 Biju Yuva Janata Dal (BYJD) members as they had to pay Rs 1,000 each for violating the new Motor Vehicles Act.

Notably, the BYJD members had held a bike rally in the city on the 23rd foundation day of the BJD on December 26.

The BYJD activists took out the rally from Station Square to the party office, where they welcomed party president and Chief Minister Naveen Patnaik.

But many onlookers were quick to notice the traffic rule violation and took to Twitter to question whether the Commissionerate police would initiate any action against the violators.

Following the public reaction on Twitter, the Commissionerate police on December 28 had assured of actions against the violators after scrutiny of video footages. “This being a problem in all political rallies in the country, we’ve to devise ways for dealing with it in future,” the Commissionerate police had added.",state-editions,https://www.dailypioneer.com/images/logo.jpg,https://www.dailypioneer.com/2020/state-editions/25-bjd-youths-fined-for-helmetless-driving.html
97,01-1-20,Postmortem refutes rape in N’rangpur case,"In a new turn of events in the case of alleged Kosagumuda minor girl rape and murder, the postmortem report of the victim has mentioned that she was not raped. But the girl’s family members are not ready to accept the autopsy report read out to them by police officials on Tuesday. They stuck to their stand that the girl was raped before being murdered. They demanded that police exhume the body of the girl and get a fresh postmortem conducted.

“We want the police to exhume the body from the coffin and carry out autopsy (again). All the accused must also be arrested by January 4 next. Circumstantial evidences at the spot show that the girl was raped and murdered. But the current postmortem is talking of strangulation only without mentioning anything about rape,” a relative of the girl said.

On the day, DIG (Southern Range) Satyabrata Bhoi and other police officials visited the crime spot and talked to the girl’s family members. Notably, on December 13 when the girl had gone outside her house to attend nature’s call, she went missing. Next morning, family members and villagers found her body lying in a field some 300 metre from the house. Two jeans trousers and a pair of sandals were also found near the spot.

Following this, her family members had alleged that the girl was raped and murdered. Police handed over the girl’s body to her family late on December 13 night after postmortem. Alleging delay in handing over the postmortem report to the girl’s family, the Nabarangpur District Congress recently observed a bandh and demanded that the accused be arrested at the earliest.",state-editions,https://www.dailypioneer.com/images/logo.jpg,https://www.dailypioneer.com/2020/state-editions/postmortem-refutes-rape-in-n---rangpur-case.html
98,01-1-20,JSpur Muslims stage anti-CAA rally,"As many as 3,000 Muslims from Jagatsinghpur district on Tuesday held a demonstration in front of the Collector’s office here opposing the CAA, the NRC and the NPR. The agitators submitted a memorandum addressed to the President of India through the Collector demanding withdrawal of what they called 'anti-Constitutional' laws.

Speaking at the protest meeting, minority leader Sk Tamij Uddin said the Government should first identify the people who should be given citizenship and people who have illegally entered into the country. Any person’s citizenship should not be based on religion, he stressed.

India is a very inclusive country which is a land of all communities, all religions, all castes and creeds, said another leader Mir Ajmir Ali, adding, ""We are not a dictatorship, rather we are a democracy.""

Among others, Mohammad Nazir, SK Jahir Uddin, Ekbal Ahemmed Shah, Zakir Uddin Khan and Mahammad Lokman spoke.",state-editions,https://www.dailypioneer.com/images/logo.jpg,https://www.dailypioneer.com/2020/state-editions/jspur-muslims-stage-anti-caa-rally.html
99,01-1-20,102 troupes to participate in Dulduli,"All arrangements are nearing completion for Jharsuguda district festival ""Dulduli"" on Wednesday. In a Press meet on Tuesday under the chairmanship of district Collector Saroj Samal, details of the programme were given.

Samal said the 26th foundation day of Jharsuguda district and Dulduli festival would be held with pomp and grandeur. ""The main aim of the festival is to bring to limelight the hidden talents of the district and promote them. 21 cultural troupes of the district have been invited to perform in the festival. Besides, 12 troupes from five other States and 69 from different districts of Odisha would also participate in the festival. A total of 316 stalls would be opened in the Pallishree Mela.

ADM Pradeep Sahoo, Tapas Ray Choudhury, Gokul Patel, Anandini Padhi and DIPRO Ajay Jena were present.

Jharsuguda MLA and Health Minister Naba Kishore Das will inaugurate the Dulduli.",state-editions,https://www.dailypioneer.com/images/logo.jpg,https://www.dailypioneer.com/2020/state-editions/102-troupes-to-participate-in-dulduli.html
100,01-1-20,SABARD holds anti-graft drive in B’pur,"The Special Association of Advocates against Barred Corruption and Range Domination (SABARD) organised an anti- corruption drive at the Geeta Bhawan here on Monday.

A team led by SABARD president and convenor Dillip Kumar Patro held talks with the employees of Geeta Bhawan and enquired about accounts for monetary receipts and expenditures. The religious institution reportedly receives Rs 10 lakh from different sources per annum.

However, tension prevailed as officials didn’t respond to the team’s queries and allegedly threatened Patro of dire consequences.

Earlier to this move, Patro had sought information in this regard from the Chief Secretary through an RTI application.

“The Gita Bhawan collects about Rs 10 lakh per annum. But its officials are spending the as there own money. Conscious citizens should oppose this,” alleged Patro.

Among others, SABARD advisor Surendranath Sahu, Dr Siva Prasad Mishra, Kailash Panigrahi, Rama Prasad Panda and Hemanta Mishra were present.",state-editions,https://www.dailypioneer.com/images/logo.jpg,https://www.dailypioneer.com/2020/state-editions/sabard-holds-anti-graft-drive-in-b---pur.html
101,01-1-20,Forest officials attacked in Konark,"A Range Officer and a Forest Guard were attacked by a mob for stopping an illegal parking lot construction along the Konark-Puri marine drive on Monday.

Reports said the parking space was being constructed in the sanctuary area allegedly by Achyutpur sarpanch Bhakta Ballav Das and his supporters when Range Officer Benudhar Behera along with a Forest Guard reached the site. The officials seized a JCB machine engaged in the construction work and detained one person.

Sources said that on their way back to office, Behera and the Forest Guard were attacked by the sarpanch and his supporters. On the other hand, Achyutpur sarpanch said the parking space was being constructed on the direction of administration to ease parking problem arising due to the ongoing Eco Retreat Festival. He also refuted the allegations of the forest officials.

On the basis of the complaints of the both parties, the police launched a probe into the matter.",state-editions,https://www.dailypioneer.com/images/logo.jpg,https://www.dailypioneer.com/2020/state-editions/forest-officials-attacked-in-konark.html
