,Date,Title,Article,Category,Image_link,Article_link
0,01-1-20,Taxation reforms crucial,"Taxation has been a weak area for the Central Government. Statutory compliances have reached a saturation level and some relaxation is needed in 2020

The year 2019 started with all political parties in election mode due to the general elections and has ended with large-scale protests due to the Citizenship Amendment Act, 2019 (CAA) and the National Register of Citizens (NRC). The economy and taxation usually take a back seat when the country has such a volatile environment and this is exactly what happened in India. By and large, 2019 was not good on the economic front and the fiscal situation was in such a state of turmoil that it forced the Finance Minister to review the situation every week and come up with stimulus packages.

Taxation has been a weak area for the Narendra Modi-led Government. Statutory compliances have reached a saturation level and some relaxation is needed. Till now the Government has paid heed more to the bureaucracy than the professional fraternity on this front. As we enter a new year with a pall of economic gloom hanging over it, full-fledged economic and taxation reforms are the need of the new decade. Here are some reforms the Government could consider in the days ahead.

Direct tax reforms: India faced weak demand in 2019 that led us to the economic slowdown. The Central Government reduced corporate tax rates up to 10 per cent, the biggest cut in the last three decades. As per estimates, this cost the exchequer around Rs 145,000 crore. The Government reduced corporate tax in anticipation that after the cut businesses would have a better cash flow and they would invest it further, resulting in employment generation and creation of demand. The results of this cut are expected in 2020. If the excess investments meet the Government’s expectation then they would ease the pressure of rising unemployment. But, if this calculated move backfires then it would be a setback to the Government because it promised a lower corporate tax rate. If even after sacrificing revenue the Government is unable to recover money, then it would work on reducing other deductions and so on.

Cut in individual income tax rates: The economic deceleration was due to weak demand. The Government slashed corporate tax and increased supply — which was already abundant — whereas the requirement was for increasing demand. Therefore, to create demand the Government could reduce income tax rates and create some more sub-slabs. For instance, the current tax rate is 20 per cent for the Rs 5 lakh to Rs 10 lakh slab. This could be reduced to 10 per cent and a new slab of Rs 10 lakh to Rs 20 lakh could be created with a 20 per cent tax rate.

Direct tax code: The current Income Tax Act was introduced in 1961 and since then the business environment has changed. It needs a total revamp so that a Direct Tax Code (DTC) is required. The UPA Government had proposed a DTC but due to differences between P Chidambaram and Pranab Mukherjee, it never saw the light of day. In August the Akhilesh Ranjan task force submitted its report along with a new draft for the DTC and recommended its implementation.

Tax profits by multinationals operating in the digital space: India has raised apprehensions at global forums, particularly at the Organisation for Economic Co-operation and Development (OECD), about profit-sharing by multinationals operating in the digital space. Currently, the entity is taxed in the country where it has a physical presence. “Base Erosion Profit Shifting” Project (BEPS) will be addressing the core issue of such taxation. In the digital world, there is no nexus between physical presence and revenue generation. While traditional taxation statutes take into account things like assets and employees located in the country, in the digital world these have become irrelevant to some extent. So perhaps this principle should be modified to a large extent. The introduction of “equalisation levy” was the first baby step towards such taxation and thus much more comprehensive tax may be levied on this in the next Union Budget.

GAAR to SAAR: General Anti-Avoidance Rules (GAAR) are aimed at curtailing tax avoidance and empower authorities to deny benefits to arrangements not having any commercial substance other than achieving tax benefit. Tax avoidance is legal but large-scale revenue loss can occur due to aggressive tax planning. To counter this, GAAR provisions were introduced recently. India also has Double Taxation Avoidance Agreements (DTAA) with many countries and these will override the GAAR except when there are Impermissible Avoidance Arrangements (IAAs). India could also introduce Specific Anti Avoidance Rules (SAAR), aimed at individuals on case by case provisions.

Reforms expected in Goods and Services Tax: While being introduced GST was called the “Good and Simple Tax” but unfortunately due to the compliances and complications it is neither simple nor good. Falling GST collections and increasing compensations to States have further complicated the problems. The Government’s priority should be to sort out the mess GST has created.

E-Invoice, Q-R codes and invoice reference number: Electronic Invoice (e-Invoice) is a system in which “Business to Business” (B2B) invoices are authenticated electronically by GST Network (GSTN) for further use on the common GST portal. Under the proposed electronic invoicing system, an identification number will be issued against every invoice by the Invoice Registration Portal (IRP) to be managed by the GSTN. E-invoicing will be mandatory from April 1, 2020, for businesses having a turnover of Rs 100 crore or more. It will start on a voluntary and trail basis from January 1, 2020, if the turnover is Rs 500 crore or more and from February 1, 2020, if it is Rs 100 crore or more. It is applicable for B2B invoices only and the QR code is required to be mentioned on B2C invoices. It is applicable on domestic B2B sales, export sales and sales to SEZ units. Web portals for the same have been notified recently.

New GST returns: In the GST Council meeting held on May 24, 2018, on the recommendation of the Group of Ministers on IT simplification, the GST Council vowed to introduce New Simple Returns for GST compliances. The formats of the new returns like ANX-1, ANX-2, RET-1/2/3 are in the public domain and would be available for trial from January. But as ANX-1 and ANX-2 are equivalent to GSTR-1 and GSTR-2 it would be interesting to watch whether these new returns will ease off the burden of compliance from the taxpayers or further complicate the current problem.

New GST Annual Return forms: If someone has to understand the mess created by GST compliances then one has to see the position of GST Annual Returns. GST was introduced on July 1, 2017, and for the Financial Year (FY) 2017-18 returns were to be filed by December 31, 2018. Now the date has been further extended to January 31, 2020. Three years after GST was introduced, the Government is yet to provide a simple form for Annual Return. Till the third week of December, the Government was working on providing a new utility/form for returns for FY 2017-18. So when will returns for FY 2018-19 and FY 2019-20 be filed?

Real-time availability of ITC: Input Tax Credit (ITC) is the spirit of GST and seamless credit is its backbone. But the falling GST collections forced the Government to introduce provisions against the spirit of GST by restricting 20 per cent credit over and above the matched GST (GSTR-2A) in November and then to 10 per cent in the December 18 GST Council meeting. If the economic slowdown keeps on reducing GST Collections then the Government would allow only Real Time-matched GST. This may force corporates to deal only with large enterprises and may be detrimental to the MSME sector.

Compensation to States: When GST was introduced the Centre promised States compensation for losses, if any, for collection of indirect taxes viz-a-viz GST. Growth at 14 per cent was promised and agreed upon. In the GST Council meeting, the Government asked States to agree to a growth rate of 10 to 12 per cent. This is lower than the promised compensation. Will the States agree to this or not would be seen later. Also, the Centre is not regular in its payments to States and the August compensation was released just a few days before the council meeting. The Government has largely missed its GST revenue collection target.A new year comes with new hopes and expectations for everyone but for the present dispensation at the Centre it has come with more challenges and complications on the taxation front.

(The writer is an author and GST and economics specialist)",columnists,https://www.dailypioneer.com/uploads/2020/story/images/big/taxation-reforms-crucial-2020-01-01.jpg,https://www.dailypioneer.com/2020/columnists/taxation-reforms-crucial.html
1,01-1-20,Improve your financial health,"Make financial resolutions for 2020 by all means but set small, realistic financial goals in order to be able to achieve them

A new year is always the epitome of hope, new promises and a reflection on last year’s decisions and resolutions. Did you make any financial resolution in January 2019? Were you able to keep them or were they just washouts? Whatever position you are in, today is a good time to assess your financial tally for the last year and look for ways to improve it. According to research in the Journal of Clinical Psychology, only eight per cent of the people who make New Year resolutions achieve them. This New Year, which is also the beginning of a new decade, gives us another opportunity to make some financial resolutions and be among the eight per cent achievers of the world. Here are some New Year resolutions that are not too difficult to keep and might help improve your economic outlook.

Determine your net worth: If you have not done it already, the year ahead is a good time to assess your net worth, which can give a clear idea about where you currently stand in terms of assets and liabilities. It will also give you an idea of how to improve your financial standing by spending less, reducing liabilities and improving savings. So, this year, begin by recalculating your net worth, keep a close watch on your progress towards achieving financial goals and correct any past mistakes.

Out of sight, out of mind: Having funds in your account can lead to temptation as mostly our expenses increase to meet the account balance. To save money, it is very important to earmark some of the surplus funds and transfer them into a separate account that is not easily accessible, making it less tempting to spend the cash that you have managed to save.

Bring down your debt: Uncontrolled debt can lead to financial distress in case you have difficulties in paying regular interests. This situation can easily lead to bankruptcy or insolvency. This year contemplate on your strategy to pay personal or home loans. Once in awhile, plan for an extra payment towards your home loan.

Reduce your credit card outstanding: In case you have an outstanding on your credit card, the beginning of the year is a good time to calculate how much you can afford to pay off realistically during the ensuing months. Try not to charge additional purchases on those cards while you're trying to pay down what you owe. If you have high-interest credit card balances it would be more beneficial to pay off those high-interest debts than to add to your savings.

Examine your credit report: It is important to maintain your CIBIL score so that your credit record is impeccable. If your score is less, take steps to repair any negative aspects. A poor credit report could increase the interest rates on any future loans that could eat into your potential savings.

Diversify your portfolio: Diversification is an important strategy to insulate your investments against market volatility and rebalance your portfolio to include several asset classes. This strategy will increase the variety in your portfolio.

Change, if you have outgrown your investments: The type of portfolio that you build and the type of investment avenues where you put in your money will change with time, age and the phase of your life. A young, unmarried investor’s portfolio would be much different from that of a newly-married investor or an investor with grown-up children. So whatever your phase of life is, check if your investments till meet your financial goals.

Spend sufficient time in portfolio review: Spending enough time to review your investments is a good strategy to overcome any sudden changes. Review investments at least once a quarter and never leave investments on autopilot.

Look at the big picture: Do not get involved in micromanaging your investments and day-to-day movements of the stock markets. Always be focussed on the long term as short-term ups and downs get smoothened over time. Don’t panic and churn your investments by following a herd mentality. Have patience and give time to your investments to work and generate returns for you. Stay committed to your existing strategy, with a touch of flexibility, to be able to adjust according to changing market conditions.

Get Organised: It is important to understand whether you are impulsive or methodical in your investment style. Are your investments sporadic or do you follow a regular pattern? If you find that your organisational skills are lacking, do something about it. You can set up regular investing, like a systematic investment plan; or you can set reminders in your calendar each month or a few times a year to take a look at your account. The bottom line is that to be able to stick to your financial resolutions this year to accomplish great financial health in the future, you must set achievable, realistic financial goals. Take this day to chart out simple financial resolutions and maintain a checklist to keep track of how you are doing throughout the year so that you can make any necessary modifications. Through careful and concerted steps, let’s resolve to improve our financial health in 2020.

(The writer is Associate Professor, Amity University, Noida)",columnists,https://www.dailypioneer.com/images/logo.jpg,https://www.dailypioneer.com/2020/columnists/improve-your-financial-health.html
2,01-1-20,All eyes on Delhi polls in new year,"The lower and middle classes are happy with the AAP Government as they are satisfied with the way their bread and butter issues are tackled. While it is too early to predict anything, it is likely to be advantage AAP

After the just-concluded Jharkhand Assembly polls, all eyes are now on Delhi where Assembly elections are likely to be held soon. The present Aam Aadmi Party (AAP) Government’s term ends in February 2020 and the fight for Delhi is going to be fierce as it is crucial for all players in the fray. They have already sounded the poll bugle, though polling dates for the elections, that are set to be the first in the new year, are yet to be announced.

It will be a three-dimensional fight as the nature of the poll battle in the Capital has changed in the last few years with the entry of the AAP in 2013. Earlier it used to be a direct fight between the Congress and the BJP.

Whether the BJP will be able to gain ground after its thumping victory in the 2019 Lok Sabha polls remains to be seen. The BJP won all the seven Lok Sabha seats but if the Congress and the AAP had come together the saffron party would not have won all of them. In the 2014 Lok Sabha polls, when the Modi wave swept the country, the AAP got 33.1 per cent votes while the Congress got 15.1 per cent. Their combined vote share was two percentage points more than that of the BJP.

Though Delhi is a small State the upcoming polls are crucial as it is the Capital of the country. The Congress too is hoping to improve its position in Delhi where it had ruled for three continuous terms before losing power to the AAP. Unfortunately for the grand old party, it is facing a leadership crisis not only at the national level but also at the State level, with indiscipline and groupism dogging it. It appears to be the weakest among the three parties in the fray.

The polls are taking place in a charged atmosphere amid agitations against the Citizenship Amendment Act, 2019 (CAA) and the National Register of Citizens (NRC). These agitations might continue at least until the Delhi elections are conducted. The agitations have spread all across the country with the North-east and Uttar Pradesh witnessing not only unrest but also violence. The students had jumped into the fray after the highhanded behaviour of the Delhi Police at the Jamia Millia University recently. They have the support of many other universities not only in India but also abroad. Added to that, the economy of the country is on the slide and normalcy is yet to return to Jammu and Kashmir after the abrogation of Article 370 in August.

The AAP Government and the Centre are also facing flack on the high level of pollution choking the Capital. While Kejriwal is defending his throne, the BJP is keen to come back to power in a State where it was strong in the past. In the last two Assembly elections, in 2013 and 2015, the AAP polled 29.49 per cent and 54.3 per cent votes respectively, with the latter giving it an unprecedented majority of 67 seats out of 70. However, since then, things have not been smooth for the AAP. Many senior party leaders have been expelled and Delhi Chief Minister Arvind Kejriwal has been repeatedly accused of being authoritarian.

In the fight for Delhi all the players are using social media, holding public meetings and running campaigns to target each other. They have understood the power of advertising in wooing voters and are also reaching out to the electorate with their roadshows, door-to-door campaigns, and so on. Prime Minister Narendra Modi himself led the BJP’s campaign last Sunday as the party is depending on him to capture Delhi after a gap of three decades.

The Central Government and the Delhi Government have been at loggerheads on many issues and disagreements over air pollution may set the tone for the upcoming Assembly polls. Delhi elections will be fought on local issues surrounding schools, hospitals, power, water, dengue, pollution, security and so on and also the NRC, CAA and the National Population Register.

The local BJP is hoping to make use of the recent passage of a Bill for regularisation of illegal colonies, which will benefit lakhs of slum dwellers and poor people.

In 2008, the Congress Government in Delhi had stormed back to power after it distributed provisional certificates to 1,218 unauthorised colonies.

The BJP has a support base among the traders and the middle-income groups in Delhi. While the AAP and the BJP are running their campaigns at different levels the Congress is lagging. The AAP and the Congress share a vote base — Muslims and marginalised sections of society.

The AAP has launched its poll campaign, with the slogan of “Acche beete 5 saal, lage raho Kejriwal (the last five years have been good, keep going Kejriwal).” The party is ahead in terms of its reach in unauthorised colonies and slum clusters. In the last five years, the Delhi Government has made massive investments in creating health, education and civic infrastructure in these areas. The lower and middle classes are happy with the AAP Government, as they are satisfied with the way their bread and butter issues are tackled. While it is too early to predict anything, it is likely to be advantage AAP.

(The writer is a senior journalist)",columnists,https://www.dailypioneer.com/images/logo.jpg,https://www.dailypioneer.com/2020/columnists/all-eyes-on-delhi-polls-in-new-year.html
