,Date,Title,Article,Category,Image_link,Article_link
192,25-4-20,"Two militants, an associate killed in encounter with security forces in J-K","Two militants and a ""hardcore"" militant associate were killed in an encounter with security forces in Pulwama district of Jammu and Kashmir on Saturday, police said.

Security forces launched a cordon-and-search operation in the Goripora area of Awantipora in the south Kashmir district in the early hours of Saturday after receiving specific information about the presence of some militants there, a police official said.

The search operation turned into an encounter after the militants fired upon the forces, who retaliated, he said.

In the ensuing gunfight, two militants and one ""hardcore"" associate of the militants were killed, the official said.

He said searches were going on in the area and further details were awaited.

",top-stories,https://www.dailypioneer.com/uploads/2020/story/images/big/two-militants--an-associate-killed-in-encounter-with-security-forces-in-j-k-2020-04-25.jpg,https://www.dailypioneer.com/2020/top-stories/two-militants--an-associate-killed-in-encounter-with-security-forces-in-j-k.html
193,25-4-20,Plasma therapy results promising: Kejriwal,"CM urges recovered patients to donate plasma to help the ailing fight corona

After initial positive results of the use of plasma therapy on four Covid-19 patients at Lok Nayak Jai Prakash Narayan Hospital (LNJP) in the national Capital, Chief Minister Arvind Kejriwal appealed to the recovered patients on Friday to donate their plasma to help other patients recover and contain the fatalities caused by the deadly virus.

Addressing an online media briefing, Kejriwal said more clinical trials of plasma therapy will take place over the next two-three days, and his Government will seek the Centre’s nod next week for using the technique on all seriously ill Covid-19 patients.

The CM expressed hope that the Centre will give a go-ahead to the treatment regimen. Kejriwal said two patients have recovered while other two are showing improvement and will be soon out of the Intensive Care Unit (ICU).

“Our efforts in the fight against corona are two-fold: One, how to contain the spread of corona which includes social distancing, lockdown and various other measures, and two, how to control the deaths caused by the pandemic,” said Kejriwal, who was joined by SK Sarin, the director of the Institute of Liver and Biliary Science, at the Press conference.

Dr Sarin, who is heading the task force of the Covid-19 patients, said, “Our initial plan was to use plasma therapy as per the age-old traditions, as it had also been used in the 1900s. This virus has three phases, first is when the virus enters the body, second is the pulmonary phase which affects the lungs and causes difficulty in breathing.”

“Ten days ago, we had got permission from the Central Government to conduct clinical trial of plasma therapy only on four serious Covid-19 patients admitted at the Lok Nayak Jai Prakash Narayan Hospital. The initial results are every encouraging and good. It gives a ray of hope to save people’s lives from coronavirus,” he said.

The four patients who were given plasma therapy have shown improvement in their health condition, respiratory rate and oxygen saturation, Kejriwal said.

Two of the four patients, whose condition was serious, have now been shifted to general ward from the ICU and two others are also responding well, he said.

The Chief Minister, however, said that these are only initial results and nobody should think that the government has found a cure for coronavirus.

In the plasma therapy, antibodies from the blood of a patient who has recovered from Covid-19 are used to treat serious patients.

“Once we get nod from the Centre, we will be able to use plasma therapy on all serious Covid-19 patients across Delhi. I reiterate that this is early result which is very encouraging. We must not think that we have found a cure for Covid-19,” Kejriwal said.

Sarin said donating plasma would be an act of patriotism by recovered patients. It does not lead to any weakness in the body of the donor, he said.

“It is not blood donation...Plasma therapy is also inexpensive,” he said.

Kejriwal said people who have fully recovered from coronavirus would be saving lives of people by donating their plasma.

“In the plasma therapy, donor plays an important role. Plasma is extracted from their blood as our doctors often do in case of dengue patients. “I appeal to you (who have recovered from COVID-19) with folded hands to come forward and donate your plasma. Your plasma will be given to only serious patients. You can save their lives,’’ he said.

On Thursday, the total number of coronavirus cases in the national stood at 2,376, with 128 new cases and two fresh deaths being reported in a day.

Of the total number of 50 fatalities reported till Thursday, 27 of the deceased were aged 60 years and above, constituting over 52 per cent of fatalities.",page1,https://www.dailypioneer.com/uploads/2020/story/images/big/plasma-therapy-results-promising--kejriwal-2020-04-25.jpg,https://www.dailypioneer.com/2020/page1/plasma-therapy-results-promising--kejriwal.html
194,25-4-20,"Maha tops in new cases, rate abates; spike in MP","Maharashtra and Gujarat, two of the worst affected States, saw a decline in the coronavirus cases on Friday, but Madhya Pradesh recorded a major spike as India recorded 1,395 cases during the day, taking the total to 24,434 and death count to 780.

In the last 24 hours ending 8 am on Friday, the country had reported 1,752 new coronavirus cases and 37 deaths.

As of 10 pm, on Friday, Maharashtra added 390 cases and 18 deaths as against 728 cases on Thursday. Maharashtra total count of positive cases stood at 6,817 and a casualty of 300.

Gujarat, which recorded 250 plus cases on Thursday, saw reduction of Friday, adding just 190 cases for total count of 2,815 and death count of 127. Delhi recorded 138 cases and three deaths. Now the national Capital has a total of 2,514 cases and 53 casualty.

Rajasthan added 44 new cases, Madhya Pradesh 159 and Tamil Nadu 72. Uttar Pradesh added 11 new cases for total count of 1,621 and 25 deaths.

Incidentally, States like Bihar which were virtually out of corona radar till now, have started to report significant number of cases. On Friday the State reported 44 cases, the single day high, for total ,count of 214.

Union Health Ministry Joint Secretary Lav Agarwal said that in the last 28 days, 15 districts have had no new case. Till date, there are 80 districts in the country that have reported no new cases in last 14 days. “A total of 4,748 people, which is 20.57 per cent of the total number of cases, have been cured so far,” Agarwal said.

“As on today, 15 districts in the country which earlier had cases have not reported any fresh cases since the last 28 days. Besides districts already highlighted, three new districts which got added to this list include: Durg & Rajnandgaon from Chhattisgarh; and Shivpuri from Madhya Pradesh,” said the official at the routine press briefing here.

He added, “A total of 80 districts from 23 States/UTs have not reported any new cases since the last 14 days.”

However, so far, 432 districts have confirmed cases in the country. Over the past two days, Mumbai, Pune, Ahmedabad, Surat and Jaipur districts have seen the biggest spike in confirmed cases nationally. These five districts account for 51 per cent of new cases over this period.

Among districts, Mumbai (3,746 cases) has reported the most number of cases nationally, followed by Ahmedabad (1,501) in Gujarat, Pune (945) in Maharashtra, Indore (923) in Madhya Pradesh and Jaipur (720) in Rajasthan. These top five districts now account for 37 per cent of confirmed cases in the country, according to data available from various reports.

New Delhi (484), Hyderabad (479) in Telangana, Thane (477) in Maharashtra, Surat (415) in Gujarat and Chennai (378) in Tamil Nadu are the other high-burden districts which figure in the list of top ten districts. The top ten districts account for 47 per cent of the confirmed cases nationally.

Worldwide, more than 2.6 million people have now been detected as Covid-19 patients globally even as several parts of the world, including India, continue to be under lockdown to contain the pandemic.",page1,https://www.dailypioneer.com/uploads/2020/story/images/big/maha-tops-in-new-cases--rate-abates--spike-in-mp-2020-04-25.jpg,https://www.dailypioneer.com/2020/page1/maha-tops-in-new-cases--rate-abates--spike-in-mp.html
195,25-4-20,4 cr users may lose cellphones by May end if curbs not lifted,"About 4 crore mobile phone users in the country are expected to be without handsets due to faults and breakdowns by May-end if restrictions on the sale of handsets and spare parts continue, an industry body said on Friday.

At present, more than 2.5 crore mobile customers are with non-functional devices due to non-availability of components and the restriction on sales of new handsets due to the lockdown to contain coronavirus, the India Cellular and Electronics Association (ICEA) claimed.

Operations of telecom, internet, broadcast and IT services are permitted but not for mobile devices that are pivotal for accessing these services.

The ICEA, whose members include leading handset makers like Apple, Foxconn, and Xiaomi, said on an average, approximately 2.5 crore new mobile phones are sold every month and the active population of mobile phones is 85 crore currently.

“A very large proportion of these purchases are replacements.

In addition, even with a much-improved quality of phones and mobile devices, there is an approx 0.25 per cent break down on a monthly basis. With the current mobile base at nearly 85 crore, it is clear that nearly 2.5 crore individuals are suffering due to non-availability of new devices or repair of their existing devices,” ICEA said.

The industry body has approached government authorities several times including the Prime Minister for including mobile phones in the list of essential goods as there can be life threatening situations for many without the devices.

“We have written to the government that these numbers will expand to nearly 4 crores before the end of May. It is critical that mobile device sales via online, and in a phased manner via retail, as well as service centres with facilities for home delivery and pickup must be declared as “essential services”, in addition to grocery and medicines,” ICEA Chairman Pankaj Mohindroo said.

Some district administrations have made the government’s coronavirus case tracking app Aarogya Setu mandatory for those who venture out of their homes, making it challenging for those who do not have smartphones.

ICEA said that it has made a joint representation with the traders’ body CAIT to the Home Minister, Home Secretary, Commerce & Industry Minister, Secretary DPIIT and Secretary MeitY (also currently the chair of the Empowered Group on Technology and Data Management) for allowing sales of mobile devices under the “essential services” category.

The Ministry of Electronics and IT has recommended to the Home Ministry to include mobile devices including laptops in the list of essential goods but the MHA is yet to accept it. PTI",page1,https://www.dailypioneer.com/images/logo.jpg,https://www.dailypioneer.com/2020/page1/4-cr-users-may-lose-cellphones-by-may-end-if-curbs-not-lifted.html
196,25-4-20,Covid to diminish IT sector revenue growth to decadal low of 2%: Crisil,"The Indian IT sector is staring at a revenue growth sliding to a decadal low of up to 2 per cent and an impact on profitability owing to narrowing of margins due to the Covid-19 pandemic, a report said on Friday.

The companies will lose out on new deals, which will compromise future revenues, and also face reverses on the exiting ones, which may be renegotiated as their overseas clients face difficulties due to the lockdowns, domestic rating agency Crisil said in the report.

The $97 billion IT sector is one of the largest service exporters and helps the Indian economy also by supporting over 40 lakh jobs if the IT-enabled services are also included.

Major companies, including Infosys and Wipro, have earlier this month discontinued the practice of giving yearly guidances, while TCS hinted at pain during the first two quarters of the year.

“Typically, new deals get finalised between March and May, but this time around, most clients will focus on mitigating emerging business risks and defer discretionary IT spend, while letting existing contracts continue,” Crisil’s senior director Anuj Sethi said.

Crisil said that revenue growth for the industry will decline to a decadal low of 0-2 per cent.

The ongoing restrictions on mobility, which has resulted in the entire aviation sector being closed, will also cause delays in deal consummations, Sethi added.

The IT industry’s largest client segment of banking, financial services and insurance which accounts for 28 per cent of the industry revenues will deliver an 8 per cent topline growth on rising share of digital transactions and presence of larger and longer-term maintenance contracts that are critical to operations, Crisil said.

While healthcare segment, which accounts for 8 per cent of the IT industry revenues, will also grow at similar levels, it said.

However, other segments including retail (32 per cent of IT service revenues), and communication, aerospace, defence and transportation (22 of revenues) and manufacturing, travel and tourism and oil and energy will see a steep and immediate impact on revenues considering sluggish demand in these sectors, it said.

The rating agency said operating profitability could moderate by 2-2.50 percentage points to a decadal low of 20 per cent for 2020-21, despite gains from rupee depreciation.

The slowdown in revenues will have an impact on profitability because the IT firms will have to continue investing in new age technologies to showcase their ability to execute complex digital projects, its associate director Rajeshwari Karthigeyan said.

Karthigeyan explained that in the last four years, the share of digital revenues has grown to about 40 per cent of the total revenues, but at the same time has seen a narrowing of profit margins by up to 1.50 per cent.

IT companies have already streamlined costs and raised utilisation rates to record high of 85-90 per cent by increasing the share of fixed price contracts, which will make it impossible to derive any gains from optimising employee or outsourcing costs, the agency said.

The ratings agency, which studied 15 companies constituting 70 per cent of the total revenues, said there will not be any impact on ratings as a result of this and limited itself to say that ones with revenue concentration in weak segments may face some challenges. It flagged the extent of the pandemic and its impact on the global economy as a key monitorable factor going ahead.",page1,https://www.dailypioneer.com/images/logo.jpg,https://www.dailypioneer.com/2020/page1/covid-to-diminish-it-sector-revenue-growth-to-decadal-low-of-2---crisil.html
197,25-4-20,Cops’ help offer makes migrants shelve plan to leave Capital,"At a time when poor migrants who have run out of their sustenance are pulling out all stops to head for their villages, good Samaritans among the police have been successful in persuading a sizable number of them to stay put in the national Capital. In return, the cops assured them to help provide food and convinced house owners to not insist on demanding rents from their poor tenants.

Around 70 labourers who had planned to leave the national Capital amid the lockdown were successfully persuaded to stay put by the police, which also arranged for their meals and assured them of further help, officials said on Friday.

The police received information that around 70 daily wagers, who were living in rented accommodations at the Gujar Chowk area of South Delhi’s Sangam Vihar, were planning to leave for their native places in Uttar Pradesh and Bihar.

“Assistant Sub-Inspector Devraj and constable Chetan were sent there and the workers were convinced to stay put. But the workers said they were not being served food as they did not have plates,” said Atul Kumar Thakur, Deputy Commissioner of Police (South).

Plates were procured by ASI Devraj for all of them and they were provided meals. Their landlords were also asked not to demand rent from them, he said.

The labourers were given phone numbers of police officers in case of any emergency, he added.

In another incident, 29 labourers who were attempting to return to their villages in Bihar from Delhi’s Khirki village on cycles were intercepted by the police near Pushpa Bhavan in south Delhi. After they were counselled, they returned to their accommodations and promised not to leave again, the DCP said.

The police also intercepted 15 people at a picket on Aurobindo Marg in south Delhi, he said. They were coming from Kabadi bazar area in West Delhi’s Mayapuri and were travelling to Azamgarh and Faizabad in Uttar Pradesh. All of them were sent back by a DTC bus, he added.",page1,https://www.dailypioneer.com/images/logo.jpg,https://www.dailypioneer.com/2020/page1/cops----help-offer-makes-migrants-shelve-plan-to-leave-capital.html
198,25-4-20,"Now, Yogi Govt plans to bring back migrant labourers, gives order","After successfully bringing back stranded Uttar Pradesh students from Kota, Chief Minister Yogi Adityanath has directed officials to prepare a road map to bring back tens of thousands of migrant workers from the State stranded in other States and have completed 14-day quarantine.

“Those labourers of UP who have completed 14-day quarantine in other States will be brought back in a phased manner. The officers should prepare an action plan for the same,” Yogi said while addressing the lockdown review meeting at his official residence here on Friday.

The Yogi Government’s decision could create more trouble for Bihar Chief Minister Nitish Kumar, who has refused to even bring back his State students from Kota and is facing strong criticism from Opposition parties.

Yogi said a list will be furnished having all the details of the labourers followed by screening and testing by concerning States to send them to UP border from where they will be dispatched to their respective districts by bus.

“The concerned nodal officers of different States should prepare a list of the people who want to return to UP and start making arrangements for their return. These shelter homes should be sanitised and community kitchens should be set up to quarantine labourers from other States. The nodal officers should contact the respective States and migrant workers who want to return,” the CM told the officials.

He said that the adequate number of shelter homes and centres should be readied for 14-day quarantine of the migrants. After institutional quarantine, they will be sent to their homes with ration kit and Rs 1,000 as sustenance allowance, he pointed out.

Earlier last week on the directive of the CM around 10,500 students from Uttar Pradesh who are studying in Kota Rajasthan were brought to the State. Around 300 buses were put into service. Later these students were asked to go in for quarantine in their houses for next 14 days.

Political parties in Uttar Pradesh have been asking the Yogi Government to bring back these labourers.

“We support the UP Government in bringing back students from Kota. The migrant workers should also be brought back who are suffering because they are not getting food and other essential items,” UP Congress State president Ajay Kumar Lalu said.

Early this week around 1,000 laborers from Uttar Pradesh who have got stuck in Jammu & Kashmir had appealed to the Chief Minister to make arrangements for their return to their villages as they have run out of money.

Suresh Kumar, who hails from Bahraich reached Kashmir in the first week of March and had earned around Rs 3,500 when lockdown was announced. Since then he is putting up in a Government building in north Kashmir along with 400 non-local labourers from various States.

“All the money I had earned have exhausted. Government should have given us three days to reach to our homes before announcing lockdown,” he said.

He has been lodged in a shabby room along with 20 non-local labourers. “There is no hygiene here. Labourers are not safe because we are not maintaining any distance. We fear we may get infected,” Suresh said.

“Our families are worried about our safety. We are even not able to make a video call to our families due to low internet speed. We want to leave for our home as soon as possible,” Kumar said and requested the UP Government to take them back.

He said that his brother told him that the Yogi Government had brought students back from Kota. “If they can be brought back to UP why cannot we,” asks Kumar.",page1,https://www.dailypioneer.com/uploads/2020/story/images/big/now--yogi-govt-plans-to-bring-back-migrant-labourers--gives-order-2020-04-25.jpg,https://www.dailypioneer.com/2020/page1/now--yogi-govt-plans-to-bring-back-migrant-labourers--gives-order.html
199,25-4-20,"Indians, ethnic minority medics in UK at high risk from COVID-19: Survey","Medical and healthcare professionals from Indian and the minority ethnic backgrounds fall into a higher risk category of contracting the deadly coronavirus in the UK, a first-of-its-kind survey among medics in the country has concluded.

The Research and Innovation Forum of the British Association of Physicians of Indian Origin (BAPIO) conducted the week-long online survey between April 14 and 21 to determine risk factors and emerging concerns within healthcare professionals as wider community data began to reflect black, Asian and minority ethnic (BAME) vulnerabilities during the pandemic.

Around 2,003 respondents from all backgrounds returned the questionnaire, with the majority (66 per cent) being hospital doctors and primary care practitioners forming the second large group (24 per cent). Of those surveyed, 86 per cent were from BAME backgrounds, with South Asians forming the bulk of the sample at 75 per cent.

""This is the largest survey of its kind that involves BAME healthcare workers from all backgrounds. And the results are no surprise, that being of BAME background is a major risk factor for contracting the virus,"" said Dr Indranil Chakravorty, Chair of the BAPIO Research and Innovation Forum.

The survey also shows that a lack of personal protective equipment (PPE) is a major concern to medics and also confirms that being BAME is a significant independent risk factor in contracting COVID-19 irrespective of comorbidities or the presence of one or more additional conditions co-occurring with a primary medical condition, such as obesity.

The survey also found that 64 medical professionals reported being reprimanded for wearing or wanting PPE.

""We have been urging government to protect those who are vulnerable, so that frontline workers do not themselves fall ill,"" BAPIO President Ramesh Mehta said.

""BAPIO is very keen to do research in this area and we are looking to getting involved with large studies with partners such as Imperial College London to ensure we have the scientific evidence that can be applied in clinical practice,"" Mehta said.

The overall conclusion of the survey is that further research is crucial to establish the factors behind the higher risk faced by BAME communities of Britain during the pandemic.

""There are a number of areas highlighted in this important survey. Being BAME is a clear risk factor, and we need more sophisticated research into this area,"" said Dr JS Bamrah, BAPIO Chairman.

""Also testing was not available to a sizeable number so they may have been isolating needlessly, as well as the fact that the lack of appropriate PPEs remains a recurring issue for our frontline staff,"" he added.

The UK government has launched a review into the ethnic disparity of COVID-19 impact and also vowed to address the shortage of PPE among hospital and care home staff.

The Opposition Labour Party set up its own separate review into the issue of BAME risk factors this week to push forward the timescale for solutions and steps that could be taken to address the issue.

",india-abroad,https://www.dailypioneer.com/uploads/2020/story/images/big/indians--ethnic-minority-medics-in-uk-at-high-risk-from-covid-19--survey-2020-04-25.jpg,https://www.dailypioneer.com/2020/india-abroad/indians--ethnic-minority-medics-in-uk-at-high-risk-from-covid-19--survey.html
200,25-4-20,Sanjay Kothari appointed Central Vigilance Commissioner,"Sanjay Kothari was appointed as the Central Vigilance Commissioner on Saturday, according to a Rashtrapati Bhavan communique.

He was working as the Secretary to President Ram Nath Kovind.

""At a ceremony held today at 1030 hrs at Rashtrapati Bhavan, Sanjay Kothari was sworn in as the Central Vigilance Commissioner,"" the communique said.

He took the oath of his office before the president, it said.

",top-stories,https://www.dailypioneer.com/uploads/2020/story/images/big/sanjay-kothari-appointed-central-vigilance-commissioner-2020-04-25.jpg,https://www.dailypioneer.com/2020/top-stories/sanjay-kothari-appointed-central-vigilance-commissioner.html
