,Date,Title,Article,Category,Image_link,Article_link
0,25-4-20,Post-pandemic sport,"Cricket and other sports are working on how to reduce contact. Soon, spectator-less sport may become a reality

The German football league, the Bundesliga, is mulling to restart matches on May 9, albeit behind closed doors. The American National Football League (for American “Football”) is planning to conduct its annual draft online for the first time. Cricket bosses, too, are actually discussing a point that was brought up by former Australian fast bowler Jason Gillespie regarding shining a ball. Legendary cricketer Sachin Tendulkar himself made it clear that he revelled in the full-throated chants that accompanied his stay at the crease and that this is one reason why the very idea of sport inside an empty stadium is disappointing. Without any actual games taking place on the ground, the world of tennis has been rocked with the likes of Roger Federer and Rafael Nadal promoting a combined men’s and women’s global tennis body. Other sports, too, have taken time during the lockdown to contemplate their future. While by their very nature, racquet sports are socially distanced, possibly with the exception of squash, sports such as football are having serious debate about their future.

And then there is that small issue about spectators. Modern sports is all about having tens of thousands of fans in the stadium. The fans bring with them not only substantial gate revenues but also add atmosphere and colour to the match.This is why “home” games are considered such an advantage for the host team, with the crowd often playing the role of the twelfth man. Indeed, sports associations often punish teams for infringements such as racial abuse by forcing them to play games behind closed doors, thus depriving them of both revenue and support. But now, in a post-COVID world, all games will, perhaps, be played behind closed doors or maybe with very few fans being allowed. It is almost impossible to predict how that will impact the psychology of the athletes. Test cricketers might be used to playing in front of empty stadia but how will Team India cope playing a one-dayer at an empty Eden Gardens? Or for that matter, how will teams like Manchester United and Arsenal play with an empty stadium? These cathedrals of sport, like real religious sites, are huge and organised. They could become a vector of this viral outbreak just like organised religion. It may be months before large audiences are allowed at these venues again. And even though games can be played behind closed doors, officials will have to find a way to ensure players are kept extra safe, particularly for contact sports. It would be interesting to see if the Bundesliga experiment goes ahead and what will come out of that. This might determine if organised sports can restart across the world.",columnists,https://www.dailypioneer.com/uploads/2020/story/images/big/post-pandemic-sport-2020-04-25.jpg,https://www.dailypioneer.com/2020/columnists/post-pandemic-sport.html
1,25-4-20,Congress demands power bill waiver,"While Uttar Pradesh Congress demanded waiver of power bills for three months due to lockdown, party’s national general secretary Priyanka Gandhi Vadra lauded those helping out people in distress and providing relief to them.

On Friday, Priyanka hailed an elderly woman, Kamla Saini of Muzaffarnagar, for contributing her pension to fight coronavirus pandemic.

In a letter to Saini, who lives in an old age home on Nadi Road in Muzaffarnagar, Priyanka praised her efforts in helping the nation fight the coronavirus pandemic.

Terming Kamla Saini a true patriot, Priyanka said the example she set before the country by donating her saving of Rs 21,000 in PM CARES fund for coronavirus care was not just appreciable but would motivate others to follow her.

“During coronavirus pandemic, we all are proud of the rare gesture shown by you by donating your saving from pension. Helping out people in distress is true patriotism. It increases my respect for you. I learnt that you are living in an old age home, the country will never you forget for your love and affection,” Priyanka mentioned in her letter which was handed over to an emotional Saini by former Congress MP Harendra Malik on Friday.

Earlier on Thursday, Priyanka hailed the efforts of students of Ambedkar Hostel in Gorakhpur for running a community kitchen to feed the poor and needy. She also praised similar efforts by a physically challenged girl in Prayagraj, who has been serving the needy with her small savings.

Meanwhile in Lucknow, UP Congress chief Ajay Kumar Lallu demanded that power bills be waived for three months as a large section of the people did not have income or salaries due to lockdown.

In a letter to Chief Minister Yogi Adityanath, Lallu said that people were facing economic crisis and it would be difficult for them to pay their electricity bills.

“Hence the government should waive power bills or at least give people 200 units free every month till normalcy is restored,” Lallu wrote in the letter.

Earlier, traders associations made similar demands claiming that they were forced to pay power bills even when their establishments were lying closed for over a month now.",state-editions,https://www.dailypioneer.com/images/logo.jpg,https://www.dailypioneer.com/2020/state-editions/congress-demands-power-bill-waiver.html
2,25-4-20,People badly hit by lockdown: Akhilesh,"Samajwadi Party chief Akhilesh Yadav said that the daily lives of people had been badly affected due to the ongoing lockdown while various promises of the Central and UP governments were not working at the ground level.

“The poor are facing a grave crisis of food and livelihood. Health facilities are in a shambles. In such a situation, it is obvious that questions will be raised on the claims of relief measures provided by the government,” Akhilesh said on Friday.

On migrant labourers from other states, the SP chief said that a large number of people had returned to Uttar Pradesh and were facing various issues and several among them had become ill.

“There is neither any well-planned arrangement for their treatment nor are they being checked for the coronavirus,” he said.

“The myopic policies adopted by the Yogi Adityanath government is no solution of the problem. Instead, it is going to further aggravate the problem. The government claims of providing livelihood to people through MGNREGA and other means are not reaching the intended beneficiaries,” he alleged.

Akhilesh claimed that industries had been shut down in the state, including in the VVIP district Gorakhpur, due to lockdown.

“Daily wagers are the worst affected as they have not received any relief. Besides, there are complaints of poor quality food grains being distributed through the public distribution system (PDS) shops,” he charged.

“Farmers have not been getting anything but indifference and insult from the BJP regime. Wheat purchase centres are working only on paper. Neither farmers are getting minimum support price, nor is there any hope in future. As a result, they are forced to opt for distress sale of crops. Cane growers have not received long-pending dues yet. Compensation for losses to crops due to unseasonal rains and hailstorms have also not been paid yet,” he said.

Akhilesh further said, “Apart from the dangers of coronavirus, numerous people have serious ailments like heart, kidney, cancer, liver diseases among others. Blood pressure and diabetes patients are also perturbed these days. OPDs are closed in hospitals, surgeries have been postponed. People are not getting medicines and treatment on time.”

The SP chief also said, “While the prime minister merely addresses on Panchayati Raj Diwas, we will have to take a pledge to make villages resource-rich if India has to emerge as a strong nation. The BJP dreams of a ‘vibrant India’ through big industries rather than developing villages or improving the economy of farmers.”",state-editions,https://www.dailypioneer.com/images/logo.jpg,https://www.dailypioneer.com/2020/state-editions/people-badly-hit-by-lockdown--akhilesh.html
3,25-4-20,PM lauds Basti’s woman pradhan,"



|

A village in Basti has suddenly hogged into limelight due to the steps being taken by a woman gram pradhan in containing the spread of coronavirus. Prime Minister Narendra Modi himself acknowledged the effort of the village head.

On Friday, when Prime Minister Narendra Modi interacted with heads of gram panchayats and sarpanchs of the country, he also spoke to head of Nakti Dei Bujurg gram panchayat in Basti, Varsha Singh, and after being informed of the steps initiated there and praised her.

The prime minister said that earlier people used to say that if one rupee was sent from Delhi, only 15 paise reached the village. “But today, when one rupee is released, the entire amount is deposited in beneficiary’s account,” he said.

Modi asked Varsha Singh how the villagers felt now and she replied that the residents were satisfied and said that they were getting all facilities since the Bharatiya Janata Party government came to office.

Varsha Singh has been actively working to deal with spread of coronavirus in the village in Kaptanganj development block of Basti. Working on the formula of Chief Minister Yogi Adityanath, she has ensured sanitisation of the village thrice and provided masks, soaps and sanitisers to every household.

Poor and nomadic families, who did not have ration cards, were also provided ration. Besides providing ration to very poor families, essentials and vegetables were also arranged for them. In addition, eligible women beneficiaries of Ujjwala Scheme, Labour department, PM Kisan Samman Nidhi and Jan Dhan Yojana were provided help by Singh.",state-editions,https://www.dailypioneer.com/images/logo.jpg,https://www.dailypioneer.com/2020/state-editions/pm-lauds-basti---s-woman-pradhan.html
4,25-4-20,Sunni Waqf Board to toe guidelines on coronavirus,"



|

Uttar Pradesh Sunni Central Waqf Board said that it would strictly comply with government guidelines for battling COVID-19 like lockdown and social distancing during Ramzan.

This decision was taken by the Sunni Waqf Board after Union Minister for Minority Affairs Mukhtar Abbas Naqvi directed mutawallis and management of waqfs through video conferencing on Friday to ensure compliance with lockdown and social distancing during Ramzan.

In a statement issued on Friday, the Sunni Waqf Board said that it was the foremost duty of Muslims, especially mutawallis and management of waqfs, not to allow gatherings in any institution for sehri or aftari, taraweeh and other prayers. It also advised them to ask people to perform prayers at homes and motivate others to comply with government directions.

“It is our joint responsibility to carry out and comply with orders of the Union and state governments. If any mutawalli fails to discharge his duties, then he would be accountable for the lapse,” said Sunni Central Waqf Board Chief Executive Officer Syed Mohammad Shoeb.",state-editions,https://www.dailypioneer.com/images/logo.jpg,https://www.dailypioneer.com/2020/state-editions/sunni-waqf-board-to-toe-guidelines-on-coronavirus.html
5,25-4-20,Yogi to bring back stranded workers from other states,"



|

After ensuring the return of stranded students of UP from Kota in Rajasthan, Chief Minister Yogi Adityanath directed officials to prepare a roadmap to bring back migrant workers of the state who were stranded in other states and had completed 14-day quarantine.

“Those UP labourers who have completed 14-day quarantine in other states will be brought back in a phased manner and officers should prepare an action plan for it,” Yogi said while addressing a review meeting at his official residence in Lucknow on Friday.

The chief minister said that a list would be furnished with all details of labourers followed by screening and testing by states concerned to send them to UP border from where they would be sent to their respective districts by bus.

“The nodal officers for different states should prepare a list of people who want to return to UP and start making arrangements for their return. Shelter homes should be sanitised and community kitchens set up their for quarantined labourers of other states. Nodal officers should contact respective states and migrant workers who want to return,” the chief minister told officials .

Yogi said that adequate number of shelter homes and centres should be readied for 14-day quarantine of migrants. “After quarantine, they would be sent to their homes with a ration kit and Rs 1,000 as sustenance allowance,” he said.

Last week, 10,500 UP students taking up coaching in Kota (Rajasthan) were brought back to the state on the initiative of the chief minister and for this around 300 buses were put into service. Later, the students were asked to quarantine themselves in their homes for the next 14 days.",state-editions,https://www.dailypioneer.com/images/logo.jpg,https://www.dailypioneer.com/2020/state-editions/yogi-to-bring-back-stranded-workers-from-other-states.html
6,25-4-20,Group clash over gambling leaves a dozen hurt,"



|

Objecting to urchins gambling in public led to a group clash that left at least 12 persons injured in Rampur over the last two days.

The police later arrested 15 persons and additional force was deployed in the troubled area.

As per reports, some youths were gambling in a vacant plot in Ratanpura Shaumali locality in Rampur on Thursday evening. The plot owner, a doctor, objected along with his relatives after which a clash ensued. However, the police reached there in time and nabbed three youths and brought them to the police station.

However, on Friday morning, the situation took a violent turn when the two groups again came to a head, pelted stones at each other and even opened fire that left half-a-dozen injured.

Later, the cops reached there and arrested a dozen troublemakers.

Cross-cases were registered at the local police station. Two named accused were absconding and efforts were being made to nab them.

Meanwhile in Hardoi, frustrated due to lock- down, a youth hit his father on the head leading to his death on Friday.

As per reports, Neeraj Pandey of Puranbhadhur area of Kotwali Dehat became depressed as his earning dried up due to lockdown. On Friday morning, he had an argument with his father Radhey Shyam (70) and fatally hit him on his head with a brick.

The critically injured Radhey Shyam was taken to district hospital where he was pronounced dead upon arrival. A case was registered and Neeraj was arrested.

Elsewhere in Campierganj area of Gorakhpur, fire broke out in a hut in Khadkhadiya village leaving a 12-year-old girl, Seema, dead and her father, Sudama, critically injured.

Beside the girl, 20 goats tied outside the hut were also charred.

A case was registered and the injured Sudama was shifted to a hospital where his condition was said to be critical.",state-editions,https://www.dailypioneer.com/images/logo.jpg,https://www.dailypioneer.com/2020/state-editions/group-clash-over-gambling-leaves-a-dozen-hurt.html
7,25-4-20,The eternal City of Joy,"There was no migrant workers’ crisis in Kolkata, in the industrial areas, or in the rest of Bengal, which has been peaceful unlike the Hindi heartland

Bengalis and fish and how can this classical ode to joy fall apart? No way! Bengalis and mishti (sweets). How can they ever be brutally separated, even in a nationwide lockdown, even while diabetes is itself an epidemic in Bengal, especially Kolkata?

Indeed, it’s like saying how can the average middle class Bengali bhodrolok (genteel folk) survive without his daily dose of Boroline, Digene/Gelusil and Ananda Bazaar Patrika, to use a hackneyed cliché once again. But, clichés, despite being repetitive, are life-affirming too. They tell you that the world has not changed and what Bengal thinks today, India thinks tomorrow. Not even Kerala, though they love Bengal out there, I tell you.

Starting the working day for a working Bengali is a precious ritual. Going out with a jhola (bag) to the fish market early morning is a favourite daily one. Haggling is an eternal joy. A thin fish curry with black cumin and rice and the whole day is made. Only jhaal moori at lunch time might break this daily fulfillment.

It is fulfilling truly and nourishing, too. And the food has nothing to do with calories hereafter. Often it is kachori (crispy savoury snack) in the morning from the nearest Sharma loochir dukaan, often stuffed with motor shooti (green peas) and a thin potato curry. As it is phoochka in the night, especially for women.

So, at least, two things have not changed in the eternally outgoing “City of Joy”, where “ghore-baire” is a beautiful obsession and a routine dilemma. One, the fish markets are open in many places. And I am told by reliable sources that the mishti shops, now open from 12 noon to four in the evening, might get a four hour additional bonus.

If Kolkata is the microcosm of the unfinished painting of the Bengali canvas, it seemingly hates the lockdown. Who does not? The urge to go out is as tangible as the crowd in the fish markets, even now, which are reportedly not so sanitised or following the highest of health standards. And, yet, the death toll is just about seven. How come?

And that, too, is a kind of hidden and expressed controversy. Unlike, surprisingly, in Uttar Pradesh (UP), (where the graph might seem to be flattening like Kerala, where they have literally blocked the virus now, especially in Thrissur, Kottayam and Idukki). There is a lack of testing, health infrastructure, poor safety condition of doctors, nurses and health workers, abysmal hospitals in UP, too, but a partially totalitarian regime calls the disciplinary shots. Nobody even knows what the tens of thousands of workers are going through in the small towns or the rural hinterland of UP, or, if the deadly virus is spreading out there.

However, in Kolkata, or Bengal, the graph on the death toll, as much as selective or mass testing is too low. Sources say that Chief Minister Mamata Banerjee has been efficient, on the spot, on the dot, and she started early, even though not as early as Pinarayi Vijayan in Kerala. That she has no faith in the Central laboratories with their “bureaucratic paraphernalia”, not in the unfulfilled promises of help from Delhi. For long, her Government has complained of lack of testing kits and medical equipment for doctors and nurses, saying that Delhi simply seemed too reluctant or late in response.

It is no wonder then that the Union Home Ministry sending a Central team to Bengal, among other States, to make “on-the-spot assessments” on the Covid-19 crisis has not gone down well with the fiercely independent leader. In her characteristic manner, Mamata has strongly protested against this unilateral move which goes against the federal spirit, even as the graph in Bengal just cannot be compared to the serious situation in many other States.

In a letter to Prime Minister Narendra Modi, the Chief Minister has reiterated that the Inter-Ministerial Central Team’s (IMCT) visit to several districts — Kolkata, Howrah, 24 Parganas North, Medinipur East, Kalimpong, Jalpaiguri and Darjeeling — amounted to a “unilateral action” by Modi and Union Home Minister Amit Shah.

“I am sure you will kindly agree that such unilateral action on the part of the Central Government is not desirable at all, especially in the backdrop when both Central and State Governments are working together relentlessly round-the-clock to contain the covid-19 crisis,” Mamata said in the letter.

Meanwhile, the the Calcutta High Court last week asked the West Bengal Government to go on a “war footing on the Covid-19 tests” and that it should follow the Indian Council of Medical Research (ICMR and World Health Organisation (WHO) guidelines.

Till now, in this entire process, Mamata’s total focus has been on the prestigious Calcutta Medical College and other State and private institutions, for medical care. Besides, she has been fast in her crisis management. A stadium in Howrah was converted into a fully-equipped hospital with 1,000 beds. A private high-rise building in post-modern Rajarhaat was turned into another makeshift hospital. Private hospitals were asked to cooperate. And the lockdown, sensitively done, was fully implemented.

There was no migrant workers’ crisis in Kolkata, in the industrial areas, or in the rest of Bengal, which has been peaceful unlike the Hindi heartland. She announced quickly that no one will go hungry till September. There was no mass migration nor starvation on the streets and slums. Food rations were given and is being given, to all those who seek it with a ration card, for free and with dignity. Those who don’t have ration cards or official documents can also avail of it with a temporary slip. Cooked food is being given to those who can’t cook food. Even police stations are being organised to cook food and distribute to people who are going hungry.

An activist, who works in the red light area in Kolkata, told this reporter that not one among the 10,000 residents in the area is going hungry. Those who can’t cook are being given cooked food. Even in poor villages of Purulia, Midnapore and so on, the problem of hunger has been taken care of with local official networks. “No one is really going hungry in Kolkata and Bengal, that I can assure you,” he said and he is no Mamata supporter.

There are reports of hunger stalking in the eternally-starving tea gardens of North Bengal, which have seen stark unemployment, destitution and starvation deaths in the past. Civil society initiatives are desperately working on the ground and a lot of food distribution is happening through the Trinamool Congress local networks. “It’s a difficult and tragic situation out here. The problem is not only perennial out here, it is kind of become intensified after the lockdown,” said a Jadavpur University student from Cooch Behar on the border of Bangladesh, where the “chitmahals”, too, are facing longstanding problems.

“Chitmahals” are villages which lived in a twilight zone after Partition in East Pakistan and India and later after the formation of Bangladesh. They were citizens of no man’s land and had no rights, no identity, no citizenship of any country. Recently, many of them have gone over to Bangladesh and others have been allocated to India, though the borderlines are thin and blurring. And, yet, their economic and social condition remains abysmal.

There have been recent reports of new hotspots of the epidemic in Kolkata, including in the slums. Kolkata, Howrah, East Medinipur and the North 24 Parganas have been declared sensitive zones. Eight districts have been declared as possible hotspots: Kalimpong, Jalpaiguri, Hooghly, Nadia, West Burdwan, West Medinipur, the South 24 Parganas and Darjeeling. New areas are being marked.

Meanwhile, civil society groups, especially students, have been working on the ground with great commitment. Students, research scholars and the alumni of Jadavpur University, for instance, are distributing sanitisers, rations and cooked food, which they themselves cook in the campus. They distribute it all over Kolkata, to cops, health workers, doctors, shopkeepers, vegetable vendors and slums.

“We are short of money, almost always. The alumni is helping. But we need more help,” said a research scholar.

However, life is like this only, as the story goes. Kolkata and Bengal are observing the lockdown with discipline and patience. The Government is in control. And while Rabindra Sangeet (music) and Western music still floats in the bylanes, people are waiting for a new life after the lockdown ends.

Tomaar holo shuru, aamar holo shaara, (it’s your beginning, it’s my end...) as the eternally beautiful Robi Thakur song goes.

(The writer is a senior journalist)",columnists,https://www.dailypioneer.com/uploads/2020/story/images/big/the-eternal-city-of-joy-2020-04-25.jpg,https://www.dailypioneer.com/2020/columnists/the-eternal-city-of-joy.html
