,Date,Title,Article,Category,Image_link,Article_link
56,25-4-20,3 Ganjam GPs get nat’l award,"On the occasion of the National Panchayati Raj Day on Friday, three gram panchayats (GPs) in Ganjam district were conferred with the National GP Award 2020 in different categories.

While Kainchapur GP of Ganjam block was awarded in the category of Best Development Plan in Odisha, Badaborasingi under Belaguntha block was awarded as Best Child-Friendly GP in the State. Besides, Podamari GP under Sanakhemundi block received the Nanaji Deshmukh Rashtriya Gaurav Gram Sabha Puraskar. Earlier in the day, Prime Minister Narendra Modi interacted with Sarpanchs of all GPs across the country through videoconferencing.",state-editions,https://www.dailypioneer.com/images/logo.jpg,https://www.dailypioneer.com/2020/state-editions/3-ganjam-gps-get-nat---l-award.html
57,25-4-20,"DA increment of Uttarakhand employees, pensioners frozen","In view of the financial constraint faced by the Government due to the ongoing battle against COVID-19, the Uttarakhand Government has put on hold the increase in the Dearness Allowance (DA) for its employees till July 2021.

The DA of the employees would remain frozen at 17 percent of their basic pay during this period. The State Government toed the line of the central government which a day earlier had taken a similar decision.

The Government had given an increment of 4 percent in the DA in the month of January this year. This increment would now not be given to the employees. Apart from it the usual six monthly increments in the DA would also not be given to the employees till July 2021. In an order the Secretary finance, Amit Singh Negi said that due to the crisis precipitated by the spread of COVID-19, the State Government has decided not to pay the increment in DA to its employees which were due from January 2020. The order added that the increment in the DA due in July 2020 and January 2021 would also not be given to the employees. This order would re main applicable on the employees and pensioners of state government. A total of 3.5 lakh state government employees and pensioners would be affected by this measure of the state government.

The decision to freeze the DA has not gone down well with the employees though they are not very vocal against the decision. “We understand the position of government but it would have been better had the government consulted the employee organisation before taking the decision. We would have also suggested better ways to save the money to the government. Further by reducing the money to the employees the markets would be affected,’’ said Arun Pandey, a prominent employee leader.",state-editions,https://www.dailypioneer.com/images/logo.jpg,https://www.dailypioneer.com/2020/state-editions/da-increment-of-uttarakhand-employees--pensioners-frozen.html
58,25-4-20,"SER, SERWWO manufacture PPE Kits","In order to curb the spread of COVID-19, Kharagpur Division of South Eastern Railway (SER) in association with SER Women's Welfare Organization (SERWWO), Kharagpur Division has started manufacturing PPE (Personal Protective Equipment) Kits for support of railway Doctors, Paramedical staff and Healthcare personnel. The PPE Kit includes Face Cover, Eye Shield, NS-95 Mask, Coverall Gown with Hood, Shoe Cover, Gloves and others.

Informing this by issuing press release SER said that this In-House production of PPE Kits is being done at “Hunar Center for Stitching &Embroidery” under the supervision of SER Women's Welfare Organization (SERWWO) and Mechanical Department of Kharagpur Division. It has been decided to produce 1000 PPE initially. Till now Kharagpur Division in association with SERWWO has manufactured 225 units of PPE Kit along with shoe covers.

The material used is non-woven polypropylene barrier fabric, which is impermeable to blood and bodily fluids. The PPE design and material are certified from DRDE, Gwalior. After stitching, the PPE Kits with shoe covers are sealed in plastic bags with markings of size, serial number and date of manufacturing. Social distancing, thermal screening and sanitizing are ensured during production of the PPE Kits. Regular inspections are also being done to ensure quality.

In addition to above, reusable masks are also being manufactured by SERWWO at “Hunar Centre”, Kharagpur. WWO has already manufactured 7000 reusable face masks, out of which 3000 masks have been handed over to the employees of Kharagpur Division. SERWWO is targeting for manufacturing of 30000 reusable face masks. Hand Sanitizers are also being manufactured in Kharagpur Division at Diesel Shed, Divisional Railway Hospital, EMU Car Shed at Santragachi and Electronic Loco Shed at Santragachi. Already, 600 liters of sanitizer have been manufactured In-house till now.

With a view to fulfill the commitment for the uninterrupted supply of essential commodities in every nook and corner of the Country during nation-wide lockdown in the wake of Corona virus pandemic, South Eastern Railway has already taken all out efforts to run freight trains with essential commodities on top priority towards different destinations in the country.

SER, during the month of April from April 1 to April 22 unloaded 62 rakes containing 1.56 lakh tonnes of essential commodities such as 40 rakes of rice, 14 rakes of wheat, 5 rakes of vegetable oil, one rake of salt and another 2 rakes containing 6700 Kiloliters of Petroleum product at different places of this railway covering the states of West Bengal, Jharkhand and Odisha.

In addition to above during this nation wise lockdown, this railway has already run 281 trips of Parcel Express trains carrying high priority essential commodities such as food items, medicines, medical equipment including PPE kits, face masks, sanitizers to various destinations to and fro from Shalimar, Howrah, Tatanagar from April 2 to April 22. This amounts to 3,562 tonnes of parcel traffic containing 1,25,727 number of packages to and for different cities and towns of the Country.

This challenging gigantic task has been undertaken by the SER with the active participation of a dedicated workforce of front line warriors such as Loco Pilots, Guards, Trackmen, Station Masters, Parcel handling staff working at stations and divisional headquarters who are rendering their yeoman services to the nation in this crisis time.",state-editions,https://www.dailypioneer.com/images/logo.jpg,https://www.dailypioneer.com/2020/state-editions/ser--serwwo-manufacture-ppe-kits.html
59,25-4-20,"JPPC head distributes masks, gloves among vendors","President of Jharkhand Pradesh Professional Congress, Aditya Vikram Jaiswal, distributed masks and globes among vegetable vendors of Lalpur on Friday to prevent the spread of Corona epidemic. During this time, members of the Professional Congress reached the 150 vegetable vendors sitting from Lalpur to Distillery Bridge and distributed masks and gloves. He also explained the advantages of their use and the methods of wearing and opening.

Giving masks and gloves to vegetable vendors, Jaiswal said that vigilance, caution and awareness of all of you are very important. In the purchase and sale of vegetables, one has to face many and the spread of coronavirus in the capital Ranchi is increasing every day, so it is necessary for the people to use masks and gloves. He said that awareness is necessary to protect every person and society from coronavirus disease. Jaiswal said that it is the greatest human religion to serve the poor, needy in this disaster of Corona epidemic. He has appealed to all the citizens to stay in the house for the sake of country interest and observe Lokdown. He said that people living in their homes at this time is equal to national service.

Amarjeet Singh, Rahul Roy, Rajiv Chaurasia, Gaurav Anand, Sonu Singh, Prem Kumar etc. were present on the occasion.",state-editions,https://www.dailypioneer.com/images/logo.jpg,https://www.dailypioneer.com/2020/state-editions/jppc-head-distributes-masks--gloves-among-vendors.html
60,25-4-20,MLA appeals for three months school fee waiver,"The Haridwar Rural MLA Swami Yatishwaranand has appealed that school fees not be charged for the months of April, May and June since the income of many parents have been stalled since March due to the lockdown enforced to contain the COVID-19 pandemic. Yatishwaranand said that he had talked to the Union Human Resource Development minister Ramesh Pokhriyal ‘Nishank’ and the state’s education minister Arvind Pandey about this issue. The MLA said that he had appealed through the social media that the school fees for three months should be waived off. He said that he would pursue the issue and try to get the fee waiver for three months.",state-editions,https://www.dailypioneer.com/images/logo.jpg,https://www.dailypioneer.com/2020/state-editions/mla-appeals-for-three-months-school-fee-waiver.html
61,25-4-20,CCL gives foodgrains to needy in command areas,"In a move to provide help to the people during the ongoing lockdown Central Coalfield Limited (CCL) is not only producing coal more than required but also it is distributing food grains among large numbers of people so that no one should sleep hungry during the period.

CCL has been working in coordination with the local administration in eights districts of the Jharkhand. The Company has provided about 100 quintals of food grains like rice, pulses, salt, wheat flour, mustard oil, soya bari, flattened rice, spices, potatoes, onions etc to the local administration for distribution among the needy during lockdown.

The Company has also supplied other relief materials like masks, sanitizers and others things to the administration to check spread of Corona virus. CCL has also distributed food grains packet withing the State to more than 12,000 families. CCL is continuing distribution of food grains and other relief works during the ongoing lockdown which is extended till May 3.

Apart from this CCL, a subsidiary of Coal India has set up dedicated helpline numbers (0651-2365999, 0651-2361013, 0651-2360606) so that any needy person staying in command areas of the Company can make calls during the lockdown and the Company will extend all possible support to them including arranging food grains packet and medical advice.

CCL is not only motivating the employees and stakeholders to play significant role in the Country’s fight against the Corona virus pandemic but ensuring that no one should sleep hungry in command areas of the Company during lockdown.

CMD CCL Gopal Singh has been in touch with Area General Mangers through video conference and other means of communication. He has issued necessary instruction that the employees must take all preventive measures like wearing hand gloves, mask and others while performing duties at work place and while coming to home.

Singh said that it is important to prevent oneself from this deadly virus so that he or she does not transmit to other healthy individual and then only family, society, Jharkhand and our Country could overcome from this unprecedented crisis.

CCL is ensuring in its command areas that no one sleeps hungry during the exercise to check the spread of Corona virus during lockdown. “We are distributing food packets comprising essential items like rice, pulses, spices and other items in all areas with support of district administration to ensure no one sleeps empty stomach during lockdown,” Singh said. He further added that the coal family has become a soldier in this corona war and working like every other citizen of this country to fight against the Corona virus.

The ongoing 21-day lockdown has extended till May, 3. During the first phase of 21-day lockdown, CCL has performed exemplary work and its employees worked as “front line warriors” and distributed food packets in command areas of the Company, which is spread out in eight districts of Jharkhand- Ranchi,

Ramgarh, Hazaribagh, Latehar, Palamu, Chatra, Giridih and Bokaro- by adhering norms of maintaining social distancing and other advisories issued by government from time to time.",state-editions,https://www.dailypioneer.com/images/logo.jpg,https://www.dailypioneer.com/2020/state-editions/ccl-gives-foodgrains-to-needy-in-command-areas.html
62,25-4-20,Increasing the reach of digital learning in India,"The wave of digital learning reached India in 2016 with the launch of SWAYAM (Study Webs of Active-Learning for Young Aspiring Minds) platform by Ministry of Human Resource Development. However, the foundation was already laid down by NPTEL and e-PG Pathshala, a decade ago with the availability of e-contents in the form of audio-video, text etc with free availability for all.

The author remembers attending a workshop on open educational resources (OERs) in Faculty Development Centre (FDC) of HNB Garhwal University, Srinagar, with other faculty participants. Apart from many eye opening sessions, one got the essence of digital /blended/ flipped learning through OERs and SWAYAM Massive Open Online Courses (MOOCs). During a session, professor Rajat Agarwal from the Department of Business Management, IIT Roorkee had said, “This train is going ahead and those who board early will reach the destination of the digital world earlier; digital education is the future.” Within a few months, I got two MOOC proposals approved by two different national coordinators. With the help of training extended by UGC/ MHRD in IIM Bangalore and NITTTR Chennai, the courses were developed. Both The two MOOCs ‘Academic Writing’ and ‘Industrial Pharmacy’ performed very well. Moreover, Academic Writing MOOC was ranked number one in July 2019 cycle with maximum exam registration. These were the happy moments which refreshed us after tiring journey of developing two MOOCs together. We had the feeling of “mission accomplished” but it was just the first insight of the entire story.

Just developing MOOCs was not serving the actual need of the education system. The awareness level even in urban areas about digital learning initiatives like SWAYAM is very low. Most of the universities and faculty members do not want to change the conventional teaching and learning process. The challenge was not the production but marketing of the same as a thumb rule of management. So, after checking the success and failure story of various platforms, one realised that having good intention without significant results takes even a major project down. It happened with many ICT initiatives of MHRD for the time being. Many of the e-contents were hardly viewed. When the government is spending huge amount of taxpayers’ money, the results must be tangible with fixed accountability. The success model of the Massachusetts Institute of Technology (MIT, US) and many world leaders of digital learning are just having commercial interest. But SWAYAM is carrying the Vishwaguru legacy forward.

SWAYAM, the digital platform of MHRD has a plethora of courses and contents for the learners of classes IX to PhD and even for the faculty members in the form of ARPIT (Annual Refresher Programme in Teaching). Moreover, 20 per cent of credits of a semester may be earned through SWAYAM MOOCs. The contents are used also for blended and flipped learning.

The challenge is to take SWAYAM to the grassroot level and to address the fear among faculty members that digital education is being disseminated to replace them. This will increase the willingness to accept even from the administrative part of the institutions. The awareness level must be identified in each region of the country and a need-based strategy must be planned to address the problem. In Uttarakhand, where connectivity and speed of the internet is the major challenge in many remote areas and even in an educational hub like Srinagar (Garhwal), a strong strategy must be planned based on the inputs and suggestions of the stakeholders of that area. Recently, the Uttarakhand Government has taken the initiative of establishing an e-learning lab in every government PG college. Now we have the courses, we have the experts, we have the contents, but what we don't have the users of this platform in the tune of our population of young learners. In COVID-19 scenario when the entire country is in lockdown, the importance of SWAYAM and SWAYAMPRABHA and other ICT -initiatives of MHRD, Government of India has been revalidated by the historic boom of its users. Amid the COVID -19 lockdown, the Indian Government has made it mandatory for all the DTH providers to telecast the SWAYAMPRABHA educational channels and this is a great step in increasing the reach of digital education to the larger population of the country. The need of the hour is to bring more and more regular classroom learners to SWAYAM. And the dissemination of this needs the support of every citizen of our country. At this moment one remembers what Rabindranath Tagore said 100 years ago- “Where the mind is without fear and the head is held high, where knowledge is free…”. In continuation of this spirit, can we take up the challenge to make knowledge accessible to all citizens and the next generation through digital learning?

(The author is an assistant professor, Department of Pharmaceutical Sciences at Garhwal University, Chauras campus)",state-editions,https://www.dailypioneer.com/images/logo.jpg,https://www.dailypioneer.com/2020/state-editions/increasing-the-reach-of-digital-learning-in-india.html
63,25-4-20,Let us connect with their soul,"Namaste...health for all of us!

We, as humans have that innate propensity allowing our peculiarities squeeze out of ourselves when pressed in a water tight compartment. It is our coping mechanism first and later, a forte.

So this lockdown is a 'semicolon' in a 'polysyndeton'! ...I couldn't think of a better metaphor!

This read is far from how the pandemic has brought the economic arena to a turmoil, so chill !

We actually needed this. Driving high on a long haul , a sudden speed breaker!

While you were doing the dishes and thinking of the laundry, you were also feeling gratitude of having to do the dishes; which assures you of the grains in the house. While playing it up...cooking , mopping , sweeping etc... and recording, the jocular memes and other tuck on the social media... we know we are happy souls.

Souls!

There are species of 'souls' who, if were given even more flourishing senses, in the court of Mother Nature , would undisputingly win their claim on Earth .

There is this clan of yellow butterflies swarming my garden all day long. My husband, owing to the job he is in , has to move out in the city , tells me about these lemon coloured winged caterpillars being the new inhabitants of the town.

Adjacent to my house , stands a traffic light.

So, honk and beeps, wheel roar-rush , hooters hooting are the perennial deafening melodies we are ears to without a choice.

I repeat...'we are ears to...'

....were these noises defeaning 'only ' us !?!

I answer myself in a 'no'.

And these raptors and fledlings are so naive. Sans rancour , they returned.

Parrot, koel , pigeon and sparrow , yellow beaked joy , owl and crow.

Since when did they not belong here! And where were they all this while?

That they are here now, let us connect with their soul.

They don't seek food from us nor do they tax upon our lives. Only some calm.

This Earth is theirs as much.

So, dear yellow butterflies and chirpy birdies, joy abundant for all of us !

(The writer, Neha M. R. Aggarwal, is a lawyer by qualification and hails from Patiala, Punjab; now based in Ranchi)",state-editions,https://www.dailypioneer.com/images/logo.jpg,https://www.dailypioneer.com/2020/state-editions/let-us-connect-with-their-soul.html
64,25-4-20,CM Rawat congratulates winning Panchayats,"The Chief Minister of Uttarakhand, Trivendra Singh Rawat has congratulated the public representatives and villagers of three village Panchayats of the State that have been selected for Panchayati Raj Awards by the Union Government.

On Thursday, the Belpadav gram panchayat of Kotabagh block of Nainital district was awarded with the ‘Child friendly gram panchayat award’. Similarly the Nanaji Deshmukh Rashtriya Gaurav Gram Sabha award, 2020 was awarded to Kheldi village Panchayat of Bhadarabad block of Hardiwar district. The Kedarwala gram panchayat of Vikasnagar, Dehradun was selected for ‘Gram Panchayat development plan award, 2020.

On the occasion of the Rashtriya Panchayat Diwas-2020, the CM held telephonic conversation with many panchayat representatives on Friday and thanked them for supporting the government’s actions to prevent spread of COVID-19.

The Prime Minister Narendra Modi addressed the panchayat representatives of the country on the day and the CM Rawat listened the programme at his office. The minister for Panchayati raj, Arvind Pandey listened the address of PM with villagers at Village Panchayat Jainagar, Gadarpur in Udham Singh Nagar district while the additional secretary, Panchayati Raj H C Semwal and other senior officials of the department were present at Panchayati raj directorate in Dehradun to listen the PM’s address.

The Panchayati Raj department also released a documentary on the occasion which can be seen in the U tube channel of Department of Panchayati Raj.

In the documentary the department has included the quotes of union minister for Panchayati Raj, Narendra Singh Tomar, Uttarakhand cabinet minister Arvind Pandey, senior officials of department and many representatives of Panchayats.",state-editions,https://www.dailypioneer.com/images/logo.jpg,https://www.dailypioneer.com/2020/state-editions/cm-rawat-congratulates-winning-panchayats.html
65,25-4-20,Locals consider boycotting Chinese products after lockdown,"Considering the several unconfirmed allegations that China deliberately let novel Coronavirus (COVID-19) spread across the world, many shopkeepers and customers here have decided to boycott Chinese products after the lockdown ends in the State. Though the allegations are yet to be proved correct, they have influenced public opinion regarding Chinese products.

Ram Singh Kohli, a toy and gift store owner in Rajpur said, “More than 40 per cent of the gifts and toys are generally imported from China because the made in India products are costlier and the customers prefer cheaper products.

But considering China’s dubious role in the pandemic and its negative impact on the economy of several countries, I am not going to import any Chinese products.” After the COVID-19 pandemic, there is no point in buying Chinese products because the scare of the spread of the virus will remain for at least the next two years whether China is responsible for it or not, said the owner of a cosmetic store Ritu Sharma.

Many local customers have also emphasised on not purchasing Chinese products after the lockdown. Karnpur resident Ruchika Bhalla said that all the claims of China being responsible for the spread of COVID-19 appears true so the countries should not help their economy by buying Chinese products.

“I have always preferred to buy made in India products but now is the high time when everyone should stop buying any Chinese products, especially during the festivals like Diwali and Holi.

Everyone should buy Indian products and contribute to making our economy strong,"" added Bhalla. However, some shopkeepers and locals opined that people do not care about China or Indian products once they see the price. ""Some people might claim currently that they will not buy Chinese products anymore but generally the customers prefer inexpensive products no matter where those are manufactured,"" said an E C Road shopkeeper Sanam Ali.",state-editions,https://www.dailypioneer.com/images/logo.jpg,https://www.dailypioneer.com/2020/state-editions/locals-consider-boycotting-chinese-products-after-lockdown.html
