,Date,Title,Article,Category,Image_link,Article_link
127,25-4-20,"Health Ministry OK’s pool testing, plasma therapy in Maha","The Union Health Ministry on Friday gave a go-ahead to the Maharashtra Government to undertake “Pool testing” for suspected Covid-19 patients and “Plasma therapy” to treat coronavirus patients in the State.

While interacting with State Health Ministers and Secretaries across the country, Union Health Minister Dr Harsha Varshan accepted the Maharashtra Government’s request to undertake “Pool Testing” and “Plama Therapy” to deal with the coronavirus situation in the State.

Announcing this, State Health Minister Rajesh Tope said: “Some days back, we had requested the Centre to permit us to undertake “Pool Testing” and “Plama Therapy” to deal Covid-19 patients in the state. Today, the Union Health Minister gave us a formal go ahead to us in this regard”.

In view of the fact that the Covid-19 cases are rising exponentially in India, the Indian Council of Medical Research (ICMR) has favoured the “Pool Testing” . “It is critical to increase the number of tests conducted by laboratories. Positivity rate in cases is still low. Hence, it may help to use the pooled samples for screening,” ICMR has said in one of its advisories.

A pooled testing algorithm involves the PCR screening of a specimen pool comprising multiple individual patient specimens, followed by individual testing (pool deconvolution) only if a pool screens positive. As all individual samples in a negative pool are regarded as negative, it results in substantial cost savings when a large proportion of pools tests negative.

“Pool testing” is very useful for Maharashtra can be evidenced from the fact that it is the worst Coronavirus-affected state in the country. Till Thursday evening, there were as many as 283 deaths and an alarming 6427 cases.

Till Thursday evening, as many as 96,369 samples had been clinically tested, while 89561 cases had turned out to be negative and 6427 persons had tested positive.

Given the gravity of Coronavirus situation in the state, “Plasma therapy” may prove to be boon for Maharashtra. The convalescent “plasma therapy” aims at using antibodies from the blood of a recovered Covid-19 patient to treat those critically affected by the virus. The therapy can also used to immunise those at a high risk of contracting the virus -- such as health workers, families of patients and other high-risk contacts.

This therapy's concept is simple and is based on the premise that the blood of a patient who has recovered from Covid-19 contains antibodies with the specific ability of fighting novel coronavirus. The theory is that the recovered patient's antibodies, once ingested into somebody under treatment, will begin targetting and fighting the novel coronavirus in the second patient.

Till Thursday evening, as many as 840 Covid-19 patients have fully recovered and been discharged from various hospitals across the state.

The Delhi government, which had earlier been permission by the Centre to undertake limited “Plasma therapy” trials on the seriously ill patients, has got “encouraging results”. So much so that Delhi chief minister Arvind Kejriwal has urged recovered coronavirus patients to donate their blood plasma so that it could be used to treat the Covid-19 patients in the national capital.

Meanwhile, the Union Health Minister -- who took stock of the coronavirus situation in various states across the country -- has appreciated the suggestions made by the Maharashtra government that ""Portable Pulse Oxymeter"" and ""X Ray diagnosis "" could be used effectively to treat Covid-19 patients and that the Persona Protection Equipment (PPE) could be re-used through sterilisation.",india,https://www.dailypioneer.com/images/logo.jpg,https://www.dailypioneer.com/2020/india/health-ministry-ok---s-pool-testing--plasma-therapy-in-maha.html
128,25-4-20,"Chennai, other urban areas under full shutdown mode in Tamil Nadu","It became clear on Friday that all is not well in Tamil Nadu as coronavirus continued its upward march unbated and uncontrolled. A special meeting convened by Chief Minister Edappadi Palaniswami on Friday which was attended among others by top bureaucrats, police officials and health professionals discussed and analysed the prevailing situation in the State.

After the meeting the Chief Minister in a statement declared that the city corporation limits of Chennai, Coimbatore and Madurai would be shutdown completely for four days from April 26. The shutdown or lockdown would be in operation from 6 am on April 26 to 9 pm on April 29.

Similarly, the city corporation limits of Salem and Toruppur would be shut down totally for three days from April 26.

The Chief Minister said that the decision for lock down was taken after the government was convinced that the spread of coronavirus was severe in urban areas. Even business and commercial establishments which were allowed to function following the relaxation of lock down rules has been asked to down the shutters from April 26 for four days.

Only essential wings of the Government would be allowed to function and that too with minimum staff, said the statement issued by the chief minister.

Sale of vegetables and fruits would only be permitted in mobile carts. All shops are to remain closed. Hotels can deliver parcels on orders made through phones.

Madurai experienced tense moments on Friday morning as hundreds gathered in front of the City Corporation office flouting all precautions to the winds. The people were given wrong information that only vehicles carrying new passes issued by the corporation would be allowed on the roads from Monday.

This created panic among daily wage earners and self employed persons for whom two-wheelers are the only avenue of transport.

It took the police hours to convince the crowd that there was no such plans and they have been taken for a ride by unknown elements.

For two hours, the crowd forgot social distancing and other precautions associated with the spread of Covid 19 as they argued with the local body officials.",india,https://www.dailypioneer.com/images/logo.jpg,https://www.dailypioneer.com/2020/india/chennai--other-urban-areas-under-full-shutdown-mode-in-tamil-nadu.html
129,25-4-20,"TN: Total cases 1,755, toll at 22","There was no let up in Tamil Nadu in the number of persons tested positive for coronavirus on Friday. According to a medical bulletin issued by the department of health, government of Tamil Nadu, 72 persons were tested positive for coronavirus in the State till 5 pm on Friday. Chennai alone saw 52 persons testing positive for the pandemic.

The total number of persons tested positive for coronavirus all over Tamil Nadu reached 1,755 by Friday evening, said the release.

The number of persons succumbing to the dreaded disease reached 22 by Friday as the day saw two more deaths in the State.

The State which had 1,242 coronavirus patients on April 15 saw the number increasing by 513 in just nine days. The only consolation is the news that 114 persons have been cured of Covid on Friday.

Dr CV Krishnaswamy, veteran medical scientist and physician of repute told there was no cause for panic as far as the coronavirus situation in the country is concerned.

“India’s fatality rate is just two per cent compared to that of US which is above five per cent. Moreover we have to undertake a thorough auditing of the deaths recorded in the country allegedly due to corona virus. Even newspapers report that those who succumbed to coronavirus were suffering from cardio vascular ailments, malfunctioning of kidneys or other medical disorders. My request to the media is to be extra careful while reporting about causalities,” said Dr Krishnaswamy.",india,https://www.dailypioneer.com/images/logo.jpg,https://www.dailypioneer.com/2020/india/tn--total-cases-1-755--toll-at-22.html
130,25-4-20,"1st covid test to cost Rs 2,500 in UP pvt labs","The first test for coronavirus detection in any Uttar Pradesh private lab will come for a maximum of Rs 2,500, the Yogi Adityanath Government has given its approval. earlier the labs were charging over Rs 4,000.

Principal Secretary Health Amit Mohan Prasad, in an order, said: ""The infection can be confirmed in a single step test. In such a situation, those who are not coronavirus positive will have to give only Rs 2,500.""

He said that the ICMR did not set the fee for the single step test from the kit, so all the private labs were charging Rs 4,500.

So far, even if a person is not infected with coronavirus, he had to pay a fee of Rs 4,500 for the initial test. Now the person will get a single step check and if the coronavirus is not confirmed, then he will not have to go for the second step check. The Indian Council of Medical Research (ICMR) had not yet determined the single step test fee from the kit.

He informed that private labs have to send their reports online to the ICMR and the CMO of the district concerned. Strict action will be taken if there is a complaint of overcharging.

After deliberations, the government has fixed a single-phase check of Rs 2,500.",india,https://www.dailypioneer.com/images/logo.jpg,https://www.dailypioneer.com/2020/india/1st-covid-test-to-cost-rs-2-500-in-up-pvt-labs.html
131,25-4-20,Raj: Youth quarantined on tree after being refused entry into village,"A youth in Bhilwara has had to ""quarantine"" himself on a tree after being refused entry to his village recently.

The 24-year-old Kamlesh Meena walked all the way from Ajmer to reach his village Sherpura in Bhilwara, however, was stopped by villagers while entering into his village fearing corona spread.

He was advised to go to district hospital first and get himself tested. However, Kamlesh refused to go out of his village. As the tension gripped the village, a medical team soon reached the spot and collected the samples of youth. Other medical tests were also done.

Meanwhile, the medical team to sort out the issue, asked Kamlesh to come along to Bhilwara quarantine centre. However one of the section of villagers did not allow them to do the same.

After a long debate, it was decided to quarantine the youth 3 kms far off the village on a tree.

A temporary ladder was put aside a tree to help this man come down to attend nature's call. A medical team has been coming daily to test him.

Meanwhile district collector Rajendra Bhatt said that this man is healthy. ""As he did not want to go to quarantine centre, he was quarantined on a tree.""

Kamlesh' father Sagarmal said that his son was a daily wager in Ajmer. After lockdown, he was stranded in the city and waited for some vehicle, however, when he did not get any vehicle, he walked 150 kilometres to reach his village. As villagers objected to his entry in village, he started living on a tree by making a 'machan' on it. We are giving him two meals and water,"" he added.

Bhilwara Model went famous on world map when out of 27 patients, 25 patients turned negative while two of them lost their lives to COVID-19. Its quarantine and isolation model along with the techniques to seal the city were discussed at length in different parts of the country.

For clarifications/queries, please contact IANS NEWS DESK at +91-120-4822400 Mobile: +91-9873188969 or mail us at support@ians.in",india,https://www.dailypioneer.com/images/logo.jpg,https://www.dailypioneer.com/2020/india/raj--youth-quarantined-on-tree-after-being-refused-entry-into-village.html
132,25-4-20,"ITBP to deploy 8,000 troops permanently in Naxal-hit C’garh","Following nod from the Centre, the Indo-Tibetan Border Police (ITBP) has decided to keep its eight battalions (8,000 troops) in Chhattisgarh for anti-Naxal operations on a permanent basis on the lines of the Indian Army’s Rashtriya Rifles (RR) deployed in Jammu & Kashmir on a fixed basis.

Earlier, the ITBP troops were rotated every three years from the Naxal theatre and the latest move is aimed at bolstering operations against the ultra-Left extremists in Chhattisgarh, the worst Naxal-hit State, officials said.

“The move to deploy battalions on a permanent basis as against rotational basis in Chattisgarh will strengthen the anti-Naxal security grid as the troops will not only have a good grasp of the insurgency dynamics but also a better intelligence network,” an official familiar with the decision said.

As many as eight battalions of the ITBP are deployed for anti-Naxal operations in Chhattisgarh. The ITBP is essentially a border guarding force deployed along the 3,488km Line of Actual Control (LAC) along the frontiers with China. In the rotational deployment, the maximum tenure of an ITBP battalion in Chhattisgarh was three years and every time a new battalion was moved in a pre-induction training was imparted in order to familiarise the troops with topography and the extent of the Naxal menace in the area.

The ITBP’s fixed deployment in Chhattisgarh is modelled on RR that is tasked for anti-terror operations in Jammu & Kashmir.

The RR is an elite counter-insurgency unit of the Army and has permanent in terror-hit Jammu and Kashmir and keeps participating in counter-terror operations with the State police and CRPF. Unlike RR, Army’s battalions are rotated on regular basis.

Following the move, the ITBP battalions will be exclusively used against the Naxals and intensify the operations against them in Chhattisgarh.

Besides containing terrorism in Jammu and Kashmir, countering the Naxals is a top priority of the Union Home Ministry that has been harping on intensifying operations against the ultras in Naxalism-hit States.

Out of the strength of 56 battalions of the ITBP, 34 battalions are engaged on securing the LAC, 11 are deployed in internal security and eight in Naxal-hit States and the remaining three battalions are providing protection to important installations and VIPs.",india,https://www.dailypioneer.com/images/logo.jpg,https://www.dailypioneer.com/2020/india/itbp-to-deploy-8-000-troops-permanently-in-naxal-hit-c---garh.html
133,25-4-20,Be prudent in spending: Rajnath to forces,"In view of the financial implications arising due to COVID-19 and the lockdown, Defence Minister Rajnath Singh on Friday asked the three Services to use resources prudently and avoid wastage while maintaining operational readiness. He also asked the commanders to identify and prioritise tasks and assist in the revival of the economy after the lockdown is lifted.

The Minister’s directive to the Services chiefs came in the backdrop of the impact of the lockdown on the economy on the whole and likely setback for some months in procurement of weapons systems. The armed forces were asked a few days back to avoid inking new deals in the first quarter of the current fiscal due to economic factors.

Moreover, with the possibility of budgetary constraints or cuts in the near future, the three Services were also asked to put on hold their acquisition processes to buy new weapon systems. The Department of Military Affairs in a letter also asked the forces to put on hold their capital acquisition processes till the time the COVID-19 situation continues in the country, sources said.

Faced with global slowdown, the delivery schedule of 36 Rafale fighter jets is likely to get delayed by some weeks now. The first four jets were scheduled to come to India from France next month. The deal is worth over Rs 59,000 crores.

Similarly, the S-400 missile shield system deal worth over Rs 45,000 crore with Russia may get delayed too though the Russians have assured of timely delivery schedule.

Some other procurement time lines pertaining to tanks, artillery guns and assault rifles from different countries may also get affected besides the Navy’s recent deal with the US for 24 multi-role helicopters.

Given this backdrop, the defence minister in a video-conference here with the commanders of the three Services directed them to initiate measures to spend the financial resources, avoiding wastage in view of the economic burden imposed by COVID-19.

In his address, Singh said he expected the forces to ensure their operational preparedness, “while they are battling COVID-19 and the adversary should not be allowed to exploit the current situation,” defence ministry officials said later.

“Stressing on the requirement of jointness of the armed forces, the Defence Minister asked the Commanders in Chief to identify and prioritise tasks that could be accomplished quickly and assist in revival of the economy after the lockdown is lifted,” the Ministry stated.

The Service Commanders appreciated the recent devolution of emergency financial powers by the Ministry that has ensured timely procurement of necessary medical supplies, to bolster the health infrastructure of the hospitals.

The conference was attended by the three Service Chiefs including General M M Naravane, Admiral Karambir Singh, Air Chief Marshal R K S Bhadauria, Chief of Defence Staff General Bipin Rawat(CDS),Defence Secretary Ajay Kumar and Secretary (Defence Finance) Gargi Kaul besides other senior officials of the ministry.",india,https://www.dailypioneer.com/images/logo.jpg,https://www.dailypioneer.com/2020/india/be-prudent-in-spending--rajnath-to-forces.html
134,25-4-20,Modi: Corona contagion has taught country to be self-reliant,"Prime Minister Narendra Modi on Friday said the prevailing global contagion has taught the country to be self-reliant and self-sufficient. “It is the biggest lesson leant from corona pandemic,” the Prime Minister said as he addressed ‘sarpanches’ and ‘Gram Panchayats’ on Friday observed annually as National Panchayat Day.

He launched a unified e-GramSwaraj portal and a mobile app on this occasion as part of a new initiative aimed at providing Gram Panchayats with a single interface to prepare and implement gram panchayat development plan (GPDP).

The Prime Minister, who interacted with the ‘Sarpanchs’ across the country via videoconferencing, said ''Villages, districts and States should be independent for the fulfilment of their own needs.''

The e-GramSwaraj portal and app will help in simplifying accounting application for Panchayati raj and will serve as a single platform to account for gram Panchayat's day to day activities. This app will ensure transparency in gram Panchayat's day to day working, efficient record keeping as the GramSwaraj app will be accessible to every villager.

Another major project is the ‘Swamitva Yojana’ launched by the Central Government. Under this project, household areas will be mapped via drones. Title deed will be given to property owners post mapping. Swamitva Yojana is already in its trial phase in states like Uttar Pradesh, Uttarakhand and Madhya Pradesh.

""There was a time when less than 100 hundred panchayats across the country were connected to broadband. Today, broadband has reached more than 1.25 lakh panchayats”, he said.

""Indian villages have become a subject of research for international scientists as well as scientists and researchers back home. You have given the 'Do Gaj doori' mantra to the world to combat COVID-19 without using lofty words like social distancing and lockdown.

“It is because of you that the world is discussing how India has managed to combat COVID-19,"" said Prime Minister on the new norms mandated by the one-month-long lockdown across the country.

“It is true that we are faced with obstacles and problems but resolve to keep moving forward with new energy, finding new ways to work, saving the country and advancing the country is strong,” Modi said and assured that the country would emerge stronger through the crisis.

Modi suggested that there should be a sanitisation campaign in villages to ensure minimal spread of coronavirus. The Prime Minister also urged the gram panchayats to make quarantine centres for people coming from cities and to help people with essential needs.

""Fake news around COVID-19 needs to be avoided and we need to be alert while posting anything on social media platforms. I am shocked to see that misinformation around what and what not to eat during this time is being spread at an unprecedented pace,"" said the Prime Minister.",india,https://www.dailypioneer.com/images/logo.jpg,https://www.dailypioneer.com/2020/india/modi--corona-contagion-has-taught-country-to-be-self-reliant.html
135,25-4-20,"Road Ministry bans smoking, tobacco at work stations","To prevent the spread of coronavirus, the Union Rural Development Ministry has banned smoking cigarettes or beedis, chewing tobacco and spitting at the work sites under the MNREGA scheme.

Rajesh Bhushan, Secretary of the Rural Development Ministry during a video conference a few days ago asked all the states to follow the directives to prevent the spread of coronavirus among the MNREGA workers.

“Precautions need to be taken while performing tasks under MGNREGA, Pradhan Mantri Gram Sadak Yojana (PMGSY), Pradhan Mantri Awas Yojana (Rural) and National Livelihood Mission in non containment zones,” said the Secretary.

He said that it was important for all states and union territories to develop a standard plan for each workplace. As per the directives issued by the official, smoking at the workplace has to be completely forbidden while no person should be found eating tobacco, etc. and spitting to be completely prohibited where the work is going on.

The Secretary also said that if anyone has health problems, then he should be taken to the nearest health centre.

The Ministry of Rural Development has asked all the states to follow the April 15 guidelines of the Union Home Ministry which states that “spitting in public places shall be punishable with fine” and “there shall be strict ban on sale of liquor, gutka, tobacco, etc and spitting should be strictly prohibited.”

The Union Health Ministry has also asked the States to ensure that spitting is banned as it could spread the infectious Coronavirous.

It had cited the Indian Council of Medical Research (ICMR) appeal which noted that the harmful effects of tobacco use are well established and accepted globally. Also the role of tobacco use/spitting in public place in spreading infectious diseases like Coronavirus. Chewing of smokeless tobacco products (gutkha, zarda, khaini and other chewing tobacco products and paan masala) and areca nut (supari) increases the production of saliva followed by a very strong urge to spit.

Spitting in public places increases the dangers of spread of Coronavirus/Covid-19.

States like Bihar, Jharkhand, Telangana, Uttar Pradesh, Uttarkhand, Maharashtra, Haryana, Nagaland and Assam have already issued orders on the ban of use of smokeless tobacco products and spitting in public places during the Covid epidemic.",india,https://www.dailypioneer.com/images/logo.jpg,https://www.dailypioneer.com/2020/india/road-ministry-bans-smoking--tobacco-at-work-stations.html
