,Date,Title,Article,Category,Image_link,Article_link
170,14-4-20,Delhi will ‘fully implement' lockdown measures announced by PM Modi: Kejriwal,"Lockdown measures announced by Prime Minister Narendra Modi will be “fully implemented” in Delhi, Chief Minister Arvind Kejriwal said on Tuesday and asserted that the national capital will succeed in containing the spread of coronavirus.

Welcoming Modi's decision to extend the nationwide lockdown till May 3, Kejriwal urged people to strictly adhere to the restrictions so that the city gets rid of coronavirus.

Addressing an online briefing, Kejriwal said it is a matter of concern that cases of COVID-19 are increasing in the national capital.

""I am confident that we will succeed in containing the COVID-19 outbreak in Delhi,"" the chief minister said.

Modi on Tuesday announced that the current lockdown will be extended till May 3, saying it is very necessary to contain the spread of the coronavirus pandemic in the country.

It was necessary to extend the lockdown, Kejriwal further said.

""If we strictly follow lockdown rules, I am very sure that we will get rid of COVID-19,"" he said.

Kejriwal also said that he would visit some COVID-19 containment zones in the city on Wednesday to take stock of the situation.

On Monday, the national capital reported a sharp rise in the number of COVID-19 cases in a day with 356, taking the tally to 1,510, while four people died of the disease within 24 hours.",top-stories,https://www.dailypioneer.com/uploads/2020/story/images/big/delhi-will----fully-implement--lockdown-measures-announced-by-pm-modi--kejriwal-2020-04-14.jpg,https://www.dailypioneer.com/2020/top-stories/delhi-will----fully-implement--lockdown-measures-announced-by-pm-modi--kejriwal.html
171,14-4-20,PM’s balancing act at 10 am,"All eyes on how Govt restarts economy with extended lockdown

Prime Minister Narendra Modi is to address the nation at 10 am on Tuesday to throw light on how the Government proposes to keep the country under lockdown and reopen the industry and business activities in the country.

A day after the Commerce Ministry proposed opening up most of the industries with safeguards, Road and Transport Minister Nitin Gadkari said the Government is seeking ways to resume construction of highways and arterial roads in districts least impacted by the coronavirus outbreak as it charts out a plan to revive Asia’s third-largest economy.

Even as there is gradual rise in the numbers of cases affected by coronavirus, the Central Government is considering easing some restrictions during the likely extended duration beyond April 14 and a revival plan for economy may also be on table.

The Modi Government will run special train and bus services for agricultural labour and farm industry workers. Special package is being worked out for the labourers working during the lockdown period in the wake of Covid-19 threat, according to Government officials.

Essential industrial sectors would also be opened for ensuring that the key economic sectors are also kept running. PM Modi has directed all Ministers and officials above Joint Secretary rank to resume work from this week to work towards a post-lockdown economic revival.

The Government has allowed inter-State movement of trucks and States like Odisha and Punjab have given permission to harvesting, irrigation, transport of seeds and agriculture products, agriculture machineries and cold storage.

In some States, construction of highways may also be exempted from the total shutdown. Districts which are away from the urban centres and where there have been zero Covid-19 cases may be exempted from the lockdown and construction activity of roads should be allowed as it is essential for any economy.

The Ministry of Road Transport and Highways and the National Highways Authority of India (NHAI) are also in discussions with various States to evaluate the situation on the ground.

Some States and districts had sought permission to start road construction work where the density of population is low. They had also said the guidelines of social distancing would be followed to commence the project.

The view in the Government is it needs to move fast and introduce some fiscal measures that can assure money will still flow into the bank accounts of those affected individuals and small businesses and keep them afloat with cash flow happening even during lockdown on a daily basis, sources said.

According to sources, leeway would be given to unorganised sector that constitutes 65 to 70 per cent of country’s economy where workers have lost their wages and jobs during the ongoing lockdown. Relaxation will be accorded to small-and-medium enterprises too.",page1,https://www.dailypioneer.com/uploads/2020/story/images/big/pm---s-balancing-act-at-10-am-2020-04-14.jpg,https://www.dailypioneer.com/2020/page1/pm---s-balancing-act-at-10-am.html
172,14-4-20,"Whether in power or not, Cong will help people fight against COVID-19: Sonia Gandhi","Congress president Sonia Gandhi on Tuesday sought to assure people of her party's support amid the corona-led crisis and expressed confidence that with a strong morale, the country will emerge victorious against the crisis very soon.

In a video message released by the party, the Congress president urged countrymen to stay indoors, be safe and observe the lockdown stipulations, saying it will not be possible to win this battle without everyone's support.

The message by the Congress president came shortly before Prime Minister Narendra Modi was to address the nation to chart out the next course of action after the 21-day lockdown, which is to end on Tuesday midnight.

Gandhi also thanked people for maintaining peace and patience while staying indoors and adhering to the lockdown stipulations.

""Today, when the country is fighting such a big battle, every Congress worker understands his responsibility and is always ready to help every warrior in this fight.

""Anyone can ask for our support at the state level or at the central control room and every Congress worker will support you,"" she said.

The Congress chief also sought to assure people of her party's support in fighting the anti-corona battle in these trying times.

""I assure you that whether the Congress party is in power or in opposition, we will stand by you anywhere in this battle. I am confident that, with a high morale, we will emerge from this crisis very soon. You stay at home and be safe,"" she said in her video message in Hindi.

""Today, your support in dealing with the crisis due to coronavirus is no less patriotism. The country is able to fight this virus only because of your help and support. I do not have words to thank you,"" she said.

Gandhi told countrymen that our warriors are working hard, day and night, in helping fight this battle and win over it, despite the shortage of personal protection equipment.

These warriors, she said, include doctors, health workers and NGOs.

Sanitation workers, police personnel and government officers too are working hard and round the clock to control the deadly virus, she added.

""This fight will weaken without your support, and we should not allow this to happen.

""At some place, I hear reports about ill-treatment meted out to doctors. This is wrong. Our culture and tradition does not allow this and we should support them,"" she said.

She also lauded the work done by some people at individual level in supporting the poor in providing them food, ration and sanitisers.

""Every Indian is unitedly fighting this battle and fulfilling his or her duty,"" she said.

",top-stories,https://www.dailypioneer.com/uploads/2020/story/images/big/whether-in-power-or-not--cong-will-help-people-fight-against-covid-19--sonia-gandhi-2020-04-14.jpg,https://www.dailypioneer.com/2020/top-stories/whether-in-power-or-not--cong-will-help-people-fight-against-covid-19--sonia-gandhi.html
173,14-4-20,Rlys extends suspension of passenger services till May 3,"The Indian Railways on Tuesday said full refund would automatically be provided to its online customers for trains cancelled up to May 3, while those who have booked at the counters can take refund till July 31.

Customers will also get full refunds of their tickets if they are cancelling their advance bookings for trains not yet cancelled, it said.

The railways on Tuesday extended the suspension of all its passenger trains after Prime Minister Narendra Modi extended nationwide lockdown till May 3 in view of the coronavirus spread.

It also said that no advance reservation of trains tickets, including e-tickets, will be allowed till further orders. However, facility of online cancellation will remain functional.

""As far as trains cancelled up to May 3 are concerned, refunds would be automatically provided by the railways online to the customers while those who have booked at the counters, refund can be taken up to July 31. Full refund will be given for tickets for the bookings made for the trains cancelled.

""Full refund will also be there for those cancelling the advance bookings of tickets for trains not yet cancelled,"" the railways said.

India has reported over 10,000 COVID-19 cases and 339 deaths so far.

",top-stories,https://www.dailypioneer.com/uploads/2020/story/images/big/rlys-extends-suspension-of-passenger-services-till-may-3-2020-04-14.jpg,https://www.dailypioneer.com/2020/top-stories/rlys-extends-suspension-of-passenger-services-till-may-3.html
174,14-4-20,"Cong tears into PM's address, says no concrete measures for poor, economy","The Congress on Tuesday termed as rhetoric and hollow on specifics the prime minister's address to the nation, saying there was no mention of a financial package or concrete steps to revive the economy.

Congress chief spokesperson Randeep Surjewala asked where is the country's roadmap to fight coronavirus.

He said leadership does not mean making people realise their responsibilities but to fulfil the government's duty of accountability towards the people of the country.

""A lot of talk has taken place. But, where is the roadmap to fight corona,"" he asked.

Senior Congress leader P Chidambaram said, ""The poor have been left to fend for themselves for 21+19 days, including practically soliciting food. There is money, there is food, but the government will not release either money or food. Cry, my beloved country,"" he said on Twitter.

Prime Minister Narendra Modi on Tuesday announced that the lockdown across the country will be extended till May 3 to fight the coronavirus pandemic, saying the measure has produced a significant outcome in containing the infection.

Congress spokesperson Abhishek Singhvi said the PM's address was like Hamlet without the Prince of Denmark.

""Amazing PM address. Exhortation, rhetoric, inspiration.....yet hollow on specifics! No financial package, no details, no concrete item. Neither for poor nor middle class nor industry nor businesses. Lockdown is good but cannot be end in itself! Where is single livelihood issue,"" he asked.

He said the PM be assured that all stakeholders will do their duties and will strictly observe lockdown.

""After this: should we pray? We want concrete palliatives for these deprived classes and even for middle india and MSMEs,"" he said.

""Pm address wo single specific and without guidelines is like Hamlet without Prince of Denmark. Like PM without details! We want increased GDP allocation; specific targeted monetary injections; Keynesian spending; loosen FMRB etc. not a single word!,"" he tweeted.

Chidambaram also said that he welcomed the lockdown and understands the reason for its extension.

He, however, said the CMs' demand for money elicited no response.

""Not a rupee has been added to the miserly package of March 25, 2020. From Raghuram Rajan to Jean Dreze, from Prabhat Patnaik to Abhijit Banerji, their advice has fallen on deaf years,"" the former finance minister said.

While supporting the PM's announcement of extending the lockdown, Congress leader Shashi Tharoor said the PM should have also announced serious relief for those who cannot make ends meet.

""I support the announcement by @PMOIndia @narendraModi of Lockdown extension. Can't discard the gains being made,"" Tharoor tweeted.

""But he should have also announced serious relief for those who cannot make ends meet. MNREGA payments, JanDhan accounts, GST dues to states and aid to sweeten the pill,"" the MP from Thiruvananthapuram said.

",top-stories,https://www.dailypioneer.com/uploads/2020/story/images/big/cong-tears-into-pm-s-address--says-no-concrete-measures-for-poor--economy-2020-04-14.jpg,https://www.dailypioneer.com/2020/top-stories/cong-tears-into-pm-s-address--says-no-concrete-measures-for-poor--economy.html
175,14-4-20,"Enough stock of essential commodities, no need to worry: Shah","Union Home Minister Amit Shah on Tuesday assured everyone that there is enough stock of food, medicines and other essential commodities and no one should worry for the extended period of lockdown.

In a series of tweets, the home minister also appealed to the affluent people to help the needy living nearby.

""As the home minister of the country, I assure the public again that there is enough stock of food, medicines and other commodities in the country. No one should worry about that.

""I also request the affluent people to come forward and help the poor living nearby,"" he said.

Praising the role of the state governments, Shah said the way all the state governments are working with the central government is truly praiseworthy.

""Now, we have to intensify this coordination so that all citizens follow the lockdown properly and no citizen should have the problem of the things they need,"" Shah said.

The home minister said the contribution of the doctors, healthcare workers, sanitation workers, police and all the security personnel who are playing an important role in this fight is very touching.

""Your courage and understanding in this odd situation inspires every Indian. Everyone should follow the guidelines and cooperate with them,"" he said.

Prime Minister Narendra Modi on Tuesday announced that the lockdown across the country will be extended till May 3 to fight the coronavirus pandemic.

",top-stories,https://www.dailypioneer.com/uploads/2020/story/images/big/enough-stock-of-essential-commodities--no-need-to-worry--shah-2020-04-14.jpg,https://www.dailypioneer.com/2020/top-stories/enough-stock-of-essential-commodities--no-need-to-worry--shah.html
176,14-4-20,"Govt extends suspension of domestic, intl commercial passenger flights till May 3 midnight","The Civil Aviation Ministry on Tuesday said all international and domestic commercial passenger flights will remain suspended till midnight of May 3.

The decision comes after Prime Minister Narendra Modi on Tuesday announced that the lockdown across the country will be extended till May 3 to fight the coronavirus pandemic.

Domestic and international commercial passenger flights were earlier suspended from March 25 to April 14.

""All domestic and international scheduled airlines operation shall remain suspended till 11.59 pm of 3rd May 2020,"" the ministry tweeted.

",top-stories,https://www.dailypioneer.com/uploads/2020/story/images/big/govt-extends-suspension-of-domestic--intl-commercial-passenger-flights-till-may-3-midnight-2020-04-14.jpg,https://www.dailypioneer.com/2020/top-stories/govt-extends-suspension-of-domestic--intl-commercial-passenger-flights-till-may-3-midnight.html
177,14-4-20,Delhi to fully implement lockdown measures: Kejriwal,"Chief Minister Arvind Kejriwal on Tuesday said Delhi would fully implement lockdown measures announced by Prime Minister Narendra Modi to contain the COVID-19 spread.

In a televised address to the nation on Tuesday morning, the prime minister announced that the current lockdown will be extended till May 3.

""Delhi will fully implement PM's lockdown measures,"" Kejriwal tweeted.

Modi said implementation of the lockdown will be strictly ensured in the coming days to ensure that the coronavirus does not spread to new areas.

",top-stories,https://www.dailypioneer.com/uploads/2020/story/images/big/delhi-to-fully-implement-lockdown-measures--kejriwal-2020-04-14.jpg,https://www.dailypioneer.com/2020/top-stories/delhi-to-fully-implement-lockdown-measures--kejriwal.html
178,14-4-20,PM seeks people's support in 7 things to defeat coronavirus,"Prime Minister Narendra Modi on Tuesday asked people to follow seven things in the coming days to help the government in its fight against the coronavirus.

The seven things which the prime minister asked people to follow included taking care of the elderly as they are more prone to infection, keeping their faces covered while venturing out and taking care of the poor and the needy who have been effected by the lockdown.

"" ... if we continue to be patient and follow rules, we will be able to defeat even a pandemic like coronavirus. With this faith and trust, I seek your support for 7 things,"" he said in his address to the nation.

Modi on Tuesday announced that the lockdown across the country will be extended till May 3 to fight the pandemic, saying the measure has produced a significant outcome in containing the infection

The first thing he asked for was to take special care of the elderly, especially those who have chronic disease. ""We have to take extra care of them, and keep them safe from coronavirus,"" he said.

The second thing Modi said was strict adherence to the 'Lakshman Rekha' of the lockdown and social distancing. ""Please also use homemade face-covers and masks without fail,"" he said.

He also urged people to follow the protocol issued by the Ayush Ministry to enhance immunity. ""Regularly consume warm water and kadha',"" he said.

The prime minister also stressed on the need to download the the Arogya Setu mobile app to help prevent the spread of coronavirus infection.

"" Take as much care of poor families as you can ... try to fulfill their food requirements ... Be compassionate towards the people who work with you in your business or industry. Do not deprive them of their livelihood,"" he said.

Finally, he said people should pay utmost respect to ""Corona Warriors"" doctors and nurses, sanitation workers and police force.

",top-stories,https://www.dailypioneer.com/uploads/2020/story/images/big/pm-seeks-people-s-support-in-7-things-to-defeat-coronavirus-2020-04-14.jpg,https://www.dailypioneer.com/2020/top-stories/pm-seeks-people-s-support-in-7-things-to-defeat-coronavirus.html
179,14-4-20,"10,453 +ve; but zero case in 25 dists in 2 weeks","Highest day spike of 1,241 cases, but lockdown fruitful in 25 dists in 15 States

A day ahead of the completion of 21-day lockdown imposed to curb the spread of Covid-19 pandemic, the country saw the biggest single day spike in the number of positive cases with both Maharashtra and Delhi reporting more than 300 fresh cases on Monday. The total cases countrywide stood at 10,453 and the single day rise was 1,241 plus.

This worrying signal emerged even as the Government on Monday said that containment measures have started showing results with at least 25 districts from 15 States not reporting any new case in the last 14 days.

Mumbai became the first city to record more than 100 deaths, whereas Maharashtra’s total death count stood at 150 and total positive cases was recorded at 2,314.

Delhi’s total count stood at 1,510 positive cases after the national Capital reported 356 fresh cases, 315 of them linked to Tablighi Jamaat.

Talking to reporters at a routine presser, Lav Agarwal, Joint Secretary in Union Health Ministry, said at the ground level containment measures have started yielding results.

“At least 25 districts from 15 States have not reported any new case since the last 14 days. These are Gondia in Maharashtra, Rajnandgaon, Durg, Bilaspur in Chhattisgarh, Davangiri, Kodagu, Tumkuru, Udupi in Karnataka, South Goa, Wayanad and Kottayam in Kerala, West Imphal in Manipur, Rajouri in Jammu and Kashmir and Aizawl West in Mizoram.

“The other districts are Mahe in Puducherry, SBS Nagar in Punjab, Patna, Nalanda and Munger in Bihar, Pratapgarh in Rajasthan, Panipat, Rohtak, Sirsa in Haryana, Pauri Garhwal in Uttrakhand, and Bhadradri Kothagudem in Telangana,"" Agarwal said.

Agarwal said that at least 141 people have recovered from novel coronavirus in the last 24 hours.

Maharashtra continued to be the worst-hit state with nearly 2,100 cases. More than 1,000 case were confirmed from Mumbai alone.

The total number of patients crossed 1,100-mark in Delhi. The death toll in the national capital was at 24.

In the northeast region, Assam has reported a total of 31 cases followed by two cases each in Manipur and Tripura. Mizoram, Nagaland and Arunachal Pradesh have one case each

""Till yesterday, we conducted 2,06,212 Covid-19 tests,"" said Raman R Gangakhedkar, of the Indian Council of Medical Research (ICMR). He also claimed that the institute has enough stocks to conduct tests for next six weeks easily.",page1,https://www.dailypioneer.com/uploads/2020/story/images/big/10-453--ve--but-zero-case-in-25-dists-in-2-weeks-2020-04-14.jpg,https://www.dailypioneer.com/2020/page1/10-453--ve--but-zero-case-in-25-dists-in-2-weeks.html
180,14-4-20,Oils on your Platter,"There is nothing called a good oil or a bad one. The key is to create balance between saturated and unsaturated fats, says Rachna Chhachhi

Eating fat and oil is important. It helps us absorb the oil soluble vitamins like A, D, E, as well as lubricate our joints and decrease inflammation. They also make our food tasty. However, there is always a phobia as well as confusion around which oils to use for what. If there is an imbalance between saturated and unsaturated fats, we end up increasing our inflammation and hence of the risk of getting deadly lifestyle diseases including cancer. So it is not that some oils are good and others are bad, it is the balance that we must keep to ensure that we can enjoy the taste of our food as well as keep our minds and bodies healthy.

Always remember the smoke point of an oil and use it below the smoke point. If you use an oil above it's smoke point, it becomes cancerous. Here are the oils and fats and their mysteries unravelled:

Sunflower, rice bran & mustard oil: These can be used for high flame cooking and deep frying. All of them have a smoke point of 227 degrees celcius. When we deep fry something, the temperature reaches around 177 degrees Celsius. This makes these three oils safe for deep frying and Indian cooking where a lot of masalas all sauteed on high flame and our typical tadka for the dal is put. Use them sparingly as the benefits of these for heart health and lowering inflammation are limited. They are neutral except for rice bran oil, which has heart protective qualities, as long as we consume them in limited quantities.

Extra virgin olive and flaxseed oils: A lot of people say that they do all their cooking in extra virgin olive oil. This is the most hazardous thing anyone can do from a health perspective, because extra virgin olive oil has a smoke point of 160 degrees. When we cook in extra virgin olive oil, we are way above its smoke point, hence making this wonderfully anti-inflammatory oil inflammatory and cancerous in nature. The same applies to virgin flaxseed oil. Hence, extra virgin olive and falxseed oils should be strictly used raw, for salads or smoothies only. They should come in a glass bottle, not plastic, and should say cold press/extraction somewhere on the bottle. Extra virgin olive and flaxseed oils are rich in omega-3 fatty acids, making them ideal for reducing bad cholesterol and inflammation inside the body. One should aim at 25-30 ml per day of these raw oils in salads every day.

Saturated oils: These include coconut oil, butter and ghee and their smoke points are 177 degrees. They should be used very sparingly as saturated fat can increase our triglycerides and cholesterol as well as the risk of stomach-related cancers and prostate cancer. A lot of people use butter, ghee or coconut oil for tempering spices on high flame, however, the smoke point for these oils is 177 degrees Celsius. This means that we are dangerously close to converting them into carcinogenic oils as they have already reached their smoke point of 177 degrees. A good measure is not more than 5 per cent of the total fat you consume.

A great way to balance your fat and oil intake is to use minimal oil for cooking.

The writer is Cancer Nutrition Expert & Brand Ambassador Gemini™ Rice Bran Oil",pioneer-health,https://www.dailypioneer.com/images/logo.jpg,https://www.dailypioneer.com/2020/pioneer-health/oils-on-your-platter.html
