,Date,Title,Article,Category,Image_link,Article_link
48,14-4-20,Child porn material in high demand in BBSR,"The Indian Child Protection Fund (ICPF) on Monday said that Bhubaneswar is among the cities where the demand for generic child pornographic material (also referred to as Child Sexual Abuse Material) is highest, thereby posing grave risks to its children during the Covid-induced lockdown.

The ICPF reported that since the lockdown, online data monitoring websites are showing an increase in demand for searches like ‘child porn’, ‘sexy child’ and ‘teen sex videos’.

Data from Pornhub, the world’s largest pornography website, also revealed that traffic from India has increased by 95 per cent between March 24 and 26 compared to their average traffic before coronavirus.

“This is a blatant violation of the directions of the Honourable Supreme Court and a violation of national policy. Pornographic websites are playing hide-and-seek with Indian law and judiciary by simply changing their website URLs. The Government of India must urgently crackdown on child pornography and also initiate a global dialogue for an international convention against child sexual abuse material,” asserted ICPF spokesperson Nivedita Ahuja.

The ICPF has released a report titled ‘Child Sexual Abuse Material in India’, a research of child pornography demand in 100 Indian cities like New Delhi, Chennai, Mumbai, Kolkata, Bhubaneswar and Indore.",state-editions,https://www.dailypioneer.com/images/logo.jpg,https://www.dailypioneer.com/2020/state-editions/child-porn-material-in-high-demand-in-bbsr.html
49,14-4-20,Lt Gen Dhalasamanta passes away,"Lt Gen (retired) KP Dhalasamanta from Odisha passed away at a private hospital in New Delhi on Monday. He was 71 and is survived by his wife Sumananjali Devi and son Pranab Dhalasamanta, Deputy Executive Editor of The Economic Times.

Dhalasamanta, who was battling with cancer, was a former Director General of the Rashtriya Rifles, India’s premier counter insurgency force deployed in Kashmir. He had fought in the 1971 war on the eastern front and was awarded the Poorvi Star.

He was among the veterans invited regularly to Bangladesh as a mark of honour for their valiant efforts in the liberation of Bangladesh.

Gen Dhalasamanta had also participated in Operation Blue Star in Punjab. He had commanded an artillery regiment in the Siachen Glacier. During the 1999 Kargil war, he was instrumental in helping deploy the 155mm Bofors guns in difficult conditions.

On retirement, he was made Member of the then newly created Armed Forces Tribunal in Kolkata before settling down in Bhubaneswar since 2014 onwards.

Gen Dhalasamanta has also written several Odia poems and was involved in Odia theatre. Chief Minister Naveen Patnaik, Union Minister Dharmendra Pradhan and many other eminent personalities mourned the General’s demise.",state-editions,https://www.dailypioneer.com/images/logo.jpg,https://www.dailypioneer.com/2020/state-editions/lt-gen-dhalasamanta-passes-away.html
50,14-4-20,466 morning walkers rounded up in Chandigarh,"As many as 466 morning walkers were rounded up in various parks across Chandigarh on Monday morning, in a special drive carried out to nab people disobeying curfew orders.

In view of Covid-19 outbreak across the country, curfew was imposed in Chandigarh on March 24 to ensure social distancing.

“During the special drive conducted by Chandigarh Police for the enforcement of curfew, a total of 120 parks were checked thoroughly and 466 persons were rounded up. Moreover 182 violators were arrested and 56 FIRs were registered against them for disobeying curfew orders,” said a spokesman.

FIRs were registered under Section 188 IPC (Disobedience to order duly promulgated by public servant) for violating curfew orders and not wearing masks as made mandatory in Chandigarh, the spokesman said.

After receiving complaints about morning and evening walkers thronging the parks even during curfew period, the Chandigarh Administration had directed the UT Police to take action against them.

Giving details, the spokesman said that 215 persons were nabbed in central division, 142 in east division and 109 in south division. A person who was out for a walk alongwith his dog was also rounded up while the Police had allowed the family to take the dog alongwith them, the spokesperson said.

He said that even after repeatedly spreading awareness and warnings, some people are still found violating curfew orders. They were venturing out of their houses for morning walk in various parks.

The UT Police will continue to scrupulously check the morning and evening walkers and action will be taken against those who will not follow the norms and guidelines of curfew, the spokesman added.

From March 23 till Monday evening, a total of 12959 persons have been rounded up for violating curfew orders in the city. A total of 6473 vehicles have been detained, out of which 3768 were impounded.",state-editions,https://www.dailypioneer.com/images/logo.jpg,https://www.dailypioneer.com/2020/state-editions/466-morning-walkers-rounded-up-in-chandigarh.html
51,14-4-20,Odia scientist gives Rs 11.43L to CMRF,"US-based Odia biotech scientist and social worker Dr Sitikantha Dash has donated 15,000 dollar or Rs 11,43,000 to the Chief Minister’s Relief Fund for Covid-19.

Dr Dash belongs to Salepur of Cuttack district and owns a lab in the US. He is also the founder of Dr Dash Foundation, which is engaged in various humanitarian works across the globe. The foundation runs an innovation centre at the IIT Bhubaneswar.

Dr Dash is also known for establishing various temples and educational institutions at his village. He is devoted to propagation of Odishan culture in the US.",state-editions,https://www.dailypioneer.com/images/logo.jpg,https://www.dailypioneer.com/2020/state-editions/odia-scientist-gives-rs-11-43l-to-cmrf.html
52,14-4-20,"COVID-19 Hospitals in B’swar, J’pore","The first dedicated COVID Hospital in Baleswar district became operational on Monday. The unit having 120 beds was opened at the Jyoti Hospital at Kuruda.

The hospital is funded by the Odisha Hydro Power Corporation (OHPC).

District Headquarters Hospital senior doctor Dulalsen Jagdeo is the In-Charge Medical Officer of the hospital.

Also on the day, a 150-bed COVID Hospital was inaugurated in Jeypore town in Koraput district with the building of the old Sub-Divisional Hospital being converted into the new facility.

While doctors would be accommodated at two hotels in the town, the paramedics would stay at the newly-built local Vikram Dev College.",state-editions,https://www.dailypioneer.com/images/logo.jpg,https://www.dailypioneer.com/2020/state-editions/covid-19-hospitals-in-b---swar--j---pore.html
53,14-4-20,99L Ujjwala women to benefit in State,"About 99.42 lakh Prime Minister Ujjwala Yojana (PMUY) beneficiaries in the State would be benefitted as they would be supplied free LPG refills over a period of three months from April to June.

Union Petroleum and Natural Gas Minister Dharmendra Pradhan announced free distribution of Ujjwala gas recently.

This is part of the Union Government's initiatives taken under the Pradhan Mantri Garib Kalyan Yojana (PMGKY) to alleviate the hardships faced by the poor due to economic disruption by coronavirus.

Booking of 1.26 crore cylinders has been done this month by PMUY beneficiaries, totalling 8 crore in the country, out of which about 85 lakh cylinders have been delivered.",state-editions,https://www.dailypioneer.com/images/logo.jpg,https://www.dailypioneer.com/2020/state-editions/99l-ujjwala-women-to-benefit-in-state.html
54,14-4-20,Blood donation camp at Brahmapur,"At a time when blood collection has been hit due to coronavirus threat and patients are suffering a lot, the Brahmapur Sabuja Bahini and the Amchalika Bikash Parishad organised a blood donation camp for the fifth time under a campaign named ""Asantu Gadhiba Rakta Sampark"" (Let's build blood relation) at the Brahmapur Blood Bank here on Sunday.

A total of 13 units of blood were collected. Dr Rashmita Panigrahi and Susmita Behera collected bood. Sabuja Bahini president Sibaram Panigrahi and Parishad secretary Bijendra Majhi coordinated the camp. Bishnu Prasad Das, Satya Narayan Das and Durga Prasad Panda provided coopratio. Nine youths from Lanjia village and four from Brahmapur donated blood.",state-editions,https://www.dailypioneer.com/images/logo.jpg,https://www.dailypioneer.com/2020/state-editions/blood-donation-camp-at-brahmapur.html
55,14-4-20,"4,100 inmates released; 640 new inmates lodged in Hry jails","To decongest State prisons in the wake of the Covid-19 pandemic, around 4,100 jail inmates were released on parole or interim bail in Haryana during the first 20 days of lockdown.

However, on the charges of different offences, around 640 new inmates have also been lodged in jails after the national lockdown imposed on March 24, Haryana Director General (Prisons) K Selvaraj said while talking to The Pioneer over the phone.

Earlier, in pursuance to the directives issued by the apex court, the State Government had decided that convicts will be released on parole for six weeks and undertrial prisoners on interim bail for the same period, to de-congest jails and to prevent the spread of Covid-19.

Selvaraj said, “Prisons have suspended visitation and largely restricted the movement of inmates within their jails. We are taking all precautionary measures and have given necessary directions to the jail authorities in view of Covid-19 outbreak.”

Jail authorities have been asked to ensure that anyone who reports fever or flu will be shifted to the isolation ward with the recommendation of the medical officer, he said, adding they have been directed to make an arrangement of sanitisers at the entrance and ensure that no one is allowed to enter without using it. The meeting of inmates with their family members has also been cancelled till the next order and no outsider is allowed in the jail premises.

The DG (Prisons) said that till date, as many as 641 new inmates facing various charges have been lodged in different jails of the State since March 25.

A quarantine ward has been set up in all the jails for the newly lodged inmates. These inmates were being kept under observation for 14 days before being transferred to other wards in the prison after being certified by the jail medical officer.

Selvaraj further said that in accordance with the directions issued by a high-powered committee set up for the purpose, as many as 4198 prisoners were released on parole or interim bail or personal bond or regular bail who were confined in several jails across the State.

Among the other steps taken are the suspension of visits and group activities like yoga. Inmates have been asked to refrain from being in large groups, he added.

Sources in jail headquarters said that in some districts, authorities concerned are spraying sodium hydrochloride for disinfecting their jails. Fogging inside the jail has also been ordered to check the spread of malaria. Sanitiser bottles have been placed outside all barracks and inmates have been directed to use them before entering barracks after meals, they added.

Earlier, the Supreme Court had ordered all states to set up high-level panels which would consider releasing all convicts who have been jailed for up to seven years on parole to decongest jails in an attempt to contain the Covid-19 outbreak.

In Haryana, a high-level committee was constituted, which has arranged for the release of around 4,198, and added that many are yet to be released. In the State, more than 19,000 inmates have been lodged in the 19 prisons.",state-editions,https://www.dailypioneer.com/images/logo.jpg,https://www.dailypioneer.com/2020/state-editions/4-100-inmates-released--640-new-inmates-lodged-in-hry-jails.html
56,14-4-20,B’swar betel vine farmers hit hard as leaves rot,"While the COVID-19 scare has affected livelihood of all, irrespective of professions, in north Baleswar the betel vine farmers are the worst sufferers during the lockdown period.

They fear that their condition would further deteriorate as the lockdown period in Odisha has been extended till end of April by Chief Minister Naveen Patnaik.

Not only the farmers, other people associated with the cultivation and profession, including transporters, are sitting idle having no hope to keep their profession afloat. It may be noted everyday hundreds of tons of betel leaf are transported to several places of India including Delhi, Mumbai, Banaras , Azamgargh etc since the betel leaf demand of Baleswar is high in the market because of its special quality and taste.

The betel leaf is highly perishable and on regular basis they are plucked and then processed before being sent outside. North Baleswar betel leaf has a special demand within the State.

Since there is no scope of transporting betel leaf thesedays, they are not plucked from the yards, leaving them to rot. Sources said hundreds of acres of betel vine yards are facing similar fate.

Betel vine culture is one of the main sources of income of the area. Not only the farmers, but also the people associated with it are bearing the brunt of the lockdown.",state-editions,https://www.dailypioneer.com/images/logo.jpg,https://www.dailypioneer.com/2020/state-editions/b---swar-betel-vine-farmers-hit-hard-as-leaves-rot.html
57,14-4-20,"Capt leads Baisakhi prayers, thanks to people for staying in","Punjab Chief Minister Capt Amarinder Singh on Monday thanked the people of the State for responding to his appeal for ardas at 11 am from their homes, and celebrating the auspicious festival of Baisakhi from their homes in the larger interest of all.

The Chief Minister, who led the Baisakhi prayers with his own Ardas at his home, hoped that the collective prayers of the people would keep Punjab safe and ensure its victory of the deadly coronavirus.

Capt Amarinder had, a day before, called upon the people not to venture out of their homes to celebrate Baisakhi with the traditional fervour and gaiety, but to stay at home, for their own safety and that of their children as well as the State and the Nation.

Lauding the people’s cooperation in this difficult time, the Chief Minister said that it was the need of the hour for all to behave responsibly and ensure that pandemic does not escalate out of control.

“Unfortunately, we have had to extend the curfew for another two weeks, till May 1, but given the critical situation, there was no option,” said the Chief Minister, hopeful that the State, which had largely been able to control the pandemic till now, would be able to stabilize the situation further.",state-editions,https://www.dailypioneer.com/images/logo.jpg,https://www.dailypioneer.com/2020/state-editions/capt-leads-baisakhi-prayers--thanks-to-people-for-staying-in.html
58,14-4-20,When teachers can best serve by counselling,"Sir, Namaskar. Kebe amoro exam hebo? (When will our exams be held?)”. I am receiving this question from the students at least twenty times every day. Their voices tremble with fear and anxiety. I can understand their plight as their exams were stopped abruptly and there is uncertainty about their future dates.

I convince them as far as possible and assure them that I will intimate them the exam dates as soon as they are announced. Ours is a remote district of Odisha where literacy rates, transport and communication are very poor and it is difficult to pass on the information to the students at short notice.

Students are the worst hit by the nationwide lockdown unable to adjust with the sudden change in their routines. The uncertainty of the conduct of examination and evaluation is taking an emotional toll on the young minds.

The abrupt closure of the examinations results in restlessness, anxiety and irritation among the students. The Class 12 students are away from one subject for completion of their examination. The second and fourth semester degree examinations scheduled to be held in April are postponed indefinitely. Till now I am convincing the students that soon after the lockdown, i.e., April 14, the authorities will take a decision and by the end of April, their examinations will be completed. Now Odisha became the first State in the country to declare extension of lockdown till the end of April. I am preparing myself how to answer the queries of the students and counsel them not to panic.

The University of Calcutta issued a notification that the Psychology and Applied Psychology Departments will provide free counselling services to all students of the university. It released a list of names of professors and their contact numbers whom the students can contact during a specified time. Many reputed colleges and universities are also following the same in the interest of their students. Even the parents can also avail the counselling services. There is every need to introduce the same thing in Odisha.

No doubt, the lockdown and home stay are in the interest of the public and it is prudent to follow the Government guidelines. But the tender age of the student may not understand the severity of the pandemic. The mental pressure on the young minds can be better understood by the teacher and every teacher should act as a counsellor.

During the lockdown period, it is the best thing a teacher can do and there by contribute for the development of mental health of the students. At the same time, they have to clarify their doubts online, if facilities are available. They must be made academically and mentally strong by injecting confidence and hope. This is the need of the hour.

(Dr Biswal is Head, Department of Commerce, Nowrangpur College, Nabarangpur, Odisha. Mob:9437125286. bhaskarbiswal@gmail.com)",state-editions,https://www.dailypioneer.com/images/logo.jpg,https://www.dailypioneer.com/2020/state-editions/when-teachers-can-best-serve-by-counselling.html
59,14-4-20,Haryana CM praises NGOs’ role during crisis,"Haryana Chief Minister Manohar Lal Khattar on Monday praised the role of NGOs during the times of crisis and expressed hope that they will contribute in a big way in the fight against coronavirus.

He said that Government and various other agencies are putting in their best efforts to control the spread of coronavirus but whenever there have been natural calamities like floods, earthquakes or this new type of pandemic, the role of NGOs at such times is appreciable.

In a televised address to the people of Haryana, in which he updated them about the

Covid-19 situation in the State, Khattar said as per rough figures, the total number of registered and unregistered “social organisations or NGOs” in Haryana was nearly 30,000.

“During the times of crisis such as the present one they also put in their efforts,” he said, expressing hope that they will contribute in a big way in the fight to eliminate coronavirus.

He said NGOs can get in touch with Deputy Commissioners concerned and will be facilitated in whatever way they want to contribute in the present situation.

Khattar informed that so far the government had distributed 90 lakh food packets and 4.80 lakh ration kits to the needy people during the lockdown period.

He also said that more and more people were coming forward to make their contributions towards the Haryana Covid Relief Fund. So far, donations worth Rs 75 crore have been received, he said.

Haryana MLAs cutting across parties have donated their one-month salary already towards the Fund and agreed to take 30 per cent pay cut for one year. Former MLAs and pensioners are also contributing, he said. Khattar said coronavirus pandemic has affected millions of people globally. “If I talk of our country, we are still in a safe zone where we can manage things. We have to now ensure that it does not spread in community.”

With Haryana so far reporting 182 coronavirus cases, Khattar said that 115 among those were the Tablighi Jamaat members.

Referring to his recent video conference meeting with Prime Minister Modi, Khattar said the nationwide lockdown was expected to be extended by another two weeks and Haryana is prepared to enforce it.

He again indicated that worst-affected Covid districts of Nuh, Gurgaon, Palwal and Faridabad will be placed in the red zone meaning stricter restrictions, while those with fewer cases will be placed in the “orange category” while the places where there have been no or a few cases will fall in the “green category”.",state-editions,https://www.dailypioneer.com/images/logo.jpg,https://www.dailypioneer.com/2020/state-editions/haryana-cm-praises-ngos----role-during-crisis.html
60,14-4-20,Corona mars Odia NY celebration,"The celebration of Odia New Year was marred due to the coronavirus threat on Monday.

""On the Odia New Year, Odia people sing, dance, make resolutions and visit temples. Meetings and seminars are held. But the coronavirus has dampened the festive mood of Odia people,"" said Utkal Sammilani Manchshwar Industrial Estate Branch president Dillip Dashsharma in a statement.

He informed that he conducted a puja at home and prayed to Lord Jagannath for the wellbeing of all Odia people.

Branch advisor Dr Dwaraka Nath Mohanty, secretary Gobinda Chandra Subudhi and joint-secretaries Sidharth Sankar Gadanayak, Er Shiba Prasad Mishra and Kshetra Mohan Nayak too celebrated the New Year at their houses.",state-editions,https://www.dailypioneer.com/images/logo.jpg,https://www.dailypioneer.com/2020/state-editions/corona-mars-odia-ny-celebration.html
61,14-4-20,"10 more cases in Punjab, including police officer","With 10 new cases reported on Monday, Punjab’s tally stood at 180. Among these, a Punjab Police cop was also tested positive.

Maximum six cases were reported from Pathankot taking the district’s total tally to 22. Besides, two positive cases were confirmed from Jalandhar and one from Ludhiana. So far, the state has recorded total 12 deaths.

The media bulletin said that a total of 3,858 swabs of the 4480, sent for testing, came back negative. Authorities are now awaiting the results for 446 suspected cases.

Currently, the State has 139 active cases, with one person who is critical and on ventilator support, while total 25 have been cured, including two on Monday.

Meanwhile, Pathankot reported six more positive cases on Monday evening. While the mdia bulletin, released by the State Government, have count of two cases, the others four are yet to be added to the official list.

While two are the contacts of Pathankot’s newspaper hawker, who tested positive couple of days back, other four were from the secondary and tertiary level contacts of district’s first positive case, who died in Amritsar hospital.

“Two positive cases have been reported from pathankot including the sister and sister-in-law of newspaper hawker of Anandpur Rarra Rajkumar. Out of 17 samples from the hawker, 15 came negative but two are positive. The standard operation procedure of quarantining people and contact tracing is being done,” said a senior government official.

The other four positive cases are “from secondary and tertiary level contacts of Rajrani’s (the original positive case, now deceased) maid and head of another household, which maid used to also visit”.

Jalandhar also reported two more cases — taking the district’s total to 24. A 25-year-old resident of Lal Bazaar, who tested positive, is related to an already diagnosed patient in the city’s Mitha Bazar. The infection source of another case, 40-year-old resident of Raja Garden, is unknown.

Out of the total, about 17 coronavirus cases in Jalandhar have no contact history.

Meanwhile, a person working at Lovely Professional University in Kapurthala’s Phagwara was brought dead to the civil hospital. Only a day ago, a student from the institution was tested positive.

The health authorities have sent the samples from the patient for testing.

LUDHIANA ACP NORTH, ON DUTY AT SABZI MANDI, TESTED POSITIVE

Ludhiana’s Assistant Commissioner of Police (North) Anil Kumar Kohli has tested positive for coronavirus and is currently on ventilator. The worrying factor is that the cop was on duty at Ludhiana’s sabzi mandi, where people come in large numbers, in the last week of March.

Kohli began to show symptoms of fever and cough in the beginning of April, and was admitted to SPS Hospital on April 8.

His first swabs sent for testing about four days ago were tested negative, but samples sent on Sunday came back positive, said the authorities.

With the new case, Ludhiana now has 11 positive cases.

The officer’s test report has sent alarm bells ringing. The district health authorities are now struggling to identify and isolate the people with whom the cop would have came in contact over the past few days. Besides, the authorities are also taking samples of the people, who visited him in the hospital in the past few days.

“Thirteen close contact of the ACP, including his staff and security, have been quarantined and his wife and son have been sent into isolation and samples have been collected. We are further exploring the contacts of the ACP to know the source of contract. It is too early to say that he got infected from sabzi mandi. We are tracing all the possible contacts and trying to find the source,” said Ludhiana Civil Surgeon Dr Rajesh Bagga.

“The 52-year old Gazetted Officer of Punjab Police, posted in Ludhiana, tests positive. He had been unwell for the past week and has been put on ventilator. SOP is being followed,” said the special chief secretary KBS Sidhu.",state-editions,https://www.dailypioneer.com/images/logo.jpg,https://www.dailypioneer.com/2020/state-editions/10-more-cases-in-punjab--including-police-officer.html
