,Date,Title,Article,Category,Image_link,Article_link
105,14-4-20,Sena slams Fadnavis for safe passage of Wadhawans,"Dubbing IAS officer Amitabh Gupta’s decision to give “safe passage” to scam accused Wadhawan brothers and 21 other family members to Mahabaleshwar amid lockdown period as a “conspiracy” to defame the MVA Government, the Shiv Sena on Tuesday said that Gupta had been appointed by the State Principal Secretary (Home) by former chief minister and senior BJP leader Devendra Fadnavis.

Indirectly accusing Fadnavis of behind the “conspiracy” to malign the Uddhav Thackeray government, the Shjiv Sena – in an editorial published its mouth-piece “Saamana” said: “The current leader of the Opposition in the Assembly (Fadnavis) says that Gupta might not have given travel permission to Wadhavans on his own. There must be someone behind it.. Why is he making all kind of baseless allegations?. The Wadhawan incident happened, when the entire Maharashtra government was pre-occupied with waging a war against Coronavirus.

“The IAS officer, who gave the ‘safe passage” to Wadhawan, was reportedly appointed in the Home department during the previous regime by Fadnavis himself. By giving special concessions to the Wadhawans, the same IAS officer has tried to put the state government in an embarrassing situation. That it was Fadnavis who had reportedly handpicked and appointed as Principal Secretary (Home) explains who must have been behind the IAS officer concerned who asked him to give travel permission to Wadhavans,” the Saamana editorial said.

“We are pretty sure that a conspiracy was hatched to defame MVA government. If the state government were to help out Wadhawans, then why did the Satara district officials apprehend them and put them under quarantine in Mahabaleshwar? Why did the Satara district (in which Mahabaleshwar falls) ignore the travel permission letter given by Gupta and act legally against them?,” the editorial said.

“The Maharashtra government has sent Gupta on compulsory leave. Since he is an Indian Administrative Officer, it is for the Centre to initiate further action against Gupta. One should ask the Centre as to what action it will take against Gupta and who was actually prompted him to issue to travel permission to the Principal Secretary (Home),” the Saamana said.

It may be recalled that on April 10, the Maharashtra government sent Principal Secretary (Home) Amitabh Gupta on ‘compulsory leave’ for allowing the scam-tainted Wadhawan brothers and their family members to travel from Khandala to Mahabaleshwar on Wednesday during the ongoing lockdown period.

The State government instituted an inquiry against Gupta under Additional chief Secretary (Finance) Additional Chief Secretary Manoj Sonic it also registered an offence under sections 188, 269, 270, 34 of IPC and section 51 (B)of Disaster Management Act and section 11 of Maharashtra Covid-19 Regulations”.

Twenty three members of Wadhawan family were detained by the police at Panchgani on Thursday night while travelling in five cars from Khandala to another hill station of Mahabaleswar in Satara district of western Maharashtra. They were carrying with them a “To whomsoever it may concern” issued to them by Gupta on his personal head, permitting the Wadhawans and others to cross from Khandala in Pune to Mahabaleshwar in Satara.

“This is to just inform you that following are well known to me as they are my family friends and travelling from Khandala to Mahabaleshwar for family emergency… Hence you are here by informed through this letter to co-operate with them to reach their destination,” Gupta’s letter

read.

The Saamana editorial said that one hand the ordinary people were adhering to the lockdown norms and staying at home, while on the other there could not be different set of rules to the moneyed people. “This proves that the people are vigilant and the government machinery is not corrupt. If anyone in the government is involved in the Wadhawan safe passage incident, they would have stopped the Satara district officials from taking action against the Wadhawans,” the editorial said.

“The Uddhav Thackeray believes in the rule of law. It treats everyone equally. It does not differentiate between the poor and the rich. The people ( Fadnavis and other BJP leaders) who are speaking out now will shut their mouth, if one goes into the details of the party to which Wadhwans donated money to.

No one should stoop this low to malign the Government,” the Saamana editorial said.

Advocating against indulging in politics during this crucial period, the Saamana editorial said: “There will be lot of time for politics in future. On one day on Saturday, as many as 1000 people tested positive for Coronavirus in the country. The Maharashtra government is waging a war against Coronavirus. The Opposition should not indulge in acts like this”.",india,https://www.dailypioneer.com/images/logo.jpg,https://www.dailypioneer.com/2020/india/sena-slams-fadnavis-for-safe-passage-of-wadhawans.html
106,14-4-20,SPO martyred in Kishtwar,"Two suspected terrorists attacked a patrolling party, stationed at Tander police picket under the jurisdiction of Dacchan police station of Kishtwar district, with axes and fled away with their service weapons after killing one of them on the spot and seriously injuring other on Monday.

The injured SPO was evacuated by the jawans of the nearby police post and airlifted to Government Medical college hospital in Jammu where he was undergoing treatment till the time of filing the report. Meanwhile, the joint teams of the Special Operations group of Kishtwar police and Army have launched massive manhunt in the area to track down the assailants. According to official sources, one of the suspected terrorist, facing charges of rape, was released on bail barely 20 days ago.

Inspector General of Police, Jammu range, Mukesh Singh also rushed to Kishtwar to supervise the ongoing operations.

Sharing details of the gruesome attack, police spokesman in a statement said, ""at around 1.30 p.m police picket Tander Kishtwar reported that two assailants attacked two SPOs namely Pashid Iqbal and Vishal at some distance (about 200/300 metres) from the post Tander Dachhan with axes and seriously injured both of them"".

Out of these two, SPO Pashid Iqbal succumbed to his injuries while SPO Vishal Singh was airlifted to GMC, Jammu.

According to police, both the SPO's had gone to the upper area of Tander for patrolling. The assailants have been identified as Basharat Hussain S/O Gh. Qadir Gainoo and Ashiq Hussain S/O Bashir Ahmed both residents of village Tander, Dachhan.

According to police, Ashiq Hussain was involved in case FIR No 06/2018 U/S 363,376 RPC of P/S Dachhan. He went out on bail 20 days back. Former BJP Minister and ex MLA, Kishtwar Sunil Sharma visited GMC, Jammu to meet injured SPO. Sharma told reporters, an attempt is being made since 2018 to revive militancy in the region.

He said, after large number of active militants, involved in killing of BJP leaders and RSS worker and his PSO were neutralised, several active OGW's have been making desperate bids to revive militancy. He said it is for this reason the assailants involved in the attack on SPO's have fled away with their service weapons.",india,https://www.dailypioneer.com/images/logo.jpg,https://www.dailypioneer.com/2020/india/spo-martyred-in-kishtwar.html
107,14-4-20,Law invoked for steady supply of medicines,"The National Pharmaceutical Pricing Authority (NPPA) has invoked a clause of a legislation that will equip it to issue directions to the manufacturers for regulating distribution of drugs in case of emergency or in case of non-commercial use in public interest with a view to achieve adequate availability of medicines and medical devices.

The move aims to ensure consistent supply of medicines and medical devices in the country which along with other nations is grappling with the deadly Covid-19 pandemic. The virulent pathogen has so far claimed over 350 lives.

A senior official from the national drug price regulator, NPPA said that Para 3 of the DPCO (Drug Price Control Order)-2013 has been invoked.

“Invoking of para 3 of DPCO-2013 will help the drug pricing regulator to resolve issues associated with the availability, supply and shortage of drugs and medical devices.”

He explained, “as per para 3 of DPCO-2013, NPPA may give directions to manufacturers of active pharmaceutical ingredients (APIs) or bulk drugs or formulations with a view to achieve adequate availability and to regulate the distribution of drugs, in case of emergency..

“… or in circumstances of urgency or in case of non-commercial use in public interest, direct any manufacturer of any APIs or bulk drug or formulation to increase the production and to sell such APIs or bulk drug to such other manufacturer(s) of formulations and to direct formulators to sell the formulations to institutions, hospitals or any agency as the case may be,” the official said.",india,https://www.dailypioneer.com/images/logo.jpg,https://www.dailypioneer.com/2020/india/law-invoked-for-steady-supply--of-medicines.html
108,14-4-20,Aarogya Setu app current fad,"Amid coronavirus scare, Aarogya Setu app, a technology initiative taken by the Centre, has found huge takers. So far over 3.5 crore people have downloaded the app. Aarogya Setu app helps significantly in contact tracing and curbing the spread of the dreaded Covid-19 pandemic. It uses location data from persons’ smartphones to tell users if they have been near someone who tested positive for Covid-19, explained an official.",india,https://www.dailypioneer.com/images/logo.jpg,https://www.dailypioneer.com/2020/india/aarogya-setu-app-current-fad.html
109,14-4-20,Govt directs States for smooth movement of trucks,"Following the Commerce Ministry’s suggestion for opening the industries, the Union Home Ministry has directed the States to ensure the “smooth movement” of trucks, workers and functioning at warehouses and cold storages.

Union Home Secretary AK Bhalla in his letter to the State authorities said that all trucks should be permitted with the driver carrying valid driving licences. One more person can travel along with the driver.

“Inter-state and intra-state movement of all trucks and other goods / carrier vehicles with one driver and one additional person is allowed as long as the driver is carrying a valid driver’s licence. This is irrespective of the nature of the cargo, whether essential or otherwise.

No further permit or approval would be required. Empty trucks/ goods carriers should also be allowed to operate while on way to pick up goods, or returning after completing a delivery.

Hence, there is no cause to stop empty trucks provided they have valid documents such as driving license & road permit etc.

“Local authorities should actively facilitate the movement of truck drivers and cleaners from their place of residence to location of their trucks. Local authorities should facilitate the easy to and fro movement of workers to workplace and back, in respect of all the permitted industrial/ commercial activities.Railways, Airports, Seaports, and Customs authorities have already been authorised to issue passes for their staff and contractual labour. This may be ensured,” said MHA in statement.",india,https://www.dailypioneer.com/images/logo.jpg,https://www.dailypioneer.com/2020/india/govt-directs-states-for-smooth-movement-of-trucks.html
110,14-4-20,Centre asks sugar mills to surrender ‘sugar quota’,"The Centre on Monday asked sugar mills to surrender the sugar quota which could not be exported by March-end and submit a detailed report by next week.

In a communication to sugar mills, the food ministry also warned that if mills fail to export the quota, they would not be entitled for their claim for their quota of fourth quarter under the MAEQ scheme and also for maintenance of buffer stock.

The Government also gave more time till April 20 for mills to submit the quarterly report of sugar export. Earlier, mills were supposed to submit the report by April 3.

For the current 2019-20 season (October-September), the Government has allowed export of 6 million tonnes of sugar under the Maximum Admissible Export Quantity (MAEQ) scheme to help deal with the surplus sugar. However, some mills have not been able to export their quota.

The Government has reallocated about 6,50,000 tonnes of unexported sugar that was surrendered by mills.

In February, a senior food ministry official had said that total sugar exports could reach 5 million tonnes in the current season on higher global demand. India has exported 3.8 million tonnes of sugar during the 2018-19 marketing year against the mandatory quota of 5 million tonne.

The country's total sugar production is expected to touch 27 million tonnes this year, lower than 33 million tonnes achieved in the past two years.",india,https://www.dailypioneer.com/images/logo.jpg,https://www.dailypioneer.com/2020/india/centre-asks-sugar-mills-to-surrender----sugar-quota---.html
111,14-4-20,eNAM going strong despite criticism,"Despite its several detractors who had criticised the concept of connecting primary markets through an online platform, eNAM, at four (as on April 14), is going strong. The e-platform, with 585 connected mandis across 16 States and two Union Territories, and 1.7 crore farmers and 1.3 lakh traders on board, is all set to add another 415 mandis to its fold this year. There are more than 1.9 lakh transporters and over 7 lakh trucks available on eNAM now. Besides, more than 1.66 crore farmers and 1.28 Lakh traders registered on e-NAM platform.

According to Agriculture Minister Narender Singh Tomar, total trade volume of 3.39 Crore MT of bulk commodities & 37 Lakh numbers of Bamboo & Coconut worth approximately Rs 1Lakh crore has been recorded on e-NAM platform.",india,https://www.dailypioneer.com/images/logo.jpg,https://www.dailypioneer.com/2020/india/enam-going-strong-despite-criticism.html
112,14-4-20,"25 new cases, total tally at 270 in J&K","A total number of 25 cases of Covid-19 were reported from Kashmir division while Jammu region recorded zero case in the last 24 hours,taking the final tally of positive cases to 270 across the Union Territory of Jammu & Kashmir on Monday.

In Srinagar, two children, who had tested positive earlier, were discharged from JLNM Hospital Rainawari Srinagar along with their mother who was Covid-19 Negative but was staying with her daughters.

The repeat samples of both the children and of the mother came 'negative' for Covid-19 on Monday.

Spokesman of the Jammu & Kashmir Government, Rohit Kansal also tweeted on a happy note, ""The bright spark - the number of recovered and discharged cases now goes up to 16. Tremendous effort by the doctors and all support staff both at Jammu and Srinagar ""

Even though the number of positive cases have been steadily increasing in the valley over the past 10 days the government agencies are focusing on contact tracing of positive cases and urging more and more people to report their travel history in order to break the chain.

Out of 270 Covid-19 cases, 250 are active. 38 cases are active in Jammu and 212 in Kashmir division. Srinagar, Bandipora and Baramulla districts have accounted for maximum number of 70, 51 and 40 cases so far in Kashmir valley while Jammu has reported 21 cases and Udhampur 19 so far.

While four patients have died in Jammu and Kashmir, one in Jammu and three in Kashmir valley.

More than 53,000 people have been kept under surveillance, including those who are either in Government established quarantine facilities or in home quarantine.",india,https://www.dailypioneer.com/images/logo.jpg,https://www.dailypioneer.com/2020/india/25-new-cases--total-tally-at-270-in-j-k.html
113,14-4-20,Gurudwara Saheb feeds over 500 in Chennai daily,"Even as the number of persons afflicted with coronavirus continues unabated in Tamil Nadu, especially in Chennai and Coimbatore, the officials sit back and look skywards in the hope of a decrease in the spreading of the disease.

While the Tamil Nadu Government is struggling hard to feed the poor who have lost their livelihood because of the national lock down, there are organizations in Chennai city which ensure that the helpless and infirm are well fed. Leading the army of warriors who fight disease and hunger in the metropolis is Sri Guru Nanak Sat Sangh Sabha Gurudwara Saheb in T-Nagar, the main commercial center in Chennai.

The Gurudwara Saheb feeds more than 500 persons in the city through the office of Chennai Municipal Corporation. Thrice daily, a mini truck owned by the Corporation could be seen coming to the Gurudwara for collecting the delicacies and nutritious food prepared in the kitchen by experienced hands. The menu include rotti, chappathi, vegetable curries, fried rice and lassi. Since the closure of eateries in the city as part of the lock down, the Gurudwara has started cooking vegetable fried rice as well as sambar rice (staple food of Chennaites) to be served among the beneficiaries.

“We serve food free of cost for all those who come to the Gurudwara for prayers. There is no limit to the number of people who come here for worship and we offer langhar to all. Moreover we provide heavily subsidised accommodation for those who come to Chennai for medical treatment,” said Amandeep Singh Kandhari, president, T-Nagar Gurudwara Saheb.

Even as the priests read from the Guru Granth Saheb and Bhai Joginder Singh Ji Rair’s mellifluous voice resonates the atmosphere with “Wahe Guru Naam..”, the Gurudwara staff (all volunteers from the Sikh community in the metropolis) are busy serving food to the hundreds who have lined up in the dining room. Sardar Kandhari and Sardar Harbans Singh are ensuring that the diners maintain social distance specified by medical experts.

Prof Poojappura Krishnan Nair, literary icon from Kerala, stands with curious eyes watching the goings on in the Gurudwara. “This is the real service to God Almighty and humanity . Our scriptures mention that Annadaanam Mahaadaanam ( Offering of food to the needy is the biggest service). You get a divine feeling here because of Gurbani and the serving of food,” said Prof Nair who is of the view that there never can be an India without the turbaned Sikh community.

Sam Rajappa, veteran journalist , says that Gurudwara and Sikh community members were always in the forefront with their helping hands whenever Chennai or Tamil Nadu was struck by disasters. “I myself was rescued and rehabilitated by the Silkh community during the 2015 floods that devastated Chennai. I stayed at the Gurunanak College for almost a fortnight and the Gurudwra officials looked after us nicely. Ill never forget those days. We always pray that all districts in Tamil Nadu should have Gurudwaras,” said Sam.

Dr S Kalyanaraman, director, Saraswathi Research Centre, said that service and sacrifice are the hallmarks of the Sikh community. “They continue to do it generations after generations. The service they do to the society is unique and serene,” he said.

Sardar Kandhari and members of the Sikh community observed Baisakhi, the day Shree Guru Gobind Singh Ji, the 10th Guru of the Sikhs laid the foundation of Panth Khalsa on Monday. “For us it is Thanksgiving Day -thanking God for the abundant harvest and also praying for future prosperity,” said Kandhari. “

“Let the Sikhs prosper so that they would guard us from all kinds of attacks, attacks from across the borders as well as invasion by species like corona virus,” said Prof Nair. The Aryan Sikhs helping the Dravidian Tamils! All one could tell about the goings on in Gurudwara Saheb is “Wahe Guru.. Wahe Guru..”",india,https://www.dailypioneer.com/images/logo.jpg,https://www.dailypioneer.com/2020/india/gurudwara-saheb-feeds-over-500-in-chennai-daily.html
114,14-4-20,"37 persons held in Maharashtra for fake news, hate speeches","The Maharashtra Cyber police have arrested as many as 37 persons and registered as many as 183 cases against persons disseminating fake news, rumours and hate speeches relating to Covid-19 over social media in the State.

Of the total cases, 176 are cognizable cases, while the remaining seven are for Non-cognizable offences.

“In all, there are 37 accused are arrested. Of the total accused, 114 have been identified,” Dr Balsing Rajput, Superintendent of police (Cyber), Maharashtra Cyber Cell said .

“There has been a rising trend in hate speech cases during the last few days. Of the total cases registered , 88 relate to hate speeches over social media.

“We have issued take down Notices to all concerned platforms of social media. We have so far removed 32 objectionable posts, Rajput said.

“During the last 24 hours, we have registered 6 cases in various parts of the state,” Rajput added.",india,https://www.dailypioneer.com/images/logo.jpg,https://www.dailypioneer.com/2020/india/37-persons-held-in-maharashtra-for-fake-news--hate-speeches.html
115,14-4-20,"UP: After Corona, Covid and Lockdown, baby named ‘Sanitiser'","A new born boy in Uttar Pradesh's Saharanpur district has been named 'Sanitiser'.

His father Omvir Singh, resident of Vijay Vihar, said he had named his son 'Sanitizer' because it had the capacity to fight against the coronavirus.

""Whenever people will talk of Corona, they will remember that it was Sanitizer that saved them.""

Sanitizer was born on Sunday in a hospital and his mother Monika said that as soon as her husband announced that his son would be named 'Sanitizer, all medical staff started smiling.

The couple has asked all relatives and family members to wait for the lockdown to be lifted before they celebrate the baby's coming.

A baby girl born in Gorakhpur on the day of Janata Curfew has been named 'Corona', while a boy born a week later in Deoria district of the state has been named 'Lockdown'. In Rampur, a newborn boy has been named 'Covid'.",india,https://www.dailypioneer.com/images/logo.jpg,https://www.dailypioneer.com/2020/india/up--after-corona--covid-and-lockdown--baby--named----sanitiser-.html
116,14-4-20,"Telugu scientist lies to parents, reaches UP to help in testing","Ramakrishna, a corona warrior, who was lauded by Congress General Secretary Priyanka Gandhi Vadra for leaving his home in Telangana to help in corona testing in Lucknow, has now admitted that he even lied to his parents to return to Lucknow.

The Ph.D scholar in the microbiology department of Lucknow's King George Medical University (KGMU) said he was helping his parents in agricultural operations in their fields in their village in Khammam district when he received a call from Doctor Amita Jain, who is the head of the department of microbiology.

She said that he was needed in testing samples for the infection that was spreading rapidly.

Ramakrishna said he immediately packed his bags and even lied to his parents, who were worried about their son travelling during the corona crisis.

""I initially told my parents I will be staying with my friends from the village who are studying in Hyderabad. Now, of course, they know I am working in Lucknow in this fight against coronavirus and they are fine with it,"" he said.

Ramakrishna said he reached Hyderabad on March 22, the day of the Janata Curfew when all routes were blocked. Before daybreak, in the early hours of March 23, he headed to the airport.

Ramakrishna said he was stopped by the police, but when he explained the reason for travel, they helped him get there. He caught a flight to Lucknow and ever since he has been working tirelessly to test more and more samples each day.

The Ph.D scholar had completed his project six months ago and had returned to his village. He was working on his thesis and also helping his parents in farming.

Jain, head of the department of microbiology, KGMU, said she had called four of her students for help.

Two were in Lucknow and joined immediately, while Ramakrishna and one more person were away and returned to help.

Jain said, ""I told him that we need him if he can help. He asked for an hour to convince his parents and within an hour, he said he is coming. These research scholars helping out in testing is a commitment that can be compared to soldiers reporting to their battalions in times of war. This time, these soldiers are wearing masks.""

Ramakrishna, who hit the limelight when Congress leader Priyanka Gandhi Vadra tweeted about him, insisted he was just doing his duty like all the others in the medical fraternity to fight this pandemic.

The virology laboratory at the KGMU has been testing suspected samples for COVID-19 under the leadership of Jain since February.

On Priyanka's appreciation, he said ""I do not know who told her (Priyanka), but I am humbled at the appreciation,"" he said.",india,https://www.dailypioneer.com/images/logo.jpg,https://www.dailypioneer.com/2020/india/telugu-scientist-lies-to-parents--reaches-up-to-help-in-testing.html
