,Date,Title,Article,Category,Image_link,Article_link
113,29-2-20,UMU observes National Science Day,"As the country marks the National Science Day, UMU commemorated the day by organising an in-house competition in a variety of events including on-spot poster making, nukkad-natak, English-language debate and quiz. National Science Day is celebrated on February 28 each year commemorating Indian physicist C V Raman’s discovery in 1928 of the Raman Effect – the scattering of photons or light particles by matter.

Since this years’ theme for Science Day was ‘Women in Science’ the competitions acknowledged issues related to women’s role in recent scientific concerns & scientific discourses, developments & benefits of technology, gender gap in science, and preventable problems for women scientists.

The program aimed to disseminate the importance of scientific learning and scientific culture among the students to encourage their understanding of science and scientific temper.

Addressing the valedictory session, Binod Kispotta, Registrar of the University said that universities should encourage women to excel in the field of science and entrepreneurship.

“Women should come to the frontier in research and innovation and make the country proud,” he added.

Numerous students enthusiastically participated in all the competitions and made the event a success. Dr. Abhishek Pandey, Head of Engineering and Applied Sciences extended vote of thanks to the organisers as well as the participants for the success of the event.",state-editions,https://www.dailypioneer.com/images/logo.jpg,https://www.dailypioneer.com/2020/state-editions/umu-observes-national-science-day.html
114,29-2-20,‘Declare Odisha a Special Focus State’,"Chief Minister Naveen Patnaik on Friday reiterated his demand that the Centre declare Odisha a ‘Special Focus State’ as it is frequently being ravaged by natural disasters.

“Taking the frequency of natural disasters faced by Odisha into consideration, Vulnerability to Natural Calamity should be taken as a criterion to declare Odisha as a Special Focus State,” Patnaik said at the 24th Eastern Zonal Council (EZC) meeting held here under the Chairmanship of Union Home Minister Amit Shah and attended by West Bengal Chief Minister Mamata Banerjee, Bihar Chief Minister Nitish Kumar and other Ministers from Jharkhand and Chhattisgarh.

Patnaik also urged for increasing banking, tele-density and coal royalty in the State.

“Royalty on coal has not been revised from 2012. There is an urgent need to revise royalty on coal and also to share the proceeds of clean energy cess with the State Government,” said he.

He also demanded announcement of a special economic package for speeding up the infrastructural development of the eastern region. “Our regions have some of the largest scheduled areas of the country. I reiterate my demand for inclusion of the Ho, Bhumij and Mundari languages in the Eighth Schedule of Constitution,” he added.

Patnaik said Odisha provides 50-per cent funds and land free of cost in important railway projects, but the projects’ progress has been very slow.

“If a nationwide analysis is done for tele-density, banking density, rail and road density, East Zone would be at the bottom in all these subjects that are in the Union List. There is a need to double the allotments made to this region so that they catch up to the national benchmarks,” said Patnaik.

He said this zone contributes maximum to the country’s mineral wealth and is, in turn, manufacturing and energy security of the country. The fruits of this wealth should boost the economic growth of the region and its people, said he.",state-editions,https://www.dailypioneer.com/images/logo.jpg,https://www.dailypioneer.com/2020/state-editions/---declare-odisha-a-special-focus-state---.html
115,29-2-20,Rains in parts of State from Mar 2,"The Indian Metrological Department (IMD) Regional Office here on Friday predicted that thunderstorm accompanied with lightning is again likely to sweep various parts of the State from March 2.

The IMD issued yellow warning for the districts of Sundargarh, Keonjhar, Mayurbhanj, Gajapati and Baleswar. Besides, dry weather is very likely to prevail over the rest districts of the state.

Besides, the weather office forecasted that dense fog is very likely to occur at one or two places over Bhadrak, Cuttack, Khordha, Jagatsinghpur, Angul, Kandhamal, Balangir and Kalahandi till 8.30 am on February 29.

The predicted that minimum temperature is very likely to be below normal by three to four degree in the next two to three days. And, the maximum temperature is likely to gradually rise by two to four degree Celsius during the next two to four days, the IMD.",state-editions,https://www.dailypioneer.com/images/logo.jpg,https://www.dailypioneer.com/2020/state-editions/rains-in-parts-of-state-from-mar-2.html
116,29-2-20,Sports event ‘Shaurya-2020’ concludes on a grand note,"A five-day annual sports event ‘Shaurya-2020’ culminated with vibrancy and prize distribution at Friendship Sports venue at Hundru village under Chandankiyari Block of Bokaro district on Friday.

The concluding day witnessed exciting and captivating performances by the enthusiastic employees of Vedanta-Electrosteel Steels Limited, who participated in different sports events.

Speaking on the occasion Chief Executive Officer of the company, Pankaj Malhan, extended a warm welcome to all the participants and encouraged them to participate in sports for good health. “Sports develop team spirit which also teaches us management skills,” he added.

The event Shaurya-2020 was inaugurated on 18 February, includes several sports events include 100-meter race, 200-meter race, 400-meter race, relay race, marathon, walkathon, badminton, table tennis, high jump, long jump, shot put, carrom, javelin, tug of war and kabaddi, informed Vivek Anand PRO of Vedanta Electrosteel.

Among the winners Jitendra Kumar in both 100 and 200 meters race (men) and Anushka Kumari also in 100 and 200 meters race (women), Mahmud, Ashish, Soumyajit Pal, and Anand in the 400-meter relay (men), in women Anushka Kumari, Mamta Mandal, Pragya Shri, Vidya Priya, Mohammad Shabbir (men) and Kajal Singh (women) wins in long-jumps while in high-jumps Jitendra Kumar and Anushka Kumari, Abhishek Kumar and Ankit in (shot-put), Ansuman Samanta and Shruti wins the badminton doubles men and women respectively. Ranjan Pandey and Pragya in table tennis, Md Mahmud and Pragya Shree in Carrom, Sanjay Bauri wins the marathon race, informed Anand.

The Security department of the company won the Kabbadi and Tug of War matches while Manoj won the best photographer award.

Besides others, SLVP Ready COO of the company, SBU Director Samar Suri, Sumit Burman, Kundan Karna, S Venkataraman, Anand Reddy and a large number of officials and employees of the company were present on the occasion.",state-editions,https://www.dailypioneer.com/images/logo.jpg,https://www.dailypioneer.com/2020/state-editions/sports-event----shaurya-2020----concludes-on-a-grand-note.html
117,29-2-20,"WIPS, CMPDI holds workshop under Project Swawalambi","A workshop was organised by WIPS, CMPDI in association with the CSR team under project Swawlambi here on Friday, which aims at providing skill development and employability to underprivileged women of Hatma Basti and nearby areas of Kanke Road. Under this programme, women are being trained in tailoring with the help of master trainer from Usha International limited, Patna.

The programme was inaugurated by Mita Sharan, President, Kasturi Mahila Sabha on the premises of RI-III, CMPDI. The programme was also graced by the presence of Manoj Kumar, RD, RI-III, MSA Khan, CM (Personnel), HRD Dept. and others, where they gave their valuable views on necessity of women self-employment and its necessity for their progression and survival in the society.

Zeba Imam, Chief Manager (Geo)/General Secretary, WIPS CMPDI introduced the programmr and the participants among the assemblage. Mamta Toppo, Sr. Manager(P)/Executive member, WIPS CMPDI informed about the features and benefits of the programme.

Certificates for successful completion of training was distributed among the women of previous year’s batch consisting of 10 women of nearby areas and a fresh batch of 15 women was inducted for undergoing training under this project.

After successful completion of the training, the women will be given the work of stitching uniforms for the students of Gondwana Primary School and Birsa Uccha Vidhyalaya and certificates of successful completion of training by them which will enable and ensure employment for them or to carry on any new business venture on their own.",state-editions,https://www.dailypioneer.com/images/logo.jpg,https://www.dailypioneer.com/2020/state-editions/wips--cmpdi-holds-workshop-under-project-swawalambi.html
118,29-2-20,Pulwama attack breakthrough: JeM’s Bashir in NIA net,"A year after the Pulwama terror attack, the NIA on Friday claimed to have achieved a major breakthrough in the case by arresting an accused Shakir Bashir Magrey, an Over-Ground Worker of Pakistan-based terror group Jaish-e-Mohammad (JeM).

Magrey, 22, is a resident of Hajibal, Kakapora, Pulwama, Jammu and Kashmir.

“A furniture shop owner, Shakir Bashir Magrey provided shelter and other logistical assistance to the Pulwama suicide-bomber Adil Ahmad Dar. He was introduced to Adil Ahmad Dar in mid-2018 by a Pakistani terrorist Mohammad Umar Farooq and he became a full-time OGW of JeM,” the NIA said in a statement.

During his initial interrogation, Magrey has disclosed that on several occasions, he collected and delivered arms, ammunition, cash and explosive material to the JeM terrorists including those involved in the Pulwama attack, the agency said.

Magrey has further revealed that he had harboured Adil Ahmad Dar and Pakistani terrorist Mohammad Umar Farooq in his house from late 2018 till the attack in February 2019 and assisted them in the preparation of the IED, the NIA said. His shop is located near Lethpora bridge, and as advised by Mohammad Umar, he started conducting reconnaissance of the movement of CRPF convoy on Jammu-Srinagar Highway in January 2019, and informed Mohammad Umar and Adil Ahmad Dar about it. Further, he was also involved in modifying the Maruti Eeco car and fitting the IED early in February, 2019.

The Pulwama attack was carried out on February 14 last year by JeM taking a toll of 40 CRPF personnel.

During investigation, the make, model and number of the car used in the attack was ascertained by the NIA to be a Maruti Eeco car through forensic examination of the tiny remnants of the car, which were seized from the spot during extended searches.

The details of the car used for the suicide bombing corroborated by Magrey. The explosives used in the attack were determined to be Ammonium Nitrate, Nitro-Glycerin and RDX through forensic investigation, the agency said.

Investigation has also confirmed the identity of the suicide bomber to be Adil Ahmad Dar through DNA matching with that of his father. Other key terrorists involved in the attack have been found to be Muddasir Ahmad Khan (JeM’s Divisional Commander of South Kashmir killed in an operation by security forces on March 11, 2019), Pakistani terrorists Muhammad Umar Farooq and IED expert Kamran, (both killed on March 29, 2019), the owner of the car Sajjad Ahmad Bhat, resident of Marhama, Anantnag (killed on June 16, 2019) and Qari Yassir, JeM’s Commander for Kashmir (killed on January 25, 2020).

Magrey was produced before the NIA Special Court at Jammu on Friday and remanded to 15-day NIA custody for his detailed interrogation.",state-editions,https://www.dailypioneer.com/images/logo.jpg,https://www.dailypioneer.com/2020/state-editions/pulwama-attack-breakthrough--jem---s-bashir-in-nia-net.html
119,29-2-20,LoP issue rocks Assembly on Day 1,"Slogans like ‘Jai Sri Ram’, ‘Bharat Mata ki Jai’ were raised in the Jharkhand Assembly on Friday with the BJP legislators demanding Speaker Rabindra Nath Mahto to accord leader of opposition (LoP) status to Babulal Marnadi the BJP legislative party leader in House.

As the month long budget session commenced on Friday at new Assembly building, BJP legislator from Bokaro Viranchi Narayan raised the issue demanding the Speaker to accord LoP chair to Marandi. The Speaker replying to MLA said that the House has taken cognizance to MLAs’ demand and will give its reply, however the MLAs were adamant on their demand. The BJP MLAs trooped into the well of the House demanding Speaker to announce BJP legislative party leader Marandi as Leader of Opposition.

The BJP MLAs with their demand entered the well of the house sitting on the floor with their demand. As the Speaker was undeterred with BJP legislators’ demand, the BJP MLA sitting on the floor raised the slogan of ‘Jai Shri Ram’ and ‘Bharat Mata Ki Jai’. However, the Speaker said that it is not the appropriate time to such demand.

Few Congress MLAs such Irfan Ansari, Deepika Pandey Singh and others too reached the well of the House opposing BJP lawmakers move.

Marandi was seen sitting in the front row adjacent to AJSU party Chief Sudesh Mahto, which was allotted to him during a special session between January 6 and January 8 soon after the JMM-Congress-RJD alliance won a thumping majority in the Assembly polls in November-December.

The BJP legislators, on request of Speaker, later occupied their chairs with Speaker saying that on the first day of House condolences messages is to be read. The demand for according leader of opposition chair to Marandi was again raised when speaker asked leaders from different political parties to read the condolence messages. Senior BJP leader CP Singh who was asked by Speaker to read the condolence message after Chief Minister Hemant Soren said that as a practice the condolence message is read by leader of the opposition party in the house and as per rule our leader is Babulal Marandi. The Speaker after condolence message adjourned the House till Monday.

Meanwhile, outside the House Marandi said, “I am BJP legislative party leader and will discharge my duties even if I get ground to sit. The BJP will keep on raising public interest issue in the House.”

Congress MLA and Minister Banna Gupta said that the BJP MLAs were unnecessary raising the issue. Gupta said, “Speaker had said that issue will sorted out as per law, but the BJP wants the issue to be sorted out immediately. They should understand that in last Assembly session, Speaker Dinesh Oraon took almost five year to take a final decision on membership of six JVM MLAs who switched side from JVM to BJP.”

BJP MLAs on February 24 unanimously elected Marandi as their Legislature Party Leader after he merged his Jharkhand Vikas Party (Prajatantrik-JVM-P) with the saffron party a week ago in the presence of former BJP president and Union Home Minister Amit Shah.

A BJP legislature party delegation had also given a letter to the office of the Speaker in favour of Marandi on February 17, when he had merged his party.",state-editions,https://www.dailypioneer.com/images/logo.jpg,https://www.dailypioneer.com/2020/state-editions/lop-issue-rocks-assembly-on-day-1.html
120,29-2-20,CM: Rs 25K instant relief being given to victims,"The Delhi Government on Friday announced immediate compensation amount to those whose house have been burnt in arson. Chief Minister Arvind Kejriwal said his Government will do overall assessment on the loss and will prepare a report. “Rs 25,000 amount is being given to the victims as immediate relief amount.” “We will ensure quick verification and assessment of the details, to provide immediate ex-gratia amount of Rs 25,000. The full compensation amount will be provided after 2-3 days,” Kejriwal said.

While death toll has recorded 42 till Friday, the Delhi Government has set up shelters for riot victims where they can stay. A total 18 Sub Divisional Magistrate (SDMs) also have been appointed in the riot affected areas to maintain law and order situation. Beside this, Lieutenant Governor Anil Baijal also visited the affected area in the areas.

According to the Delhi Government officials, an app along with the physical system will be developed where citizens can lodge details of the loss of property, loss of vehicles, damage to the business and details of injury and death.

“For those who have lost their identity proofs due to the riots, special camps will be set up by the Revenue Department for facilitating urgent availability of important documents, such as voter ID Card, Aadhaar Card, Community Certificate, Income Certificate, copies of property deeds,” a Government official said.

“We have also advised East Delhi Municipal Corporation (EDMC) to undertake a massive cleaning up exercise of the whole affected area under the supervision of the Revenue Department so that the riot-affected areas can be brought back to normalcy,” Delhi Government said.

The Chief Minister said, “Peace Committees are being constituted at the Mohalla level for the restoration of peace and normalcy in the areas. The Finance Department is advised to convene a meeting of the Heads of Insurance Companies, directing them to organize special camps for immediate disbursement of insurance claims. An insurance loss assessment has to be carried out transparently with very little documentation.”

Elaborating the measures taken by Delhi Government, Kejriwal said the relief measures have been spearheaded. There are four sub-divisions in that area, wherein we have posted 18 SDMs so that each SDM can work on the rehabilitation of three to four areas each and the help can reach the maximum number of people.”

“Night Magistrates have also been deployed to coordinate relief and rehabilitation activities in any emergent situation at any time, along with measures like fixing street lights to ensure the security of residents at night,” he added.

The Delhi Government with the help of local bodies — NGOs and RWAs — is reaching out the people and distributing the items. “We are providing food and water and necessities to people on a larger scale. We are also requesting people to share relevant information with us on whether someone in the affected areas needs food and amenities. We are also supported by several NGOs, RWAs, and MLAs for the distribution of foods. People who have been dislocated due to the violence will be provided refuge in around nine shelter homes and local community centres. We are also arranging the establishment of temporary tents for sheltering dislocated people,” Kejriwal added.

“The balance cheque will be provided to them after proper assessment done by the PWD. Any NGO, social organisations and individual donors, who would like to contribute to our relief and rehabilitation activities, can contact the office of District Magistrate North East,” he added.

While number of injured also escalating in government hospitals, Kejriwal said . “We are being contacted by the people regarding their friends and relatives admitted for serious injuries in the government hospitals, but not getting proper treatments due to huge crowds in the hospitals.” “The Delhi Government will assess the situation and if needed, patients with serious conditions and injuries will be shifted to private hospitals for proper treatment.”

Deputy Chief Minister Manish Sisodia who was also there said that the compensation form will be issued on behalf of the Delhi Government.

An App will also be developed where citizens can lodge details of the loss of property, loss of vehicles, damage to the business and details of injury and death, which will be starting from Saturday. A citizens’ forum on the same will be issued seeking a form mentioning all the details of all the victims of the riots so that timely compensation is provided to them. Any citizen can submit the form in the North East DM office physically, or through the app. The Delhi Financial Corporation shall provide subsidized loans to small businessmen who have lost their livelihood, he added.",state-editions,https://www.dailypioneer.com/images/logo.jpg,https://www.dailypioneer.com/2020/state-editions/cm--rs-25k-instant-relief-being-given-to-victims.html
121,29-2-20,5% quota for Muslims soon: Nawab Malik,"Reviving the DF Government’s stalled move of 2014, Maharashtra Minorities Affairs Minister Nawab Malik on Friday announced that the State Government would soon come out with a legislation according 5 per cent reservations to Muslims in educational institutions in the state.

Replying to a question raised by Congress member in the Maharashtra Letgislative Council, Malik said: “At that time, the Bombay High Court had given a go-ahead for 5 per cent reservations to Muslims in educations but the previous BJP-led Government did not take any action on the HC directive. That being the case, we will soon come out with a law in this regard as soon as possible”.

Opposing Malik’s announcement, senior BJP MLC Vijay Girkar said that reservations could be given on the basis of religion as per the Constitution.

Seeking to quell the speculation that the Sena might oppose reservations to Muslims in educational institutions as it had done in the past when it was in alliance with the BJP, Mailk said: “Everyone was looking at Shiv Sena in the house, after I made this announcement. Let me assure you all that we have the Shiv Sena’s support. The Sena has assured us that all social problems faced by backward classes, castes and communities will be resolved. Like others, Muslims will be given justice. The Sena may have opposed the move when it was in alliance with the BJP, but it with us and is supporting the reservations to Muslims in educational institutions”.

It may be recalled that on November 14, 2014, the Bombay High Court had stayed an ordinance promulgated by the then Congress-led DF government ahead of the State Assembly polls extending 16 per cent reservations to Marathas and five per cent to Muslims, saying that they were not in conformity with the law laid down by the Supreme Court in three cases.

However, a HC bench, headed by Chief Justice Mohit Shah, had allowed reservations to Muslims in educational institutions, on the ground at that their educational achievements were ""abysmally low"" and that there was a need to draw them into the ""mainstream of secular education"". The court had ruled that admissions given to Muslims on the basis of such reservations this year would not be disturbed and students would be allowed to continue their courses.

With the ordinance promulgated by the DF Government having lapsed, Muslims no longer enjoy any reservations in the State.

On its part, the previous BJP-led government – without bothering to follow up on the nod for reservations to Muslims in educational institutions – in November 2018 announced 16 per cent reservations for Marathas in educational institutions and government jobs. However, the state government’s decision was subsequently challenged in the Bombay High Court.

On June 27, 2019, the Bombay High Court on Thursday upheld the previous government’s decision to accord reservations to the Maratha community, but directed the Devendra Fadnavis dispensation to bring down the quantum of the approved reservation from 16 per cent to 12 per cent in educational institutions and 13 per cent in government jobs.

After upholding the “legislative competence” of the State government to create a separate category of the Socially and Educationally Backward Classes (SEBC) and grant reservation, a HC bench of Justices Ranjit More and Bharati Dangre noted that 16 per cent of reservations as approved by the government “is not justifiable”.

However, the HC bench ordered the state government to bring down the reservation for Marathas from 16 per cent to 12 per cent in educational institutions and to 13 per cent in Government jobs.

""We hold and declare that the State Government possesses legislative competence to create a separate category of the Socially and Educationally Backward Class and grant reservation,"" the Judges said.

“We hold and declare that the report of the Gaikwad Commission has set out the exceptional circumstances and extra-ordinary situations justifying crossing of the limit of 50% reservation as set out in Indra Sawhney's case, “ the judges noted.

Ater taking into account the June 7, 2019 high court order, Maharashtra currently has 65 per cent reservations in jobs and 64 per cent reservations in educational institutions. If the state government accords five per cent reservations in educational institutions, the reservations in educational institutions will go up to 69, far above the 50 per cent reservations prescribed by the Supreme Court.",india,https://www.dailypioneer.com/images/logo.jpg,https://www.dailypioneer.com/2020/india/5--quota-for-muslims-soon--nawab-malik.html
