,Date,Title,Article,Category,Image_link,Article_link
154,29-2-20,"The known,unknown and the unsung","Gustasp and Jeroo Irani delve into the city of Jaipur to find treasures beyond the obvious

We weren’t debutante tourists in Jaipur but repeat visitors enthralled by an enchanting city. Over several visits, we had explored most of Jaipur’s awesome roster of attractions and realised that the city’s sights could give other great metros an inferiority complex. Throw in unforgettable cameos of proud locals in colourful turbans and handlebar moustaches; village belles in swirling skirts and chunky silver jewellery and proud camels squatting in the sand… Soon, Jaipur begins to resemble a stage set up with extravagant props.

But it’s all very real and we decided to re-visit some of its known architectural marvels and scoop out some of its hidden treasures as well. A quick stop at the 18th century Hawa Mahal or Palace of Wind wasn’t enough. Locals ushered us up narrow stairs, above a warren of shops opposite the monument, to get picture- postcard-perfect photographs of the palace. The pink, five-storey palace, honey-combed with over 150 latticed windows enabled ladies to watch unseen life and processions swirl on the broad street below. On a terrace across Hawa Mahal, perched precariously on a parapet, some selfie-struck tourists posed, pirouetted and pouted in front of cell phones held aloft to get the Hawa Mahal as a backdrop to their preening selves.

One of the country’s first planned cities, the origins of Jaipur go back to 1727 when Jai Singh II, Raja of Amer, traded his grand palace within the fortified walls of Amer Fort for an even more magnificent city, to be named after him. Jaipur was dubbed the Pink City in 1876 when Sawai Ram Singh I who had the city painted pink in honour of the visit of Prince of Wales’, who was later crowned King Edward VII. Ever since, and even today, the city has been getting a coat of fresh paint every once in a while.

To escape the traffic-clogged streets of the old city, we retreated for a while into the rambling City Palace, a maze of cool courtyards, gardens and palaces from different eras where royal memorabilia is on display. There we stumbled on a Craft Centre where visitors can view and buy goods directly from craftsmen and artists personally selected by a member of the royal family and asked to set up shop.

We sat next to an artist and watched his paintbrush glide over the paper. The crisp clean lines that danced across his canvas started to merge and a few moments later, he handed us his creation: a miniature painting of a fierce Rajput prince with a sword held aloft and ready to strike. The contrast between the menacing posture of the handsome young warrior in the painting and the gentle demeanour of the wrinkled old artist who created it was striking, and in many ways captured the spirit of Jaipur. For this is a city that is both artistic and imposing; a city of fantasy with modern contours.

As a break from Jaipur’s history-webbed monuments, we stopped at Channi Carpets and Textiles, a factory-cum showroom, one of the oldest in the city, where on an upper floor, hand-knotted carpets in wool, silk and a blend of silk and wool cascaded down walls or were rolled up against them. They were then strewn and unfurled on the floor for us to gawk at and perhaps buy. The carpets and rugs with Persian, Kashmiri, oriental and other designs glowed and shimmered and we realised how art and beauty are woven into the DNA of the city. In a ground floor atelier, artisans demonstrated the art of block printing with vegetable dyes and teak wood blocks. They even encouraged us to try our hand at it.

Shopping sprees can be addictive in a city where the past continues to burnish the present. We would take frequent breaks from tumultuous Jaipur, at the recently re-launched Ibis Jaipur Civil Lines hotel in the city centre. Functional, funky and the epitome of modern-day cool, the relaunched Ibis Jaipur Civil Lines offers guests the option to go green, peddle away and explore the city on their e bikes. A gaily painted auto rickshaw, minus the beeps so typical of the city, is an arresting art installation in the porch where guests love to click some mandatory selfies. When we felt overpowered by the city’s manifold charms, we would often relax in the vibrant lobby which flows seamlessly into the restaurant; pour over the inventive menu and admire the witty doodles by local artists on the walls and tables which cleverly evoke Jaipur life.

On our last evening, we headed for Amer Fort, the former capital. En route to the fort, we saw another enchanting marvel that Jaipur showcases so casually, typical of a city that suffers from an embarrassment of riches…We stopped to gaze at the recently restored Jal Mahal or water palace moored in the middle of Man Sagar Lake. A hidden gem, oft-overlooked by tourists on their way to the muscled Amer Fort, the Jal Mahal is a lake palace that exudes feminine charm and romance. It was once the playground of the maharajas in the 18th century when it resonated with the sounds of duck hunting parties, firework displays and elaborate music and dance festivals. In its heyday, the palace was strewn with silk pillows and glowing carpets, and the courtyard and corridors were shaded with rich awnings. Today, a forlorn beauty clings to it.

The 16th century Amer Fort is another eyeful and as the fading light of a post-sunset sky brushed its ramparts, we quickly explored its labyrinthine but stunning interior. Massive arched gates protect the outer courtyard which is dominated by the many arched Diwan-e-Aam or hall of public audience. The main palace complex is tucked away behind walls and archways alive with a mosaic of inlaid images. The magnificent Diwan-e-Khas or hall of private audience, elaborate gardens and courtyards, a hall of mirrors that recreates star-studded night skies, the private residential quarters of the king and his queens cooled by breeze blowing across channels of water and filigreed walls with delicate designs speak eloquently of a love for opulence...

And as the sky darkened, the Sound and Light show brought the past back to centre stage once again as in a dramatic play, the story of Amer Fort unfolded. Twenty-eight kings of the Kachwaha dynasty ruled from this impressive fort till the capital was moved to Jaipur. Local legends and folk music enhanced the delve-into-the-past experience while the stunning setting of the Amer Fort and Palace complex in the foreground and the Jaigarh Fort to the left, back-dropped by shadowy hills reverberated with the thunder of battle and galloping horses; the thrust and parry of swords, the cries of fallen soldiers, and of bereft princesses left grieving in their opulent citadels.

After the show, we headed to Sahu Restaurant in the old city to warm up. Sahu, famed for its hot milky tea served in an earthen kulhad, turned out be a hole-in-the-wall tea stall which was set up by the present owner’s grandfather and is now a popular “watering hole” for locals.

The sweet milky tea is slowly brewed on a coal fire with a dash of their secret masala. Anything between 1,500 to 2,000 cups a day are consumed as the stall is open from 5 am to 11 pm. Political heavyweights and even royalty have stopped by for a sip of the beverage, with which they wash down the sting of mirch vadas.

But it was at the over 50-year-old Rawat Mishtan Bhandar (a takeaway with a restaurant attached) that we found the flavours of Jaipur packaged into crisp mava, potato and onion kachoris; mirch vada, lassi, sweets and other delicacies. A magnet for locals and the Indian diaspora visiting Jaipur, we were told that the kachoris are carried all the way to the US and last for seven days when refrigerated.

Our voyage of discovery ended with a taste of city at Spice It, the edgy, modern restaurant at Ibis Jaipur Civil Lines, where we savoured timeless and succulent local specialties like Laal maas and Gatta curry for which Rajasthan is famed. We were aware that in this Land of Kings, we were biting into hefty chunks of history.",vivacity,https://www.dailypioneer.com/uploads/2020/story/images/big/the-known-unknown-and-the-unsung-2020-02-29.jpg,https://www.dailypioneer.com/2020/vivacity/the-known-unknown-and-the-unsung.html
155,29-2-20,Eat Your Way Through New York City’s Five Boroughs,"From Michelin-starred restaurants to hole-in-the-wall gems, awe-inspiring global cuisine to aromatic street carts, New York City has endless dining options. The cuisine of each borough and neighbourhood tells the story of the city’s history, culture and latest trends, making food tours the perfect way to experience authentic NYC. Visit the neighbourhoods that make each borough so special.

Brooklyn: On A Slice of Brooklyn Pizza Tour, cover Brooklyn and pizzas from end to end via bus, stopping at iconic landmarks and movie locations. The tour company’s latest is the Chocolate Bus Tour of Brooklyn, which features chocolatiers in the lesser-known neighborhoods of Red Hook, Cobble Hill and Gowanus. Learn how chocolate is made, sample traditional and artisanal chocolates and visit Valentino Pier for a view of the Statue Liberty.

Visit four of Williamsburg’s hottest restaurants and enjoy a four-course progressive meal on Avital Tours’ Williamsburg Food Tour, all the while learning about the neighbourhood’s culinary history, important places and must-eat dishes.

Why not get some exercise while you taste local delicacies and take in the vibe of the borough? Dine on pizza, dessert or a combination of both on one of Brooklyn Bike Tours’ offerings.

Enjoy Brooklyn’s burgeoning craft beer scene on a City Brew Tour. Meet brewers, get VIP behind-the-scenes tours and enjoy 12+ brew samples paired with gourmet food throughout the borough.

Explore three different neighbourhoods of Brooklyn during a Literary Pub Crawl Brooklyn, focusing on history, literature and, of course, drinking.

Manhattan: Dine in true luxury on City Chic Experiences’ Signature Culinary Experience. This curated culinary tour features notable Michelin-starred dining establishments throughout Manhattan.

On Like A Local’s Flatiron Food, History & Architecture Tour, see two of New York City’s most iconic and picturesque neighbourhoods, Flatiron District and Union Square, and explore classic restaurants and hidden gems.

Experience Harlem like a local, enjoying soul food and the cuisines of the Caribbean, Africa and Italy on a Taste Harlem Food and Cultural Tours.

Learn to appreciate New York City’s authentic street food on Turnstile Tours’ Food Cart Tour. Enjoy bites from some of the city’s best food carts and trucks while learning about Midtown Manhattan or the Financial District.

Celebrate the Year of Pride on Urban Adventures’ LGBTQ+ History, Neighbourhood and Pub Tour of Greenwich Village. Have a drink at Julius’, the oldest gay bar in New York City, visit the historic Stonewall Inn and cool down with an ice cream covered in rainbow sprinkles at Big Gay Ice Cream.

Queens: With three different culinary walks in Queens, there’s something for everyone on a Culinary Backstreets tour. A full Sichuan banquet in Flushing, food trucks in Corona, the Queens Night Market and a Thai grocery store/community centre in Elmhurst are just a few of the options.

On Food On Foot Tours’ International Express Food Tour of Queens, delight your taste buds in New York City’s most diverse borough. Along with food stops, your guide will take you around famous TV, movie and sports landmarks.

From traditional Greek to Brazilian, Venezuelan and Balkan food, the Noshwalks Astoria Tour unearths both the classic and lesser-known cuisines of Astoria. Groups will also stop to see the Museum of the Moving Image and Kaufman Studios along the way.

Staten Island: Cititrek offers a variety of Staten Island tours, including two culinary adventures. The Taste of Diversity Tour of Victory Boulevard takes visitors through Tompkinsville to discover Albanian, Sri Lankan, Ecuadoran, Caribbean and African shops and restaurants. The Pub Crawl Tour of St George by the Ferry features brewery tours, samples, wine and appetisers in St. George close to the ferry. Afterward, take a ride on the free Staten Island Ferry.

Noshwalks Staten Island Tour includes a diverse offering of food and culture in Tompkinsville. See and taste the area’s rich history, shops and cuisine from Jamaica, Poland, Honduras and Nigeria.

The Bronx: Follow Me New York City Adventures has two new walking tours in the Bronx centered around delicious bites. The Arthur Avenue Adventure includes samples of meats, cheeses, seafood and baked goods. It gives a “crash course” on how Italian immigration shaped New York City. The Food and Faith Adventure incorporates these elements with neighbourhood houses of worship.

Shop for authentic culinary delights on Inside Out Tours’ Bronx’s Little Italy & Arthur

Avenue Shopping Tour. Learn about the rich history and cultural heritage of Belmont, home to generations of Italian-American families.

Join Bronx resident and food aficionado Susan Birnbaum on a SusanSez NYC Walkabouts tour to see the neighbourhood like a local. Susan’s Little Italy on Arthur Avenue tour takes you to some of her favorite spots for fresh pasta, mozzarella and cannoli.

Play ball and eat game-day classics in the greatest sports city in the world. Pair a Yankees Stadium Tour with ballgame fare and new dining options.",vivacity,https://www.dailypioneer.com/uploads/2020/story/images/big/eat-your-way-through-new-york-city---s-five-boroughs-2020-02-29.jpg,https://www.dailypioneer.com/2020/vivacity/eat-your-way-through-new-york-city---s-five-boroughs.html
156,29-2-20,Man Utd play LASK in last 16,"Manchester United will meet Austrian club LASK in the last 16 of the Europa League, while Wolves were pitted against Olympiakos.

United, who lifted the trophy in 2017, are one of six former champions left in the competition. The first leg will be played in Linz on March 12 with the return a week later at Old Trafford.

Austrian league leaders LASK made their group stage debut this season and secured a 3-1 aggregate win over AZ Alkmaar in the last 32.

Wolves progressed to the last 16 of a major European competition for the first time since finishing runners-up in the UEFA Cup in 1971-72, after overcoming Spanish strugglers Espanyol.

Nuno Espirito Santo’s side will take on an Olympiakos team that shocked Arsenal.

Steven Gerrard’s Rangers, the 2008 finalists, face Bayer Leverkusen who dumped out Porto in a clash of two former winners of the competition.

Inter Milan, winners of the tournament in 1991, 1994 and 1998, were drawn against La Liga surprise package Getafe. Five-time former champions Sevilla face a tricky tie against Roma, while 2009 winners Shakhtar Donetsk will lock horns with Wolfsburg.

Istanbul Basaksehir face FC Copenhagen, while Basel await the winners of the tie between Eintracht Frankfurt and Salzburg.

The final will be played in the Polish city of Gdansk on May 27.",sports,https://www.dailypioneer.com/images/logo.jpg,https://www.dailypioneer.com/2020/sports/man-utd-play-lask-in-last-16.html
157,29-2-20,Ritu dominates her 2nd ONE C’ship bout,"Wrestler-turned-Mixed Martial Arts (MMA) fighter Ritu Phogat continued her dominating run at the ONE Championship, beating debutante Wu Chiao Chen of China at the One: King of the Jungle at the Singapore Indoor Stadium on Friday.

The Chinese, who has an 8-0 record as an amateur in MMA and has been a former JJIF Asian Jiu-Jitsu Championship Gold medallist, was no match for the determined Indian in a heavily one-sided women’s atomweight contest.

“Winning my second match has been a very good feeling and my confidence level has been boosted further,” said Phogat after win.

She controlled each of the three rounds by using her power and strength to force early takedowns of her opponent and kept her pinned to the ground.

She was unanimously declared the winner by all the three judges present.",sports,https://www.dailypioneer.com/images/logo.jpg,https://www.dailypioneer.com/2020/sports/ritu-dominates-her-2nd-one-c---ship-bout.html
158,29-2-20,Turkey threatens Europe with refugees,"The Presidents of Turkey and Russia spoke over the phone on Friday, a day after Syrian Government airstrikes killed 33 Turkish troops, significantly ratcheting up tensions between Ankara and Moscow. It was the highest number of Turkish soldiers killed in a single day since Ankara first intervened in the Syrian conflict in 2016.

The development was the most serious escalation in the conflict between Turkish and Russia-backed Syrian forces and raised the prospect of all-out war with millions of Syrian civilians trapped in the middle.

NATO envoys held emergency talks at the request of Turkey, a NATO member, and scores of migrants began converging on Turkey’s border with Greece seeking entry into Europe after Turkey said it was “no longer able to hold refugees.” Turkish President Recep Tayyip Erdogan, whose country already hosts more than 3.5 million Syrian refugees, has long threatened to “open the gates” for millions of refugees eager to flee to Europe unless more international support was provided.

Refugees, meanwhile, headed to the land border with Greece, taking minibuses and taxis from Istanbul. Dozens waited at the Turkish side of the border gate at Pazarkule and dozens of others were in no-man’s land between the two countries.

Others headed to Turkey’s west coast to attempt to reach the Greek islands, a short distance away. Several rubber dinghy boats with groups of people clambering aboard were seen on Friday, heading for the island of Lesbos after apparently setting off from Ayvacik, northwest Turkey in broad daylight.",world,https://www.dailypioneer.com/images/logo.jpg,https://www.dailypioneer.com/2020/world/turkey-threatens-europe-with-refugees.html
159,29-2-20,Turkish reprisals kill 16 Syria troops,"Turkish reprisals killed 16 Syrian soldiers in the battleground northwestern province of Idlib on Friday after a bombardment Ankara blamed on Damascus killed 33 Turkish soldiers, a monitor said.

The retaliatory drone and artillery strikes hit Syria army positions in southern and eastern parts of the province which were recaptured by the Government in a nearly three-month-old offensive against the rebel enclave, the Syrian Observatory for Human Rights said. Also on Friday in Idlib, four members of a single family, two of them children, were killed in air strikes, the Britain-based monitoring group said.

There was no immediate confirmation from Damascus of the 16 deaths or any comment on the flare-up with Ankara that prompted NATO to call an urgent meeting of its ruling council for later on Friday.",world,https://www.dailypioneer.com/images/logo.jpg,https://www.dailypioneer.com/2020/world/turkish-reprisals-kill-16-syria-troops.html
160,29-2-20,"Experts question delayed action as death toll climbs to over 2,780","Forty four more people have died of the novel coronavirus in China, taking the death toll in the outbreak to 2,788, Chinese health officials said on Friday, amid growing criticism from experts and the public that the epidemic would have been less severe if the authorities acted when the first confirmed case was reported in December.

Among the deaths reported on Thursday, 41 were from the epicentre Hubei province and its capital Wuhan, two in Beijing and one in Xinjiang, the National Health Commission said in its daily report.

A total of 44 new deaths and 327 confirmed cases were reported on Thursday from all over China, far lower than the earlier days, it said.

The overall confirmed cases in the mainland have reached 78,824 by the end of Thursday. In all, 2,788 people have died of the disease so far, it said. As virulence of the disease slowed, criticism of Chinese officials’ attempts to hide the outbreak in its early stage was highlighted by the official media on Thursday in a rare public criticism of the system of secrecy in governance.

The outbreak first surfaced in December last year until it became severe by middle of January, becoming a full-fledged epidemic causing massive devastation in the country, a report highlighting the shortcomings was published by the state-run Global Times on Thursday.

While China’s massive response in trying to localise the virus to Hubei province with strong measure like locking over 18 cities including Wuhan with over 50 million people came for praise from the World Health Organisation (WHO), criticism is also growing at home over why it was not nipped in the bud.

The situation should have been better if the control measures were taken earlier Zhong Nanshan, said a leading epidemiologist who was also among those in the expert groups dispatched by the central Government to the epicentre Wuhan.

Under the scanner is China’s famous top down approach under the ruling Communist Party of China (CPC) with little power to local officials.

Several top-down authorities, constantly shifting blame on each other for mishandling the outbreak earlier, have now been engulfed in a public opinion crisis, with people calling for an improved decision-making process in the country’s healthcare system, the media report said.",world,https://www.dailypioneer.com/images/logo.jpg,https://www.dailypioneer.com/2020/world/experts-question-delayed-action-as-death-toll-climbs-to-over-2-780.html
161,29-2-20,Mexico confirms first 2 cases,"Mexico’s assistant health secretary announced on Friday that the country now has two confirmed cases of the new coronavirus.

Hugo Lopez-Gatell said one of the patients is in Mexico City and the other in the northern state of Sinaloa. While a second test is still pending on that case, he said, “We are treating this as confirmed.” Neither is seriously ill.

At least five family contacts of the first patient have been placed in isolation. He said one of the men had contact with someone who had traveled to the northern Italian region where there has been an outbreak.",world,https://www.dailypioneer.com/images/logo.jpg,https://www.dailypioneer.com/2020/world/mexico-confirms-first-2-cases.html
162,29-2-20,Iran confirms 34 deaths,"A spokesman for Iran’s Health Ministry says the new coronavirus has killed 34 people amid 388 confirmed cases in Iran.

Iran’s Health Ministry spokesman Kianoush Jahanpour made the announcement on Friday at a news conference in Tehran.

The new total pushes the confirmed cases of the virus in the Mideast above 500.

Iran has the highest death toll for the virus and the illness it causes, COVID-19, outside of China, the epicentre of the outbreak.",world,https://www.dailypioneer.com/images/logo.jpg,https://www.dailypioneer.com/2020/world/iran-confirms-34-deaths.html
163,29-2-20,Pet dog quarantined in HK with low levels of virus,"A pet dog was quarantined at an animal centre in Hong Kong after it tested positive to low levels of the new coronavirus, officials said Friday, in the first such case in the city.

The canine, which belongs to a 60-year-old woman infected with the virus, has no “relevant symptoms”, the Agriculture, Fisheries and Conservation Department said.

But “nasal and oral cavity samples were tested weak positive to COVID-19 virus,” a spokesman said, without explaining why they tested the animal in the first place.

The dog was collected from the owner’s home on Wednesday, after the woman was diagnosed with the contagion and placed in a hospital isolation ward.

It would be closely monitored and undergo further tests to confirm if it really has the virus or if “this is a result of environmental contamination of the dog’s mouth and nose,” the department said. The canine would be held until it returned a negative result.",world,https://www.dailypioneer.com/images/logo.jpg,https://www.dailypioneer.com/2020/world/pet-dog-quarantined-in-hk-with-low-levels-of-virus.html
164,29-2-20,"Germany quarantines 1,000 as coronavirus cases push past 50","Around 1,000 people were in quarantine in Germany’s most populous state on Friday, as the number of confirmed cases of novel coronavirus in Europe’s biggest economy rose above 50. The district of Heinsberg in North Rhine-Westphalia said it had to take the step of keeping around 1,000 home as an infected couple had participated in carnival celebrations in mid-February.",world,https://www.dailypioneer.com/images/logo.jpg,https://www.dailypioneer.com/2020/world/germany-quarantines-1-000-as-coronavirus-cases-push-past-50.html
