,Date,Title,Article,Category,Image_link,Article_link
54,05-1-20,Chilika bird population likely to be 10.7 lakh,"The total bird population of the Chilika lake is expected to be in the range of 10.5 lakh to 10.7 lakh this winter, which would be a good number compared to the last winter, claimed the Chilika Development Authority (CDA) on Friday.

The exact number of population with figures of different species would be provided only after a census done in near future by Chilika Wildlife Division, added the CDA.

The Nalabana water bird sanctuary spread over 15.53 sq km has the largest congregation of 3,74,752 birds of 114 species. Off these, 74 are water fowls and 40 waders.

Most of these water fowls breed outside the sub-continent in the palearctic region and migrates to Chilika lagoon during the winter for roosting and feeding.

The evicted areas from the net gharries to the tune of 162 sq km have not been reconstructed yet.

These areas have become the new place of congregation for the birds and the dolphin population. Areas such as Gurubai and Parikuda have become Important Bird Areas (IBA) with presence of large number of migratory ducks and geese.

The CDA said dolphins are colonising new areas which have become free from encroachments.

The population of wader birds was observed to be less compared to previous years, as they are dependent on mudflats which are dynamic in nature and was affected by the storm surge during the Cyclone Fani.

Notably, the annual monitoring of Chilika lagoon to know the status of flora and fauna and also to estimate the population range of birds in particular, was taken-up by Chilika Development Authority (CDA) with the help of 175 personnel in 29 teams. The survey was carried out from the morning to noon on January 3.

However, the inclement weather hindered the sighting and population estimation of Irrawaddy dolphin. The IBA, which holds significant numbers of one or more globally threatened bird species, were mapped out earlier to facilitate counting of birds.",state-editions,https://www.dailypioneer.com/images/logo.jpg,https://www.dailypioneer.com/2020/state-editions/chilika-bird-population-likely-to-be-10-7-lakh.html
55,05-1-20,Oram stuck as train stranded for 6 hrs,"Sundargarh BJP MP and former Union Minister Jual Oram had a harrowing time along with other passengers on Friday night and Saturday when the Puri-Hatia Tapaswini Express was stranded for more than six hours at two railway stations in Angul district due to engine failure.

The train halted at the Angul railway station for over three hours late on Friday night and again at the Bamur station for more than three hours on Saturday morning.

Oram, who was travelling from Bhubaneswar to Rourkela along with RSS Kshetra Sampark Pramukh PK Mishra, took to Tweeter and sought intervention of Railway Minister Piyush Goyal for restoration of the train service.

Later, the train resumed its service following restoration work.",state-editions,https://www.dailypioneer.com/images/logo.jpg,https://www.dailypioneer.com/2020/state-editions/oram-stuck-as-train-stranded-for-6-hrs.html
56,05-1-20,NTPC Kaniha finalises alternate coal supply sources,"The NTPC Talcher Kaniha is strategically moving ahead with long-term fuel security plan to fulfil its coal requirement for its 3,000-MW coal station.

The station has a Fuel Supply Agreement with MCL and ECL as a long-term coal plan. In addition, in order to ease the operation of the station caused due to coal crisis and inadequate coal supply and incurred generation loss, the NTPC Talcher Kaniha is taking strategic steps.

The station has now successfully finalised two alternate sources of coal for the plant and has started coal lifting from the Bhubaneswari and Dulanga mines from December 30.

Coal from Bhubaneswari mines will be transported to the newly constructed Lingaraj-3 siding which is dedicated to NTPC from where transportation through rake will be made to the NTPC Kaniha.

In addition, the NTPC’s own coal block, Dulanga mines will supply coal to Talcher Kaniha through road-cum-rail mode in a sustainable manner. Both coal sources are a boon to the Kaniha station in improving the plant generation and ensuring uninterrupted efficient power supply to its stakeholders.",state-editions,https://www.dailypioneer.com/images/logo.jpg,https://www.dailypioneer.com/2020/state-editions/ntpc-kaniha-finalises-alternate-coal-supply-sources.html
57,05-1-20,Youth shot at in group clash in JSpur,"A youth sustained bullet injuries in a violent clash that broke between two groups at Alavar village in the Balikuda area of the district on Friday night.

The injured youth was identified as Debaraj Biswal.

The incident took place when a verbal duel over some matter between the rival groups turned violent during which the Biswal received a gunshot wound on his thigh.

Debraj was initially rushed to the District Headquarters Hospital and later shifted to the SCB Medical College Hospital in Cuttack after his condition deteriorated.

Being informed, police reached the spot and detained two persons in connection with the clash. Cops also registered a case regarding the incident and are conducting further investigations, sources said.",state-editions,https://www.dailypioneer.com/images/logo.jpg,https://www.dailypioneer.com/2020/state-editions/youth-shot-at-in-group-clash-in-jspur.html
58,05-1-20,"JAC to conduct 8th board exams in 2,200 centres","Jharkhand Academic Council (JAC) has announced that the class VIII board examinations will be held on January 24. The examination will be conducted in 2,200 centres simultaneously across the State.

The time for the exam has been fixed from 11 am to 2 pm by the council. JAC has uploaded the admit card for the students on its website along with other information for those taking the exam and sample question papers.

“This is the second time the board is conducting the examination and about 5.5 Lakh students will appear for the exam in 2020. The Board first conducted the exam in 2019 where about 5 Lakh students had appeared for it. To avoid putting any pressure on the students, the exam will be held in one sitting with multiple choice questions,” JAC Secretary, MK Singh,

The examination will be held on OMR sheets with around 20 questions from each subject. The exam is of total 300 marks with 33 percent passing marks.

As per the board official, the question paper, OMR sheet and attendance sheet will reach the office of the District Education Officer by January 20 and will be kept in the storage room at the block level.

The examination centres will receive the OMR sheets one day before the exam while the question papers will reach the centres two hours prior to the exam.

After the exam, the OMR sheets will be packed and submitted to the District Education Officer office.",state-editions,https://www.dailypioneer.com/images/logo.jpg,https://www.dailypioneer.com/2020/state-editions/jac-to-conduct-8th-board-exams-in-2-200-centres.html
59,05-1-20,Swachchh Sarvekshan 2020 begins in Capital City,"With ‘Swachchh Survekshan 2020’ beginning from January 4, Ranchi Municipal Corporation (RMC) is striving to make the city clean. Initiatives of planting flowering plants are also being taken for the beautification of certain areas

Deputy Municipal Commissioner Shankar Yadav chaired a meeting with a group of representatives of nurseries and plant shops on Friday in Ranchi.

“The city belongs to all the residents of Ranchi and keeping this in mind RMC is trying to involve the stakeholders for the cleanliness and beautification of the city. For this nursery owners and vendors have been involved to plant flowering plants in certain areas across the City,” said Yadav.

The civic body has asked the nursery owners to decide on the number of plants they can contribute for the city.

All the nurseries involved- big and small come under the area of RMC.

“Areas will be identified by both RMC and the vendors where these plants will be kept. Even if the number of plants given by the vendors is not much, it will still be a great step for the adornment of the City. The basic motto of this initiative is to promote cleanliness in and around Ranchi,” said Yadav.

The vendors have been asked to give a list of the number of plants along with the areas identified by them to the civic body by Monday so that further action can be taken on the same. The areas may include slums of Hatma in ward number 2 and Gungutoli in ward 15 among others.

RMC is also taking this step to stop people from dumping garbage just randomly anywhere.

“At crossings and busy market areas, it is seen that people generally throw trash anywhere. So if flowering plants will be kept in those places, it will not only to the beauty of the place but also prevent the public from littering,” added the official. The meeting was attended by City Manager Rupesh Ranjan, zonal supervisors, ward supervisors along with nursery owners.",state-editions,https://www.dailypioneer.com/images/logo.jpg,https://www.dailypioneer.com/2020/state-editions/swachchh-sarvekshan-2020-begins-in-capital-city.html
60,05-1-20,in briefs,"XLRI alumnus tops Global ‘AI’ Experts Panel

Delhi NCR based 5Jewels Research’s Chief Analyst, Sumant Parimal, who studied from XLRI, Jamshedpur and previously working as IT Manager at SAIL-CET, Ranchi, has been selected and toped in ‘AI’ (Artificial Intelligence) Global Experts Panel of reputed Forbes magazine. In two months long on-line run experts’ panel on ‘AI’, in which reputed experts of IT and ‘AI’ from America, Europe, Asia, Australia have participated, and moderated by New York based Frank Kovacs, ratings of Sumant Parimal remained highest, and declared as Top Most ‘AI’ Expert of this Panel. He has been only expert from India selected in this Global ‘AI’ Experts Panel of Forbes. As it is known, ‘AI’ and Robotics are of special interest for World’s reputed Tech. companies like IBM, Google, Microsoft, Amazon. Apart from this, developed countries of the World like America, China, Germany, Japan, are intensively focusing in this new technology for establishing their leadership. In this scenario, emergence of an Indian thought leader in new ‘AI’ Technology as Top Most Thought Leader in a Global Platform of Forbes demonstrates potentials of India in leading the ‘AI’ race.

Tarang 2020 inaugrated

Tarang 2020, hosted by Jawaharlal Nehru Kala Kendra, in the morning painting exhibition cum work shop cum competition “Moods of Colors” inaugurated by Director (Finance) MECON Ltd, R H Juneja, alongwith other dignitaries Sanjeev Kumar ED (CS), U K Viswakarma (GM Mas), U K Kedia (CVO), A K Agarwal (GM TS & Chairman JNKK), A W Biswas (GM CC&HRD), Subhas Chatterjee (Secretary JNKK), Lily Mukherjee (Principal JNKK). Juneja in his address said that art shows the peoples culture. Dignitaries also interacted with the painters and guest artists performed live, Moumita Ghosh, Iti Bhattacharya, Piyali Ganguly, Popi Banerjee, Sudipta Das, Pooja Kumar, Rahul Vishwakarma, Zakia Shah, Satyam Shree and Saurabh Kumar. The eminent artists present were Praveen Karmkar, Haren Thakur. In the evening musical night Jashn-e-Tarang was organised.

6 DPS students qualify for National Olympiad

Six students from DPS Ranchi have been selected in the NSE (National Standard Examination) 2019-2020 and have qualified for the second stage INO (Indian National Olympiad) conducted by Homi Bhabha Centre for Science Education (HBCSE). It is remarkable that two students qualified for both INO-Astronomy and INO-Chemistry. Akshat Kumar and Dayal Kumar of class XII qualified for both INO –Chemistry and INO-Astronomy, Aakriti Parashar , Ashima Singh and Anima of class XII qualified for INO-Biology and Aryan Kumar Singh of class IX qualified for INO-Junior Science. HBCSE Science Olympiad 2019-2020 is a 5-stage selection process for short listing Indian team for representation at the International Olympiads in Astronomy, Biology, Chemistry, Junior Science and Physics.

Police jawan suspected dead due to cold

The body of a 52-year-old police jawan, identified as Ramlal Tudu, a havildar was found at police picket at Gawa in Giridih on Saturday. The deceased is said to have died due to exposure to extreme cold. “We found his body after some commuters informed us. Prima facie, it seems that he died of cold. However, the cause of death can only be ascertained after the post-mortem examination,” Inspector P.Leyangi of Gawa, said. Meanwhile, there was no respite from cold on Saturday with higher reaches of the Giridih reeling under 7 degree Celsius temperatures. The Giridih recorded a minimum temperature of 7.2 degrees Celsius, two notches below normal, the Met office said. Officials said cold wave conditions are likely to prevail in the plains over the next 24 hours.

Banks strike on Jan 8

Banks employees will go on nationwide strike on January 8 against anti-labour policy of the Central Government. Employees Unions of State Bank of India, Reserve Bank of India and other nationalised banks announced the strike. The major demand of the strike are merger of nationalised banks, to collect loan amount from corporate houses, 11 th bilateral agreement and recruitment at all seats.",state-editions,https://www.dailypioneer.com/images/logo.jpg,https://www.dailypioneer.com/2020/state-editions/in-briefs-in-briefs.html
61,05-1-20,Elephant herd kills 24-yr-old at Ichagarh,"A 24-year-old youth was trampled to death by an elephant herd under Ichargarh police station area, Seraikela Kharsawan on Saturday morning. The victim, Laxman Mahto had gone to nearby jungle to meet nature’s call when he came too close to the elephant herd.

A forest officer said that Mahto had gone too close to herd and was subsequently attacked and killed.

“We are investigating the incident. Mahto had gone to relive himself when he came very close to the herd, which resulted in his death,” he added.

Soon after the incident, local MLA Savita Mahto rushed to the spot and promised neccesary compensation to the victim’s family.

An official said following instructions from his office the local range officers held meetings with the local villagers and gave them the guideline how to evade danger if the herds of elephants stray into the human habitat in their bid of searching food.

He pointed out that he was going to take corrective measures immediately so that the elephants may not destroy any more of the paddy crops by straying into the human habitats.

“As we cannot stop the elephants from migrating from one jungle to another, but can safeguard the villages from the tuskers’ attack on the villages as well as the paddy fields, we have set up separate teams for tuskers- driving wherever the chances of the menace is maximum,” said another forest official.

Meanwhile, people are in state of havoc due to such menace. Sometimes villagers migrate to safer places for a week or more to avoid the sudden night-time attacks of the wild elephant herds. “ The villagers have been asked to make red chilly cakes so as to ward off the elephants . We are also providing them crackers and burnt mobile so that they can drive away the pachyderms, “ he said.

Forest officials reveal that the elephants are straying into human habitat from different forest area including Seraikela, Kharsawan, Kuchai and Bagmundi forest in neighbouring Purulia district of Bengal. As many as 40 wild elephants in separate herds are anchored in forest patches close to the human habitats.",state-editions,https://www.dailypioneer.com/images/logo.jpg,https://www.dailypioneer.com/2020/state-editions/elephant-herd-kills-24-yr-old-at-ichagarh.html
62,05-1-20,"Committed to helping soldiers, families: CM","Chief Minister Yogi Adityanath on Saturday said his government was committed to providing all possible support to soldiers and their families.

He said several new steps had been taken by the government to give a boost to the defence sector in Uttar Pradesh and it would generate large-scale employment opportunities,

Yogi also announced increase in the lumpsum amount and annual amount for soldiers receiving various medals.

The chief minister was speaking after giving away appointment letters to the dependants of 11 martyred soldiers of UP at a programme organised at his official residence in Lucknow on Saturday morning. The chief minister said appointment letters to the dependants of martyred soldiers were being given away for the second time.

“It is the responsibility of everyone to honour the families of those who attain martyrdom for the country. The government is committed to providing every possible support to the families of these martyrs,” Yogi said.

The chief minister added that in a first, a grand Defence Expo was being organised in the state capital in February where everyone would get a chance to view the state-of-the-art technology and weapons of the defence sector, and invest in the Defence Manufacturing Corridor.

“Employment opportunities will be created at a large scale in the state through the Defence Manufacturing Corridor. Besides, it will also be helpful in equipping the army with weapons as per Prime Minister Narendra Modi’s ‘Make in India’ vision,” he said.

The chief minister further said that the state government was contributing three times the amount to be deposited in the ‘Sena Jhanda Diwas Nidhi’ so that there was no shortage of funds for the welfare of soldiers.

“In addition, for rehabilitation of ex-servicemen, the state government will bear 4 per cent interest on bank loans up to Rs 3 lakh. The government has also decided to give Rs 12,000 to eligible beneficiaries under this scheme,” Yogi said.

The chief minister said that earlier, the state government had increased the lumpsum amount and annual amount for the soldiers receiving various medals.

For those who won Param Vir Chakra prior to 1986, the state government has decided to provide a lumpsum amount of Rs 32,50,000 and an annuity of Rs 1, 95,000. Earlier, there was a provision of Rs 15,000 as lumpsum and Rs 1,000 as annuity amount.

The chief minister said that arrangements had also been made for providing Rs 52 lakh lumpsum and Rs 3 lakh as annuity to the winners of Param Vir Chakra, Rs 31 lakh lumpsum and annuity of Rs 2 lakh to Maha Vir Chakra winners and Rs 20 lakh lumpsum and Rs 1 lakh annuity to the winners of Vir Chakra.

Yogi said for the welfare of soldiers, new ‘Sanik Kalyan’ offices were being constructed at a cost of Rs 5.5 crore in Prayagraj, Meerut, Kaushambi and Mau while rest houses were being constructed for ex-servicemen while military rest houses were being renovated in nine districts at a cost Rs 3.5 crore.

He said the state government was providing 5 per cent reservation to ex-servicemen in Group ‘B’ and Group ‘C’ posts and the government was making sincere efforts to appoint ex-servicemen to all positions available for soldiers.",state-editions,https://www.dailypioneer.com/images/logo.jpg,https://www.dailypioneer.com/2020/state-editions/committed-to-helping-soldiers--families--cm.html
63,05-1-20,"Sadaf Jafar, Darapuri get bail","Congress leader Sadaf Jafar and former IPS officer SR Darapuri, besides 10 others, arrested in December in connection with protests against the Citizenship (Amendment) Act in Lucknow, were granted bail by a court here on Saturday.

Additional District Judge SS Pandey had reserved his order on the bail applications of Jafar, Darapuri and other accused on Friday after hearing their individual pleas as well as the submissions of the government lawyer. He gave his verdict on Saturday, providing much relief to these people who were behind the bar since a fortnight.

The court, while granting the bail, asked the accused to furnish two bail bonds of Rs 50,000 each and personal bonds of an equal amount.

The protests against the CAA had turned violent in Lucknow on December 19 when during a demonstration against the amended citizenship law, the protesters pelted stones and torched vehicles parked outside a police post.

Over 200 people were detained following the clashes between the anti-CAA protesters and security forces in Lucknow. Those arrested included Sadaf Jafar, a UP-based Congress worker and social activist.

Jafar was arrested from the protest site at Parivartan Chowk on the evening of December 19 when she was streaming the demonstrations live. An FIR was registered against 34 people, including Jafar, at Hazratganj police station.

Several leaders in the opposition had come out in support of Sadaf Jafar and Darapuri and demanded their release.

Congress general secretary Priyanka Gandhi Vadra had visited Darapuri’s family on December 28 and met the family of Sadaf Jafar in Lucknow the next day.",state-editions,https://www.dailypioneer.com/images/logo.jpg,https://www.dailypioneer.com/2020/state-editions/sadaf-jafar--darapuri-get-bail.html
64,05-1-20,Priyanka meets affected families,"Congress general secretary Priyanka Gandhi Vadra, who was earlier stopped by the district police from entering Meerut along with her brother Rahul Gandhi, on Saturday made unscheduled visits to Muzaffarnagar and Meerut in western Uttar Pradesh to meet the families who bore the brunt of alleged “police excesses” following violent protests against the amended Citizenship Act or were affected by the clashes.

Priyanka, who was coming from Muzaffarnagar after meeting the victims, was on Saturday again stopped at the border of Meerut and was handed over a notice about enforcement of prohibitory orders under Section 144 of the Criminal Procedure Code in the district. However, she was allowed to visit the victim’s family at one place after she assured the officials that she would comply with the prohibitory orders.

She met the families of several victims at Bhurbaral house in Sai colony in Partapur area. She assured the people assembled there that the Congress would stand be them and would fight for their cause.

Earlier, in Muzaffarnagar too, Priyanka reiterated her party’s stand to support the families of those killed in the protest against the Citizenship (Amendment) Act in Uttar Pradesh or were being harassed by police to taking part in the protests.

The Congress general secretary alleged that the UP police were implicating innocent people in the violence during anti-CAA protests.

“I have already apprised UP Governor Anandiben Patel through a memorandum how the police have unleashed a reign of terror in the name of anti-CAA protests by beating up innocent people and putting them in jail,” she said.

While talking to media persons after meeting the victims and their family members, Priyanka said, “We would have had no problem had the police behaved in such manner with people involved in violence but the police are harassing innocents and this will not be tolerated at all.”

On Saturday, Priyanka first met Maulana Asad Raza Hussaini who runs a madarasa.

“The maulana said that the police entered the madarasa and beat up children, causing injuries to severely of them. Even minor children were put in jail. The maulana was also beaten up and his hand was broken,” she said.

Later, Priyanka met the family members of Noora Mohammad, who was killed in the anti-CAA violence.

“I met the 22-year-old widow of the victim, who is 7-month pregnant and has a one-and-half-year-old daughter. I consoled her and assured all support from the Congress,” she said.

The Congress leader also met Ruqaiya Parveen who was also beaten up by police. Parveen’s marriage is scheduled for February 4, 2020. She alleged that the police ransacked her house and destroyed all the items stored for the marriage.

Priyanka was accompanied by senior party leader Imran Masood and Pankaj Mallik.

Last month, Priyanka had visited Bijnor but was stopped from going towards Meerut along with brother Rahul Gandhi. The state capital also witnessed a high drama when Priyanka took pillion ride on a scooty to meet the family members of activist and retired IPS officer SR Darapuri, who was put in the jail for supporting the anti-CAA protest.

Meanwhile, the Congress general secretary has written condolence letters to all the families of those killed during the anti-CAA protests in the state. In her letter to the bereaved families, she has said, “I know very well how it feels to loose the dear ones. You should not feel alone in this situation and don’t lose your confidence. We are with you every time. We will have to march ahead and strengthen our power to seek justice.”

On the other hand, a Congress delegation led by former parliamentarian and party’s national spokesman Rashid Alvi met one of the victim’s family in Firozabad and consoled them. Later Alvi said they would submit a full report on their visit to Congress general secretary.

The visit was kept secret and not even the district Congress president was aware of it.

Altogether, 19 people were killed and over 100 injured in the large-scale violence in UP during the anti-CAA protests last month.

Meanwhile, a scuffle broke out between Congress workers during Priyanka‘s surprise visit to Meerut’s Partapur on Saturday to meet the families of the victims of the violence that broke out during protests against the Citizenship (Amendment) Act on December 20.

Two groups, one supporting the CAA and other opposing it clashed with each other in front of Priyanka. However, senior leaders intervened to defuse the situation.",state-editions,https://www.dailypioneer.com/images/logo.jpg,https://www.dailypioneer.com/2020/state-editions/priyanka-meets-affected-families.html
