,Date,Title,Article,Category,Image_link,Article_link
162,05-1-20,Singles,"Bayern to sign young Schalke keeper

Munich: Goalkeeper Alexander Nuebel has agreed to join Bayern Munich on a free transfer becoming the latest potential successor to Manuel Neuer, the club announced on Saturday. The 23-year-old, who has played 17 times for Germany's under-21 team, had refused to extend his contract at Schalke and will join the German champions at the end of the season on a five-year contract. Neuer, who moved from Schalke in 2011, has been injury prone in recent years but the 33-year-old has started 26 games this season and remains the Bayern captain.

Ter Stegen out of Spanish Super Cup

Barcelona: Barcelona goalkeeper Marc-Andre ter Stegen will miss the derby match against Espanyol through injury and is unlikely to play in next week's Spanish Super Cup. “It is true that he has some problems in the tendon,” said coach Ernesto Valverde in a press conference. “He will not be available tomorrow and for the Super Cup it will be difficult too. He will return after the Super Cup.” The club had said on Monday that Ter Stegen is undergoing treatment on a problem with his right knee. Ter Stegen's absence means Neto will likely play in goal.

Saurabh wins 10m air pistol Gold

Bhopal: Ace shooter Saurabh Chaudhary stamped his class to win the men's 10m air pistol Gold at the 63rd National Shooting Championship competitions. The 17-year-old from Uttar Pradesh, who is touted as India's biggest hope for a medal in shooting in Tokyo Games, went below his recently lost world record score by just 0.1, shooting a classy 246.4 to finish on top. Second-placed Sarabjot Singh of Haryana was well behind with a score of 243.9, while world number two Abhishek Verma settled for Bronze in a high-quality final.

Lagat, Alemu to defend titles

Mumbai: Defending champions Cosmas Lagat and Worknesh Alemu will return to the Tata Mumbai Marathon to defend their titles at the prestigious IAAF Gold Label Road Race which is set to be the strongest marathon ever to be staged in the country. The marathon which will be held here on January 19, will feature 14 men, who have run faster than 2:10:00, making it the strongest marathon ever in India. Lagat will be aiming to become just the second man to win back-to-back Mumbai Marathon titles in the race's 17-year history.

Barty gets tough draw in brisbane

Brisbane: No 1-ranked Ashleigh Barty will begin the new year with a tough draw at the Brisbane International. She's one of six Grand Slam champions in her half of the draw. She will have a first-round bye before a potential second-round match against five-time major winner and wild-card entry Maria Sharapova, who plays a qualifier in the first round. If Barty reaches the quarterfinals, the French Open champion could take on either 2017 US Open champion Sloane Stephens or two-time Wimbledon champion and fifth-seeded Petra Kvitova.

Sonam shocks Sakshi Malik in trials

Lucknow: Two-time World Cadet champion Sonam Malik stunned Rio Olympic Bronze medallist Sakshi Malik while another promising junior Anshu Malik knocked out 2018 World Championship medallist Pooja Dhanda to seal their places in the Indian team for the Asian Championship. Pitted against heavyweights in their respective first round, both Sonam and Anshu cared little for reputations, fighting fearlessly. There were no surprises in other categories with Vinesh Phogat (53kg) and Divya Kakran (68kg) easily winning in their respective bouts. Agencies",sports,https://www.dailypioneer.com/images/logo.jpg,https://www.dailypioneer.com/2020/sports/singles-singles.html
163,05-1-20,"I hope the focus is not just on me in ''83', says Kapil Dev","Former India World Cup-winning captain Kapil Dev hopes that the focus is not just on him, but on the entire squad in the upcoming film ""'83"" which narrates the story of the historic 1983 World Cup triumph.

In ""'83"", directed by Kabir Khan, features Ranveer Singh as Kapil Dev, who led the team to India's first-ever World Cup win against the mighty West Indies.

Point him out that the focus will be on him in the film, the legendary all-rounder, said, ""I hope not.""

""I am the captain, I am a team man. I think everybody should get their performance to look into at. I don't look at my performance, it is the team's performance.

""That's how the game of cricket is. It is not about one person but everybody. Everybody gave 100 per cent and that's how the team won the World Cup,"" Dev told PTI in an interview.

The movie, also starring Tahir Raj Bhasin, Pankaj Tripathi, Saqib Saleem, Hardy Sandhu, among others, is seen as one of the most anticipated films of 2020.

Dev said his job was to share as much information as possible with the makers.

""We know what we did. It is difficult to judge what they are going to put in and make. So you sit and give your side of the story and let them do it, they are smart people, they had done enough research,"" he said.

The veteran cricketer said he was initially concerned about how the makers will show the historical win on the celluloid.

""When I first heard the story, I was confused, I didn't know how it will happen. There is so much to talk about it. You are concerned about how it will come out. We are a little bit concerned and worried about how the movie will come out but I do hope everything will be ok,"" he added.

Dev also coached Ranveer for the film and the entire cast was trained by former India players Balwinder Sandhu and Yashpal Sharma, who were part of the World Cup winning team.

Asked how important it is to get the formal training in cricket right, Dev said, ""I think it was not easy. You are trying to create something which happened 30 to 40 years back with so many characters. It is not just one Kapil Dev. There is a team of 14 players and to bring them all together, it is quite a tough job.""

""83"", produced by Madhu Mantena, Vishnu Induri and Kabir, and presented by Reliance Entertainment, will release on April 10.

In reality, when asked as a captain how difficult was it then to lead a team that was considered as underdogs, Dev said, ""Nothing is difficult when you are enjoying something. When you are passionate about something it is not difficult. I have never taken it as a difficult thing. Never at all. It was enjoyable and fantastic.

""That's the way I look into life. When you are in love, it is a great time, it is not a difficult time. Similarly, when you are playing for the country it is a good time, it is not a difficult time. If it is difficult time then don't play.""

Competing with two time World Champions West Indies, which had some of the greatest players of all time -- Gordon Greenidge, Desmond Haynes, Clive Llyod, Vivian Richards in the finals at Lord's, didn't seem easy but Dev said for him and his team-mates the aim was to give their best.

India were all out for just 183. So, what was the discussion at the break and according to Kapil, he motivated the team by saying ""they are the best"".

""Basically, we wanted to just enjoy and give our 100 per cent. We had reached here so we must have done something really well, those kinds of chats we had. On the ground, you don't look other team is bigger than you, you say, you are the best team and then you believe in yourself,"" he added.

He further said while playing cricket one shouldn't look at the result but play the game with a positive mindset.

""You have to keep on doing your best. With sports one has to understand that you are not looking for the result, you are looking to play good cricket. We just went in and start saying our team is good enough, we are ready to win every match. You have to think positive. That is the only message I believe in.""

When team India came on the field to ball, Dev believes right from the beginning, every moment was a game changer for them.

""I think from the first wicket from Balwinder Singh Sandhu bowled that was also a game-changer, why only say, the catch (of Richards) changed the game. At every step, we were changing the game,"" he added. Sandhu dismissed Greenidge for 1.

Dev will be turning 61 on January 6 and it is like any other day for him.

""I like to spend the day as simply as possible. Nothing change in that,"" he added.

The team of ""'83"" has recreated Dev's match-winning innings of 175 runs against Zimbabwe at Tunbridge stadium.

Kabir had earlier said that a video capturing the moment will be unveiled on January 6, which is Dev's birthday.

""It is nice it is coming out. It is all wonderful,"" Dev said.",sports,https://www.dailypioneer.com/uploads/2020/story/images/big/i-hope-the-focus-is-not-just-on-me-in---83---says-kapil-dev-2020-01-05.jpg,https://www.dailypioneer.com/2020/sports/i-hope-the-focus-is-not-just-on-me-in---83---says-kapil-dev.html
164,05-1-20,Missiles hit Green Zone and Iraq base housing US troops: security sources,"Two rockets on Saturday hit Iraq's Al-Balad air base, where US troops are stationed, while two mortars hit Baghdad's Green Zone, a high-security enclave housing the US embassy, security sources said.

Sirens immediately rang out at the American compound in Baghdad hosting both diplomats and troops, sources there told AFP.

The Al-Balad base, north of Baghdad, was hit by Katyusha rockets, security sources said.

The US has feared a backlash against its mission and bases where its troops are deployed across Iraq following the precision drone strike that killed Iranian general Qasem Soleimani on Friday.",top-stories,https://www.dailypioneer.com/uploads/2020/story/images/big/missiles-hit-green-zone-and-iraq-base-housing-us-troops--security-sources-2020-01-05.jpg,https://www.dailypioneer.com/2020/top-stories/missiles-hit-green-zone-and-iraq-base-housing-us-troops--security-sources.html
165,05-1-20,"Maha portfolios: Ajit Pawar gets Finance, Anil Deshmukh Home","Maharashtra Deputy Chief Minister and senior NCP leader Ajit Pawar has got the finance and planning department while party colleague Anil Deshmukh is the state's new Home minister, a senior official said on Sunday.

Besides, first-time Shiv Sena MLA Aaditya Thackeray, who is the son of Chief Minister Uddhav Thackeray, has been given charge of the environment, tourism and protocol departments, he said.

Senior Congress leader Balasaheb Thorat has got the revenue ministry while his party colleague and former chief minister Ashok Chavan got the Public Works Department (PWD)- excluding public undertakings, the official added.

NCP's former leader of opposition in state Legislative Council Dhananjay Munde has got the social justice department while party leader Jitendra Awhad has been given housing.

With this allocation of portfolios, the Sharad Pawar- led NCP has got most of the 'plum' ministries.

There were speculations that either Ajit Pawar or Jayant Patil of the NCP would get the Home department, but the portfolio has been allocated to their party colleague Anil Deshmukh, the MLA from Katol in Nagpur district of Vidarbha.

The chief minister has kept the general administration department (GAD), information and technology, and law and judiciary departments with himself.

The urban development department has been allocated to Shiv Sena's Eknath Shinde, who will also hold charge of PWD (public undertakings).

Senior Shiv Sena leader Subhash Desai has got industries and mineral departments, while party leader Anil Parab got the transport and parliamentary affairs departments.

Governor Bhagat Singh Koshyari on Sunday approved the list of portfolios as proposed by the chief minister, a Raj Bhavan spokesperson earlier said.

The list of portfolios to be allocated to ministers was sent to the governor on Saturday evening.

Among the NCP ministers, Chhagan Bhujbal got the food and civil supplies, and consumer protection departments, Nawab Malik- minority development, Waqf Board, skill development and entrepreneurship, Dilip Walse Patil- Excise and labour, Jayant Patil- water resources development and command area development, and Rajendra Shingane- food and drug administration (FDA).

Besides, NCP's Rajesh Tope has been allocated public health and family welfare departments, Hasan Mushrif- rural development, and Balasaheb Patil- cooperation and marketing.

From the Shiv Sena, Dadaji Bhuse has got agriculture and ex-servicemen welfare departments, Sandipan Bhumare- EGS and horticulture, Gulabrao Patil- water supply and sanitation, Sanjay Rathod- forest, relief and rehabilitation, and disaster management, and Uday Samant- higher and technical education.

Among the Congress ministers, Yashomati Thakur has been allocated women and child development department, Varsha Gaikwad- school education department, Sunil Kedar- animal husbandry and dairy development, youth and sports welfare, Vijay Wadettiwar- OBC welfare and salt land development, Amit Deshmukh- medical education and culture, K C Padvi- tribal development, and Aslam Shaikh- textile, fisheries and port development.

Besides, Cabinet minister Shankarrao Gadakh (Independent MLA) got soil and water conservation department.

Among Ministers of State (MoS) from the NCP, Dattatray Bharne has got PWD, forest, animal husbandry and GAD, Sanjay Bansode- environment, drinking water and sanitation, Prajakt Tanpure- urban development, power, tribal development, and Aditi Tatkare- industries, tourism, horticulture and sports.

Shiv Sena's MoS Shambhuraj Desai got Home-rural, finance and planning, and Excise, while Abdul Sattar got revenue, rural development, port and salt land development.

Among the Congress' MoS, Vishwajeet Kadam got cooperation and agriculture departments, while Satej Patil got Home-urban, transport, IT and ex-servicemen welfare.

Besides, MoS Rajendra Yadravkar (Independent MLA) has got medical education, public health and family welfare, while Bachchu Kadu (also Independent legislator) got water resources department, school education and OBC welfare.

The Maharashtra Vikas Aghadi government, comprising the Shiv Sena, NCP and Congress, had been facing criticism from the opposition BJP for delay in the allocation of portfolios despite being in power for over a month now.

Shiv Sena president Uddhav Thackeray was sworn-in as chief minister on November 28 along with six ministers, two each from his party, NCP and Congress.

The Cabinet was expanded on December 30 with the induction of 36 ministers.",top-stories,https://www.dailypioneer.com/uploads/2020/story/images/big/maha-portfolios--ajit-pawar-gets-finance--anil-deshmukh-home-2020-01-05.jpg,https://www.dailypioneer.com/2020/top-stories/maha-portfolios--ajit-pawar-gets-finance--anil-deshmukh-home.html
166,05-1-20,"Shameful that Jafar, Darapuri arrested without evidence: Chidambaram","Senior Congress leader P Chidambaram on Sunday sàid it was ""shameful"" that Sadaf Jafar, SR Darapuri and Pavan Rao were arrested by the Uttar Pradesh Police for violence without any evidence against them.

He also said that it was a shocking admission by the police that there is no evidence of their involvement.

""Sadaf Jafar, S R Darapuri and Pavan Rao Ambedkar released on bail after police ADMITTED no evidence of their involvement in violence. Shocking admission,"" he said on Twitter.

""If that were so, why did the police arrest them in the first place? And how did the Magistrate remand them to custody without looking at the evidence,"" he asked.

""The law says 'find evidence, then arrest'. The reality is 'first arrest, then search for evidence'. Shameful,"" Chidambaram tweeted.",top-stories,https://www.dailypioneer.com/uploads/2020/story/images/big/shameful-that-jafar--darapuri-arrested-without-evidence--chidambaram-2020-01-05.jpg,https://www.dailypioneer.com/2020/top-stories/shameful-that-jafar--darapuri-arrested-without-evidence--chidambaram.html
167,05-1-20,"NPR update in Bihar to begin on May 15, says Sushil Modi","Bihar Deputy Chief Minister Sushil Kumar Modi has said the updation process of the National Population Register (NPR) will be carried out in the state from May 15 to May 28 this year, notwithstanding the West Bengal and Kerala governments' decision to put the exercise on hold in their respective states.

Bihar senior BJP leader also said administrative and punitive action would be taken against officials if they refuse to carry out the NPR.

""The NPR process in 2020 will be carried out between April 1 to September 30 in the country. In Bihar it will be done between May 15 and May 28, 2020,"" Sushil Modi told reporters on Saturday.

The process of preparing NPR began in 2010 during the UPA regime which was completed between April 1 to September 30 that year, he said.

The Centre is ""updating"" the NPR 2010 in 2020 just before the 2021 census, Bihar Deputy chief minister said.

""NPR and NRC are two different things"", he said.

He also dared West Bengal and Kerala Chief Ministers, Mamata Banerjee and P Vijayan respectively not to implement the Citizenship Amendment Act (CAA) and the NPR if they can.

""No state including West Bengal, Kerala, Rajasthan can refuse to implement the CAA or NPR as the Centre has the power to bring legislation over citizenship. Preparing NPR is a statutory provision which no state can refuse to implement,"" Sushil Modi added.",top-stories,https://www.dailypioneer.com/uploads/2020/story/images/big/npr-update-in-bihar-to-begin-on-may-15--says-sushil-modi-2020-01-05.jpg,https://www.dailypioneer.com/2020/top-stories/npr-update-in-bihar-to-begin-on-may-15--says-sushil-modi.html
168,05-1-20,"Sunny morning in Delhi, air quality 'very poor'","Delhi witnessed a sunny Sunday morning, with the minimum temperature settling at 7 degrees Celsius.

The air quality in the city was 'very poor' with AQI at 350 at 9 AM, according to the Central Pollution Control Board(CPCB) data.

Shallow fog was witnessed in some parts of the city but there were no major visibility issues, said a MeT department official.

As per forecast for the day, the maximum temperature is expected to hover around 21 degrees Celsius.

Relative humidity was 94 percent at 8.30 AM, said the MeT official.

The maximum and minimum were 21.6 degrees Celsius and 8 degrees Celsius respectively on Saturday.",top-stories,https://www.dailypioneer.com/uploads/2020/story/images/big/sunny-morning-in-delhi--air-quality--very-poor--2020-01-05.jpg,https://www.dailypioneer.com/2020/top-stories/sunny-morning-in-delhi--air-quality--very-poor-.html
169,05-1-20,BJP only party free from dynastic politics: JP Nadda,"BJP working president J P Nadda on Sunday said his party is the only one that is free from dynastic politics and based on ideology.

Addressing party workers here, Nadda said the BJP is also the only party with a leader (neta) and policy (neeti).

Ahead of the Delhi Assembly polls, he urged the party workers to at least visit a household thrice to send across the message of the BJP.",top-stories,https://www.dailypioneer.com/uploads/2020/story/images/big/bjp-only-party-free-from-dynastic-politics--jp-nadda-2020-01-05.jpg,https://www.dailypioneer.com/2020/top-stories/bjp-only-party-free-from-dynastic-politics--jp-nadda.html
170,05-1-20,Break was not difficult for Bumrah,"The forced four-month break due to a stress fracture “wasn’t a difficult” period for India’s pace spearhead Jasprit Bumrah as there was “no pain” and he utilised the time away from the game to work on his strength and conditioning.

“It was not difficult for me as I was never in pain. Not even for a single day. I took it as an opportunity to build my strength,” Bumrah told bcci.Tv after his first training session with the team.

He was always updated about how the team was progressing and did his homework so that he is not found wanting once he is back in action.

“I was always keeping a track on what is happening so when you are back in the team, you shouldn’t be too far away.”

The 26-year-old slinger felt that playing all three formats continuously did affect his fitness, for which the break was necessary.

“When you play continuously, your strength level goes down. Your fitness level can also go down a little bit. So I was looking at how to bring the strength back, how to improve upon the things I wanted to improve.

“So take some time off and return fresh. Be hungry again. So all these things were on top of my mind. I am not looking too far ahead. I wanted to take one match at a time,” said Bumrah.",sports,https://www.dailypioneer.com/images/logo.jpg,https://www.dailypioneer.com/2020/sports/break-was-not-difficult-for-bumrah.html
171,05-1-20,Kohli not in favour of four-day Tests,"Indian captain Virat Kohli on Saturday strongly opposed the “four-day Test” proposed by the ICC as he is not in favour of any alterations which hurts the sanctity of the traditional five-day format.

“According to me, it should not be altered. As I said, the day-night is another step towards commercialising Test cricket and you know, creating excitement around it, but it can’t be tinkered with too much. I don’t believe so,” Kohli, one of the biggest names in world cricket, told mediapersons.

The India captain feels that the intent in reducing a day from five can’t be right and then one might talk about having “three-day Tests”.

“Then you are purely only talking about getting numbers, entertainment and you know. I think the intent will not be right then because then you will speak of three-day Tests. I mean where do you end. Then you will speak of Test cricket disappearing,” Kohli was forthright in his answer.

“So I don't endorse that at all. I don’t think that is fair to the purest format of the game. How cricket started initially, and you know five-day Tests was the highest of tests you can have at the International level.”",sports,https://www.dailypioneer.com/images/logo.jpg,https://www.dailypioneer.com/2020/sports/kohli-not-in-favour-of-four-day-tests.html
172,05-1-20,Irfan Pathan says goodbye to cricket,"All-rounder Irfan Pathan on Saturday announced his retirement from all forms of cricket, ending an injury-ridden career that prevented him from realising his true potential.

The 35-year-old’s retirement was on expected lines, considering he last played a competitive game in February 2019 during the Syed Mushtaq Ali trophy for Jammu and Kashmir.

Before turning up for Jammu and Kashmir as a player cum mentor in 2018, Pathan played all his domestic cricket for Baroda.

Though he remains a non-playing mentor to the Jammu and Kashmir outfit, Irfan had not been playing over the past 12 months and did not even put himself in the IPL auction pool last month.

“Today, I am saying goodbye to cricket, about which I thought for day and night. I last represented India in 2012 and after that I tried hard. Today in 2020, a thing comes up on social media ‘make a comeback’, so I want to thank the fans, who never left me alone. It’s a time to start the next journey,” Irfan said at a Star Sports show.

The left-arm seamer’s bowling was like a breath of fresh air when he made his India debut against Australia at the Adelaide Oval in 2003. He was all of 19 back then.

He never had express pace but his natural ability to swing the ball into the right-handers got him instant success, also drawing comparisons with the great Kapil Dev.

It seemed India had found the all-rounder they were looking for since Kapil left the scene.

Talking about his favourite moments, Irfan said getting the blue India cap easily sits on the top.

“There were many moments when I look back. Definitely getting (Mathew) Hayden as my first wicket is there. But when I got the cap, that was a special moment. It is close to my heart because you do everything for the cap.

“No one knows how your career will shape up, but going to play for the country first time, getting the cap from a senior player or the captain, that was special moment for me,” he said.

With his elder brother Yusuf, he made a rare sibling pair to represent India.

Irfan, who last played for India in October 2012, featured in 29 Tests (1105 runs and 100 wickets), 120 ODIs (1544 runs and 173 wickets) and 24 T20 Internationals (172 runs and 28 wickets).

He was also part of the victorious Indian team at the 2007 World Twenty20 and was the man-of-the-match in the final against Pakistan.

One of his best performances came on the tour of Pakistan in 2006 when Irfan became the second Indian after Harbhajan Singh to take a Test hat-trick, removing Salman Butt, Younis Khan and Mohammad Yusuf in the first over of the match held in Karachi.

“It was a memorable event but personally I don’t speak about that hat-trick because we lost the match,” he said.

In 2008, he played a big role in India winning a Test match against Australia on a tough Perth wicket, which offered steep bounce.",sports,https://www.dailypioneer.com/images/logo.jpg,https://www.dailypioneer.com/2020/sports/irfan-pathan-says-goodbye-to-cricket.html
